,title,abstract,authors,link,ID,publication_date,update_date,subject,is_medRxiv
64,Generation of glucocorticoid resistant SARS-CoV-2 T-cells for adoptive cell therapy,"Adoptive cell therapy with viral-specific T cells has been successfully used to treat life-threatening viral infections, supporting the application of this approach against COVID-19. We expanded SARS-CoV-2 T-cells from the peripheral blood of COVID-19-recovered donors and non-exposed controls using different culture conditions. We observed that the choice of cytokines modulates the expansion, phenotype and hierarchy of antigenic recognition by SARS-CoV-2 T-cells. Culture with IL-2/4/7 but not other cytokine-driven conditions resulted in >1000 fold expansion in SARS-CoV-2 T-cells with a retained phenotype, function and hierarchy of antigenic recognition when compared to baseline (pre-expansion) samples. Expanded CTLs were directed against structural SARS-CoV-2 proteins, including the receptor-binding domain of Spike. SARS-CoV-2 T-cells could not be efficiently expanded from the peripheral blood of non-exposed controls. Since corticosteroids are used for the management of severe COVID-19, we developed an efficient strategy to inactivate the glucocorticoid receptor gene (NR3C1) in SARS-CoV-2 CTLs using CRISPR-Cas9 gene editing.","Basar, R.; Uprety, N.; Ensley, E.; Daher, M.; Klein, K.; Martinez, F.; Aung, F.; Shanley, M.; Hu, B.; Gokdemir, E.; Mendt, M.; Reyes Silva, F.; Acharya, S.; Laskowski, T.; Muniz-Feliciano, L.; Banerjee, P.; Li, Y.; Li, S.; Melo Garcia, L.; Lin, P.; Shaim, H.; Yates, S. G.; Marin, D.; Kaur, I.; Rao, S.; Mak, D.; Lin, A.; Miao, Q.; Dou, J.; Chen, K.; Champlin, R.; Shpall, E. J.; Rezvani, K.","https://www.biorxiv.org/content/10.1101/2020.09.15.298547v1?rss=1""",https://www.biorxiv.org/content/10.1101/2020.09.15.298547v1?rss=1,2020-09-15,2020-09-15,,False
65,"Antibody potency, effector function and combinations in protection from SARS-CoV-2 infection in vivo","SARS-CoV-2, the causative agent of COVID-19, is responsible for over 24 million infections and 800,000 deaths since its emergence in December 2019. There are few therapeutic options and no approved vaccines. Here we examine the properties of highly potent human monoclonal antibodies (hu-mAbs) in a mouse adapted model of SARS-CoV-2 infection (SARS-CoV-2 MA). In vitro antibody neutralization potency did not uniformly correlate with in vivo activity, and some hu-mAbs were more potent in combination in vivo. Analysis of antibody Fc regions revealed that binding to activating Fc receptors is essential for optimal protection against SARS-CoV-2 MA. The data indicate that hu-mAb protective activity is dependent on intact effector function and that in vivo testing is required to establish optimal hu-mAb combinations for COVID-19 prevention.","Schaefer, A.; Muecksch, F.; Lorenzi, J. C. C.; Leist, S. R.; Cipolla, M.; Bournazos, S.; Schmidt, F.; Gazumyan, A.; Baric, R. S.; Robbiani, D. F.; Hatziioannou, T.; Ravetch, J. V.; Bieniasz, P. D.; Nussenzweig, M. C.; Sheahan, T. P.","https://www.biorxiv.org/content/10.1101/2020.09.15.298067v1?rss=1""",https://www.biorxiv.org/content/10.1101/2020.09.15.298067v1?rss=1,2020-09-15,2020-09-15,,False
66,Ceftazidime Is a Potential Drug to Inhibit SARS-CoV-2 Infection In Vitro by Blocking Spike Protein-ACE2 Interaction,"Coronavirus Disease 2019 (COVID-19) spreads globally as a sever pandemic, which is caused by severe acute respiratory syndrome coronavirus 2 (SARS-CoV-2). Cell entry of SARS-CoV-2 mainly depends on binding of the viral spike (S) proteins to angiotensin converting enzyme 2 (ACE2) on host cells. Therefore, repurposing of known drugs to inhibit S protein-ACE2 interaction could be a quick way to develop effective therapy for COVID-19. Using a high-throughput screening system to investigate the interaction between spike receptor binding domain (S-RBD) and ACE2 extracellular domain, we screened 3581 FDA-approved drugs and natural small molecules and identified ceftazidime as a potent compound to inhibit S-RBD-ACE2 interaction by binding to S-RBD. In addition to significantly inhibit S-RBD binding to HPAEpiC cells, ceftazidime efficiently prevented SARS-CoV-2 pseudovirus to infect ACE2-expressing 293T cells. The inhibitory concentration (IC50) was 113.2 M, which is far below the blood concentration (over 300 M) of ceftazidime in patients when clinically treated with recommended dose. Notably, ceftazidime is a drug clinically used for the treatment of pneumonia with minimal side effects compared with other antiviral drugs. Thus, ceftazidime has both anti-bacterial and anti-SARS-CoV-2 effects, which should be the first-line antibiotics used for the clinical treatment of COVID-19.","Lin, C.; Li, Y.; Yuan, M.; Huang, M.; Liu, C.; Du, H.; Pan, X.; Wen, Y.; Xu, X.; Xu, C.; Chen, J.","https://www.biorxiv.org/content/10.1101/2020.09.14.295956v1?rss=1""",https://www.biorxiv.org/content/10.1101/2020.09.14.295956v1?rss=1,2020-09-15,2020-09-15,,False
67,CROssBAR: Comprehensive Resource of Biomedical Relations with Deep Learning Applications and Knowledge Graph Representations,"Systemic analysis of available large-scale biological and biomedical data is critical for developing novel and effective treatment approaches against both complex and infectious diseases. Owing to the fact that different sections of the biomedical data is produced by different organizations/institutions using various types of technologies, the data are scattered across individual computational resources, without any explicit relations/connections to each other, which greatly hinders the comprehensive multi-omics-based analysis of data. We aimed to address this issue by constructing a new biological and biomedical data resource, CROssBAR, a comprehensive system that integrates large-scale biomedical data from various resources and store them in a new NoSQL database, enrich these data with deep-learning-based prediction of relations between numerous biomedical entities, rigorously analyse the enriched data to obtain biologically meaningful modules and display them to users via easy-to-interpret, interactive and heterogenous knowledge graph (KG) representations within an open access, user-friendly and online web-service at https://crossbar.kansil.org. As a use-case study, we constructed CROssBAR COVID-19 KGs (available at: https://crossbar.kansil.org/covid_main.php) that incorporate relevant virus and host genes/proteins, interactions, pathways, phenotypes and other diseases, as well as known and completely new predicted drugs/compounds. Our COVID-19 graphs can be utilized for a systems-level evaluation of relevant virus-host protein interactions, mechanisms, phenotypic implications and potential interventions.","Dogan, T.; Atas, H.; Joshi, V.; Atakan, A.; Rifaioglu, A. S.; Nalbat, E.; Nightingale, A.; Saidi, R.; Volynkin, V.; Zellner, H.; Cetin-Atalay, R.; Martin, M.; Atalay, V.","https://www.biorxiv.org/content/10.1101/2020.09.14.296889v1?rss=1""",https://www.biorxiv.org/content/10.1101/2020.09.14.296889v1?rss=1,2020-09-15,2020-09-15,,False
68,"The Anti-histamine Azelastine, Identified by Computational Drug Repurposing, Inhibits SARS-CoV-2 Infection in Reconstituted Human Nasal Tissue In Vitro","BackgroundThe COVID-19 pandemic is an enormous threat for healthcare systems and economies worldwide that urgently demands effective preventive and therapeutic strategies. Unlike the development of vaccines and new drugs specifically targeting SARS-CoV-2, repurposing of approved or clinically tested drugs can provide an immediate solution.

MethodsWe applied a novel computational approach to search among approved and clinically tested drugs from the DrugBank database. Candidates were selected based on Shannon entropy homology and predefined activity profiles of three small molecules with proven anti-SARS-CoV activity and a published data set. Antiviral activity of a predicted drug, azelastine, was tested in vitro in SARS-CoV-2 infection assays with Vero E6 monkey kidney epithelial cells and reconstituted human nasal tissue. The effect on viral replication was assessed by quantification of viral genomes by droplet digital PCR.

FindingsThe computational approach with four independent queries identified major drug families, most often and in overlapping fashion anti-infective, anti-inflammatory, anti-hypertensive, anti-histamine and neuroactive drugs. Azelastine, an histamine 1 receptor-blocker, was predicted in multiple screens, and based on its attractive safety profile and availability in nasal formulation, was selected for experimental testing. Azelastine significantly reduced cytopathic effect and SARS-CoV-2 infection of Vero E6 cells with an EC50 of [~]6 M both in a preventive and treatment setting. Furthermore, azelastine in a commercially available nasal spray tested at 5-fold dilution was highly potent in inhibiting viral propagation in SARS-CoV-2 infected reconstituted human nasal tissue.

InterpretationsAzelastine, an anti-histamine, available in nasal sprays developed against allergic rhinitis may be considered as a topical prevention or treatment of nasal colonization with SARS-CoV-2. As such, it could be useful in reducing viral spread and prophylaxis of COVID-19. Ultimately, its potential benefit should be proven in clinical studies.

Fundingprovided by the Hungarian government to the National Laboratory of Virology and by CEBINA GmbH.","Konrat, R.; Papp, H.; Szijarto, V.; Gesell, T.; Nagy, G.; Madai, M.; Zeghbib, S.; Kuczmog, A.; Lanszki, Z.; Helyes, Z.; Kemenesi, G.; Jakab, F.; Nagy, E.","https://www.biorxiv.org/content/10.1101/2020.09.15.296228v1?rss=1""",https://www.biorxiv.org/content/10.1101/2020.09.15.296228v1?rss=1,2020-09-15,2020-09-15,,False
69,Emergence and expansion of highly infectious spike:D614G mutant SARS-CoV-2 in central India,"COVID 19 has emerged as global pandemic with largest damage to the economy and human psyche. The genomic signature deciphered during the ongoing pandemic period is valuable to understand the virus evolutionary patterns and spread across the globe. Increased availability of genome information of circulating strain in our country will enable to generate selective details in virulent and non virulent markers to prophylaxis and therapeutic interventions. The first case of SARS CoV-2 was detected in Chambal region of Madhya Pradesh state in mid of March 2020 followed by multiple introduction events and expansion of COVID-19 cases within 3 months in this region. We analyzed around 5000 COVID -19 suspected samples referred to Defence Research and Development Establishment, Gwalior, Madhya Pradesh. A total of 136 cases were found positive over a span of three months period this includes virus introduction to region and further spread. Whole genome sequences employing Oxford nanopore technology were deciphered for 26 SARS-CoV-2 circulating in 10 different districts in Madhya Pradesh State of India. The region witnessed index cases with multiple travel history responsible for introduction of COVID-19 followed by remarkable expansion of virus. The genome wide substitutions including in important viral proteins were observed. The detailed phylogenetic analysis revealed the circulating SARS-CoV-2 clustered in multiple clades A2a, A4 and B. The cluster wise segregation was observed suggesting multiple introduction links and evolution of virus in the region. This is the first comprehensive details of whole genome sequence analysis from central India region, which will add genome wide knowledge towards diagnostic and therapeutic interventions.","Sharma, S.; Dash, P. K.; Sharma, S. K.; Srivastava, A.; Kumar, J. S.; Karothia, B. S.; Chelvam, K. T.; Singh, S.; Gupta, A.; Yadav, R. G.; Yadav, R.; S, G. T.; Kushwah, P.; Bhushan, R.; Nagar, D. P.; Nandan, M.; Kumar, S.; Thavaselvam, D.; Dubey, D. K.","https://www.biorxiv.org/content/10.1101/2020.09.15.297846v1?rss=1""",https://www.biorxiv.org/content/10.1101/2020.09.15.297846v1?rss=1,2020-09-15,2020-09-15,,False
70,LOX-1+ immature neutrophils predict severe COVID-19 patients at risk of thrombotic complications,"RationalLymphopenia and neutrophil/lymphocyte ratio may have prognostic value in coronavirus disease 2019 (COVID-19) severity.

ObjectiveWe sought to investigate the representation of neutrophil subsets in severe and critical COVID-19 patients based on Intensive Care Units (ICU) and non-ICU admission.

MethodsWe developed a multi-parametric neutrophil profiling strategy based on known neutrophil markers to distinguish COVID-19 phenotypes in critical and severe patients.

ResultsOur results showed that 80% of ICU patients develop strong myelemia with CD10-CD64+ immature neutrophils. Cellular profiling revealed two distinct neutrophil subsets expressing either the lectin-like oxidized low-density lipoprotein receptor-1 (LOX-1) or the Interleukin-3 receptor alpha (CD123), both significantly overrepresented in ICU patients compared to non-ICU patients. The proportion of LOX-1-expressing immature neutrophils positively correlated with clinical severity, with the cytokine storm (IL-1{beta}, IL-6, IL-8, TNF), and with intravascular coagulation. Importantly, high proportions of LOX-1+-immature neutrophils are associated with high risks of severe thrombosis.

ConclusionsTogether these data suggest that point of care enumeration of LOX-1-immature neutrophils might help distinguish patients at risk of thrombosis complication and most likely to benefit from intensified anticoagulant therapy.","Combadiere, B.; Adam, L.; Quentric, P.; Rosenbaum, P.; Dorgham, K.; Bonduelle, O.; Parizot, C.; Sauce, D.; Mayaux, J.; Luyt, C.-E.; Boissonnas, A.; Amoura, Z.; Pourcher, V.; Miyara, M.; Gorochov, G.; Guihot, A.; Combadiere, C.","https://www.biorxiv.org/content/10.1101/2020.09.15.293100v1?rss=1""",https://www.biorxiv.org/content/10.1101/2020.09.15.293100v1?rss=1,2020-09-15,2020-09-15,,False
71,SARS-CoV-2 ribosomal frameshifting pseudoknot: Improved secondary structure prediction and detection of inter-viral structural similarity,"AO_SCPLOWBSTRACTC_SCPLOWSevere acute respiratory syndrome coronavirus 2 (SARS-CoV-2) has led to the COVID-19 pandemic; a pandemic of a scale that has not been seen in the modern era. Despite over 29 million reported cases and over 900, 000 deaths worldwide as of September 2020, herd immunity and widespread vaccination efforts by many experts are expected to be insufficient in addressing this crisis for the foreseeable future. Thus, there is an urgent need for treatments that can lessen the effects of SARS-CoV-2 in patients who become seriously affected. Many viruses including HIV, the common cold, SARS-CoV and SARS-CoV-2 use a unique mechanism known as -1 programmed ribosomal frameshifting (-1 PRF) to successfully replicate and infect cells in the human host. SARS-CoV (the coronavirus responsible for SARS) and SARS-CoV-2 possess a unique RNA structure, a three-stemmed pseudoknot, that stimulates -1 PRF. Recent experiments identified that small molecules can be introduced as antiviral agents to bind with the pseudoknot and disrupt its stimulation of -1 PRF. If successfully developed, small molecule therapy that targets -1 PRF in SARS-CoV-2 is an excellent strategy to improve patients prognoses. Crucial to developing these successful therapies is modeling the structure of the SARS-CoV-2 -1 PRF pseudoknot. Following a structural alignment approach, we identify similarities in the -1 PRF pseudoknots of the novel coronavirus SARS-CoV-2, the original SARS-CoV, as well as a third coronavirus: MERS-CoV, the coronavirus responsible for Middle East Respiratory Syndrome (MERS). In addition, we provide a better understanding of the SARS-CoV-2 -1 PRF pseudoknot by comprehensively investigating the structural landscape using a hierarchical folding approach. Since understanding the impact of mutations is vital to long-term success of treatments that are based on predicted RNA functional structures, we provide insight on SARS-CoV-2 -1 PRF pseudoknot sequence mutations and their effect on the resulting structure and its function.","Trinity, L.; Lansing, L.; Jabbari, H.; Stege, U.","https://www.biorxiv.org/content/10.1101/2020.09.15.298604v1?rss=1""",https://www.biorxiv.org/content/10.1101/2020.09.15.298604v1?rss=1,2020-09-15,2020-09-15,,False
72,Levels of genetic diversity of SARS-CoV-2 virus: reducing speculations about the genetic variability of the virus in South America,"In this work, we evaluated the levels of genetic diversity in 38 complete Genomes of SARS-CoV-2 from six countries in South America, using specific methodologies for paired FST, AMOVA, mismatch, demographic and spatial expansions, molecular diversity and for the time of evolutionary divergence. The analyses showed non-significant evolutionary divergences within and between the six countries, as well as a significant similarity to the time of genetic evolutionary divergence between all populations. Thus, it seems safe to affirm that we will find similar results for the other Countries of South America, reducing speculation about the existence of rapid and silent mutations that, although there are as we have shown in this work, do not increase, until this moment, the genetic variability of the Virus, a fact that would hinder the work with molecular targets for vaccines and drugs in general.","Filho, C. B. d. N.; Ramos, R. d. S.; Paulino, A. J.; Venancio, D. B. R.; Felix, P. T.","https://www.biorxiv.org/content/10.1101/2020.09.14.296491v1?rss=1""",https://www.biorxiv.org/content/10.1101/2020.09.14.296491v1?rss=1,2020-09-15,2020-09-15,,False
73,Rational design of a new class of protease inhibitors for the potential treatment of coronavirus diseases,"The coronavirus main protease, Mpro, is a key protein in the virus life cycle and a major drug target. Based on crystal structures of SARSCoV2 Mpro complexed with peptidomimetic inhibitors, we recognized a binding characteristic shared with proline-containing inhibitors of hepatitis C virus protease. Initial tests showed that this subclass of HCV protease inhibitors indeed exhibited activity against Mpro. Postulating a benefit for a preorganized backbone conformation, we designed new ketoamide-based Mpro inhibitors based on central proline rings. One of the designed compounds, ML1000, inhibits Mpro with low-nanomolar affinity and suppresses SARSCoV2 viral replication in human cells at sub-micromolar concentrations. Our findings identify ML1000 as a promising new pre-organized scaffold for the development of anti-coronavirus drugs.","Westberg, M.; Su, Y.; Zou, X.; Hurst, B.; Tarbet, B.; Lin, M.","https://www.biorxiv.org/content/10.1101/2020.09.15.275891v1?rss=1""",https://www.biorxiv.org/content/10.1101/2020.09.15.275891v1?rss=1,2020-09-15,2020-09-15,,False
74,Flushing of stagnant premise water systems after theCOVID-19 shutdown can reduce infection risk byLegionella and Mycobacterium spp.,"The unprecedented widespread closing of buildings due to the COVID-19 pandemic has allowed water to stagnate in premise plumbing systems, creating conditions that may facilitate the growth of opportunistic pathogens. In this study, we flushed and collected samples from showers in buildings that had been unoccupied for approximately two months and quantified Legionella pneumophila using a commercial cultivation-based assay. In addition, all bacteria, Legionella spp., L. pneumophila, L. pneumophila serogroup 1, non-tuberculous mycobacteria (NTM), and Mycobacterium avium complex (MAC) were analyzed using quantitative PCR (qPCR). Despite low or negligible total chlorine in the stagnant pre-flush water samples, L. pneumophila were not detected by either method; Legionella spp., NTM, and MAC, however, were widespread. Using quantitative microbial risk assessment (QMRA), estimated risks of clinical illness from exposure to legionella and MAC via showering were generally low, but the risk of subclinical infection via Legionella spp. could exceed a 10-7 daily risk threshold if just a small fraction ([&ge;]0.1 %) of those legionellae detected by qPCR are highly infectious. Flushing cold and hot water lines rapidly restored a total chlorine (as chloramine) residual and decreased all bacterial gene targets to building inlet water levels within 30 min. Following flushing, the chlorine residual rapidly dissipated and bacterial gene targets rebounded, approaching pre-flush concentrations after 6 to 7 days of stagnation. These results suggest that stagnant water in premise plumbing may contain elevated levels of opportunistic pathogens; flushing, however, can rapidly improve water quality and reduce the health risk but the improvement will be short-lived if building disuse persists.","Hozalski, R. M.; LaPara, T. M.; Zhao, X.; Kim, T.; Waak, M. B.; Burch, T.; McCarty, M.","https://www.medrxiv.org/content/10.1101/2020.09.14.20194407v1?rss=1""",https://www.medrxiv.org/content/10.1101/2020.09.14.20194407v1?rss=1,2020-09-15,2020-09-15,,True
75,Predictors of characteristics associated with negative SARS-CoV-2 PCR test despite proven disease and association with treatment and outcomes.The COVID-19 RT-PCR Study.,"Background: Since December 2019, Coronavirus 2019 (Covid-19) emerged in Wuhan city in China, and rapidly spread throughout China, Asia and worldwide. Recently, concerns emerged about specificity of PCR testing especially sensibility. We hypothesis first that clinical and/or biological and/or radiological characteristics of patients with first false negative COVID19 RT-PCR test despite final diagnosis of COVID-19 are different from patients with first positive COVID19 RT-PCR test. Methods: Case / control study in which patients with first negative COVID19 RT-PCR test were matched to patients with first positive COVID-19 RT-PCR test on age, gender and ward/ICU location at time of RT-PCR test. Results: Between March 30, and June 22, 2020, 82 cases and 80 controls were included. Neither proportion of death at hospital discharge, nor duration of hospital length stay differed between patients Cases and Controls (respectively P=0.53 and P=0.79). In multivariable analysis, fatigue and/or malaise (aOR: 0.16 [0.03 ; 0.81]; P=0.0266), headache (aOR: 0.07 [0.01 ; 0.49]; P=0.0066) were associated with lower risk of false negative whereas platelets upper than 207 per 10.3.mm-3 (aOR: 3.81 [1.10 ; 13.16]; P=0.0344), and CRP>79.8 mg.L-1 (aOR: 4.00 [1.21 ; 13.19]; P=0.0226) were associated with higher risk of false negative. Interpretation: Patients suspected of COVID19 with higher inflammatory biological findings expected higher risk of false negative COVID19 RT-PCR test. Strategy of serial RT-PCR test must be rigorously evaluated before adoption by clinicians.","Lascarrou, J. B.; Colin, G.; Le Thuaut, A.; Serck, N.; Ohana, M.; Sauneuf, B.; Geri, G.; Mesland, J. B.; Ribeyre, G.; Hussenet, C.; Boureau, A. S.; Gille, T.","https://www.medrxiv.org/content/10.1101/2020.09.14.20194001v1?rss=1""",https://www.medrxiv.org/content/10.1101/2020.09.14.20194001v1?rss=1,2020-09-15,2020-09-15,,True
76,"Safety and Efficacy of the combined use of ivermectin, dexamethasone, enoxaparin and aspirin against COVID-19","From the first outbreak in Wuhan (China) in December 2019, until today the number of deaths worldwide due to the coronavirus pandemic exceeds eight hundred thousand people and the number of infected people arises to more than 25 million. No treatment tested worldwide has shown unquestionable efficacy in the fight against COVID 19, according to NICE reports. We have designed an experimental treatment called IDEA based on four affordable drugs already available on the market in Argentina, based on the following rationale: -Ivermectin solution at a relatively high dose to lower the viral load in all stages of COVID 19 -Dexamethasone 4-mg injection, as anti-inflammatory drug to treat hyperinflammatory reaction to COVID-infection -Enoxaparin injection as anticoagulant to treat hypercoagulation in severe cases. -Aspirin 250-mg tablets to prevent hypercoagulation in mild and moderate cases Except for Ivermection oral solution, which was used in a higher dose than approved for parasitosis, all other drugs were used in the already approved dose and indication. Regarding Ivermectin safety, several oral studies have shown it to be safe even when used at daily doses much higher than those approved already. A clinical study has been conducted on COVID-19 patients at Eurnekian Hospital in the Province of Buenos Aires, Argentina. The study protocol and its final outcomes are described in this article. Results were compared with published data and data from patients admitted to the hospital receiving other treatments. None of the patient presenting mild symptoms needed to be hospitalized. Only one patient died (0.59 % of all included patients vs. 2.1 % overall mortality for the disease in Argentina today; 3.1 % of hospitalized patients vs. 26.8 % mortality in published data). IDEA protocol appears to be a useful alternative to prevent disease progression of COVID-19 when applied to mild cases and to decrease mortality in patients at all stages of the disease with a favorable risk-benefit ratio.","Carvallo, H. E.; Hirsch, R. R.; Farinella, M. E.","https://www.medrxiv.org/content/10.1101/2020.09.10.20191619v1?rss=1""",https://www.medrxiv.org/content/10.1101/2020.09.10.20191619v1?rss=1,2020-09-15,2020-09-15,,True
