"title","abstract","authors","link","date","subject","source","initial_decision","q0","q1","q2","q3","q4","q5","q6","q7","q8","q9","q10","q11","q12","q13","exclusion_reason","extraction_date","expert_decision","ID","o1"
"The impact of SARS-CoV-2 transmission fear and COVID-19 pandemic on the mental health of patients with primary immunodeficiency disorders, severe asthma, and other high-risk groups","Background: The adverse effects of COVID-19 pandemic on the mental health of high-risk group patients for morbidity and mortality and its impact on public health in the long term have not been clearly determined. Objective: To determine the level of COVID-19 related transmission fear and anxiety in healthcare workers and patients with primary immunodeficiency disorder (PID), severe asthma, and the ones with other comorbidities. Methods: The healthcare workers and patients with PID, severe asthma (all patients receiving biological agent treatment), malignancy, cardiovascular disease, hypertension (90% of patients receiving ACEI or ARB therapy), diabetes mellitus (42 % of patients receiving DPP-4 inhibitor therapy) were included in the study. A total of 560 participants, 80 individuals in each group, were provided. The hospital anxiety and depression scale ( HADS ) and Fear of illness and virus evaluation (FIVE ) scales were applied to the groups with face to face interview methods. Results: The mean age was 49.30 years and 306 (55 %) were female. The FIVE Scale and HADS-A scale scores of health care workers were significantly higher than other groups' scores (p = 0.001 and 0.006). The second-highest scores belonged to patients with PID. There was no significant difference between the groups for the HADS-D score (p=0.07). The lowest score in all scales was observed in patients with hypertension. Conclusions: This study demonstrated that in the pandemic process, patients with primary immunodeficiency, asthma patients, and other comorbid patients, especially healthcare workers, should be referred to the centers for the detection and treatment of mental health conditions.","Michael Daly; Eric Robinson; Joana Pereira Dias; Martin D Curran; Surendra Parmar; Fahad Khokhar; Delphine Cuchet-Loureno; Janine Lux; Sapna Sharma-Hajela; Benjamin Ravenhill; Razeen Mahroof","https://medrxiv.org/cgi/content/short/2020.06.26.20140616""","20200628","","medRxiv","Undecided","","","","","","","","","","","","","False","False","","2020-09-25","",5097,""
"The impact of the COVID-19 pandemic on quality of life, physical and psychosocial wellbeing in breast cancer patients and survivors - A prospective, multicenter cohort study","Purpose: The COVID-19 pandemic and the resulting social distancing and lockdown measures are having a substantial impact on daily life and medical management of people with breast cancer. We evaluated to what extent these changes have affected quality of life and physical, and psychosocial wellbeing of people (being) treated for breast cancer. Methods: This study was conducted within the prospective Utrecht cohort for Multiple BREast cancer intervention studies and Long-term evaluation (UMBRELLA). Shortly after the implementation of COVID-19 measures, extra questionnaires were sent to 1595 cohort participants, including standard UMBRELLA quality of life (EORTC) questionnaires. Patient-reported outcomes (PROs) were compared to the most recent PROs collected within UMBRELLA before COVID-19. The impact of COVID-19 on PROs was evaluated using mixed models analysis. Results: In total, 1051 patients (66%) completed the questionnaires. One third (n = 327, 31%) reported a higher threshold to contact their general practitioner due to COVID-19. A significant deterioration in emotional functioning was observed (82.6 to 77.9, p < 0.001) and 505 (48%, 95% CI 45-51) patients reported moderate to severe loneliness. Small significant improvements were observed in QoL, physical-, social- and role functioning scores. In the subgroup of 51 patients under active treatment, there was a strong deterioration in social functioning (69.8 to 5.0, p = 0.03). Conclusion: Due to COVID-19, patients (being) treated for breast cancer are less likely to contact physicians, and experience a deterioration in emotional functioning. Patients undergoing active treatment report a strong drop in social functioning. One in two patients reports (severe) loneliness. Online applications facilitating peer contact and e-mental health interventions could support mental health and social interaction times of total lockdown or social distancing.","Michael Daly; Eric Robinson; Joana Pereira Dias; Martin D Curran; Surendra Parmar; Fahad Khokhar; Delphine Cuchet-Loureno; Janine Lux; Sapna Sharma-Hajela; Benjamin Ravenhill; Razeen Mahroof; Amelia Solderholm; Sally Forrest; Sushmita Sridhar; Nicholas M Brown; Stephen Baker","https://medrxiv.org/cgi/content/short/2020.06.26.20140657""","20200628","","medRxiv","Undecided","","","","","","","","","","","","","False","False","","2020-09-25","",5098,""
"Health Condition and Test Availability as Predictors of Adults' Mental Health during the COVID-19 Pandemic","Background: Research identifying adults' mental health during the COVID-19 pandemic relies solely on demographic predictors without examining adults' health status during the COVID-19 pandemic as a potential predictor. Methods: An online survey of 669 adults in Malaysia was conducted during May 2-8, 2020, six weeks after a Movement Control Order (MCO) was issued. Findings: Adults' health condition had curvilinear relationships (horizontally reversed J-shaped) with insomnia, anxiety, depression and distress. Reported test availability for COVID-19 (from ""strongly disagree"" to ""strongly agree"" ) also had curvilinear relationships (horizontally reversed J-shaped) with anxiety and depression. Younger adults reported worse mental health, but people from various religions and ethnic groups did not differ significantly in reported mental health. Interpretation: Adults with worse health conditions had more mental health problems, especially adults at the lower end of the health spectrum. Test availability negatively predicted anxiety and depression, especially for adults experiencing poor COVID-19 test availability. The significant predictions of health condition and COVID-19 test availability suggest a new direction for the literature to identify psychiatric risk factors directly from health related variables during a pandemic.","Erhan Bayraktar; Asaf Cohen; April Nellis; Sara Terreri; Francesco Corrente","https://medrxiv.org/cgi/content/short/2020.06.21.20137000""","20200623","","medRxiv","Undecided","","","","","","","","","","","","","False","False","","2020-09-25","",5099,""
"Mental health and health behaviours before and during the COVID-19 lockdown: Longitudinal analyses of the UK Household Longitudinal Study","Background: There are concerns that COVID-19 mitigation measures, including the lockdown, may have unintended health consequences. We examined trends in mental health and health behaviours in the UK before and during the initial phase of the COVID-19 lockdown and differences across population subgroups. Methods: Repeated cross-sectional and longitudinal analysis of the UK Household Longitudinal Study, including representative samples of adults (aged 18+) interviewed in four survey waves between 2015 and 2020 (n=48,426). 9,748 adults had complete data for longitudinal analyses. Outcomes included psychological distress (General Health Questionnaire-12 (GHQ)), loneliness, current cigarette smoking, use of e-cigarettes and alcohol consumption. Cross-sectional prevalence estimates were calculated and multilevel Poisson regression assessed associations between time period and the outcomes of interest, as well as differential associations by age, gender, education level and ethnicity. Results: Psychological distress increased one month into lockdown with the prevalence rising from 19.4% (95% CI 18.7%-20.0%) in 2017-19 to 30.3% (95% CI 29.1%-31.6%) in April 2020 (RR=1.3, 95% CI: 1.1,1.4). Groups most adversely affected included women, young adults, people from an Asian background and those who were degree educated. Loneliness remained stable overall (RR=0.9, 95% CI: 0.6,1.5). Smoking declined (RR=0.9, 95% CI=0.8,1.0) and the proportion of people drinking four or more times per week increased (RR=1.4, 95% CI: 1.3,1.5), as did binge drinking (RR=1.5, 95% CI: 1.3,1.7). Conclusions: Psychological distress increased one month into lockdown, particularly among women and young adults. Smoking declined, but adverse alcohol use generally increased. Effective measures are required to mitigate adverse impacts on health.","Erhan Bayraktar; Asaf Cohen; April Nellis; Sara Terreri; Francesco Corrente; Claudia Capponi; Patrizia Palomba; Mattia Mirabella; Simona Cascioli; Paolo Palange; Ilaria Cuccaro","https://medrxiv.org/cgi/content/short/2020.06.21.20136820""","20200623","","medRxiv","Undecided","","","","","","","","","","","","","False","False","","2020-09-25","",5100,""
"Factors Associated with Mental Health Outcomes in Oman during COVID19: Frontline vs Non-frontline Healthcare Workers","OBJECTIVE: This study aims to assess and compare demographic and psychological factors and sleep status of frontline HCWs in relation to non-frontline HCWs DESIGN, SETTINGS, AND PARTICIPANTS This cross-sectional study was conducted using an online survey from the 8th to the 17th of April 2020 across varied health care settings in Oman accruing 1139 HCWS. MAIN OUTCOMES AND MEASURES Mental health status was assessed using Depression, Anxiety, and Stress Scales (DASS-21), and insomnia was evaluated by the Insomnia Severity Index (ISI). Samples were categorized into the frontline and non-frontline groups. Chi-square, odds ratio, and independent t-tests were used to compare groups by demographic and mental health outcomes. Results This study included 1139 HCWs working in Oman. There was a total of 368 (32.3%), 388 (34.1%), 271 (23.8%), and 211 (18.5%) respondents reported to have depression, anxiety, stress, and insomnia, respectively while working during the pandemic period. HCWs in the frontline group were 1.4 times more likely to have anxiety (OR=1.401, p=0.007) and stress (OR=1.404, p=0.015) as compared to those working in the non-frontline group. On indices of sleep-wake cycles, HCWs in the frontline group were 1.37 times more likely to report insomnia (OR=1.377, p=0.037) when compared to those working in the non-frontline group. No significant differences in depression status between workers in the frontline and non-frontline groups were found (p=0.181). CONCLUSIONS AND RELEVANCE To our knowledge, this is the first study to explore the differential impacts of the COVID-19 pandemic on different grades of HCWs. This study suggests that frontline HCWs are disproportionally affected compared to non-frontline HCWs. The problem with managing sleep-wake cycles and anxiety symptoms were highly endorsed among frontline HCWs. As psychosocial interventions are likely to be constrained owing to the pandemic, mental health care must first be directed to frontline HCWs.","Carlos J. Camacho; Kristina A. Paris; Ulises Santiago; Mesfin Nigussie Difabachew; Christopher J Kempen; Melaku Tesfaye Debele; Abel A Menkir; Maranatha T Assefa; Eyob H Asfaw","https://medrxiv.org/cgi/content/short/2020.06.23.20138032""","20200623","","medRxiv","Undecided","","","","","","","","","","","","","False","False","","2020-09-25","",5101,""
"Factors associated with self-reported anxiety, depression, and general health during the UK lockdown; a cross-sectional survey","Background: To investigate factors associated with anxiety, depression, and self-reported general health during ""lockdown"" due to COVID-19 in the UK. Methods: Online cross-sectional survey of a nationally-representative sample of 2240 participants living in the UK aged 18 years or over (data collected 6-7 May 2020). Participants were recruited from YouGov's online research panel. Outcomes: In this sample, 21.9% (n=458, 95% CI [20.1% to 23.7%]) reported probable anxiety (scored three or over on the GAD-2); while 23.5% (n=494, 95% CI [21.7% to 25.3]) reported probable depression (scored three or over on the PHQ-2). Poorer mental health was associated with greater financial hardship during the lockdown, thinking that you would lose contact with friends or family if you followed Government measures, more conflict with household members during the lockdown, less sense of community with people in your neighbourhood, and lower perceived effectiveness of Government measures. Females and those who were younger were likely to report higher levels of anxiety and depression. The majority of participants reported their general health as ""good"" (as measured by the first item of the SF-36). Poorer self-reported general health was associated with psychological distress, greater worry about COVID-19 and markers of inequality. Interpretation: Rates of self-reported anxiety and depression in the UK during the lockdown were greater than population norms. Reducing financial hardship, promoting social connectedness, and increasing solidarity with neighbours and household members may help ease rifts within the community which are associated with distress, thereby improving mental health. Reducing inequality may also improve general health.","Carlos J. Camacho; Kristina A. Paris; Ulises Santiago; Mesfin Nigussie Difabachew; Christopher J Kempen; Melaku Tesfaye Debele; Abel A Menkir","https://medrxiv.org/cgi/content/short/2020.06.23.20137901""","20200623","","medRxiv","Undecided","","","","","","","","","","","","","False","False","","2020-09-25","",5102,""
"Assessment of impact of COVID-19 outbreak & lockdown on mental health status & its associated risk and protective factors in adult Indian population","Background: The novel Corona virus has derailed the entire world and various steps have been taken by the health authorities to tackle this pandemic. Nationwide lockdown has been imposed to control the spread of COVID-19 outbreak in India, which could have psychological impact on the population. Aim: Our study aims to study the effect of the COVID-19 outbreak & subsequent lockdown on mental health status of adult Indian population along with identifying the high-risk groups. Methodology: An online survey was conducted during 3rd phase of lockdown gathering details about sociodemographic variables, practice of precautionary measures, awareness and concerns regarding COVID-19 and mental health status of the participants through DASS21 questionnaire from 873 adults. Results: The prevalence of depression, anxiety and stress were 18.56%, 25.66%, and 21.99% respectively including higher number of participants with mild depression (15.1%) and stress (14.5%) and moderate anxiety (16.3%). Female gender, age <25 years, unemployment, self-business, employed in private sector, lack of formal education, larger household size, parenthood (>2 kids) were associated with increased likelihood of negative mental health. Confidence in physician's ability to diagnose COVID-19 infection, decreased self-perceived likelihood of contracting COVID-19, lesser frequency of checking for information on COVID-19 and satisfaction of information received were protective against negative mental health. Conclusion: This landmark study identified the protective and risk factors of mental health during COVID-19 pandemic, to help authorities and mental health workers to strategize and deliver interventional methods to maintain psychosocial wellbeing of the population.","Andrew Wooyoung Kim; Tawanda Nyengerai; Emily Mendenhall","https://medrxiv.org/cgi/content/short/2020.06.13.20130153""","20200616","","medRxiv","Undecided","","","","","","","","","","","","","False","False","","2020-09-25","",5103,""
"Is the psychological well-being of a population associated with COVID-19 related survival?","OBJECTIVE Immunological mind-body research suggests mental health may also be important in the COVID-19 pandemic. This study aimed to investigate the potential influence of mental health as a protective factor for COVID-19 related mortality in the general population. The second goal was to examine this among populations of countries most affected by COVID-19 related mortality. METHODS Data sources were the Global Burden of Disease report 2017 and publicly reported situational reports of COVID-19. We described variables; calculated the spearman's correlation coefficient, calculated the percentage of the variability of the data that is explained by the association. We explored inter-relationships among other variables: aged 70 or older, cardiovascular disease, obesity and diabetes. A correlation matrix with plotted scatter matrix diagrams was produced. RESULTS Across 181 countries, the mean total COVID-19 related survivors per million was 999,949 (sd=125), median=999,993. The variable had a lognormal distribution; the mean mentally healthy per 100,000 was 85,411 (sd=1,871), median=85,634. The test of normality resulted in p-value < 0.001. Correlation of mentally healthy per 100,0000 and totals of COVID-19 related survivors was s=0.29 (n=181, 95% CI 0.16-0.43). The variance explained by the relation between mental healthy and totals of COVID-19 related survivors was 8.4% (2.6-18.5%). Across countries most affected by COVID-19 related mortality s=0.49 (n=45, 0.28-0.70), explaining 24.2% (7.7-49.3%). CONCLUSION A weak association was found between the psychological well-being of a population and COVID-19 related survival. This relationship explained between 2.6 and 18.5% of COVID-19 related survival. For countries most affected by COVID-19 related death, this association was moderate and explained between 7.7 and 49.3%. Confirmation of these important observational findings is needed with future individual patient data research.","Shane Miersch","https://medrxiv.org/cgi/content/short/2020.06.05.20123018""","20200607","","medRxiv","Undecided","","","","","","","","","","","","","False","False","","2020-09-25","",5104,""
"Trajectories of depression and anxiety during enforced isolation due to COVID-19: longitudinal analyses of 59,318 adults in the UK with and without diagnosed mental illness","Background: There is currently major concern about the impact of the global COVID-19 outbreak on mental health. A number of studies suggest that mental health deteriorated in many countries prior to and during enforced isolation (lockdown), but it remains unknown how mental health has changed week by week over the course of the COVID-19 pandemic. Aims: This study explored trajectories of anxiety and depression over the 20 weeks after lockdown was announced using data from England, and compared the growth trajectories by individual characteristics. Methods: Data from 36,520 adults in the UCL COVID -19 Social Study (a well-stratified panel study weighted to population proportions collecting data weekly during the COVID-19 pandemic) were analysed from 23/03/2020-09/08/2020. Latent growth models were fitted accounting for socio-demographic and health covariates. Results: 22.6% of the sample had scores indicating moderate-severe anxiety, and 25.1% indicating moderate-severe depressive symptoms. Anxiety and depression levels both declined across the first 20 weeks following the introduction of lockdown in the England. The fastest decreases were seen across the strict lockdown period, with symptoms plateauing as further lockdown easing measures were introduced. Being female or younger, having lower educational attainment, lower income or pre-existing mental health conditions, and living alone or with children were all risk factors for higher levels of anxiety and depression at the start of lockdown. Many of these inequalities in experiences were reduced as lockdown continued, but differences were still evident 20 weeks after the start of lockdown. Conclusions: As countries face potential future lockdowns, these data suggest that the highest levels of depression and anxiety are in the early stages of lockdown but decline fairly rapidly as individuals adapt to circumstances. They also suggest the importance of supporting individuals in the lead-up to lockdown measures being brought in to try and reduce distress and highlight that emotionally vulnerable groups have remained at risk throughout lockdown and its aftermath.","Marissa LoPresti; David B Beck; Priya Duggal","https://medrxiv.org/cgi/content/short/2020.06.03.20120923""","20200604","","medRxiv","Undecided","","","","","","","","","","","","","False","False","","2020-09-25","",5105,""
"Are adversities and worries during the COVID-19 pandemic related to sleep quality? Longitudinal analyses of 45,000 UK adults","There are concerns that both the experience of adversities during the COVID-19 pandemic and worries about experiencing adversities will have substantial and lasting effects on mental health. One pathway through which both experience of and worries about adversity may impact health is through effects on sleep. We used data from 48,723 UK adults in the COVID-19 Social Study assessed weekly from 01/04/2020-12/05/2020 to study the association between adversities and sleep quality. We studied six categories of adversity including both worries and experiences of: illness with COVID-19, financial difficulty, loss of paid work, difficulties acquiring medication, difficulties accessing food, and threats to personal safety. We used random-effect within-between models to account for all time-invariant confounders. Both the total number of adversity experiences and total number of adversity worries were associated with lower quality sleep. Each additional experience was associated with a 1.16 (95% CI = 1.10, 1.22) times higher odds of poor quality sleep while each additional worry was associated with a 1.20 (95% CI = 1.17, 1.22) times higher odds of poor quality sleep. When considering specific experiences and worries, all worries and experiences were significantly related to poorer quality sleep except experiences relating to employment and finances. Having a larger social network offered some buffering effects on associations but there was limited further evidence of moderation by social or psychiatric factors. Poor sleep may be a mechanism by which COVID-19 adversities are affecting mental health. This highlights the importance of interventions that support adaptive coping strategies during the pandemic.","Marissa LoPresti; David B Beck; Priya Duggal","https://medrxiv.org/cgi/content/short/2020.06.02.20120311""","20200604","","medRxiv","Undecided","","","","","","","","","","","","","False","False","","2020-09-25","",5106,""
"Psychological Impact of COVID-19 on Pakistani University Students and How They Are Coping","Background: COVID-19 is spreading quickly, causing great deal of fear and unrest in the public. We aimed to assess the psychological impact of COVID-19 on university students and their coping strategies. Methods: This web-based, cross-sectional study was conducted among students of four Pakistani higher education institutions. Google forms were used to disseminate the online questionnaire to assess anxiety (GAD-7), depression (PHQ-9), sources of distress (14-items) and the coping strategies (Brief-COPE). Results: A total of 1134 responses (age 21.7 {+/-} 3.5 years) were included. The frequency of students having moderate-severe anxiety and depression (score [&ge;] 10) were {approx} 34% and 45%, respectively. The respondents' aged [&ge;] 31 years had significantly lower depression score than those below 30 years. Males had significantly less anxiety and depression scores than females. Additionally, those having a family member, friend or acquaintance infected with the disease had significantly higher anxiety score. The main sources of distress were the changes in daily life due to the ongoing pandemic. Regarding coping strategies, majority of respondents were found to have adopted religious/spiritual coping (6.45 {+/-} 1.68) followed by acceptance (5.58 {+/-} 1.65). Conclusions: COVID-19 have significant adverse impact on students' mental health. The most frequent coping strategy adopted by them are religious/spiritual coping, acceptance, self-distraction and active coping. It is suggested that mental health of students should not be neglected during epidemics.","Elizabeth A Samuels; Rebecca Karb; Rahul Vanjani; M. Catherine Trimbur; Anthony Napoli; Mohammad AlSeaidan; Ali Y. Al-Muhaini; Fahad Al-Ghimlas; Salman K. Al-Sabah","https://medrxiv.org/cgi/content/short/2020.05.21.20108647""","20200523","","medRxiv","Undecided","","","","","","","","","","","","","False","False","","2020-09-25","",5107,""
