"title","abstract","authors","link","date","subject","source","initial_decision","q0","q1","q2","q3","q4","q5","q6","q7","q8","q9","q10","q11","q12","extraction_date","expert_decision","ID","o1"
"<U+8B77><U+7406><U+4EBA><U+54E1><U+7167><U+8B77><U+65B0><U+578B><U+51A0><U+72C0><U+75C5><U+6BD2><U+611F><U+67D3><U+75C5><U+60A3><U+5FC3><U+9748><U+8A18><U+4E8B>-<U+67D0><U+4E2D><U+53F0><U+7063><U+91AB><U+9662><U+7684>2<U+4F8B><U+7D93><U+9A57>","<U+672C><U+6587><U+662F><U+70BA><U+7167><U+8B77><U+5169><U+4F4D><U+65B0><U+578B><U+51A0><U+72C0><U+75C5><U+6BD2><U+75BE><U+75C5>Coronavirus disease 2019(COVID-19)<U+611F><U+67D3><U+500B><U+6848><U+5165><U+4F4F><U+8CA0><U+58D3><U+9694><U+96E2><U+75C5><U+623F><U+5F8C>,<U+75C5><U+4EBA><U+6240><U+9762><U+81E8><U+8EAB><U+9AD4><U+3001><U+5FC3><U+7406><U+3001><U+8207><U+793E><U+6703><U+7B49><U+5404><U+65B9><U+9762><U+6539><U+8B8A><U+6240><U+5F15><U+767C><U+7684><U+8B77><U+7406><U+554F><U+984C><U+3002><U+7B46><U+8005><U+85C9><U+7531><U+81E8><U+5E8A><U+89C0><U+5BDF><U+53CA><U+96FB><U+8A71><U+8A2A><U+8AC7><U+8490><U+96C6><U+8CC7><U+6599>,<U+63D0><U+4F9B><U+5408><U+5B9C>,<U+500B><U+5225><U+8B77><U+7406><U+63AA><U+65BD>,<U+5305><U+542B><U+9F13><U+52F5><U+500B><U+6848><U+60C5><U+7DD2><U+6292><U+767C><U+8207><U+8010><U+5FC3><U+50BE><U+807D><U+5FC3><U+4E2D><U+611F><U+53D7>,<U+9069><U+6642><U+63D0><U+4F9B><U+9069><U+7576><U+7684><U+5FC3><U+7406><U+652F><U+6301><U+3002><U+5229><U+7528><U+97F3><U+6A02><U+7D13><U+58D3>,<U+5F15><U+5C0E><U+500B><U+6848><U+4EE5><U+6B63><U+5411><U+614B><U+5EA6><U+9762><U+5C0D><U+6B64><U+6B21><U+75BE><U+75C5>,<U+540C><U+6642><U+5354><U+52A9><U+500B><U+6848><U+5728><U+51FA><U+9662><U+5F8C><U+6062><U+5FA9><U+6B63><U+5E38><U+751F><U+6D3B>,<U+5E0C><U+671B><U+6B64><U+5831><U+544A><U+80FD><U+63D0><U+4F9B><U+8B77><U+7406><U+4EBA><U+54E1><U+5728><U+7167><U+9867><U+985E><U+4F3C><U+500B><U+6848><U+4E4B><U+53C3><U+8003><U+3002> We reported our nursing experience about caring two cases for Coronavirus disease 2019 (COVID-19) infected diseases patients, mainly focused on the mental health care. Patients admitted in the negative pressure isolation ward might having care needs in physical, mental, and social dimensions. According to our clinical observation and telephone interviews with patients, we suggested personalized nursing cares by listening, music relaxation, and emotional expression might be the suitable methods to lead patients to release their acute stress status.","<U+674E><U+5468><U+71D5>; <U+51CC><U+6B63><U+83EF>; <U+5289><U+7FCE><U+73B2>; <U+8449><U+9E97><U+6708>; <U+6D2A><U+5F18><U+660C>","https://www.google.com/search?q=<U+8B77><U+7406><U+4EBA><U+54E1><U+7167><U+8B77><U+65B0><U+578B><U+51A0><U+72C0><U+75C5><U+6BD2><U+611F><U+67D3><U+75C5><U+60A3><U+5FC3><U+9748><U+8A18><U+4E8B>-<U+67D0><U+4E2D><U+53F0><U+7063><U+91AB><U+9662><U+7684>2<U+4F8B><U+7D93><U+9A57>","2020","","WHO","Undecided","","","","","","","","","","","","","FALSE","2020-04-13","",329,""
"The role of Mental Health Home Hospitalization Care during the COVID-19 pandemic.","The 2019 novel coronavirus disease emerged in China in late 2019-early 2020 and it is spreading rapidly worldwide (1). Amongst the Spanish public health interventions aimed at reducing the transmission rate, home confinement has been enforced (2). The Royal Decree 463/2020 stated a 15-day national emergency states starting on March 15, that has since been extended (3).","Garriga, Agasi, Fedida, Pinzón-Espinosa, Vazquez, Pacchiarotti, Vieta","https://doi.org/10.1111/acps.13173","20200412",NA,"PubMed","Undecided","","","","","","","","","","","","","FALSE","2020-04-13","",330,""
"First COVID-19 suicide case in Bangladesh due to fear of COVID-19 and xenophobia: Possible suicide prevention strategies.",NA,"Mamun, Griffiths","https://doi.org/10.1016/j.ajp.2020.102073","20200412",NA,"PubMed","Undecided","","","","","","","","","","","","","FALSE","2020-04-13","",331,""
"Health-Related-Quality of Life in Common Variable Immunodeficiency Italian patients switched to remote assistance during the COVID-19 pandemic.","A rapidly expanding epidemic of the new coronavirus has become the focus of global scientific attention. Data are lacking on impact of SARS-CoV-2 pandemic on Health-Related Quality of Life among patients affected by Primary Antibody Deficiencies. to identify factors impacting the Health-Related-Quality of Life among Italian patients affected by Primary Antibody Deficiencies switched to remote assistance at the time of the COVID-19 pandemic. Survey on quality of life in 158 Primary Antibody Defic","Pulvirenti, Cinetto, Milito, Bonanni, Pesce, Leodori, Garzi, Miglionico, Tabolli, Quinti","https://doi.org/10.1016/j.jaip.2020.04.003","20200412","COVID-19; Common Variable Immune Deficiencies; Coronavirus; General Health Questionnaire; Health-related Quality of life; SARS-CoV-2 pandemic; anxiety; depression; remote assistance","PubMed","Undecided","","","","","","","","","","","","","FALSE","2020-04-13","",332,""
"COVID-19, Mental Health and Aging: A Need for New Knowledge to Bridge Science and Service.",NA,"Vahia, Blazer, Smith, Karp, Steffens, Forester, Tampi, Agronin, Jeste, Reynolds","https://doi.org/10.1016/j.jagp.2020.03.007","20200412","COVID-19; aging; geriatrics; psychiatry","PubMed","Undecided","","","","","","","","","","","","","FALSE","2020-04-13","",333,""
