"title","abstract","authors","link","date","subject","source","initial_decision","q0","q1","q2","q3","q4","q5","q6","q7","q8","q9","q10","q11","q12","q13","exclusion_reason","extraction_date","expert_decision","ID","o1"
"Focus on Mental Health During the Coronavirus (COVID-19) Pandemic: Applying Learnings from the Past Outbreaks","The 2019 novel coronavirus (COVID-19) has gained global attention after it originated from China at the end of 2019, and later turned into pandemic as it affected about 118,000 in 114 countries by March 11, 2020. By March 13, 2020, it was declared a national emergency in the United States as the number of COVID-19 cases, and the death toll rose exponentially. To contain the spread of the disease, the world scientist community came together. However, the unpreparedness of the nations, even with the advanced medical sciences and resources, has failed to address the mental health aspect amongst the public, as all efforts are focused on understanding the epidemiology, clinical features, transmission patterns, and management of COVID-19 pneumonia. Our efforts in this review are to evaluate and study similar outbreaks from the past to understand its adverse impact on mental health, implement adequate steps to tackle and provide a background to physicians and healthcare workers at the time of such outbreaks to apply psychological first aid.","Shah, Kaushal; Kamrai, Dhwani; Mekala, Hema; Mann, Birinder; Desai, Krishna; Patel, Rikinkumar S.","https://doi.org/10.7759/cureus.7405","2020","","WHO","Undecided","","","","","","","","","","","","","False","False","","2020-05-11","",803,""
"Health Communication Through News Media During the Early Stage of the COVID-19 Outbreak in China: Digital Topic Modeling Approach","Background: In December 2019, a few coronavirus disease (COVID-19) cases were first reported in Wuhan, Hubei, China. Soon after, increasing numbers of cases were detected in other parts of China, eventually leading to a disease outbreak in China. As this dreadful disease spreads rapidly, the mass media has been active in community education on COVID-19 by delivering health information about this novel coronavirus, such as its pathogenesis, spread, prevention, and containment. Objective: The aim of this study was to collect media reports on COVID-19 and investigate the patterns of media-directed health communications as well as the role of the media in this ongoing COVID-19 crisis in China. Methods: We adopted the WiseSearch database to extract related news articles about the coronavirus from major press media between January 1, 2020, and February 20, 2020. We then sorted and analyzed the data using Python software and Python package Jieba. We sought a suitable topic number with evidence of the coherence number. We operated latent Dirichlet allocation topic modeling with a suitable topic number and generated corresponding keywords and topic names. We then divided these topics into different themes by plotting them into a 2D plane via multidimensional scaling. Results: After removing duplications and irrelevant reports, our search identified 7791 relevant news reports. We listed the number of articles published per day. According to the coherence value, we chose 20 as the number of topics and generated the topicsâ€™ themes and keywords. These topics were categorized into nine main primary themes based on the topic visualization figure. The top three most popular themes were prevention and control procedures, medical treatment and research, and global or local social and economic influences, accounting for 32.57% (n=2538), 16.08% (n=1258), and 11.79% (n=919) of the collected reports, respectively. Conclusions: Topic modeling of news articles can produce useful information about the significance of mass media for early health communication. Comparing the number of articles for each day and the outbreak development, we noted that mass media news reports in China lagged behind the development of COVID-19. The major themes accounted for around half the content and tended to focus on the larger society rather than on individuals. The COVID-19 crisis has become a worldwide issue, and society has become concerned about donations and support as well as mental health among others. We recommend that future work addresses the mass mediaâ€™s actual impact on readers during the COVID-19 crisis through sentiment analysis of news data.","Liu, Qian; Zheng, Zequan; Zheng, Jiabin; Chen, Qiuyi; Liu, Guan; Chen, Sihan; Chu, Bojia; Zhu, Hongyu; Akinwunmi, Babatunde; Huang, Jian; Zhang, Casper J P; Ming, Wai-Kit","https://doi.org/10.2196/19118","2020","","WHO","Undecided","","","","","","","","","","","","","False","False","","2020-05-11","",804,""
"Curating evidence on mental health during COVID-19: A living systematic review","","Thombs, Brett D.; Bonardi, Olivia; Rice, Danielle B.; Boruff, Jill T.; Azar, Marleine; He, Chen; Markham, Sarah; Sun, Ying; Wu, Yin; Krishnan, Ankur; Thombs-Vite, Ian; Benedetti, Andrea","https://doi.org/10.1016/j.jpsychores.2020.110113","2020","","WHO","Undecided","","","","","","","","","","","","","False","False","","2020-05-11","",805,""
"Is Returning to Work during the COVID-19 Pandemic Stressful? A Study on Immediate Mental Health Status and Psychoneuroimmunity Prevention Measures of Chinese Workforce","This study aimed to quantify the immediate psychological effects and psychoneuroimmunity prevention measures of a workforce returning to work during the COVID-19 epidemic. Workforce returning to work was invited to complete an online questionnaire regarding their attitude toward the COVID-19 epidemic and return-to-work along with psychological parameters including the Impact of Event Scale-Revised, Depression, Anxiety, Stress Scale- 21 (DASS-21) and Insomnia Severity Index (ISI). Psychoneuroimmunity prevention measures include precautions at personal and organization levels. From 673 valid questionnaires, we found that 10.8% of respondents met the diagnosis of post-traumatic stress disorder (PTSD) after returning to work. The respondents reported a low prevalence of anxiety (3.8%), depression (3.7%), stress (1.5%) and insomnia (2.3%). There were no significant differences in the severity of psychiatric symptoms between workers/technicians and executives/managers. More than 95% reported psychoneuroimmunity prevention measures including good ventilation in the workplace and wore a face mask as protective. Factors that were associated with the severity of psychiatric symptoms in the workforce were marital status, presence of physical symptom, poor physical health and viewing return to work as a health hazard (p<0.05). In contrast, personal psychoneuroimmunity prevention measures including hand hygiene and wearing face masks as well as organizational measures including significant improvement of workplace hygiene and concerns from the company were associated with less severe psychiatric symptoms (p<0.05). Contrary to expectations, returning to work had not caused a high level of psychiatric symptoms in the workforce. The low prevalence of psychiatric symptoms could be due to confidence instilled by psychoneuroimmunity prevention measures before the resumption of work. Our findings would provide information for other countries during the COVID-19 pandemic.","Tan, Wanqiu; Hao, Fengyi; McIntyre, Roger S.; Jiang, Li; Jiang, Xiaojiang; Zhang, Ling; Zhao, Xinling; Zou, Yiran; Hu, Yirong; Luo, Xi; Zhang, Zhisong; Lai, Andre; Ho, Roger; Tran, Bach; Ho, Cyrus; Tam, Wilson","https://doi.org/10.1016/j.bbi.2020.04.055","2020","","WHO","Undecided","","","","","","","","","","","","","False","False","","2020-05-11","",806,""
"Comparison of Prevalence and Associated Factors of Anxiety and Depression Among People Affected by versus People Unaffected by Quarantine During the COVID-19 Epidemic in Southwestern China","BACKGROUND At the end of 2019, the COVID-19 outbreak began in Wuhan, Hubei, China, and spread rapidly to the whole country within 1 month. This new epidemic caused a great mental reaction among the public. This study aimed to assess and compare the prevalence and associated factors of anxiety and depression among the public affected by quarantine and those unaffected during the COVID-19 outbreak in southwestern China in early Feb. 2020. MATERIAL AND METHODS Data were collected using the self-rating anxiety scale (SAS) and the self-rating depression scale (SDS) administered to 1593 respondents aged 18 years and above. The respondents were grouped as 'affected group' and 'unaffected group' on the basis of whether they or their families/colleagues/classmates/neighbors had been quarantined. RESULTS Among 1593 participants, the prevalence of anxiety and depression was approximately 8.3% and 14.6%, respectively, and the prevalence in the affected group (12.9%, 22.4%) was significantly higher than that in the unaffected group (6.7%, 11.9%). Lower average household income, lower education level, having a higher self-evaluated level of knowledge, being more worried about being infected, having no psychological support, greater property damage, and lower self-perceived health condition were significant associated with higher scores on the SAS and SDS. People living in Chongqing had higher SAS and SDS scores than those living in Yunnan Province. CONCLUSIONS The prevalence of anxiety and depression of the affected group are higher than in the unaffected group during the COVID-19 outbreak in southwestern China in early Feb. 2020. The government should focus more on providing economic and medical support to improve the general population's mental state.","Lei, Lei; Huang, Xiaoming; Zhang, Shuai; Yang, Jinrong; Yang, Lin; Xu, Min","https://doi.org/10.12659/MSM.924609","2020","","WHO","Undecided","","","","","","","","","","","","","False","False","","2020-05-11","",807,""
"Do psychiatric patients experience more psychiatric symptoms during COVID-19 pandemic and lockdown? A Case-Control Study with Service and Research Implications for Immunopsychiatry","This study aimed to assess and compare the immediate stress and psychological impact experienced by people with and without psychiatric illnesses during the peak of 2019 coronavirus disease (COVID-19) epidemic with strict lockdown measures. Seventy-six psychiatric patients and 109 healthy control subjects were recruited from Chongqing, China and completed a survey on demographic data, physical symptoms during the past 14 days and a range of psychiatric symptoms using the Impact of Event Scale- Revised (IES-R), Depression, Anxiety and Stress Scale (DASS-21) and Insomnia Severity Index (ISI). IES-R measures PTSD symptoms in survivorship after an event. DASS -21 is based on tripartite model of psychopathology that comprise a general distress construct with distinct characteristics. The mean IES-R, DASS-21 anxiety, depression and stress subscale and ISI scores were higher in psychiatric patients than healthy controls (p<0.001). Serious worries about their physical health, anger and impulsivity and intense suicidal ideation were significantly higher in psychiatric patients than healthy controls (p<0.05). More than one-third of psychiatric patients might fulfil the diagnostic criteria post-traumatic stress disorder (PTSD). More than one-quarter of psychiatric patients suffered from moderately severe to severe insomnia. Respondents who reported no change, poor or worse physical health status and had a psychiatric illness were significantly more likely to have higher mean IES-R, DASS depression, anxiety and stress subscale scores and ISI scores (p<0.05). This study confirms the severity of negative psychological impact on psychiatric patients during the COVID-19 epidemic with strict lockdown measures. Understanding the psychological impact on psychiatric patients during the COVID-19 pandemic has the potential to provide insight into how to develop a new immunopsychiatry service. Further research is required to compare pro-inflammatory cytokines between psychiatric patients and healthy controls during the pandemic.","Hao, Fengyi; Tan, Wanqiu; Jiang, Li; Zhang, Ling; Zhao, Xinling; Zou, Yiran; Hu, Yirong; Luo, Xi; Jiang, Xiaojiang; McIntyre, Roger S.; Tran, Bach; Sun, Jiaqian; Zhang, Zhisong; Ho, Roger; Ho, Cyrus; Tam, Wilson","https://doi.org/10.1016/j.bbi.2020.04.069","2020","","WHO","Undecided","","","","","","","","","","","","","False","False","","2020-05-11","",808,""
"A Second Pandemic: Mental Health Spillover From the Novel Coronavirus (COVID-19)","The novel coronavirus (COVID-19) pandemic has created an unprecedented global health challenge. There is risk that the outbreak will create a ?second pandemic? of mental health crises in health systems and communities. Thus, a comprehensive public health response to the pandemic must include (a) attention to the psychological aspects of hospitalization for patients, families, and staff affected by COVID-19; (b) planning for emergency and acute psychiatric patient care if hospitals become overwhelmed with COVID-19 patients; and (c) innovations for providing mental health care in communities while social distancing is required and health system resources are strained. Nurses and nurse leaders must anticipate these mental health challenges, assist with preparedness in health systems and communities, and advocate for a coordinated response to promote mental wellness and resilience.","Choi, Kristen R.; Heilemann, MarySue V.; Fauer, Alex; Mead, Meredith","https://doi.org/10.1177/1078390320919803","2020","","WHO","Undecided","","","","","","","","","","","","","False","False","","2020-05-11","",809,""
"Role of increasing the aerobic capacity on improving the function of immune and respiratory systems in patients with coronavirus (COVID-19): A review","Background and aims COVID-19 is a public world crisis, however, it is a self-limited infection. In COVID-19, the strength of immune and respiratory systems is a critical element. Thus, this review was conducted to demonstrate the short and long term effects of increasing the aerobic capacity on increasing the function and strength of immune and respiratory systems, particularly those essential for overcoming COVID-19 infections and associated disorders. Methods This review was carried out by searching in Web of Science, Scopus, EBSCO, Medline databases. The search was conducted over clinical trials and literature and systematic reviews on the effects of increasing the aerobic capacity on the function and strength of specific immune and respiratory elements essential for overcoming COVID-19 infections. Results This review found that increasing the aerobic capacity could produce short-term safe improvements in the function of immune and respiratory systems, particularly those specific for COVID-19 infections. This could be mainly produced through three mechanisms. Firstly, it could improve immunity by increasing the level and function of immune cells and immunoglobulins, regulating CRP levels, and decreasing anxiety and depression. Secondly, it could improve respiratory system functions by acting as an antibiotic, antioxidant, and antimycotic, restoring normal lung tissue elasticity and strength. Lastly, it could act as a protective barrier to decrease COVID-19 risk factors, which helps to decrease the incidence and progression of COVID-19. Conclusion This review summarizes that increasing the aerobic capacity is recommended because it has potential of improving immune and respiratory functions which would help counter COVID-19.","Mohamed, Ayman; Alawna, Motaz","https://doi.org/10.1016/j.dsx.2020.04.038","2020","","WHO","Undecided","","","","","","","","","","","","","False","False","","2020-05-11","",810,""
"Reactive psychoses in the context of the COVID-19 pandemic: clinical perspectives from a case series","Introduction: The world is currently undergoing an extremely stressful scenario due to the COVID-19 pandemic. This unexpected and dramatic situation could increase the incidence of mental health problems, among them, psychotic disorders. The aim of this paper was to describe a case series of brief reactive psychosis due to the psychological distress from the current coronavirus pandemic. Materials and methods: We report on a case series including all the patients with reactive psychoses in the context of the COVID-19 crisis who were admitted to the Virgen del RocÃ­o and Virgen Macarena University Hospitals (Seville, Spain) during the first two weeks of compulsory nationwide quarantine. Results: In that short period, four patients met the Diagnostic and Statistical Manual of Mental Disorders (DSM-5) criteria for a brief reactive psychotic disorder. All of the episodes were directly triggered by stress derived from the COVID-19 pandemic and half of the patients presented severe suicidal behavior at admission. Conclusions: We may now be witnessing an increasing number of brief reactive psychotic disorders as a result of the COVID-19 pandemic. This type of psychosis has a high risk of suicidal behavior and, although short-lived, has a high rate of psychotic recurrence and low diagnostic stability over time. Therefore, we advocate close monitoring in both the acute phase and long-term follow-up of these patients. Resumen IntroducciÃ³n: El mundo estÃ¡ experimentando un escenario extremadamente estresante a causa de la pandemia del COVID-19. Esta situaciÃ³n inesperada y dramÃ¡tica podrÃ­a incrementar la incidencia de los problemas de salud mental y, entre estos, los trastornos psicÃ³ticos. El objetivo de este documento es describir una serie de casos de psicosis reactiva breve, debidos al distrÃ©s psicolÃ³gico debido a la pandemia actual de coronavirus. Materiales y mÃ©todos: Reportamos una serie de casos, que incluye a todos los pacientes con psicosis reactiva en el contexto de la crisis del COVID-19, ingresados en los hospitales universitarios Virgen del RocÃ­o y Virgen Macarena (Sevilla, EspaÃ±a) durante las dos primeras semanas de la cuarentena obligatoria a nivel nacional. Resultados: En este breve espacio de tiempo, cuatro pacientes cumplieron los criterios de trastorno psicÃ³tico breve del Manual diagnÃ³stico y estadÃ­stico de trastornos mentales (DSM-5). Todos los episodios fueron desencadenados por el estrÃ©s derivado de la pandemia del COVID-19, y la mitad de los pacientes presentaron un comportamiento suicida grave a su ingreso. Conclusiones: Actualmente podemos estar asistiendo a un incremento del nÃºmero de trastornos psicÃ³ticos reactivos breves, como resultado de la pandemia del COVID-19. Este tipo de psicosis tiene un elevado riesgo de comportamiento suicida y, aunque es transitorio, tiene una elevada tasa de recurrencia psicÃ³tica y baja estabilidad diagnÃ³stica a lo largo del tiempo. Por tanto, somos partidarios de una supervisiÃ³n estrecha tanto en la fase aguda como en el seguimiento a largo plazo de estos pacientes.","ValdÃ©s-Florido, MarÃ­a JosÃ©; LÃ³pez-DÃ­az, Ãlvaro; Palermo-Zeballos, Fernanda Jazmin; MartÃ­nez-Molina, IvÃ¡n; MartÃ­n-Gil, Victoria Eugenia; Crespo-Facorro, Benedicto; Ruiz-Veguilla, Miguel","https://doi.org/10.1016/j.rpsm.2020.04.009","2020","","WHO","Undecided","","","","","","","","","","","","","False","False","","2020-05-11","",811,""
"COVID-19, anxiety, sleep disturbances and suicide","","Sher, Leo","https://doi.org/10.1016/j.sleep.2020.04.019","2020","","WHO","Undecided","","","","","","","","","","","","","False","False","","2020-05-11","",812,""
"Emergency Responses to Covid-19 Outbreak: Experiences and Lessons from a General Hospital in Nanjing, China","The novel coronavirus 2019 (SARS-CoV-2) has caused wide dissemination across the world. Global health systems are facing the unprecedented challenges. Here we shared the experiences and lessons in emergency responses and management from our hospital, a government-assigned regional anti-Covid-19 general hospital in Nanjing, Jiangsu Province, China. Our periodic strategies in dealing with Covid-19 were described in detail. An administrative response including the establishment of Emergency Leadership Committee that was in full charge of management was established. Modifications of infrastructure including the Fever Clinic, inpatient ward, outpatient clinic and operation room were carried out. Special arrangements for outpatient services, hospitalization and surgeries were introduced. Medical personnel training and patient educations were performed. Initiations of Covid-19 researches and application of information technology were introduced. Since January 16, three cases have been confirmed in our hospital and no healthcare-associated infection was found. During the epidemics, 6.46% staffs suffered depression, 9.87% had anxiety, and 98% were satisfied with the infection control policy. Shortages in staffs and medical consumables, and limitation in space were the obstacles we encountered. As the cost of in-hospital transmission is unbearable, our experiences and lessons suggested that prompt actions should be taken immediately to decrease or eliminate potential in-hospital transmission. Experience shared herein may be useful for those facilities that are and may encounter Covid-19.","Shen, Yang; Cui, Ying; Li, Ning; Tian, Chen; Chen, Ming; Zhang, Ye-Wei; Huang, Ying-Zi; Chen, Hui; Kong, Qing-Fang; Zhang, Qun; Teng, Gao-Jun","https://doi.org/10.1007/s00270-020-02474-w","2020","","WHO","Undecided","","","","","","","","","","","","","False","False","","2020-05-11","",813,""
"Maintaining mental health in the time of coronavirus","From social isolation to working on the front line, covid-19 is posing serious challenges to mental health. Moya Sarner asks the experts how we can protect ourselves","Sarner, Moya","https://doi.org/10.1016/S0262-4079(20)30819-8","2020","","WHO","Undecided","","","","","","","","","","","","","False","False","","2020-05-11","",814,""
"[An analysis of global research on SARS-CoV-2]","The SARS-CoV-2 has been spread to 26 countries around the world since its outbreak. By February 16, 2020, more than 68 000 people had been diagnosed with COVID-19. Researchers from all over the world have carried out timely studies on this public health emergency and produced a number of scientific publications. This review aims to re-analyze and summarize the current research findings in a timely manner to guide scholars in relevant fields to further SARS-CoV-2 research and assist healthcare professionals in their work and decision-making. The SARS-CoV-2 related terms were selected in both English and Chinese and were searched in several major databases, including Pubmed, Web of Science, CNKI, Wanfang, and VIP databases. The reference list of each search result was screened for relevance, which was further supplemented to the search results. The included studies were categorized by topics with key characteristics extracted, re-analyzed, and summarized. A total of 301 articles were finally included with 136 in Chinese and 165 in English. The number of publications has rapidly increased since mid-January, 2020, and a peak day was 6th February on which 50 articles were published. The top three countries publishing articles were China, the United States and the United Kingdom. The Lancet and its specialty journals have published the most articles, with contribution also from journals such as New England Journal of Medicine ( NEJM), The Journal of the American Medical Association ( JAMA), and Nature. All articles were categorized into epidemiology, clinical diagnosis and treatment, basic research, pregnant women and children, mental health, epidemic prevention & control, and others. The literatures related to SARS-CoV-2 are emerging rapidly. It is necessary to sort out and summarize the research topic in time, which has a good reference value for staff in different positions. At the same time, it is necessary to strengthen the judgment of the quality of literatures.","Zhang, Longhao; Li, Baihong; Jia, Peng; Pu, Jian; Bai, Bei; Li, Yin; Zhu, Peijia; Li, Lei; Zeng, Guojun; Zhao, Xin; Dong, Shanshan; Liu, Menghan; Zhang, Nan","https://doi.org/10.7507/1001-5515.202002034","2020","","WHO","Undecided","","","","","","","","","","","","","False","False","","2020-05-11","",815,""
"Comment on ""Digital Mental Health and COVID-19: Using Technology Today to Accelerate the Curve on Access and Quality Tomorrow"": A UK Perspective","","Whelan, Pauline; Stockton-Powdrell, Charlotte; Jardine, Jenni; Sainsbury, John","https://doi.org/10.2196/19547","2020","","WHO","Undecided","","","","","","","","","","","","","False","False","","2020-05-11","",816,""
