"title","abstract","authors","link","date","subject","source","initial_decision","q0","q1","q2","q3","q4","q5","q6","q7","q8","q9","q10","q11","q12","q13","exclusion_reason","extraction_date","expert_decision","ID","o1"
"Rapid Systematic Review: The Impact of Social Isolation and Loneliness on the Mental Health of Children and Adolescents in the Context of COVID-19","Disease containment of COVID-19 has necessitated widespread social isolation. We aimed to establish what is known about how loneliness and disease containment measures impact on the mental health in children and adolescents. For this rapid review, we searched MEDLINE, PSYCHINFO, and Web of Science for articles published between 01/01/1946 and 03/29/2020. 20% of articles were double screened using pre-defined criteria and 20% of data was double extracted for quality assurance. 83 articles (80 stu","Loades, Chatburn, Higson-Sweeney, Reynolds, Shafran, Brigden, Linney, McManus, Borwick, Crawley","https://doi.org/10.1016/j.jaac.2020.05.009","20200606","COVID-19; disease containment; loneliness; mental health; pandemic","PubMed","Undecided","","","","","","","","","","","","","False","False","","2020-06-07","",1700,""
"Changing the Landscape of Medical Oncology Training at the National University Hospital in the Philippines during the Coronavirus Disease 2019 (COVID-19) Pandemic","Serving as one of the few training institutions of medical oncology in the Philippines, the University of the Philippines-Philippine General Hospital was faced with challenges brought by the coronavirus 2019 disease (COVID-19) pandemic. With the dismantling of routines and practices in the hospital, training activities such as daily rounds, conferences, and examinations were temporarily put on hold. Recognizing that the strength of any clinical training program is its wealth of patients, the imm","Chua, Mendoza, Ando, Planilla, Fernando, Strebel, Ignacio","https://doi.org/10.1007/s13187-020-01786-2","20200606","","PubMed","Undecided","","","","","","","","","","","","","False","False","","2020-06-07","",1701,""
"Are we all in this together? Longitudinal assessment of cumulative adversities by socioeconomic position in the first 3 weeks of lockdown in the UK","Despite media claims that coronavirus disease 2019 (COVID-19) is uniting societies and countries in shared experience, there has been concern that the pandemic is in fact exposing and widening existing inequalities within societies. Data have shown these differences for cases and fatalities, but data on other types of adversities are lacking. Therefore, this study explored the changing patterns of adversity relating to the COVID-19 pandemic by socioeconomic position (SEP) during the early weeks ","Wright, Steptoe, Fancourt","https://doi.org/10.1136/jech-2020-214475","20200606","Cohort studies; EPIDEMIOLOGY; MENTAL HEALTH; PSYCHOSOCIAL FACTORS; PUBLIC HEALTH","PubMed","Undecided","","","","","","","","","","","","","False","False","","2020-06-07","",1702,""
"Medical and Surgical Education Challenges and Innovations in the COVID-19 Era: A Systematic Review","The aim of this systematic review was to identify the challenges imposed on medical and surgical education by the COVID-19 pandemic, and the proposed innovations enabling the continuation of medical student and resident training. A systematic review on the MEDLINE and EMBASE databases was performed on April 18th, 2020, and yielded 1288 articles. Sixty-one of the included manuscripts were synthesized in a qualitative description focused on two major axes, &quot;challenges&quot; and &quot;innovati","Dedeilia, Sotiropoulos, Hanrahan, Janga, Dedeilias, Sideris","https://doi.org/10.21873/invivo.11950","20200606","COVID-19; Medical education; SARS-CoV-2; coronavirus; medical students; residents; review; tele-education; telemedicine; virtual learning","PubMed","Undecided","","","","","","","","","","","","","False","False","","2020-06-07","",1703,""
"Distress and Resilience in the Days of COVID-19: Comparing Two Ethnicities","The COVID-19 pandemic is an ongoing epidemic of coronavirus disease, caused by severe acute respiratory syndrome, which has spread recently worldwide. Efforts to prevent the virus from spreading include travel restrictions, lockdowns as well as national or regional quarantines throughout the international community. The major negative psychological outcome of the COVID-19 pandemic is the anxiety caused by it. The aim of the present study was to examine the level of concern and the contributions ","Kimhi, Eshel, Marciano, Adini","https://doi.org/10.3390/ijerph17113956","20200606","COVID-19; community and national resilience; distress symptoms; individual; minority and majority groups; sense of danger","PubMed","Undecided","","","","","","","","","","","","","False","False","","2020-06-07","",1704,""
"Psychosocial and Behavioral Impact of COVID-19 in Autism Spectrum Disorder: An Online Parent Survey","The 2019 coronavirus disease (COVID-19) outbreak could result in higher levels of psychological distress, especially among people suffering from pre-existing mental health conditions. Young individuals with autism spectrum disorders (ASD) are particularly at risk due to their vulnerability to unpredictable and complex changes. This study aimed to investigate the impact of the COVID-19 pandemic on ASD individuals, whether any pre-pandemic sociodemographic or clinical characteristics would predict","Colizzi, Sironi, Antonini, Ciceri, Bovo, Zoccante","https://doi.org/10.3390/brainsci10060341","20200606","2019-nCoV; child and adolescent psychiatry; coronavirus; mental health prevention; neurodevelopment","PubMed","Undecided","","","","","","","","","","","","","False","False","","2020-06-07","",1705,""
