"title","abstract","authors","link","date","subject","source","initial_decision","q0","q1","q2","q3","q4","q5","q6","q7","q8","q9","q10","q11","q12","q13","exclusion_reason","extraction_date","expert_decision","ID","o1"
"Mental Health Outcomes Among Frontline and Second-Line Health Care Workers During the Coronavirus Disease 2019 (COVID-19) Pandemic in Italy","","Rossi, Socci, Pacitti, Di Lorenzo, Di Marco, Siracusano, Rossi","https://doi.org/10.1001/jamanetworkopen.2020.10185","20200528","","PubMed","Undecided","","","","","","","","","","","","","False","False","","2020-05-29","",1423,""
"Shattered social identity and moral injuries: Work-related conditions in health care professionals during the COVID-19 pandemic","The present article assesses the effects of shattered social identity and moral injuries experienced by health care professionals (HCPs) due to the COVID-19 pandemic. Professional expertise and emotional-cognitive demands as key aspects of HCPs' social identity are introduced, and the effects of moral injuries-in terms of violation of medical-ethical and social-ethical norms-on the mental health of HCPs are discussed. (PsycInfo Database Record (c) 2020 APA, all rights reserved).","KrÃ¶ger","https://doi.org/10.1037/tra0000715","20200528","","PubMed","Undecided","","","","","","","","","","","","","False","False","","2020-05-29","",1424,""
"Heightened risk of child maltreatment amid the COVID-19 pandemic can exacerbate mental health problems for the next generation","The spread of the COVID-19 disrupted ecological systems in which children develop, exacerbating threats to their safety and increasing their vulnerability to future psychopathology. Supports to reduce sources of stress for caregivers and protect children from threats to their safety are warranted. (PsycInfo Database Record (c) 2020 APA, all rights reserved).","Cuartas","https://doi.org/10.1037/tra0000597","20200528","","PubMed","Undecided","","","","","","","","","","","","","False","False","","2020-05-29","",1425,""
"COVID-19 and prisons: Providing mental health care for people in prison, minimising moral injury and psychological distress in mental health staff","","Kothari, Forrester, Greenberg, Sarkissian, Tracy","https://doi.org/10.1177/0025802420929799","20200528","","PubMed","Undecided","","","","","","","","","","","","","False","False","","2020-05-29","",1426,""
"Impact of COVID-19 on the mental health of surgeons and coping strategies","Unprecedented times call for extraordinary measures. While surgeons across the globe try to comprehend the evolving facade of the COVID-19 pandemic and improvise surgical practice to the best of their ability, the psychological impact of the stress on their own mental health and well-being has been underestimated. This paper aims to review the indirect and overt factors that may affect the mental health of a surgeon in the present circumstances. Furthermore, it will aim to highlight key coping m","Balasubramanian, Paleri, Bennett, Paleri","https://doi.org/10.1002/hed.26291","20200528","COVID-19 impact; head neck; mental health; otolaryngology; surgeons","PubMed","Undecided","","","","","","","","","","","","","False","False","","2020-05-29","",1427,""
"COVID-19 Implications on Clinical Clerkships and the Residency Application Process for Medical Students","The coronavirus disease 2019 (COVID-19) pandemic has caused significant disruption to undergraduate medical education (UME). Although the immediate scheduling challenges are being addressed, there has been less discourse regarding how this pandemic will impact medical students in their preparation for and application to residency programs.Â While some historical disasters and pandemics provide a loose precedent for UME response during COVID-19, the impact of the current pandemic has surpassed an","Akers, Blough, Iyer","https://doi.org/10.7759/cureus.7800","20200528","clerkships; covid-19; medical education; residency application","PubMed","Undecided","","","","","","","","","","","","","False","False","","2020-05-29","",1428,""
"Covid-19 and the need for perinatal mental health professionals: now more than ever before","","Hynan","https://doi.org/10.1038/s41372-020-0696-z","20200528","","PubMed","Undecided","","","","","","","","","","","","","False","False","","2020-05-29","",1429,""
"Psychological impact of COVID-19 on ophthalmologists-in-training and practising ophthalmologists in India","To evaluate the psychological impact of the COVID 19 crisis on ophthalmologists-in-training and practising ophthalmologists during lockdown in India. An online survey was completed by ophthalmologists and ophthalmology trainees during the lockdown. The information collected included demographics (age, gender), domicile (state, union territory), current professional status (in training or practising), type of practice (solo, group, institutional, governmental, non-governmental), marital status (m","Khanna, Honavar, Metla, Bhattacharya, Maulik","https://doi.org/10.4103/ijo.IJO_1458_20","20200528","COVID-19; Coronavirus; India; SARS COV-2; ophthalmologists","PubMed","Undecided","","","","","","","","","","","","","False","False","","2020-05-29","",1430,""
