"title","abstract","authors","link","date","subject","source","initial_decision","q0","q1","q2","q3","q4","q5","q6","q7","q8","q9","q10","q11","q12","q13","exclusion_reason","extraction_date","expert_decision","ID","o1"
"Communicating about suicide during a global pandemic: impact on journalists and media audiences","COVID-19 has brought with it an increase in predictions of mental ill-health and suicide impacts in Australia  For journalists, it has been a period not only of personal stress about their economic livelihoods and occupational safety, but also balancing providing up to date information about the pandemic with safe, sensitive and accurate reporting on associated suicide and mental health issues  Mindframe offers guidelines, resources and individualised support to help manage the complexities of reporting on suicide in this global pandemic, working with media to protect people in their audience who are vulnerable to suicide while also helping journalists protect their own mental health and well being","Wake, Alexandra; Paton, Elizabeth; Pryor, Rebecca","https://doi.org/10.1177/1329878X20956415","","Database: COVIDWHO; Publication details: Media International Australia;2020.; Publication details: Media International Australia;2020.; Publication type: article","WHO","Undecided","","","","","","","","","","","","","False","False","","2020-09-25","",5133,""
"Suicide Attempt as the Presenting Symptom in a Patient with COVID-19: A Case Report from the United States","Coronavirus disease 2019 (COVID-19) has attained a pandemic status and is associated with a high morbidity and mortality  Social isolation, fear of ostracization, and illness itself and limited access to care can lead to worsening of mental illnesses  We report a case from the United States describing a young male with a suicidal attempt who was subsequently found to have COVID-19 infection  Further research is needed to evaluate potential factors for this unique association","Telles-Garcia, N.; Zahrli, T.; Aggarwal, G.; Bansal, S.; Richards, L.; Aggarwal, S.","https://doi.org/10.1155/2020/8897454","","Database: COVIDWHO; Publication details: Case Rep Psychiatry;2020:8897454, 2020.; Publication details: Case Rep Psychiatry;2020:8897454, 2020.; Publication type: article","WHO","Undecided","","","","","","","","","","","","","False","False","","2020-09-25","",5134,""
"Social Isolation and Loneliness Among San Francisco Bay Area Older Adults During the COVID-19 Shelter-in-Place Orders","BACKGROUND/OBJECTIVES: Physical distancing during the COVID-19 pandemic may have unintended, detrimental effects on social isolation and loneliness among older adults  Our objectives were to investigate 1) experiences of social isolation and loneliness during shelter-in-place orders and 2) unmet health needs related to changes in social interactions  DESIGN: Mixed-methods, longitudinal phone-based survey administered every 2 weeks  SETTING: Two community sites and an academic geriatrics outpatient clinical practice  PARTICIPANTS: 151 community-dwelling older adults  MEASUREMENTS: We measured social isolation using a 6-item modified Duke Social Support Index, social interaction sub-scale, which included assessments of video-based and internet-based socializing  Measures of loneliness included self-reported worsened loneliness due to the COVID-19 pandemic, and loneliness severity based on the 3-item UCLA loneliness scale  Participants were invited to share open-ended comments about their social experiences  RESULTS: Participants were on average 75 years old (SD=10), 50% had hearing or vision impairment, 64% lived alone, and 26% difficulty bathing  Participants reported social isolation in 40% of interviews, 76% reported minimal video-based socializing, and 42% minimal internet-based socializing  Socially isolated participants reported difficulty finding help with functional needs, including bathing (20% vs 55%, p= 04)  Over half (54%) of participants reported worsened loneliness due to COVID-19, which was associated with worsened depression (62% vs 9%, p &lt;  001) and anxiety (57% vs 9%, p &lt;  001)  Rates of loneliness improved on average by time since shelter-in-place orders (4-6 weeks: 46% vs 13-15 weeks: 27%, p= 009), however, loneliness persisted or worsened for a subgroup of participants  Open-ended responses revealed challenges faced by the subgroup experiencing persistent loneliness, including poor emotional coping and discomfort with new technologies  CONCLUSIONS: Many older adults are adjusting to COVID-19 restrictions since the start of shelter-in-place orders  Additional steps are critically needed to address the psychological suffering and unmet medical needs of those with persistent loneliness or barriers to technology-based social interaction","Kotwal, A. A.; Holt-Lunstad, J.; Newmark, R. L.; Cenzer, I.; Smith, A. K.; Covinsky, K. E.; Escueta, D. P.; Lee, J. M.; Perissinotto, C. M.","https://doi.org/10.1111/jgs.16865","","Database: COVIDWHO; Publication details: J Am Geriatr Soc;2020.; Publication details: J Am Geriatr Soc;2020.; Publication type: article","WHO","Undecided","","","","","","","","","","","","","False","False","","2020-09-25","",5135,""
"Cardiovascular adverse events associated with hydroxychloroquine and chloroquine: A comprehensive pharmacovigilance analysis of pre-COVID-19 reports","AIM: There is a clinical need for safety data regarding hydroxychloroquine (HCQ) and chloroquine (CQ) during the coronavirus (COVID-19) pandemic  We analysed real-world data using the U S  Food and Drug Administration Adverse Events Reporting System (FAERS) database to assess HCQ/CQ-associated cardiovascular adverse events (CVAEs) in pre-COVID-19 reports  METHODS: We conducted disproportionality analysis of HCQ/CQ in the FAERS database (07/2014-9/2019), using reporting odds ratio (ROR) and the lower bound of the information component 95% credibility interval (IC(025) )  RESULTS: The full database contained 6 677 225 reports with a mean (SD) age of 53 (17) years and 74% females  We identified 4895 reports of HCQ/CQ related adverse events, of which 696 (14 2%) were CVAEs  Compared with the full database, HCQ/CQ use was associated with a higher reporting rate of major CVAEs, including cardiomyopathy (n = 86 [1 8%], ROR = 29 0 [23 3-35 9]), QT prolongation (n = 43 [0 9%], ROR = 4 5 [3 3-6 1]), cardiac arrhythmias (n = 117 [2 4%], ROR = 2 2 [1 8-2 7]) and heart failure (n = 136 [2 8%], ROR = 2 2 [1 9-2 7], all IC025 &gt; 0)  No statistically significant differences were observed between sex and age groups  CVAEs were reported more often in patients with systemic lupus erythematosus and Sjogren's syndrome  HCQ/CQ-associated CVAEs demonstrated subsequent hospitalization and mortality rates of 39% and 8%, respectively  Overdose reports demonstrated an increased frequency of QT prolongation and ventricular arrhythmias (35% and 25%, respectively)  CONCLUSION: In a real-world setting, HCQ/CQ treatment is associated with higher reporting rates of various CVAEs, particularly cardiomyopathy, QT prolongation, cardiac arrhythmias and heart failure  HCQ/CQ-associated CVAEs result in high rates of severe outcomes and should be carefully considered as an off-label indication, especially for patients with cardiac disorders","Goldman, A.; Bomze, D.; Dankner, R.; Hod, H.; Meirson, T.; Boursi, B.; Maor, E.","https://doi.org/10.1111/bcp.14546","","Database: COVIDWHO; Publication details: Br J Clin Pharmacol;2020.; Publication details: Br J Clin Pharmacol;2020.; Publication type: article","WHO","Undecided","","","","","","","","","","","","","False","False","","2020-09-25","",5136,""
"Impact of Fear of COVID-19 Pandemic on the Mental Health of Nurses in Pakistan","","Khattak, Sajid Rahman; Saeed, Imran; Rehman, Shams Ur; Fayaz, Mohammad","https://doi.org/10.1080/15325024.2020.1814580","","Database: COVIDWHO; Publication details: Journal of Loss and Trauma;2020.; Publication details: Journal of Loss and Trauma;2020.; Publication type: article","WHO","Undecided","","","","","","","","","","","","","False","False","","2020-09-25","",5137,""
"University experiences of occupational therapy in Brazil during the Covid-19 pandemic: Contributions and support in mental health for the population","","Ricci, llen C.; Dimov, Tatiana; da Silva Cassais, Tatiane; Dellbrgger, Ana Paula","https://doi.org/10.1080/14473828.2020.1818048","","Database: COVIDWHO; Publication details: World Federation of Occupational Therapists Bulletin;2020.; Publication details: World Federation of Occupational Therapists Bulletin;2020.; Publication type: article","WHO","Undecided","","","","","","","","","","","","","False","False","","2020-09-25","",5138,""
"Mental health in times of COVID: Thoughts after the state of alarm","","Gonzlez-Rodrguez, A.; Labad, J.","https://doi.org/10.1016/j.medcli.2020.07.009","","Database: COVIDWHO; Publication details: Med Clin (Barc);2020.; Publication details: Med Clin (Barc);2020.; Publication type: article","WHO","Undecided","","","","","","","","","","","","","False","False","","2020-09-25","",5139,""
"The potential impact of the COVID-19 pandemic on child growth and development: a systematic review","Objective This was a systematic review of studies that examined the impact of epidemics or social restriction on mental and developmental health in parents and children/adolescents  Source of data The PubMed, WHO COVID-19, and SciELO databases were searched on March 15, 2020, and on April 25, 2020, filtering for children (018 years) and humans  Synthesis of data The tools used to mitigate the threat of a pandemic such as COVID-19 may very well threaten child growth and development  These tools  such as social restrictions, shutdowns, and school closures  contribute to stress in parents and children and can become risk factors that threaten child growth and development and may compromise the Sustainable Development Goals  The studies reviewed suggest that epidemics can lead to high levels of stress in parents and children, which begin with concerns about children becoming infected  These studies describe several potential mental and emotional consequences of epidemics such as COVID-19, H1N1, AIDS, and Ebola: severe anxiety or depression among parents and acute stress disorder, post-traumatic stress, anxiety disorders, and depression among children  These data can be related to adverse childhood experiences and elevated risk of toxic stress  The more adverse experiences, the greater the risk of developmental delays and health problems in adulthood, such as cognitive impairment, substance abuse, depression, and non-communicable diseases  Conclusion Information about the impact of epidemics on parents and children is relevant to policy makers to aid them in developing strategies to help families cope with epidemic/pandemic-driven adversity and ensure their childrens healthy development","Arajo, Liubiana Arantes de; Veloso, Cssio Frederico, Souza; Matheus de Campos, Azevedo; Joo Marcos Coelho de, Tarro; Giulio","https://doi.org/10.1016/j.jped.2020.08.008","","Database: COVIDWHO; Publication details: Jornal de Pediatria;2020.; Publication details: Jornal de Pediatria;2020.; Publication type: article","WHO","Undecided","","","","","","","","","","","","","False","False","","2020-09-25","",5140,""
"Dying alone and lonely dying: Media discourse and pandemic conditions","Background and objectives This paper explores current concerns and practice related to older people dying alone in Intensive Care Units, care homes, and at home through media discussions during the Covid-19 pandemic and before  It addresses the historically-situated concept of a good death and a bad death and suggests why dying alone, whether completely alone or without significant others physically present, may be considered a bad death  Methods As evidence for collective fears about dying alone, we explored the treatment of these deaths in media using headline examples from the US New York Times and the English Guardian newspaper from the 19th century through Sept  2020  Results A search of the New York Times located 39 articles with either lonely dying or lonely death in the headline  The Guardian had 25 articles with use of the term, but unlike the New York Times, no obituaries were included  Although the deaths profiled were deemed unusual, deaths by suicide were only minimally classed as dying alone  The condition of dying alone is represented as a stigmatised death  Themes addressed: 1) dying alone is a nonnormative event;2) this death matters;and 3) where people die alone, societies should honour the death and learn from it  Discussion and implications Contemporary dying involves conditions for which we are unprepared as a society  We seldom address our civic obligations to each other  Few people have discussed their wishes about their preferences in dying and whether and how they want to be accompanied at their death, if possible  This is an invisible constraint of modern healthcare  Because of limited discussions and preparation, these deaths may lead to disenfranchised grief for the mourners  Cultural and societal responses to lonely dying are important in easing the emotional burden of dying alone, helping individuals prepare for this possibility and better integrating death with the life course  Recommendations include inclusion of accompaniment/nonaccompaniment at death as part of advance care planning and mitigation if this condition occurs  It is essential for individuals to find their own still point of acceptance within competing societal narratives of privileging the self in dying alone and the value of social connection","Nelson-Becker, Holly; Victor, Christina","https://doi.org/10.1016/j.jaging.2020.100878","","Database: COVIDWHO; Publication details: Journal of Aging Studies;55:100878, 2020.; Publication details: Journal of Aging Studies;55:100878, 2020.; Publication type: article","WHO","Undecided","","","","","","","","","","","","","False","False","","2020-09-25","",5141,""
"COVID-19-related financial stress associated with higher likelihood of depression among pregnant women living in the United States","OBJECTIVES: The COVID-19 pandemic has led to unprecedented levels of unemployment and financial strain for many Americans  Among the individuals impacted by financial strain are pregnant women, for whom added financial stress may be particularly impactful due to the costs associated with prenatal care and providing for a newborn  Financial stress has been previously associated with elevated depression symptoms among pregnant women, which could have significant impacts on birth outcomes and long-term offspring health  However, the impacts of COVID-19-associated financial stress on maternal depression in pregnancy has not been investigated  METHODS: Here, we evaluated whether COVID-19-associated financial stress was associated with increased likelihood of a clinically significant depression score (Edinburgh Postnatal Depression Score = 15) among pregnant women living in the United States during the COVID-19 pandemic  Data come from an online survey administered to a convenience sample in April 2020 (N = 2099)  RESULTS: Forty-three percent of participants reported experiencing financial stress as a result of the pandemic, while 24% of participants had a clinically significant depression score  COVID-19-related financial stress was significantly associated with increased likelihood of a clinically significant depression score, even after adjustment for covariates including participant education and income (adjusted Odds Ratio: 2 23, 95% CI = 1 80, 2 77, P &lt;  001)  CONCLUSIONS: Financial stress caused by the COVID-19 pandemic is associated with more than two times the likelihood of depression during pregnancy, which could impact birth outcomes and long-term offspring health","Thayer, Z. M.; Gildner, T. E.","https://doi.org/10.1002/ajhb.23508","","Database: COVIDWHO; Publication details: Am J Hum Biol;2020.; Publication details: Am J Hum Biol;2020.; Publication type: article","WHO","Undecided","","","","","","","","","","","","","False","False","","2020-09-25","",5142,""
"Erratum: Meyer, J, et al Changes in Physical Activity and Sedentary Behavior in Response to COVID-19 and Their Associations with Mental Health in 3052 US Adults Int J Environ Res Public Health 2020, 17(18), 6469","Due to an error during production, Dr [   ]","Meyer, Jacob; McDowell, Cillian; Lansing, Jeni; Brower, Cassandra; Smith, Lee; Tully, Mark; Herring, Matthew","https://www.google.com/search?q=Erratum:+Meyer,+J.,+et+al.+Changes+in+Physical+Activity+and+Sedentary+Behavior+in+Response+to+COVID-19+and+Their+Associations+with+Mental+Health+in+3052+US+Adults.+Int.+J.+Environ.+Res.+Public+Health+2020,+17(18),+6469","","Database: COVIDWHO; Publication details: International Journal of Environmental Research and Public Health;17(19):6949, 2020.; Publication details: International Journal of Environmental Research and Public Health;17(19):6949, 2020.; Publication type: article","WHO","Undecided","","","","","","","","","","","","","False","False","","2020-09-25","",5143,""
"Social Networks Consumption and Addiction in College Students during the COVID-19 Pandemic: Educational Approach to Responsible Use","Within the framework of digital sustainability, the increase in Internet consumption, and especially online social networks, offers social benefits, but is not without its drawbacks  For example, it can lead to psychological and/or psychiatric disorders in some people  Numerous researches are highlighting the similarities of these addictions with the consumption of toxic substances  University students are heavy users of the Internet and, in certain situations, addiction to online social networks can be the result of depression, harassment, and anxiety, among others, affecting their daily life, including their academic responsibilities  In recent months, an anomaly has occurred that may have contributed to intensifying this problem, namely the confinement produced by the COVID-19 pandemic, which has affected the whole world to a greater or lesser extent  In this cross-sectional study, with a descriptive and quantitative methodology, students from 14 Spanish universities were investigated in the first wave of the COVID-19 pandemic in order to understand the effects of this situation on the problem described  The results show a high consumption of social networks during that time, with significant incidences of addiction  In parallel, the presence of comorbidity has been determined  In this scenario, it would be necessary to implement university educational programs to redirect these addictive behaviors, as well as preventative recommendations and actions to minimize negative impacts  This is a major problem that is growing, exacerbated by the global pandemic produced by the SARS-CoV-2 coronavirus  Situations of this gravity call for the development of preventive and educational measures for the responsible and sustainable use of ICT","Gmez-Galn, Jos, Martnez-Lpez, Jos ngel, Lzaro-Prez, Cristina; Sarasola Snchez-Serrano, Jos Luis","https://www.google.com/search?q=Social+Networks+Consumption+and+Addiction+in+College+Students+during+the+COVID-19+Pandemic:+Educational+Approach+to+Responsible+Use","","Database: COVIDWHO; Publication details: Sustainability;12(18):7737, 2020.; Publication details: Sustainability;12(18):7737, 2020.; Publication type: article","WHO","Undecided","","","","","","","","","","","","","False","False","","2020-09-25","",5144,""
"Impacts of Layoffs and Government Assistance on Mental Health during COVID-19: An Evidence-Based Study of the United States","This study evaluates the impact of unemployment and government financial assistance during the COVID-19 pandemic on the working-age population&rsquo;s mental health and further examines the differential impacts between urban and non-urban groups, as well as African American (AA) and non-African American groups  Based on the COVID-19 Household Impact Survey, four measures of mental health conditions (nervous, depressed, lonely, and hopeless) are constructed  Our empirical analysis applies the ordinal regression model (ordered logit model) that takes both the week and regional factors into consideration to control for potential time effects and time-invariant confounders varying across regions  The results show that government aid only mitigates the psychological symptoms for the group in non-urban areas, with no significant impacts on the urban group  On the other hand, the AA working-age group experiences similar or more favorable mental health than other ethnic groups, while government aid does not alleviate the mental pressure for the AA group  Therefore, government interventions should recognize the heterogeneity of impacts on socioeconomic groups within the target population","Fan, Haobin; Nie, Xuanyi","https://www.google.com/search?q=Impacts+of+Layoffs+and+Government+Assistance+on+Mental+Health+during+COVID-19:+An+Evidence-Based+Study+of+the+United+States","","Database: COVIDWHO; Publication details: Sustainability;12(18):7763, 2020.; Publication details: Sustainability;12(18):7763, 2020.; Publication type: article","WHO","Undecided","","","","","","","","","","","","","False","False","","2020-09-25","",5145,""
"Shifting to Remotely Delivered Mental Health Care: Quality Improvement in the COVID-19 Pandemic","This paper presents an organizational (ambulatory) case study of shifting mental health care from in-person to remote service delivery due to the current (COVID-19) pandemic as a rapid quality improvement initiative  Remotely delivered mental health care, particularly using synchronous video and phone, has been shown to be cost-effective, especially for rural service users  Our provincial specialized mental health clinic rapidly shifted to such remote delivery during the current pandemic  We report on processes and outputs of this rapid quality improvement initiative, which serves a purpose beyond pandemic circumstances, such as improving access to such specialized mental health care for rural and other service users at any time  In conclusion, shifting specialized mental health care from in-person to remotely delivered services as much as possible could be beneficial beyond the current pandemic  More research is needed to optimize the implementation of such a shift","Daigle, Patrick; Rudnick, Abraham","https://www.google.com/search?q=Shifting+to+Remotely+Delivered+Mental+Health+Care:+Quality+Improvement+in+the+COVID-19+Pandemic","","Database: COVIDWHO; Publication details: Psychiatry International;1(1):31-35, 2020.; Publication details: Psychiatry International;1(1):31-35, 2020.; Publication type: article","WHO","Undecided","","","","","","","","","","","","","False","False","","2020-09-25","",5146,""
"PROFESSIONAL BURNOUT, SYMPTOMS OF EMOTIONAL DISORDERS AND DISTRESS AMONG HEALTHCARE PROFESSIONALS DURING THE COVID-19 EPIDEMIC","The article presents the results of a synthesis by Australian and Canadian scientists (Kisely et al, 2020) of 59 reliable studies of the effects of work during various epidemics, including COVID-19, on mental health and well-being of medical workers in different countries  The research includes the level of professional burnout, symptoms of emotional ill-being, and distress data based on the analysis of a data sample from 248 involved healthcare professionals of Russian medical institutions  They anonymously and voluntarily filled up the Google-form that contained a methodical complex during the COVID-19 epidemic  The complex included: A  Beck Depression Scale, A  Beck Anxiety Scale, J  Goland Distress Rating Scale, K  Maslach Professional Burnout Inventory  The research showed that during the epidemic, most healthcare professionals experienced evidence of the professional burnout (60% complain of emotional exhaustion), moderate and severe indicators of depression (23%), moderate and severe anxiety indicators (25%)  Also, a suicidal trend was found (10%)  Negative emotions (fear of infection, loneliness and isolation sense), organizational problems (personal protective equipment deficit), physical discomfort (inconvenience of protective clothing, lack of sleep), and communicative difficulties have a great influence on the emotional distress of healthcare professionals  Information ""noise"" and personal protective equipment deficit often performs as a problem area  Healthcare professionals involved in supporting COVID-19 patients have higher rates of professional burnout, depression, and anxiety  At the same time, high professional responsibility and motivation are maintained by the majority of specialists providing care to patients with COVID-19  Region healthcare professionals differ from Moscow healthcare professionals by higher rates of depression and anxiety and frequently complain about personal protective equipment deficit, leadership mistrust, or disagreement with them","Petrikov, Sergey S.; Kholmogorova, Alla B.; Suroegina, Anastasiya Yu; Mikita, Olesya Yu; Roy, Anita P.; Rakhmanina, Anastasiya A.","https://doi.org/10.17759/cpp.2020280202","","Database: COVIDWHO; Publication details: Konsultativnaya Psikhologiya I Psikhoterapiya-Counseling Psychology and Psychotherapy;28(2):8-45, 2020.; Publication details: Konsultativnaya Psikhologiya I Psikhoterapiya-Counseling Psychology and Psychotherapy;28(2):8-45, 2020.; Publication type: article","WHO","Undecided","","","","","","","","","","","","","False","False","","2020-09-25","",5147,""
