"title","abstract","authors","link","date","subject","source","initial_decision","q0","q1","q2","q3","q4","q5","q6","q7","q8","q9","q10","q11","q12","q13","q14","q15","q16","q17","q18","q19","q20","exclusion_reason","extraction_date","expert_decision","ID","o1"
"Effects of COVID-19 pandemic and lockdown on lifestyle and mental health of students: A retrospective study from Karachi,Pakistan","Introduction: Due to the COVID-19 pandemic, many countries imposed lockdowns on their citizens in an attempt to contain the disease  Pakistan is one of these countries  A government mandated lockdown can have mitigating psychological effects on young adults, out of which a large fraction is made up of students  This study aims to investigate the correlations between changes in sleep pattern, perception of time, and digital media usage  Furthermore, it explores the impact of these changes on the mental health of students of different educational levels  Methods: This cross-sectional study was conducted via a web-based questionnaire, from March 24 to April 26, 2020  The survey was targeted at students and 251 responses were obtained  It was a 5-section long questionnaire  The first section inquired about demographics of participants  Each of the other 4 section were devoted to changes in sleep pattern, perception of time flow, digital media usage and mental health status of students  Close ended questions with multiple choice responses, dichotomous, interval and 4-point Likert scales were used in the construction of the survey questionnaire  Chi square, T-tests multinomial and binary logistic regression were used as primary statistical tests  All data were analyzed using Statistical Package for Social Science (SPSS) version 23 0 (IBM Corp , Armonk, NY)  Results: Out of 251 adolescents that participated in our study, the majority (70 2%) were females  The mean age of the participants was 19 40+/- 1 62 years  Two-thirds of the respondents did not have much trouble falling asleep (66 5%)  The analysis found no significant association between longer sleep periods and procrastination level (p = 0 054)  Nearly three-fourths (72 9%) of our participants felt that getting through quarantine would have been more difficult if they did not have any electronic gadgets  Of these, a majority (85 8%) had a general feeling of tiredness and lacked motivation (p = 0 023)  Additionally, a large number of students (69 7%) had reported that time is seemingly moving faster  A significant relationship between increased usage of electronic items and longer sleep periods was also noted (p = 0 005)  With respect to the level of education statistically significant values were noted for alarm use both before and after quarantine began (p = 0 021 and p = 0 004, respectively)  Further analysis showed that there was a significant difference in the median difference of time spent on social media before the outbreak (3 0+/-32 46) and time spent on social media after the outbreak (6 0+/-3 52) in a single day (p=0 000)  Conclusions: Our research has revealed that due to the lockdown imposed by the government in response to COVID-19, the sleeping patterns of the students was affected the most  Our findings show that the increase in use of social media applications led to a widespread increase in the length of sleep, worsening of sleep habits (people sleeping at much later hours than usual), and a general feeling of tiredness  A general lack of recollection regarding what day of the week it was, as well as a change in the perceived flow of time were also notable  All these findings indicate the decline in mental health of students due to the lockdown  Promoting better sleep routines, minimizing the use of digital media, and encouragement of students to take up more hobbies could collectively improve the health and mood of students in self quarantine  RÃ©sumÃ© Cette Ã©tude vise Ã  examiner la santÃ© mentale et le mode de vie des Ã©tudiants de Karachi, en surveillant les perturbations dans le rythme de leur sommeil, la perception du temps et l'utilisation des mÃ©dias numÃ©riques pendant la pandÃ©mie  Cette Ã©tude transversale a Ã©tÃ© menÃ©e au moyen d'un questionnaire en ligne, du 24 mars au 26 avril 2020  L'enquÃªte visait les Ã©tudiants et 251 rÃ©ponses ont Ã©tÃ© obtenues  Les deux tiers des rÃ©pondants n'avaient pas de difficultÃ© Ã  s'endormir (66 5 %)  PrÃ¨s des trois quarts (72 9 %) de nos participants ont estimÃ© que supporter la quarantaine aurait Ã©tÃ© plus difficile sans gadgets Ã©lectroniques  De plus, un grand nombre d'Ã©tudiants (69 7 %) ont indiquÃ© que le temps passe apparemment plus vite  En ce qui concerne le niveau d'Ã©ducation, des valeurs statistiquement significatives ont Ã©tÃ© notÃ©es pour l'utilisation de l'alarme avant et aprÃ¨s le dÃ©but de la quarantaine (p = 0 021 et p = 0 004, respectivement)  En outre, il y avait une diffÃ©rence significative dans la diffÃ©rence mÃ©diane du temps passÃ© sur les rÃ©seaux sociaux avant l'Ã©pidÃ©mie (3,0 +/- 32,46) et le temps passÃ© sur les rÃ©seaux sociaux pendant l'Ã©pidÃ©mie (6 0 +/- 3 52) en une seule journÃ©e (p = 0 000)  Nos rÃ©sultats montrent que l'augmentation de l'utilisation des applications de mÃ©dias sociaux a conduit Ã  une augmentation gÃ©nÃ©ralisÃ©e de la durÃ©e du sommeil, Ã  une aggravation des habitudes de sommeil et Ã  une sensation gÃ©nÃ©rale de fatigue  Tous ces rÃ©sultats indiquent le dÃ©clin de la santÃ© mentale des Ã©tudiants en raison de la quarantaine","Ali, Abraish, Siddiqui, Asad Ali, Arshad, Muhammad Sameer, Iqbal, Fizza, Arif, Taha Bin","https://doi.org/10.1016/j.amp.2021.02.004","","Database: COVIDWHO; Publication details: Annales MÃ©dico-psychologiques, revue psychiatrique;2021.; Publication details: Annales MÃ©dico-psychologiques, revue psychiatrique;2021.; Publication type: article","WHO","Undecided","","","","","","","","","","","","","False","False","","","","","False","False","False","","2021-02-19","",10843,""
"Atividades fÃ­sicas e os desafios da pandemia","The influence of the level of physical activity and human development in the quality of life in survivors of stroke  The Impact of Measures Recommended by the Government to Limit the Spread of Coronavirus (COVID-19) on Physical Activity Levels, Quality of Life, and Mental Health of Brazilians  Heart and Circulatory Physiology, 318(6), H1441-H1446  https:// doi org/10 1152/aipheart 00268 2020 World Health Organization","Aidar, Felipe J.; de Matos, Dihogo Gama","https://doi.org/10.6063/motricidade.22100","","Database: COVIDWHO; Publication details: Motricidade;16:1-3, 2020.; Publication details: Motricidade;16:1-3, 2020.; Publication type: article","WHO","Undecided","","","","","","","","","","","","","False","False","","","","","False","False","False","","2021-02-19","",10844,""
"Comparison of knowledge, attitude, socioeconomic burden, and mental health disorders of COVID-19 pandemic between general population and health care workers in Egypt","IntroductionThe global devastating effect of COVID-19 has caused anxiety and fear to variable extent among the public  We aimed to evaluate the knowledge, attitude, socioeconomic burden, and the mental health problems regarding anxiety, depression, and obsessive-compulsive disorder during COVID-19 on the general population and HCWs in Egypt MethodsThis study was conducted using a semi-structured online questionnaire in May 2020  Data on demographic features, socioeconomic scale, knowledge, and attitude regarding COVID-19 and the effect on different aspects of life were collected  Assessment was done using Arabic versions of Beckâ€™s Anxiety Inventory, Beckâ€™s Depression Inventoryâ€“II, and Yale-Brown Obsessive-Compulsive Scale  We divided participants into non-health care workers (non-HCWs) and HCWs groups ResultsThere were 524 participants who responded to the survey from 23 governorates  More than half of the participants were females (57 4%), middle age (53%), and middle socioeconomic class (66 6%)  Non-HCWs were 402 and HCWs were 122  Most participants had good knowledge about the disease and a positive attitude toward protective measures particularly in HCWs  COVID-19 showed negative impact on different aspects of participantsâ€™ life  HCWs had higher frequency of anxiety (32%) and OCD (29%) than non-HCWs (30% and 28%, respectively) while non-HCWs had higher depression (69%) than HCWs (66 4%)  HCWs had higher rates of severe depression (20 5%) with moderate and severe OCD (4 9%, 1 6% respectively) than non-HCWs  Female gender, young age, urban residence, students, smoking, history of medical illness, and low socioeconomic class were significant associated factors ConclusionsHealth care workers had good knowledge about COVID-19 and a positive attitude toward the protective measures relative to non-HCWs  COVID-19 had a negative impact on different aspects of life and had a major association with the anxiety, depression, and OCD in both groups  Health professionals are more likely to have these psychological consequences","Ahmed, Gellan K.; Ramadan, Haidi Karam-Allah, Refay, Samah Mohammed, Khashbah, Mohamed A.","https://doi.org/10.1186/s41983-021-00280-w","","Database: COVIDWHO; Publication details: The Egyptian Journal of Neurology, Psychiatry, and Neurosurgery;57(1), 2021.; Publication details: The Egyptian Journal of Neurology, Psychiatry, and Neurosurgery;57(1), 2021.; Publication type: article","WHO","Undecided","","","","","","","","","","","","","False","False","","","","","False","False","False","","2021-02-19","",10845,""
"Effects of the Disastrous Pandemic COVID 19 on Learning Styles, Activities and Mental Health of Young Indian Students - A Machine Learning Approach","Word Health Organization declared coronavirus disease 2019 (COVID-19) as pandemic on 11 March 2020  After that on 14 March 2020 the Ministry of Home Affairs, India decided to treat COVID-19 as a ""notified disaster"" due to the spurt in the cases related to coronavirus in the country, leading to a complete shut down from 24 March 2020  This has affected all sectors of the country including the education sector  The near-total closure of schools, colleges, and universities has disrupted academic activities at various levels  The objective of this online survey study is to understand the day to day living, activities, learning styles, and mental health of young students of India during this unprecedented crisis and assess how they are adapting to the new e-learning styles and how they are managing their social lives","Khattar, A.; Jain, P. R.; Quadri, S. M. K.; Ieee","https://www.google.com/search?q=Effects+of+the+Disastrous+Pandemic+COVID+19+on+Learning+Styles,+Activities+and+Mental+Health+of+Young+Indian+Students+-+A+Machine+Learning+Approach","","Database: COVIDWHO; Publication details: Proceedings of the International Conference on Intelligent Computing and Control Systems;: 1190-1195, 2020.; Publication details: Proceedings of the International Conference on Intelligent Computing and Control Systems;: 1190-1195, 2020.; Publication type: article","WHO","Undecided","","","","","","","","","","","","","False","False","","","","","False","False","False","","2021-02-19","",10846,""
"Pandemics Have Serious Psychological Implications for Nurses","The article discusses watching patients-or colleagues-suffer or die, not being able to protect with the right personal protective equipment about exposing loved ones, and the challenge of balancing all contribute to an immeasurable psychological burden for nurses  Topics include Preliminary studies are showing that COVID-19 has reduced sleep quality and increased stress, and depression;and Shah et al  provided a three-step process health care systems has used to support staffs psychological","Becze, Elisa","https://www.google.com/search?q=Pandemics+Have+Serious+Psychological+Implications+for+Nurses","","Database: COVIDWHO; Publication details: ONS Voice;36(2):16-17, 2021.; Publication details: ONS Voice;36(2):16-17, 2021.; Publication type: article","WHO","Undecided","","","","","","","","","","","","","False","False","","","","","False","False","False","","2021-02-19","",10847,""
"'The problem is greater than it's ever been': US universities urged to invest in mental-health resources","","Woolston, Chris","https://dx.doi.org/10.1038/d41586-021-00229-2","","Country: GB; REINO UNIDO; UNITED KINGDOM; REINO UNIDO; UK; GREAT BRITAIN; INGLATERRA; ENGLAND; ESCOCIA; SCOTLAND; Database: MEDLINE; Publication details: Nature;590(7844): 171-172, 2021 02.; Publication details: Nature;590(7844): 171-172, 2021 02.; Mental Health; Universities; Health Resources; Humans; Students; Publication type: article","WHO","Undecided","","","","","","","","","","","","","False","False","","","","","False","False","False","","2021-02-19","",10848,""
"Trends in US Pediatric Hospital Admissions in 2020 Compared With the Decade Before the COVID-19 Pandemic","Importance: In early 2020, the United States declared a public health emergency in response to coronavirus disease 2019 (COVID-19) and implemented a variety of social distancing measures. The association between the COVID-19 pandemic and the number of pediatric admissions is unclear. Objective: To determine the changes in patterns of pediatric admissions in 2020 compared with the prior decade. Design, Setting, and Participants: This cross-sectional study included 49 US hospitals contributing to the Pediatric Health Information Systems database. Inpatient admissions were transformed into time-series data, and ensemble forecasting models were generated to analyze admissions across a range of diagnoses in 2020 compared with previous years. The setting was inpatient admissions. All patients discharged between January 1, 2010, and June 30, 2020, from an inpatient hospital encounter were included. Main Outcomes and Measures: Number of hospital admissions by primary diagnosis for each encounter. Results: Of 5Ã¢<U+0080>Â¯424Ã¢<U+0080>Â¯688 inpatient encounters among 3Ã¢<U+0080>Â¯372Ã¢<U+0080>Â¯839 patients (median [interquartile range] age, 5.1 [0.7-13.3] years; 2Ã¢<U+0080>Â¯823Ã¢<U+0080>Â¯748 [52.1%] boys; 3Ã¢<U+0080>Â¯171Ã¢<U+0080>Â¯224 [58.5%] White individuals) at 49 hospitals, 213Ã¢<U+0080>Â¯571 (3.9%) were between January 1, 2020, and June 30, 2020. There was a decrease in the number of admissions beginning in March 2020 compared with the period from 2010 to 2019. At the nadir, admissions in April 2020 were reduced 45.4% compared with prior years (23Ã¢<U+0080>Â¯798 in April 2020 compared with a median [interquartile range] of 43Ã¢<U+0080>Â¯550 [42Ã¢<U+0080>Â¯110-43Ã¢<U+0080>Â¯946] in April 2010-2019). Inflation-adjusted hospital charges decreased 27.7% in the second quarter of 2020 compared with prior years ($4Ã¢<U+0080>Â¯327Ã¢<U+0080>Â¯580Ã¢<U+0080>Â¯511 in 2020 compared with a median [interquartile range] of $5Ã¢<U+0080>Â¯983Ã¢<U+0080>Â¯142Ã¢<U+0080>Â¯102 [$5Ã¢<U+0080>Â¯762Ã¢<U+0080>Â¯690Ã¢<U+0080>Â¯022-$6Ã¢<U+0080>Â¯324Ã¢<U+0080>Â¯978Ã¢<U+0080>Â¯456] in 2010-2019). Seasonal patterns were evident between 2010 and 2019 for a variety of common pediatric conditions, including asthma, atrial septal defects, bronchiolitis, diabetic ketoacidosis, Kawasaki syndrome, mental health admissions, and trauma. Ensemble models were able to discern seasonal patterns in admission diagnoses and accurately predicted admission rates from July 2019 until December 2019 but not from January 2020 to June 2020. All diagnoses except for birth decreased below the model 95% CIs between January 2020 and June 2020. Conclusions and Relevance: In this cross-sectional study, pediatric admissions to US hospitals decreased in 2020 across an array of pediatric conditions. Although some conditions may have decreased in incidence, others may represent unmet needs in pediatric care during the COVID-19 pandemic.","Pelletier, Jonathan H; Rakkar, Jaskaran; Au, Alicia K; Fuhrman, Dana; Clark, Robert S B; Horvat, Christopher M","https://dx.doi.org/10.1001/jamanetworkopen.2020.37227","","Country: US; ESTADOS UNIDOS; UNITED STATES; ESTADOS UNIDOS; USA; EUA; US; UNITED STATES OF AMERICA; ESTADOS UNIDOS DA AMERICA; EEUU; Database: MEDLINE; Publication details: JAMA Netw Open;4(2): e2037227, 2021 02 01.; Publication details: JAMA Netw Open;4(2): e2037227, 2021 02 01.; Publication type: article","WHO","Undecided","","","","","","","","","","","","","False","False","","","","","False","False","False","","2021-02-19","",10849,""
"Exposure to COVID-19-Related Information and its Association With Mental Health Problems in Thailand: Nationwide, Cross-sectional Survey Study","BACKGROUND: The COVID-19 pandemic has had a negative impact on both the physical and mental health of individuals worldwide. Evidence regarding the association between mental health problems and information exposure among Thai citizens during the COVID-19 outbreak is limited. OBJECTIVE: This study aimed to explore the relationship between information exposure and mental health problems during the COVID-19 pandemic in Thailand. METHODS: Between April 21 and May 4, 2020, we conducted a cross-sectional, nationwide online survey of the general population in Thailand. We categorized the duration of exposure to COVID-19-related information as follows: <1 h/day (reference group), 1-2 h/day, and &#8805;3 h/day. Mental health outcomes were assessed using the Patient Health Questionnaire-9, the Generalized Anxiety Disorder-7 scale, the Perceived Stress Scale-10, and the Insomnia Severity Index for symptoms of depression, anxiety, perceived stress, and insomnia, respectively. Multivariable logistic regression models were used to evaluate the relationship between information exposure and the risk of developing the aforementioned symptoms. An ancillary analysis using multivariable multinomial logistic regression models was also conducted to assess the possible dose-response relationship across the severity strata of mental health problems. RESULTS: Of the 4322 eligible participants, 4004 (92.6%) completed the online survey. Of them, 1481 (37.0%), 1644 (41.1%), and 879 (22.0%) participants were exposed to COVID-19-related information for less than 1 hour per day, 1 to 2 hours per day, or 3 or more hours per day, respectively. The major source of information related to the COVID-19 pandemic was social media (95.3%), followed by traditional media (68.7%) and family members (34.9%). Those exposed to information for 3 or more hours per day had a higher risk of developing symptoms of depression (adjusted odds ratio [OR] 1.35, 95% CI 1.03-1.76; P=.03), anxiety (adjusted OR 1.88, 95% CI 1.43-2.46; P<.001), and insomnia (adjusted OR 1.52, 95% CI 1.17-1.97; P=.001) than people exposed to information for less than 1 hour per day. Meanwhile, people exposed to information for 1 to 2 hours per day were only at risk of developing symptoms of anxiety (adjusted OR 1.35, 95% CI 1.08-1.69; P=.008). However, no association was found between information exposure and the risk of perceived stress. In the ancillary analysis, a dose-response relationship was observed between information exposure of 3 or more hours per day and the severity of mental health problems. CONCLUSIONS: These findings suggest that social media is the main source of COVID-19-related information. Moreover, people who are exposed to information for 3 or more hours per day are more likely to develop psychological problems, including depression, anxiety, and insomnia. Longitudinal studies investigating the long-term effects of COVID-19-related information exposure on mental health are warranted.","Mongkhon, Pajaree; Ruengorn, Chidchanok; Awiphan, Ratanaporn; Thavorn, Kednapa; Hutton, Brian; Wongpakaran, Nahathai; Wongpakaran, Tinakon; Nochaiwong, Surapon","https://dx.doi.org/10.2196/25363","","Country: CA; CANADÃ; CANADA; CANADA; Database: MEDLINE; Publication details: J Med Internet Res;23(2): e25363, 2021 02 12.; Publication details: J Med Internet Res;23(2): e25363, 2021 02 12.; Publication type: article","WHO","Undecided","","","","","","","","","","","","","False","False","","","","","False","False","False","","2021-02-19","",10850,""
"Debate: Gold standard or go for gold? The pros and cons of waiting for gold standard evidence of effectiveness for adolescent depression and self-harm interventions versus acting with the precautionary principle in current political times","There is increasing concern about the prevalence of depression and self-harm among children adolescents in many countries. Governments who commission and fund psychological interventions to address these difficulties want to know what is effective. The techniques available for synthesising gold standard evidence are increasingly sophisticated, but there are many criticisms of being completely reliant on this approach. A precautionary approach, where public policy decision-makers acknowledge that where the evidence is limited, the benefits of certain interventions are thought to outweigh the risks, including the risk of doing nothing. This later element may be particularly important in the domain of depression and self-harm, as both are associated with elevated risk of death by suicide.","Fortune, Sarah; Hetrick, Sarah","https://dx.doi.org/10.1111/camh.12442","","Country: GB; REINO UNIDO; UNITED KINGDOM; REINO UNIDO; UK; GREAT BRITAIN; INGLATERRA; ENGLAND; ESCOCIA; SCOTLAND; Database: MEDLINE; Publication details: Child Adolesc Ment Health;26(1): 83-85, 2021 Feb.; Publication details: Child Adolesc Ment Health;26(1): 83-85, 2021 Feb.; Publication type: article","WHO","Undecided","","","","","","","","","","","","","False","False","","","","","False","False","False","","2021-02-19","",10851,""
"Psychosocial predictors of virus and social distancing fears in undergraduate students living in a US COVID-19 ""hotspot""","The COVID-19 pandemic is positioned to exact a substantial mental health toll on the global population. Heightened fears of viral contamination and fears of the negative consequences of social distancing (e.g., fears related to home confinement, fears of loneliness and isolation) might contribute to the distress caused by the pandemic. Cross-sectional data were collected from undergraduates (N =Â 608) residing in a U.S. pandemic ""hotspot"" at the time of data collection (between 7 April to 9 May, 2020). Outcome variables included viral contamination fears and social distancing fears. Predictor variables included biological sex, underlying medical vulnerability, number of recent viral symptoms, presence of positive COVID-19 test in social network, anxiety, depression, stress, emotion dysregulation, intolerance of uncertainty, body vigilance, and health anxiety. Female sex, anxiety severity, intolerance of uncertainty, and health anxiety uniquely predicted fears of viral contamination. Female sex and depression severity uniquely predicted fears of social distancing. Multiple anxiety-related vulnerabilities are potential intervention targets for reducing viral contamination fears. Depression is a potential intervention target for social distancing fears. Females might be at greater risk for both types of fears.","Fedorenko, Erick J; Kibbey, Mindy M; Contrada, Richard J; Farris, Samantha G","https://dx.doi.org/10.1080/16506073.2020.1866658","","Country: GB; REINO UNIDO; UNITED KINGDOM; REINO UNIDO; UK; GREAT BRITAIN; INGLATERRA; ENGLAND; ESCOCIA; SCOTLAND; Database: MEDLINE; Publication details: Cogn Behav Ther;: 1-17, 2021 Feb 15.; Publication details: Cogn Behav Ther;: 1-17, 2021 Feb 15.; Publication type: article","WHO","Undecided","","","","","","","","","","","","","False","False","","","","","False","False","False","","2021-02-19","",10852,""
"Moving into 2021: Refocusing on the critical issues in child mental health","","Delaney, Kathleen R","https://dx.doi.org/10.1111/jcap.12307","","Country: GB; REINO UNIDO; UNITED KINGDOM; REINO UNIDO; UK; GREAT BRITAIN; INGLATERRA; ENGLAND; ESCOCIA; SCOTLAND; Database: MEDLINE; Publication details: J Child Adolesc Psychiatr Nurs;34(1): 5-6, 2021 Feb.; Publication details: J Child Adolesc Psychiatr Nurs;34(1): 5-6, 2021 Feb.; Publication type: article","WHO","Undecided","","","","","","","","","","","","","False","False","","","","","False","False","False","","2021-02-19","",10853,""
