"title","abstract","authors","link","date","subject","source","initial_decision","q0","q1","q2","q3","q4","q5","q6","q7","q8","q9","q10","q11","q12","q13","q14","q15","q16","q17","q18","q19","q20","q21","q22","q23","q24","q25","q26","q27","q28","q29","q30","q31","q32","q33","q34","q35","q36","q37","q38","q39","q40","q41","q42","q43","q44","q45","q46","q47","q48","q49","q50","q51","q52","q53","q54","q55","q56","q57","q58","q59","q60","q61","q62","q63","q64","q65","q66","q67","q68","q69","q70","q71","q72","q73","q74","q75","q76","q77","q78","q79","q80","exclusion_reason","extraction_date","expert_decision","ID","o1"
"Impact of the COVID-19 pandemic on remote mental healthcare and prescribing in psychiatry: an electronic health record study","The recent COVID-19 pandemic has disrupted mental healthcare delivery, with many services shifting from in-person to remote patient contact. We investigated the impact of the pandemic on the use of remote consultation and on the prescribing of psychiatric medications. The Clinical Record Interactive Search tool was used to examine deidentified electronic health records of people receiving mental healthcare from the South London and Maudsley (SLaM) NHS Foundation Trust. Data from the period before and after the onset of the pandemic were analysed using linear regression, and visualised using locally estimated scatterplot smoothing. All patients receiving care from SLaM between 7 January 2019 and 20 September 2020 (around 37 500 patients per week). (i) The number of clinical contacts (in-person, remote or non-attended) with mental healthcare professionals per week.(ii) Prescribing of antipsychotic and mood stabiliser medications per week. Following the onset of the pandemic, the frequency of in-person contacts was significantly reduced compared with that in the previous year (Î² coefficient: -5829.6 contacts, 95% CI -6919.5 to -4739.6, p&lt;0.001), while the frequency of remote contacts significantly increased (Î² coefficient: 3338.5 contacts, 95% CI 3074.4 to 3602.7, p&lt;0.001). Rates of remote consultation were lower in older adults than in working age adults, children and adolescents. Despite this change in the type of patient contact, antipsychotic and mood stabiliser prescribing remained at similar levels. The COVID-19 pandemic has been associated with a marked increase in remote consultation, particularly among younger patients. However, there was no evidence that this has led to changes in psychiatric prescribing. Nevertheless, further work is needed to ensure that older patients are able to access mental healthcare remotely.","Patel, Irving, Brinn, Broadbent, Shetty, Pritchard, Downs, Stewart, Harland, McGuire","https://doi.org/10.1136/bmjopen-2020-046365","20210331","epidemiology; health informatics; mental health; psychiatry; telemedicine","PubMed","Undecided","","","","","","","","","","","","","False","False","","","","","False","False","False","","False","False","False","False","False","False","False","False","False","","","","","","","","","","","","","","","","","","","","","","","","","","","","","","","","","","","","","","","","","","","","","","","","","","","","2021-04-01","",12537,""
"Probiotics in Prevention and Treatment of COVID-19: Current Perspective and Future Prospects","Saving lives and flattening the curve are the foremost priorities during the ongoing pandemic spread of SARS-CoV-2. Developing cutting-edge technology and collating available evidence would support frontline health teams. Nutritional adequacy improves general health and immunity to prevent and assuage infections. This review aims to outline the potential role of probiotics in fighting the COVID-19 by covering recent evidence on the association between microbiota, probiotics, and COVID-19, the role of probiotics as an immune-modulator and antiviral agent. The high basic reproduction number (R0) of SARS-CoV-2, absence of conclusive remedies, and the pleiotropic effect of probiotics in fighting influenza and other coronaviruses together favour probiotics supplements. However, further support from preclinical and clinical studies and reviews outlining the role of probiotics in COVID-19 are critical. Results are awaited from many ongoing clinical trials investigating the benefits of probiotics in COVID-19.","Kurian, Unnikrishnan, Miraj, Bagchi, Banerjee, Reddy, Rodrigues, Manu, Saravu, Mukhopadhyay, Rao","https://doi.org/10.1016/j.arcmed.2021.03.002","20210331","COVID-19; Coronavirus; Immunity; Microbiota; Probiotics; SARS-CoV-2","PubMed","Undecided","","","","","","","","","","","","","False","False","","","","","False","False","False","","False","False","False","False","False","False","False","False","False","","","","","","","","","","","","","","","","","","","","","","","","","","","","","","","","","","","","","","","","","","","","","","","","","","","","2021-04-01","",12538,""
"Meaningful activities during COVID-19 lockdown and association with mental health in Belgian adults","The spread of COVID-19 has affected people's daily lives, and the lockdown may have led to a disruption of daily activities and a decrease of people's mental health. To identify correlates of adults' mental health during the COVID-19 lockdown in Belgium and to assess the role of meaningful activities in particular. A cross-sectional web survey for assessing mental health (General Health Questionnaire), resilience (Connor-Davidson Resilience Scale), meaning in activities (Engagement in Meaningful Activities Survey), and demographics was conducted during the first Belgian lockdown between April 24 and May 4, 2020. The lockdown consisted of closing schools, non-essential shops, and recreational settings, employees worked from home or were technically unemployed, and it was forbidden to undertake social activities. Every adult who had access to the internet and lived in Belgium could participate in the survey; respondents were recruited online through social media and e-mails. Hierarchical linear regression was used to identify key correlates. Participants (Nâ€‰=â€‰1781) reported low mental health (Mâ€‰=â€‰14.85/36). In total, 42.4% of the variance in mental health could be explained by variables such as gender, having children, living space, marital status, health condition, and resilience (Î²â€‰=â€‰-.33). Loss of meaningful activities was strongly related to mental health (Î²â€‰=â€‰-.36) and explained 9% incremental variance (R<sup>2</sup> changeâ€‰=â€‰.092, pâ€‰&lt;â€‰.001) above control variables. The extent of performing meaningful activities during the COVID-19 lockdown in Belgium was positively related to adults' mental health. Insights from this study can be taken into account during future lockdown measures in case of pandemics.","Ellen, Patricia, Miet, Peter, Patrick, Robby, Kristine, Maria, Arnaud, Antonio, Judit, Laura, de Velde Dominique","https://doi.org/10.1186/s12889-021-10673-4","20210331","Corona; General health; Meaningful activities; Occupations; Resilience; Well-being","PubMed","Undecided","","","","","","","","","","","","","False","False","","","","","False","False","False","","False","False","False","False","False","False","False","False","False","","","","","","","","","","","","","","","","","","","","","","","","","","","","","","","","","","","","","","","","","","","","","","","","","","","","2021-04-01","",12539,""
"Changes in Workers' Sedentary and Physical Activity Behaviors in Response to the COVID-19 Pandemic and Their Relationships With Fatigue: Longitudinal Online Study","Sedentary behaviors and physical activity are likely to be affected by the COVID-19 outbreak, and sedentary lifestyles can increase subjective fatigue. The nonpharmaceutical policies imposed as a result of the COVID-19 pandemic may also have adverse effects on fatigue. This study has two aims: to examine the changes in sedentary behaviors and physical activity of company workers in response to the COVID-19 pandemic in Japan and to examine relationships between changes in these sedentary behaviors and physical activity and changes in fatigue. Data from a nationwide prospective online survey conducted in 2019 and 2020 were used. On February 22, 2019, an email with a link to participate in the study was sent to 45,659 workers, aged 20 to 59 years, who were randomly selected from a database of approximately 1 million individuals. A total of 2466 and 1318 participants, who self-reported their occupation as company workers, answered the baseline and follow-up surveys, respectively. Surveys captured fatigue, workday and daily domain-specific sedentary behaviors and physical activity, and total sedentary behaviors and physical activity. We used multivariable linear regression models to estimate associations of changes in sedentary behaviors and physical activity with changes in fatigue. Increases in public transportation sitting during workdays, other leisure sitting time during workdays, and other leisure sitting time were associated with an increase in the motivation aspect of fatigue (b=0.29, 95% CI 0-0.57, P=.048; b=0.40, 95% CI 0.18-0.62, P&lt;.001; and b=0.26, 95% CI 0.07-0.45, P=.007, respectively). Increases in work-related sitting time during workdays, total sitting time during workdays, and total work-related sitting time were significantly associated with an increase in the physical activity aspect of fatigue (b=0.06, 95% CI 0-0.12, P=.03; b=0.05, 95% CI 0.01-0.09, P=.02; and b=0.07, 95% CI 0-0.14, P=.04, respectively). The motivation and physical activity aspects of fatigue increased by 0.06 for each 1-hour increase in total sitting time between baseline and follow-up (b=0.06, 95% CI 0-0.11, P=.045; and b=0.06, 95% CI 0.01-0.10, P=.009, respectively). Our findings demonstrated that sedentary and active behaviors among company workers in Japan were negatively affected during the COVID-19 outbreak. Increases in several domain-specific sedentary behaviors also contributed to unfavorable changes in workers' fatigue. Social distancing and teleworking amid a pandemic may contribute to the sedentary lifestyle of company workers. Public health interventions are needed to mitigate the negative effects of the COVID-19 pandemic or future pandemics on sedentary and physical activity behaviors and fatigue among company workers.","Koohsari, Nakaya, McCormack, Shibata, Ishii, Oka","https://doi.org/10.2196/26293","20210331","COVID-19; Japan; mental health; physical inactivity; prospective design; sitting time","PubMed","Undecided","","","","","","","","","","","","","False","False","","","","","False","False","False","","False","False","False","False","False","False","False","False","False","","","","","","","","","","","","","","","","","","","","","","","","","","","","","","","","","","","","","","","","","","","","","","","","","","","","2021-04-01","",12540,""
"Patterns of Youth Inpatient Psychiatric Admissions Before and After the Onset of the COVID-19 Pandemic","To slow the spread of severe acute respiratory syndrome coronavirus 2, the virus causing 2019 novel coronavirus disease (COVID-19), many state authorities enforced extreme social distancing measures, such as closing schools, implementing online instruction, canceling major events, and limiting social contact outside families. Such measures have promoted safety but also have severely disrupted the lives of children of all ages. Many youths have missed seminal milestones; have struggled with the challenges of virtual schooling; and have isolated at home with their families, which has eroded opportunities for peer social support, relaxation, and enjoyment. While the consequences of COVID-19 on mental health are still unfolding, the psychological toll of these prolonged social distancing measures in combination with economic hardships and increased parental stress has led to worldwide reports of increased rates of mental health problems,<sup>1,2</sup> trauma, abuse,<sup>3,4</sup> and predicted increases in suicide<sup>5</sup> in youths.","Ugueto, Zeni","https://doi.org/10.1016/j.jaac.2021.02.006","20210331","","PubMed","Undecided","","","","","","","","","","","","","False","False","","","","","False","False","False","","False","False","False","False","False","False","False","False","False","","","","","","","","","","","","","","","","","","","","","","","","","","","","","","","","","","","","","","","","","","","","","","","","","","","","2021-04-01","",12541,""
"Mental health during the second wave of the covid-19 pandemic—polish studies","","","https://doi.org/10.3390/ijerph18073423","20210401","","Scopus","Undecided","","","","","","","","","","","","","False","False","","","","","False","False","False","","False","False","False","False","False","False","False","False","False","","","","","","","","","","","","","","","","","","","","","","","","","","","","","","","","","","","","","","","","","","","","","","","","","","","","2021-04-01","",12542,""
"Mental health of children and adolescents amidst covid-19 and past pandemics: A rapid systematic review","","","https://doi.org/10.3390/ijerph18073432","20210401","","Scopus","Undecided","","","","","","","","","","","","","False","False","","","","","False","False","False","","False","False","False","False","False","False","False","False","False","","","","","","","","","","","","","","","","","","","","","","","","","","","","","","","","","","","","","","","","","","","","","","","","","","","","2021-04-01","",12543,""
"Portuguese nurses’ stress, anxiety, and depression reduction strategies during the covid-19 outbreak","","","https://doi.org/10.3390/ijerph18073490","20210401","","Scopus","Undecided","","","","","","","","","","","","","False","False","","","","","False","False","False","","False","False","False","False","False","False","False","False","False","","","","","","","","","","","","","","","","","","","","","","","","","","","","","","","","","","","","","","","","","","","","","","","","","","","","2021-04-01","",12544,""
"NHS staff mental health status in the active phase of the COVID-19 era: A staff survey in a large London hospital","","","https://doi.org/10.1136/gpsych-2020-100368","20210319","","Scopus","Undecided","","","","","","","","","","","","","False","False","","","","","False","False","False","","False","False","False","False","False","False","False","False","False","","","","","","","","","","","","","","","","","","","","","","","","","","","","","","","","","","","","","","","","","","","","","","","","","","","","2021-04-01","",12545,""
"Problematic Use of Digital Technologies and Its Impact on Mental Health During COVID-19 Pandemic: Assessment Using Machine Learning","","","https://doi.org/10.1007/978-3-030-67716-9_13","20210101","","Scopus","Undecided","","","","","","","","","","","","","False","False","","","","","False","False","False","","False","False","False","False","False","False","False","False","False","","","","","","","","","","","","","","","","","","","","","","","","","","","","","","","","","","","","","","","","","","","","","","","","","","","","2021-04-01","",12546,""
"Stress and Sleep Across the Onset of the COVID-19 Pandemic: Impact of Distance Learning on US College Students’ Health Trajectories","Study Objectives. This study examined associations between average and intraindividual trajectories of stress, sleep duration, and sleep quality in college students before and after transitioning to online learning due to the COVID-19 pandemic. Methods. Two hundred and one first-year college students answered twice-weekly questionnaires assessing stress exposure, sleep duration, and sleep quality from January until May, 2020 (N= 4,278 unique observations). Results. Multilevel growth modeling revealed that prior to distance learning, student stress was increasing and sleep duration and quality were decreasing. After transitioning online, students’ stress immediately and continuously decreased; sleep quality initially increased but decreased over time; and sleep duration increased but then plateaued for the remainder of the semester. Days with higher stress than typical for that student were associated with lower sleep quality, and higher average stress exposure was linked with shorter sleep duration and lower sleep quality. Specific demographics (e.g., females) were identified as at-risk for stress and sleep problems. Conclusions. Although remote learning initially alleviated college students’ stress and improved sleep, these effects plateaued, and greater exposure to academic, financial, and interpersonal stressors predicted worse sleep on both daily and average levels. Environmental stressors may particularly dictate sleep quality during times of transition, but changes in learning modalities may mitigate short-term detrimental health outcomes, even during a developmental period with considerable stress vulnerability. Future studies should examine the longer-term implications of these trajectories on mental and physical health.","Michaela S Gusman et al.","https://share.osf.io/preprint/460CA-CA7-239","20210401","PsyArXiv|Social and Behavioral Sciences; PsyArXiv|Social and Behavioral Sciences|Clinical Psychology; PsyArXiv|Social and Behavioral Sciences|Developmental Psychology; PsyArXiv|Social and Behavioral Sciences|Developmental Psychology|Adolescence; PsyArXiv|Social and Behavioral Sciences|Developmental Psychology|Early Adulthood; PsyArXiv|Social and Behavioral Sciences|Health Psychology; PsyArXiv|Social and Behavioral Sciences|Health Psychology|Health-related Behavior; PsyArXiv|Social and Behavioral Sciences|Health Psychology|Mental Health; PsyArXiv|Social and Behavioral Sciences|Health Psychology|Social health; PsyArXiv|Social and Behavioral Sciences|Health Psychology|Stress; college students; sleep; pandemic; stress; sleep quality; covid-19; sleep duration; ecological momentary assessment","PsyArXiv","Undecided","","","","","","","","","","","","","False","False","","","","","False","False","False","","False","False","False","False","False","False","False","False","False","","","","","","","","","","","","","","","","","","","","","","","","","","","","","","","","","","","","","","","","","","","","","","","","","","","","2021-04-01","",12547,""
"Personal and caregiver resilience relate to lower internalizing symptoms among Peruvian adolescents during COVID19 lockdown","The COVID-19 pandemic has touched the lives of adolescents around the world. This longitudinal, observational study followed 1,334 adolescents (11 - 17 yo) to investigate whether personal and/or caregiver resilience relates to changes in internalizing symptoms during six stressful weeks of COVID-19 lockdown in Perú. In this work, we contextualize socio-ecological resilience in relation to culturally-relevant personal and caregiver resources that youth can use to adapt to stressful situations. We found that adolescents who reported higher levels of personal, caregiver, and overall resilience had lower levels of anxiety and depression at week six. We also find that personal, caregiver and overall resilience moderated the change in anxiety across the five week period of lockdown.","Victoria Guazzelli Williamson et al.","https://share.osf.io/preprint/46141-BFB-ABE","20210401","PsyArXiv|Social and Behavioral Sciences; PsyArXiv|Social and Behavioral Sciences|Developmental Psychology; PsyArXiv|Social and Behavioral Sciences|Developmental Psychology|Adolescence","PsyArXiv","Undecided","","","","","","","","","","","","","False","False","","","","","False","False","False","","False","False","False","False","False","False","False","False","False","","","","","","","","","","","","","","","","","","","","","","","","","","","","","","","","","","","","","","","","","","","","","","","","","","","","2021-04-01","",12548,""
