"title","abstract","authors","link","date","subject","source","initial_decision","q0","q1","q2","q3","q4","q5","q6","q7","q8","q9","q10","q11","q12","q13","q14","q15","q16","q17","q18","q19","q20","q21","q22","q23","q24","q25","q26","q27","q28","q29","q30","q31","q32","q33","q34","q35","q36","q37","q38","q39","q40","q41","q42","q43","q44","q45","q46","q47","q48","q49","q50","q51","q52","q53","q54","q55","q56","q57","q58","q59","q60","q61","q62","q63","q64","q65","q66","q67","q68","q69","q70","q71","q72","q73","q74","q75","q76","q77","q78","q79","q80","exclusion_reason","extraction_date","expert_decision","ID","o1"
"""We All Held Our Own"": Job Demands and Resources at Individual, Leader, Group, and Organizational Levels During COVID-19 Outbreak in Health Care A Multi-Source Qualitative Study","Interventions tackling COVID-19 impact on health care workers' mental health would benefit from being informed by validated and integrated assessment frameworks. This study aimed to explore the fitness of integrating the Job Demands-Resources (JD-R) model and the Individual-Group-Leader-Organization (IGLO) framework to investigate the pandemic's impact on health care workers' mental health. Qualitative data were collected via 21 semi-structured interviews with senior and middle managers and four focus groups with employees (doctors, nurses, health care assistants) from three areas (Department of Emergency, Department of Medicine, Research Institute of Neuroscience) of a large health care institution facing the first wave of COVID-19. NVivo deductive content analysis of text data was performed. Several COVID-19-related job demands and resources were found at IGLO levels. Individual-level demands included emotional load, while resources included resilience and motivation. Group-level demands included social distancing, while resources included team support and cohesion. Leader-level demands included managers' workload, while resources included leader support. Organizational-level demands included work reorganization, while resources included mental health initiatives. Integrating JD-R and IGLO proved feasible, as job demands and resources could be categorized according to the individual, group, leader, and organization framework. The findings expand previous studies by filling the lack of knowledge on how job demands and resources might unfold at different workplace levels during a pandemic. Results provide unit-level evidence for designing and implementing multilevel interventions to manage health care workers' mental health during COVID-19 and future pandemics. Our findings offer occupational health practitioners a suitable approach to perform workplace mental health assessment activities.","Giusino, De Angelis, Mazzetti, Christensen, Innstrand, Faiulo, Chiesa","https://doi.org/10.1177/21650799211038499","20211007","COVID-19; IGLO; JD-R; health care; workplace mental health","PubMed","Undecided","","","","","","","","","","","","","False","False","","","","","False","False","False","","False","False","False","False","False","False","False","False","False","","","","","","","","","","","","","","","","","","","","","","","","","","","","","","","","","","","","","","","","","","","","","","","","","","","","2021-10-08","",18652,""
"Telehealth genetic services during the COVID-19 Pandemic: Implementation and patient experiences across multiple specialties in Nebraska","The COVID-19 pandemic has altered the delivery of genetics services. In response to the pandemic, our genetics department offered telehealth visits to all outpatients, regardless of their physical proximity to Omaha, Nebraska. Traditionally, our department did not offer telehealth visits to patient's homes or to patients who lived in close proximity to a genetics clinic. Therefore, we designed a survey to gain insight into the patient experience with remote genetic counseling appointments during the pandemic. Any patient referred to see a genetics provider in pediatrics, prenatal, adult, or cancer between March 16, 2020 and October 28, 2020 was eligible for the study. The survey included both quantitative and qualitative measures to assess patient demographics, patient experience, stressors during the COVID-19 pandemic, and anxiety and depression. We hypothesized that patients would report they received quality care by telehealth despite the presence of COVID-19-related stressors or anxiety/depression. From the 143 survey participants, 80% had their first telehealth appointment during the pandemic. The vast majority (96%) reported that they felt like they received quality care by telehealth. Additionally, more than 93% of participants strongly or somewhat agreed that their genetic providers were attentive to their emotional needs, medical needs, and privacy. Since March 2020, participants reported experiencing several COVID-19-related stressors including fear of illness (86%), feelings of isolation (45%), and safety concerns (33%). Relatively low levels of depressive and anxiety symptoms were recorded using the HADS questionnaire. Despite the prevalence of COVID-19 stressors, depression, and/or anxiety, our participants felt they received quality care via telehealth. In fact, 51% agree that they prefer to receive future genetics services virtually. These results suggest the value of telehealth as an alternative service delivery model, even for local patients, and should be offered for future appointments, beyond the COVID-19 pandemic.","Rezich, Malone, Reiser, Zimmerman, Blase, Fishler","https://doi.org/10.1002/jgc4.1507","20211007","COVID-19; genetic counseling; genetics services; program evaluation; public health; service delivery models; telehealth","PubMed","Undecided","","","","","","","","","","","","","False","False","","","","","False","False","False","","False","False","False","False","False","False","False","False","False","","","","","","","","","","","","","","","","","","","","","","","","","","","","","","","","","","","","","","","","","","","","","","","","","","","","2021-10-08","",18653,""
"Anxiety and psychosocial impact during coronavirus disease 2019 in home dialysis patients","The severe acute respiratory syndrome coronavirus (SARS-Cov-2) resulting in the coronavirus disease 2019 (COVID-19) is documented to have a negative psychosocial impact on patients. Home dialysis patients may be at risk of additional isolating factors affecting their mental health. The aim of this study is to describe levels of anxiety and quality of life during the COVID-19 pandemic among home dialysis patients. This is a single-centre survey of home dialysis patients in Toronto, Ontario. Surveys were sent to 98 home haemodialysis and 43 peritoneal dialysis patients. Validated instruments (Haemodialysis and Peritoneal Dialysis Treatment Satisfaction Questionnaire, Generalized Anxiety Disorder 7 Item [GAD7] Scale, Patient Health Questionnaire [PHQ-9], Illness Intrusiveness Ratings Scale, Family APGAR Questionnaire and The Self Perceived Burden Scale) assessing well-being were used. Forty of the 141 patients surveyed, participated in September 2020. The mean age was 53.1Ã¢â‚¬â€°Ã‚Â±Ã¢â‚¬â€°12.1Ã¢â‚¬â€°years, with 60% male, and 85% home haemodialysis, 80% of patients rated their satisfaction with dialysis at 8/10 or greater, 82% of respondents reported either ""not at all"" or ""for several days"" indicating frequency of anxiety and depressive symptoms, 79% said their illness minimally or moderately impacted their life, 76% of respondents were almost always satisfied with interactions with family members, 91% were never or sometimes worried about caregiver burden. Among our respondents, there was no indication of a negative psychosocial impact from the pandemic, despite the increased social isolation. Our data further supports the use of home dialysis as the optimal form of dialysis.","Davis, Alqarni, McGrath-Chong, Bargman, Chan","https://doi.org/10.1111/nep.13978","20211007","dialysis; home haemodialysis; peritoneal dialysis","PubMed","Undecided","","","","","","","","","","","","","False","False","","","","","False","False","False","","False","False","False","False","False","False","False","False","False","","","","","","","","","","","","","","","","","","","","","","","","","","","","","","","","","","","","","","","","","","","","","","","","","","","","2021-10-08","",18654,""
"Association between COVID-19 and anxiety during social isolation: A systematic review","The uncertainties about coronavirus disease 2019 (COVID-19), the change in routine, lifestyles and the reduction of physical contact can cause stress, anxiety, emotional overload, poor sleep and even physical health complications. To evaluate the scientific publications available on the relationship between COVID-19 and anxiety experienced in the general population, during the period of social isolation, adopted by governmental organizations and public health policymakers as a measure to contain the spread of cases. A literature search was performed systematically exploring the PubMed and Medline databases using the following terms classified as MeSH descriptors: (""anxiety"" AND ""pandemic"" AND ""COVID-19""). For the search, in the <i>Biblioteca Virtual em SaÃƒÂºde</i> - BVS, Science.gov, Web of Science and National Library platforms, the following keywords were used: (""anxiety"" AND ""coronavirus"" AND ""social isolation""). Thirty-seven peer-reviewed articles were found. PRISMA and the Downs &amp; Black checklist were used for qualitative evaluation. After applying the inclusion criteria, seven (<i>n</i> = 7) original scientific articles were selected. The collated evidence demonstrated increased levels of symptoms of anxiety and depression during the period of social isolation. The population between 21 to 40 years was most affected. The risk of severe depression was twice as high at the epicenter of the pandemic. Sleep quality was significantly impaired. Questions about politics, religion, and consumption of products from China were found to generate fear and anticipate probable changes in the pattern of post-pandemic consumption. Social isolation exacerbated feelings of extreme hopelessness, sadness, loneliness and suicidal ideation. We conclude that there is a potential relationship between social isolation during the COVID-19 pandemic and symptoms of anxiety. It is important to note that the direct and indirect costs of not identifying the detrimental effects of this phenomenon and neglecting strategies for intervention could lead to a significant psychological burden on society in several aspects after social isolation.","Dos Santos, Silva de Paula, Tardieux, Costa-E-Silva, Lal, Leite","https://doi.org/10.12998/wjcc.v9.i25.7433","20211007","Anxiety; COVID-19; Mental health; Pandemic; Public health; Social isolation","PubMed","Undecided","","","","","","","","","","","","","False","False","","","","","False","False","False","","False","False","False","False","False","False","False","False","False","","","","","","","","","","","","","","","","","","","","","","","","","","","","","","","","","","","","","","","","","","","","","","","","","","","","2021-10-08","",18655,""
"Knowledge, Anxiety, Depression, and Sleep Quality Among Medical Staff in Central South Areas of China During the Break of COVID-19: Does the Level of Hospitals Make a Difference?","<b>Purpose:</b> To evaluate the knowledge, anxiety, depression, and sleep quality toward COVID-19 among Chinese medical staff from tertiary and basic-level hospitals in central south areas of China. <b>Method:</b> A structured questionnaire was composed of Demographic and clinical characteristics of medical staff, Knowledge toward COVID-19 including epidemiology and clinical manifestations, The Self-rating anxiety scale (SAS), Center for Epidemiologic Studies Depression Scale (CES-D), and The Pittsburgh Sleep Quality Index (PSQI). It was administered to medical staff from tertiary hospitals (Group A) (<i>n</i> = 407) and basic-level hospitals (Group B) (<i>n</i> = 388) during February 2020 and May 2020. <b>Results:</b> Medical staff in group A had a stronger knowledge toward COVID-19 than group B (23.69 Ã‚Â± 5.83 &amp; 18.15 Ã‚Â± 6.35, <i>p</i> &lt; 0.001). Mild anxiety symptoms were found in both groups. The SAS scores (Mean Ã‚Â± SD) of group B were 58.87 Ã‚Â± 10.17, which was significantly higher than that of group A (52.59 Ã‚Â± 12.09, <i>p</i> &lt; 0.001). There were no significant differences in CES-D scores between the two groups (<i>p</i> = 0.981). The mean score of total PSQI in group B (8.41 Ã‚Â± 3.03) was statistically higher than that of group A (7.31 Ã‚Â± 3.74, <i>p</i> &lt; 0.001). Additionally, the scores of sub-components of group B, including subjective sleep quality, sleep latency, sleep disorder, sleeping medication use and daytime dysfunction, were significantly higher compared to Group A (<i>p</i> &lt; 0.05). <b>Conclusions:</b> Our study showed greater anxiety, more severe depression and poorer sleep quality among medical staff in central south areas of China during the COVID-19 outbreak. Additionally, compared to the tertiary hospital group, medical staff from basic-level hospitals had poorer knowledge toward COVID-19 and worse mental health conditions. In addition, residence, specialty, title and education level may also be factors of knowledge of COVID-19 and psychiatry problems. In light of this information, more attention should be paid to early identification and intervention of symptoms of anxiety and depression in susceptible medical staff from the basic-level hospitals.","Yang, Shi, Chi, Qiao, Wu, Zhu, Xiao, Feng, Wang","https://doi.org/10.3389/fpsyt.2021.714870","20211007","COVID-19; anxiety; depression; knowledge; medical staff; sleep quality","PubMed","Undecided","","","","","","","","","","","","","False","False","","","","","False","False","False","","False","False","False","False","False","False","False","False","False","","","","","","","","","","","","","","","","","","","","","","","","","","","","","","","","","","","","","","","","","","","","","","","","","","","","2021-10-08","",18656,""
"Brief Report: A Cross-Sectional Study of Anxiety Levels and Concerns of Chinese Families of Children With Special Educational Needs and Disabilities Post-first-wave of COVID-19","The COVID-19 pandemic has a multifaceted impact on mental health due to ill health, restrictions and lockdowns, and loss of employment and institutional support. COVID-19 may disproportionally impact families with special educational needs and disabilities (SEND) due to the already higher prevalence of mental health conditions in children with SEND and their parents. Therefore, it is essential to determine the short-term impact of the pandemic on the mental health of families with SEND in order to identify their ongoing health support needs. The current study aims to examine the anxiety level and concerns of children with SEND and their parents living in China. The sample consisted of 271 parents of children with SEND aged between 6 and 17 years (<i>M</i> <sub><i>age</i></sub> = 8.37; <i>SD</i> <sub><i>age</i></sub> = 2.76). Parents completed an online survey between 10 April to 8 June 2020. Both child and parental anxiety levels and various concerns increased after the initial wave of COVID-19 when compared with retrospective pre-COVID-19 levels. Parental anxiety and concern levels were significantly higher for those living in rural areas compared to urban areas. In addition, parental and child anxiety and concern levels were significantly correlated with each other. Parental anxiety at the lowest level made a unique and significant statistical contribution to children's anxiety levels. The implications of the study findings are discussed.","Su, Cai, UljareviÃ„â€¡, Van Herwegen, Dukes, Yang, Peng, Samson","https://doi.org/10.3389/fpsyt.2021.708465","20211007","COVID-19; China; SEND; anxiety; children; pandemic","PubMed","Undecided","","","","","","","","","","","","","False","False","","","","","False","False","False","","False","False","False","False","False","False","False","False","False","","","","","","","","","","","","","","","","","","","","","","","","","","","","","","","","","","","","","","","","","","","","","","","","","","","","2021-10-08","",18657,""
"The Association Between Financial Hardship and Mental Health Difficulties Among Adult Wage Earners During the COVID-19 Pandemic in Bangladesh: Findings From a Cross-Sectional Analysis","<b>Background:</b> The ongoing COVID-19 pandemic has created several challenges including financial burdens that may result in mental health conditions. This study was undertaken to gauge mental health difficulties during the COVID-19 pandemic and gain an insight into wage earners' mental health. <b>Method:</b> This cross-sectional study was conducted through an online survey. A t total of 707 individual Bangladeshi wage earners were enrolled between 20 and 30 May 2020. The questionnaire had sections on sociodemographic information, COVID-19 related questions, PHQ-9 and GAD-7 scales. STATA version 14.1 program was used to carry out all the analyses. <b>Results:</b> The study revealed that 58.6 and 55.9% of the respondents had moderate to severe anxiety and depressive symptoms, respectively. The total monthly income was &lt;30,000 BDT (353.73USD) and displayed increased odds of suffering from depressive symptoms (OR = 4.12; 95% CI: 2.68-6.34) and anxiety (OR = 3.31; 95% CI: 2.17-5.03). Participants who did not receive salary income, had no income source during the pandemic, had financial problems, and inadequate food supply and were more likely to suffer from anxiety and depressive symptoms (<i>p</i> Ã¢â€°Â¤ 0.01). Perceiving the upcoming financial crisis as a stressor was a potential risk factor for anxiety (OR = 1.91; 95% CI:1.32-2.77) and depressive symptoms (OR = 1.50; 95% CI:1.04-2.16). <b>Limitations:</b> The online survey method used in this study limits the generalizability of the findings and self-reported answers might include selection and social desirability bias as a community-based survey was not possible during the pandemic. <b>Conclusion:</b> Wage earners in a low resource setting like Bangladesh require mental health attention and financial consideration to deal with mental health difficulties.","Sultana, Khan, Hossain, Islam, Hasan, Ahmed, Li, Khan","https://doi.org/10.3389/fpsyt.2021.635884","20211007","Bangladesh; COVID-19; anxiety; depressive symptoms; financial crisis; wage earners","PubMed","Undecided","","","","","","","","","","","","","False","False","","","","","False","False","False","","False","False","False","False","False","False","False","False","False","","","","","","","","","","","","","","","","","","","","","","","","","","","","","","","","","","","","","","","","","","","","","","","","","","","","2021-10-08","",18658,""
"Suicidality in Bangladeshi Young Adults During the COVID-19 Pandemic: The Role of Behavioral Factors, COVID-19 Risk and Fear, and Mental Health Problems","It is said that psychological stressors have risen during the COVID-19 pandemic, which may contribute to suicidality. A fewÃ‚Â studies were conducted investigating suicidality amid the first wave of the pandemic in Bangladesh, but none of these studies explored the predictive role of the suicidality-related factors (eg, behavior and health-related variables, COVID-19 risk, fear of COVID-19). Thus, this study aimed to investigate the prevalence of suicidality and the predictive models explaining suicidality variance among Bangladeshi young adults during the second wave of the pandemic. An online-based cross-sectional survey was conducted during the second wave of the pandemic (between 1 and 13 April 2021; a year after the pandemic's inception in the country). The survey questionnaire collected information on socio-demographics, behavior and health-related variables, COVID-19 risk, fear of COVID-19, depression, anxiety, and suicidality. A total of 756 data were analyzed (male 59%; mean age 22.24 Ã‚Â±4.39 years), and hierarchical regression was performed considering suicidality as the dependent variable. A <i>p</i>-value &lt;0.05 was set to be statistically significant with a 95%Ã‚Â of confidence interval. About 8.2% reported having at least suicidal thoughts within the pandemic inception to survey time (one-year suicidal ideation). More specifically, 7.40% had only suicidal ideation, whereas 0.10% planned for suicide, 0.70% attempted suicide. None of the socio-demographic variables was significantly associated with suicidality. Taking drugs, performing less physical activity, poor self-reporting health condition, being comorbid, being at higher COVID-19 risk, having fear of COVID-19 infection, and suffering from depression and anxiety were significantly associated with a higher risk of suicidality. However, the final model including all of the studied variables explained a 17.1% (F=8.245, <i>p</i>&lt;0.001) variance in terms of suicidality. Although this study reported a lower severity of suicidality than prior Bangladeshi studies conducted during the first wave of the pandemic, a portion of people are still at risk of suicide and they should be given attention.","Mamun, Al Mamun, Hosen, Hasan, Rahman, Jubayar, Maliha, Abdullah, Sarker, Kabir, Jyoti, Kaggwa, Sikder","https://doi.org/10.2147/RMHP.S330282","20211007","Bangladeshi youths; COVID-19 suicide; depression; fear of COVID-19; psychological impact; self-harm; suicide","PubMed","Undecided","","","","","","","","","","","","","False","False","","","","","False","False","False","","False","False","False","False","False","False","False","False","False","","","","","","","","","","","","","","","","","","","","","","","","","","","","","","","","","","","","","","","","","","","","","","","","","","","","2021-10-08","",18659,""
"Reliable and comprehensive assessment of post-traumatic stress disorder is required to provide population-based prevention and treatment of PTSD during the COVID-19 pandemic","","Ghassemi","https://doi.org/10.1136/ebnurs-2020-103388","20211007","anxiety disorders; mental health; nursing research; physicians; public health","PubMed","Undecided","","","","","","","","","","","","","False","False","","","","","False","False","False","","False","False","False","False","False","False","False","False","False","","","","","","","","","","","","","","","","","","","","","","","","","","","","","","","","","","","","","","","","","","","","","","","","","","","","2021-10-08","",18660,""
"Resilience, coping, and distress among healthcare service personnel during the COVID-19 pandemic","The COVID-19 pandemic has a detrimental effect on the health and well-being of health care workers (HCWs). The extent to which HCWs may differ in their experience of depression and anxiety is unclear, and longitudinal studies are lacking. The present study examined theorized differences in distress between resilient and non-resilient HCWs over time, as reported in a national online survey. We also examined possible differences in distress as a function of sex and doctoral-level status. A national sample responded to an online survey data that included the study measures. Of the HCWs who responded, 666 had useable data at the two time points. A longitudinal structural equation model tested an a priori model that specified the relationship of a resilient personality prototype to self-reported resilience, coping, depression and anxiety at both measurement occasions. Additional invariance models examined possible differences by sex and doctoral-level status. The final model explained 46.4% of the variance in psychological distress at Time 1 and 69.1% at Time 2. A non-resilient personality prototype predicted greater depression and anxiety. A resilient personality prototype was predictive of and operated through self-reported resilience and less disengaged coping to effect lower distress. No effects were found for active coping, however. The final model was generallyÃ‚Â invariant by sex and HCWs status. Additional analyses revealed that non-doctoral level HCWs had significantly higher depression and anxiety than doctoral-level HCWs on both occasions. HCWs differ in their susceptibility to distress imposed by COVID-19. Those who are particularly vulnerable may have characteristics that contribute to a lower sense of confidence and efficacy in stressful situations, and more likely to rely on ineffective, disengaged coping behaviors that can exacerbate stress levels. Individual interventions and institutional policies may be implemented to support HCWs at risk.","Elliott, Perrin, Bell, Powers, Warren","https://doi.org/10.1186/s12888-021-03506-6","20211007","Anxiety; COVID-19; Coping; Depression; Healthcare workers; Resilience","PubMed","Undecided","","","","","","","","","","","","","False","False","","","","","False","False","False","","False","False","False","False","False","False","False","False","False","","","","","","","","","","","","","","","","","","","","","","","","","","","","","","","","","","","","","","","","","","","","","","","","","","","","2021-10-08","",18661,""
