"title","abstract","authors","link","date","subject","source","initial_decision","q0","q1","q2","q3","q4","q5","q6","q7","q8","q9","q10","q11","q12","q13","q14","q15","q16","q17","q18","q19","q20","q21","q22","q23","q24","q25","q26","q27","q28","q29","q30","q31","q32","q33","q34","q35","q36","q37","q38","q39","q40","q41","q42","q43","q44","q45","q46","q47","q48","q49","q50","q51","q52","q53","q54","q55","q56","q57","q58","q59","q60","q61","q62","q63","q64","q65","q66","q67","q68","q69","q70","q71","q72","q73","q74","q75","q76","q77","q78","q79","q80","exclusion_reason","extraction_date","expert_decision","ID","o1"
"""I had no life I was only existing"" Factors shaping the mental health and wellbeing of people experiencing long Covid: a qualitative study","Background Around one in 10 people who have COVID-19 report persistent symptoms or ""long Covid"". Impaired mental health and wellbeing is commonly reported including anxiety, depression and reduced quality of life. There is however, limited in-depth research exploring why mental health and wellbeing have been impacted among people experiencing long Covid. Aims To explore factors impacting mental health and wellbeing, from the perspective of people with long Covid. Method Semi-structured qualitative interviews that were audio-recorded and transcribed. Data were analysed using reflexive thematic analysis. 21 people with long Covid participated in the study. Participants were eligible to take part if they self-reported a positive swab test/antibody test, or one or more commonly reported COVID-19 symptoms at illness onset and experiences of one or more long Covid symptom three or more weeks following illness onset. Results Five themes were identified across participant accounts regarding factors impacting mental health and wellbeing including i) experiences of care and understanding from others; ii) lack of service and treatment options; iii) severe disruption to daily life iv) uncertainty of illness trajectories and v) changes to identity. Conclusions People with long Covid experience a range of factors that negatively impact their mental health and wellbeing. Providing patient centred health services that integrate the rapidly evolving research in this area is important, as are peer support groups and supported approaches to self-management.","Alexandra Burton; Henry Aughterson; Daisy Fancourt; Keir Elmslie James Philip","https://medrxiv.org/cgi/content/short/2021.10.13.21264855","20211017","","medRxiv","Undecided","","","","","","","","","","","","","False","False","","","","","False","False","False","","False","False","False","False","False","False","False","False","False","","","","","","","","","","","","","","","","","","","","","","","","","","","","","","","","","","","","","","","","","","","","","","","","","","","","2021-10-18","",18903,""
"Mental health during the covid-19 crisis in africa: A systematic review and meta-analysis","","","https://doi.org/10.3390/ijerph182010604","20211002","","Scopus","Undecided","","","","","","","","","","","","","False","False","","","","","False","False","False","","False","False","False","False","False","False","False","False","False","","","","","","","","","","","","","","","","","","","","","","","","","","","","","","","","","","","","","","","","","","","","","","","","","","","","2021-10-18","",18904,""
"Structural relationship between korean adolescent’s sports participation, optimism, pessimism, self-regulation, and coronavirus-related stress in the pandemic situation","","","https://doi.org/10.3390/ijerph182010645","20211001","","Scopus","Undecided","","","","","","","","","","","","","False","False","","","","","False","False","False","","False","False","False","False","False","False","False","False","False","","","","","","","","","","","","","","","","","","","","","","","","","","","","","","","","","","","","","","","","","","","","","","","","","","","","2021-10-18","",18905,""
"The fear of COVID-19 raises the level of depression, anxiety and stress through the mediating role of intolerance of uncertainty","","","https://doi.org/10.31577/SP.2021.03.828","20210101","","Scopus","Undecided","","","","","","","","","","","","","False","False","","","","","False","False","False","","False","False","False","False","False","False","False","False","False","","","","","","","","","","","","","","","","","","","","","","","","","","","","","","","","","","","","","","","","","","","","","","","","","","","","2021-10-18","",18906,""
"Changes in Depressive Symptoms, Physical Symptoms, and Sleep-Wake Problems From Before to During the COVID-19 Pandemic Among Emerging Adults: Inequalities by Gender, Socioeconomic Position, and Race","","","https://doi.org/10.1177/21676968211042111","20210101","","Scopus","Undecided","","","","","","","","","","","","","False","False","","","","","False","False","False","","False","False","False","False","False","False","False","False","False","","","","","","","","","","","","","","","","","","","","","","","","","","","","","","","","","","","","","","","","","","","","","","","","","","","","2021-10-18","",18907,""
"Physical activity, mental health and wellbeing of irish adolescents during covid-19 restrictions A re-issue of the physical activity and wellbeing study (PAWS)","","","https://doi.org/10.5334/PAAH.127","20210101","","Scopus","Undecided","","","","","","","","","","","","","False","False","","","","","False","False","False","","False","False","False","False","False","False","False","False","False","","","","","","","","","","","","","","","","","","","","","","","","","","","","","","","","","","","","","","","","","","","","","","","","","","","","2021-10-18","",18908,""
"Mental health experiences of healthcare professionals during covid-19","","","https://doi.org/10.4102/sajip.v47i0.1865","20210101","","Scopus","Undecided","","","","","","","","","","","","","False","False","","","","","False","False","False","","False","False","False","False","False","False","False","False","False","","","","","","","","","","","","","","","","","","","","","","","","","","","","","","","","","","","","","","","","","","","","","","","","","","","","2021-10-18","",18909,""
"Factors influencing self-harm thoughts and behaviours over the first year of the COVID-19 pandemic in the UK: Longitudinal analysis of 49 324 adults","","","https://doi.org/10.1192/bjp.2021.130","20210101","","Scopus","Undecided","","","","","","","","","","","","","False","False","","","","","False","False","False","","False","False","False","False","False","False","False","False","False","","","","","","","","","","","","","","","","","","","","","","","","","","","","","","","","","","","","","","","","","","","","","","","","","","","","2021-10-18","",18910,""
