"title","abstract","authors","link","date","subject","source","initial_decision","q0","q1","q2","q3","q4","q5","q6","q7","q8","q9","q10","q11","q12","q13","q14","q15","q16","q17","q18","q19","q20","q21","q22","q23","q24","q25","q26","q27","q28","q29","q30","q31","q32","q33","q34","q35","q36","q37","q38","q39","q40","q41","q42","q43","q44","q45","q46","q47","q48","q49","q50","q51","q52","q53","q54","q55","q56","q57","q58","q59","q60","q61","q62","q63","q64","q65","q66","q67","q68","q69","q70","q71","q72","q73","q74","q75","q76","q77","q78","q79","q80","exclusion_reason","extraction_date","expert_decision","ID","o1"
"Screening for Mental Health Problems in Epidemics: Is It Justifiable?","Given the overwhelming mental health consequences of infectious epidemics, timely identification and treatment of people with mental health problems is essential. In this narrative review, screening instruments and procedures for identification of mental health problems at the time of epidemic crises are reviewed and the results are discussed in the context of our experience in the recent COVID-19 epidemic in Iran. Forty studies were retrieved from searches in several databases which used screening procedures for identification of mental health conditions during infectious epidemics. Studies were performed on three groups of health care workers, at-risk general population, and patients with confirmed/ suspected infection, using a wide range of instruments. Most have used screening instruments for the purpose of prevalence estimation and only 5 have included it as a health intervention while none has investigated its effectiveness. The evidence base for screening at the time of epidemics is weak. If it is used to identify the needs and enhance help seeking, the screening instruments should have adequate psychometric properties; moreover, their integration in the available services is strongly recommended. Original studies are needed to investigate the usefulness of mental health screening programs in crises such as the COVID-19 epidemic.","Sharifi, Mohammadjafari","https://doi.org/10.34172/aim.2021.91","20210907","COVID-19; Epidemic; Identify; Iran; Mental health; Screening","PubMed","Undecided","","","","","","","","","","","","","False","False","","","","","False","False","False","","False","False","False","False","False","False","False","False","False","","","","","","","","","","","","","","","","","","","","","","","","","","","","","","","","","","","","","","","","","","","","","","","","","","","","2021-09-08","",17770,""
"Information avoidance during health crises: Predictors of avoiding information about the COVID-19 pandemic among german news consumers","This study investigates the prevalence of source-specific information avoidance among German consumers and predictors of information-avoidance behavior in the context of the COVID-19 pandemic. Guided by the Risk Information Seeking and Processing Model (RISP), we propose that the perceived social norms, information insufficiency, risk perception, affective risk response, and attitudes toward seeking predict information avoidance. We supplement the RISP model by considering information overload as the vast volume and the incredulous quality of information in the COVID-19 pandemic challenge individualsâ€™ information acquisition and processing. Using a stratified demographic sample of news consumers of a federal German state (NÂ =Â 1,000), we empirically examined the proposed model, answered the research question, and tested our hypotheses using structural equation modeling. The results reveal information avoidance among one-third of the respondents. They avoided online sources, including online-mediated interpersonal sources, more often than interpersonal sources and traditional mass media. Information avoidance was linked to more negative attitudes toward seeking and negative affective risk responses, more pronounced descriptive and injunctive avoidance norms, and perceived information overload. Attitudes and information overload were the most influential predictors of avoidance. In contrast, risk perception and information insufficiency were not associated with information avoidance. This study provides insights into theory development, contributes to the information behavior literature, and identifies barriers to communication during health crises.","","https://doi.org/10.1016/j.ipm.2021.102714","20211101","","Scopus","Undecided","","","","","","","","","","","","","False","False","","","","","False","False","False","","False","False","False","False","False","False","False","False","False","","","","","","","","","","","","","","","","","","","","","","","","","","","","","","","","","","","","","","","","","","","","","","","","","","","","2021-09-08","",17771,""
"Associations between physical activity, sitting time, and time spent outdoors with mental health during the first COVID-19 lock down in Austria","","","https://doi.org/10.3390/ijerph18179168","20210901","","Scopus","Undecided","","","","","","","","","","","","","False","False","","","","","False","False","False","","False","False","False","False","False","False","False","False","False","","","","","","","","","","","","","","","","","","","","","","","","","","","","","","","","","","","","","","","","","","","","","","","","","","","","2021-09-08","",17772,""
"Antidepressants May Not Be Enough When Frailty Complicates Depression in Late Life","","","https://doi.org/10.1016/j.jagp.2021.01.003","20210901","","Scopus","Undecided","","","","","","","","","","","","","False","False","","","","","False","False","False","","False","False","False","False","False","False","False","False","False","","","","","","","","","","","","","","","","","","","","","","","","","","","","","","","","","","","","","","","","","","","","","","","","","","","","2021-09-08","",17773,""
"Perceptions of Illness Severity, Treatment Goals, and Life Expectancy: The ePISTLE Study","Introduction A better understanding of factors influencing perceived life expectancy (PLE), interactions between patient prognostic beliefs, experiences of illness, and treatment behavior is urgently needed. Methods Case-notes at 3 hemodialysis units were screened: patients with =20% 1-year mortality risk were included. Patients and their health care professionals (HCPs) were invited to complete a structured interview or mixed-methods questionnaire. Four hundred eleven patient notes were screened. Seventy-seven eligible patients were approached and 51 were included. Results Patients predicted significantly higher life expectancies than HCPs (P < 0.0001). Documented cognitive impairment, gender, or increasing age did not affect 1- or 5-year PLE. PLE influenced priorities of care: one-fifth of patients who estimated themselves to have >95% 1-year survival preferred â€œcare focusing on relieving pain and discomfort,â€ compared with nearly three-quarters of those reporting a =50% chance of 1-year survival. Twenty of 51 (39%) patients believed transplantation was an option for them, despite only 4 being waitlisted at the time of the interview. Patients who thought they were transplant candidates were significantly more confident they would be alive at 1 and 5 years and to want resuscitation attempted. Cognitive impairment had no effect on perceived transplant candidacy. A high symptom burden was present and underrecognized by HCPs. High symptom burden was associated with significantly lower PLE at both 1 and 5 years, increased anxiety/depression scores, and treatment choices more likely to prioritize relief of suffering. Conclusion There is a disparity between patient PLE and those of their HCPs. Severity of symptom burden and beliefs regarding PLE or transplant candidacy affect patient treatment preferences.","","https://doi.org/10.1016/j.ekir.2021.02.032","20210601","","Scopus","Undecided","","","","","","","","","","","","","False","False","","","","","False","False","False","","False","False","False","False","False","False","False","False","False","","","","","","","","","","","","","","","","","","","","","","","","","","","","","","","","","","","","","","","","","","","","","","","","","","","","2021-09-08","",17774,""
"Depression, anxiety, perceived and post-traumatic stress, and the use of alcohol during the covid-19 pandemic in estonia from spring to autumn in 2020: A longitudinal study","","","https://doi.org/10.3176/tr.2021.3.01","20210101","","Scopus","Undecided","","","","","","","","","","","","","False","False","","","","","False","False","False","","False","False","False","False","False","False","False","False","False","","","","","","","","","","","","","","","","","","","","","","","","","","","","","","","","","","","","","","","","","","","","","","","","","","","","2021-09-08","",17775,""
"Impact of Covid-19 on depressive and anxiety symptoms of pregnant women: A systematic review","","","https://doi.org/10.1684/nrp.2021.0615","20210101","","Scopus","Undecided","","","","","","","","","","","","","False","False","","","","","False","False","False","","False","False","False","False","False","False","False","False","False","","","","","","","","","","","","","","","","","","","","","","","","","","","","","","","","","","","","","","","","","","","","","","","","","","","","2021-09-08","",17776,""
