"title","abstract","authors","link","date","subject","source","initial_decision","q0","q1","q2","q3","q4","q5","q6","q7","q8","q9","q10","q11","q12","q13","q14","q15","q16","q17","q18","q19","q20","q21","q22","q23","q24","q25","q26","q27","q28","q29","q30","q31","q32","q33","q34","q35","q36","q37","q38","q39","q40","q41","q42","q43","q44","q45","q46","q47","q48","q49","q50","q51","q52","q53","q54","q55","q56","q57","q58","q59","q60","q61","q62","q63","q64","q65","q66","q67","q68","q69","q70","q71","q72","q73","q74","q75","q76","q77","q78","q79","q80","exclusion_reason","extraction_date","expert_decision","ID","o1"
"Association of Workload and Practice of Respectful Maternity Care Among the Healthcare Providers, Before and During the COVID-19 Pandemic in South Western Nepal: A Cross-Sectional Study","Introduction: Respectful maternity care is a crucial component of intrapartum quality care. As the imbalance in demand and supply of the maternity care workforce affects intrapartum quality care, respectful maternity care might be affected by increased workload among the healthcare providers. Thus, this study was conducted to examine the association between workload among healthcare providers and their practice of respectful maternity care, both before and during the COVID-19 pandemic. Methods: A cross-sectional study was conducted in South Western Nepal. A total of 78 birthing centers and 267 healthcare providers were included. Data collection was done through telephone interviews. The exposure variable was workload among the healthcare providers, and the outcome variable was respectful maternity care practice before and during the COVID-19 pandemic. Multilevel mixed-effect linear regression was used to examine the association. Results: The median client-provider ratio before and during the pandemic was 21.7 and 13.0, respectively. The mean score of respectful maternity care practice was 44.5 (SD 3.8) before the pandemic, which was decreased to 43.6 (SD 4.5) during the pandemic. Client-provider ratio was negatively associated with respectful maternity care practice for both times; before (Coef. -5.16; 95% CI -8.41 to -1.91) and during (Coef. -7.47; 95% CI -12.72 to -2.23) the pandemic. The variance of respectful maternity care practice among the health facilities was 26% before the pandemic, and was increased to 33% during the pandemic. Being tested positive for COVID-19 in the past was negatively associated with respectful maternity care practice during the COVID-19 pandemic (Coef. -3.18; 95% CI -5.06 to -1.30). Conclusions: While a higher client-provider ratio was associated with a lower respectful maternity care practice score both before and during the COVID-19 pandemic, the coefficient was larger during the pandemic. Also, the variance among the health facilities for respectful maternity care was increased more during the COVID-19 pandemic. The findings of this study call for the decrement in the client-provider ratio for better respectful maternity care practice, especially during the pandemic. However, supplying health human resources per the population demand, especially during the pandemic, may be difficult in a resource-limited setting. The number of delivery cases at local health facilities should be increased by improving the quality of care, particularly during the pandemic. This could help equal distribution of client-provider and practice respectful maternity care, even during the pandemic. Further, healthcare providers who tested positive for COVID-19 had lower respectful maternity care practice scores. Therefore, additional physical and mental health support to healthcare providers should be considered to improve their respectful maternity care practice, particularly during the pandemic.","Alpha Pokharel; Junko Kiriya; Akira Shibanuma; Ram Silwal; Masamine Jimba","https://medrxiv.org/cgi/content/short/2022.02.21.22271309","20220224","","medRxiv","Undecided","","","","","","","","","","","","","False","False","","","","","False","False","False","","False","False","False","False","False","False","False","False","False","","","","","","","","","","","","","","","","","","","","","","","","","","","","","","","","","","","","","","","","","","","","","","","","","","","","2022-02-25","",27490,""
"Effect of perception of stage in time course of the pandemic on the emotional health of ICU workers","INTRODUCTION/HYPOTHESIS: Recent studies have shown that healthcare workers directly engaged with COVID-19 patients and those with pre-existing psychological problems were at increased risk of anxiety, depression, and PTSD symptoms. It is not known whether these symptoms are anticipatory or reactive. This study examines the influence that the perception of the course in time of the pandemic (early, middle, late) has on ICU professionals' mental health. We hypothesize that those workers who perceive that they were at the beginning of the pandemic would have higher anticipatory anxiety, but those who perceived they were toward the end would have higher reactive depression and somatization symptoms. METHODS: On April 7, 2020, an email survey was sent to the members of SCCM with a reminder email one week later to those who hadn't yet responded. Collected information included demographic data, perception of caseload and point in the time course of the pandemic, and responses to psychological instruments assessing depression (PHQ-9), anxiety (GAD-7), and symptom somatization (PHQ-15). RESULTS: ANOVA and Tukey post-hoc analysis of the 939 responses showed no significant difference between respondent's perception of their stage in the time course of the pandemic (early, middle, toward the end) and levels of depression (PHQ-9) or anxiety (GAD-7);however, those who believed they were near the end of the pandemic had significantly fewer somatic symptoms (PHQ-15) than those who believed they were early or mid (p&lt; 0.05). DISCUSSION: Perception of stage in the time course of the pandemic did not influence the presence of depression or anxiety but did lead to improved somatization symptoms for those who felt they were at the end of the pandemic. These results suggest that reactive depression and anxiety abate more slowly than somatic symptoms during a pandemic. Psychological interventions for the ICU professional should start in the earliest stages of a pandemic and persist throughout the course.","Branca, R.; Branca, P.","https://doi.org/10.1097/01.ccm.0000806792.07246.d6","","Database: EMBASE; Publication type: article; Publication details: Critical Care Medicine; 50(1 SUPPL):41, 2022.","WHO","Undecided","","","","","","","","","","","","","False","False","","","","","False","False","False","","False","False","False","False","False","False","False","False","False","","","","","","","","","","","","","","","","","","","","","","","","","","","","","","","","","","","","","","","","","","","","","","","","","","","","2022-02-25","",27491,""
"Increasing rates of acetaminophen ingestion for self-harm in the pediatric population","BACKGROUND: Social distancing precautions due to the COVID-19 pandemic have had a detrimental physical and emotional effect. Anecdotally, hospitalizations within our health system for pediatric acetaminophen ingestions increased during the pandemic. OBJECTIVE: To evaluate the rates of pediatric intentional acetaminophen ingestion and overall self-harm admissions before and during the COVID-19 pandemic. PARTICIPANTS: All discharges of patients 0 to 23 years of age admitted to the health system between 2016 and 2020 were electronically queried. Patients were identified by a primary International Classification of Disease 10 diagnosis code of acetaminophen ingestion related to self-harm [T39.1X2]. DESIGN: This is a single-centered retrospective observational study. Statistical analysis was performed using a logistic regression model. MAIN OUTCOME(S) AND MEASURE(S): The primary outcome was rate of hospitalization for acetaminophen ingestion by year. This was defined as the number of hospital discharges for acetaminophen ingestion divided by the total number of discharges per year (excluding obstetric or newborn discharges). Secondary outcomes included age, race/ethnicity, insurance, and gender. RESULTS: From 2016-2020 there were 25,927 discharges of pediatric patients with 65 acetaminophen ingestion and 148 overall self-harm discharges. Of the 65 acetaminophen patients, 78% identified as female and 54% identified as non-white. The proportion of acetaminophen ingestion admissions increased from 0.13% to 0.28% between 2016 and 2018, decreased to 0.24% in 2019, then increased to 0.44% in 2020. The proportion of self-harm ingestion admissions increased from 0.42% to 0.64% between 2016 and 2018, decreased to 0.55% in 2019, then increased to 0.73% in 2020. We found a significant increasing linear trend. The log-odds of acetaminophen ingestion admission from 2016 through 2020 increased by 28% each additional year (OR=1.28;95% CI: 1.08-1.53;p=0.01). There was not enough evidence to conclude that the log-odds of a self-harm ingestion admission were linearly related to time (p=0.06). CONCLUSIONS: Acetaminophen ingestion for self-harm has significantly increased, while overall self-harm has remained stable. It is important to note this trend and to continue to screen for depression.","Moss, R.; Hertzberg, E.; Person, H.; Zackai, S.; Bucuvalas, J.; Gillen, J.","https://doi.org/10.1097/01.ccm.0000808792.12260.0a","","Database: EMBASE; Publication type: article; Publication details: Critical Care Medicine; 50(1 SUPPL):301, 2022.","WHO","Undecided","","","","","","","","","","","","","False","False","","","","","False","False","False","","False","False","False","False","False","False","False","False","False","","","","","","","","","","","","","","","","","","","","","","","","","","","","","","","","","","","","","","","","","","","","","","","","","","","","2022-02-25","",27492,""
"Pharmacist interventions in a postintensive care unit recovery clinic","INTRODUCTION: Up to 80% of intensive care unit (ICU) survivors experience post-intensive care syndrome (PICS) which is a constellation of new or worsening physical, mental and cognitive impairment that can last for years following ICU admission. Post-intensive care unit recovery clinics (PIRCs) are multidisciplinary clinics which have been developed to promote patient and family recovery following critical illness and pharmacist involvement has helped to optimize medication therapy and promote recovery. METHODS: A retrospective chart review of patients who attended PIRC at the Cleveland Clinic from December 2019-September 2020 was completed. Patients were evaluated for baseline characteristics, in-hospital and PIRC variables, and number and type of pharmacist interventions. RESULTS: A total of 63 patients were seen in PIRC during the study period. The median (IQR) age was 59.1 (49.2-71.6) years and 37 (58.7%) patients were male. The median ICU and hospital length of stay were 7 (3-12.5) and 14 (10- 22) days, respectively. A total of 26 (41.3%) patients had acute respiratory distress syndrome and 52 (82.5%) had COVID-19. The median time from hospital discharge to PIRC visit was 52.5 (32-78) days and the majority of appointments were virtual (61.3%). At PIRC, 21 (45%) patients had a new oxygen requirement, 6 (38%) had an abnormal cognitive test, 11 (52%) screened positive for new anxiety or depression, and 3 (19%) screened positive for post-traumatic stress disorder. Pharmacists made a median (IQR) 4 (1-6.5) interventions per patient. The majority of interventions were discontinuation of medications from a patient's medication list (59.4%), followed by adding medications which were omitted from the patient's medication list (25.5%) and updating medication records to reflect current doses and frequencies (15.2%). Routine vaccinations were recommended for 33 (52.4%) patients and education frequently included medication adherence, proper inhaler technique, management of medication adverse effects and optimal use of as needed medications. CONCLUSIONS: Pharmacists are an integral member of the multidisciplinary PIRC care team. Pharmacists optimize medication therapy and provide valuable patient education. Further studies evaluating long-term outcomes of patients presenting to PIRCs and pharmacist involvement are warranted.","Torbic, H.; Conroy, G.; Ward, J.; Biehl, M.","https://doi.org/10.1097/01.ccm.0000809736.02922.d8","","Database: EMBASE; Publication type: article; Publication details: Critical Care Medicine; 50(1 SUPPL):421, 2022.","WHO","Undecided","","","","","","","","","","","","","False","False","","","","","False","False","False","","False","False","False","False","False","False","False","False","False","","","","","","","","","","","","","","","","","","","","","","","","","","","","","","","","","","","","","","","","","","","","","","","","","","","","2022-02-25","",27493,""
"The 5 senses program: A patientcentered family engagement strategy","INTRODUCTION: Patients admitted to pediatric intensive care units (PICU) often experience sensory deprivation and develop maladaptive sensory disorders. Simultaneously, families often endorse feelings of helplessness and fear while their child is critically ill. This study aims to expand ICU family engagement in a unique, patient-centered manner. METHODS: This is a single-centered prospective cohort study performed at a quaternary PICU. Inclusion criteria included age &gt;12 months, were mechanically ventilated, and with a Glasgow Coma Scale &lt; 10. Exclusion criteria included those with baseline cognitive or developmental delay, palliative concerns, or to clinically unstable. The team consisted of occupational therapists and speechlanguage pathologists. Once enrolled, the team created an individualized sensory plan, including any existing sensory needs or aversions. The therapist oriented the family to the program and provided stimulation to all 5 senses. The family was provided an informational handout and a sensory kit to encourage stimulation when the therapist was not present. Following ICU discharge, the families were surveyed regarding their experience. RESULTS: From June 2019 through July 2021, 15 patients were enrolled and 12 completed surveys. Age ranged from 15 months to 17 years with a mean age of 7.6 years. The most common diagnosis was traumatic brain injury (n=5, 33%). All surveyed families provided stimulation at least 3 times following ICU transfer. 92% (n=11) participants provided stimulation more than once a day. Reported difficulty level was labeled as easy (n=9, 69%) or medium (n=3, 23%). CONCLUSIONS: Sensory stimulation can augment recovery and prevent new sensory integration disorders. These targeted plans and environmental modifications have been shown to aid in delirium prevention, family engagement, and non-pharmacologic soothing. Overall, we found that families and caregivers enjoyed the guided engagement and provided very positive feedback. There were several limitations to this project. Primarily, due to the COVID-19 pandemic, the average daily PICU census was very low, inhibiting enrollment ability. Additionally, there was difficulty obtaining consults for the therapist team, thus delaying enrollment. We hope to continue to enroll patients and expand our program to other hospital units.","Dodenhoff, E.; Comer, L.; Robbins, J.; Rogers, A.; Tidwell, A.; Hayes, L.","https://doi.org/10.1097/01.ccm.0000809796.24710.fe","","Database: EMBASE; Publication type: article; Publication details: Critical Care Medicine; 50(1 SUPPL):429, 2022.","WHO","Undecided","","","","","","","","","","","","","False","False","","","","","False","False","False","","False","False","False","False","False","False","False","False","False","","","","","","","","","","","","","","","","","","","","","","","","","","","","","","","","","","","","","","","","","","","","","","","","","","","","2022-02-25","",27494,""
"Phenobarbital versus benzodiazepines for alcohol withdrawal management: A retrospective comparison","INTRODUCTION: Benzodiazepine (BZD)-based regimens are first-line therapy for alcohol withdrawal syndrome (AWS). Phenobarbital (PHB) is an alternative treatment but with limited guidance for use. We evaluated the efficacy and safety of PHB compared to BZD for AWS. METHODS: This was a single-center retrospective cohort study. Adult patients were included if they received BZD symptom-triggered protocol or PHB monotherapy for management of AWS and excluded if they received both therapies, were COVID positive, or died within 48 hours of hospital admission. Data collection started on December 31, 2020 and data were collected in reverse chronological order until target sample size was attained. Primary endpoint evaluated was development of AWS-related complications. Secondary endpoints included need for adjunct therapy, duration of mechanical ventilation, hospital and ICU length of stay (LOS), and hospital mortality. Safety endpoints included incidence of hypotension, bradycardia, and significant respiratory depression. RESULTS: 100 patients out of 164 screened patients were included, with 50 patients in PHB and 50 patients in BZD cohorts. Baseline characteristics were similar, except more patients in PHB cohort had history of alcohol dependence (82% vs. 56%, p&lt; 0.001). Majority of BZD patients were in medical ICU while PHB patients were in surgical ICU. Baseline median MINDS scores were similar [PHB, 10 (5-16) vs. BZD, 11 (5-15), p=0.99]. Median (IQR) phenobarbital loading dose given was 14.8 (12.8-15.9) mg/kg followed by maintenance dose 356 (259-389) mg with a duration of 5 (3-5) days. Total lorazepam-equivalent dose given was 19.3 (5.0-44.0) mg with a duration of 4 (3-5) days. There was no significant difference in the primary endpoint [4 (8%) vs. 4(8%), p=1.00]. MINDS score post therapy initiation was significantly higher in BZD cohort [5 (1-14) vs. 15 (8-19), p&lt; 0.001]. Patients who received PHB therapy had significantly shorter ICU LOS in days [3 (1-7) vs. 5 (2-6), p&lt; 0.001] but no difference in hospital LOS [PHB, 8 (5-13) vs. BZD, 7 (5-12), p=0.37]. There were no significant differences in other secondary and safety endpoints. CONCLUSION: In this study there was no difference in efficacy or safety of PHB in management of AWS compared to BZD. Larger studies to confirm PHB as first-line AWS therapy are warranted.","Ammar, M.; Ammar, A.; McGill, B.; Rouse, G.; Patel, A.; Becher, R.","https://doi.org/10.1097/01.ccm.0000809968.32358.26","","Database: EMBASE; Publication type: article; Publication details: Critical Care Medicine; 50(1 SUPPL):452, 2022.","WHO","Undecided","","","","","","","","","","","","","False","False","","","","","False","False","False","","False","False","False","False","False","False","False","False","False","","","","","","","","","","","","","","","","","","","","","","","","","","","","","","","","","","","","","","","","","","","","","","","","","","","","2022-02-25","",27495,""
"Incidence and risk factors for iatrogenic opioid withdrawal in medical critical care patients","INTRODUCTION/HYPOTHESIS: Prolonged exposure to opioids through analgosedation may lead to iatrogenic opioid withdrawal syndrome (IWS) once patients are extubated and weaned from sedation. With the lack of validated assessment tools, IWS is likely underdiagnosed in critically ill adult patients. METHODS: This was an IRB-approved, prospective, observational study assessing IWS based on Clinical Opiate Withdrawal Scale (COWS) from October 2019 to November 2020. Patients were included if they were =18 years, admitted to the critical care medicine (CCM) service, and received =24 hours of continuous opioid infusion. Patients were excluded if they were admitted for drug overdose, intracranial pathology, active COVID-19, transitioned to withdrawal of life support or hospice, remained GCS =8 and/or RASS &lt; -2 throughout assessment period, prisoners, pregnant patients, or missing =2 assessments. Patients were assessed within 24 hours from opioid cessation and followed for 5 days. The primary outcome was the incidence of at least moderate IWS diagnosis assessed using COWS. Secondary outcomes included the incidence of mild IWS based on COWS, the incidence of IWS diagnosis based on a positive DSM-V score, the correlation between diagnosis of IWS by DSM-V and COWS, and the identification of risk factors for IWS. RESULTS: Ninety-two patients were included in the final analysis. Except for a higher prevalence of psychiatric history in the IWS-positive group, baseline characteristics were similar. Overall, 11 patients (12%) developed at least moderate IWS, based on COWS. There was a strong, positive correlation between DSM-V and COWS on the day COWS was the highest (rs(90)=0.64;p&lt; 0.01). The IWSpositive group also had longer durations of opioid infusions, higher cumulative opioid infusion doses, higher mean daily doses, and higher infusion rates at any given time. No significant differences were found between the two groups for scheduled or PRN opioids after cessation of the opioid infusion. Logistic regression did not identify any independent predictors for the development of IWS. CONCLUSION: At least 12% of CCM patients who received =24 hours of continuous opioid infusions developed IWS. These patients had significantly longer durations, higher cumulative daily and total opioid doses, and higher opioid infusion rates.","Fox, M.; Carothers, W.; Birrer, K.; Choi, M.; Dircksen, K.; Mukkera, S. R.","https://doi.org/10.1097/01.ccm.0000810084.26337.83","","Database: EMBASE; Publication type: article; Publication details: Critical Care Medicine; 50(1 SUPPL):467, 2022.","WHO","Undecided","","","","","","","","","","","","","False","False","","","","","False","False","False","","False","False","False","False","False","False","False","False","False","","","","","","","","","","","","","","","","","","","","","","","","","","","","","","","","","","","","","","","","","","","","","","","","","","","","2022-02-25","",27496,""
"A case of severe rhabdomyolysis and acute myocarditis in an adolescent female","INTRODUCTION: Rhabdomyolysis describes a condition where muscle tissue destruction occurs. Mortality and morbidity can be significant especially when multi-organ injury ensues. In very few instances, myocarditis has been described in association with this condition. DESCRIPTION: An 11-year-old previously healthy female presents with vomiting, diarrhea, tactile fever, worsening severe bilateral leg pain and gross hematuria for four days. At the Emergency Department, her ECG showed ST depression in lateral leads and abnormal Q waves. Laboratory studies were notable for significantly elevated CK &gt;330,000 U/L. Elevated Troponin T and Troponin I at 3.60 ng/ml and 0.54 ng/mL, respectively. Elevation of CRP 23.5 mg/dl, ALT 1,966 U/L, AST 5,956 U/L, and Ferritin 712.1 ng/ml. Patient had dark brown urine, which was positive for blood, and urine myoglobin peaked at 2690 ng/mL. Her renal function was normal with blood urea nitrogen 8 mg/dl and creatinine 0.4 mg/dl. C3 and C4 levels were decreased, 45 mg/dl and 5 mg/dl, respectively. Anti-dsDNA negative, ANCA negative, and ANA negative. Nasopharyngeal PCR was negative for Mycoplasma pneumoniae, influenza A and B. Blood enterovirus PCR negative. COVID PCR and antibodies negative. Neuromuscular genetic testing was non-diagnostic. Her echocardiography showed thin rim of pericardial effusion and normal ejection fraction. Cardiac MRI demonstrated myocardial edema and regional sub-epicardial delayed enhancement consistent with acute myocarditis. Patient was started on hyperhydration therapy, Solumedrol and intravenous immunoglobulin. The rhabdomyolysis resulted in severe extremity weakness requiring prolonged rehabilitation. Her condition and biomarkers normalized and was subsequently discharged home. Follow up cardiac MRI 6 months later showed increased extracellular volume (ECV) of 38% suggestive of focal and diffuse areas of fibrosis. Patient remains under physical activity restrictions and is being followed by cardiology service. DISCUSSION: Our case highlights severe rhabdomyolysis in association with acute myocarditis and subsequent cardiac structural abnormalities. Although it remains unclear whether myocarditis evolved as a complication of rhabdomyolysis or was triggered by same inciting agent, an infectious etiology overall remains the most likely culprit.","Abderrahman, Y.; Deepthi Billa, R.; Weiner, L.; Khan, R.; Lee-son, K.; Badheka, A.","https://doi.org/10.1097/01.ccm.0000811712.24270.46","","Database: EMBASE; Publication type: article; Publication details: Critical Care Medicine; 50(1 SUPPL):675, 2022.","WHO","Undecided","","","","","","","","","","","","","False","False","","","","","False","False","False","","False","False","False","False","False","False","False","False","False","","","","","","","","","","","","","","","","","","","","","","","","","","","","","","","","","","","","","","","","","","","","","","","","","","","","2022-02-25","",27497,""
