"title","abstract","authors","link","date","subject","source","initial_decision","q0","q1","q2","q3","q4","q5","q6","q7","q8","q9","q10","q11","q12","q13","q14","q15","q16","q17","q18","q19","q20","q21","q22","q23","q24","q25","q26","q27","q28","q29","q30","q31","q32","q33","q34","q35","q36","q37","q38","q39","q40","q41","q42","q43","q44","q45","q46","q47","q48","q49","q50","q51","q52","q53","q54","q55","q56","q57","q58","q59","q60","q61","q62","q63","q64","q65","q66","q67","q68","q69","q70","q71","q72","q73","q74","q75","q76","q77","q78","q79","q80","exclusion_reason","extraction_date","expert_decision","ID","o1"
"The impact of the COVID-19 pandemic on the oncology services demand in a middle-income setting with universal health insurance","We analyze the impact of the COVID-19 pandemic on oncology service demand in a middle-income country with universal health coverage. We collected data from January 1<sup>st</sup>-2017 to December 31<sup>th</sup>-2021 at a reference center in Bogot&#xe1;-Colombia regarding first-time consultations of cross-cutting services (clinical oncology, hematology, palliative care, radiation oncology); specialized multidisciplinary units (breast, prostate, lung, stomach); inpatient and outpatient systemic therapy; radiotherapy; oncology surgery; and bone marrow transplant. A descriptive time series analysis was performed, estimating monthly percent change and endemic channels. Starting the confinement (April 2020), a general decrease in service demand was observed (R: -14.9% to -90.0%), with an additional but lower decrease in August 2020 coinciding with the first pandemic wave (R: -11.3% to -70.0%). Follow-up visits and ambulatory treatment showed no consistent reductions. New patients' consultations for cross-cutting services had a speedy recovery (1 month), but clinical oncology, specialized units, and in-hospital treatment resumed more slowly. Only breast and stomach cancer showed a sustained reduction in early-stage disease. Women and older patients had a more significant reductionin service demand. Conclusion: Despite no changes in service supply, the confinement induced a significant reduction in service demand. Variations by cancer type, service type, and population demographics deserve careful consideration for a suitable response to the emergency. The speedy recovery and the absence of a significant decrease during subsequent waves of the pandemic suggest patient resiliency and a lower impact than expected in middle-income settings in the presence of universal health insurance. Analizar el impacto de la pandemia de COVID-19 sobre la demanda de servicios oncol&#xf3;gicos. Se recolectaron datos de enero 1/2017 hasta diciembre 31/2021 de consulta de primera vez en servicios transversales (oncolog&#xed;a clinica, hematolog&#xed;a, cuidados paliativos, oncolog&#xed;a radioter&#xe1;pica) y servicios especializados multidisciplinarios (mama, pr&#xf3;stata, pulm&#xf3;n, est&#xf3;mago), as&#xed; como de suministro de tratamiento (terapia sist&#xe9;mica ambulatoria y hospitalaria, radioterapia, cirug&#xed;a oncol&#xf3;gica, trasplante de m&#xe9;dula &#xf3;sea), en un centro de referencia en Bogot&#xe1;-Colombia. Se realiz&#xf3; un an&#xe1;lisis descriptivo de series de tiempo estimando el cambio porcentual mensual y los canales end&#xe9;micos. Al inicio del confinamiento obligatorio (abril/2020) hubo una disminuci&#xf3;n general en la demanda de servicios transversales (R: -14.9% a -90.0%), con nuevo descenso de menor grado en agosto/2020 durante la primera ola de infecciones (R: -11.3% a -70.0%). Las consultas de seguimiento y tratamientos ambulatorios no mostraron reducciones consistentes. Exceptuando oncolog&#xed;a cl&#xed;nica, las consultas de primera vez para servicios transversales tuvieron r&#xe1;pida recuperaci&#xf3;n hasta cifras basales (1 mes), pero las unidades especializadas y los tratamientos intrahospitalarios tuvieron recuperaci&#xf3;n mas lenta. &#xda;nicamente los c&#xe1;nceres de mama y est&#xf3;mago mostraron una reduccion sostenida de estadios tempranos de la enfermedad. La reducci&#xf3;n de la demanda fue mas marcada en mujeres y adultos mayores. A pesar de no tener cambios en la oferta, el confinamiento indujo una reducci&#xf3;n significativa en la demanda de servicios oncol&#xf3;gicos con variaci&#xf3;n diferencial por tipo de c&#xe1;ncer, servicio y caracter&#xed;sticas demogr&#xe1;ficas de la poblaci&#xf3;n. Esto merece consideraci&#xf3;n especial para generar respuestas adecuadas a las emergencias sanitarias. La r&#xe1;pida recuperaci&#xf3;n de la demanda y la ausencia de ca&#xed;das en olas de infecci&#xf3;n subsiguientes sugieren resiliencia de los pacientes e impacto menor del esperado en pa&#xed;ses con cobertura de salud universal.","Zuluaga Pati&#xf1;o, Luna Benitez, Jurado Sanabria, Soto-Cala, Solano Vega, S&#xe1;nchez Forero, Murillo","https://doi.org/10.25100/cm.v53i1.5115","20221123","Colombia; Coronavirus infections; health services needs and demand; hospital oncology service; neoplasms","PubMed","Undecided","","","","","","","","","","","","","False","False","","","","","False","False","False","","False","False","False","False","False","False","False","False","False","","","","","","","","","","","","","","","","","","","","","","","","","","","","","","","","","","","","","","","","","","","","","","","","","","","","2022-11-23","",41415,""
"The experiences of nursing students using virtual education during the COVID-19 pandemic","Due to the rapid spread of COVID-19, virtual education was proposed globally. This study aimed to examine the views and experiences of nursing students regarding quality, quantity, e-learning challenges, and solutions. This is a qualitative study using a purposive sampling method in which 42 nursing students were included. Data were collected through in-depth semi-structured face-to-face or telephone interviews and analyzed using content analysis. Concepts that were raised in the experience of nursing students were: ""Incompatibility of educational processes"", including ineffective teaching methods, limited interaction, limited feedback, low creativity, and educational injustice. ""Loss of opportunities"" including lack of clinical competence, concern for job opportunities, and lack of time management. ""Imposed burnout"", including forced labor and personal protection. ""Personal helplessness"", including lack of access to electronic facilities, struggles with the coronavirus, unemployment, and family conflicts. The enforcement of e-learning imposed restrictions on students with different conditions. Older students, those living in rural areas, students with work and family responsibilities, and people with limited electronic resources experienced challenges that require educational management based on challenges. Because e-learning goes beyond COVID-19 and given the continuing trend in e-learning in the coming years, it is necessary to address these challenges.","Mousavizadeh","https://doi.org/10.25122/jml-2021-0315","20221123","Covid-19; educational management; nursing students; pandemic; virtual education","PubMed","Undecided","","","","","","","","","","","","","False","False","","","","","False","False","False","","False","False","False","False","False","False","False","False","False","","","","","","","","","","","","","","","","","","","","","","","","","","","","","","","","","","","","","","","","","","","","","","","","","","","","2022-11-23","",41416,""
"Attachment and Sexuality: Impact of Confinement by COVID-19","This study examined attachment style and its relationship with sexual self-esteem during COVID-19 confinement. COVID-19 has caused changes in the way couples interact intimately and sexually around the world; some have found improvements and others an increase in difficulties. This article uses a retrospective pre post approach to evaluate 120 men and 89 women who were part of a couple at the time of confinement in Spain and completed an online survey. The sample was obtained during the de-escalation months, from May 9th until July 1st, 2020. Through an online survey we collected the data using the Spanish version of the Experiences in Close Relationships (ECR-S) to measure attachment and the Brief Sexuality Scale (SS) to measure aspects related to the participants sexuality (sexual self-esteem, sexual depression, and sexual preoccupation), as well as a scale designed post hoc on other aspects related to sexuality. Overall, the t-test results suggest that confinement had a negative effect on sexuality because sexual depression (SD) had a small increased in our sample. Multiple regression analysis showed that FSI, and ANXS attachment style were able to predict sexual depression during confinement. The results also showed a decrease in the strength of the relationship between sexual self-esteem (SSE) and attachment styles during confinement. However, sexual preoccupation (SP) and sexual self-esteem (SSE) remained relatively stable. Based on the results obtained, we conclude that there is an association between an increase in participants' sexual depression and being confined due to COVID-19.","Torres-Cruz, Aznar-Mart&#xed;nez, P&#xe9;rez-Testor","https://doi.org/10.1007/s12119-022-10039-x","20221123","Attachment; COVID-19; Intimacy; Sexual self-esteem; Sexuality","PubMed","Undecided","","","","","","","","","","","","","False","False","","","","","False","False","False","","False","False","False","False","False","False","False","False","False","","","","","","","","","","","","","","","","","","","","","","","","","","","","","","","","","","","","","","","","","","","","","","","","","","","","2022-11-23","",41417,""
"Exploring the pathway from seeking to sharing social support in e-learning: an investigation based on the norm of reciprocity and expectation confirmation theory","E-learning is increasingly evidenced as a conduit for social support exchange among students and protects them against mental health issues, however, the cognitive process of how social support is exchanged remains unclear. This study uses a cognitive theory approach to achieve a more nuanced explanation of students sharing or giving social support in e-learning. Specifically, we adopted the Norm of Reciprocity and Expectation Confirmation Theory to reveal the interconnection between students' perceived social support and giving social support in learning. The model is empirically validated based on survey data of 512 respondents from college students across China regarding their e-learning experience during the first wave of Covid-19. Our findings suggest that the relationship between perceived social support and giving social support is significant and positive, and this relationship is partially mediated by confirmation of social support. These findings imply that e-learning can foster a self-reliant environment for social support exchange among college students. Under such an environment, students' cognitive process in their seeking and sharing social support is majorly following the norm of reciprocity and secondary expectation confirmation theory.","Hu, Zhang, Shen","https://doi.org/10.1007/s12144-022-03982-3","20221123","E-learning; Expectation confirmation theory; Social support; The norm of reciprocity","PubMed","Undecided","","","","","","","","","","","","","False","False","","","","","False","False","False","","False","False","False","False","False","False","False","False","False","","","","","","","","","","","","","","","","","","","","","","","","","","","","","","","","","","","","","","","","","","","","","","","","","","","","2022-11-23","",41418,""
"Management of Obese Type 1 Diabetes Mellitus (Double Diabetes) Through Telemedicine During COVID-19 Pandemic Lockdown: A Case Report","Metabolic syndrome in Type 1 diabetes mellitus (T1DM) has been shown to be an independent risk factor for macro-vascular and micro-vascular complications. Obesity also affects many people with T1DM across their lifetime with an increasing prevalence in recent decades. Individuals with T1DM who are overweight, have a family history of type 2 diabetes, and/or have clinical features of insulin resistance, are known as ""double diabetes"". It is challenging for a person with double diabetes to achieve reasonable glycemic control, avoid insulin-related weight gain, and prevent hypoglycaemia. This was especially true during the coronavirus disease 2019 (COVID-19) pandemic lockdown. The aim of this report is to show that lifestyle modification through telemedicine can immensely help in managing uncontrolled T1DM&#xa0;with associated morbid obesity in lockdown situations, with the help of the diabetes educator. In this case, the complicated history of double diabetes was taken through telephonic and online consultations with the help of a nutritionist and diabetes educator, and the treating clinician supervised the insulin doses and frequency. Patient Health Questionnaire (PHQ)-9 questionnaire was used to assess depression. Medical nutrition therapy (MNT) was given through online consultations, where the patient was reoriented to carbohydrate counting, insulin&#xa0;dose adjustment, along with modifications in the diet. Regular exercise was advised along with frequent self-monitoring of blood glucose (SMBG). Moreover, the diet order was changed to eat protein and fibre first, followed by carbohydrates, later. The three-tier system of the medical expert, clinical dietitian, and diabetes educator was applied. The subject was trained for carbohydrate counting and insulin dose adjustment by teaching her about the insulin-to-carb ratio and insulin sensitivity factor (ISF). She was asked to examine her insulin injection sites by visual and palpatory methods for lipohypertrophy. Once a week, the diabetes educator and nutritionist did telephonic follow-up and counselling, while online consultation was done by the treating clinician once a month. As a result, her weight, BMI, and waist circumference were reduced drastically, and there was an improvement in haemoglobin A1C (HbA1C), lipid parameters, and blood pressure after the intervention. Thus, implementing diabetes education via telemedicine&#xa0;in circumstances such as the COVID-19 pandemic can help achieve the best possible compliance for strict diet adherence, regular exercise and monitoring, reducing obesity, glycosylated HbA1c, insulin doses, and risk of depression in a person with double diabetes.","Gupta, Totade, Gupta, Bamrah, Gupta, Gupta","https://doi.org/10.7759/cureus.30533","20221123","covid-19 retro; covid-19 telemedicine; double diabetes; medical nutrition therapy; national lockdown; previous gestational diabetes mellitus; type 1 diabetes mellitus (t1d); weight loss and obesity","PubMed","Undecided","","","","","","","","","","","","","False","False","","","","","False","False","False","","False","False","False","False","False","False","False","False","False","","","","","","","","","","","","","","","","","","","","","","","","","","","","","","","","","","","","","","","","","","","","","","","","","","","","2022-11-23","",41419,""
"Lifestyle behaviors and mental health during the coronavirus disease 2019 pandemic among college students: a web-based study","After emerging in China, the novel coronavirus disease 2019 (COVID-19) quickly spread to all parts of the country and became a global public health emergency. The Chinese government immediately took a series of protective and quarantine measures to prevent the spread of the virus, and these measures may have negative effects on behavior and psychological health. This study aimed to examine the associations between factors related to COVID-19 measures and mental health symptoms among Chinese college students in different pandemic areas. An online survey was administered to 14,789 college students from February 4 to 12, 2020. After excluding the participants who did not complete the questionnaire, the quality of the questionnaire was checked. Finally, the sample included 11,787 college students from 16 cities and 21 universities in China. The areas included the city of Wuhan (Area 1), the neighboring province of Hubei (Area 2), first-tier cities (Beijing, Shanghai, and Guangzhou [Area 3]), and other provinces (Area 4). The average age of the participants was 20.51&#x2009;&#xb1;&#x2009;1.88&#x2009;years. One-third of the participants were men. In total, 25.9 and 17.8% reported depression and anxiety, respectively. We also explored COVID-19-related factors, such as infection risk, perceived resistance to COVID-19 (or susceptibility to COVID-19 infection), perceived physical symptoms, family or friends, direct or indirect contact with confirmed cases, and having sought psychological counseling, which were significantly associated with anxiety and depression symptoms. Higher screen time, lower physical activity, higher soda and tea beverages (also called sugar sweetened beverages intake), use of alternative medicines or food supplements (including Chinese herbal medicines and vitamins), and decreased meal frequency were all correlated with higher depression and anxiety symptoms (depression: &#x3c7;<sup>2</sup>&#xa0;=&#x2009;25.57 and anxiety: &#x3c7;<sup>2</sup>&#xa0;=&#x2009;39.42). Coping with COVID-19 partially mediated the associations between some related lifestyle behaviors, anxiety, and depression. The conditional process model analysis results supported our hypotheses that lifestyle health behaviors and coping style were both predictors of anxiety and depression symptoms, and their direct and indirect effects were moderated by sex. Compared with the city of Wuhan, other epidemic areas had a lower risk of mental health problems. Lifestyle health behaviors and coping styles alleviated mental health symptoms. COVID-19-related social stressors were positively associated with mental health symptoms.","Zhang, Tao, Qu, Mou, Gan, Zhou, Zhu, Wu, Tao","https://doi.org/10.1186/s12889-022-14598-4","20221122","Aanxiety; Ccollege students; Ccoronavirus disease 2019; Ddepression; Lifestyle health behaviors","PubMed","Undecided","","","","","","","","","","","","","False","False","","","","","False","False","False","","False","False","False","False","False","False","False","False","False","","","","","","","","","","","","","","","","","","","","","","","","","","","","","","","","","","","","","","","","","","","","","","","","","","","","2022-11-23","",41420,""
"Covid-19 Pandemic-Knowledge, Perception, Anxiety And Depression Among Frontline Healthcare Workers Of Ayub Teaching Hospital Abbottabad, Pakistan","The COVID-19 pandemic is a viral infection that spreads through different mediums and has a high rate of mortality. At its initial stages, there is no particular medicine that can cure patients of COVID-19. The aim of the present study was to understand the COVID-19 knowledge, perception, and its effects in terms of anxiety and depression among frontline health care workers of Ayub Teaching Hospital, Abbottabad. This cross-sectional study was conducted in Ayub Teaching Hospital, Abbottabad from June to July 2021 in which data was collected from 200 hospital healthcare workers who have performed duties in COVID isolation wards through standard questionnaire. SPSS version 24.0 was used for data analysis. Out of 200 participants in the study 100 (50.0%) were male. Regarding safety measures taken during COVID -19, 144 (72.0%) individuals reported that they have not been given training to handle known or suspected cases of COVID-19. Moderate anxiety and depression was found in 153 (76.5%) healthcare workers, mild in 25 (12.5%) and 22 (11.0%) had severe anxiety and depression at the time of COVID-19 pandemic. This study revealed that a significant anxiety and depression was found in frontline healthcare workers during the COVID-19 pandemic. In addition, a more extensive study should be conducted which involves many other hospitals like Ayub Teaching Hospital.","Malik, Rehman, Naz, Rehman, Syed, Mushtaq, Haseeb","https://doi.org/10.55519/JAMC-03-S1-10650","20221122"," COVID-19 pandemic; Anxiety; ;  Depression; Healthcare workers","PubMed","Undecided","","","","","","","","","","","","","False","False","","","","","False","False","False","","False","False","False","False","False","False","False","False","False","","","","","","","","","","","","","","","","","","","","","","","","","","","","","","","","","","","","","","","","","","","","","","","","","","","","2022-11-23","",41421,""
"Adolescent mental health problems in early stages of the COVID-19 pandemic were masked by lockdown measures and restrictions","In the <i>BJPsych Open</i> Wong et al examined the influence of lockdown stringency during early stages of the COVID-19 pandemic on psychiatric emergency presentations among children and adolescents from ten countries. Data from March and April 2019 were compared with the same time frame in 2020, with particular focus on self-harm admissions. In this editorial, the publication is summarised and potential implications for the field and future studies are discussed.","Rockstroh, Kaess","https://doi.org/10.1192/bjo.2022.606","20221122","COVID-19; Self-harm; admissions; lockdown; paediatric mental illness","PubMed","Undecided","","","","","","","","","","","","","False","False","","","","","False","False","False","","False","False","False","False","False","False","False","False","False","","","","","","","","","","","","","","","","","","","","","","","","","","","","","","","","","","","","","","","","","","","","","","","","","","","","2022-11-23","",41422,""
"Determinants of depressive symptoms increase in older persons during the COVID-19 pandemic: evidence from Czech cohort study using repeated assessments","Numerous studies reported higher levels of mental health issues during the COVID-19 pandemic but only a minority used repeated measurements. We investigated change in depressive symptoms in the Czech ageing cohort and the impact of pre-existing and COVID-19-related stressors. We used data on 2853 participants (mean age 73.4 years) from the Czech part of the prospective Health, Alcohol and Psychosocial factors In Eastern Europe cohort that participated in postal questionnaire surveys before (September 2017-June 2018) and during the pandemic (October 2020-April 2021). Participants reported their depressive symptoms using the Centre for Epidemiological Studies-Depression Scale including 10 (CESD-10) tool. A principal component analysis (PCA) was used to create representative components of the pandemic-related stressors. The impact of the stressors on change in depressive symptoms was tested using multivariable linear regression, after adjustment for age and potential confounders. Three patterns of the pandemic-related stressors ('financial stressors', 'social and perception stressors' and 'death and hospitalisation stressors') were extracted from the PCA. The mean CESD-10 score increased from 4.90 to 5.37 (p&lt;0.001). In fully adjusted models, significantly larger increases in depression score were reported by older people (&#x3b2;=0.052; p=0.006), those with poor self-rated health (&#x3b2;=0.170; p&lt;0.001), those who experienced death or hospitalisation of a close person (&#x3b2;=0.064; p&lt;0.001), social deprivation (&#x3b2;=0.057; p&lt;0.001), delays in healthcare (&#x3b2;=0.048; p=0.005) and those who suffered from COVID-19 (&#x3b2;=0.045; p=0.008). This study confirms an increase in depressive symptoms in older persons during the pandemic and identified several pandemic-related risk factors suggesting that public health policies should address this vulnerable group by adopting the preventing strategies.","Daleck&#xe1;, Pikhart, Barto&#x161;kov&#xe1;, &#x10c;apkov&#xe1;, Bob&#xe1;k","https://doi.org/10.1136/jech-2022-219412","20221122","COVID-19; aging; depression","PubMed","Undecided","","","","","","","","","","","","","False","False","","","","","False","False","False","","False","False","False","False","False","False","False","False","False","","","","","","","","","","","","","","","","","","","","","","","","","","","","","","","","","","","","","","","","","","","","","","","","","","","","2022-11-23","",41423,""
