"title","abstract","authors","link","date","subject","source","initial_decision","q0","q1","q2","q3","q4","q5","q6","q7","q8","q9","q10","q11","q12","q13","q14","q15","q16","q17","q18","q19","q20","q21","q22","q23","q24","q25","q26","q27","q28","q29","q30","q31","q32","q33","q34","q35","q36","q37","q38","q39","q40","q41","q42","q43","q44","q45","q46","q47","q48","q49","q50","q51","q52","q53","q54","q55","q56","q57","q58","q59","q60","q61","q62","q63","q64","q65","q66","q67","q68","q69","q70","q71","q72","q73","q74","q75","q76","q77","q78","q79","q80","exclusion_reason","extraction_date","expert_decision","ID","o1"
"The change in anxiety and depression levels of chronic obstructive pulmonary disease patients during the COVID-19 pandemic period: a follow-up study","Objective: The Covid-19 pandemic has led to the postponement of applications to health institutions due to the risk of transmission of the disease in individuals with chronic diseases, and to an increase in the level of anxiety due to its more severe/fatal course when infected. Chronic obstructive pulmonary patients are among the most affected groups. In this study, the change in anxiety/depression status during the pandemic process in chronic obstructive pulmonary patients was investigated. Material and Methods: The study was conducted in chronic obstructive pulmonary patients anxiety/depression scores were measured by applying the ""Hospital Anxiety/Depression Scale""(HAD) before pandemia (November2019/March-2020). With the start of the pandemic process in our country in March2020, in order to determine how our patients were affected by the pandemic, the HAD scale was repeated by reaching the same patients by phone in the 18 months of the pandemic (September/2021). The anxiety/depression scores of the patients before and 18 months of the pandemic were compared. The data were analyzed in SPSS 22.0 program. In comparison, X2 and t-tests were used, independent groups.","Bozkurt, N.; Bozkurt, A. I.","https://doi.org/10.5336/archlung.2022-88122","","Database: CAB Abstracts; Publication type: article; Publication details: T..rkiye Klinikleri Archives of Lung; 21(1):1-8, 2022.","WHO","Undecided","","","","","","","","","","","","","False","False","","","","","False","False","False","","False","False","False","False","False","False","False","False","False","","","","","","","","","","","","","","","","","","","","","","","","","","","","","","","","","","","","","","","","","","","","","","","","","","","","2022-04-08","",29801,""
"Six-Week Hospital-Based Pulmonary Rehabilitation in Covid Pneumonia ICU Survivors: Experience from a Tertiary Care Center in Central India","OBJECTIVE: There is very limited data on the usefulness of pulmonary rehabilitation in patients with coronavirus pneumonia who have survived intensive care unit care. The primary aim was to explore the feasibility of conducting a pulmonary rehabilitation program in patients with coronavirus disease-19 pneumonia surviving intensive care. The secondary aim was to study the impact of a hospital-based 6-week pulmonary rehabilitation program on exercise capacity, quality of life, and psychological parameters in these patients. This study was conducted at the Center for Pulmonary Rehabilitation, Department of Pulmonary Medicine of the institute. MATERIAL AND METHODS A total of 27 patients were enrolled. Among them, 14 patients who completed the desired 12 sessions over 6 weeks constituted the pulmonary rehabilitation group and 13 patients who either did not consent or defaulted within the first 2 weeks were considered as controls. Both groups had assessments at 0 and 6 weeks that included a 6-Minute Walk Test, Incremental Shuttle Walk Test, mMRC Dyspnea Scale, Baseline Dyspnea Index, and Transitional Dyspnea Index, Saint George's Respiratory Questionnaire score, and Depression, Anxiety, Stress Scale-21 score. RESULTS: Significant improvement in dyspnea by mMRC (P = .01) and exercise capacity as measured by 6-Minute Walk Test (P &lt;.001) and Incremental Shuttle Walk Test (P = .025) was seen in the pulmonary rehabilitation group as compared to the control group. There was no significant improvement in quality of life and psychological parameters (Depression, Anxiety, Stress Scale 21 score) after 6 weeks of pulmonary rehabilitation program as measured in our study. CONCLUSION: Pulmonary rehabilitation is feasible and appears promising in coronavirus disease acute respiratory distress syndrome survivors. However, data from other centers and a larger number of patients are required to imbibe conclusive results.","Khurana, A. K.; Hussain, A.; Goyal, A.; Karna, S. T.; Saigal, S.; Soman, R. K.; Verma, M.; Khadanga, S.; Sahu, G.; Singh, B.","https://doi.org/10.5152/TurkThoracJ.2022.21159","","Database: EMBASE; Publication type: article; Publication details: Turkish Thoracic Journal; 23(2):89-96, 2022.","WHO","Undecided","","","","","","","","","","","","","False","False","","","","","False","False","False","","False","False","False","False","False","False","False","False","False","","","","","","","","","","","","","","","","","","","","","","","","","","","","","","","","","","","","","","","","","","","","","","","","","","","","2022-04-08","",29802,""
"Experiences and Psychosocial Difficulties of Frontline Health Care Workers Struggling With COVID-19 in Turkey: A Qualitative Study","AIM: This study was performed to explore the experiences and the psychosocial difficulties faced by nurses and physicians involved in the treatment and care for COVID-19 adult patients in the intensive care unit. METHOD: The interpretative phenomenological approach was used, and the data were gathered between June and July, 2020 in Rize using face-to-face interviews. The sample consisted of 10 nurses and 5 physicians. The thematic analysis was utilized to analyze the data. The Consolidated Criteria for Reporting Qualitative Research (COREQ) were followed in the study. RESULTS: The experiences of nurses and physicians were categorized under three themes and subcategories. The theme of ""Going Through Psychosocial Changes"" was divided into decreased emotional well-being and experiencing social changes, the theme of ""Work-Related Challenges"" was divided into losing the routines and economic concerns, and the theme of ""Felt Gains"" was divided into realizing one's worth and increased motivation. CONCLUSION: The study revealed that nurses and physicians are supported, respected, and described as heroes by Turkish society. However, they are psychologically and socially adversely affected, they display negative and positive emotions, and experience psychological growth. In addition, nurses complain about insufficient and unfair payment. Despite all these challenges, nurses and physicians continue to work with increasing emotional resistance. It is recommended to be aware of the problems that they experience during and after the COVID-19 pandemic, protect their mental health, provide adequate economic support, especially for nurses, and take necessary measures by collecting data that may be a guide for subsequent outbreaks.","Sahin, C. U.; Aydin, M.; Usta, A.; Sakin, M.","https://doi.org/10.5152/fnjn.2022.21053","","Database: Web of Science; Publication type: article; Publication details: Florence Nightingale Journal of Nursing; 30(1):11, 2022.","WHO","Undecided","","","","","","","","","","","","","False","False","","","","","False","False","False","","False","False","False","False","False","False","False","False","False","","","","","","","","","","","","","","","","","","","","","","","","","","","","","","","","","","","","","","","","","","","","","","","","","","","","2022-04-08","",29803,""
"Difficulty in work practices and depression due to the COVID-19 pandemic","","Ishida, Hina, Ichikura, Kanako, Imura, Riho, Fukase, Yuko, Murase, Hanako, Tagaya, Hirokuni","https://doi.org/10.4992/JJPSY.93.20068","","Database: J-STAGE; Publication type: article; Publication details: The Japanese journal of psychology;: 93.20068-93.20068, 2022.","WHO","Undecided","","","","","","","","","","","","","False","False","","","","","False","False","False","","False","False","False","False","False","False","False","False","False","","","","","","","","","","","","","","","","","","","","","","","","","","","","","","","","","","","","","","","","","","","","","","","","","","","","2022-04-08","",29804,""
"Using text analysis to assess the mental health impacts of COVID-19 on rural healthcare providers (Special Issue: Rural research in the time of COVID)","The pandemic increased the stress levels of frontline healthcare providers in every country across the globe, and continues to do so. Health care providers in the rural regions of the U.S. were more vulnerable to the impact of COVID-19 due to the lack of resources and the population they serve. A qualitative study of 25 rural healthcare providers in a western U.S. state was conducted during 2020. In this report, Linguistic Inquiry and Word Count (LIWC) was used to compare the use of emotion and reward words in 12 providers interviewed before the onset of COVID-19 on March 11, 2020, to 13 interviews conducted after COVID-19 onset. Results indicated that providers used fewer positive emotion words after COVID-19 onset compared to before COVID. Negative emotion words also decreased. Words related to the rewarding aspects of their work increased after COVID-19, but differed among the pre- and post-COVID groups. Positive emotion words was more strongly related to rewards in the post-COVID group. Providers reported concerns about access to care for those unable to be treated for the increased depression, anxiety and suicide ideation related to the pandemic. The rural health care system needs policies directed at improving patient access to care and greater funding.","Beseler, C. L.; McNeely, S.","https://doi.org/10.4148/1936-0487.1110","","Database: CAB Abstracts; Publication type: article; Publication details: Online Journal of Rural Research & Policy; 17(1):1-9, 2022.","WHO","Undecided","","","","","","","","","","","","","False","False","","","","","False","False","False","","False","False","False","False","False","False","False","False","False","","","","","","","","","","","","","","","","","","","","","","","","","","","","","","","","","","","","","","","","","","","","","","","","","","","","2022-04-08","",29805,""
"The influence of the COVID-19 pandemic and the first UK lockdown on older age presentations to a regional psychiatric liaison service: A retrospective observational study","Background: Loneliness and social isolation may have increased during the coronavirus disease 2019 (COVID-19) pandemic, possibly increasing mental health problems. However, due to fears of contracting COVID-19, patients may not have presented to hospitals. Aims: We assessed the impact of the COVID-19 pandemic measures and lockdown on elderly (=65 years) presentations to a psychiatric liasion service. Settings and Design: A UK regional liasion psychiatry service. Materials and Methods: Mixed methods methodologies were used to assess data between 01/01/20 and 31/08/20, which were compared to data from the same time period in 2019. Statistical and thematic analyses were conducted to understand drivers of presentations. Statistical Analysis: Nonparametric testing and analysis of variance (ANOVA). Results: Presentations to liaison psychiatry reduced by 13% for 01-08/2020 compared to 01-08/2019, with a 42% reduction during lockdown. Average weekly presentations significantly decreased during the main lockdown months only (April 2019 vs. 2020: 213.0 [12.3] vs. 110.3 [22.9] [adjusted P = 0.006], May 2019 vs. 2020: 209.5 [14.6] vs. 148.8 [12.3] [adjusted P = 0.006]). There was only a trend toward reduced elderly presentations from January to August 2020 and during lockdown. Lockdown pressures did not drive significantly more new elderly presentations. However, we still found a highly significant difference in the distribution of causal factors for the elderly presentations affected by the pressures of lockdown compared to those who were not. Conclusions: A trend toward reduced elderly presentations during lockdown and the pandemic was found. Thematic analysis supported by further statistical analysis of the drivers of elderly presentations showed that the pressures of lockdown clearly affected older age liaison psychiatry presentations.","Shinwari, Sara, Odejimi, Opeyemi, Bagchi, Dhruba","https://doi.org/10.4103/indianjpsychiatry.indianjpsychiatry_243_21","","Database: CINAHL; Publication type: article; Publication details: Indian Journal of Psychiatry; 64(2):178-184, 2022.","WHO","Undecided","","","","","","","","","","","","","False","False","","","","","False","False","False","","False","False","False","False","False","False","False","False","False","","","","","","","","","","","","","","","","","","","","","","","","","","","","","","","","","","","","","","","","","","","","","","","","","","","","2022-04-08","",29806,""
"Prevalence of psychological outcomes and its associated factors in healthcare personnel working during COVID-19 outbreak in India","Background: Care of COVID-19 patients has been shown to affect the mental health of healthcare personnel (HCP), however, there is little data reflecting psychological health of HCP in India. Aims: The present study was undertaken to assess the prevalence of psychological outcomes and its association with various sociodemographic and occupational factors among the HCP in India. Methodology: A cross-sectional, online survey, using snowball sampling method was conducted between June 1, 2020, and June 22, 2020. The HCP working in COVID-19 designated hospitals across India were invited to participate. Patient Health Questionnaire-4 and 19-item stress-related questionnaire were used to evaluate symptoms of overall anxiety, depression, COVID-19 infection specific anxiety, exhaustion, and workload. Results: In this cross-sectional study with 2334 HCP from 27 states and 7 union territories of India;17.9% of participants had depression, 18.7% had overall anxiety, 26.5% had exhaustion, 30.3% reported heavy workload, and 25.4% had COVID-19 infection-specific anxiety, respectively. The HCP working in states with higher caseload was a common risk factor for overall anxiety (odds ratio [OR], 1.7;P &lt; 0.001), depression (OR, 1.6;P &lt; 0.001), COVID-19 infection-specific anxiety (OR, 2.5;P &lt; 0.001), exhaustion (OR, 3.1;P &lt; 0.001), and heavy workload (OR, 2.6;P &lt; 0.001). Nurses were more at risk for depression (OR, 2.2;P &lt; 0.001), anxiety specific to COVID-19 infection (OR, 1.3;P = 0.034), and heavy workload (OR, 2.9;P &lt; 0.001);while doctors were more at risk for overall anxiety (OR, 2.0;P = 0.001) and exhaustion (OR, 3.1;P &lt; 0.001). Conclusions: Frontline workers, specifically nurses and doctors, and those working in states with high COVID-19 caseload are more at risk for adverse psychological outcomes. The relatively less prevalence compared with other countries, is perhaps a reflection of measures undertaken, including early lockdown, ensuring better all-round preparedness and social norms.","Sharma, Gautam, Sharma, Payal, Mohan, Bishav, Agarwal, Aman, Lama, Sudha, Jat, Mansingh, Biju, K. C.; Upadhyay, Palak, Gupta, Anupama, Mohanty, Sriloy, Miglani, Mitthat, Sharma, Sarit, Sagar, Rajesh, Prabhakaran, Dorairaj, Pandey, R. M.","https://doi.org/10.4103/indianjpsychiatry.indianjpsychiatry_60_21","","Database: CINAHL; Publication type: article; Publication details: Indian Journal of Psychiatry; 64(2):151-158, 2022.","WHO","Undecided","","","","","","","","","","","","","False","False","","","","","False","False","False","","False","False","False","False","False","False","False","False","False","","","","","","","","","","","","","","","","","","","","","","","","","","","","","","","","","","","","","","","","","","","","","","","","","","","","2022-04-08","",29807,""
"Quality of Life of Hemodialysis Patients during COVID-19 Pandemic in Gatoel Hospital, Mojokerto City","AIM: The purpose of this study was to analyze the quality of life of hemodialysis patients during the COVID-19 pandemic. METHODS: This study used a descriptive design. The sample in this study was hemodialysis patients at the Gatoel Hospital, Mojokerto City, as many as 122 respondents who were determined using simple random sampling technique. The sample criteria in this study were hemodialysis patients at Gatoel Hospital, Mojokerto City, undergoing hemodialysis therapy &lt;2 years, and willing to participate in research activities. The research instrument used was adopted from the WHOQOL-BREF questionnaire. RESULTS: From the results of the study, it was found that more than half of the respondents had poor physical health dimensions as many as 62 respondents (50.8%), more than half of respondents had poor mental health dimensions as many as 68 respondents (55.7%), more than half of respondents had social health dimensions. Bad as many as 62 respondents (50.8%) and most respondents have poor functional health dimensions as many as 74 respondents (60.7%). CONCLUSION: It was found that more than half of the respondents in this study had poor quality of life. More than half of the respondents had physical health dimensions in the poor category, more than half of the respondents had mental health dimensions in the bad category, more than half of the respondents had social health dimensions in the bad category and most of the respondents had functional health dimensions in the bad.","Darsini, D.; Notobroto, H. B.; Afiyah, R. K.; Cahyono, E. A.; Aryani, H. P.; Rahman, F. S.","https://doi.org/10.3889/oamjms.2022.7583","","Database: EMBASE; Publication type: article; Publication details: Open Access Macedonian Journal of Medical Sciences; 10(E):293-302, 2022.","WHO","Undecided","","","","","","","","","","","","","False","False","","","","","False","False","False","","False","False","False","False","False","False","False","False","False","","","","","","","","","","","","","","","","","","","","","","","","","","","","","","","","","","","","","","","","","","","","","","","","","","","","2022-04-08","",29808,""
"COVID-19 pandemic: Changes in the emotions, body weights and nutrition habits of individuals during social intervention measures","BACKGROUND: During the COVID-19 pandemic, the increase in the anxiety levels of individuals is associated with the increase in body weight. OBJECTIVE: To evaluate the effects of changes in individuals' experiences and mood on eating habits and body weights in during social restrictions due to COVID-19. METHODS: The study included 623 adults in Turkey. Demographic characteristics, anthropometric measurements, information about nutritional habits during the pandemic period were questioned via an online survey. The Beck Depression Inventory (BDI) was used to evaluate individuals' negative perspectives. RESULTS: The rate of patients who experienced body weight changes during the pandemic period was 61.4% (40.2% experienced increase), the mean BDI value was found to be higher in individuals whose body weight increased/decreased compared to those who experienced no change in body weight (p = 0.008, p = 0.02, respectively). Variables that positively affected the BDI scores, which was performed in individuals with increased body weight, main meal numbers (p &lt; 0.03), and change in dried fruit consumption (p = 0.05). The variables that negatively affected the BDI scores were body weight increase (p = 0.05) and changes in cheese consumption. CONCLUSIONS: We found that the changes in the emotional state during COVID-19 had an effect on dietary habits and body weight. There is a need for more comprehensive randomized studies on the interaction between lifestyle changes during the social intervention period due to the COVID-19 epidemic, quality of life, emotional state and eating habits.","Akkus, O. O.; Atalay, B. G.; Parlak, E.","https://doi.org/10.3233/mnm-210006","","Database: Web of Science; Publication type: article; Publication details: Mediterranean Journal of Nutrition and Metabolism; 15(1):11-21, 2022.","WHO","Undecided","","","","","","","","","","","","","False","False","","","","","False","False","False","","False","False","False","False","False","False","False","False","False","","","","","","","","","","","","","","","","","","","","","","","","","","","","","","","","","","","","","","","","","","","","","","","","","","","","2022-04-08","",29809,""
"PUBG Ban and Issues of Online Child Safety During COVID-19 Lockdown in India: A Critical Review from the Indian Information Technology Act Perspectives","In June 2020 India opted for banning 59 Chinese Apps. Contrary to the apprehension of banning gaming apps including PUBG, the government did not do so when the Chinese apps were banned. But soon PUBG also got banned in India. Several stakeholders had raised their concerns in this regard as PUBG may affect the mental health of children who are the major users of this app. But on the other hand, it had been observed that PUBG had remained the biggest respite for children who were confined to homes due to COVID-19. S.69A of the Information Technology Act 2000 (amended in 2008) had been the main tool by the government to block access to Chinese apps. PUBG developers had however tried to outsmart S.69A of the Information Technology Act, 2000 (amended in 2008), which had been used primarily to block the website and by using Artificial Intelligence for preventing children below 18 from being engaged for a continuous period, being exposed to nudity, etc. This article aims to analyse the tussle between the scope and inherent meaning of S.69A and 79 of the Indian Information technology Act, 2000 (amended in 2008) and the ever-developing due diligence of the game developers with special concern for child safety and mental health of the children, which may make the later a winner or a loser in the legal battleground.","Halder, D.","https://doi.org/10.2298/tem2103303h","","Database: Web of Science; Publication type: article; Publication details: Temida; 24(3):303-327, 2021.","WHO","Undecided","","","","","","","","","","","","","False","False","","","","","False","False","False","","False","False","False","False","False","False","False","False","False","","","","","","","","","","","","","","","","","","","","","","","","","","","","","","","","","","","","","","","","","","","","","","","","","","","","2022-04-08","",29810,""
"Observed effects of the COVID-19 pandemic on the life satisfaction, psychological distress and loneliness of Australian carers and non-carers","Using six waves of longitudinal data, we investigate wellbeing, psychological distress and loneliness differences between informal carers and non-carers in the context of COVID-19-related policy changes in Australia. Wellbeing levels fluctuated along with the virus case numbers. Free childcare temporarily alleviated the disparity between carers and non-carers, but by its cessation, carers, in particular, reported lower wellbeing and higher psychological distress. Wage subsidies and income supports had opposing effects for carers' and non-carers' mental health but decreased the loneliness of both groups. Victorians, living in the state where the second wave of infections in Australia was concentrated, experienced worse outcomes than other Australians.","Abbasi-Shavazi, A.; Biddle, N.; Edwards, B.; Jahromi, M.","https://doi.org/10.1332/239788221x16323394592678","","Database: Web of Science; Publication type: article; Publication details: International Journal of Care and Caring; 6(1):179-209, 2022.","WHO","Undecided","","","","","","","","","","","","","False","False","","","","","False","False","False","","False","False","False","False","False","False","False","False","False","","","","","","","","","","","","","","","","","","","","","","","","","","","","","","","","","","","","","","","","","","","","","","","","","","","","2022-04-08","",29811,""
"Virtual care facing the COVID-19 outbreak in China","New ways of care have emerged as the COVID-19 pandemic sweeps the world, including virtual care exchanged in cyberspace. As people are physically isolated by travel restrictions and guidelines to avoid gatherings and keep at distance, cyberspace has become a major place in which people care about and for each other. When government-oriented medical and civil service systems malfunctioned upon the rapid outbreak in Hubei Province, China, Chinese people used online social platforms to provide individual and organised care activities - disseminating information, petitioning for access to healthcare, offering voluntary mental health interventions and facilitating embodied and material support - to respond to the challenges of local people at the epicentre. This article intends to acknowledge and showcase the virtual care that Chinese people demonstrated transnationally upon the outbreak of COVID-19 in China, and discusses the significance and impacts of this way of care in the cyberspace era.","Zhang, J. X.; Yang, M. H.; Sui, Z.","https://doi.org/10.1332/239788221x16196129721067","","Database: Web of Science; Publication type: article; Publication details: International Journal of Care and Caring; 6(1):275-281, 2022.","WHO","Undecided","","","","","","","","","","","","","False","False","","","","","False","False","False","","False","False","False","False","False","False","False","False","False","","","","","","","","","","","","","","","","","","","","","","","","","","","","","","","","","","","","","","","","","","","","","","","","","","","","2022-04-08","",29812,""
