"title","abstract","authors","link","date","subject","source","initial_decision","q0","q1","q2","q3","q4","q5","q6","q7","q8","q9","q10","q11","q12","q13","q14","q15","q16","q17","q18","q19","q20","q21","q22","q23","q24","q25","q26","q27","q28","q29","q30","q31","q32","q33","q34","q35","q36","q37","q38","q39","q40","q41","q42","q43","q44","q45","q46","q47","q48","q49","q50","q51","q52","q53","q54","q55","q56","q57","q58","q59","q60","q61","q62","q63","q64","q65","q66","q67","q68","q69","q70","q71","q72","q73","q74","q75","q76","q77","q78","q79","q80","exclusion_reason","extraction_date","expert_decision","ID","o1"
"COVID-19-related anxieties do not decrease support for liberal democracy","The COVID-19 pandemic led to widespread fear among the population. Early studies suggested that this resulted in exclusionary attitudes and increased support for discriminatory policy measures. We still lack an understanding of the longer-term, potentially erosive consequences that COVID-19-specific anxieties may carry for citizens' commitment to liberal democratic norms. In this research note, we present evidence from an original experiment in which we manipulate individuals' cognitive accessibility of their fears related to COVID-19. We implemented this experiment in Hungary and Romania - two cases where illiberal attitudes are most likely to amplify under conditions of fear - a year and a half after the outbreak of the pandemic. The results show that our intervention is successful in elevating respondents' levels of worry, anxiety and fear when thinking about infectious diseases like COVID-19. However, these emotions do not carry secondary effects on individuals' levels of right-wing authoritarianism, nationalism or outgroup hostility, nor do they affect preferences for specific discriminatory policy measures aimed to fight a potential resurgence of COVID-19. We discuss these findings in light of the literature on the demand-side determinants of democratic backsliding and the consequences of emotions on political&#xa0;behaviour.","Anghel, Schulte-Cloos","https://doi.org/10.1111/1475-6765.12554","20221019","COVID&#x2010;19; Eastern Europe; anxiety; autocratization; political attitudes","PubMed","Undecided","","","","","","","","","","","","","False","False","","","","","False","False","False","","False","False","False","False","False","False","False","False","False","","","","","","","","","","","","","","","","","","","","","","","","","","","","","","","","","","","","","","","","","","","","","","","","","","","","2022-11-23","",41462,""
"Association of Residence Type on Smoking in South Korean Adolescents during the COVID-19 Pandemic: Findings from a National Survey","The closure of schools due to the COVID-19 pandemic has forced adolescents to stay home. These disruptions, as well as a significant decrease in social access, have impacted smoking behavior. This study identified the association between the adolescents' type of residence and tobacco product use. A cross-sectional study (using data from the Korea Youth Risk Behavior Web-based Survey) examined 3774 students in 2019 (pre-pandemic) and 2575 students in 2020 (during the pandemic). The participants were South Korean middle and high school students aged 13-19 years. Using multinomial logistic regression, it was shown that adolescents who lived alone or in a boarding house had a higher risk of being an e-cigarette smoker compared with those who lived with family or relatives (OR = 6.49, CI = 2.06-20.45). Living in a dormitory or orphanage also increased the risk of dual tobacco use compared with living with family (OR = 2.09, 95% CI = 1.13-3.84). With the advent and continuation of the COVID-19 pandemic, this effect became more significant in 2020 than in 2019. Our findings support the theory that residential differences affect adolescent smoking behavior and highlight the importance of integrated smoking bans and educational programs to control adolescent smoking.","Kwon, Cho","https://doi.org/10.3390/ijerph191912886","20221017","adolescent health; residence characteristics; smoking; tobacco use; Adolescent; Adolescent Behavior; COVID-19; Cross-Sectional Studies; Electronic Nicotine Delivery Systems; Humans; Pandemics; Republic of Korea; Smoking","PubMed","Undecided","","","","","","","","","","","","","False","False","","","","","False","False","False","","False","False","False","False","False","False","False","False","False","","","","","","","","","","","","","","","","","","","","","","","","","","","","","","","","","","","","","","","","","","","","","","","","","","","","2022-11-23","",41463,""
"Naturally occurring spike mutations influence the infectivity and immunogenicity of SARS-CoV-2","Mutations in SARS-CoV-2 variants of concern (VOCs) have enhanced transmissibility and immune evasion with respect to current vaccines and neutralizing antibodies (NAbs). How naturally occurring spike mutations affect the infectivity and antigenicity of VOCs remains to be investigated. The entry efficiency of individual spike mutations was determined in vitro using pseudotyped viruses. BALB/c mice were immunized with 2-dose DNA vaccines encoding B.1.1.7, B.1.351,&#xa0;B.1.1.529&#xa0; and their single mutations. Cellular and humoral immune responses were then compared to determine the impact of individual mutations on immunogenicity. In the B.1.1.7 lineage, Del69-70 and Del 144 in NTD, A570D and P681H in SD1 and S982A and D1118H in S2 significantly increased viral entry, whereas T716I resulted in a decrease. In the B.1.351 lineage, L18F and Del 242-244 in the NTD, K417N in the RBD and A701V in S2 also increased viral entry. S982A weakened the generation of binding antibodies. All sera showed reduced cross-neutralization activity against B.1.351, B.1.617.2 (Delta) and B.1.1.529 (Omicron BA.1). S982A, L18F, and Del 242-244 hindered the induction of cross-NAbs, whereas Del 69-70, Del144, R246I, and K417N showed the opposite effects. B.1.351 elicited adequate broad cross-NAbs against both B.1.351 and B.1.617.2. All immunogens tested, however, showed low neutralization against circulating B.1.1.529. In addition, T-cell responses were unlikely affected by mutations tested&#xa0;in the spike. We conclude that&#xa0;individual spike mutations influence viral infectivity and vaccine immunogenicity. Designing VOC-targeted vaccines is likely necessary to overcome immune evasion from current vaccines and neutralizing antibodies.","Peng, Zhou, Liu, Wang, Xu, Zhao, Yang, Au, Huang, Liu, Chen","https://doi.org/10.1038/s41423-022-00924-8","20221103","SARS-CoV-2; Single mutation; T cell responses; Variants of Concern; neutralizing antibody; vaccine immunogenicity; Animals; Humans; Mice; Antibodies, Neutralizing; Antibodies, Viral; COVID-19; Mice, Inbred BALB C; Mutation; Neutralization Tests; SARS-CoV-2; Spike Glycoprotein, Coronavirus","PubMed","Undecided","","","","","","","","","","","","","False","False","","","","","False","False","False","","False","False","False","False","False","False","False","False","False","","","","","","","","","","","","","","","","","","","","","","","","","","","","","","","","","","","","","","","","","","","","","","","","","","","","2022-11-23","",41464,""
"COVID-19 Whole-Genome Resequencing with Redundant Tiling PCR and Subtract-Based Amplicon Normalization Successfully Characterized SARS-CoV-2 Variants in Clinical Specimens","With an increasing number of severe acute respiratory syndrome coronavirus-2 (SARS-CoV-2) sequences gathered worldwide, we recognize that deletion mutants and nucleotide substitutions that may affect whole-genome sequencing are accumulating. Here, we propose an additional strategy for tiling PCR for whole-genome resequencing, which can make the pipeline robust for mutations at the primer annealing site by a redundant amplicon scheme. We further demonstrated that subtracting overrepresented amplicons from the multiplex PCR products reduced the bias of the next-generation sequencing (NGS) library, resulting in decreasing required sequencing reads per sample. We applied this sequencing strategy to clinical specimens collected in Bangladesh. More than 80% out of the 304 samples were successfully sequenced. Less than 5% were ambiguous nucleotides, and several known variants were detected. With the additional strategies presented here, we believe that whole-genome resequencing of SARS-CoV-2 from clinical samples can be optimized.","Sugi, Rahman, Rahim, Hasan, Kawai, Hayashida, Yamagishi","https://doi.org/10.1155/2022/2109641","20221011","","PubMed","Undecided","","","","","","","","","","","","","False","False","","","","","False","False","False","","False","False","False","False","False","False","False","False","False","","","","","","","","","","","","","","","","","","","","","","","","","","","","","","","","","","","","","","","","","","","","","","","","","","","","2022-11-23","",41465,""
"A five-year review of prevalence and treatment outcomes of pre-extensively drug-resistant plus additional drug-resistant tuberculosis in the Henan Provincial Tuberculosis Clinical Medicine Research Centre","This study investigated the prevalence and significant clinical outcomes of pre-extensively drug-resistant plus additional drug-resistant tuberculosis (pre-XDR-plus) in Henan Provincial Chest Hospital between 2017 and 2021. We analysed and summarized the drug sensitivity test (DST) results of clinical Mycobacterium tuberculosis (MTB) strains in TB patients seeking care in the Tuberculosis Clinical Medical Research Centre of Henan Province between 2017 and 2021. Medical records of pre-extensively drug-resistant plus additional drug-resistant TB patients were statistically analysed, including demographic characteristics, regimens, and outcomes. Of the 3689 Mycobacterium tuberculosis strains, 639 (17.32%), 353 (9.56%), and 109 (2.95%), multidrug-resistant tuberculosis (MDR-TB), pre-extensively drug-resistant tuberculosis (pre-XDR), and pre-XDR-plus, respectively. The proportion of MDR decreased from 19.1% in 2017 to 17.5% in 2021 (&#x3c7;<sup>2</sup>&#xa0;=&#xa0;0.686, P = 0.407), the proportion of pre-XDR from 11.4% in 2017 to 9.0% in 2021 (&#x3c7;<sup>2</sup>&#xa0;=&#xa0;2.39, P&#xa0;=&#xa0;0.122), and pre-XDR-plus from 4.7% in 2017 to 1.8% in 2020, with the declining trend was significant (&#x3c7;<sup>2</sup>&#xa0;=&#xa0;9.348, P&#xa0;=&#xa0;0.002). The most commonly used anti-TB drugs were pyrazinamide (PZA, 37/46, 80.43%) and cycloserine (CS, 32/46, 69.57%), followed by linezolid (LZD, 25/46, 54.35%), protionamide (TH, 25/46, 54.35%), and para-aminosalicylic acid (PAS, 23/46, 50.00%). Patients receiving the LZD regimen were 5 times more likely to have a favourable outcome than those not receiving LZD (OR&#xa0;=&#xa0;6.421, 95% CI 2.101-19.625, P&#xa0;=&#xa0;0.001). Patients receiving a regimen containing CS were 4 times more likely to have a favourable outcome compared to those not taking CS (OR&#xa0;=&#xa0;5.444, 95% CI 1.650-17.926, P&#xa0;=&#xa0;0.005). Our data suggest that the population of pre-XDR-plus had significantly decreased over the past five years in the Henan Provincial Chest Hospital. The COVID-19 and flood disaster affect TB patients' selection of medical services. In addition, the pre-XDR-plus patients whose regimens contain LZD or CS were more likely to have favourable outcomes.","Li, Liu, Chen, Han, You, Xie, Zhao, Tan, Guo, Cheng, Wang, Li, Cheng, Xia, Niu, Wei, Wang","https://doi.org/10.1016/j.jgar.2022.09.010","20221122","CS; LZD; Mycobacterium tuberculosis; Pre-extensively drug-resistant","PubMed","Undecided","","","","","","","","","","","","","False","False","","","","","False","False","False","","False","False","False","False","False","False","False","False","False","","","","","","","","","","","","","","","","","","","","","","","","","","","","","","","","","","","","","","","","","","","","","","","","","","","","2022-11-23","",41466,""
"Calcium dobesilate reduces SARS-CoV-2 entry into endothelial cells by inhibiting virus binding to heparan sulfate","Recent reports demonstrate that SARS-CoV-2 utilizes cell surface heparan sulfate as an attachment factor to facilitate the initial interaction with host cells. Heparan sulfate interacts with the receptor binding domain of SARS-CoV-2 spike glycoprotein, and blocking this interaction can decrease cell infection. We and others reported recently that the family of compounds of 2,5-dihydroxyphenylic acid interferes with the binding of the positively charged groove in growth factor molecules to negatively charged cell surface heparan sulfate. We hypothesized that Calcium Dobesilate (CaD)-calcium salt of 2,5-dihydroxyphenylic acid-may also interfere with the binding of SARS-CoV-2 spike protein to heparan sulfate. Using lentiviral SARS-CoV-2 spike protein pseudotyped particles we show that CaD could significantly reduce pseudovirus uptake into endothelial cells. On the contrary, CaD did not affect cell infection with VSVG-expressing lentivirus. CaD could also prevent retention of SARS-CoV-2 spike protein in ex vivo perfused mouse kidney. Using microfluidic culture of endothelial cells under flow, we show that CaD prevents spike protein interaction with heparan sulfate glycocalyx. Since CaD has no adverse side effects and is approved in humans for other medical indications, our findings can rapidly translate into clinical studies.","Kiyan, Schultalbers, Chernobrivaia, Tkachuk, Rong, Shushakova, Haller","https://doi.org/10.1038/s41598-022-20973-3","20221011","Animals; COVID-19; Calcium; Calcium Dobesilate; Endothelial Cells; Heparitin Sulfate; Humans; Mice; Protein Binding; SARS-CoV-2; Spike Glycoprotein, Coronavirus; Virus Attachment","PubMed","Undecided","","","","","","","","","","","","","False","False","","","","","False","False","False","","False","False","False","False","False","False","False","False","False","","","","","","","","","","","","","","","","","","","","","","","","","","","","","","","","","","","","","","","","","","","","","","","","","","","","2022-11-23","",41467,""
"Immune-related molecular changes in the olfactory epithelium, structural alteration in the olfactory bulb, and psychosis","Olfactory dysfunction has been reproducibly reported in patients with psychosis. Consistently, some studies have reported structural abnormalities in the olfactory bulb (OB) in psychotic disorders with modest sample size. Air pollution and viral infections in the upper respiratory tract, including those of SARS-CoV-2, are reportedly risk factors for brain dysfunction and mental disorders. These risk factors can disturb the olfactory epithelium (OE) that is connected with the OB via direct neuronal projections. Nevertheless, it is unknown whether and how a disturbance of the OE could possibly affect the structure of OB in the pathophysiological context of psychotic disorders. To address this knowledge gap, we first utilized an inducible OE inflammation mouse model (IOI model) and found that OE inflammation could induce a significant reduction in the OB volume, shrinkage of the glomerular layer and the external plexiform layer of OB, and decrease in the immunoreactivity of OMP (olfactory sensory neuron marker), Vglut2 (glutamatergic presynaptic marker), CCK8 (tufted cell marker), and PGP9.5 (mitral cell marker) in the glomerular layer of OB in IOI mice compared to control mice. We then analyzed 3 Tesla magnetic resonance imaging and molecular expression profiles of olfactory neuronal cells (ONCs) biopsied from living human subjects. Interestingly, we also observed a significant reduction in the OB volume, as well as alterations in the expression profiles in ONCs in first episode psychosis (FEP) patients compared to healthy controls. Higher expression levels of IOI immune genes (genes coding immune-related transcription factors up-regulated in IOI mice) in ONCs was significantly associated with smaller volumes of the OB in FEP patients. The subgroup of FEP patients with an up-regulation of IOI immune genes had significantly smaller OB volumes than other FEP patients. Together, our study implied the existence and connections between OE and OB pathologies in psychotic disorders.","Yang, Hasegawa, Hua, Dower, Etyemez, Prasad, Duvall, Paez, Smith, Lane, Ishizuka, Kamath, Kamiya, Sawa","https://doi.org/10.1101/2022.09.23.509224","20221007","","PubMed","Undecided","","","","","","","","","","","","","False","False","","","","","False","False","False","","False","False","False","False","False","False","False","False","False","","","","","","","","","","","","","","","","","","","","","","","","","","","","","","","","","","","","","","","","","","","","","","","","","","","","2022-11-23","",41468,""
"ACE2 Affects the Expression and Function of IFITM3 During SARS-CoV-2 Pseudovirus Infection in Vero E6 Cells","COVID-19 is a globally infectious viral epidemic of great public health concern caused by severe acute respiratory syndrome coronavirus 2 (SARS-CoV-2). Angiotensin-converting enzyme 2 (ACE2) plays its role as the receptor for SARS-CoV-2 through binding with S protein and the binding results in ACE2 expression decrease. The change of ACE2 is supposed to elicit a series of cellular and molecular events. Other than as the receptor, ACE2's roles on infection by regulating other molecules need to be further studied during SARS-CoV-2 infection. In the present study, we established the ACE2 knockdown model using Vero E6 cells to study how ACE2 influenced the downstream signaling molecules. Analysis of transcriptome sequencing discovered that ACE2 alteration <i>per se</i> caused the alteration of immune factors, including some related to the viral infection-related signaling pathways. We found that ACE2 silencing induced the reduced interferon-induced transmembrane protein 3 (IFITM3) expression. Overexpression of IFITM3 promoted the SARS-CoV-2 pseudovirus infection of Vero E6 cells lacking the ACE2. It indicates that ACE2 can affect IFITM3 expression and function to affect the SARS-CoV-2 infection. Our results reveal possible mechanisms influencing SARS-CoV-2 infectivity and contribute to explaining the rapid spread and pathogenesis especially in the case of ACE2 low expression.","Long, Li, Zhang, Peng, Chen, Wang","https://doi.org/10.1089/vim.2022.0042","20220930","ACE2; COVID-19; IFITM3; SARS-CoV-2; type I interferon","PubMed","Undecided","","","","","","","","","","","","","False","False","","","","","False","False","False","","False","False","False","False","False","False","False","False","False","","","","","","","","","","","","","","","","","","","","","","","","","","","","","","","","","","","","","","","","","","","","","","","","","","","","2022-11-23","",41469,""
"Older Adults' Biobehavioral Fall Risks Were Affected by the COVID-19 Pandemic: Lessons Learned for Future Fall Prevention Research to Incorporate Multilevel Perspectives","Examining the impact of coronavirus disease 2019 (COVID-19) pandemic on fall risks may provide insight into how multilevel factors as described in National Institute of Nursing Research's (NINR's) draft strategic plan can guide future fall prevention research. This article describes the affect of COVID-19 on fall risks from the perspective of older adults who live in assisted living facilities (ALFs), and explores the needs and approaches to implement fall prevention interventions at individual, social, community, and policy levels. Exploratory survey study. Participants from a fall prevention study at 2 ALFs in Oregon were invited to the study. Survey questions asked about COVID experience, and changes in fall risks and day-to-day activities in Spring 2020. Quantitative responses were analyzed using descriptive statistics and Cohen's <i>d</i> effect sizes. Qualitative responses were analyzed using conventional content analysis. Thirteen participants (age: <i>M =</i> 87.08, standard deviation = 6.52) responded. More participants reported feeling unsteady compared to pre-COVID data (38% vs. 62%), while the proportion of those worried about falling remained the same at 38%. Participants reported negligible decreases in importance of fall prevention and small decreases in confidence of fall prevention (Cohen's <i>d</i> = -0.13 and -0.21, respectively). The themes related to the affect of COVID on fall risks were: <i>not to worry about fall risks but be cautious</i> and <i>physical activity is important, but it's hard during COVID</i>. Impact of COVID on day-to-day activities were: <i>varying degrees of concern for COVID, lack of social and community support</i>, and <i>finding unique ways to cope with COVID.</i> These individual-level perspectives suggest that older adults were at increased risk for falling. Results exemplify the influence of broader-level factors (e.g., social, community, and policy) on individual biobehavioral factors (e.g., fall risks and health behaviors), and illustrate the value of examining multilevel factors in future fall prevention research.","Kiyoshi-Teo, Izumi, Stoyles, McMahon","https://doi.org/10.1093/geroni/igac033","20220928","Biobehavioral; Health behaviors; Injury prevention; Pandemic; Socioecological framework","PubMed","Undecided","","","","","","","","","","","","","False","False","","","","","False","False","False","","False","False","False","False","False","False","False","False","False","","","","","","","","","","","","","","","","","","","","","","","","","","","","","","","","","","","","","","","","","","","","","","","","","","","","2022-11-23","",41470,""
"Connecting to Nature through 360&#xb0; Videos during COVID-19 Confinement: A Pilot Study of a Brief Psychological Intervention","Psychological interventions have been shown to be beneficial in mitigating stress related to COVID-19 confinement. According to theories of restorative environments, exposure to natural surroundings has positive effects on well-being and stress through its restorative qualities. With 360&#xb0; video-based Virtual Reality (VR), people can be exposed to nature and so better manage the consequences associated with mobility restrictions during confinement. The main aim of this pilot study was to examine whether a 360&#xb0; video-based VR intervention composed of five 13-minute sessions (once a day) has positive effects on affect, well-being, and stress. The sample was made up of 10 participants (4 men and 6 women; age&#x2009;:&#x2009;M&#x2009;=&#x2009;46.5, SD&#x2009;=&#x2009;11.7) who were confined at home (voluntarily or not) during the COVID-19 pandemic. Participants were instructed to watch a 360&#xb0; video each day (of a ""beach"" or ""lake"" environment) using their smartphone and VR glasses sent to them by mail. Participants responded with several self-reports before and/or after each session (emotions and sense of presence) and before and/or after the intervention (affect, well-being, perceived stress, perceived restorativeness of nature, and the usefulness and acceptability of the intervention). Results showed a tendency to improve positive (e.g., happiness) and negative (e.g., anxiousness) emotions and experience a high sense of presence after each session. Moreover, perceived restorative qualities of the environment and their cognitive and behavioral effects were high. A significant decrease in negative affect was found after the intervention. Usefulness and acceptability were also high. This is the first study to show that an affordable and accessible technology can be used to overcome the negative consequences of confinement and counteract its harmful psychological effects.","Navarrete, Navarro-Siurana, Herrero, Vara, Miragall, Ba&#xf1;os","https://doi.org/10.1155/2022/4242888","20220928","COVID-19; Emotions; Female; Humans; Male; Pandemics; Pilot Projects; Psychosocial Intervention","PubMed","Undecided","","","","","","","","","","","","","False","False","","","","","False","False","False","","False","False","False","False","False","False","False","False","False","","","","","","","","","","","","","","","","","","","","","","","","","","","","","","","","","","","","","","","","","","","","","","","","","","","","2022-11-23","",41471,""
