"title","abstract","authors","link","date","subject","source","initial_decision","q0","q1","q2","q3","q4","q5","q6","q7","q8","q9","q10","q11","q12","q13","q14","q15","q16","q17","q18","q19","q20","q21","q22","q23","q24","q25","q26","q27","q28","q29","q30","q31","q32","q33","q34","q35","q36","q37","q38","q39","q40","q41","q42","q43","q44","q45","q46","q47","q48","q49","q50","q51","q52","q53","q54","q55","q56","q57","q58","q59","q60","q61","q62","q63","q64","q65","q66","q67","q68","q69","q70","q71","q72","q73","q74","q75","q76","q77","q78","q79","q80","exclusion_reason","extraction_date","expert_decision","ID","o1"
"Effect of alternatives to opiates program on discharge opioid prescribing in trauma patients","INTRODUCTION: Opioid overdose deaths increased over two decades, with the incidence accelerated further during the COVID-19 pandemic. While opioids remain mainstay for trauma-related pain management, organizations are focused on reducing use. This study aimed to determine if a hospitalwide Alternatives to Opiates (ALTO) program reduced opioid prescribing at discharge after trauma. METHODS: A single-center, retrospective analysis of patients =18 years old admitted for =24 hours with primary diagnosis of traumatic injury between August 1, 2018 - October 31, 2019 was performed. Admissions before July 1, 2019, represent the control group, whereas admissions on/after represent the ALTO group. Patients with alcohol or polysubstance abuse, chronic opioid use, or in-hospital mortality were excluded. The primary outcome was incidence of opioid prescribing at discharge. Secondary outcomes were percent with in-hospital non-opioid and multimodal analgesia, and hospital and intensive care unit (ICU) length of stay (LOS). A sample size of 129 patients was needed to observe a 30% reduction in primary outcome and maintain 80% power to detect a statistically significant difference using alpha &lt; 0.05. RESULTS: A total of 703 patients were included, 471 in the control and 232 in the ALTO groups. Mean age was 59Â±22 years and 58.7% were male. Mean initial Injury Severity Score (ISS) was 9.1Â±7.7 and Charlson Comorbidity Index (CCI) was 2.7Â±2.7. In-hospital opioid prescribing was higher (70.4% vs. 87.5%, p&lt; 0.0001), and opioid discontinuation at hospital discharge occurred less frequently (60.5% vs. 56.2%, p=0.1237) after ALTO implementation. Surgical intervention, lack of ICU admission, ISS =9 and CCI =1 was associated with lower incidence of opioid discontinuation at discharge in both groups. Most patients received nonopioid (93.6 vs. 98.7%, p=0.0051) and multimodal analgesia (84.3% vs. 87.5%, p=0.3083) during hospitalization. Median hospital LOS [5(3-9) vs. 4(3-7), p=0.3427] and ICU LOS [2(0-4) vs. 3(2-5), p=0.3461] were similar. CONCLUSIONS: Opioids remain mainstay for traumarelated pain management. In our study, ALTO was not associated with a reduction in in-hospital opioid prescribing or at discharge. Identification and implementation of strategies to further reduce opioid prescribing at discharge in trauma patients are needed.","Johnston, J.; Nerenberg, S.; LaPietra, A.; Wang, A.; Kulig, C.; Foran, L.; Hlayhel, A.; Yang, J.; Parmar, D.; Elsawy, O.","https://doi.org/10.1097/01.ccm.0000812536.34842.d8","","Database: EMBASE; Publication type: article; Publication details: Critical Care Medicine; 50(1 SUPPL):780, 2022.","WHO","Undecided","","","","","","","","","","","","","False","False","","","","","False","False","False","","False","False","False","False","False","False","False","False","False","","","","","","","","","","","","","","","","","","","","","","","","","","","","","","","","","","","","","","","","","","","","","","","","","","","","2022-02-25","",27498,""
"Impact of Covid-19 pandemic on female health care workers in Odisha (India)","Purpose - The purpose of this paper is to investigate the impact of Covid-19 on female health workers (FHWs) in Odisha (India). Here, this study discusses the economic hardship of the FHWs during the pandemic time. Additionally, this study also identifies the various socio-economic factors responsible for the increasing mental stress level of FHWs in Odisha. Design/methodology/approach - The study is based on a telephonic survey method. Overall the study has collected 80 samples of FHWs from Odisha (India). Additionally, the study uses a logistic regression model to measure the impact of various socio-economic factors affecting the mental health status of FHWs during the pandemic time. Findings - The findings of this study depict that FHWs working as a Covid warrior during the pandemic time are facing severe economic vulnerability in their life. It is found that though the FHWs have worked tirelessly to save millions of human lives, but irregularity in salary payment and temporary jobs position have caused more mental distress to them. Moreover, the empirical findings have shown that factors such as joint family, social isolation, having an elderly member in their family, duty in Covid ward, staying in staff quarter and temporary job position are responsible for increasing the mental stress of FHWs in Odisha during the Covid-19 pandemic time. Originality/value - This study is a first attempt to explain the life struggle, economic vulnerability and mental stress of Indian (Odisha) FHWs working during the Covid-19 pandemic period to save millions of human lives.","Pattayat, S. S.; Patri, P.; Das, S.; Barik, R.","https://doi.org/10.1108/mhsi-12-2020-0092","","Database: Web of Science; Publication type: article; Publication details: Mental Health and Social Inclusion; 25(3):254-266, 2021.","WHO","Undecided","","","","","","","","","","","","","False","False","","","","","False","False","False","","False","False","False","False","False","False","False","False","False","","","","","","","","","","","","","","","","","","","","","","","","","","","","","","","","","","","","","","","","","","","","","","","","","","","","2022-02-25","",27499,""
"Why the new normal might be the old normalâ€”but worse","The same effect is seen in new US data showing increased rates of mental illness after covid-19 when compared with contemporary and historical controls (doi:10.1136/bmj-2021-068993, doi:10.1136/bmj.o326).56 With increased pressure on mental health services and ongoing staff shortages (doi:10.1136/bmj.o350),7 BMJ Careers has launched a new UK jobs board for mental health professionals (https://healthjobs.bmj.com). Nonetheless, worries about excessive ministerial control and the absence of clear strategies to tackle workforce shortages, social care provision, and inequalitiesâ€”as reinforced by a damning new report on the influence of race on health outcomes (doi:10.1136/bmj.o382)8â€”suggest that the UK governmentâ€™s proposals are light in important areas and with regard to persistent problems (doi:10.1136/bmj.o361).9 One conclusion is that promises to build back better or build back fairer are empty, especially when the haste to end all restrictions, including abandoning covid surveillance (doi:10.1136/bmj.o376),10 is widely condemned as ill informed and reckless (doi:10.1136/bmj.o383).11 Weâ€™re reconstructing the same flawed society that failed to respond effectively to SARS-CoV-2 and continues to fail on climate action. The answers may lie in new approaches to incentivise sustainable corporate behaviour, reduce the rich worldâ€™s consumption, and, most interestingly, to encourage â€œdegrowthâ€ (doi:10.1136/bmj-2021-068126).12 Doctors and other health professionals are stronger than they think, with influence stretching from citizens to politicians (doi:10.1136/bmj.o246).13 The challenge is to ensure that the â€œnew normalâ€ isnâ€™t simply the â€œold normalâ€ but with even more damaging consequences. 1 Loseva P. Data and distrust hamper Russiaâ€™s vaccination programme.","Abbasi, Kamran","https://doi.org/10.1136/bmj.o398","","Database: ProQuest Central; Publication type: article; Publication details: BMJ : British Medical Journal (Online); 376, 2022.","WHO","Undecided","","","","","","","","","","","","","False","False","","","","","False","False","False","","False","False","False","False","False","False","False","False","False","","","","","","","","","","","","","","","","","","","","","","","","","","","","","","","","","","","","","","","","","","","","","","","","","","","","2022-02-25","",27500,""
"Understanding the Impact of COVID-19 on Online Mental Health Forums","Like many of the disasters that have preceded it, the COVID-19 pandemic is likely to have a profound impact on people's mental health. Understanding its impact can inform strategies for mitigating negative consequences. This work seeks to better understand the impacts of COVID-19 on mental health by examining how discussions on mental health subreddits have changed in the three months following theWHO's declaration of a global pandemic. First, the rate at which the pandemic is discussed in each community is quantified. Then, volume of activity is measured to determine whether the number of people with mental health concerns has risen, and user interactions are analyzed to determine how they have changed during the pandemic. Finally, the content of the discussions is analyzed. Each of these metrics is considered with respect to a set of control subreddits to better understand if the changes present are specific to mental health subreddits or are representative of Reddit as a whole. There are numerous changes in the three mental health subreddits that we consider, r/Anxiety, r/depression, r/SuicideWatch;there is reduced posting activity in most cases, and there are significant changes in discussion of some topics such as work and anxiety. The results suggest that there is not an overwhelming increase in online mental health support-seeking on Reddit during the pandemic, but that discussion content related to mental health has changed.","Biester, L.; Matton, K.; Rajendran, J.; Provost, E. M.; Mihalcea, R.","https://doi.org/10.1145/3458770","","Database: Web of Science; Publication type: article; Publication details: Acm Transactions on Management Information Systems; 12(4):28, 2021.","WHO","Undecided","","","","","","","","","","","","","False","False","","","","","False","False","False","","False","False","False","False","False","False","False","False","False","","","","","","","","","","","","","","","","","","","","","","","","","","","","","","","","","","","","","","","","","","","","","","","","","","","","2022-02-25","",27501,""
"School Counselors and Unified Educatorâ€“Counselor Identity: A Data-Informed Approach to Suicide Prevention","School counselors are vital in crisis prevention and intervention. In this article, we discuss the unified educatorâ€“counselor identity as it informs the suicide prevention work of school counselors, illustrated with a data-based case example from a quantitative study based in one high school. This case example includes a decision tree to show how school counselors can use data to understand the suicide prevention and intervention needs of a diverse student body in their own schools.","Wachter Morris, Carrie A.; Wester, Kelly L.; Jones, Connie T.; Saron, Fantahun","https://doi.org/10.1177/2156759X211011909","","Database: ProQuest Central; Publication type: article; Publication details: Professional School Counseling; 24(1_part_3), 2021.","WHO","Undecided","","","","","","","","","","","","","False","False","","","","","False","False","False","","False","False","False","False","False","False","False","False","False","","","","","","","","","","","","","","","","","","","","","","","","","","","","","","","","","","","","","","","","","","","","","","","","","","","","2022-02-25","",27502,""
"Sick Leave and Intention to Quit the Job among Nursing Staff in German Hospitals during the COVID-19 Pandemic","Background: Sick leave and turnover of nurses exacerbate an already existing nursing shortage during the COVID-19 pandemic in Germany and other countries. Frequency and associated factors of sick leave and intention to quit among nurses need to be examined to maintain healthcare. Methods: An online survey among nursing staff (N = 757) in German hospitals was conducted between May and July 2021. Sick leave days, intention to quit, working conditions, depression, anxiety and sleep disorder symptoms, effort-reward imbalance (ERI), COVID-19-related and sociode-mographic variables were measured. Regression analyses were performed. Results: The intention to quit was present in 18.9%. One third (32.5%) reported sick leave of =10 and 12.3% more than 25 days in 12 months. Significant predictors for =10 sick leave days were infection with SARS-CoV-2, a pre-existing illness, exhaustion, trust in colleagues and fear of becoming infected. Higher ERI reward levels, perception of sufficient staff and contact with infected patients were associated with lower odds for =10 sick leave days. Lower reward levels, having changed work departments during the pandemic, working part-time and higher depression levels significantly predicted turnover intention. Conclusion: Alarmingly, many nurses intend to quit working in healthcare. Perceived reward seems to buffer both sick leave and turnover intention. Enhancing protection from COVID-19 and reducing workload might also prevent sick leave. Depression prevention, improved change management and support of part-time workers could contribute to reducing turnover intention among nurses.","Schug, C.; Geiser, F.; Hiebel, N.; Beschoner, P.; Jerg-Bretzke, L.; Albus, C.; Weidner, K.; Morawa, E.; Erim, Y.","https://doi.org/10.3390/ijerph19041947","","Database: EMBASE; Publication type: article; Publication details: International Journal of Environmental Research and Public Health; 19(4), 2022.","WHO","Undecided","","","","","","","","","","","","","False","False","","","","","False","False","False","","False","False","False","False","False","False","False","False","False","","","","","","","","","","","","","","","","","","","","","","","","","","","","","","","","","","","","","","","","","","","","","","","","","","","","2022-02-25","",27503,""
"Predictors of Short-Term Alcohol Drinking in Patients with Alcohol Use Disorders during the Third Wave of the COVID-19 Pandemic: Prospective Study in Three Addiction Outpatient Centers in France","The present study investigates the extent to which the COVID-19 crisis disturbed different life domains of patients with alcohol use disorder (AUD) and assessed the associations between these disturbances and the risk of short-term alcohol drinking. All patients aged &gt;18 years receiving outpatient care at three addiction treatment facilities from 15 April to 30 May 2021 were eligible for inclusion in the study. A trained resident assessed the extent to which the COVID-19 crisis affected their professional activity, social life, access to healthcare, and drinking problems, together with craving, drinking behavior, psychological distress, physical/mental health, and sociodemographic and clinical data. The same investigator assessed alcohol drinking 1 month after their visit. Nearly half of the patients felt that the COVID-19 crisis had a serious impact on their drinking problems, despite minor disruptions in access to healthcare. These disturbances significantly influenced short-term alcohol drinking in univariate analysis, together with psychological distress, craving, and drinking problems. Only craving predicted alcohol drinking in multivariate analyses, suggesting that psychological and drinking problems, as well as COVID-19 disturbances, increased the risk of alcohol drinking by increasing craving. Craving should be systematically investigated in patients with AUD to establish adapted social support systems during pandemics.","Constant, A.; Sanz, M.; Moirand, R.","https://doi.org/10.3390/ijerph19041948","","Database: EMBASE; Publication type: article; Publication details: International Journal of Environmental Research and Public Health; 19(4), 2022.","WHO","Undecided","","","","","","","","","","","","","False","False","","","","","False","False","False","","False","False","False","False","False","False","False","False","False","","","","","","","","","","","","","","","","","","","","","","","","","","","","","","","","","","","","","","","","","","","","","","","","","","","","2022-02-25","",27504,""
"Social Health among German Nursing Home Residents with Dementia during the COVID-19 Pandemic, and the Role of Technology to Promote Social Participation","The COVID-19 pandemic severely impacted the social health of nursing home residents with dementia due to social isolation. Consequently, the frequency of Behavioral and Psychological Symptoms in Dementia (BPSD) might increase. Technological solutions might help safeguard the social health of nursing home residents with dementia. This study investigates the impacts of the COVID-19 pandemic on clinical outcomes and the availability of social activities and technology to promote social participation in nursing home residents with dementia. The study analyzed cross-sectional data from a follow-up questionnaire nested in a larger national survey of care facilities in Germany. A mixed-methods approach integrated statistical analyses of closed-ended responses and thematic analysis of free-text responses. A total of 417 valid individual responses were received, showing an overall increase in observed BPSDâ€”with anxiety and depression most frequently occurring. Many nursing homes canceled all social activities for residents with dementia, though a few had established procedures to facilitate social participation using technology. Requirements to promote social participation in this population using technology were identified at the micro-, meso-, and macro levels. Technology requirements permeated all three levels. During and beyond the COVID-19 pandemic, technology-driven solutions to promote social health among nursing home residents with dementia should be integrated into caregiving procedures.","Hoel, V.; Seibert, K.; Domhoff, D.; PreuÃŸ, B.; Heinze, F.; Rothgang, H.; Wolf-Ostermann, K.","https://doi.org/10.3390/ijerph19041956","","Database: EMBASE; Publication type: article; Publication details: International Journal of Environmental Research and Public Health; 19(4), 2022.","WHO","Undecided","","","","","","","","","","","","","False","False","","","","","False","False","False","","False","False","False","False","False","False","False","False","False","","","","","","","","","","","","","","","","","","","","","","","","","","","","","","","","","","","","","","","","","","","","","","","","","","","","2022-02-25","",27505,""
"Experiences of Perinatal Mental Health Care among Minority Ethnic Women during the COVID-19 Pandemic in London: A Qualitative Study","(1) Background: Approximately one in five women will experience mental health difficulties in the perinatal period. Women from ethnic minority backgrounds face a variety of barriers that can prevent or delay access to appropriate perinatal mental health care. COVID-19 pandemic restrictions created additional obstacles for this group of women. This study aims to explore minority ethnic womenâ€™s experiences of perinatal mental health services during COVID-19 in London. (2) Methods: Eighteen women from ethnic minority backgrounds were interviewed, and data were subject to a thematic analysis. (3) Results: Three main themes were identified, each with two sub-themes: â€˜Difficulties and Disruptions to Accessâ€™ (Access to Appointments;Pandemic Restrictions and Disruption), â€˜Experiences of Remote Deliveryâ€™ (Preference for Face-to-Face Contact;Advantages of Remote Support);and â€˜Psychosocial Experiencesâ€™ linked to COVID-19 (Heightened Anxiety;Social Isolation). (4) Conclusions: Women from ethnic minority backgrounds experienced disrupted perinatal mental health care and COVID-19 restrictions compounding their mental health difficulties. Services should take womenâ€™s circumstances into account and provide flexibility regarding remote delivery of care.","Pilav, S.; Easter, A.; Silverio, S. A.; De Backer, K.; Sundaresh, S.; Roberts, S.; Howard, L. M.","https://doi.org/10.3390/ijerph19041975","","Database: EMBASE; Publication type: article; Publication details: International Journal of Environmental Research and Public Health; 19(4), 2022.","WHO","Undecided","","","","","","","","","","","","","False","False","","","","","False","False","False","","False","False","False","False","False","False","False","False","False","","","","","","","","","","","","","","","","","","","","","","","","","","","","","","","","","","","","","","","","","","","","","","","","","","","","2022-02-25","",27506,""
"The Psychological Impact of COVID-19 among Women Accessing Family Care Centers during Pregnancy and the Postnatal Period in Italy","There has been concern about the impact of the COVID-19 outbreak on womenâ€™s mental health during the perinatal period. We conducted a cross-sectional web-based study aimed at evaluating the psychological impact (BSI-18) of the COVID-19 pandemic on this population and collecting information on the perinatal experiences (COPE-IS) during the second Italian wave. Overall, 1168 pregnant women, and 940 within the first six months after childbirth, were recruited in selected Italian Family Care Centers from October 2020 to May 2021. The prevalence of psychological distress symptoms during pregnancy was 12.1% and 9.3% in the postnatal group. Financial difficulties, a previous mood or anxiety disorder and lack of perceived social support and of support provided by health professionals were associated to psychological distress symptoms in both groups. A third of the women felt unsupported by their social network;61.7% of the pregnant women experienced changes in antenatal care;21.2% of those in the postnatal period gave birth alone;more than 80% of the participants identified access to medical and mental health care and self-help as important resources in the present context. Health services should assure enhanced support to the most vulnerable women who face the perinatal period during the pandemic.","Lega, I.; Bramante, A.; Lauria, L.; Grussu, P.; Dubini, V.; Falcieri, M.; Ghiani, M. C.; Giordano, A.; Guidomei, S.; Mignuoli, A. D.; Paris, S.; Bettinelli, M. E.; Proietti, P.; Andreozzi, S.; Brenna, V.; Bucciarelli, M.; Martelli, G.; Ferraro, C.; Torrisi, M.; Carrozzino, D.; Donati, S.","https://doi.org/10.3390/ijerph19041983","","Database: EMBASE; Publication type: article; Publication details: International Journal of Environmental Research and Public Health; 19(4), 2022.","WHO","Undecided","","","","","","","","","","","","","False","False","","","","","False","False","False","","False","False","False","False","False","False","False","False","False","","","","","","","","","","","","","","","","","","","","","","","","","","","","","","","","","","","","","","","","","","","","","","","","","","","","2022-02-25","",27507,""
