"title","abstract","authors","link","date","subject","source","initial_decision","q0","q1","q2","q3","q4","q5","q6","q7","q8","q9","q10","q11","q12","q13","q14","q15","q16","q17","q18","q19","q20","q21","q22","q23","q24","q25","q26","q27","q28","q29","q30","q31","q32","q33","q34","q35","q36","q37","q38","q39","q40","q41","q42","q43","q44","q45","q46","q47","q48","q49","q50","q51","q52","q53","q54","q55","q56","q57","q58","q59","q60","q61","q62","q63","q64","q65","q66","q67","q68","q69","q70","q71","q72","q73","q74","q75","q76","q77","q78","q79","q80","exclusion_reason","extraction_date","expert_decision","ID","o1"
"Restrictive interventions on a psychiatric admission ward before and after COVID-19","Restrictive interventions (seclusion, restraint and special observations) are used on psychiatric wards when there are no other means available to keep a patient or others safe. These measures can be traumatic, and the Mental Health Commission and the Health Service Executive are focused on minimising their use. We set out to determine whether, following a COVID related reduction in bed numbers on a high dependency psychiatric ward in St John of God Hospital in Dublin, there was a change in their incidence. Data on restrictive interventions and challenging behaviours were gathered for 9-month periods before and after March 2020 when COVID related ward changes took place. Figures were also collected on seclusion and restraint for the previous 18 months for a longer-term view. Ward and hospital occupancy levels were also recorded. Between the two time periods, episodes of seclusion fell by 53% and episodes of restraint by 56%. The hours devoted to special observation declined by 30% and incidents of challenging behaviours fell by 26%. Ward occupancy levels fell by only 5%. The longer-term comparison of figures for seclusion and restraint point towards a downward trend from mid-2019 that was accentuated in the post-COVID period. The changes found may relate to reduced crowding on the ward or other COVID related factors such as the emphasis on social distancing and a shared sense of purpose on the ward. The longer-term trend points towards an emerging cultural shift. The challenge now is to sustain and build upon these changes.","Feeney, Bonner, McAndrew","https://doi.org/10.1017/ipm.2022.9","20220407","aggression; challenging behaviour; mental health; psychiatry; restraint; seclusion; special observation; ward design","PubMed","Undecided","","","","","","","","","","","","","False","False","","","","","False","False","False","","False","False","False","False","False","False","False","False","False","","","","","","","","","","","","","","","","","","","","","","","","","","","","","","","","","","","","","","","","","","","","","","","","","","","","2022-04-08","",29822,""
"EXPRESS: Far from the eyes, far from the heart COVID-19 confinement dampened sensitivity to painful facial features","In the last two years, governments of many countries imposed heavy social restrictions to contain the spread of the COVID-19 virus, with consequent increase of bad mood, distress, or depression for the people involved. Few studies investigated the impact of these restrictive measures on individual social proficiency, and specifically the processing of emotional facial information, leading to mixed results. The present research aimed at investigating systematically whether, and to which extent, social isolation influences the processing of facial expressions. To this end, we manipulated the social exclusion experimentally through the well-known Cyberball game (within-subject factor), and we exploited the occurrence of the lockdown for the Swiss COVID-19 first wave by recruiting participants before and after being restricted at home (grouping factor). We then tested whether either form of social segregation influenced the processing of pain, disgust or neutral expressions, across multiple tasks probing access to different components of affective facial responses (state-specific, shared across states). We found that the lockdown (but not game-induced exclusion) affected negatively the processing of pain-specific information, without influencing other components of the affective facial response related to disgust or broad unpleasantness. In addition, participants recruited after the confinement reported lower scores in empathy questionnaires. These results suggest that social isolation affected negatively individual sensitivity to other people's affect and, with specific reference to the processing of facial expressions, the processing of pain-diagnostic information.","Antico, Corradi-Dell'Acqua","https://doi.org/10.1177/17470218221094772","20220407","COVID_19 lockdown; Emotional facial processing; Empathy; Social exclusion","PubMed","Undecided","","","","","","","","","","","","","False","False","","","","","False","False","False","","False","False","False","False","False","False","False","False","False","","","","","","","","","","","","","","","","","","","","","","","","","","","","","","","","","","","","","","","","","","","","","","","","","","","","2022-04-08","",29823,""
"Rise in depression and anxiety during the COVID-19 pandemic: results from a cross-sectional national survey","The Coronavirus disease 2019 (COVID-19) pandemic has introduced many mental stressors. This study aimed to evaluate the prevalence of depression and anxiety during the pandemic and characterize those at higher risk. We conducted a national cross-sectional telephone interview survey among Israeli adults from May to September 2020, between the first two national lockdowns. Mental health status was measured using the 5-item Mental Health Inventory (MHI-5). A score of â‰¤60 was defined as poor mental health with moderate to high anxiety and depression symptoms. Multivariate analysis was used to identify demographic, health-related, and COVID-19-related risk factors associated with poor mental health. From 4,712 households that were eligible for inclusion in this study, 2,634 participants (55.9%) completed the survey. Levels of anxiety and depression symptoms increased significantly throughout the pandemic (from 12.9% to 20.3%, P &lt;Â 0.001). Loneliness also increased over time (from 48.8% to 58.8%, P &lt;Â 0.001), and fear of the pandemic remained high (66.5%) throughout the study. According to the multivariate analysis, poor mental health was associated with younger age, female gender, lower education, Arab ethnicity, decrease in household income during the pandemic, having a pre-existing chronic illness, obesity, smoking, ever being quarantined, feeling lonely and fear of the pandemic. Our findings show an increase in anxiety and depression over time among the Israeli population during the COVID-19 pandemic. These findings highlight the need for strengthened mental health services and the flexibility of reallocation of funds and health resources to support the growing mental health needs during the health crisis.","Frankenthal, Keinan-Boker, Bromberg","https://doi.org/10.1080/13548506.2022.2057558","20220407","COVID-19; Israel; anxiety; depression; mental health; pandemic","PubMed","Undecided","","","","","","","","","","","","","False","False","","","","","False","False","False","","False","False","False","False","False","False","False","False","False","","","","","","","","","","","","","","","","","","","","","","","","","","","","","","","","","","","","","","","","","","","","","","","","","","","","2022-04-08","",29824,""
"ACT for Lupus: Pilot Feasibility and Acceptability Study of a Novel Web-Based Acceptance and Commitment Therapy Program for Patients With Lupus","Acceptance and commitment therapy (ACT) has demonstrated effectiveness in addressing symptoms of anxiety and depression, frequently experienced by patients with systemic lupus erythematosus (SLE). The goal of this pilot study was to develop and assess the feasibility and acceptability of a novel web-based ACT skills training program tailored for patients with lupus: ACT for Lupus. The program served as a complementary approach to support the management of symptoms and stressors during the COVID-19 pandemic. This study employed a single-group pretest-posttest design. Participants with a diagnosis of SLE were primarily recruited through an institutional healthcare system between November 25, 2020 and December 17, 2020 and through an online national lupus organization listserv. Participants were invited to attend two 1-hour webinars delivered over a 2-week period. Educational ACT-based content was tailored for patients with lupus and delivered by an experienced clinical psychologist specializing in ACT. Surveys assessed patient-reported outcomes of anxiety, depression, and quality of life and evaluated program feedback, usability, and satisfaction. A total of 83 participants submitted the baseline survey, with 21 participants designated as study completers. The program was well received by participants, who reported feasibility and acceptability of the intervention, as reflected by high usability ratings. Participants reported favorable experiences with the program. Feedback included suggestions to include additional lupus-tailored content, increase the range and scope of sessions and activities, and improve program flexibility and availability to avoid scheduling conflicts. This study provides preliminary evidence for an adapted, ACT-based virtual skills training program as a feasible and acceptable intervention to support the well-being of patients with lupus.","McCormick, Englund, Cleveland, Dickson, Schiller, Sheikh","https://doi.org/10.1002/acr2.11433","20220407","","PubMed","Undecided","","","","","","","","","","","","","False","False","","","","","False","False","False","","False","False","False","False","False","False","False","False","False","","","","","","","","","","","","","","","","","","","","","","","","","","","","","","","","","","","","","","","","","","","","","","","","","","","","2022-04-08","",29825,""
"Parental Stress of Children with Autism Spectrum Disorder During the Coronavirus Pandemic (COVID-19): Experience from Serbia","Taking care of children with autism spectrum disorder (ASD), as of children with other developmental disorders, is associated with greater parental stress. The aim of this study was to determine the prevalence and impact of integrative and co-morbid ASD-related symptoms on parental stress levels during the COVID-19 pandemic at four time points. Testing was performed during significant changes related to the state of the COVID-19 pandemic in Serbia. The research sample included 67 parents of children with ASD 4 to 7 years and 6 months of age. The Autism Parenting Stress Index, Gilliam Autism Rating Scale - Third Edition, diagnostic criteria for ASD from DSM-5 and Wechsler Preschool and Primary Scale of Intelligence - Fourth Edition were used to assess the tested abilities. Core behavior (problems of social development and communication skills) as well as co-morbid behaviors related to ASD (tantrums, aggressive behavior, self-injurious behavior and difficulties with transitions) caused the highest degree of parental stress. Post hoc tests that used Bonferroni correction found that parental stress caused by basic and co-morbid behaviors gradually decreased from first to fourth measurement, respectively. Sleep and toilet training problems, as well as co-morbid physical problems, caused the greatest degree of parental stress during the first measurement. Measuring total parental stress caused by integrative and co-morbid symptoms related to ASD showed that it was at the highest level during the first measurement, decreased during the second measurement and remained unchanged during the third and fourth measurements. Time, as a repeating factor, during the COVID-19 pandemic has an effect on lowering the levels of parental stress caused by all examined ASD-related domains. These results may be useful in creating individual programs to support parents of children with ASD during the COVID-19 pandemic. Taking care of children with autism spectrum disorder (ASD), as of children with other developmental disorders, is associated with greater parental stress. The aim of this study was to determine the prevalence and impact of integrative and co-morbid ASD-related symptoms on parental stress levels during the COVID-19 pandemic at four time points. Testing was performed during significant changes related to the state of the COVID-19 pandemic in Serbia. The research sample included 67 parents of children with ASD 4 to 7 years and 6 months of age. The Autism Parenting Stress Index, Gilliam Autism Rating Scale - Third Edition, diagnostic criteria for ASD from DSM-5 and Wechsler Preschool and Primary Scale of Intelligence - Fourth Edition were used to assess the tested abilities. Core behavior (problems of social development and communication skills) as well as co-morbid behaviors related to ASD (tantrums, aggressive behavior, self-injurious behavior and difficulties with transitions) caused the highest degree of parental stress. Post hoc tests that used Bonferroni correction found that parental stress caused by basic and co-morbid behaviors gradually decreased from first to fourth measurement, respectively. Sleep and toilet training problems, as well as co-morbid physical problems, caused the greatest degree of parental stress during the first measurement. Measuring total parental stress caused by integrative and co-morbid symptoms related to ASD showed that it was at the highest level during the first measurement, decreased during the second measurement and remained unchanged during the third and fourth measurements. Time, as a repeating factor, during the COVID-19 pandemic has an effect on lowering the levels of parental stress caused by all examined ASD-related domains. These results may be useful in creating individual programs to support parents of children with ASD during the COVID-19 pandemic.","Djuric-Zdravkovic, Japundza-Milisavljevic, Perovic","https://doi.org/10.1055/a-1743-2770","20220407","","PubMed","Undecided","","","","","","","","","","","","","False","False","","","","","False","False","False","","False","False","False","False","False","False","False","False","False","","","","","","","","","","","","","","","","","","","","","","","","","","","","","","","","","","","","","","","","","","","","","","","","","","","","2022-04-08","",29826,""
"An evaluation of the veteran friendly practice accreditation programme","The Royal College of General Practitioners Veteran Friendly Practice Accreditation Programme launched in 2019, aiming to allow practices to better identify, treat and refer veterans, where appropriate, to dedicated NHS services. Evaluate the effectiveness of the accreditation programme, focusing on benefits for the veteran, the practice and the delivery of the programme itself. The study evaluated the views of Veteran Friendly Accredited GP Practices across England. Mixed-methods study collecting data via an online survey from 232 accredited Primary Healthcare (PHC) staff and 15 semi-structured interviews with PHC Veteran Leads. Interviews were analysed using modified Grounded Theory. 99% (N=228) of respondents would recommend the programme, 77% (N=124) reported improved awareness and 84% (N=193) a better understanding of veteran's needs. 72% (N=166) identified benefits for veterans who were engaging more with PHC but participants felt more time was needed, largely due to the Covid-19 pandemic, to fully assess the impact of the programme on help-seeking behaviour. Challenges included identifying veterans already registered, promoting the accreditation process and ensuring all PHC staff were kept up to date with veteran issues. The programme has increased signposting to veteran specific services and greater understanding of the NHS priority referral criteria for veterans. Recording of veteran status has improved and there was evidence of a better medical record coding system in PHC practices. These findings add to the limited empirical evidence exploring veteran engagement in PHC and demonstrate how accreditation results in better treatment and identification of veterans.","Finnegan, Salem, Ainsworth-Moore, Randles, West, Simpson, Grant","https://doi.org/10.3399/BJGPO.2022.0012","20220407","Health promotion and prevention; Mental health (general)","PubMed","Undecided","","","","","","","","","","","","","False","False","","","","","False","False","False","","False","False","False","False","False","False","False","False","False","","","","","","","","","","","","","","","","","","","","","","","","","","","","","","","","","","","","","","","","","","","","","","","","","","","","2022-04-08","",29827,""
"Physical activity domains, levels, and health-related quality of life among Nigerian adolescents during the coronavirus disease 2019 pandemic","The coronavirus disease 2019 pandemic spurred unprecedented public health measures to curb its spread. Such measures might have negatively impacted adolescents' participation in physical activity and health-related quality of life. However, the evidence is unclear in Nigerian adolescents. This study assessed the physical activity domains, levels, and health-related quality of life in Nigerian adolescents during the coronavirus disease 2019 pandemic. The sample consisted of 430 students in public secondary schools in Nsukka, Enugu State. The students were randomly selected to participate in the cross-sectional study between November 2020 and April 2021. The Demographic Profile Form, International Physical Activity Questionnaire, Short Form-36 Health Survey, and Perceived Susceptibility to coronavirus disease 2019 Infection Questionnaire were used for data collection. Descriptive statistics, Chi-square test, independent-samples <i>t</i>-test, univariate ANOVA, and multiple linear regressions were conducted using SPSS version 25. The mean score of total physical activity (MET-min/week) was 1651.3 (<i>SD</i>â€‰=â€‰842.18). The mean overall score of health-related quality of life was 78.30 (<i>SD</i>â€‰=â€‰16.43). The mental health component of health-related quality of life showed that adolescents had poor mental health status. Female adolescents had higher mean scores in physical component summary (<i>M</i>â€‰=â€‰83.03; <i>SD</i>â€‰=â€‰27.36) and mental component summary (<i>M</i>â€‰=â€‰51.19; <i>SD</i>â€‰=â€‰8.69) than the male adolescents, physical component summary (<i>M</i>â€‰=â€‰69.0; <i>SD</i>â€‰=â€‰21.65) and mental component summary (<i>M</i>â€‰=â€‰46.15; <i>SD</i>â€‰=â€‰10.71). The findings showed a significant positive association among gender, class of study, parental type, perceived susceptibility to coronavirus disease 2019, and physical activity domains, levels, and health-related quality of life. In addition, boys had a higher mean score of total physical activity (MET-min/week) than the girls. More girls were less active than the boys. However, concerning the health-related quality of life, girls had higher mean scores in physical component summary and mental component summary than boys. Physical activity interventions that specifically target female adolescents' physical activity participation are needed. Also, mental health interventions are needed to improve the mental health status of adolescents, especially boys in the post-coronavirus disease 2019 era.","Ugwueze, Agbaje","https://doi.org/10.1177/20503121221088808","20220407","COVID-19; Nigeria; Physical activity; adolescents; health-related quality of life","PubMed","Undecided","","","","","","","","","","","","","False","False","","","","","False","False","False","","False","False","False","False","False","False","False","False","False","","","","","","","","","","","","","","","","","","","","","","","","","","","","","","","","","","","","","","","","","","","","","","","","","","","","2022-04-08","",29828,""
"Psychological Impact in Healthcare Workers During Emergencies: The Italian Experience With COVID-19 First Wave","The COVID-19 outbreak imposed an overwhelming workload as well as emotional burdens on Healthcare workers (HCWs). In May 2020, an online survey was administered to HCWs in Italy to assess the pandemic's psychological impact and to investigate possible predictive factors that led to individual differences. The psychological experience was measured based on the prevalence of self-reported feelings during the pandemic, including negative and positive emotional states. We analyzed the relationship between factors of gender, age, geographic region, professional role, and operational unit, and the four-point scale used to rate the frequency of each emotional state experienced by performing several multinomial logistic regressions, one for each emotion. Our findings suggest that more than half of HCWs experienced psychological distress during the first COVID-19 outbreak in Italy. Female and younger respondents, especially those operating in northern Italy experienced more frequently negative emotional states such as irritability, anxiety, loneliness, and insecurity. However, positive feelings, first of all solidarity, were also reported especially by female and older workers. The majority of the negative as well as positive emotional states were experienced almost equally by both doctors and nurses, and independently of the operational unit in which they operated. This study can be very useful as a contribution to the current literature on the psychological effects of this pandemic on health workers. Moreover, our findings can provide useful information in planning more tailored psychological interventions to support this category of workers in the ongoing and future emergencies.","Pisanu, Di Benedetto, Infurna, Rumiati","https://doi.org/10.3389/fpsyt.2022.818674","20220407","COVID-19; healthcare workers (HCWs); mental health; pandemic; psychological impact","PubMed","Undecided","","","","","","","","","","","","","False","False","","","","","False","False","False","","False","False","False","False","False","False","False","False","False","","","","","","","","","","","","","","","","","","","","","","","","","","","","","","","","","","","","","","","","","","","","","","","","","","","","2022-04-08","",29829,""
"Post-traumatic Growth and Psychological Resilience During the COVID-19 Pandemic: A Serial Mediation Model","Although the World Health Organization (WHO) has issued guidelines for managing to contain, mitigate, and limit of the COVID-19. However, it is more essential to highlight the urgency and importance of evaluating social functioning and mental health status during the pandemic. College students have experienced serious problems and have had to overcome many negative situations brought about by the pandemic. Accordingly, the present study intended to use Chinese college students as sample to examine the positive adoption and changes during the ongoing COVID-19. Guided by literatures in this filed, we explored the internal mechanism of post-traumatic growth affecting psychological resilience, and considered about mediation roles of positive coping styles and cognitive reappraisal. A total of 463 college students from universities in China effectively completed online questionnaires. The result indicated that these four variables were positively correlated with each other (<i>p</i>s &lt; 0.001). More importantly, our findings proved a direct and positive effect on psychological resilience. Positive coping styles and cognitive reappraisal, respectively, mediated the relationship between post-traumatic growth and psychological resilience. Over all, the hypothesized serial model conclusively fits the data: students with high-level post-traumatic growth tended to report increased use of positive coping strategies, which further facilitated their cognitive reappraisal, and subsequently, promoted their psychological resilience. The findings obtained in this study will provide a theoretical basis and possible viable strategies for both targeted crisis intervention and psychological trauma recovery plans.","Li, Hu","https://doi.org/10.3389/fpsyt.2022.780807","20220407","cognitive reappraisal; college students; positive coping; post-traumatic growth; psychological resilience","PubMed","Undecided","","","","","","","","","","","","","False","False","","","","","False","False","False","","False","False","False","False","False","False","False","False","False","","","","","","","","","","","","","","","","","","","","","","","","","","","","","","","","","","","","","","","","","","","","","","","","","","","","2022-04-08","",29830,""
