"title","abstract","authors","link","date","subject","source","initial_decision","q0","q1","q2","q3","q4","q5","q6","q7","q8","q9","q10","q11","q12","q13","q14","q15","q16","q17","q18","q19","q20","q21","q22","q23","q24","q25","q26","q27","q28","q29","q30","q31","q32","q33","q34","q35","q36","q37","q38","q39","q40","q41","q42","q43","q44","q45","q46","q47","q48","q49","q50","q51","q52","q53","q54","q55","q56","q57","q58","q59","q60","q61","q62","q63","q64","q65","q66","q67","q68","q69","q70","q71","q72","q73","q74","q75","q76","q77","q78","q79","q80","exclusion_reason","extraction_date","expert_decision","ID","o1"
"Non-Negative Matrix Factorization Temporal Topic Models and Clinical Text Data Identify COVID-19 Pandemic Effects on Primary Healthcare and Community Health in Toronto, Canada","To demonstrate how non-negative matrix factorization can be used to learn a temporal topic model over a large collection of primary care clinical notes, characterizing diverse COVID-19 pandemic effects on the physical/mental/social health of residents of Toronto, Canada. The study employs a retrospective open cohort design, consisting of 382,666 primary care progress notes from 44,828 patients, 54 physicians, and 12 clinics collected 01/01/2017 through 31/12/2020. Non-negative matrix factorization uncovers a meaningful latent topical structure permeating the corpus of primary care notes. The learned latent topical basis is transformed into a multivariate time series data structure. Time series methods and plots showcase the evolution/dynamics of learned topics over the study period and allow the identification of COVID-19 pandemic effects. We perform several post-hoc checks of model robustness to increase trust that descriptive/unsupervised inferences are stable over hyper-parameter configurations and/or data perturbations. Temporal topic modelling uncovers a myriad of pandemic-related effects from the expressive clinical text data. In terms of direct effects on patient-health, topics encoding respiratory disease symptoms display altered dynamics during the pandemic year. Further, the pandemic was associated with a multitude of indirect patient-level effects on topical domains representing mental health, sleep, social and familial dynamics, measurement of vitals/labs, uptake of prevention/screening maneuvers, and referrals to medical specialists. Finally, topic models capture changes in primary care practice patterns resulting from the pandemic, including changes in EMR documentation strategies and the uptake of telemedicine. Temporal topic modelling applied to a large corpus of rich primary care clinical text data, can identify a meaningful topical/thematic summarization which can provide policymakers and public health stakeholders a passive, cost-effective, technology for understanding holistic impacts of the COVID-19 pandemic on the primary healthcare system and community/public-health.","Meaney, Escobar, Moineddin, Stukel, Kalia, Aliarzadeh, Chen, O'Neill, Greiver","https://doi.org/10.1016/j.jbi.2022.104034","20220224","COVID-19; Electronic medical record; Non-negative matrix factorization; Temporal topic modelling; Text mining; Time series analysis","PubMed","Undecided","","","","","","","","","","","","","False","False","","","","","False","False","False","","False","False","False","False","False","False","False","False","False","","","","","","","","","","","","","","","","","","","","","","","","","","","","","","","","","","","","","","","","","","","","","","","","","","","","2022-02-25","",27508,""
"Pediatric Emergency Department Visits Associated with Mental Health Conditions Before and During the COVID-19 Pandemic - United States, January 2019-January 2022","In 2021, a national emergency* for children's mental health was declared by several pediatric health organizations, and the U.S. Surgeon General released an advisory<sup>Ã¢â‚¬Â </sup> on mental health among youths. These actions resulted from ongoing concerns about children's mental health in the United States, which was exacerbated by the COVID-19 pandemic (1,2). During March-October 2020, among all emergency department (ED) visits, the proportion of mental health-related visits increased by 24% among U.S. children aged 5-11 years and 31% among adolescents aged 12-17 years, compared with 2019 (2). CDC examined changes in U.S. pediatric ED visits for overall mental health conditions (MHCs) and ED visits associated with specific MHCs (depression; anxiety; disruptive behavioral and impulse-control disorders; attention-deficit/hyperactivity disorder; trauma and stressor-related disorders; bipolar disorders; eating disorders; tic disorders; and obsessive-compulsive disorders [OCD]) during 2019 through January 2022 among children and adolescents aged 0-17 years, overall and by sex and age. After declines in weekly visits associated with MHCs among those aged 0-17 years during 2020, weekly numbers of ED visits for MHCs overall and for specific MHCs varied by age and sex during 2021 and January 2022, when compared with corresponding weeks in 2019. Among adolescent females aged 12-17 years, weekly visits increased for two of nine MHCs during 2020 (eating disorders and tic disorders), for four of nine MHCs during 2021 (depression, eating disorders, tic disorders, and OCD), and for five of nine MHCs during January 2022 (anxiety, trauma and stressor-related disorders, eating disorders, tic disorders, and OCD), and overall MHC visits during January 2022, compared with 2019. Early identification and expanded evidence-based prevention and intervention strategies are critical to improving children's and adolescents' mental health (1-3), especially among adolescent females, who might have increased need.","Radhakrishnan, Leeb, Bitsko, Carey, Gates, Holland, Hartnett, Kite-Powell, DeVies, Smith, van Santen, Crossen, Sheppard, Wotiz, Lane, Njai, Johnson, Winn, Kirking, Rodgers, Thomas, Soetebier, Adjemian, Anderson","https://doi.org/10.15585/mmwr.mm7108e2","20220224","","PubMed","Undecided","","","","","","","","","","","","","False","False","","","","","False","False","False","","False","False","False","False","False","False","False","False","False","","","","","","","","","","","","","","","","","","","","","","","","","","","","","","","","","","","","","","","","","","","","","","","","","","","","2022-02-25","",27509,""
"Changes in Suicide Rates - United States, 2019 and 2020","Suicide was among the 10 leading causes of death in the United States in 2020 among persons aged 10-64 years, and the second leading cause of death among children and adolescents aged 10-14 and adults aged 25-34 years (1). During 1999-2020, nearly 840,000 lives were lost to suicide in the United States. During that period, the overall suicide rate peaked in 2018 and declined in 2019 and 2020 (1). Despite the recent decline in the suicide rate, factors such as social isolation, economic decline, family stressors, new or worsening mental health symptoms, and disruptions to work and school associated with the COVID-19 pandemic have raised concerns about suicide risk in the United States. During 2020, a total of 12.2 million U.S. adults reported serious thoughts of suicide and 1.2 million attempted suicide (2). To understand how changes in suicide death rates might have varied among subpopulations, CDC analyzed counts and age-adjusted suicide rates during 2019 and 2020 by demographic characteristics, mechanism of injury, county urbanization level, and state. From 2019 to 2020, the suicide rate declined by 3% overall, including 8% among females and 2% among males. Significant declines occurred in seven states but remained stable in the other states and the District of Columbia. Despite two consecutive years of declines, the overall suicide rate remains 30% higher compared with that in 2000 (1). A comprehensive approach to suicide prevention that uses data driven decision-making and implements prevention strategies with the best available evidence, especially among disproportionately affected populations (3), is critical to realizing further declines in suicide and reaching the national goal of reducing the suicide rate by 20% by 2025 (4).","Ehlman, Yard, Stone, Jones, Mack","https://doi.org/10.15585/mmwr.mm7108a5","20220224","","PubMed","Undecided","","","","","","","","","","","","","False","False","","","","","False","False","False","","False","False","False","False","False","False","False","False","False","","","","","","","","","","","","","","","","","","","","","","","","","","","","","","","","","","","","","","","","","","","","","","","","","","","","2022-02-25","",27510,""
"Pediatric Emergency Department Visits Before and During the COVID-19 Pandemic - United States, January 2019-January 2022","Emergency departments (EDs) in the United States remain a frontline resource for pediatric health care emergencies during the COVID-19 pandemic; however, patterns of health-seeking behavior have changed during the pandemic (1,2). CDC examined changes in U.S. ED visit trends to assess the continued impact of the pandemic on visits among children and adolescents aged 0-17 years (pediatric ED visits). Compared with 2019, pediatric ED visits declined by 51% during 2020, 22% during 2021, and 23% during January 2022. Although visits for non-COVID-19 respiratory illnesses mostly declined, the proportion of visits for some respiratory conditions increased during January 2022 compared with 2019. Weekly number and proportion of ED visits increased for certain types of injuries (e.g., drug poisonings, self-harm, and firearm injuries) and some chronic diseases, with variation by pandemic year and age group. Visits related to behavioral concerns increased across pandemic years, particularly among older children and adolescents. Health care providers and families should remain vigilant for potential indirect impacts of the COVID-19 pandemic, including health conditions resulting from delayed care, and increasing emotional distress and behavioral health concerns among children and adolescents.","Radhakrishnan, Carey, Hartnett, Kite-Powell, Zwald, Anderson, Leeb, Holland, Gates, DeVies, Smith, van Santen, Crossen, Sheppard, Wotiz, Johnson, Winn, Kirking, Lane, Njai, Rodgers, Thomas, Soetebier, Adjemian","https://doi.org/10.15585/mmwr.mm7108e1","20220224","","PubMed","Undecided","","","","","","","","","","","","","False","False","","","","","False","False","False","","False","False","False","False","False","False","False","False","False","","","","","","","","","","","","","","","","","","","","","","","","","","","","","","","","","","","","","","","","","","","","","","","","","","","","2022-02-25","",27511,""
"Factors associated with suicidal ideation among medical students during the initial phase of the COVID-19 pandemic in Peru: A multicenter study","We aimed to describe the prevalence and factors associated with suicidal ideation in a sample of 1238 medical students from different medical schools in Peru based on question 9 of the Patient Health Questionnaire (PHQ-9). Our results revealed that 17.9% of the participants had suicidal ideation. Furthermore, using logistic regression, we found that not practicing any religion, the presence of clinically significant depression, and the presence of clinically significant anxiety were statistically related to the presence of suicidal ideation. Our results indicate that suicidal ideation was highly prevalent in the sample of medical students studied.","Crisol-Deza, Poma-RamÃƒÂ­rez, Pacherres-LÃƒÂ³pez, Noriega-Baella, Villanueva-ZÃƒÂºÃƒÂ±iga, Salvador-Carrillo, Huarcaya-Victoria","https://doi.org/10.1080/07481187.2022.2042752","20220224","","PubMed","Undecided","","","","","","","","","","","","","False","False","","","","","False","False","False","","False","False","False","False","False","False","False","False","False","","","","","","","","","","","","","","","","","","","","","","","","","","","","","","","","","","","","","","","","","","","","","","","","","","","","2022-02-25","",27512,""
"Health anxiety During COVID-19: Predictive Roles of Health Promoting Behaviors and Sensory Processing Sensitivity","The emergence of the COVID-19 pandemic resulted in major changes in daily life and economic conditions while heightening physical and mental health problems, including health anxiety. Health authorities and elected officials have encouraged individuals to engage in health behaviors. Perceptions of and reactions to these changes could be subject to individual differences. In this line, the current study investigated the predictive roles of health promoting behaviors, sensory processing sensitivity, and their interactions with health anxiety.Design and measures: In this cross-sectional study, 355 participants (73% female, 25.9% male) whose ages range from 19 to 72 (<i>MÃ¢â‚¬â€°=</i>Ã¢â‚¬â€°25.91, <i>SD =</i> 9.80) filled out self-reported measures on health promoting behaviors, sensory processing sensitivity, and health anxiety <i>via</i> an online platform between April and May 2020. It was revealed that caring for a healthy diet, taking responsibility for health and sensory processing sensitivity, but not physical activity and stress management, were associated with health anxiety. Diagnoses and perceptions of physical and mental health problems also contributed to health anxiety during the COVID-19 pandemic. Individuals with higher levels of sensory processing sensitivity and health responsibility were more likely to experience higher levels of health anxiety, while typical physical activities and stress management behaviors were less likely to have an impact during the COVID-19 pandemic. These results highlight the importance of having a healthy diet and the need for pandemic-specific interventions for stress management and sport activities.","GÃƒÂ¼neÃ…Å¸, Bulut","https://doi.org/10.1080/00223980.2021.2012110","20220224","COVID-19; health anxiety; health promoting behaviors; interaction; sensory processing sensitivity","PubMed","Undecided","","","","","","","","","","","","","False","False","","","","","False","False","False","","False","False","False","False","False","False","False","False","False","","","","","","","","","","","","","","","","","","","","","","","","","","","","","","","","","","","","","","","","","","","","","","","","","","","","2022-02-25","",27513,""
"Resilience in the Face of Pandemic: The Impact of COVID-19 on the Psychologic Morbidity and Health-Related Quality of Life Among Women With Ovarian Cancer","The COVID-19 pandemic has created new challenges for ovarian cancer survivors. This study aims to evaluate the psychologic morbidity and alterations in medical care caused by the pandemic. Advanced-stage ovarian cancer survivors at our institution were contacted for participation in a cross-sectional telephone-based quantitative survey study assessing pandemic-related psychologic morbidity. Psychologic domains using validated measures were explored: health-related quality of life (HRQOL; functional assessment of cancer therapy [FACT-G7]), anxiety (generalized anxiety disorder-7 [GAD7]), depression (Patient Health Questionnarie-2 [PHQ2]), global health Patient-Reported Outcomes Measurement Information System - Global Physical Health/Global Mental Health (PROMIS-GMH/GPH), resilience (brief resilience scale), and loneliness (English Longitudinal Study on Aging). Novel COVID-19 pandemic questions were drawn from a larger survey developed in our department. Fifty-nine percent (61 of 104) of contacted patients completed the survey. One quarter of respondents had high resilience, with only 10% reporting low resilience. Only one patient screened positive for depression, and two for anxiety. Increased loneliness was reported by 43% of respondents. Patients' overall HRQOL was good (median = 21; range = 6-28). Few patients experienced treatment delays, with only four experiencing chemotherapy interruption and two reporting surgical delays. Multiple regression analyses revealed that high FACT-G7 HRQOL was predicted by age &gt; 65 years, high self-reported mental health, high resilience, and being off chemotherapy. Lower COVID-19 concern was predicted by recurrent cancer and high resilience. Despite the far-reaching impact of the COVID-19 pandemic, ovarian cancer survivors' HRQOL has been maintained. Older age, high resilience, high mental health, and being off chemotherapy predicted better HRQOL. Ovarian cancer survivors remain resilient in the face of the pandemic, and the support of clinicians to preserve this invaluable personal resource is critical for well-being.","Javellana, Hlubocky, Somasegar, Sorkin, Kurnit, Jani, Stock, Mills, Lengyel, Lee","https://doi.org/10.1200/OP.21.00514","20220224","","PubMed","Undecided","","","","","","","","","","","","","False","False","","","","","False","False","False","","False","False","False","False","False","False","False","False","False","","","","","","","","","","","","","","","","","","","","","","","","","","","","","","","","","","","","","","","","","","","","","","","","","","","","2022-02-25","",27514,""
"The impact of operational partnership on telemental health before, during, and after COVID-19","The coronavirus disease (COVID-19) pandemic significantly accelerated the growth of telehealth services within the Veterans Health Administration (VHA), as the use of video conferencing to meet with Veterans in their homes increased tenfold in a 3-month period. A substantial portion of telehealth in VHA has traditionally comprised mental health services, and both the scope and volume of such services were significantly broadened in response to COVID-19 to allow for social distancing. The current article is a review of this mobilization from the framework of the People, Process, Technology, and Information model, with a particular highlight on the critical operational partnership between individual facilities providing care and the governing VHA program offices. Lessons learned and future goals for the sustainment and integration of telemental health services are also discussed. (PsycInfo Database Record (c) 2022 APA, all rights reserved).","Carper, Hunley, Myers, Chen, Birks, Williams, Lindsay, Weaver","https://doi.org/10.1037/ser0000636","20220224","","PubMed","Undecided","","","","","","","","","","","","","False","False","","","","","False","False","False","","False","False","False","False","False","False","False","False","False","","","","","","","","","","","","","","","","","","","","","","","","","","","","","","","","","","","","","","","","","","","","","","","","","","","","2022-02-25","",27515,""
"Provider perspectives on telemental health implementation: Lessons learned during the COVID-19 pandemic and paths forward","After years of slow and fragmented implementation of telemental health (TMH), the coronavirus disease (COVID-19) pandemic necessitated widespread adoption. With the initial state of public health emergency behind us, we are at a decision point on whether to continue with TMH or return to a largely in-person care model. In this qualitative study, we investigated clinicians' perspectives on advantages and disadvantages of TMH in outpatient mental healthcare as well as considerations for future implementation. We conducted 29 semistructured interviews with outpatient mental health providers. Data were analyzed using rapid qualitative analysis methodology. Advantages included increased utilization of services, improved therapeutic processes, and improved provider wellbeing. Providers, however, also noted that TMH has some disadvantages in terms of therapeutic processes and provider wellbeing, and they reported technology issues as an additional disadvantage. Overall providers reported they can provide high quality care via TMH, but indicated some patient populations and appointment types are a better fit for in-person services. Most providers preferred a hybrid model of care moving forward with reimbursement discrepancies and out-of-state licensure restrictions as barriers. They indicated that, as TMH becomes a mainstay in psychiatric care, training and professional guidelines will be important. Continued implementation of TMH alongside in-person care is likely to offer improved access and enhanced service quality when applied to the right patient populations and appointment types. Effective implementation may require policy and systems level support on equitable reimbursement rates, out-of-state licensure restrictions and professional guidelines for delivering TMH. (PsycInfo Database Record (c) 2022 APA, all rights reserved).","Lipschitz, Connolly, Van Boxtel, Potter, Nixon, Bidargaddi","https://doi.org/10.1037/ser0000625","20220224","","PubMed","Undecided","","","","","","","","","","","","","False","False","","","","","False","False","False","","False","False","False","False","False","False","False","False","False","","","","","","","","","","","","","","","","","","","","","","","","","","","","","","","","","","","","","","","","","","","","","","","","","","","","2022-02-25","",27516,""
"Women's Mental Health Services and Pregnancy: A Review","The importance of women's mental health services is becoming more evident as we learn more about the impact of mental health on maternal and perinatal outcomes. The purpose of this review is to identify the importance of mental health issues arising during pregnancy including prevention, timely diagnosis and treatment, and referral to specialized services. A literature search was undertaken using the search engines PubMed, CINAHL, and PsycINFO. The search terms were as follows: ""mental health services"" or ""behavioral health"" or ""mental health counseling"" or ""psychological"" and ""delivery of health care"" and ""pregnancy"" or ""pregnant."" The years searched were January 2000 to November 2020. The search was limited to English language. Of the 255 abstracts identified and reviewed, 35 full-text articles were the basis of this review. Literature summarizing the availability and models of care for mental health services for pregnant women is limited. After reviewing the literature, the themes of depression and anxiety in the antepartum and postpartum periods that emerged as mental health issues, especially during adolescent pregnancies, the coronavirus pandemic, intimate partner violence, and pregnancy loss, are of primary importance to obstetrical providers. All of these issues can have a significant impact on maternal and neonatal outcomes and should be addressed during routine practice. Maternal mental health is garnering deserved attention and has enormous implications on maternal and infant outcomes. Obstetrical providers should be comfortable with screening, identification, and basic treatment algorithms including when to refer to specialized services. Mental health issues during pregnancy and the postpartum period can be profound with severe maternal and perinatal consequences.","Ghahremani, Magann, Phillips, Ray-Griffith, Coker, Stowe","https://doi.org/10.1097/OGX.0000000000000994","20220224","","PubMed","Undecided","","","","","","","","","","","","","False","False","","","","","False","False","False","","False","False","False","False","False","False","False","False","False","","","","","","","","","","","","","","","","","","","","","","","","","","","","","","","","","","","","","","","","","","","","","","","","","","","","2022-02-25","",27517,""
