"title","abstract","authors","link","date","subject","source","initial_decision","q0","q1","q2","q3","q4","q5","q6","q7","q8","q9","q10","q11","q12","q13","q14","q15","q16","q17","q18","q19","q20","q21","q22","q23","q24","q25","q26","q27","q28","q29","q30","q31","q32","q33","q34","q35","q36","q37","q38","q39","q40","q41","q42","q43","q44","q45","q46","q47","q48","q49","q50","q51","q52","q53","q54","q55","q56","q57","q58","q59","q60","q61","q62","q63","q64","q65","q66","q67","q68","q69","q70","q71","q72","q73","q74","q75","q76","q77","q78","q79","q80","exclusion_reason","extraction_date","expert_decision","ID","o1"
"Rehabilitation of post-COVID patients with chronic fatigue and cognitive disorders syndromes","Introduction. Almost all patients, who have experienced acute manifestations of COVID-19, regardless of the severity of the acute phase of the disease, are only at the beginning of a long way to recovery. According to experts, SARS-CoV-2 infection should affect almost 80% of the world's population, so all these patients to a greater or lesser extent will need a rehabilitation of certain manifestations of postcovid syndrome. Purpose: to study the effectiveness of rehabilitation program and the dynamics of cognitive impairment and manifestations of chronic fatigue syndrome in patients after coronavirus disease. Methods: The study design included 60 patients after SARS-Cov-2 infection. Among the examined patients there were 26 (43,3%) women and 34 (56,7%) men. An average age of the patients was 43,9 +/- 1,08 years. Patients were referred to the Department of Physical Rehabilitation after coronavirus disease with chronic fatigue and cognitive disorders syndromes. Accordingly, all patients, who participated in the study, were divided into two groups: group I - 28 patients with a general condition of moderate severity at the hospital stage and 32 patients - group II, with severe course of the disease and oxygen demand at the hospital stage. Depending on the duration of rehabilitation, two observation periods were used - on the 7th and 14th day of rehabilitation program. Results: It has been proven, that patients, who didn't need oxygen, were complaining about anosmia, cephalgia, cognitive impairment, increased anxiety and fatigue. Dysgeusia, dyssomnia, and depression were more common in patients, requiring oxygen therapy at the hospital stage. Rehabilitation program eliminated cognitive dysfunction, depression, cephalgia, drowsiness and dyssomnia on the 7th day in patients, who did not require oxygen therapy (p&gt;0,05), and in patients, who needed oxygen therapy - on the 14th day of the rehabilitation program (p&gt;0,05). However, 2 (6,3%) and 3 (9,4%) patients, who needed oxygen therapy, even after 14 days of rehabilitation had manifestations of minor recurrent headache and drowsiness. Conclusion: Thus, patients after coronavirus disease, who needed oxygen therapy at the hospital stage, need long-term rehabilitation program.","Babliuk, L.; Fediaeva, S.; Babova, I.; Mesoedova, V.; Tamazlykar, S.","https://doi.org/10.12680/balneo.2022.497","","Database: Web of Science; Publication type: article; Publication details: Balneo and Prm Research Journal; 13(1):9, 2022.","WHO","Undecided","","","","","","","","","","","","","False","False","","","","","False","False","False","","False","False","False","False","False","False","False","False","False","","","","","","","","","","","","","","","","","","","","","","","","","","","","","","","","","","","","","","","","","","","","","","","","","","","","2022-04-08","",29791,""
"Depression, anxiety and stress among nursing officers in a dedicated hospital for COVID patients in Sri Lanka: a single institute experience","The main objective of this study was to assess the prevalence of stress, anxiety and depression, among nurses working in a tertiary hospital dedicated to the COVID-19 patients in Sri Lanka. A cross-sectional study was carried out among nurses working at Colombo East Base Hospital. The data was collected using a self-administered questionnaire and DASS-21, a set of three self-report scales designed to measure the negative emotional states of depression, anxiety, and stress over three months from October 2020. Data were analysed applying descriptive statistics and inferential statistical methods. There was a total of 131 study participants (response rate 83%), and most of them were working in general wards (56%), while 42% were in critical care units. The proportion of anxiety and stress is associated with nurses working in critical care units were significantly higher than those in general wards (p &lt; 0.001). There were no associations between sex, marital status, having children, experience, qualifications, and medical or psychiatric conditions (p &gt; 0.05). The system of reporting mental health issues was unfortunately not in place. Staff felt that reporting stress/burnout or anxiety might seem like a negative attribute. Considering the above factors, one would expect more prevalence than we have seen in this study;therefore, we can infer that if mental health is not prioritised in healthcare institutions, then definitely lack of awareness/openness and under-reporting by staff will result in a long-term systemic problem (Suffering in the name of Resilience).","Pathiraja, PathirajageDeepthiMadushan, Srikanthi, W. S.; Jayamanne, B. D. W.; Desilva, H. S.","https://doi.org/10.12669/pjms.38.4.5508","","Database: GIM; Publication type: article; Publication details: Pakistan Journal of Medical Sciences; 38(4):1073-1076, 2022.","WHO","Undecided","","","","","","","","","","","","","False","False","","","","","False","False","False","","False","False","False","False","False","False","False","False","False","","","","","","","","","","","","","","","","","","","","","","","","","","","","","","","","","","","","","","","","","","","","","","","","","","","","2022-04-08","",29792,""
"An Interesting Case of Fatal Myasthenic Crisis Probably Induced by the COVID-19 Vaccine","A myasthenic crisis is a severe, life-threatening exacerbation of myasthenia gravis that causes a rapid onset of muscle weakness and fatigue that may result in tetraparesis, dyspnea, respiratory insufficiency, aspiration, and death. Bulbar muscle functions are markedly affected resulting in depressed cough reflex, swallowing, and speech. Thus, mechanical ventilation, supportive feeding, and critical care are essential for the survival of patients in a myasthenic crisis. Numerous precipitating factors of this condition are well known and include infections, various medications, pregnancy, and childbirth. Patients with myasthenia gravis are at a considerably higher risk of developing a debilitating coronavirus disease 2019 (COVID-19) infection due to the associated immunosuppression resulting from long-term corticosteroid use, which makes vaccination of such individuals necessary. However, the relationship between an exacerbation of myasthenia gravis and the COVID-19 vaccination is currently unknown. In this paper, we report the case of a 55-year-old male patient who developed a myasthenic crisis after receiving the first dose of the ChAdOx1-S (recombinant) vaccine (AstraZeneca batch number 210157;AstraZeneca plc, Cambridge, United Kingdom). Despite the administration of aggressive and intensive treatment over a period of 29-day hospitalization, the myasthenic crisis could not be reversed and the patient ultimately deteriorated and succumbed from multiple myocardial infarction events and organ failures. While it is still uncommon, evidence associating the effects of the vaccine to the development of a crisis is mounting;therefore, it is crucial for clinicians to promptly identify clinical features that suggest an exacerbation of myasthenia gravis in order to intervene at the earliest possible stage for a more favorable outcome. The myasthenia gravis patient should be informed about the possible association between COVID-19 vaccination and the development of a myasthenic crisis.","Sonigra, K. J.; Sarna, K.; Vaghela, V. P.; Guthua, S.","https://doi.org/10.7759/cureus.23251","","Database: Web of Science; Publication type: article; Publication details: Cureus Journal of Medical Science; 14(3):6, 2022.","WHO","Undecided","","","","","","","","","","","","","False","False","","","","","False","False","False","","False","False","False","False","False","False","False","False","False","","","","","","","","","","","","","","","","","","","","","","","","","","","","","","","","","","","","","","","","","","","","","","","","","","","","2022-04-08","",29793,""
"Systemic Sclerosis (SSc) After COVID-19: A Case Report","A 48-year-old female with past medical history of anxiety and depression presented to the rheumatology clinic after being referred for further evaluation of abnormal labs, Raynaud's phenomenon, and other concerning symptoms. Shortly after hospitalization for COVID-19 pneumonia, she began experiencing symptoms that included fatigue, xerostomia, dysphagia, bilateral lower extremity weakness, dyspnea with exertion, unintentional weight loss, and diffuse skin hyperpigmentation. Labs ordered shortly before presentation were significant for antinuclear antibody (ANA) titer &gt; 1:1280. Physical exam was remarkable for puffy fingers, sclerodactyly of the fingers, diffuse skin hyperpigmentation, and abnormal nailfold capillaries. Anti-RNA polymerase III, anti-Scl-70, anti-centromere, anti-SSA, anti-SSB, anti-Smith, and anti-Smith/RNP antibodies were all negative. BNP, aldolase, and serum myoglobin levels were within normal limits while creatine phosphokinase level was slightly decreased. Pulmonary function testing showed reduced diffusion capacity with normal lung mechanics and volumes. High-resolution CT scan of the chest showed interstitial lung disease, with findings suggestive of nonspecific interstitial pneumonia. Transthoracic echocardiogram showed mild elevation of right ventricular systolic pressure, but pulmonary hypertension was not found on right heart catheterization. Esophagugastroduodenoscopy (EGO) with biopsy performed for evaluation of esophageal dysphagia showed sliding hiatal hernia, irregular Z-line, and gastric hyperemia. Biopsy of the distal esophagus was consistent with Barrett's esophagus. The patient was diagnosed with SSc according to the 2013 American College of Rheumatology/European League Against Rheumatism (ACR-EULAR) classification criteria for SSc. She is currently being treated with mycophenolate mofetil, amlodipine, methotrexate, and prednisone.","Chandra, A.; Kahaleh, B.","https://doi.org/10.7759/cureus.23179","","Database: Web of Science; Publication type: article; Publication details: Cureus Journal of Medical Science; 14(3):5, 2022.","WHO","Undecided","","","","","","","","","","","","","False","False","","","","","False","False","False","","False","False","False","False","False","False","False","False","False","","","","","","","","","","","","","","","","","","","","","","","","","","","","","","","","","","","","","","","","","","","","","","","","","","","","2022-04-08","",29794,""
"Pain Management and COVID-19: A Latin American Perspective","Vaccinations and therapeutics have been developed for COVID-19, but vaccine uptake varies markedly among countries. Public health responses have also varied, in particular, with lockdown efforts and school closing. All over the world, the pandemic exposed healthcare and economic weaknesses. COVID-19 exacerbated mental health issues by exposing the population to prolonged periods of fear, anxiety, financial stress, psychological uncertainties, and sometimes isolation from even family and friends. Chronic pain patients have been disproportionately affected. The pandemic-associated stresses may have exacerbated their already painful symptoms while at the same time interrupting their access to care. The ramifications of the COVID-19 post-viral syndrome (""long COVID-19"") are not yet known. COVID-19 viral infection has been associated with neuropathic pain symptoms. Tele-triage and telehealth applications can help manage chronic pain patients in the COVID-19 era, but many interventional procedures, injections, or other treatments have been delayed. The role of palliative care for patients with terminal cases of infection must be re-examined. Palliative care is a relatively new medical specialty and allows terminally ill patients to die in as much comfort and peace as can be afforded to them. More training in palliative care for all clinicians is urgently needed. COVID-19 exposed much that is wrong or weak or inadequate in our healthcare systems, but it also allowed us to embrace new technologies and develop better systems to manage the challenge of a pandemic.","Guerrero, M.; Castroman, P.; Quiroga, O.; Cook, M. B.; Tamayo, M. A. N.; Venturoni, L.; Pergolizzi, J.; Rekatsina, M.; Varrassi, G.","https://doi.org/10.7759/cureus.23100","","Database: Web of Science; Publication type: article; Publication details: Cureus Journal of Medical Science; 14(3):10, 2022.","WHO","Undecided","","","","","","","","","","","","","False","False","","","","","False","False","False","","False","False","False","False","False","False","False","False","False","","","","","","","","","","","","","","","","","","","","","","","","","","","","","","","","","","","","","","","","","","","","","","","","","","","","2022-04-08","",29795,""
"Effectiveness of digital mental health interventions for university students: an umbrella review","Background Poor mental health among university students remains a pressing public health issue. Over the past few years, digital health interventions have been developed and considered promising in increasing psychological wellbeing among university students. Therefore, this umbrella review aims to synthesize evidence on digital health interventions targeting university students and to evaluate their effectiveness. Methods A systematic literature search was performed in April 2021 searching PubMed, Psychology and Behavioural Science Collection, Web of Science, ERIC, and Scopus for systematic reviews and meta-analyses on digital mental health interventions targeting university students. The review protocol was registered in the International Prospective Register of Systematic Reviews PROSPERO [CRD42021234773]. Results The initital literature search resulted in 806 records of which seven remained after duplicates were removed and evaluated against the inclusion criteria. Effectiveness was reported and categorized into the following six delivery types: (a) web-based, online/computer-delivered interventions (b) computer-based Cognitive Behavior Therapy (CBT), (c) mobile applications and short message service (d) virtual reality interventions (e) skills training (f) relaxation and exposure-based therapy. Results indicated web-based online/computer delivered-interventions were effective or at least partially effective at decressing depression, anxiety, stress and eating disorder symptoms. This was similar for skills-training interventions, CBT-based intervention and mobile applications. However, digital mental health interventions using virtual reality and relaxation, exposure-based therapy was inconclusive. Due to the variation in study settings and inconsistencies in reporting, effectiveness was greatly dependent on the delivery format, targeted mental health problem and targeted purpose group. Conclusion The findings provide evidence for the beneficial effect of digital mental health interventions for university students. However, this review calls for a more systematic approach in testing and reporting the effectiveness of digital mental health interventions.","Harith, Sophia, Backhaus, Insa, Mohbin, Najihah, Huyen Thi, Ngo, Khoo, Selina","https://doi.org/10.7717/peerj.13111","","Database: ProQuest Central; Publication type: article; Publication details: PeerJ;2022.","WHO","Undecided","","","","","","","","","","","","","False","False","","","","","False","False","False","","False","False","False","False","False","False","False","False","False","","","","","","","","","","","","","","","","","","","","","","","","","","","","","","","","","","","","","","","","","","","","","","","","","","","","2022-04-08","",29796,""
"Challenges, burden and emotional impact on Portuguese athletes during COVID-19 pandemic","This study aimed to explore how contextual variables associated with the period of confinement during pandemic can differentiate symptoms of anxiety, depression, and stress. It also intended to understand the concerns that were experienced by athletes when resuming their sport practice and how these could be associated with psychopathological indicators. The sample comprised 265 athletes who completed self-reported questionnaires. Results demonstrated that there were differences in psychopathological indicators in terms of hours of training per week, and the type of contact that athletes have with their coach. Athletes reported concerns regarding the resumption of sport practice, and that were associated with anxiety, depression, and stress symptoms. This study may contribute in warning the sports community about the impact of contextual variables-related to critical moments of this pandemic. Sports communities should encourage the preservation of the athlete's physical activities, as well as supporting coaches in continuing to guide athlete's training.","Oliveira, S.; Cunha, M.; Rosado, A.; Ferreira, C.","https://doi.org/10.6018/cpd.462181","","Database: CAB Abstracts; Publication type: article; Publication details: Cuadernos de Psicolog..a del Deporte; 22(1):44-60, 2022.","WHO","Undecided","","","","","","","","","","","","","False","False","","","","","False","False","False","","False","False","False","False","False","False","False","False","False","","","","","","","","","","","","","","","","","","","","","","","","","","","","","","","","","","","","","","","","","","","","","","","","","","","","2022-04-08","",29797,""
"Effects of the COVID-19 lockdown on the livelihood and food security of street food vendors and consumers in Nigeria","Nigeria's local food economy was affected by state-imposed restrictions to curb the spread of COVID-19 in communities. Street food vendors and consumers are among local food system actors impacted by such restrictions because their livelihood and food security are contingent on daily operations on the street. Informed by a descriptive qualitative approach, we interviewed 31 street food vendors and consumers who shared their experiences on how the lockdown impacted them. Vendors reported various impacts, including losing income, customers, customer trust, and social connection. Street food consumers reported difficulties meeting their food needs and developing multiple coping strategies, including cutting back on fruit and vegetable consumption and food sharing. Both vendors and consumers would like to see measures put in place to allow them to operate safely in a future lockdown event. This study is timely as the country strives to balance human and economic health amid the pandemic.","Oloko, M.; Ekpo, R.","https://doi.org/10.5897/JASD2021.0641","","Database: CAB Abstracts; Publication type: article; Publication details: Journal of African Studies and Development; 13(4):106-114, 2021.","WHO","Undecided","","","","","","","","","","","","","False","False","","","","","False","False","False","","False","False","False","False","False","False","False","False","False","","","","","","","","","","","","","","","","","","","","","","","","","","","","","","","","","","","","","","","","","","","","","","","","","","","","2022-04-08","",29798,""
"Impact of the COVID-19 Pandemic on Anxiety and Depression Levels in Pregnant Women","Objective: Our objectives in this study are to understand the impact of COVID-19 pandemic on mental health during pregnancy and to determine the levels of depression, stress, and anxiety, to evaluate the knowledge, attitudes and behaviors of pregnant women about COVID-19 infection during the pandemic period, to be able to provide evidence-based data to all authorities involved in the prevention of depression and anxiety caused by the COVID-19 pandemic. The studies on the psychological effects of the SARS outbreak on pregnant women in 2003 showed that their mental health was affected and they experienced high levels of anxiety and anxiety of infection10. [...]it has been reported that new and threatening daily and hourly reports on the pandemic and its uncertainty create a psychological burden on pregnant women and increase their anxiety levels10,11. Psychological care of pregnant women should not be neglected, as these psychological effects during pregnancy can cause damage to both the mother and the fetus because the symptoms of anxiety and depression if highly and continuously exposed during pregnancy can cause an increase postpartum infection11, abortus, preterm birth, low birth weight fetus, low Apgar scores, preeclampsia, and cesarean delivery rates12. [...]given the effects of psychological disorders during pregnancy on the mother and fetus, improving the mental state of pregnant women exposed to stress and anxiety, correcting the factors that can cause this mental burden and preventing complications that may occur in this way, informing pregnant women in detail and providing them with emotional support can help them recover and feel safe. [...]our primary objectives in this study are: 1) to understand the impact of COVID-19 pandemic on mental health during pregnancy and to determine the depression, stress, and anxiety levels, 2) to evaluate the knowledge, attitudes and behaviors of pregnant women about COVID-19 infection during the pandemic period, 3) To be able to provide evidence-based data to all authorities involved in the prevention of depression and anxiety caused by the COVID19 pandemic.","Turan, Gokce, Taner, Mehmet Zeki, Eser, Ayla, Tufan, Ayse Duygu, Terece, Cem, Uckan, Hasan Huseyin, Nas, Tuncay","https://doi.org/10.5798/dicletip.1086193","","Database: ProQuest Central; Publication type: article; Publication details: Dicle Tip Dergisi; 49(1):53-65, 2022.","WHO","Undecided","","","","","","","","","","","","","False","False","","","","","False","False","False","","False","False","False","False","False","False","False","False","False","","","","","","","","","","","","","","","","","","","","","","","","","","","","","","","","","","","","","","","","","","","","","","","","","","","","2022-04-08","",29799,""
"COVID-19 pandemic and individuals with severe mental illness: A comparative study of Community Mental Health Centers early experiences in COVID-19 pandemic","Objective: In this study, we aimed to determine the effects of the early phase of the COVID-19 pandemic on the services in Community Mental Health Centers (CMHCs) and on the patients followed up by the CMHC. In this direction, the clinical data of the patients and CMHC services were compared with the same period of the previous year. Method: Three CMHCs' data within the first three months following the first COVID-19 case report in Turkey (11.03.202011.06.2020) were compared with the same period of the previous year retrospectively. Sociodemographic data, the number of admissions to the emergency psychiatry outpatient clinic, and the number of admissions to the psychiatry service of 2008 patients followed-up by CMHC were recorded as well as clinical parameters of inpatients and the quantitative values of the services provided by CMHCs. Results: The number of patients presenting to the emergency psychiatry outpatient clinic and admission to the inpatient psychiatry unit significantly decreased in the initial phase of the COVID-19 pandemic (p &lt;0.001). While a narrowing was observed in psychiatric hospitalization indications, face-to-face CMHC services decreased. Conclusion: The COVID-19 outbreak has created difficulties in preventing and treating COVID19 infection in individuals with severe mental illness, as well as difficulties in safely handling patients' existing mental illnesses. Considering the experiences from the early period of the pandemic, for current and future needs, the continuity of CMHCs should be supported and efforts should be made to provide digital services such as telepsychiatry applications when necessary.","Saglam, N. G. U.; Bestepe, E. E.; Izci, F.; Sarikaya, I.; Usta, H.; Baz, F.","https://doi.org/10.5505/kpd.2022.10437","","Database: Web of Science; Publication type: article; Publication details: Klinik Psikiyatri Dergisi-Turkish Journal of Clinical Psychiatry; 25(1):49-56, 2022.","WHO","Undecided","","","","","","","","","","","","","False","False","","","","","False","False","False","","False","False","False","False","False","False","False","False","False","","","","","","","","","","","","","","","","","","","","","","","","","","","","","","","","","","","","","","","","","","","","","","","","","","","","2022-04-08","",29800,""
