"title","abstract","authors","link","date","subject","source","initial_decision","q0","q1","q2","q3","q4","q5","q6","q7","q8","q9","q10","q11","q12","q13","q14","q15","q16","q17","q18","q19","q20","q21","q22","q23","q24","q25","q26","q27","q28","q29","q30","q31","q32","q33","q34","q35","q36","q37","q38","q39","q40","q41","q42","q43","q44","q45","q46","q47","q48","q49","q50","q51","q52","q53","q54","q55","q56","q57","q58","q59","q60","q61","q62","q63","q64","q65","q66","q67","q68","q69","q70","q71","q72","q73","q74","q75","q76","q77","q78","q79","q80","exclusion_reason","extraction_date","expert_decision","ID","o1"
"Mini international neuropsychiatry interview kid or child posttraumatic stress disorder symptom scale 5I for posttraumatic stress disorder among adolescent girls infected with COVID-19","Posttraumatic stress disorder (PTSD) is a mental disorder that may develop after exposure to exceptionally life threatening or horrifying events. People suffering from PTSD are vulnerable for both physical and mental health. To find out sensitivity, specificity, positive predictive value (PPV), negative predictive value (NPV), and to plot receiver operating characteristic curve taking Mini International Neuropsychiatry Interview-Kid (MINIKID) as the gold standard and Child PTSD Symptom Scale 5I (CPSS-5I) as the newer diagnostic tool for diagnosing PTSD. The cross-sectional study was carried out for a period of 6 months from January 2021 to June 2021 at R. L. Jalappa Hospital and Research Center, Kolar, Karnataka through telephonic interviews. All the data entered in Microsoft office Excel sheet, analyzed using the SPSSv22 (IBM Corp). Sensitivity of the CPSS-5I was 56% and specificity was 96% compared with MINIKID. 83% and 85%, respectively, was PPV and NPV of the CPSS-5I compared with MINIKID. Area under the curve is 83.9% with P &lt; 0.001 (72.5-95.2) indicating CPSS-5I is 84% sensitive proving to be a very good diagnostic tool for diagnosing PTSD. Furthermore, scores of 9.5 or 10.5 from CPSS-5I can be used as cutoff in diagnosing PTSD using CPSS 51. CPSS-5I is extremely well designed, helpful and functional tool used in diagnosing PTSD. With the current study showing CPSS-5I can be used in post-COVID PTSD diagnosis, it also provides cutoff which can be helpful in mass screening.","Suresh, Shankar, Satyanarayana","https://doi.org/10.4103/ijph.ijph_1076_22","20221123","Child PTSD Symptom Scale 5I; Mini International Neuropsychiatry Interview-Kid; receiver operating characteristic; sensitivity; specificity; Child; Female; Adolescent; Humans; Stress Disorders, Post-Traumatic; COVID-19; Psychometrics; Cross-Sectional Studies; Neuropsychiatry; India","PubMed","Undecided","","","","","","","","","","","","","False","False","","","","","False","False","False","","False","False","False","False","False","False","False","False","False","","","","","","","","","","","","","","","","","","","","","","","","","","","","","","","","","","","","","","","","","","","","","","","","","","","","2022-11-23","",41433,""
"Messages focused on the effect of alcohol on the immune system boosted intention to adhere to alcohol intake guidelines during Covid-19 lockdown","<b>Objective:</b> Research shows that personal relevance may affect the impact of alcohol-related health information. This study explored alcohol consumption during the UK Covid-19 lockdown, and whether a message emphasising the effect of alcohol on the immune system was more effective in altering intentions to follow low-risk drinking guidelines than other messages about the effects of alcohol on health.<b>Methods &amp; Measures:</b> From April to June 2020, 953 drinkers completed an online questionnaire, and were randomly allocated to exposure to a control condition or one of three messages emphasising the impact of alcohol on: the immune system; mental health; or physical health. Outcome variables were: concern about alcohol intake, and intention to adhere to low-risk drinking guidelines.<b>Results:</b> Pre-post ANCOVAs revealed that participants in the immunity message group had significantly stronger intention to adhere to low-risk guidelines than the control group (after controlling for initial intention). Concern for the effect of alcohol on health was not significantly affected.<b>Conclusion:</b> During Covid-19 lockdown, a message emphasising the impact of alcohol on the immune-system had a greater effect on intention to observe low-risk drinking guidelines than other messages. Contextually relevant messages could be used for alcohol health campaigns and for improving alcohol labelling.","Walker, de Visser","https://doi.org/10.1080/08870446.2022.2145606","20221122","CMO low-risk drinking guidelines; Covid-19; alcohol consumption; health communication; message tailoring","PubMed","Undecided","","","","","","","","","","","","","False","False","","","","","False","False","False","","False","False","False","False","False","False","False","False","False","","","","","","","","","","","","","","","","","","","","","","","","","","","","","","","","","","","","","","","","","","","","","","","","","","","","2022-11-23","",41434,""
"Risk Perceptions, Level of Government Trust, and Psychological Distress During COVID-19 Pandemic in Taiwan","Severe acute respiratory syndrome coronavirus 2 (SARS-CoV-2) is spreading worldwide, causing mental health concerns among people. People's perceptions of the disease affect their psychological adaptation and health outcomes. In this study, we present people's perceptions of coronavirus disease 2019 (COVID-19), level of government trust, and their psychological distress during the pandemic for examining the impact of peoples' COVID-19 perceptions on their mental health. This cross-sectional study was conducted through a telephone survey in Taiwan in April 2020. Participants were randomly selected for telephone screening using a computer-assisted telephone interviewer system. A total of 1098 participants aged more than 20 years participated in the survey. The mean age of participants was 47.7 &#xb1; 16.4 years. After controlling for covariates, participants who were worried about contracting COVID-19, those who believed that they had a chance of being infected with COVID-19, those who were reluctant to visit the hospital for fear of contracting the virus, those who felt that the pandemic had affected their daily life, and those with low levels of trust in the government's capacity to manage the pandemic had anxiety, hostility, depression, interpersonal sensitivity/inferiority, and psychological symptoms. People's perception of COVID-19 and public's trust in the government's ability to respond to the pandemic are related to psychological distress. Although the Taiwanese government may have undertaken effective epidemic control measures to address with the COVID-19 pandemic, this crisis may have still caused mental health problems in the general population. Health professionals and policy makers should pay more attention to high-risk groups among those at risk for developing mental health problems.","Chang, Shih, Lee, Lin, Lyu","https://doi.org/10.2147/PRBM.S375722","20221122","COVID-19; economic crisis; fears; mental health; perceptions; psychological distress; trust","PubMed","Undecided","","","","","","","","","","","","","False","False","","","","","False","False","False","","False","False","False","False","False","False","False","False","False","","","","","","","","","","","","","","","","","","","","","","","","","","","","","","","","","","","","","","","","","","","","","","","","","","","","2022-11-23","",41435,""
"An exploratory study of a hands-on naloxone training for rural clinicians and staff","Since the COVID-19 pandemic, an increase in fentanyl-combined drugs has led to a surge in opioid overdose deaths in the United States. Higher opioid overdose mortality rates are problematic in rural communities, and there are few prevention, treatment, and recovery resources for individuals experiencing opioid use disorder. This exploratory project aimed to investigate a hands-on naloxone training for rural clinicians and staff. Rural clinicians and staff at two behavioral health centers were recruited to participate in a 30-min lecture and 30-min hands-on intranasal naloxone training using a low-fidelity mannequin. A pre-post opioid knowledge questionnaire, rubric based on the Substance Abuse and Mental Health Services Administration toolkit, and investigator-generated survey were used to evaluate opioid knowledge and response, demonstration of intranasal naloxone administration, and participants' perceptions of the training. Enrollment characteristics were summarized using descriptive statistics and paired t-tests were used to assess mean differences. Of the nine participants in the project, seven (87.5%) were female and six (75.0%) were Black. Four participants assumed a therapist role, attained a MS or MA degree, and had 5 or more years of experience working in healthcare. The total mean rubric score for all participants was 96.0 (SD&#xa0;=&#xa0;8.8). No significant pre-post mean differences among opioid knowledge, overdose risk, and overdose response categories were found, all p&#x2009;&gt;&#x2009;0.05. However, post-intervention mean scores were slightly higher in all categories except overdose risk. Most participants (77.8%) responded that they felt comfortable handling an opioid situation and teaching the training to community members. Open-ended responses indicated that participants liked the demonstrations, examples used, hands-on nature of the training, and the presentation materials. A hands-on naloxone training is beneficial for training rural clinicians and staff to respond to opioid overdose. This training may be a promising solution to reduce response time between recognition of opioid symptoms and administration of the life-saving medication, naloxone. Future studies should examine the efficacy of this training in larger samples with the inclusion of rural interdisciplinary teams, trusted community leaders, and family and friends of those impacted by opioid use disorder. This innovative hands-on naloxone training is designed for rural clinicians and residents who are most likely to witness individuals experiencing opioid toxicity. The primary goal is to reduce response time between recognition of signs and symptoms and administration of the life-saving medication, Naloxone.","Cody, Hines, Glenn, Sharp-Marbury, Newman","https://doi.org/10.1111/jnu.12841","20221121","clinicians; harms reduction; naloxone training; opioid use disorder; rural","PubMed","Undecided","","","","","","","","","","","","","False","False","","","","","False","False","False","","False","False","False","False","False","False","False","False","False","","","","","","","","","","","","","","","","","","","","","","","","","","","","","","","","","","","","","","","","","","","","","","","","","","","","2022-11-23","",41436,""
"Factors associated with insomnia and suicidal thoughts among outpatients, healthcare workers, and the general population in Taiwan during COVID-19 pandemic: a cross-sectional study","Insomnia and suicidal thoughts are two of the negative impacts that have been caused by the COVID-19 pandemic. Identifying the factors that contribute to these psychological problems may help develop strategies to sustain the&#xa0;mental health of the public. The present study examined the psychosocial impacts caused by the COVID-19 pandemic among different populations in Taiwan, and investigated the relationships between these psychosocial variables, insomnia, and suicidal thoughts. Between September 2020 and May 2021, online questionnaires including psychometrically validated scales were distributed to a convenience sample of outpatients (n&#x2009;=&#x2009;205), healthcare workers (HCWs) (n&#x2009;=&#x2009;500), and individuals in the general population (n&#x2009;=&#x2009;1200) in Taiwan to collect data regarding their insomnia severity, suicidal thoughts, fear of COVID-19, trust of information, and resilience. Multivariate logistic regression methods were used to identify variables associated with suicidal thoughts and insomnia. Greater fear of COVID-19 was significantly associated with suicidal thoughts: odds ratios (ORs) with 95% confidence interval (CI)&#x2009;=&#x2009;1.155 (1.002-1.330) for outpatients; 1.127 (1.035-1.228) for HCWs; and 1.100 (1.130-1.222) for those in the general population. Higher resilience was significantly associated with lower insomnia: OR (95% CI)&#x2009;=&#x2009;0.819 (0.725-0.926) for outpatients; 0.803 (0.728-0.887), for HCWs; 0.829 (0.785-0.875), and for those in the general population. In addition, there was a statistically significant association between insomnia diagnosis and greater fear of COVID-19 among HCWs (OR [95% CI]&#x2009;=&#x2009;1.102 [1.062-1.144]) and those in the general population (OR [95% CI]&#x2009;=&#x2009;1.079 [1.053-1.106]). Among outpatients, there was a statistically significant association between suicidal thoughts and lower trust of information (OR [95% CI]&#x2009;=&#x2009;0.794 [0.646-0.976]), while among those in the general population there was a statistically significant association between suicidal thoughts and higher insomnia severity (OR [95% CI]&#x2009;=&#x2009;1.175 [1.13-1.222]). A statistically significant association was also found between insomnia diagnosis and higher suicidal thoughts among those in the general population (OR [95% CI]&#x2009;=&#x2009;3.455 [2.338-5.106]). Trust of information, fear, and resilience were important factors for suppressing suicidal thoughts&#xa0;and insomnia among the three study populations. Health policies that monitor psychological status and build resiliency of the public are recommended to help develop tailored strategies for different populations affected by the COVID-19 pandemic.","Lin, Chen, Huang, Lu, Strong, Lin, Griffiths, Ko","https://doi.org/10.1186/s12889-022-14557-z","20221123","COVID-19; Frontline worker; Mental health; Sleep disorder; Suicide; Taiwan; Humans; COVID-19; Outpatients; Sleep Initiation and Maintenance Disorders; Suicidal Ideation; Cross-Sectional Studies; Taiwan; Pandemics; Health Personnel","PubMed","Undecided","","","","","","","","","","","","","False","False","","","","","False","False","False","","False","False","False","False","False","False","False","False","False","","","","","","","","","","","","","","","","","","","","","","","","","","","","","","","","","","","","","","","","","","","","","","","","","","","","2022-11-23","",41437,""
"Depression and Anxiety During the COVID-19 Pandemic: Epidemiology, Mechanism, and Treatment","The Coronavirus Disease 2019 (COVID-19) pandemic has had an adverse impact on the physical and mental health of the public worldwide. In addition to illness in patients with COVID-19, isolated people and the general population have experienced mental health problems due to social distancing policies, mandatory lockdown, and other psychosocial factors, and the prevalence of depression and anxiety significantly increased during the pandemic. The purpose of this review is to elucidate the epidemiology, contributing factors, and pathogenesis of depression and anxiety. during the pandemic. These findings indicate that physicians and psychiatrists should pay more attention to and identify those with a high risk for mental problems, such as females, younger people, unmarried people, and those with a low educational level. In addition, researchers should focus on identifying the neural and neuroimmune mechanisms involved in depression and anxiety, and assess the intestinal microbiome to identify effective biomarkers. We also provide an overview of various intervention methods, including pharmacological treatment, psychological therapy, and physiotherapy, to provide a reference for different populations to guide the development of optimized intervention methods.","Zhu, Zhang, Li, Chen, Wang","https://doi.org/10.1007/s12264-022-00970-2","20221121","Anxiety; COVID-19; Depression; Epidemiology; Intervention; Mechanism","PubMed","Undecided","","","","","","","","","","","","","False","False","","","","","False","False","False","","False","False","False","False","False","False","False","False","False","","","","","","","","","","","","","","","","","","","","","","","","","","","","","","","","","","","","","","","","","","","","","","","","","","","","2022-11-23","",41438,""
"[Consequences of the COVID-19 measures for wellbeing aspects of long-term care residents]","To examine the impact of COVID-19 measures on residents of long-term care institutions, two surveys were conducted in the spring of 2020. Leontjevas et al. (study 1) inventoried practitioners' opinions, Van der Roest et al. (study 2) opinions of care workers, family, and residents without severe cognitive impairments. This article describes the combined results on social interaction and loneliness, challenging behaviour and mood, and lessons learned. In study 1, an online survey distributed to nursing home psychologists, they were asked to complete it anonymously and share the link with their fellow elderly care physicians and nurse specialists. 16 participants were then interviewed via video calling. In study 2, three hundred and fifty-seven care organizations were invited to recruit residents without severe cognitive impairments, family members and care workers for participating in a digital, anonymous survey (Study 2). The completed surveys of 323 practitioners (study 1) and 193 residents, 1609 family members and 811 employees (study 2) were included in the analyses. Social contacts of residents had changed in frequency and form compared to before the COVID-measures. Many residents experienced some loneliness during the visit ban, especially residents without cognitive impairments. There were both an increase and a decrease in challenging behaviour and affect. Several strategies used to reduce the effects of COVID-19 measures on well-being, were considered maintainable. Our studies confirmed a major impact of the COVID-19 measures on the wellbeing of long-term care residents, but also showed successful strategies of practitioners that can benefit future practice. Om de impact van de COVID-19-maatregelen op bewoners van instellingen voor langdurige zorg te onderzoeken, hielden we in het voorjaar van 2020 twee enqu&#xea;tes. Leontjevas en collega&#x2019;s (studie 1) inventariseerden de mening van behandelaren en Van der Roest en collega&#x2019;s (studie 2) die van zorgmedewerkers, familie en bewoners zonder ernstige cognitieve beperkingen. Dit artikel beschrijft de gecombineerde resultaten over sociale contacten en eenzaamheid, probleemgedrag en affect, en door professionals opgedane inzichten om toe te passen in de toekomst (lessons learned). Verpleeghuispsychologen zijn gevraagd een online enqu&#xea;te, anoniem in te vullen en de link te delen met hun collega-artsen ouderengeneeskunde en verpleegkundig specialisten. Zestien deelnemers zijn vervolgens ge&#xef;nterviewd via beeldbellen (studie 1). Daarnaast zijn 357 zorgorganisaties uitgenodigd om bewoners zonder ernstige cognitieve beperkingen, naasten en zorgmedewerkers aan een digitale, anonieme enqu&#xea;te te laten deelnemen (studie 2). De ingevulde enqu&#xea;tes van 323 behandelaren (studie 1) en 193 bewoners, 1609 naasten en 811 medewerkers (studie 2) zijn meegenomen in de analyses. Sociale contacten van bewoners waren veranderd in frequentie en vorm ten opzichte van v&#xf3;&#xf3;r de maatregelen. Veel bewoners ervaarden eenzaamheid tijdens het bezoekverbod, vooral bewoners zonder cognitieve beperkingen. Er bleek zowel een toename als afname van probleemgedrag en affecten. Verschillende strategie&#xeb;n, ingezet om effecten van COVID-19 maatregelen op welbevinden te verminderen, wilde men behouden. Onze studies toonden een impact van de COVID-19 maatregelen op het welbevinden van bewoners, maar toonden ook succesvolle strategie&#xeb;n van professionals waar zorgverleners in de toekomst voordeel mee kunnen doen.","Gerritsen, Leontjevas, Prins, van der Roest","https://doi.org/10.36613/tgg.1875-6832/2022.01.01","20221122","Family carers; Nursing homes; Residential homes; Treatment staff; Visitor ban; Humans; Aged; Long-Term Care; COVID-19; Nursing Homes; Loneliness; Surveys and Questionnaires","PubMed","Undecided","","","","","","","","","","","","","False","False","","","","","False","False","False","","False","False","False","False","False","False","False","False","False","","","","","","","","","","","","","","","","","","","","","","","","","","","","","","","","","","","","","","","","","","","","","","","","","","","","2022-11-23","",41439,""
"Water Poverty Index: a Tool for Water Resources Management in Jordan","In terms of water resources, Jordan is considered one of the poorest countries in the world. Water resources management is one of the available options to decrease the gap between demand and resources. Water resources management requires optimum use of the available water resources taking into consideration resources availability, resources reliability, water use pattern, in addition to the socioeconomic issues. One of the most important aspects is human behaviour which has a strong impact on water management and on the ecosystem. Therefore, there is a need to follow a sustainable approach to improve the management and the understanding of the difficulties of water issues by integrating the physical, social, economic, and environmental aspects, as well as linking water issues to poverty indicator. In this paper, Water Poverty Index (WPI) will be used as a tool for water resources management. WPI was calculated based on five parameters: resources, access to water, capacity, use, and the environment. The Jordanian water strategy targets will be used to forecast the water situation in 2025 and calculate WPI. In 2002, the WPI was calculated and found at 46.3%, in comparison with higher figures for other countries. WPI was calculated for the year 2018, and the results showed a value of 50.7%. If the national water strategy targets and improvements will be successfully implemented, by 2025, the value is expected to be increased to 56.38%. Water resources are the most sensitive component of WPI. COVID-19 increased the rate of unemployment and poverty ratio which will affect WPI negatively. It's concluded that WPI could be used as a valuable indicator to help evaluate the running plans and monitor the management performance.","Alqatarneh, Al-Zboon","https://doi.org/10.1007/s11270-022-05892-3","20221122","Consumption; Jordan; Water Poverty Index; Water budget; Water scarcity","PubMed","Undecided","","","","","","","","","","","","","False","False","","","","","False","False","False","","False","False","False","False","False","False","False","False","False","","","","","","","","","","","","","","","","","","","","","","","","","","","","","","","","","","","","","","","","","","","","","","","","","","","","2022-11-23","",41440,""
