"title","abstract","authors","link","date","subject","source","initial_decision","q0","q1","q2","q3","q4","q5","q6","q7","q8","q9","q10","q11","q12","q13","q14","q15","q16","q17","q18","q19","q20","q21","q22","q23","q24","q25","q26","q27","q28","q29","q30","q31","q32","q33","q34","q35","q36","q37","q38","q39","q40","q41","q42","q43","q44","q45","q46","q47","q48","q49","q50","q51","q52","q53","q54","q55","q56","q57","q58","q59","q60","q61","q62","q63","q64","q65","q66","q67","q68","q69","q70","q71","q72","q73","q74","q75","q76","q77","q78","q79","q80","exclusion_reason","extraction_date","expert_decision","ID","o1"
"Knowledge, Attitudes, Behavioural Practises, and Psychological Impact Relating to COVID-19 Among People Living With Spinal Cord Injury During In-Patient Rehabilitation in Bangladesh","The aim of this research is to focus on gaining an insight into the knowledge, attitudes, behavioural practises (KAP), and psychological impact relating to COVID-19 among the people living with spinal cord injury receiving in-patient rehabilitation. A prospective, cross-sectional survey of people with SCI (<i>N</i> = 207), who were in active in-patient rehabilitation from two tertiary SCI Rehabilitation Centres in Bangladesh. Data were collected via face-to-face interviews, after voluntary consent, using a pretested, language validated questionnaire on Knowledge, Attitude and Behavioural practises (KAP) and the Depression, Anxiety, Stress Scale (DASS-21). Ethical approval and trial registration were obtained prospectively. A total of 207 people with SCI responded, among which 87% were men and 13% were women, with a mean age of 34.18 Ã‚Â± 12.9 years. Within the sample group, people living with tetraplegia comprised 33.8%, and people living with paraplegia comprised 66.2%. Overall, 63.8% of the participants were diagnosed with an SCI categorised as ASIA-A. Overall, the ""knowledge score"" was 8.59 Ã‚Â± 2.3 out of 12, ""depression"" was 11.18 Ã‚Â± 8, ""anxiety"" was 7.72 Ã‚Â± 5.1, and ""stress"" was 9.32 Ã‚Â± 6.7 from a total of 21 scores each category. The strong correlation was between knowledge, DASS scores, and age (<i>p</i> &lt; 0.05). In addition, there was a strong correlation between knowledge, gender (<i>p</i> &lt; 0.05) and education (<i>p</i> &lt; 0.01). Binary logistic regression found a stronger association of knowledge and DASS scores with gender, young age, illiteracy (<i>p</i> &lt; 0.01), and rural residence (<i>p</i> &lt; 0.05). A positive relationship was found between depression and anxiety scores (<i>p</i> &lt; 0.01) and a moderate positive relationship was found between depression and stress scores (<i>p</i> &lt; 0.01). A positive attitude was reported by the majority of participants (<i>p</i> &lt; 0.05). In terms of behavioural practises, participants reported both self and caregiver had followed health advice with regard to consulting health professionals (65.7%), implementing isolation (63.8%), taking droplet precaution care (87.4%), and hygiene care (90.3%). Participants in this study reported high levels of knowledge, adoption of positive attitudes, and the practise of positive health advisory behaviours related to COVID-19 prevention procedures. However, high levels of depression, anxiety, and stress were also reported. Overall, women and younger participants were more likely to have high KAP, whereas those living in rural areas and with literacy challenges were less likely to report high knowledge scores.","Hossain, Hossain, Sakel, Kabir, Saunders, Faruqui, Hossain, Uddin, Kader, Walton, Haque, Shafin, Chakrovorty, Jahid","https://doi.org/10.3389/fneur.2021.739354","20220224","Bangladesh; COVID-19; anxiety; depression; knowledge attitudes behavioural practices; psychological impact; spinal cord injury; stress","PubMed","Undecided","","","","","","","","","","","","","False","False","","","","","False","False","False","","False","False","False","False","False","False","False","False","False","","","","","","","","","","","","","","","","","","","","","","","","","","","","","","","","","","","","","","","","","","","","","","","","","","","","2022-02-25","",27528,""
"University Students Adjusting to COVID-19 Stressors: Exploratory and Confirmatory Factor Analyses of the COVID-19 Stressors Questionnaire","The psychological effects of COVID-19 have been documented in the past year, but scarce literature exists on the nature of COVID-19 stressors. Using a random split sample of 1199 young adult university students, results of exploratory factor analyses (EFA) identified a four-factor structure in the COVID-19 Stressors Questionnaire (C19SQ), which were labeled Resource Constraints, Social Restrictions, Future Uncertainty, and Health Concerns. This model was supported by a confirmatory factor analysis (CFA) when run on the other split sample of 1139 university students. Higher levels of COVID-19 stress were positively associated with anxiety and depressive symptoms and negatively associated with sleep duration, sleep quality, and the number of exercise days. COVID-19 stress also uniquely predicted poor university adjustment. This study demonstrated the link between COVID-19 stressors and mental and physical health symptoms, thus providing support for conceptualizing the psychological impact of the pandemic as adjustment problems for some individuals.","Yong, Suh","https://doi.org/10.3389/fpsyg.2022.816961","20220224","COVID-19; adjustment; anxiety; depression; factor analyses; stressor; young adulthood","PubMed","Undecided","","","","","","","","","","","","","False","False","","","","","False","False","False","","False","False","False","False","False","False","False","False","False","","","","","","","","","","","","","","","","","","","","","","","","","","","","","","","","","","","","","","","","","","","","","","","","","","","","2022-02-25","",27529,""
"Effects of COVID-19 on Mental Health and Its Relationship With Death Attitudes and Coping Styles Among Hungarian, Norwegian, and Turkish Psychology Students","The purpose of this study was to investigate mental effects of coronavirus disease 2019 (COVID-19) and its relationship with death attitudes and coping styles among Hungarian, Norwegian, and Turkish psychology students. A total of 388 participants from Hungary (<i>N</i> = 122, 31.4%), Norway (<i>N</i> = 96, 24.7%), and Turkey (<i>N</i> = 170, 43.8%) were recruited during the pandemic. The Depression, Anxiety and Stress Scale, the Impact of Event Scale-Revised, the Carver Brief COPE Inventory, and the Death Attitude Profile-Revised were used. The results indicated that escape acceptance might be the most maladaptive death attitude during COVID-19, as it was related to poorer mental health among the Hungarian, Norwegian, and Turkish psychology students. Self-blame, behavioral disengagement, self-distraction, and substance use coping styles were also related to poorer mental health, whereas positive-reframing (only among the Hungarian and Turkish participants) and humor (only among the Norwegian participants) were related to better mental health among our sample in the context of COVID-19. The findings implied that death attitudes and coping styles may differ in their efficacy among the Hungarian, Norwegian, and Turkish participants. These differences were discussed in detail in the discussion part. During the pandemic, practitioners might pay closer attention to patients with higher escape acceptance death attitude and patients who use dysfunctional coping styles. Additionally, patients can be encouraged to use techniques involving positive reframing and humor coping styles.","Oker, Reinhardt, Schmelowszky","https://doi.org/10.3389/fpsyg.2022.812720","20220224","COVID-19; coping styles; cross-cultural comparison; death attitudes; mental health","PubMed","Undecided","","","","","","","","","","","","","False","False","","","","","False","False","False","","False","False","False","False","False","False","False","False","False","","","","","","","","","","","","","","","","","","","","","","","","","","","","","","","","","","","","","","","","","","","","","","","","","","","","2022-02-25","",27530,""
"Adolescents' Resilience During COVID-19 Pandemic and Its Mediating Role in the Association Between SEL Skills and Mental Health","The main purpose of this paper is to investigate the role of social and emotional learning (SEL) skills and resilience in explaining mental health in male and female adolescents, during the COVID-19 pandemic. Three self-report questionnaires were administered to 778 participants aged between 11 and 16 years (mean age = 12.73 years; SD = 1.73) and recruited from 18 schools in Northern Italy. The SSIS-SEL<i>b</i>-S and the CD-RISC 10 assessed SEL and resilience skills respectively, while the Strengths and Difficulties Questionnaire (SDQ) was used to measure mental health in terms of internalizing problems, externalizing problems, and prosocial behavior. We found that SEL and resilience skills were positively and significantly associated with each other, negatively associated with internalizing and externalizing problems, and positively related to prosocial behavior. Three linear regression analyses showed the significant role of resilience, age, and gender in explaining the variance of internalizing problems; the significant role of SEL skills, resilience, age, and gender in explaining the variance of externalizing problems; and the role of SEL skills, age, and gender in explaining prosocial behavior. Importantly, we found that resilience fully mediated the relationship between SEL skills and internalizing problems, partially mediated the relationship between SEL skills and externalizing problems and didn't mediate the relationship between SEL skills and prosocial behavior. The paper concludes with a discussion of the limitations of the study as well as its practical implications.","Grazzani, Agliati, Cavioni, Conte, Gandellini, Lupica Spagnolo, Ornaghi, Rossi, Cefai, Bartolo, Camilleri, Oriordan","https://doi.org/10.3389/fpsyg.2022.801761","20220224","adolescents; externalizing behaviors; internalizing behaviors; mental health; prosocial behaviors; resilience; social-emotional learning","PubMed","Undecided","","","","","","","","","","","","","False","False","","","","","False","False","False","","False","False","False","False","False","False","False","False","False","","","","","","","","","","","","","","","","","","","","","","","","","","","","","","","","","","","","","","","","","","","","","","","","","","","","2022-02-25","",27531,""
"Scaling Up Patient-Centered Psychological Treatments for Perinatal Depression in the Wake of a Global Pandemic","There is a call to action to reduce the public health burden of perinatal depression worldwide. The COVID-19 pandemic has further highlighted significant gaps in perinatal mental health care, especially among women who identify as Black, Indigenous, People of Color (BIPOC). While psychotherapeutic (cognitive, behavioral and interpersonal) interventions are endorsed for perinatal mood disorders, barriers to access and uptake contribute to inequitable access to treatment at the population level. To effectively address these barriers and increase the scalability of psychotherapy among perinatal women, we suggest four pragmatic questions to be answered from a patient-centered lens; namely, ""who,"" ""what,"" ""how,"" and ""when."" Promising avenues include task-sharing among mental health non-specialists, an emphasis on culturally sensitive care, web-based delivery of psychotherapy with some caveats, and a lifespan approach to perinatal mental health. Innovative research efforts are seeking to validate these approaches in diverse contexts across North America and the UK, lending optimism toward scalable and long-term solutions for equitable perinatal mental health care.","Singla, Meltzer-Brody, Savel, Silver","https://doi.org/10.3389/fpsyt.2021.826019","20220224","health equity; perinatal depression; psychotherapy; task sharing; telemedicine","PubMed","Undecided","","","","","","","","","","","","","False","False","","","","","False","False","False","","False","False","False","False","False","False","False","False","False","","","","","","","","","","","","","","","","","","","","","","","","","","","","","","","","","","","","","","","","","","","","","","","","","","","","2022-02-25","",27532,""
"Social Media Efficacy in Crisis Management: Effectiveness of Non-pharmaceutical Interventions to Manage COVID-19 Challenges","The new identified virus COVID-19 has become one of the most contagious diseases in human history. The ongoing coronavirus has created severe threats to global mental health, which have resulted in crisis management challenges and international concerns related to health issues. As of September 9, 2021, there were over 223.4 million patients with COVID-19, including 4.6 million deaths and over 200 million recovered patients reported worldwide, which has made the COVID-19 outbreak one of the deadliest pandemics in human history. The aggressive public health implementations endorsed various precautionary safety and preventive strategies to suppress and minimize COVID-19 disease transmission. The second, third, and fourth waves of COVID-19 continue to pose global challenges to crisis management, as its evolution and implications are still unfolding. This study posits that examining the strategic ripostes and pandemic experiences sheds light on combatting this global emergency. This study recommends two model strategies that help reduce the adverse effects of the pandemic on the immune systems of the general population. This present paper recommends NPI interventions (non-pharmaceutical intervention) to combine various measures, such as the suppression strategy (lockdown and restrictions) and mitigation model to decrease the burden on health systems. The current COVID-19 health crisis has influenced all vital economic sectors and developed crisis management problems. The global supply of vaccines is still not sufficient to manage this global health emergency. In this crisis, NPIs are helpful to manage the spillover impacts of the pandemic. It articulates the prominence of resilience and economic and strategic agility to resume economic activities and resolve healthcare issues. This study primarily focuses on the role of social media to tackle challenges and crises posed by COVID-19 on economies, business activities, healthcare burdens, and government support for societies to resume businesses, and implications for global economic and healthcare provision disruptions. This study suggests that intervention strategies can control the rapid spread of COVID-19 with hands-on crisis management measures, and the healthcare system will resume normal conditions quickly. Global economies will revitalize scientific contributions and collaborations, including social science and business industries, through government support.","Zhou, Draghici, Abbas, Mubeen, Boatca, Salam","https://doi.org/10.3389/fpsyt.2021.626134","20220224","COVID-19; crisis management; health related information; non-pharmaceutical interventions; social media use","PubMed","Undecided","","","","","","","","","","","","","False","False","","","","","False","False","False","","False","False","False","False","False","False","False","False","False","","","","","","","","","","","","","","","","","","","","","","","","","","","","","","","","","","","","","","","","","","","","","","","","","","","","2022-02-25","",27533,""
"Type 1 diabetes and the challenges of emotional support in crisis situations: results from a randomized clinical trial of a multidisciplinary teleintervention","The association between type 1 diabetes and mental health disorders could be exacerbated in a stressful environment. This study aimed to evaluate the effectiveness of a teleguided intervention on emotional disorders in patients with type 1 diabetes during the COVID-19 outbreak. An open-label clinical trial was performed during the social distancing period in the COVID-19 outbreak in Brazil. Individuals with type 1 diabetes agedÃ¢â‚¬â€°Ã¢â€°Â¥Ã¢â‚¬â€°18Ã‚Â years were randomized to receive a teleguided multidisciplinary intervention or the usual care plus an educational website access. The primary outcome was a positive screening for emotional disorders (Self Report Questionnaire 20) after a 16-week intervention. Secondary outcomes included evaluation of patients' perceptions of pandemic-related changes, diabetes-related emotional distress, eating disorders, and sleep disorders. Data were analyzed with the intent-to-treat principle. Fifty-eight individuals (mean age, 43.8Ã¢â‚¬â€°Ã‚Â±Ã¢â‚¬â€°13.6Ã‚Â years) were included (intervention group, nÃ¢â‚¬â€°=Ã¢â‚¬â€°29; control group, nÃ¢â‚¬â€°=Ã¢â‚¬â€°29). The primary outcome was not different between the groups. The intervention group felt more supported in their diabetes care during the social distancing period (82.8% vs. 48.3% in the control group, PÃ¢â‚¬â€°&lt;Ã¢â‚¬â€°0.01). Both groups reported a similar self-perceived worsening of physical activity habits and mental health during the outbreak. There was no benefit to using theÃ‚Â telehealth strategy proposed for emotional disorders in patients with type 1 diabetes during the COVID-19 outbreak. Further studies are needed to determine the impact on metabolic parameters and to understand why it is so difficult to emotionally support these patients.Trail Registration: ClinicalTrials.gov (NCT04344210), 14/04/2020.","Alessi, Becker, Amaral, de Oliveira, Franco, Knijnik, Kobe, de Brito, de Carvalho, Telo, Schaan, Telo","https://doi.org/10.1038/s41598-022-07005-w","20220224","","PubMed","Undecided","","","","","","","","","","","","","False","False","","","","","False","False","False","","False","False","False","False","False","False","False","False","False","","","","","","","","","","","","","","","","","","","","","","","","","","","","","","","","","","","","","","","","","","","","","","","","","","","","2022-02-25","",27534,""
"Increase in Mental Disorders During the COVID-19 Pandemic-the Role of Occupational and Financial Strains An Analysis of the German National Cohort (NAKO) Study","Numerous studies have reported an increase in mental disorders during the COVID-19 pandemic, but the exact reasons for this development are not well understood. In this study we investigate whether pandemic-related occupational and financial changes (e.g., reduced working hours, working from home, financial losses) were associated with increased symptoms of depression and anxiety compared with the situation before the pandemic. We analyzed data from the German National Cohort (NAKO) Study. Between May and November 2020, 161 849 study participants answered questions on their mental state and social circumstances. Their responses were compared with data from the baseline survey before the pandemic (2014-2019). Linear fixed-effects models were used to determine whether individual changes in the severity of symptoms of depression (PHQ-9) or anxiety (GAD-7) were associated with occupational/financial changes (controlling for various covariates). The prevalence of moderate or severe symptoms of depression and anxiety increased by 2.4% and 1.5%, respectively, during the COVID-19 pandemic compared with the preceding years. The mean severity of the symptoms rose slightly. A pronounced increase in symptoms was observed among those who became unemployed during the pandemic (+ 1.16 points on the depression scale, 95% confidence interval [0.91; 1.41], range 0-27). Increases were also seen for reduced working hours with no short-time allowance, increased working hours, working from home, insecurity regarding employment, and financial strain. The deterioration in mental health was largely statistically explained by the occupational and financial changes investigated in the model. Depressive symptoms and anxiety disorders increased slightly in the study population during the first year of the COVID-19 pandemic. Occupational and financial difficulties were an essential contributory factor. These strains should be taken into account both in the care of individual patients and in the planning of targeted prevention measures.","Dragano, Reuter, Peters, Engels, Schmidt, Greiser, Bohn, Riedel-Heller, Karch, Mikolajczyk, Krause, Lang, Panreck, Rietschel, Brenner, Fischer, Franzke, Gastell, Holleczek, JÃƒÂ¶ckel, Kaaks, Keil, Kluttig, KuÃƒÅ¸, Legath, Leitzmann, Lieb, Meinke-Franze, Michels, Obi, Pischon, Feinkohl, Rospleszcz, Schikowski, Schulze, Stang, VÃƒÂ¶lzke, Willich, Wirkner, Zeeb, Ahrens, Berger","https://doi.org/10.3238/arztebl.m2022.0133","20220224","","PubMed","Undecided","","","","","","","","","","","","","False","False","","","","","False","False","False","","False","False","False","False","False","False","False","False","False","","","","","","","","","","","","","","","","","","","","","","","","","","","","","","","","","","","","","","","","","","","","","","","","","","","","2022-02-25","",27535,""
"Impact of COVID-19 on Malaysian dental students' physical, mental, financial and academic concerns","The coronavirus disease 2019 (COVID-19) caused by a novel coronavirus (SARS-CoV-2) has gained worldwide attention and proved to hold an impact to humankind in all aspects of life. Dental students' performances may indirectly be affected following the preventive measures in containing the disease. This study aims to evaluate the impact of COVID-19 pandemic on physical, mental, financial health and academic concern among dental students in Malaysia. The current research implemented a cross sectional study among dental students in Malaysia. Assessment of the impact of COVID-19 on dental education was done by the distribution of a set of online survey consisting of 28 questions to dental students (nÃ¢â‚¬â€°=Ã¢â‚¬â€°353) from public and private universities in Malaysia. The questionnaires include sociodemographic backgrounds and assessment on the mental health, financial health, physical health and academic concern. Kruskal Wallis test and Mann-Whitney U test were used to analyse the impact of COVID-19 to these 4 domains according to sociodemographic background. A total number of 353 respondents was recorded and 76.2% comprised of female. 59.7% were clinical students and 40.3% were preclinical students. Most of students were concerned about their own emotional health, financial concern, physical wellbeing, in which Year 3 students were found to be more concerned about their mental and financial health concern. COVID-19 pandemic had indeed significantly affected Malaysian dental students mainly due to fear of the quality of online learning and the amount of clinical skills acquired. Therefore, it is important to identify dental stressorsÃ‚Â and lessen the impact of COVID-19 to dental students.","Lestari, Yazid, Azhar, Ismail, Sukotjo","https://doi.org/10.1186/s12903-022-02081-w","20220224","COVID-19; Dental education; Dentistry; Medicine; Mental health; Pandemic","PubMed","Undecided","","","","","","","","","","","","","False","False","","","","","False","False","False","","False","False","False","False","False","False","False","False","False","","","","","","","","","","","","","","","","","","","","","","","","","","","","","","","","","","","","","","","","","","","","","","","","","","","","2022-02-25","",27536,""
"Digital transformation in medical education: Factors that influence readiness","Digital transformation has become inseparable from education, and its implementation has broadly increased due to the increased adoption of e-learning during the COVID-19 pandemic. The present study evaluated the levels and influence of computer anxiety and digital readiness for academic engagement among undergraduate students. A cross-sectional study was conducted on 272 medical students enrolled in a medicine program. Two previously validated instruments were adopted. We examined the association between students' sociodemographic variables, internet use, and perceived academic performance during e-learning and their computer anxiety and digital readiness. The results show a significant effect of gender, age, and internet use on students' computer anxiety and digital readiness. Males' information-sharing behavior and skills outperformed those of females, and students' computer anxiety decreased with increasing age. In addition, the results indicate that the greater the students' internet use, the better their digital readiness for academic engagement. Furthermore, computer anxiety and digital readiness affect students' perceptions of their academic performance in e-learning. The rapid rate of technological advancements and the integration of e-learning into education means that careful attention must be paid to student characteristics as well as their skills. This will allow educators to create a successful, personalized learning framework.","Althubaiti, Tirksstani, Alsehaibany, Aljedani, Mutairii, Alghamdi","https://doi.org/10.1177/14604582221075554","20220224","Academic engagement; academic performance; computer anxiety; digital readiness; e-learning, medical students","PubMed","Undecided","","","","","","","","","","","","","False","False","","","","","False","False","False","","False","False","False","False","False","False","False","False","False","","","","","","","","","","","","","","","","","","","","","","","","","","","","","","","","","","","","","","","","","","","","","","","","","","","","2022-02-25","",27537,""
