"title","abstract","authors","link","date","subject","source","initial_decision","q0","q1","q2","q3","q4","q5","q6","q7","q8","q9","q10","q11","q12","q13","q14","q15","q16","q17","q18","q19","q20","q21","q22","q23","q24","q25","q26","q27","q28","q29","q30","q31","q32","q33","q34","q35","q36","q37","q38","q39","q40","q41","q42","q43","q44","q45","q46","q47","q48","q49","q50","q51","q52","q53","q54","q55","q56","q57","q58","q59","q60","q61","q62","q63","q64","q65","q66","q67","q68","q69","q70","q71","q72","q73","q74","q75","q76","q77","q78","q79","q80","exclusion_reason","extraction_date","expert_decision","ID","o1"
"[2021 scientific breakthroughs in ambulatory general internal medicine]","Psychotherapy diminishes depression relapses when antidepressants are reduced or stopped. Delayed antibiotic therapy is effective and safe while treating community-acquired respiratory infection. Physical rehabilitation after hospitalization due to acute cardiac decompensation is useful in frail patients. Six hours of sleep appears to be associated with a higher risk of dementia in people aged 50-70 years. Patients modify healthcare use after losing their referring physician. Screening for atrial fibrillation in healthy patients aged 65 or older is not beneficial. Physicians' ECG reading skills decrease in the absence of regular training. Patients hospitalized with COVID-19 are often clinically, psychologically, and economically impacted. La psychothÃ©rapie diminue les rechutes de dÃ©pression lors de la rÃ©duction ou de lâ€™arrÃªt des antidÃ©presseurs. En cas dâ€™infection respiratoire communautaire, lâ€™antibiothÃ©rapie retardÃ©e est efficace et sÃ»re. La rÃ©adaptation physique aprÃ¨s une dÃ©compensation cardiaque aiguÃ« est utile chez les patients fragiles. Un sommeil de 6 heures semble Ãªtre associÃ© Ã un risque plus Ã©levÃ© de dÃ©mence chez les personnes de 50 Ã 70 ans. Les patients modifient le recours aux soins de santÃ© aprÃ¨s la cessation dâ€™activitÃ© de leur mÃ©decin rÃ©fÃ©rent. La recherche de fibrillation auriculaire chez les patients de 65 ans ou plus en bonne santÃ© nâ€™est pas bÃ©nÃ©fique. Les compÃ©tences mÃ©dicales de lecture dâ€™ECG diminuent en lâ€™absence de formation rÃ©guliÃ¨re. Les patients hospitalisÃ©s pour un Covid-19 sont souvent impactÃ©s aux niveaux clinique, psychologique et Ã©conomique.","Gouveia, Auer, Baratali, Deillon, Kokkinakis, Leuzinger, Samusure, Selby, Tzartzas, Favrat, Bodenmann","https://doi.org/10.53738/REVMED.2022.18.766.102","20220127","","PubMed","Undecided","","","","","","","","","","","","","False","False","","","","","False","False","False","","False","False","False","False","False","False","False","False","False","","","","","","","","","","","","","","","","","","","","","","","","","","","","","","","","","","","","","","","","","","","","","","","","","","","","2022-01-28","",26109,""
"Publication trends in telemedicine research originating from Canada","Telemedicine modalities for patient care have seen significant global uptake during the COVID-19 pandemic. This study aimed to bibliometrically evaluate the evolution and current landscape of telemedicine literature in Canada. The Scopus database was searched to identify telemedicine publications for which the first or last author had a Canadian institutional affiliation. Study selection and data abstraction were conducted by two pairs of independent reviewers. Between 1976 and January 2021, 810 of 3620 retrieved citations were telemedicine publications originating from Canada, including 29 randomized controlled trials and 6 systematic reviews. The annual publication output increased substantially from 1/year in 1976 to 80/year in 2020. Based on author keyword analysis, the most frequently investigated disciplines or disease entities were primary care, COVID-19, telepsychiatry, heart failure, and mental health. The insights this study provides will aid scientists, policymakers, and other stakeholders in identifying opportunities for future investigation and clinical application.","Xie, Nanji, Khan, Khalid, Garg, Sivaprasad, Thabane, Chaudhary","https://doi.org/10.1177/08404704211070240","20220127","Canada; bibliometrics; telemedicine","PubMed","Undecided","","","","","","","","","","","","","False","False","","","","","False","False","False","","False","False","False","False","False","False","False","False","False","","","","","","","","","","","","","","","","","","","","","","","","","","","","","","","","","","","","","","","","","","","","","","","","","","","","2022-01-28","",26110,""
"The impact of early stages of COVID-19 on the mental health of autistic adults in the United Kingdom: A longitudinal mixed-methods study","During the COVID-19 pandemic, high levels of depression, anxiety and stress have been reported in the general population. However, much less has been reported about the impact of COVID-19 on the mental health of autistic people. What we did: In the present study, we investigated how the mental health of autistic adults in the United Kingdom changed during the early stages of the COVID-19 pandemic. In total, 133 participants completed an online survey at two different time points. Of the 133 participants, 70 completed the survey at the first time point just before the onset of the national lockdown. This allowed us to look at changes in their mental health, from before the lockdown to 10 to 15â€‰weeks during lockdown. All participants (133) told us about their experiences of the pandemic. What we found: While many autistic adults told us that their mental health worsened, people's experience varied. For some autistic adults, aspects of mental health (e.g. anxiety, stress) actually improved. Participants also described social changes that had occurred, at home and in the outside world. They described feelings of uncertainty during the pandemic, and discussed how the pandemic had affected some of their previous coping strategies. Participants also told us about their difficulties in accessing healthcare services and food during the early stages of the pandemic. In our article, we discuss these findings and focus on what needs to change to ensure that autistic people are better supported as the pandemic continues.","Bundy, Mandy, Crane, Belcher, Bourne, Brede, Hull, Brinkert, Cook","https://doi.org/10.1177/13623613211065543","20220127","COVID-19; adults; anxiety; autism spectrum disorders; depression; health services; mental health; qualitative research","PubMed","Undecided","","","","","","","","","","","","","False","False","","","","","False","False","False","","False","False","False","False","False","False","False","False","False","","","","","","","","","","","","","","","","","","","","","","","","","","","","","","","","","","","","","","","","","","","","","","","","","","","","2022-01-28","",26111,""
"The benefits and consequences of the COVID-19 pandemic for patients diagnosed with cancer and their family caregivers","The objectives of this study were to examine benefits and consequences of the COVID-19 pandemic for patients diagnosed with cancer and their family caregivers. A 23-item questionnaire assessing COVID-19-related issues, the Patient Health Questionnaire-2, Generalized Anxiety Disorder-2, Pittsburgh Sleep Quality Index, and the Perceived Stress Scale (PSS)-4 were administered to patients diagnosed with cancer and their family caregivers. Of the 161 patients and 78 caregivers who participated, 38.1% and 32.8 were male, 95% and 84.6% Caucasian, and the mean age was 66 and 64.6 years, respectively. A total of 16.5% and 15.2% reported depressive symptoms, 18.4% and 19% reported anxiety; 35.5% and 26.6% reported poor sleep quality, and 66% and 63.3% scored one standard deviation above the norms for the PSS, respectively. Predictors of poorer patient- and caregiver-reported outcomes included greater loneliness, worry about self or family being infected by the COVID-19, and worsening relationships with family. The fear of COVID-19 led to 20.8% of patients and 24.4% of family caregivers cancelling medical appointments, procedures, and treatments. A total of 52.5% of patients and 53.2% caregivers reported that the pandemic led to benefit finding but these changes were not associated with any of the measured patient- or caregiver-related outcomes. Psychological functioning for patients and caregivers was similar to that of pre-pandemic levels, however the decrease in health care utilization secondary to fear of COVID-19 was notable. While there were many negative effects of the pandemic, the majority of patients and caregivers reported some benefit to the pandemic. This article is protected by copyright. All rights reserved.","Steel, Amin, Peyser, Olejniczak, Antoni, Carney, Tillman, Hecht, Pandya, Miceli, Reyes, Nilsen, Johnson, Kiefer, Pappu, Zandberg, Geller","https://doi.org/10.1002/pon.5891","20220127","COVID-19 pandemic; cancer; cancer care; oncology; patient reported outcomes","PubMed","Undecided","","","","","","","","","","","","","False","False","","","","","False","False","False","","False","False","False","False","False","False","False","False","False","","","","","","","","","","","","","","","","","","","","","","","","","","","","","","","","","","","","","","","","","","","","","","","","","","","","2022-01-28","",26112,""
"COVID-19 and mental health: a longitudinal population study from Norway","Existing research has found adverse short-term effects of the COVID-19 pandemic on mental health, but longer-term effects have been less documented. Using newly released register data on all general practitioner consultations in Norway through 2020 (about 14 million consultations in total), we find that during the spring and early summer 2020, the number of psychological cases initially increased relative to prior years, but then fell back towards the level of prior years during the summer 2020. In early September 2020, the number of cases accelerated, a pattern that held up through December 2020, so that the gap between 2020 and prior years became largest end-of-year. Our findings suggest that the accumulated adverseÂ effects of the COVID-19 pandemic on mental health far exceeds the short-term effects. The effects are particularly strong for females and for residents in urban areas.","Hvide, Johnsen","https://doi.org/10.1007/s10654-021-00836-3","20220127","Mental health; Primary care; Psychological disorder; Psychological symptoms","PubMed","Undecided","","","","","","","","","","","","","False","False","","","","","False","False","False","","False","False","False","False","False","False","False","False","False","","","","","","","","","","","","","","","","","","","","","","","","","","","","","","","","","","","","","","","","","","","","","","","","","","","","2022-01-28","",26113,""
"Love in the Time of COVID-19: A Multi-Wave Study Examining the Salience of Sexual and Relationship Health During the COVID-19 Pandemic","The current study used Family Systems Theory as a framework to clarify the impact of the COVID-19 pandemic on sexual, romantic, and individual functioning. Specifically, sexual and romantic functioning were modeled as key mechanisms linking COVID-19 related stressors (as predictors) to aspects of individual functioning over time (as outcomes). A sample of 1,241 sexually active adults in relationships (47% married/engaged) was recruited from March 5 to May 5, 2020: 82% White, 66% women, Mâ€‰=â€‰34 years old, 58% heterosexual. All participants completed a baseline survey and 642 participants completed at least one of the six, monthly, follow-up surveys. Multilevel SEM models evaluated the model both at the level of stable between-person differences (i.e., level 2) and at the level of within-person change across time (i.e., level 1). The findings suggested that COVID-19 related stress was predictive of lower sexual, romantic, and individual functioning in both levels of the model. Significant indirect paths supported the proposed mediation at the level of within-person change across time: elevations in COVID-19 stress within specific months predicted corresponding drops in sexual functioning, which in turn predicted corresponding drops in romantic functioning, which in turn predicted corresponding drops in individual well-being (highlighting points of intervention). In contrast, at the level of between-person differences, stable levels of sexual and relationship satisfaction across the 6Â months of the study were not associated with stable levels of COVID-19 stressors (representing sources of resilience that promoted well-being) and stable levels of stress from social isolation predicted stably higher amounts of communicating affection to one's loved ones (suggesting a need for affiliation in the face of chronic stress) whereas stable difficulties with orgasms were linked to stable irritability toward partners and depressive symptoms. Multigroup analyses suggested that the findings generalized across gender, age, race/ethnicity, sexual orientation, relationship stage, and cohabitation groups. Spillover effects within a Family Systems Theory framework clarify how upheaval of the COVID-19 pandemic could have impacted sexual, romantic, and individual functioning in a process-oriented framework, highlighting sources of resilience (sexual satisfaction, communicating affection) and risk (orgasm difficulties).","Pollard, Rogge","https://doi.org/10.1007/s10508-021-02208-0","20220127","COVID-19; Orgasm; Romantic relationship; SARS-CoV-2 virus; Sexual functioning","PubMed","Undecided","","","","","","","","","","","","","False","False","","","","","False","False","False","","False","False","False","False","False","False","False","False","False","","","","","","","","","","","","","","","","","","","","","","","","","","","","","","","","","","","","","","","","","","","","","","","","","","","","2022-01-28","",26114,""
"COVID-19 Changed Prevalence, Disease Spectrum and Management Strategies of Ocular Trauma","The coronavirus disease 2019 (COVID-19) pandemic has significantly impacted the health of people around the world and has reshaped social behaviors and clinical practice. The purpose of this perspective is to provide epidemiologists and clinicians with information about how the spectrum of ocular trauma diseases changed, as well as to optimize management for improving patient prognosis during this crisis. Analysis of current studies revealed that the prevalence of eye trauma decreased overall, with a trend of delayed medical treatment during the COVID-19 era. Irregular epidemic prevention and control measures, unprotected home activities, and unusual mental states are the main causes of ocular trauma. Strategies for reducing morbidity are also discussed, including popularizing the use norms of prevention and control supplies, taking heed to the safety of family activities, highlighting the special status of child protection, and paying attention to previous case data to implement region-specific precautions. The procedure of ophthalmological emergency and outpatient management should also be optimized, and mental health should be emphasized during this pandemic.","Yu, Xu, Zhao, Li, Wu, Feng","https://doi.org/10.3389/fmed.2021.774493","20220127","COVID-19; disinfectants; management; ocular trauma; prevalence","PubMed","Undecided","","","","","","","","","","","","","False","False","","","","","False","False","False","","False","False","False","False","False","False","False","False","False","","","","","","","","","","","","","","","","","","","","","","","","","","","","","","","","","","","","","","","","","","","","","","","","","","","","2022-01-28","",26115,""
"Substantial Impact of COVID-19 on Self-Reported Mental Health of Healthcare Professionals in the Netherlands","Initially, the COVID-19 pandemic caused a continued pressure on professionals working in hospitals due to the increase of affected patients. At the moment, the pandemic continues but thanks to all kinds of measures (e.g., social distancing) workload seems to decrease at the hospitals. On the contrary, patients with long-lasting symptoms due to COVID-19 infection or the pandemic begin to merge at the mental healthcare institutions in the Netherlands but this also holds true for other countries. Furthermore, healthcare professionals are affected by safety measures such as working from home, which led to an increased feeling of stress and may have led to a misbalance in work and private life. As a result, the question whether healthcare employees in mental healthcare experience impaired mental health remains unclear and chances are fair that mental health problems such as exhaustion and burnout may be prevalent. This study describes an online survey in which mental health amongst mental healthcare professionals is investigated. About 1,300 professionals from a large number of mental healthcare institutions replied the survey. Around 50% of the respondents experienced increased levels of stress. Feelings of anxiety, anger, and sadness were also increasingly experienced due to the COVID-19 pandemic. Furthermore, 4.2% replied that they were considering resigning their jobs which is alarming considering the shortage of healthcare professionals in mental healthcare institutions. The results support the importance of treatment or support of professionals in mental healthcare that experience psychological ailments.","de Vroege, van den Broek","https://doi.org/10.3389/fpubh.2021.796591","20220127","COVID-19; SARS-Cov-2; healthcare professionals; mental health; pandemic; the Netherlands","PubMed","Undecided","","","","","","","","","","","","","False","False","","","","","False","False","False","","False","False","False","False","False","False","False","False","False","","","","","","","","","","","","","","","","","","","","","","","","","","","","","","","","","","","","","","","","","","","","","","","","","","","","2022-01-28","",26116,""
"Facilitators and barriers to using telepresence robots in aged care settings: A scoping review","Social isolation has been a significant issue in aged care settings, particularly during the COVID-19 pandemic, and is associated with adverse outcomes, including loneliness, depression, and cognitive decline. While robotic assistance may help mitigate social isolation, it would be helpful to know how to adopt technology in aged care. This scoping review aims to explore facilitators and barriers to the implementation of telepresence robots in aged care settings. Following the Joanna Briggs Institute scoping review methodology and the PRISMA extension for scoping reviews reporting guidelines, we searched relevant peer-reviewed studies through eight databases: CINAHL, MEDLINE, Cochrane, PsychINFO (EBSCO), Web of Science, ProQuest Dissertations and Theses Global, IEEE Xplore, and ACM Digital Library. Google was used to search gray literature, including descriptive, evaluative, quantitative, and qualitative designs. Eligibility includes: studies with people aged 65Â years and older who interacted with a telepresence robot in a care setting, and articles written in English. We conducted a thematic analysis to summarize the evidence based on the constructs in the Consolidated Framework of Implementation Research. Of 1183 articles retrieved, 13 were included in the final review. The analysis yielded three themes: relative advantages, perceived risks and problems, and contextual considerations. The key facilitators to telepresence robot adoption are as follows: a feeling of physical presence, ease of use, mobility, and training. The barriers to implementation are as follows: cost, privacy issues, internet connectivity, and workflow. Future research should investigate the role of leadership support in implementation and practical strategies to overcome barriers to technology adoption in aged care settings.","Hung, Wong, Smith, Berndt, Gregorio, Horne, Jackson, Mann, Wada, Young","https://doi.org/10.1177/20556683211072385","20220127","Dementia; implementation; robots; technology; telepresence","PubMed","Undecided","","","","","","","","","","","","","False","False","","","","","False","False","False","","False","False","False","False","False","False","False","False","False","","","","","","","","","","","","","","","","","","","","","","","","","","","","","","","","","","","","","","","","","","","","","","","","","","","","2022-01-28","",26117,""
"Developmental Trend of Subjective Well-Being of Weibo Users During COVID-19: Online Text Analysis Based on Machine Learning Method","Currently, the coronavirus disease 2019 (COVID-19) pandemic experienced by the international community has increased the usage frequency of borderless, highly personalized social media platforms of all age groups. Analyzing and modeling texts sent through social media online can reveal the characteristics of the psychological dynamic state and living conditions of social media users during the pandemic more extensively and comprehensively. This study selects the Sina Weibo platform, which is highly popular in China and analyzes the subjective well-being (SWB) of Weibo users during the COVID-19 pandemic in combination with the machine learning classification algorithm. The study first invokes the SWB classification model to classify the SWB level of original texts released by 1,322 Weibo active users during the COVID-19 pandemic and then combines the latent growth curve model (LGCM) and the latent growth mixture model (LGMM) to investigate the developmental trend and heterogeneity characteristics of the SWB of Weibo users after the COVID-19 outbreak. The results present a downward trend and then an upward trend of the SWB of Weibo users during the pandemic as a whole. There was a significant correlation between the initial state and the development rate of the SWB after the COVID-19 outbreak (<i>r</i> = 0.36, <i>p</i> &lt; 0.001). LGMM results show that there were two heterogeneous classes of the SWB after the COVID-19 outbreak, and the development rate of the SWB of the two classes was significantly different. The larger class (normal growth group; <i>n</i> = 1,229, 93.7%) showed a slow growth, while the smaller class (high growth group; <i>n</i> = 93, 6.3%) showed a rapid growth. Furthermore, the slope means across the two classes were significantly different (<i>p</i> &lt; 0.001). Therefore, the individuals with a higher growth rate of SWB exhibited stronger adaptability to the changes in their living environments. These results could help to formulate effective interventions on the mental health level of the public after the public health emergency outbreak.","Han, Pan, Li, Zhang, Zhang, Zhang","https://doi.org/10.3389/fpsyg.2021.779594","20220127","coronavirus disease 2019 (COVID-19); latent growth curve model (LGCM); latent growth mixture model (LGMM); online text analysis; subjective well-being","PubMed","Undecided","","","","","","","","","","","","","False","False","","","","","False","False","False","","False","False","False","False","False","False","False","False","False","","","","","","","","","","","","","","","","","","","","","","","","","","","","","","","","","","","","","","","","","","","","","","","","","","","","2022-01-28","",26118,""
