"title","abstract","authors","link","date","subject","source","initial_decision","q0","q1","q2","q3","q4","q5","q6","q7","q8","q9","q10","q11","q12","q13","q14","q15","q16","q17","q18","q19","q20","q21","q22","q23","q24","q25","q26","q27","q28","q29","q30","q31","q32","q33","q34","q35","q36","q37","q38","q39","q40","q41","q42","q43","q44","q45","q46","q47","q48","q49","q50","q51","q52","q53","q54","q55","q56","q57","q58","q59","q60","q61","q62","q63","q64","q65","q66","q67","q68","q69","q70","q71","q72","q73","q74","q75","q76","q77","q78","q79","q80","exclusion_reason","extraction_date","expert_decision","ID","o1"
"Prevalence and clinical characteristics of COVID-19 in inpatients with schizophrenia in Wuhan, China","In contrast to many Western countries, China has maintained its large psychiatric hospitals. The prevalence and clinical characteristics of coronavirus disease 2019 (COVID-19) in inpatients with schizophrenia (SCZ) are unclear. To assess the prevalence of COVID-19 among inpatients with SCZ and compare the infected to uninfected SCZ patients in a Wuhan psychiatric hospital. We retrospectively collected demographic characteristics and clinical profiles of all SCZ patients with COVID-19 at Wuhan's Youfu Hospital. Among the 504 SCZ patients, 84 had COVID-19, and we randomly sampled 174 who were uninfected as a comparison group. The overall prevalence of COVID-19 in SCZ patients was 16.7%. Among the 84 SCZ patients with confirmed COVID-19, the median age was 54 years and 76.2% were male. The most common symptom was fever (82%), and less common symptoms were cough (31%), poor appetite (20%), and fatigue (16%). Compared with SCZ patients without COVID-19, those with COVID-19 were older (<i>P</i> = 0.006) and significantly lighter (<i>P</i> = 0.002), and had more comorbid physical diseases (<i>P</i> = 0.001). Surprisingly, those infected were less likely to be smokers (&lt; 0.001) or to be treated with clozapine (<i>P</i> = 0.03). Further logistic regression showed that smoking [odds ratio (OR) = 5.61], clozapine treated (OR = 2.95), and male (OR = 3.48) patients with relatively fewer comorbid physical diseases (OR = 0.098) were at a lower risk for COVID-19. SCZ patients with COVID-19 presented primarily with fever, but only one-third had a cough, which might otherwise be the most common mode of transmission between individuals. Two unexpected protective factors for COVID-19 among SCZ inpatients are smoking and clozapine treatment.","Sheng, Wang, Wang, Wu, Huo, Wang, Zhou, Zhang","https://doi.org/10.5498/wjp.v12.i1.140","20220203","Epidemiology; Inpatient; Mental health; Schizophrenia","PubMed","Undecided","","","","","","","","","","","","","False","False","","","","","False","False","False","","False","False","False","False","False","False","False","False","False","","","","","","","","","","","","","","","","","","","","","","","","","","","","","","","","","","","","","","","","","","","","","","","","","","","","2022-02-04","",26463,""
"Impact of COVID-19 on deaths from respiratory diseases: Panel data evidence from Chile","The COVID-19 pandemic has relegated pathologies that were previously commonplace to a secondary context. Therefore, it is necessary to study the evolution of these diseases in the presence or absence of COVID-19. The present study had the following objectives: 1. to evaluate the relationship between the COVID-19 epidemic and the possible decrease in death from respiratory disease (DRd) in Chile; and 2. to study the relationships between meteorological variables and severity of COVID-19 with respect to DRd from January 2018 to February 2021. The variable number of DRds in Chile was analyzed considering the monthly records of meteorological variables (temperature, precipitation and humidity) in each region of Chile and the severity of COVID-19 to evaluate the mortality trend before and after the pandemic. For this, different nonobservable heterogeneity models for panel data were used. The variables that affect DRd include the number of deaths from COVID-19, which led to a decrease in DRd (negative effect) when increased, the number of patients with COVID-19 in the intensive care unit (ICU), which led to an increase in DRd (positive effect) when increased, and the minimum temperature, which had a negative effect on DRd. These results are supported by the application of panel regression with one-way random-effects models. This study revealed a reduction in the number of DRds other than COVID-19 during the pandemic in Chile. This could be explained by the sanitary measures applied by the Ministry of Health of Chile in relation to mobility restrictions and social distancing, among others. Therefore, DRd decreased in accordance with the appearance of the COVID-19 pandemic.","BarrÃƒÂ­a-Sandoval, Ferreira, MÃƒÂ©ndez, Toffoletto","https://doi.org/10.1080/20008686.2021.2023939","20220203","Respiratory diseases; SARS-CoV-2; panel data regression analysis","PubMed","Undecided","","","","","","","","","","","","","False","False","","","","","False","False","False","","False","False","False","False","False","False","False","False","False","","","","","","","","","","","","","","","","","","","","","","","","","","","","","","","","","","","","","","","","","","","","","","","","","","","","2022-02-04","",26464,""
"Hospitalization, interpersonal and personal factors of social anxiety among COVID-19 survivors at the six-month follow-up after hospital treatment: the minority stress model","As a highly infectious disease with human-to-human transmission characteristics, COVID-19Ã‚Â has caused panic in the general public. Those who have recovered from COVID-19 may experience discrimination and internalized stigma. They may be more likely to worry about social interaction and develop social anxiety. This study investigated the associations among hospitalization factors, social/interpersonal factors, personal factors, and social anxiety to reveal the mechanism of social anxiety in COVID-19 survivors. A cross-sectional, multicenter telephone survey was conducted from July to September 2020 in five Chinese cities (i.e. Wuhan, Nanning, Shenzhen, Zhuhai, and Dongguan); adult COVID-19 survivors were recruited 6 months after they were discharged from the hospital. Linear regressions and path analysis based on the minority stress model were conducted to test the relationships among hospitalization, social/interpersonal factors, personal factors, and social anxiety. The response rate was 74.5% (<i>N</i> =Ã‚Â 199, 55.3% females). Linear regression analyses showed that various hospitalization, social/interpersonal, and personal factors were statistically significantly associated with social anxiety. Path analysis showed that the proposed model fit the data well (Ãâ€¡<sup>2</sup>(df)Ã‚Â =Ã‚Â 3.196(3), <i>p</i> =Ã‚Â .362, CFIÃ‚Â =Ã‚Â .999, NNFIÃ‚Â =Ã‚Â .996, RMSEAÃ‚Â =Ã‚Â .018). Internalized stigma fully mediated the association between perceived discrimination/social support and social anxiety, while it partially mediated the association between perceived affiliate stigma and social anxiety. The results suggest that social/interpersonal and personal factors have a stronger association with social anxiety than hospitalization factors and highlight the importance of internalized stigma in understanding the mechanisms of these relationships. Clinical psychologists can refer to these modifiable psychosocial factors to develop efficient interventions for mental health promotion. <b>Antecedentes:</b> Como una enfermedad altamente infecciosa con caracterÃƒÂ­sticas de transmisiÃƒÂ³n de persona a persona, el COVID-19 ha causado pÃƒÂ¡nico en el pÃƒÂºblico en general. Aquellos que se han recuperado del COVID-19 pueden experimentar discriminaciÃƒÂ³n y estigma internalizado. Es mÃƒÂ¡s probable que se preocupen por la interacciÃƒÂ³n social y desarrollen ansiedad social.<b>Objetivos:</b> Este estudio investigÃƒÂ³ las asociaciones entre factores de hospitalizaciÃƒÂ³n, factores sociales /interpersonales, factores personales y ansiedad social para revelar el mecanismo de ansiedad social en sobrevivientes de COVID-19.<b>MÃƒÂ©todos:</b> Se realizÃƒÂ³ una encuesta telefÃƒÂ³nica transversal multicentro de julio a septiembre de 2020 en cinco ciudades chinas (es decir, Wuhan, Nanning, Shenzhen, Zhuhai y Dongguan). Se reclutaron sobrevivientes adultos de COVID-19 seis meses despuÃƒÂ©s de ser dados de alta del hospital. Se realizaron regresiones lineales y anÃƒÂ¡lisis de ruta basados en el modelo de estrÃƒÂ©s de minorÃƒÂ­a para probar las relaciones entre la hospitalizaciÃƒÂ³n, los factores sociales/interpersonales, los factores personales y la ansiedad social.<b>Resultados:</b> La tasa de respuesta fue del 74,5% (<i>N</i> =Ã‚Â 199, 55,3% mujeres). Los anÃƒÂ¡lisis de regresiÃƒÂ³n lineal mostraron que varios factores de hospitalizaciÃƒÂ³n, sociales/interpersonales y personales se asociaron de manera estadÃƒÂ­sticamente significativa con la ansiedad social. El anÃƒÂ¡lisis de ruta mostrÃƒÂ³ que el modelo propuesto se ajustaba bien a los datos (<i>Ãâ€¡</i> <sup>2</sup> (<sub>df</sub>)Ã‚Â =Ã‚Â 3.196 (3), <i>p</i> =Ã‚Â .362, CFIÃ‚Â =Ã‚Â .999, NNFIÃ‚Â =Ã‚Â .996, RMSEAÃ‚Â =Ã‚Â .018). El estigma internalizado mediÃƒÂ³ completamente la asociaciÃƒÂ³n entre discriminaciÃƒÂ³n/apoyo social percibido y ansiedad social, mientras que mediÃƒÂ³ parcialmente la asociaciÃƒÂ³n entre el estigma percibido de afiliados y ansiedad social.<b>Conclusiones:</b> Los resultados sugieren que los factores sociales/interpersonales y personales tienen una asociaciÃƒÂ³n mÃƒÂ¡s fuerte con la ansiedad social que los factores de hospitalizaciÃƒÂ³n y resaltan la importancia del estigma internalizado en la comprensiÃƒÂ³n de los mecanismos de estas relaciones. Los psicÃƒÂ³logos clÃƒÂ­nicos pueden referirse a estos factores psicosociales modificables para desarrollar intervenciones eficientes para la promociÃƒÂ³n de la salud mental. <b>Ã§Â â€Ã§Â©Â¶Ã¨Æ’Å’Ã¦â„¢Â¯</b>: Ã¦â€“Â°Ã¥Å¾â€¹Ã¥â€ Â Ã§Å Â¶Ã§â€”â€¦Ã¦Â¯â€™Ã¨â€šÂºÃ§â€šÅ½Ã¤Â½Å“Ã¤Â¸ÂºÃ¤Â¸â‚¬Ã§Â§ÂÃ¥â€¦Â·Ã¦Å“â€°Ã¤ÂºÂºÃ¤Â¼Â Ã¤ÂºÂºÃ§â€°Â¹Ã¥Â¾ÂÃ§Å¡â€žÃ©Â«ËœÃ¤Â¼Â Ã¦Å¸â€œÃ¦â‚¬Â§Ã§â€“Â¾Ã§â€”â€¦, Ã¥Å“Â¨Ã¥â€¦Â¬Ã¤Â¼â€”Ã¤Â¸Â­Ã¤Â¸â‚¬Ã¥ÂºÂ¦Ã¥Â¼â€¢Ã¨ÂµÂ·Ã¤Âºâ€ Ã¨Â¾Æ’Ã¥Â¤Â§Ã¦ÂÂÃ¦â€¦Å’Ã£â‚¬â€šÃ¦â€žÅ¸Ã¦Å¸â€œÃ¨Â¿â€¡Ã¨Â¯Â¥Ã§â€“Â¾Ã§â€”â€¦Ã§Å¡â€žÃ¥ÂºÂ·Ã¥Â¤ÂÃ¨â‚¬â€¦Ã¥Â¾â‚¬Ã¥Â¾â‚¬Ã¤Â¼Å¡Ã¨Â¢Â«Ã¥â€ â€¦Ã¥Å“Â¨Ã¦Â±Â¡Ã¥ÂÂÃ¥Å’â€“, Ã§â€Å¡Ã¨â€¡Â³Ã¥ÂÂ¯Ã¨Æ’Â½Ã©ÂÂ­Ã¥Ââ€”Ã¦Â­Â§Ã¨Â§â€ , Ã¥â€ºÂ Ã¨â‚¬Å’Ã¥Â¾Ë†Ã¥ÂÂ¯Ã¨Æ’Â½Ã¤Â¼Å¡Ã©Â¡Â¾Ã¨â„¢â€˜Ã¤ÂºÂºÃ©â„¢â€¦Ã¤ÂºÂ¤Ã¥Â¾â‚¬, Ã¨Â¿â€ºÃ¨â‚¬Å’Ã¤ÂºÂ§Ã§â€Å¸Ã§Â¤Â¾Ã¤ÂºÂ¤Ã§â€žÂ¦Ã¨â„¢â€˜Ã£â‚¬â€š<b>Ã§Â â€Ã§Â©Â¶Ã§â€ºÂ®Ã§Å¡â€ž:</b> Ã¦Å“Â¬Ã§Â â€Ã§Â©Â¶Ã©â‚¬Å¡Ã¨Â¿â€¡Ã¨Â°Æ’Ã¦Å¸Â¥Ã¤Â½ÂÃ©â„¢Â¢Ã¦Â²Â»Ã§â€“â€”Ã§Â»ÂÃ¥Å½â€ , Ã¤ÂºÂºÃ©â„¢â€¦Ã§Â¤Â¾Ã¤ÂºÂ¤Ã¥â€ºÂ Ã§Â´Â , Ã¤Â¸ÂªÃ¤ÂºÂºÃ¥â€ºÂ Ã§Â´Â Ã¤Â¸Å½Ã§Â¤Â¾Ã¤ÂºÂ¤Ã§â€žÂ¦Ã¨â„¢â€˜Ã¤Â¹â€¹Ã©â€”Â´Ã§Å¡â€žÃ¥â€¦Â³Ã§Â³Â», Ã¦ÂÂ­Ã§Â¤ÂºÃ¥â€¡ÂºÃ¦â€“Â°Ã¥Å¾â€¹Ã¥â€ Â Ã§Å Â¶Ã§â€”â€¦Ã¦Â¯â€™Ã¨â€šÂºÃ§â€šÅ½Ã¥Â¹Â¸Ã¥Â­ËœÃ¨â‚¬â€¦Ã¥Å“Â¨Ã¥ÂºÂ·Ã¥Â¤ÂÃ¥ÂÅ½Ã§Å¡â€žÃ§Â¤Â¾Ã¤ÂºÂ¤Ã§â€žÂ¦Ã¨â„¢â€˜Ã¥Â½Â¢Ã¦Ë†ÂÃ¦Å“ÂºÃ¥Ë†Â¶Ã£â‚¬â€š<b>Ã§Â â€Ã§Â©Â¶Ã¦â€“Â¹Ã¦Â³â€¢:</b> Ã¦Å“Â¬Ã§Â â€Ã§Â©Â¶Ã¥Å¸ÂºÃ¤ÂºÅ½Ã¤Â¸â‚¬Ã©Â¡Â¹Ã¦Â¨ÂªÃ¦â€“Â­Ã©ÂÂ¢Ã¨Â°Æ’Ã¦Å¸Â¥, Ã¤Â»Â¥Ã§â€ÂµÃ¨Â¯ÂÃ¨Â®Â¿Ã¨Â°Ë†Ã§Å¡â€žÃ¥Â½Â¢Ã¥Â¼ÂÃ¤ÂºÅ½2020Ã¥Â¹Â´7Ã¦Å“Ë†Ã¨â€¡Â³9Ã¦Å“Ë†Ã¨Â¿â€ºÃ¨Â¡Å’, Ã¥Å“Â¨Ã¤Â¸Â­Ã¥â€ºÂ½Ã¤Âºâ€Ã¤Â¸ÂªÃ¥Å¸Å½Ã¥Â¸â€š (Ã¦Â­Â¦Ã¦Â±â€°, Ã¥Ââ€”Ã¥Â®Â, Ã¦Â·Â±Ã¥Å“Â³, Ã§ÂÂ Ã¦ÂµÂ·Ã¥â€™Å’Ã¤Â¸Å“Ã¨Å½Å¾) Ã¥Â¯Â¹Ã¦â€“Â°Ã¥â€ Â Ã§â€”â€¦Ã¦Â¯â€™Ã¨â€šÂºÃ§â€šÅ½Ã¥Â¹Â¸Ã¥Â­ËœÃ¨â‚¬â€¦Ã¨Â¿â€ºÃ¨Â¡Å’Ã¥â€¡ÂºÃ©â„¢Â¢Ã¥ÂÅ Ã¥Â¹Â´Ã§Å¡â€žÃ©Å¡ÂÃ¨Â®Â¿Ã¨Â°Æ’Ã¦Å¸Â¥, Ã¥Â½Â¢Ã¦Ë†ÂÃ¤Âºâ€ Ã¤Â¸â‚¬Ã¤Â¸ÂªÃ¥Â¤Å¡Ã¤Â¸Â­Ã¥Â¿Æ’Ã§Â â€Ã§Â©Â¶Ã£â‚¬â€šÃ¦â€¹â€ºÃ¥â€¹Å¸Ã¥Â¯Â¹Ã¨Â±Â¡Ã¤Â¸ÂºÃ¦Ë†ÂÃ¥Â¹Â´Ã§Å¡â€žÃ¦â€“Â°Ã¥â€ Â Ã§â€”â€¦Ã¦Â¯â€™Ã¨â€šÂºÃ§â€šÅ½Ã¥Â¹Â¸Ã¥Â­ËœÃ¨â‚¬â€¦Ã£â‚¬â€šÃ¥Ë†â€ Ã¦Å¾ÂÃ¦â€“Â¹Ã¦Â³â€¢Ã©â€¡â€¡Ã§â€Â¨Ã§ÂºÂ¿Ã¦â‚¬Â§Ã¥â€ºÅ¾Ã¥Â½â€™Ã¦Â¨Â¡Ã¥Å¾â€¹Ã¤Â»Â¥Ã¥ÂÅ Ã¥Å¸ÂºÃ¤ÂºÅ½Ã¥Â°â€˜Ã¦â€¢Â°Ã§Â¾Â¤Ã¤Â½â€œÃ¥Å½â€¹Ã¥Å â€ºÃ¦Â¨Â¡Ã¥Å¾â€¹Ã§Å¡â€žÃ¨Â·Â¯Ã¥Â¾â€žÃ¥Ë†â€ Ã¦Å¾Â, Ã¦Å½Â¢Ã¨Â®Â¨Ã¤Â½ÂÃ©â„¢Â¢, Ã¤ÂºÂºÃ©â„¢â€¦Ã§Â¤Â¾Ã¤ÂºÂ¤Ã¥â€ºÂ Ã§Â´Â , Ã¤Â¸ÂªÃ¤ÂºÂºÃ¥â€ºÂ Ã§Â´Â Ã¤Â¸Å½Ã§Â¤Â¾Ã¤ÂºÂ¤Ã§â€žÂ¦Ã¨â„¢â€˜Ã¤Â¹â€¹Ã©â€”Â´Ã§Å¡â€žÃ¥â€¦Â³Ã¨Ââ€Ã¦Å“ÂºÃ¥Ë†Â¶Ã£â‚¬â€š<b>Ã¥Ë†â€ Ã¦Å¾ÂÃ§Â»â€œÃ¦Å¾Å“:</b> Ã¥Ââ€”Ã¨Â®Â¿Ã¨â‚¬â€¦Ã§Å¡â€žÃ¥Âºâ€Ã§Â­â€Ã§Å½â€¡Ã¤Â¸Âº 74.5% (Ã¨Å½Â·Ã¥Â¾â€”Ã§Å¡â€žÃ¦Â Â·Ã¦Å“Â¬Ã©â€¡ÂÃ¤Â¸Âº 199,Ã¥â€¦Â¶Ã¤Â¸Â­Ã¥Â¥Â³Ã¦â‚¬Â§Ã¥Â 55.3%) Ã£â‚¬â€šÃ§ÂºÂ¿Ã¦â‚¬Â§Ã¥â€ºÅ¾Ã¥Â½â€™Ã¥Ë†â€ Ã¦Å¾ÂÃ¨Â¡Â¨Ã¦ËœÅ½, Ã¥Ââ€žÃ§Â§ÂÃ¤Â½ÂÃ©â„¢Â¢Ã§â€ºÂ¸Ã¥â€¦Â³Ã¥â€ºÂ Ã§Â´Â , Ã¤ÂºÂºÃ©â„¢â€¦Ã§Â¤Â¾Ã¤ÂºÂ¤Ã¥â€ºÂ Ã§Â´Â Ã¥ÂÅ Ã¤Â¸ÂªÃ¤ÂºÂºÃ¥â€ºÂ Ã§Â´Â Ã¥Ââ€¡Ã¤Â¸Å½Ã§Â¤Â¾Ã¤ÂºÂ¤Ã§â€žÂ¦Ã¨â„¢â€˜Ã¦ËœÂ¾Ã¨â€˜â€”Ã§â€ºÂ¸Ã¥â€¦Â³Ã£â‚¬â€šÃ¨Â·Â¯Ã¥Â¾â€žÃ¥Ë†â€ Ã¦Å¾ÂÃ¦Â¨Â¡Ã¥Å¾â€¹Ã§Å¡â€žÃ¦â€¢Â°Ã¦ÂÂ®Ã¦â€¹Å¸Ã¥ÂË†Ã¨Â¾Æ’Ã¥Â¥Â½ (Ãâ€¡<sup>2</sup>(df)Ã‚Â =Ã‚Â 3.196(3), <i>p</i>=Ã‚Â .362, CFIÃ‚Â =Ã‚Â .999, NNFIÃ‚Â =Ã‚Â .996, RMSEAÃ‚Â =Ã‚Â .018) Ã£â‚¬â€šÃ¥â€ â€¦Ã¥Å“Â¨Ã¥Å’â€“Ã§Å¡â€žÃ¦Â±Â¡Ã¥ÂÂÃ¥Å“Â¨Ã¦Â­Â§Ã¨Â§â€ Ã¦â€žÅ¸Ã§Å¸Â¥Ã¤Â¸Å½Ã§Â¤Â¾Ã¤ÂºÂ¤Ã§â€žÂ¦Ã¨â„¢â€˜, Ã¤Â»Â¥Ã¥ÂÅ Ã§Â¤Â¾Ã¤Â¼Å¡Ã¦â€Â¯Ã¦Å’ÂÃ¤Â¸Å½Ã§Â¤Â¾Ã¤ÂºÂ¤Ã§â€žÂ¦Ã¨â„¢â€˜Ã§Å¡â€žÃ¥â€¦Â³Ã§Â³Â»Ã¤Â¸Â­Ã¦â€°Â¿Ã¦â€¹â€¦Ã¥Â®Å’Ã¥â€¦Â¨Ã¤Â¸Â­Ã¤Â»â€¹Ã¦â€¢Ë†Ã¥Âºâ€, Ã¥Å“Â¨Ã¨Â¿Å¾Ã¥Â¸Â¦Ã¦Â±Â¡Ã¥ÂÂÃ¤Â¸Å½Ã§Â¤Â¾Ã¤ÂºÂ¤Ã§â€žÂ¦Ã¨â„¢â€˜Ã¤Â¹â€¹Ã©â€”Â´Ã¦â€°Â¿Ã¦â€¹â€¦Ã¥Â±â‚¬Ã©Æ’Â¨Ã¤Â¸Â­Ã¤Â»â€¹Ã¦â€¢Ë†Ã¥Âºâ€Ã£â‚¬â€š<b>Ã§Â»â€œÃ¨Â®Âº:</b> Ã§Â â€Ã§Â©Â¶Ã§Â»â€œÃ¦Å¾Å“Ã¨Â¡Â¨Ã¦ËœÅ½, Ã¤ÂºÂºÃ©â„¢â€¦Ã§Â¤Â¾Ã¤ÂºÂ¤Ã¥â€™Å’Ã¤Â¸ÂªÃ¤ÂºÂºÃ¥â€ºÂ Ã§Â´Â Ã¤Â¸Å½Ã§Â¤Â¾Ã¤ÂºÂ¤Ã§â€žÂ¦Ã¨â„¢â€˜Ã¥Â­ËœÃ¥Å“Â¨Ã§â€ºÂ¸Ã¥â€¦Â³Ã¦â‚¬Â§, Ã§â€ºÂ¸Ã¥Â¯Â¹Ã¨â‚¬Å’Ã¨Â¨â‚¬Ã¦Â¯â€Ã¤Â½ÂÃ©â„¢Â¢Ã¥â€ºÂ Ã§Â´Â Ã¤Â¸Å½Ã§Â¤Â¾Ã¤ÂºÂ¤Ã§â€žÂ¦Ã¨â„¢â€˜Ã§Å¡â€žÃ§â€ºÂ¸Ã¥â€¦Â³Ã¦â‚¬Â§Ã¦â€ºÂ´Ã¥Â¼Âº, Ã¨Â¿â„¢Ã¥Â¼ÂºÃ¨Â°Æ’Ã¤Âºâ€ Ã¥â€ â€¦Ã¥Å“Â¨Ã¥Å’â€“Ã§Å¡â€žÃ¦Â±Â¡Ã¥ÂÂÃ¥Â¯Â¹Ã§Ââ€ Ã¨Â§Â£Ã¨Â¿â„¢Ã¤Âºâ€ºÃ¥â€¦Â³Ã§Â³Â»Ã§Å¡â€žÃ¦Â½Å“Ã¥Å“Â¨Ã¥Â½Â¢Ã¦Ë†ÂÃ¦Å“ÂºÃ¥Ë†Â¶Ã§Å¡â€žÃ©â€¡ÂÃ¨Â¦ÂÃ¦â‚¬Â§Ã£â‚¬â€šÃ¤Â¸Â´Ã¥ÂºÅ Ã¥Â¿Æ’Ã§Ââ€ Ã¥Å’Â»Ã§â€Å¸Ã¥ÂÂ¯Ã¤Â»Â¥Ã¥Ë†Â©Ã§â€Â¨Ã¨Â¿â„¢Ã¤Âºâ€ºÃ¥ÂÂ¯Ã¦â€Â¹Ã¥ÂËœÃ§Å¡â€žÃ¥Â¿Æ’Ã§Ââ€ Ã§Â¤Â¾Ã¤Â¼Å¡Ã¥â€ºÂ Ã§Â´Â , Ã¥Ë†Â¶Ã¥Â®Å¡Ã¥â€¡ÂºÃ©Â«ËœÃ¦â€¢Ë†Ã§Å¡â€žÃ¥Â¹Â²Ã©Â¢â€žÃ¦Å½ÂªÃ¦â€“Â½Ã¦ÂÂ¥Ã¤Â¿Æ’Ã¨Â¿â€ºÃ¥Â¿Æ’Ã§Ââ€ Ã¥ÂÂ¥Ã¥ÂºÂ·Ã£â‚¬â€š.","Ju, Yang, Ma, Wang, Fu, Hu, Luo, Xiao, Zheng, Xu, Fang, Chan, Xu, Chen, He, Zhu, Tang, Huang, Hong, Xiao, Sun, Hao, Cai, Yang, Ye, Chen, Yuan, Wang, Zou","https://doi.org/10.1080/20008198.2021.2019980","20220203","COVID-19 survivor; China; hospitalization; minority stress; psychosocial factors; social anxiety","PubMed","Undecided","","","","","","","","","","","","","False","False","","","","","False","False","False","","False","False","False","False","False","False","False","False","False","","","","","","","","","","","","","","","","","","","","","","","","","","","","","","","","","","","","","","","","","","","","","","","","","","","","2022-02-04","",26465,""
"COVID-19 Pandemic and Overall Mental Health of Healthcare Professionals Globally: A Meta-Review of Systematic Reviews","This meta-review aimed to provide a comprehensive overview of overall mental health of healthcare professionals during the COVID-19 pandemic. We conducted a comprehensive literature search on Academic Search Premier, CINAHL, Cochrane Library, and MEDLINE. A predefined eligibility criterion was used to screen the articles. The methodology quality of eligible studies was assessed using Joanna Briggs Institute checklist for systematic reviews. The data were narratively synthesised in line with the meta-review aim. Forty systematic reviews (represented as <i>K</i> = 40), which reported data from 1,828 primary studies (<i>N</i>) and 3,245,768 participants, met the inclusion criteria. The findings from a pooled prevalence indicate that anxiety (16-41%, <i>K</i> = 30, <i>N</i> = 701), depression (14-37%, <i>K</i> = 28, <i>N</i> = 584), and stress/post-traumatic stress disorder (18.6-56.5%, <i>K</i> = 24, <i>N</i> = 327) were the most prevailing COVID-19 pandemic-related mental health conditions affecting healthcare workers. Other reported concerns included insomnia, burnout, fear, obsessive-compulsive disorder, somatization symptoms, phobia, substance abuse, and suicidal thoughts. Considering regions/countries, the highest anxiety was reported in the United-Kingdom [22.3, 95% Confidence Interval (CI):7-38, <i>N</i> = 4] compared to other countries, while the highest depression was in the Middle-East, (41, 95% CI:16-60, <i>N</i> = 5) and stress in the Eastern Mediterranean region (61.6, 95% CI:56.4-66.8, <i>N</i> = 2) compared to other regions. The most significant risk factors include female gender, younger age, being a nurse, and frontline professional. The most-reported coping strategies include individual/group psychological support, family/relative support, training/orientation, and the adequacy of personal protective equipment. It was concluded that healthcare professionals (nurses, doctors, allied health) have experienced various mental health issues during COVID-19 pandemic. The meta-review, therefore, recommends targeted interventions and health policies that address specific mental health issues to support health professionals worldwide during the duration of the COVID-19 pandemic and similar future health crises. https://www.crd.york.ac.uk/prospero/display_record.php?ID=CRD4202126200, identifier: CRD42021262001.","Chutiyami, Cheong, Salihu, Bello, Ndwiga, Maharaj, Naidoo, Kolo, Jacob, Chhina, Ku, Devar, Pratitha, Kannan","https://doi.org/10.3389/fpsyt.2021.804525","20220203","COVID-19; coping strategies; health professional; mental health; reviewÃ¢â‚¬â€œsystematic","PubMed","Undecided","","","","","","","","","","","","","False","False","","","","","False","False","False","","False","False","False","False","False","False","False","False","False","","","","","","","","","","","","","","","","","","","","","","","","","","","","","","","","","","","","","","","","","","","","","","","","","","","","2022-02-04","",26466,""
"The Impact of the COVID-19 Pandemic on Affect, Fear, and Personality of Primary School Children Measured During the Second Wave of Infections in 2020","In relation to the COVID-19 pandemic outbreak, a large body of research has identified a negative impact on individuals' affectivity, frequently documented by increased prevalence of anxiety and depression symptoms. For children, this research was less extensive, was mainly based on caregivers' reports and neglected personality assessment. In order to measure the impact of the pandemic, and the fears it caused, on primary school children's affect and personality, 323 (180 boys and 143 girls) Italian third, fourth and fifth graders were assessed between October and November 2020, namely during the second wave of COVID-19 infections in Italy, with validated self-reports of affect (Positive and Negative Affect Scale for Children, PANAS-C), fear of COVID-19 (Fear of COVID-19 Scale, FCV-19S) and personality (junior Temperament and Character Inventory, jTCI). In comparison with PANAS-C and jTCI normative scores collected prior to the pandemic, data obtained from children in 2020 showed unchanged affect scores in the overall sample, a decrease of Positive Affect in girls, and a decrease in the Harm Avoidance and an increase in the Self-Transcendence scales of personality. Fear of COVID-19 scores were positively correlated with Negative Affect scores and negatively predicted by children's personality profile of resilience (calculated using scores on the Harm Avoidance and the Self-Directedness scales of personality). These results suggested that Italian primary school children, especially boys, maintained their pre-pandemic levels of affect (or restored them after the first COVID-19 wave) and partially diverged from the typical development of personality in an apparently positive sense, namely toward more courageous/optimistic and spiritual profiles. This sort of children's post-traumatic growth might also be attributed to children's family and education systems, which should continue to be supported to promote and maintain community mental health.","Matiz, Fabbro, Paschetto, Urgesi, Ciucci, Baroncelli, Crescentini","https://doi.org/10.3389/fpsyt.2021.803270","20220203","COVID-19; affect; anxiety; children; depression; mental health; personality; spirituality","PubMed","Undecided","","","","","","","","","","","","","False","False","","","","","False","False","False","","False","False","False","False","False","False","False","False","False","","","","","","","","","","","","","","","","","","","","","","","","","","","","","","","","","","","","","","","","","","","","","","","","","","","","2022-02-04","",26467,""
