"title","abstract","authors","link","date","subject","source","initial_decision","q0","q1","q2","q3","q4","q5","q6","q7","q8","q9","q10","q11","q12","extraction_date","expert_decision","ID","o1"
"Response of Chinese Anesthesiologists to the COVID-19 Outbreak.","The coronavirus disease 2019, named COVID-19 officially by the World Health Organization (Geneva, Switzerland) on February 12, 2020, has spread at unprecedented speed. After the first outbreak in Wuhan, China, Chinese anesthesiologists encountered increasing numbers of infected patients since December 2019. Because the main route of transmission is via respiratory droplets and close contact, anesthesia providers are at a high risk when responding to the devastating mass emergency. So far, action","Zhang, Bo, Lin, Li, Sun, Lin, Xu, Bian, Yao, Chen, Meng, Deng","https://doi.org/10.1097/ALN.0000000000003300","20200401","","PubMed","Undecided","","","","","","","","","","","","","FALSE","2020-04-08","",270,""
"Iranian mental health during the COVID-19 epidemic.","","Zandifar, Badrfam","https://doi.org/10.1016/j.ajp.2020.101990","20200407","","PubMed","Undecided","","","","","","","","","","","","","FALSE","2020-04-08","",271,""
"Fear of COVID 2019: First suicidal case in India !","","Goyal, Chauhan, Chhikara, Gupta, Singh","https://doi.org/10.1016/j.ajp.2020.101989","20200403","","PubMed","Undecided","","","","","","","","","","","","","FALSE","2020-04-08","",272,""
"[Mental health survey of 230 medical staff in a tertiary infectious disease hospital for COVID-19].","Objective: To investigate the mental health of clinical first-line medical staff in COVID-19 epidemic and provide theoretical basis for psychological intervention. Method: The mental health status of the first-line medical staff was investigated by Self-rating Anxiety Acale (SAS) and Post-Traumatic Stress Disorder Self-rating Scale(PTSD-SS). From February 7 to 14, 2020, 246 medical staff were investigated who participated in the treatment of COVID-19 using cluster sampling , and received 230 res","Huang, Han, Luo, Ren, Zhou","https://doi.org/10.3760/cma.j.cn121094-20200219-00063","20200304","Anxiety; COVID-19; Medical staff; Stress disorder, post-traumatic","PubMed","Undecided","","","","","","","","","","","","","FALSE","2020-04-08","",273,""
"[Diagnostic and therapeutic strategies of lung cancer patients during the outbreak of 2019 novel coronavirus disease (COVID-19)].","With the increasing number of cases and widening geographical spread, the 2019 novel coronavirus disease (COVID-19) has been classified as one of the class B infectious diseases but prevented and controlled as class A infectious disease by the National Health Commission of China. The diagnosis and treatment of lung cancer patients have been challenged greatly because of extraordinary public health measures since the lung cancer patients are a high-risk population during the COVID-19 outbreak per","Yang, Xu, Wang","https://doi.org/10.3760/cma.j.cn112152-20200229-00152","20200302","COVID-19; Diagnostic and therapeutic strategy; Lung neoplasm","PubMed","Undecided","","","","","","","","","","","","","FALSE","2020-04-08","",274,""
"Mental Health Care Measures in Response to the 2019 Novel Coronavirus Outbreak in Korea.","","Park, Park","https://doi.org/10.30773/pi.2020.0058","20200308","","PubMed","Undecided","","","","","","","","","","","","","FALSE","2020-04-08","",275,""
"[Psychological intervention in oral patients in novel coronavirus pneumonia outbreak period].","Public health emergencies have an impact on the public mental health. The outbreak of the novel coronavirus has affected the normal diagnosis and treatment services in oral medical institutions across the country. Delay of non-emergency dental service will have a potential impact on the experience, cognition, treatment and rehabilitation of patients with oral diseases. Through literature review, this paper reviewed the oral psychosomatic diseases closely related to patients' psychological state,","Qu, Zhou","https://doi.org/10.3760/cma.j.cn112144-20200213-00053","20200222","Crisis intervention; Novel coronavirus pneumonia; Oral psychosomatic disorder; Stress, psychological","PubMed","Undecided","","","","","","","","","","","","","FALSE","2020-04-08","",276,""
"Mental health services for older adults in China during the COVID-19 outbreak.","","Yang, Li, Zhang, Zhang, Cheung, Xiang","https://doi.org/10.1016/S2215-0366(20)30079-1","20200325","Access to Information; Age Factors; Aged; China; Coronavirus Infections; Health Services Accessibility; Humans; Internet; Mental Health; Mental Health Services; Middle Aged; Pneumonia, Viral; Smartphone; Telemedicine; Vulnerable Populations","PubMed","Undecided","","","","","","","","","","","","","FALSE","2020-04-08","",277,""
"Online mental health services in China during the COVID-19 outbreak.","","Liu, Yang, Zhang, Xiang, Liu, Hu, Zhang","https://doi.org/10.1016/S2215-0366(20)30077-8","20200325","China; Coronavirus Infections; Counseling; Disease Outbreaks; Emergency Medical Services; Humans; Internet; Mental Health; Mental Health Services; Pneumonia, Viral; Practice Guidelines as Topic; Public Health; Telemedicine","PubMed","Undecided","","","","","","","","","","","","","FALSE","2020-04-08","",278,""
"Mental health care for medical staff in China during the COVID-19 outbreak.","","Chen, Liang, Li, Guo, Fei, Wang, He, Sheng, Cai, Li, Wang, Zhang","https://doi.org/10.1016/S2215-0366(20)30078-X","20200325","Adaptation, Psychological; Betacoronavirus; China; Coronavirus Infections; Disease Outbreaks; Family Health; Humans; Mental Health Services; Personal Protective Equipment; Personnel, Hospital; Pneumonia, Viral; Rest; Stress, Psychological; Treatment Refusal","PubMed","Undecided","","","","","","","","","","","","","FALSE","2020-04-08","",279,""
"[The network investigation on knowledge, attitude and practice about Novel coronavirus pneumonia of the residents in Anhui Province].","Objective: To analyze the current situation of the knowledge, attitudes and practice about Novelcoronavirus pneumonia (NCP) of the residents in Anhui Province. Methods: Anonymous network sampling survey was carried out with an electronic questionnaire that designed by the questionnaire star, and a total of 4016 subjects from Anhui province were investigated. The content of the survey includes that the basic information of subjects,the residents' knowledge, attitudes and practice about NCP, as we","Chen, Jin, Zhu, Fang, Wu, Du, Jiang, Wang, Yao","https://doi.org/10.3760/cma.j.issn.0253-9624.2020.0004","20200217","Novel coronavirus pneumonia; attitude; knowledge; practice","PubMed","Undecided","","","","","","","","","","","","","FALSE","2020-04-08","",280,""
"2019-nCoV epidemic: address mental health care to empower society.","","Bao, Sun, Meng, Shi, Lu","https://doi.org/10.1016/S0140-6736(20)30309-3","20200316","Betacoronavirus; China; Coronavirus Infections; Data Accuracy; Disease Outbreaks; Global Health; Humans; Stress, Psychological","PubMed","Undecided","","","","","","","","","","","","","FALSE","2020-04-08","",281,""
"The mental health of medical workers in Wuhan, China dealing with the 2019 novel coronavirus.","","Kang, Li, Hu, Chen, Yang, Yang, Wang, Hu, Lai, Ma, Chen, Guan, Wang, Ma, Liu","https://doi.org/10.1016/S2215-0366(20)30047-X","20200318","Betacoronavirus; China; Coronavirus; Disease Outbreaks; Global Health; Humans; Mental Health","PubMed","Undecided","","","","","","","","","","","","","FALSE","2020-04-08","",282,""
"Public responses to the novel 2019 coronavirus (2019-nCoV) in Japan: Mental health consequences and target populations.","","Shigemura, Ursano, Morganstein, Kurosawa, Benedek","https://doi.org/10.1111/pcn.12988","20200406","","PubMed","Undecided","","","","","","","","","","","","","FALSE","2020-04-08","",283,""
"Timely mental health care for the 2019 novel coronavirus outbreak is urgently needed.","","Xiang, Yang, Li, Zhang, Zhang, Cheung, Ng","https://doi.org/10.1016/S2215-0366(20)30046-8","20200323","China; Civil Defense; Communication; Coronavirus; Coronavirus Infections; Crisis Intervention; Disease Outbreaks; Health Personnel; Health Plan Implementation; Humans; Mental Health; Quarantine; Transportation","PubMed","Undecided","","","","","","","","","","","","","FALSE","2020-04-08","",284,""
"Mental Health of Nurses Working at a Government-designated Hospital During a MERS-CoV Outbreak: A Cross-sectional Study.","During an epidemic of a novel infectious disease, many healthcare workers suffer from mental health problems. The aims of this study were to test the following hypotheses: stigma and hardiness exert both direct effects on mental health and also indirect (mediated) effects on mental health through stress in nurses working at a government-designated hospital during a Middle East Respiratory Syndrome coronavirus (MERS-CoV) epidemic. A total of 187 participants were recruited using a convenience sam","Park, Lee, Park, Choi","https://doi.org/10.1016/j.apnu.2017.09.006","20180522","Hardiness; Mental health; Middle East Respiratory Syndrome coronavirus; Nurse; Stigma; Stress; Adult; Coronavirus Infections; Cross-Sectional Studies; Disease Outbreaks; Female; Hospitals, State; Humans; Mental Health; Middle East Respiratory Syndrome Coronavirus; Nurse's Role; Psychiatric Nursing; Republic of Korea; Stress, Psychological","PubMed","Undecided","","","","","","","","","","","","","FALSE","2020-04-08","",285,""
"Mental health status of people isolated due to Middle East Respiratory Syndrome.","Isolation due to the management of infectious diseases is thought to affect mental health, but the effects are still unknown. We examined the prevalence of anxiety symptoms and anger in persons isolated during the Middle East Respiratory Syndrome (MERS) epidemic both at isolation period and at four to six months after release from isolation. We also determined risk factors associated with these symptoms at four to six months. Of 14,992 individuals isolated for 2-week due to having contact with M","Jeong, Yim, Song, Ki, Min, Cho, Chae","https://doi.org/10.4178/epih.e2016048","20170216","Anger; Anxiety; Isolation; Korea; Middle East Respiratory Syndrome coronavirus; Adult; Anxiety; Coronavirus Infections; Disease Outbreaks; Female; Humans; Male; Middle Aged; Middle East Respiratory Syndrome Coronavirus; Patient Isolation; Republic of Korea; Retrospective Studies","PubMed","Undecided","","","","","","","","","","","","","FALSE","2020-04-08","",286,""
"Impact of severe acute respiratory syndrome care on the general health status of healthcare workers in taiwan.","The impact of the outbreak of severe acute respiratory syndrome (SARS) was enormous, but few studies have focused on the infectious and general health status of healthcare workers (HCWs) who treated patients with SARS. We prospectively evaluated the general health status of HCWs during the SARS epidemic. The Medical Outcome Study Short-Form 36 Survey was given to all HCWs immediately after caring for patients with SARS and 4 weeks after self-quarantine and off-duty shifts. Tests for detection of","Chen, Wang, Hsieh, Huang, Kao, Chen, Tsai","https://doi.org/10.1086/508824","20070315","Adult; Disease Outbreaks; Health Status; Health Surveys; Humans; Medical Staff, Hospital; Mental Health; Nursing Staff, Hospital; Psychology; Quarantine; Severe Acute Respiratory Syndrome; Taiwan","PubMed","Undecided","","","","","","","","","","","","","FALSE","2020-04-08","",287,""
"Mental health care for international Chinese students affected by the COVID-19 outbreak","","Zhai, Yusen; Du, Xue","https://www.doi.org/10.1016/s2215-0366(20)30089-4","20200430","","Elsevier","Undecided","","","","","","","","","","","","","FALSE","2020-04-08","",288,""
"Mitigate the effects of home confinement on children during the COVID-19 outbreak","In response to the coronavirus disease 2019 (COVID-19) outbreak, the Chinese Government has ordered a nationwide school closure as an emergency measure to prevent spreading of the infection. Public activities are discouraged. The Ministry of Education estimates that more than 220 million children and adolescents are confined to their homes; this includes 180 million primary and secondary students and 47 million preschool children).1 Thanks to the strong administrative system in China, the emergency home schooling plan has been rigorously implemented.2 Massive efforts are being made by schools and teachers at all levels to create online courses and deliver them through TV broadcasts and the internet in record time. The new virtual semester has just started in many parts of the country, and various courses are offered online in a well organised manner. These actions are helping to alleviate many parents' concerns about their children's educational attainment by ensuring that school learning is largely undisrupted. Although these measures and efforts are highly commendable and necessary, there are reasons to be concerned because prolonged school closure and home confinement during a disease outbreak might have negative effects on children's physical and mental health.3 , 4 Evidence suggests that when children are out of school (eg, weekends and summer holidays), they are physically less active, have much longer screen time, irregular sleep patterns, and less favourable diets, resulting in weight gain and a loss of cardiorespiratory fitness.3 , 5 Such negative effects on health are likely to be much worse when children are confined to their homes without outdoor activities and interaction with same aged friends during the outbreak.","Wang, Guanghai; Zhang, Yunting; Zhao, Jin; Zhang, Jun; Jiang, Fan","https://www.doi.org/10.1016/s0140-6736(20)30547-x","2020034","","Elsevier","Undecided","","","","","","","","","","","","","FALSE","2020-04-08","",289,""
"Coronavirus outbreak: the role of companies in preparedness and responses","As in previous health crises, the coronavirus disease 2019 (COVID-19) outbreak has raised questions about preparedness and emergency responses in many countries. In this crisis, what role can companies play? Public and private companies must continue to produce or provide their services, but with consideration of the health context. Many companies are involved with the COVID-19 outbreak because they are established in or work with China (client or supplier), and most have already activated their business continuity planning or equivalent. During an infectious disease outbreak like COVID-19, most large companies around the world have a major part to play, especially in terms of preparedness and emergency response. Indeed, companies should be integrated into the governmental health contingency plan developed in many countries, and by WHO and the International Labor Organization. Helped by their occupational practitioners, healthcare advisers, and safety professionals, companies that have a financial capacity and responsibilities (including governmental, federal, or state administrations) will thus have to prepare their business continuity planning for when cases of infected patients occur in the company. They also must be prepared for the potential psychosocial and psychological effects of outbreaks. All health professionals should be involved in the development and implementation of recommendations for companies and their environments","Fadel, Marc; Salomon, JÃƒÆ’Ã‚Â©rÃƒÆ’Ã‚Â´me; Descatha, Alexis","https://www.doi.org/10.1016/s2468-2667(20)30051-7","20200228","","CZI","Undecided","","","","","","","","","","","","","FALSE","2020-04-08","",290,""
"Mental health services for older adults in China during the COVID-19 outbreak","","Yang, Yuan; Li, Wen; Zhang, Qinge; Zhang, Ling; Cheung, Teris; Xiang, Yu-Tao","https://www.doi.org/10.1016/s2215-0366(20)30079-1","20200219","","Elsevier","Undecided","","","","","","","","","","","","","FALSE","2020-04-08","",291,""
"Patients with mental health disorders in the COVID-19 epidemic","","Yao, Hao; Chen, Jian-Hua; Xu, Yi-Feng","https://www.doi.org/10.1016/s2215-0366(20)30090-0","20200430","","Elsevier","Undecided","","","","","","","","","","","","","FALSE","2020-04-08","",292,""
"Mental health care for medical staff in China during the COVID-19 outbreak","","Chen, Qiongni; Liang, Mining; Li, Yamin; Guo, Jincai; Fei, Dongxue; Wang, Ling; He, Li; Sheng, Caihua; Cai, Yiwen; Li, Xiaojuan; Wang, Jianjian; Zhang, Zhanzhou","https://www.doi.org/10.1016/s2215-0366(20)30078-x","20200219","","Elsevier","Undecided","","","","","","","","","","","","","FALSE","2020-04-08","",293,""
"Online mental health services in China during the COVID-19 outbreak","","Liu, Shuai; Yang, Lulu; Zhang, Chenxi; Xiang, Yu-Tao; Liu, Zhongchun; Hu, Shaohua; Zhang, Bin","https://www.doi.org/10.1016/s2215-0366(20)30077-8","20200219","","Elsevier","Undecided","","","","","","","","","","","","","FALSE","2020-04-08","",294,""
"Measuring multimorbidity beyond counting diseases: systematic review of community and population studies and guide to index choice","Objectives To identify and summarise existing indices for measuring multimorbidity beyond disease counts, to establish which indices include mental health comorbidities or outcomes, and to develop recommendations based on applicability, performance, and usage.Design Systematic review.Data sources Seven medical research databases (Medline, Web of Science Core Collection, Cochrane Library, Embase, PsycINFO, Scopus, and CINAHL Plus) from inception to October 2018 and bibliographies and citations of relevant papers. Searches were limited to English language publications.Eligibility criteria for study selection Original articles describing a new multimorbidity index including more information than disease counts and not focusing on comorbidity associated with one specific disease. Studies were of adults based in the community or at population level.Results Among 7128 search results, 5560 unique titles were identified. After screening against eligibility criteria the review finally included 35 papers. As index components, 25 indices used conditions (weighted or in combination with other parameters), five used diagnostic categories, four used drug use, and one used physiological measures. Predicted outcomes included mortality (18 indices), healthcare use or costs (13), hospital admission (13), and health related quality of life (7). 29 indices considered some aspect of mental health, with most including it as a comorbidity. 12 indices are recommended for use.Conclusions 35 multimorbidity indices are available, with differing components and outcomes. Researchers and clinicians should examine existing indices for suitability before creating new ones.Systematic review registration PROSPERO CRD42017074211.","Stirland, Lucy E.; GonzÃƒÂ¡lez-Saavedra, Laura; Mullin, Donncha S.; Ritchie, Craig W.; Muniz-Terrera, Graciela; Russ, Tom C.","https://www.doi.org/10.1136/bmj.m160","2020","","CZI","Undecided","","","","","","","","","","","","","FALSE","2020-04-08","",295,""
"The psychological impact of the COVID-19 epidemic on college students in China","Abstract A COVID-19 epidemic has been spreading in China and other parts of the world since December 2019. The epidemic has brought not only the risk of death from infection but also unbearable psychological pressure. We sampled college students from Changzhi medical college by using cluster sampling. They responded to a questionnaire packet that included the 7-item Generalized Anxiety Disorder Scale (GAD-7) and those inquiring the participantsÃ¢â‚¬â„¢ basic information. We received 7,143 responses. Results indicated that 0.9% of the respondents were experiencing severe anxiety, 2.7% moderate anxiety, and 21.3% mild anxiety. Moreover, living in urban areas (OR = .810, 95% CI = .709 - .925), family income stability (OR = .726, 95% CI = .645 - .817) and living with parents (OR = .752, 95% CI = .596 - .950) were protective factors against anxiety. Moreover, having relatives or acquaintances infected with COVID-19 was a risk factor for increasing the anxiety of college students (OR = 3.007, 95% CI = 2.377 - 3.804). Results of correlation analysis indicated that economic effects, and effects on daily life, as well as delays in academic activities, were positively associated with anxiety symptoms (P < .001). However, social support was negatively correlated with the level of anxiety (P < .001). It is suggested that the mental health of college students should be monitored during epidemics.","Cao, Wenjun; Fang, Ziwei; Hou, Guoqiang; Han, Mei; Xu, Xinrong; Dong, Jiaxin; Zheng, Jianzhong","https://www.doi.org/10.1016/j.psychres.2020.112934","20200320","","Elsevier","Undecided","","","","","","","","","","","","","FALSE","2020-04-08","",296,""
"The COVID-19 pandemic: The Ã¢â‚¬Ëœblack swanÃ¢â‚¬â„¢ for mental health care and a turning point for e-health","","Wind, Tim R.; Rijkeboer, Marleen; Andersson, Gerhard; Riper, Heleen","https://www.doi.org/10.1016/j.invent.2020.100317","20200319","","Elsevier","Undecided","","","","","","","","","","","","","FALSE","2020-04-08","",297,""
"Prevalence and predictors of PTSS during COVID-19 Outbreak in China Hardest-hit Areas: Gender differences matter","Abstract The outbreak of COVID-19 in China in December 2019 has been identified as a pandemic and a health emergency of global concern. Our objective was to investigate the prevalence and predictors of posttraumatic stress symptoms (PTSS) in China hardest-hit areas during COVID-19 outbreak, especially exploring the gender difference existing in PTSS. One month after the December 2019 COVID-19 outbreak in Wuhan China, we surveyed PTSS and sleep qualities among 285 residents in Wuhan and surrounding cities using the PTSD Checklist for DSM-5 (PCL-5) and 4 items from the Pittsburgh Sleep Quality Index (PSQI). Hierarchical regression analysis and non-parametric test were used to analyze the data. Results indicated that the prevalence of PTSS in China hardest-hit areas a month after the COVID-19 outbreak was 7%. Women reported significant higher PTSS in the domains of re-experiencing, negative alterations in cognition or mood, and hyper-arousal. Participants with better sleep quality or less frequency of early awakenings reported lower PTSS. Professional and effective mental health services should be designed in order to aid the psychological wellbeing of the population in affected areas, especially those living in hardest-hit areas, females and people with poor sleep quality. PTSD; epidemic disease; Sleep quality; Hierarchical regression analysis; Wuhan area","Liu, Nianqi; Zhang, Fan; Wei, Cun; Jia, Yanpu; Shang, Zhilei; Sun, Luna; Wu, Lili; Sun, Zhuoer; Zhou, Yaoguang; Wang, Yan; Liu, Weizhi","https://www.doi.org/10.1016/j.psychres.2020.112921","20200316","","Elsevier","Undecided","","","","","","","","","","","","","FALSE","2020-04-08","",298,""
"The Emotional Impact Of Coronavirus 2019-Ncov (New Coronavirus Disease)","Abstract Background : A novel form of coronavirus (2019-nCoV) in Wuhan has created a confused and rapidly evolving situation. In this situational framework, patients and front-line healthcare workers are vulnerable. Method : Studies were identified using large-circulation international journals found in two electronic databases: Scopus and Embase. Results : Populations of patients that may require tailored interventions are older adults and international migrant workers. Older adults with psychiatric conditions may be experiencing further distress. The COVID-19 epidemic has underscored potential gaps in mental health services during emergencies. Conclusions : Most health professionals working in isolation units and hospitals do not receive any training for providing mental health care. Fear seems more certainly a consequence of mass quarantine.","Lima, Carlos Kennedy Tavares; Carvalho, Poliana Moreira de Medeiros; Lima, Igor de AraÃƒÂºjo Silva; Nunes, JosÃƒÂ© Victor Alexandre de Oliveira; Saraiva, Jeferson Seves; de Souza, Ricardo InÃƒÂ¡cio; da Silva, ClaÃƒÂºdio Gleidiston Lima; Neto, Modesto Leite Rolim","https://www.doi.org/10.1016/j.psychres.2020.112915","20200312","","Elsevier","Undecided","","","","","","","","","","","","","FALSE","2020-04-08","",299,""
"Iranian mental health during the COVID-19 epidemic","","Zandifar, Atefeh; Badrfam, Rahim","https://www.doi.org/10.1016/j.ajp.2020.101990","20200630","","Elsevier","Undecided","","","","","","","","","","","","","FALSE","2020-04-08","",300,""
