,title,abstract,authors,link,date,subject,source,initial_decision,q0,q1,q2,q3,q4,q5,q6,q7,q8,q9,q10,q11,q12,q13,q14,q15,q16,q17,q18,q19,q20,exclusion_reason,extraction_date
216,Emotional &quot;inflection point&quot; in public health emergencies with the 2019 new coronavirus pneumonia (NCP) in China,"The outbreak of the new coronavirus pneumonia (NCP) in Wuhan, Hubei, has caused very serious consequences and severely affected people's lives and mental health. The outbreak will cause bad emotions such as tension, anxiety, fear, and so on. College students who have returned home from school face infection, isolation, and delay in starting school, and thus, their emotional stress should be observed. This study used self-designed questionnaires and artificial intelligence (AI) to assess and analyze the emotional state of over 30,000 college students during the outbreak period in January (T1) and home quarantine in February (T2). This survey used online questionnaire (www.wjx.cn) to investigate the emotion information of college students. In the T1 survey, the &quot;Typhoon Eye Effect&quot; appeared. College students in Hubei are calmer than those outside Hubei in T1. However, in T2, an emotional &quot;infection point&quot; appeared, there was an &quot;Exposure Effect&quot;, the negative emotions of students in Hubei largely increased and became higher than students outside Hubei. This survey found that there is an emotional &quot;infection point&quot; in February among college students, especially in the Hubei area. College students in Hubei are calmer than those outside Hubei in T1. In contrast, college students in Hubei were more nervous and scared than those outside Hubei in T2. This epidemic has caused the students to experience significant pressure and negative emotions. Therefore, universities and society should pay attention to their emotional adjustment, there are some suggestions such as establish the mental health organizations, test students' emotion status regularly.","Zhang, Cao, Wang, Wang, Lei, Shou, Xie, Huang, Luo, Luo, Bian, Zhang, Xiao",https://doi.org/10.1016/j.jad.2020.07.097,20200909.0,"College students; Emotional â€œinflection pointâ€; New coronavirus pneumonia (NCP); Self-regulation; Adolescent; Anxiety; Artificial Intelligence; Betacoronavirus; COVID-19; China; Coronavirus Infections; Disease Outbreaks; Emergencies; Emotions; Female; Humans; Male; Mental Health; Pandemics; Pneumonia, Viral; Public Health; SARS-CoV-2; Students; Surveys and Questionnaires; Young Adult",PubMed,,,,,,,,,,,,,,False,False,,,,,False,False,False,,2021-01-08
217,HIV and COVID-19: Intersecting Epidemics With Many Unknowns,"As of July 2020, approximately 6 months into the pandemic of novel coronavirus disease 2019 (COVID-19), whether people living with human immunodeficiency virus (HIV; PLWH) are disproportionately affected remains an unanswered question. Thus far, risk of COVID-19 in people with and without HIV appears similar, but data are sometimes contradictory. Some uncertainty is due to the recency of the emergence of COVID-19 and sparsity of data; some is due to imprecision about what it means for HIV to be a &quot;risk factor&quot; for COVID-19. Forthcoming studies on the risk of COVID-19 to PLWH should differentiate between 1) the unadjusted, excess burden of disease among PLWH to inform surveillance efforts and 2) any excess risk of COVID-19 among PLWH due to biological effects of HIV, independent of comorbidities that confound rather than mediate this effect. PLWH bear a disproportionate burden of alcohol, other drug use, and mental health disorders, as well as other structural vulnerabilities, which might increase their risk of COVID-19. In addition to any direct effects of COVID-19 on the health of PLWH, we need to understand how physical distancing restrictions affect secondary health outcomes and the need for, accessibility of, and impact of alternative modalities of providing ongoing medical, mental health, and substance use treatment that comply with physical distancing restrictions (e.g., telemedicine).","Lesko, Bengtson",https://doi.org/10.1093/aje/kwaa158,20210106.0,COVID-19; HIV; engagement in care; mental health; substance use; telemedicine,PubMed,,,,,,,,,,,,,,False,False,,,,,False,False,False,,2021-01-08
218,Elbogen et al Respond to &quot;Stressors and Suicide Attempts in a Time of COVID-19&quot;,,"Elbogen, Lanier, Montgomery, Strickland, Wagner, Tsai",https://doi.org/10.1093/aje/kwaa149,20201109.0,"Betacoronavirus; COVID-19; Coronavirus Infections; Humans; Pandemics; Pneumonia, Viral; SARS-CoV-2; Stress, Psychological; Suicide, Attempted",PubMed,,,,,,,,,,,,,,False,False,,,,,False,False,False,,2021-01-08
219,"Experiences of American Older Adults with Pre-existing Depression During the Beginnings of the COVID-19 Pandemic: A Multicity, Mixed-Methods Study","To determine the effect of the COVID-19 pandemic on the mental health of older adults with pre-existing major depressive disorder (MDD). Participants were 73 community-living older adults with pre-existing MDD (mean age 69 [SD 6]) in Los Angeles, New York, Pittsburgh, and St Louis. During the first 2 months of the pandemic, the authors interviewed participants with a semistructured qualitative interview evaluating access to care, mental health, quality of life, and coping. The authors also assessed depression, anxiety, and suicidality with validated scales and compared scores before and during the pandemic. Five themes from the interviews highlight the experience of older adults with MDD: 1) They are more concerned about the risk of contracting the virus than the risks of isolation. 2) They exhibit resilience to the stress and isolation of physical distancing. 3) Most are not isolated socially, with virtual contact with friends and family. 4) Their quality of life is lower, and they worry their mental health will suffer with continued physical distancing. 5) They are outraged by an inadequate governmental response to the pandemic. Depression, anxiety, and suicidal ideation symptom scores did not differ from scores before the pandemic. Most older adults with pre-existing MDD show resilience in the first 2 months of the COVID-19 pandemic but have concerns about the future. Policies and interventions to provide access to medical services and opportunities for social interaction are needed to help to maintain mental health and quality of life as the pandemic continues.","Hamm, Brown, Karp, Lenard, Cameron, Dawdani, Lavretsky, Miller, Mulsant, Pham, Reynolds, Roose, Lenze",https://doi.org/10.1016/j.jagp.2020.06.013,20200907.0,"Covid-19 Pandemic; anxiety; depression; resilience; Aged; Anxiety; Betacoronavirus; COVID-19; Comorbidity; Coronavirus Infections; Depressive Disorder, Major; Female; Humans; Male; Pandemics; Pneumonia, Viral; Qualitative Research; Quality of Life; SARS-CoV-2; Suicidal Ideation; United States",PubMed,,,,,,,,,,,,,,False,False,,,,,False,False,False,,2021-01-08
220,Adapting Neurosurgery Practice During the COVID-19 Pandemic in the Indian Subcontinent,"The coronavirus 2019 (COVID-19) pandemic has changed the practice of neurosurgery. Significant resources have been dedicated to the disease. The pandemic in the Indian subcontinent, compared with the rest of the world, is relatively delayed. The neurosurgical practice cannot remain unaffected by hugely disruptive measures such as a lockdown. The inevitable increase in COVID infections with the gradual relaxation of lockdown continues to pose a risk for health care providers. Therefore, it is imperative to evaluate whether the pandemic has had a discernible effect on health care providers, especially in terms of practice modifications in private establishments and publicly funded hospitals, the emotional impact on the surgeon, and the influence of social media on the psyche of the surgeon. An online questionnaire-based survey was prepared, with questions related to the COVID-specific themes of precautions taken in outpatient services and operating theaters, the influence of social media, the economic loss incurred, and the perceptible impact of telemedicine and webinars. The links to the survey were mailed to neurosurgeons in private and public practice countrywide. The responses were anonymized to ensure free and unbiased answers to the survey questions. A total of 176 responses were received from across the Indian subcontinent. The median age of respondents was 39 years (range, 32-70 years) and the postresidency experience was 7 years (range, 0-34 years). Respondents were an equitable mix of public and private practitioners. Of respondents, 46% were practicing restricted outpatient services, more in public institutions (PÂ = 0.22) which also had a higher incidence of tele-outpatient services (26% vs. 17%). Wearing surgical masks, N95 masks, and gloves were the most commonly practiced precautionary measures in outpatient services (&gt;60%). Although private practitioners were continuing elective cases (40%), public institutes were more cautious, with only emergency patients being operated on (29%). The greatest fear among all practitioners was passing the infection to their family (75%). Social media were helpful for brainstorming queries and updating practice modifications, but some surgeons admitted to receiving threats on social media platforms (37.5%). Depression and economic losses were palpable for approximately 30% neurosurgeons. The survey highlights the perception of neurosurgeons toward the pandemic and the difference in public-private practice. Suspension of elective procedures, severe curtailment of regular outpatient appointments, drastic modifications of the normal outpatient department/operating room practices, and apprehensions related to inadequacy of safety provided by personal protective equipment use and financial losses of private establishments were some of the visible themes in our survey results. Although telemedicine has not been as widely adopted as expected, online education has been favorably received.","Deora, Mishra, Tripathi, Garg, Tandon, Borkar, Varshney, Raut, Chaurasia, Chandra, Kale",https://doi.org/10.1016/j.wneu.2020.07.038,20201009.0,"COVID-19; Coronavirus; Neurosurgery; Social media; Academic Medical Centers; Adult; Aged; Ambulatory Care; Betacoronavirus; COVID-19; Coronavirus Infections; Depression; Economics; Elective Surgical Procedures; Hospitals, Private; Hospitals, Public; Humans; India; Middle Aged; Neurosurgeons; Neurosurgery; Neurosurgical Procedures; Pandemics; Personal Protective Equipment; Pneumonia, Viral; Professional Practice; SARS-CoV-2; Social Media; Surveys and Questionnaires; Telemedicine",PubMed,,,,,,,,,,,,,,False,False,,,,,False,False,False,,2021-01-08
221,Mapping population mental health concerns related to COVID-19 and the consequences of physical distancing: a Google trends analysis,"<b>Background:</b> The 2020 Coronavirus pandemic is a major international public health challenge. Â Governments have taken public health protection measures to reduce the spread of the virus through non-pharmalogical measures. The impact of the pandemic and the public health response on individual and population mental health is unknown.Â <b>Methods:</b> We used Google Trends data (1 Jan 2020 - Â 30 Mar 2020) to investigate the impact of the pandemic and government measures to curb it on people's concerns, as indexed by changes in search frequency for topics indicating mental distress, social and economic stressors and mental health treatment-seeking. We explored the changes of key topics in Google trends in Italy, Spain, USA, UK, and Worldwide in relation to sentinel events during the pandemic. <b>Results:</b> Globally there appears to be significant concerns over the financial and work-related consequences of the pandemic, with some evidence that levels of fear are rising. Conversely relative searching for topics related to depression and suicide fell after the pandemic was announced, with some evidence that searches for the latter have risen recently. Concerns over education and access to medication appear to be particular social stressors. Whilst searches for face-to-face treatments have declined, those for self-care have risen. <b>Conclusions:</b> Monitoring Google trends shows promise as a means of tracking changing public concerns. In weeks to come it may enable policy makers to assess the impact of their interventions including those aiming to limit negative consequences, such as government funded financial safety nets.","Knipe, Evans, Marchant, Gunnell, John",https://doi.org/10.12688/wellcomeopenres.15870.2,20200928.0,Anxiety; COVID-19; Coronavirus; Depression; Economic; Mental health; Pandemic; Suicide,PubMed,,,,,,,,,,,,,,False,False,,,,,False,False,False,,2021-01-08
222,The effects of COVID-19 on self-harm in UK prisons,"Self-harm is a major international public health concern and is especially prevalent among prisoners. In this editorial, we explore recent trends in prisoner self-harm during the coronavirus lockdown, and consider strategies for improving the prevention and management of self-harm in prisons as we emerge from the pandemic.","Hewson, Green, Shepherd, Hard, Shaw",https://doi.org/10.1192/bjb.2020.83,20200928.0,COVID-19; Coronavirus; forensic mental health services; prison; self-harm,PubMed,,,,,,,,,,,,,,False,False,,,,,False,False,False,,2021-01-08
223,COVID-19 and Telepsychiatry: Development of Evidence-Based Guidance for Clinicians,"The coronavirus disease (COVID-19) presents unique challenges in health care, including mental health care provision. Telepsychiatry can provide an alternative to face-to-face assessment and can also be used creatively with other technologies to enhance care, but clinicians and patients may feel underconfident about embracing this new way of working. The aim of this paper is to produce an open-access, easy-to-consult, and reliable source of information and guidance about telepsychiatry and COVID-19 using an evidence-based approach. We systematically searched existing English language guidelines and websites for information on telepsychiatry in the context of COVID-19 up to and including May 2020. We used broad search criteria and included pre-COVID-19 guidelines and other digital mental health topics where relevant. We summarized the data we extracted as answers to specific clinical questions. Findings from this study are presented as both a short practical checklist for clinicians and detailed textboxes with a full summary of all the guidelines. The summary textboxes are also available on an open-access webpage, which is regularly updated. These findings reflected the strong evidence base for the use of telepsychiatry and included guidelines for many of the common concerns expressed by clinicians about practical implementation, technology, information governance, and safety. Guidelines across countries differ significantly, with UK guidelines more conservative and focused on practical implementation and US guidelines more expansive and detailed. Guidelines on possible combinations with other digital technologies such as apps (eg, from the US Food and Drug Administration, the National Health Service Apps Library, and the National Institute for Health and Care Excellence) are less detailed. Several key areas were not represented. Although some special populations such as child and adolescent, and older adult, and cultural issues are specifically included, important populations such as learning disabilities, psychosis, personality disorder, and eating disorders, which may present particular challenges for telepsychiatry, are not. In addition, the initial consultation and follow-up sessions are not clearly distinguished. Finally, a hybrid model of care (combining telepsychiatry with other technologies and in-person care) is not explicitly covered by the existing guidelines. We produced a comprehensive synthesis of guidance answering a wide range of clinical questions in telepsychiatry. This meets the urgent need for practical information for both clinicians and health care organizations who are rapidly adapting to the pandemic and implementing remote consultation. It reflects variations across countries and can be used as a basis for organizational change in the short- and long-term. Providing easily accessible guidance is a first step but will need cultural change to implement as clinicians start to view telepsychiatry not just as a replacement but as a parallel and complementary form of delivering therapy with its own advantages and benefits as well as restrictions. A combination or hybrid approach can be the most successful approach in the new world of mental health post-COVID-19, and guidance will need to expand to encompass the use of telepsychiatry in conjunction with other in-person and digital technologies, and its use across all psychiatric disorders, not just those who are the first to access and engage with remote treatment.","Smith, Ostinelli, Macdonald, Cipriani",https://doi.org/10.2196/21108,20200928.0,COVID-19; digital mental health; evidence-based guidance; mental health; systematic review; telepsychiatry,PubMed,,,,,,,,,,,,,,False,False,,,,,False,False,False,,2021-01-08
224,Mental health in chronic disease patients during the COVID-19 quarantine in Greece,"To investigate the effect of the time spent on quarantine on distress, anxiety, depression, and somatization of chronic disease patients during the COVID-19 quarantine in Greece and the differences in these parameters between healthy individuals and chronic disease patients. The sample consisted of 943 healthy individuals and 163 patients (respiratory, autoimmune, cardiovascular, endocrine, patients with other diseases, and patients with more than one disease) completing sociodemographic assessments as well as the 4-Dimensional Symptom Questionnaire (4DSQ) during March 30, 2020 to May 3, 2020. Pearson's correlation was used to search for the association between time spent on quarantine and the 4DSQ subscales (distress, anxiety, depression, and somatization). Independent sample T-test and Glass's Î” were used for differences between healthy individuals and chronic disease patients in these subscales, an analysis also carried out between healthy individuals and all patient subgroups. No statistically significant correlations were noted between the 4DSQ subscales and the quarantine duration, both for the patient and the healthy individuals' group. Chronic disease patients had significantly higher levels of distress (p = 0.001, Î” = 0.28) and somatization (p = 0.000, Î” = 0.47), but not there were no significant differences in anxiety (p = 0.098, Î” = 0.14) and depression (p = 0.052, Î” = 0.19). Concerning head-to-head comparisons between the healthy individuals' group and each patient group, significantly higher scores in distress were found only for patients with respiratory diseases (p = 0.028, Î” = 0.42). Regarding somatization, significantly higher scores were noted for the healthy individuals' group compared with patients with autoimmune diseases (p = 0.010, Î” = 0.62), respiratory diseases (p = 0.027, Î” = 0.42), other diseases (p = 0.003, Î” = 0.55), and more than one disease (p = 0.012, Î” = 0.60). No statistically significant differences were found in anxiety and depression. The results of this study indicate that interventional programs for chronic disease patients during quarantine should focus on distress and somatization, not on anxiety and depression. Respiratory patients might have more supportive care needs compared with patients with other diseases.","Louvardi, Pelekasis, Chrousos, Darviri",https://doi.org/10.1017/S1478951520000528,20201123.0,"Asthma; Autoimmune; Cardiovascular; Mental health; Pandemic; Adult; Aged; Aged, 80 and over; Betacoronavirus; COVID-19; Chronic Disease; Coronavirus Infections; Female; Greece; Healthy Volunteers; Humans; Male; Mental Disorders; Middle Aged; Pandemics; Pneumonia, Viral; Quarantine; SARS-CoV-2; Stress, Psychological; Surveys and Questionnaires",PubMed,,,,,,,,,,,,,,False,False,,,,,False,False,False,,2021-01-08
225,Management of COVID-19 Response in a Secure Forensic Mental Health Setting: RÃ©ponse Ã la gestion de la COVID-19 dans un Ã©tablissement sÃ©curisÃ© de santÃ© mentale et de psychiatrie lÃ©gale,"The coronavirus disease 2019 (COVID-19) pandemic presents major challenges to places of detention, including secure forensic hospitals. International guidance presents a range of approaches to assist in decreasing the risk of COVID-19 outbreaks as well as responses to manage outbreaks of infection should they occur. We conducted a literature search on pandemic or outbreak management in forensic mental health settings, including gray literature sources, from 2000 to April 2020. We describe the evolution of a COVID-19 outbreak in our own facility, and the design, and staffing of a forensic isolation unit. We found a range of useful guidance but no published experience of implementing these approaches. We experienced outbreaks of COVID-19 on two secure forensic units with 13 patients and 10 staff becoming positive. One patient died. The outbreaks lasted for 41 days on each unit from declaration to resolution. We describe the approaches taken to reduction of infection risk, social distancing and changes to the care delivery model. Forensic secure settings present major challenges as some proposals for pandemic management such as decarceration or early release are not possible, and facilities may present challenges to achieve sustained social distancing. Assertive testing, cohorting, and isolation units are appropriate responses to these challenges.","Simpson, Chatterjee, Darby, Jones, Maheandiran, Penney, Saccoccio, Stergiopoulos, Wilkie",https://doi.org/10.1177/0706743720935648,20200929.0,"COVID-19; forensic mental health; isolation units; secure hospital; Adult; Aged; COVID-19; Comorbidity; Coronavirus Infections; Developmental Disabilities; Female; Forensic Psychiatry; Hospitals, Psychiatric; Humans; Male; Middle Aged; Ontario; Pandemics; Patient Isolation; Pneumonia, Viral; Psychotic Disorders; Substance-Related Disorders",PubMed,,,,,,,,,,,,,,False,False,,,,,False,False,False,,2021-01-08
226,Lessons on Outbreak Preparedness From the Cleveland Clinic,"Disasters, including infectious disease outbreaks, are inevitable. Hospitals need to plan in advance to ensure that their systems can adapt to a rapidly changing environment if necessary. This review provides an overview of 10 general principles that hospitals and health-care systems should consider when developing disaster plans. The principles are consistent with an &quot;all-hazards&quot; approach to disaster mitigation. This approach is adapted to planning for a multiplicity of threats but emphasizes highly relevant scenarios, such as the coronavirus disease 2019 pandemic. We also describe specific ways these principles helped prepare our hospital for this pandemic. Key points include acting quickly, identifying and engaging key stakeholders early, providing accurate information, prioritizing employee safety and mental health, promoting a fully integrated clinical response, developing surge plans, preparing for ethical dilemmas, and having a cogent exit strategy for post-disaster recovery.","Orsini, Mireles-Cabodevila, Ashton, Khouli, Chaisson",https://doi.org/10.1016/j.chest.2020.06.009,20201126.0,"review; stress; topics in practice management; viral disease; Betacoronavirus; COVID-19; Communication; Cooperative Behavior; Coronavirus Infections; Creativity; Disaster Planning; Disease Outbreaks; Equipment and Supplies; Ethics; Health Personnel; Health Services Needs and Demand; Humans; Mental Health; Occupational Health; Pandemics; Personal Protective Equipment; Pneumonia, Viral; SARS-CoV-2; Stakeholder Participation; Surge Capacity",PubMed,,,,,,,,,,,,,,False,False,,,,,False,False,False,,2021-01-08
