,title,abstract,authors,link,date,subject,source,initial_decision,q0,q1,q2,q3,q4,q5,q6,q7,q8,q9,q10,q11,q12,q13,q14,q15,q16,q17,q18,q19,q20,exclusion_reason,extraction_date
90,Influencing Factors of Psychological Well-Being of the Non-designated Hospital Staff in China During the COVID-19 Pandemic,"<b>Background:</b> Recent studies report that hospital staff at the forefront of caring for COVID-19 patients experience increased psychological distress. To effectively manage the outbreak of COVID-19, China established COVID-19 designated and non-designated hospitals. To date, few studies have examined the impacts of COVID-19 on psychological health of staff working at non-designated hospitals. This study is to explore factors affecting psychological health of non-designated hospital staff in China during the COVID-19 pandemic. <b>Methods:</b> Data were collected through an online questionnaire between February and March 2020. The questionnaire consists of General Health Questionnaire (GHQ-20), Social Support Rating Scale (SSRS), Simplified Coping Style Questionnaire (SCSQ), sociodemographic characteristics, employment history, health status, and contact history of COVID-19. The questionnaire was distributed through hospital WeChat groups and work colleague referrals. A total of 470 non-designated hospital staff members completed the questionnaire. Multiple Linear Regression analysis was used to interpret the associations among social support, coping styles, sociodemographic factors, job roles, and psychological status. Data were analyzed using SPSS version 21.0. <b>Results:</b> The non-designated hospital staff differed significantly in anxiety and depression subscores of the GHQ-20 by their job roles, levels of social support, and history of mental disorders. Staff with medical job roles, good self-reported health status, no previous mental disorders, adequate social support, and positive coping styles scored lower in GHQ-20 total score, which indicated healthier psychological status. <b>Conclusions:</b> The results indicate that history of mental health disorders, non-medical job roles, and inadequate social support are associated with greater psychological distress. Personalized support should be provided to those who are vulnerable and in need of social and psychological support.","Yao, Lyu, Ma, Champ, Xiong, Li, Li, Mu, Hu, Gao, Jia",https://doi.org/10.3389/fpsyt.2021.591026,20210222.0,COVID-19; coping style; non-designated hospital staff; psychological well-being; social support,PubMed,,,,,,,,,,,,,,False,False,,,,,False,False,False,,2021-02-23
91,"The Relationship Between Mental Toughness, Job Loss, and Mental Health Issues During the COVID-19 Pandemic","Concerns toward public well-being and mental health are increasing considering the COVID-19 pandemic's global societal and individual impact. The present study builds on the current body of COVID-19 literature by examining the role of mental toughness (MT) in predicting negative affective states (depression, anxiety and stress) during the pandemic. The study also examined the effects of changes in employment on mental health and MT. Participants (<i>N</i> = 723) completed a battery of questionnaires including the <i>Mental Toughness Questionnaire 48-item, The State-Trait Anxiety Inventory</i>, and the <i>Depression, Anxiety and Stress Scale - 21 items</i>. Participants reported relatively higher levels of depression, stress and anxiety in comparison to pre-COVID-19 samples from previous research, with respondents who had lost their jobs during the pandemic reporting higher levels of negative affective states. Despite this, mentally tough individuals appeared to report lower levels of depression, anxiety and stress. Moreover, moderation analyses identified some interaction between MT and employment status when predicting depression, anxiety and stress. Our findings suggest that MT may have some utility in reducing the adverse mental health effects of the pandemic on individuals, however, further longitudinal research is needed to support these implications.","Mojtahedi, Dagnall, Denovan, Clough, Hull, Canning, Lilley, Papageorgiou",https://doi.org/10.3389/fpsyt.2020.607246,20210222.0,COVID-19; anxiety; depression; mental health; mental toughness; stress; unemployment (effects of),PubMed,,,,,,,,,,,,,,False,False,,,,,False,False,False,,2021-02-23
92,Women pay the price of COVID-19 more than men,"The COVID-19 pandemic is an unprecedented event with wide-ranging implications. Given that households are at the center of major changes affecting the entire world, the <i>Review of Economics of the Household</i> is publishing a series of issues on COVID-19 and the economics of the household. Here we review eight articles documenting the enormous costs of the COVID containment policies, in particular the school closures that ensued. Individuals paid a heavy cost in terms of disruption in their attachment to the labor force. Children could not go to school and parents were forced to provide extra childcare and spend significant amounts of time helping children continue to learn, while possibly working from home. Domestic violence became more common. These changes have often been traumatic, to the detriment of the well-being and mental health of large numbers of people. Women have paid a higher price than men, as many of the studies demonstrate. Our conclusion calls for policy-makers to prepare for the post-traumatic period: many households will need help.","Croda, Grossbard",https://doi.org/10.1007/s11150-021-09549-8,20210222.0,,PubMed,,,,,,,,,,,,,,False,False,,,,,False,False,False,,2021-02-23
93,Can South Asian Countries Cope with the Mental Health Crisis Associated with COVID-19?,,"Mia, Griffiths",https://doi.org/10.1007/s11469-021-00491-5,20210222.0,,PubMed,,,,,,,,,,,,,,False,False,,,,,False,False,False,,2021-02-23
94,Impact of Lockdown on the Attitude of University Students in South India-A Cross-Sectional Observational Study,"The whole world is under the effects of the COVID-19 pandemic which has put all nations in a unique lockdown situation to contain the disease. Though the environment got ameliorated with low pollution levels, this unexpected lockdown has taken a toll on humans' mental health. As the effects of lockdown can affect college students due to fear, anxiety and stress, this study intends to assess the attitude of the university students. An online questionnaire survey comprising 15 questions was conducted among four South Indian state university students. Their responses were recorded through Google Forms. The submitted responses were analysed using SPSS software version 17. In total, 1241 responses were recorded from university students belonging to various faculties. Though 43% considered this lockdown as a convenient break, 60% could not focus on their studies. The importance of renewing relationships was felt by 47%, and 83% tried to learn a new skill. Students from Tamil Nadu were looking forward towards a brighter future after the lockdown. This survey conducted in the early days of lockdown indicated that the university students were not anxious about the long-term effects of the pandemic but showed a decline in their academic performance.","John, P John",https://doi.org/10.1007/s12663-020-01501-0,20210222.0,Attitude; COVID-19; Coping; Lockdown; University students,PubMed,,,,,,,,,,,,,,False,False,,,,,False,False,False,,2021-02-23
95,,"COVID-19, a major 'Public Health Emergencies of International Concern,' had sought greater attention among researchers to study its pathogenesis, associated complications and management. However, there are only few studies that had studied its potential impact on mental health of general public, who are subjected to social distancing, community lockdown and restrictions in their routine activities. The aim of this study is to assess the prevalence of psychological distress and mental health needs among general public in Tamil Nadu subjected to lockdown, social distancing amidst COVID-19 crisis. Tamil Nadu is one of the worst affected states of southern India. A self-administered, web-based application study using 'WHO-Self Reported Questionnaire-20', in bilingual version, both English and Tamil, is used to screen the public for the level of distress. The study is done while the state is under extended lockdown and restricted movement. A total of 918 respondents participated in the survey and it is found that about more than one third of the respondents (âˆ¼35%) are under psychological distress. A significant association between younger age group, female gender, unmarried, people with children are found to be under distress. The lockdown had increased the frequency of smoking and quantity of cigarettes among smokers, also has increased the frequency of drinking among alcohol consumers. Of the SRQ-20 items recorded, stress related neurotic symptoms (&gt;70%) was observed more than the depressive mood. About 33% of those scored &gt; 7, had suicidal tendency. The districts declared red zones had significantly reported a greater number of respondents under distress. Besides effectively mitigating the COVID-19 crisis, in terms of prevention, control and treatment strategies, it is prerogative to effectively manage fear, distress due to the COVID-19 and associated anxiety and depression among the public.","Rajendran, Govindarajulu, Adaikalam, Srinivasan, Seshayyan, Ramalingam, Elangovan",https://doi.org/10.1016/j.amp.2021.02.013,20210222.0,Anxiety; Depression; Factor analysis; Outbreaks; Pandemics; Stress,PubMed,,,,,,,,,,,,,,False,False,,,,,False,False,False,,2021-02-23
96,,"The current cross-sectional study aimed to explore the relationship between work stressors and mental health in frontline nurses exposed to COVID-19. Participants were recruited from 16 general hospitals in Anhui province from February 2020 to March 2020. The general sociodemographic questionnaire, Nurse Job Stressors Scale, Simplified Coping Style Questionnaire, NEO Five-Factor Inventory, Perceived Social Support Scale, and Kessler Psychological Distress Scale were used in this study. Based on 723 valid questionnaires retrieved (100%), the total mean scores of work stressors and mental health of frontline nurses were (94.38Â±23.42) and (22.81Â±7.16), respectively. The results of the structural equation model showed that work stressors had an indirect positive effect (Î²=0.484, P&lt;0.01), social support had a direct negative effect (Î²=-0.934, P&lt;0.01), personality traits had a direct positive effect (Î²=0.209, P&lt;0.01), and positive coping style had both direct positive (Î²=0.246, P&lt;0.01) and indirect negative effects (Î²=-0.873, P&lt;0.01) on frontline nurses' mental health. In conclusion, nursing staff can reinforce positive influences by accepting social support, adopting positive coping methods, and weakening negative influences factors to reduce or buffer their negative mental states and further reduce work stress.","Shaohua, Dai, Wang, Zhang, Li, He",https://doi.org/10.1016/j.amp.2021.02.015,20210222.0,COVID-19; Caregiver; Job; Mental Health; Psychic suffering; Stress; Work psychology,PubMed,,,,,,,,,,,,,,False,False,,,,,False,False,False,,2021-02-23
97,Changes in emotions and worries during the Covid-19 pandemic: an online-survey with children and adults with and without mental health conditions,"The novel coronavirus disease (Covid-19) has spread quickly worldwide with dramatic consequences on our daily lives. Adverse psychosocial consequences of Covid-19 might be particularly severe for children and adolescents, parents of young children and people with mental health conditions (mhc), who are more prone to the experience of psychosocial stress and who are more dependent on the access to professional psychosocial support. The present survey therefore aimed to explore perceived stress and the emotional responses of children and adolescents as well as adults with and without mhc during the social restrictions due to the Covid-19 pandemic. The survey gathered information about 284 children and adolescent (parent-on-child-reports) and 456 adults (including 284 parents, self-reports). The participants were allocated to four groups: children and adolescents with mhc, children and adolescent without mhc, adults with mhc and adults without mhc. The survey included general questions about socio-demographic characteristics and mental health status, the CoRonavIruSHealth Impact Survey and the Perceived Stress Scale (only data on adults). Wilcoxon signed-rank tests were used for comparing the emotional responses during the Covid-19 pandemic with emotions before the Covid-19 pandemic. Independent sample t-test were used to compare the level of perceived stress between the adult groups, linear regression analyses were conducted to examine which variables predicted perceived stress during the Covid-19 restrictions. An increase to the worse during the Covid-19 restrictions was observed for most emotions and worries in all four groups (children and adolescents with mhc, children and adolescents without mhc, adults with mhc, adults without mhc). Contrary to our expectations, a greater number of emotions worsened significantly for children and adolescents as well as adults without mhc as compared to those with mhc. We found higher perceived stress in parents as compared to adults without children in the same household and in adults with mhc as compared to those without mhc. Covid-19-related social restrictions and potential health risks seem to affect emotions and perceived stress in children, adolescents and adults. Especially, Covid-19 seems to be have worsened the mental well-being of children and adolescent and their families, who were mentally healthy before the Covid-19 pandemic.","Rothe, Buse, Uhlmann, Bluschke, Roessner",https://doi.org/10.1186/s13034-021-00363-9,20210222.0,Crisis; Family; Lockdown; Psychosocial stress; SARS-CoV-2,PubMed,,,,,,,,,,,,,,False,False,,,,,False,False,False,,2021-02-23
98,Relation of severe COVID-19 to polypharmacy and prescribing of psychotropic drugs: the REACT-SCOT case-control study,"The objective of this study was to investigate the relation of severe COVID-19 to prior drug prescribing. Severe cases were defined by entry to critical care or fatal outcome. For this matched case-control study (REACT-SCOT), all 4251 cases of severe COVID-19 in Scotland since the start of the epidemic were matched for age, sex and primary care practice to 36,738 controls from the population register. Records were linked to hospital discharges since June 2015 and dispensed prescriptions issued in primary care during the last 240 days. Severe COVID-19 was strongly associated with the number of non-cardiovascular drug classes dispensed. This association was strongest in those not resident in a care home, in whom the rate ratio (95% CI) associated with dispensing of 12 or more drug classes versus none was 10.8 (8.8, 13.3), and in those without any of the conditions designated as conferring increased risk of COVID-19. Of 17 drug classes postulated at the start of the epidemic to be &quot;medications compromising COVID&quot;, all were associated with increased risk of severe COVID-19 and these associations were present in those without any of the designated risk conditions. The fraction of cases in the population attributable to exposure to these drug classes was 38%. The largest effect was for antipsychotic agents: rate ratio 4.18 (3.42, 5.11). Other drug classes with large effects included proton pump inhibitors (rate ratio 2.20 (1.72, 2.83) for = 2 defined daily doses/day), opioids (3.66 (2.68, 5.01) for = 50 mg morphine equivalent/day) and gabapentinoids. These associations persisted after adjusting for covariates and were stronger with recent than with non-recent exposure. Severe COVID-19 is associated with polypharmacy and with drugs that cause sedation, respiratory depression, or dyskinesia; have anticholinergic effects; or affect the gastrointestinal system. These associations are not easily explained by co-morbidity. Measures to reduce the burden of mortality and morbidity from COVID-19 should include reinforcing existing guidance on reducing overprescribing of these drug classes and limiting inappropriate polypharmacy. ENCEPP number EUPAS35558.","McKeigue, Kennedy, Weir, Bishop, McGurnaghan, McAllister, Robertson, Wood, Lone, Murray, Caparrotta, Smith-Palmer, Goldberg, McMenamin, Guthrie, Hutchinson, Colhoun",https://doi.org/10.1186/s12916-021-01907-8,20210222.0,Antipsychotic agents; COVID-19; Gabapentinoids; Opioids; Overprescribing; Pharmacoepidemiology; Polypharmacy; Proton pump inhibitors,PubMed,,,,,,,,,,,,,,False,False,,,,,False,False,False,,2021-02-23
99,The psychological effects of COVID-19 spread in young Canadian adults,"The novel coronavirus disease 2019 (COVID-19) not only threatens physical health but also psychological well-being. As a result of the pandemic, increased mental health burdens have been recorded in young adults around the world. We sought to understand the association of stressors related to the COVID-19 pandemic with symptoms of psychological and emotional distress in young Canadian adults. Questionnaire respondents were asked about the extent to which they were personally impacted by COVID-19, and symptoms related to depression, anxiety, post-traumatic disorder, and emotional distress. Of 84 respondents, most identified as female (74%; 62/84). Overall, 61% (51/84) reported experiencing symptoms of psychological distress related to depression, anxiety, or post-traumatic stress disorder (PTSD); specifically, 43% (36/84) reported anxiety-related symptoms, 33% (28/84) reported depression-related symptoms, and 6% (5/84) reported PTSD-related symptoms. Individuals with family in settings high risk for COVID-19 infection and individuals who received government aid with a reduction in income were 4.30-fold and 2.80-fold more likely, respectively, to experience symptoms of psychological distress (95% CI 1.31-14.14; <i>p</i>â€‰=â€‰.013 and 95% CI 1.08-7.25; <i>p</i>â€‰=â€‰.038, respectively). Visits to social media daily to hourly for COVID-19 related news resulted in a 3.24-fold increase in the likelihood of experiencing depression-related symptoms (95% CI 1.26-8.35; <i>p</i>â€‰=â€‰.020). We demonstrate a necessity to focus on alleviating the mental health burdens and contributing stressors within young Canadian adults. Though the mental health burdens are currently exacerbated by the effects of the COVID-19 pandemic, they may persist after the pandemic ends if left unaddressed.","Gill, Du, Khan, Karimi, Sabharwal, Agarwal",https://doi.org/10.1177/0020764020988878,20210222.0,SARS-CoV-2; anxiety; coronavirus disease 2019; depression; distress; post-traumatic stress disorder,PubMed,,,,,,,,,,,,,,False,False,,,,,False,False,False,,2021-02-23
100,"Effect of SARS-CoV-2 (COVID-19) Pandemic and Lockdown on Body Weight, Maladaptive Eating Habits, Anxiety, and Depression in a Bariatric Surgery Waiting List Cohort","On January 30, 2020, the World Health Organization declared COVID-19 as a &quot;public health emergency of international concern.&quot; The primary aim of the study was to evaluate weight and food habit changes during COVID-19 outbreak. The secondary endpoint was to explore the psychological factors, arising during the pandemic, influencing weight and dietary variations. A survey composed of four different items was conducted by telephone interview: (1) anthropometric data and type of procedure, (2) Hospital Anxiety and Depression Scale (HADS), (3) maladaptive eating behaviors, and (4) personal feelings moved by the COVID-19 spread and lockdown. Fifty-six patients were enrolled. No significant changes in weight, BMI, and maladaptive eating habits were observed. A significant reduction in the anxiety index score was observed. In 17.8% of cases, a change in obesity class was reported, and among these patients, a substantial modification in bariatric procedures was planned (60%). This study showed no effect on weight and BMI nor on rates of maladaptive eating habits associated with quarantine/social isolation among severely obese individuals waiting for the bariatric surgery. At the end of lockdown, a considerable proportion of patients modified their initial obesity class, and in selected cases, it could represent a criteria for rearrangement of the planned bariatric procedure. In obese patients, the lockdown and social distancing generated a reduction of fear of confronting and being negatively judged by others. This psychological aspect was assessed with the reduction of the HADS score.","Albert, Losurdo, Leschiutta, Macchi, Samardzic, Casaganda, de Manzini, Palmisano",https://doi.org/10.1007/s11695-021-05257-5,20210221.0,"Bariatric surgery, SARS-CoV-2; COVID-19; Maladaptive eating habits",PubMed,,,,,,,,,,,,,,False,False,,,,,False,False,False,,2021-02-23
101,SOCIAL DANGER OF DOMESTIC VIOLENCE AND THE NEED FOR REHABILITATION OF ITS VICTIMS,"The aim: To investigate the social danger of domestic violence, find out its principal manifestations, consequences, and impact on women and minors' health. Based on the acquired knowledge, to suggest ways to overcome this problem, which will minimize the consequences of domestic violence. Materials and methods: The authors studied and analyzed international legal acts, Ukraine's legislation, and scientific publications on domestic violence. The method of statistical processing of analytical data of the World Health Organization (hereinafter - WHO), the Institute of Demography and Social Research at the request of the UN Population Fund, the Ministry of Social Policy of Ukraine, the Ministry of Internal Affairs and the Prosecutor General's Office of Ukraine (for 2017 - first half of 2020) were used. A comparative method of research was useful in comparing the number of cases of domestic violence in Ukraine and Europe during the COVID-19 pandemic. Conclusion: It is concluded that domestic violence is a socially dangerous act that negatively affects all family members, as it causes significant damage to health and life. The most dangerous are the consequences of domestic violence on the physical and mental health of women and minors, who are particularly vulnerable to this negative manifestation. Rehabilitation is said to help minimize the effects of domestic violence, restore the physical and mental health of victims, and return them to normal social life.","Volodina, Haltsova, Kharytonov",https://www.google.com/search?q=SOCIAL+DANGER+OF+DOMESTIC+VIOLENCE+AND+THE+NEED+FOR+REHABILITATION+OF+ITS+VICTIMS.,20210221.0, criminal offense;  family;  physical and mental health ;  victim,PubMed,,,,,,,,,,,,,,False,False,,,,,False,False,False,,2021-02-23
102,SUICIDE AS AN INDICATOR OF THE PUBLIC MENTAL HEALTH IN UKRAINE (INCLUDING PERIOD OF COVID-19),"The aim: This article aims to analyze the rates of suicide as an indicator of public mental health, to consider the suicidal map of the territory of Ukraine (including to check the manifestation of such a territorial characteristic as the Albanian paradox); calculate the price of suicide for the socio-economic development of the Ukrainian state, consider the risks of suicide that have arisen as social and criminological consequences of the COVID-19 pandemic. Materials and methods: The study is based on the analytical materials of the Ministry of Health of Ukraine and the WHO; the information and analytical data of the GeneralProsecutor's Office of Ukraine, the State Statistics Service of Ukraine and sectoral statistics for the period of 2015-2019, etc. The article is based on dialectical, analytical, synthetic, comparative, statistical, cartographic, and sociological methods of research and the method of potential demography. The theoretical basis of the article is specialized literature on medicine, suicidology, law, sociology, and cartography. Results: In Ukraine, the death rate from suicide in recent years averages 1.1% of the total number of deaths. The rate of suicide decline in Ukraine has slowed significantly over the past five years, which is an alarming symptom. There are almost strict proportions between male and female suicide (men commit four out of five suicides). The level of self-harm per 100,000 population of Ukraine remains almost stable, indicating a severe demographic crisis in Ukraine. Women in Ukraine are less likely to commit suicide than in European countries. In Ukraine in recent years, contrary to European trends, suicide has dominated among the elderly aged 65+. The number of years of potential life loss for male and female suicides in Ukraine is 103 thousand, and the number of working years is almost 100 thousand. The losses for Ukraine from the unlived life of those who died as a result of suicide in 2019 are almost USD 341 billion. Conclusions: In 2019, suicides accounted for almost 21% of deaths from external causes among Ukraine's population. The most intense suicidal situation is observed in the central part of the country's geographical map along the imaginary vertical axis &quot;North-South&quot; (Kherson, Chernihiv, Cherkasy, Vinnytsia, Zaporizhia, Kirovohrad, Sumy, Poltava, Dnipropetrovsk, Mykolaiv regions). During the COVID-19 pandemic, many additional factors increase the risk of suicide among individuals who are at heightened risk of suicide or are actively suicidal, and among the general population.","Batyrgareieva, Kalinina, Babenko",https://www.google.com/search?q=SUICIDE+AS+AN+INDICATOR+OF+THE+PUBLIC+MENTAL+HEALTH+IN+UKRAINE+(INCLUDING+PERIOD+OF+COVID-19).,20210221.0, COVID-19 pandemic;  public mental health ;  suicide;  vulnerable populations,PubMed,,,,,,,,,,,,,,False,False,,,,,False,False,False,,2021-02-23
