,title,abstract,authors,link,date,subject,source,initial_decision,q0,q1,q2,q3,q4,q5,q6,q7,q8,q9,q10,q11,q12,q13,q14,q15,q16,q17,q18,q19,q20,exclusion_reason,extraction_date
69,"Time Trends of the Public's Attention Toward Suicide During the COVID-19 Pandemic: Retrospective, Longitudinal Time-Series Study","The COVID-19 pandemic has overwhelmed health care systems around the world. Emerging evidence has suggested that substantially few patients seek help for suicidality at clinical settings during the COVID-19 pandemic, which has elicited concerns of an imminent mental health crisis as the course of the pandemic continues to unfold. Clarifying the relationship between the public's attention to knowledge about suicide and the public's attention to knowledge about the COVID-19 pandemic may provide insight into developing prevention strategies for a putative surge of suicide in relation to the impact of the COVID-19 pandemic. The goal of this retrospective, longitudinal time-series study is to understand the relationship between temporal trends of interest for the search term &quot;suicide&quot; and those of COVID-19-related terms, such as &quot;social distancing,&quot; &quot;school closure,&quot; and &quot;lockdown.&quot; We used the Google Trends platform to collect data on daily interest levels for search terms related to suicide, several other mental health-related issues, and COVID-19 over the period between February 14, 2020 and May 13, 2020. A correlational analysis was performed to determine the association between the search term ''suicide'' and COVID-19-related search terms in 16 countries. The Mann-Kendall test was used to examine significant differences between interest levels for the search term &quot;suicide&quot; before and after school closure. We found that interest levels for the search term &quot;suicide&quot; statistically significantly inversely correlated with interest levels for the search terms &quot;COVID-19&quot; or &quot;coronavirus&quot; in nearly all countries between February 14, 2020 and May 13, 2020. Additionally, search interest for the term ''suicide'' significantly and negatively correlated with that of many COVID-19-related search terms, and search interest varied between countries. The Mann-Kendall test was used to examine significant differences between search interest levels for the term &quot;suicide&quot; before and after school closure. The Netherlands (P=.19), New Zealand (P=.003), the United Kingdom (P=.006), and the United States (P=.049) showed significant negative trends in interest levels for suicide in the 2-week period preceding school closures. In contrast, interest levels for suicide had a significant positive trend in Canada (P&lt;.001) and the United States (P=.002) after school closures. The public's attention to suicide might inversely correlate with the public's attention to COVID-19-related issues. Additionally, several anticontagion policies, such as school closure, might have led to a turning point for mental health crises, because the attention to suicidality increased after restrictions were implemented. Our results suggest that an increased risk of suicidal ideation may ensue due to the ongoing anticontagion policies. Timely intervention strategies for suicides should therefore be an integral part of efforts to flatten the epidemic curve.","Burnett, Eapen, Lin",https://doi.org/10.2196/24694,20210105.0,COVID-19; Google Trends; attention; crisis; infodemiology; infoveillance; mental health; school closure; suicide; time series; time trend; Attention; COVID-19; Humans; Longitudinal Studies; Public Opinion; Retrospective Studies; Search Engine; Suicide; Time Factors,PubMed,,,,,,,,,,,,,,False,False,,,,,False,False,False,,2021-01-08
70,A Novel Artificial Intelligence-Powered Emotional Intelligence and Mindfulness App (Ajivar) for the College Student Population During the COVID-19 Pandemic: Quantitative Questionnaire Study,"Emotional intelligence (EI) and mindfulness can impact the level of anxiety and depression that an individual experiences. These symptoms have been exacerbated among college students during the COVID-19 pandemic. Ajivar is an app that utilizes artificial intelligence (AI) and machine learning to deliver personalized mindfulness and EI training. The main objective of this research study was to determine the effectiveness of delivering an EI curriculum and mindfulness techniques using an AI conversation platform, Ajivar, to improve symptoms of anxiety and depression during this pandemic. A total of 99 subjects, aged 18 to 29 years, were recruited from a second-semester group of freshmen students. All participants completed the online TestWell Wellness Inventory at the start and end of the 14-week semester. The comparison group members (49/99, 49%) were given routine mental wellness instruction. The intervention group members (50/99, 51%) were required to complete Ajivar activities in addition to routine mental wellness instruction during the semester, which coincided with the onset of the COVID-19 pandemic. This group also completed assessments to evaluate for anxiety, using the 7-item Generalized Anxiety Disorder (GAD-7) scale, and depression, using the 9-item Patient Health Questionnaire (PHQ-9). Study participants reported a mean age of 19.9 (SD 1.94) years; 27% (27/99) of the group were male and 60% (59/99) identified as Caucasian. No significant demographic differences existed between the comparison and intervention groups. Subjects in the intervention group interacted with Ajivar for a mean time of 1424 (SD 1168) minutes. There was a significant decrease in anxiety, as measured by the GAD-7: the mean score was 11.47 (SD 1.85) at the start of the study compared to 6.27 (SD 1.44) at the end (P&lt;.001). There was a significant reduction in the symptoms of depression measured by the PHQ-9: the mean score was 10.69 (SD 2.04) at the start of the study compared to 6.69 (SD 2.41) at the end (P=.001). Both the intervention and comparison groups independently had significant improvements in the TestWell Wellness Inventory from pretest to posttest. The subgroups in the social awareness and spirituality inventories showed significant improvement in the intervention group. In a subgroup of participants (11/49, 22%) where the GAD-7 was available during the onset of the COVID-19 pandemic, there was an increase in anxiety from the start of the study (mean score 11.63, SD 2.16) to mid-March (ie, onset of the pandemic) (mean score 13.03, SD 1.48; P=.23), followed by a significant decrease at the end of the study period (mean score 5.9, SD 1.44; P=.001). It is possible to deliver EI and mindfulness training in a scalable way using the Ajivar app during the COVID-19 pandemic, resulting in improvements in anxiety, depression, and EI in the college student population.","Sturgill, Martinasek, Schmidt, Goyal",https://doi.org/10.2196/25372,20210106.0,COVID-19; college students; emotional intelligence; mindfulness,PubMed,,,,,,,,,,,,,,False,False,,,,,False,False,False,,2021-01-08
71,[Anxiety and Depression Associated with the Management of COVID-19 Among Healthcare Personnel in Cameroon],"The COVID-19 pandemic has had a significant impact worldwide, at different levels. The literature consulted indicates that healthcare workers, who are the first to respond, are generally the ones who pay the highest price. The present study assesses the extent of anxious and depressive symptoms among these actors responding to COVID-19, in the context of Cameroon. The Hospital Anxiety and Depression Scale (HADS) was used to assess anxious and depressive symptoms. Data collection involved the use of a web questionnaire for this purpose through the Google Forms virtual platform. The questionnaire link was sent to professional groups spread throughout Cameroon's ten regions. A total of 331 health professionals were interviewed over the period from April 5 to 19, 2020. The results show a high rate of anxiety (41.8%) and depression (42.8%). There is a higher susceptibility to depression in young people (30-39 years). Fear of contamination and fear of death are modulators of depression and anxiety. The anxiety-depression comorbidity in the sample is 14.73%. The prevalence rates of major depressive disorder and adjustment disorder in the sample were 8.2% and 3.3%, respectively. The data presented confirm the trends recorded in the literature regarding the impact of fatal epidemics on the mental health of healthcare workers. The results indicate, as is the case with most of the work consulted in the literature, that the Covid 19 pandemic is significantly affecting the mental health of healthcare workers. This underlines the urgency of setting up a specialized aid and / or support system, in the context of the current pandemic, such as that of similar health crises. Such a device does not exist in Cameroon, where the mental health response remains weak. These results suggest that the healthcare staff involved in the response to COVID-19 in Cameroon are significantly affected in their mental health. This underlines the need for specialized psychological help for nursing staff.","Mboua, Keubo, Fouaka",https://doi.org/10.1016/j.evopsy.2020.11.002,20201231.0,Adjustment disorder; Anxiety; COVID-19; Depression; Major depressive disorder; Mental health,PubMed,,,,,,,,,,,,,,False,False,,,,,False,False,False,,2021-01-08
72,Effects of COVID-19 Epidemic Lockdown on Postpartum Depressive Symptoms in a Sample of Italian Mothers,"The extraordinary health emergency of the COVID-19 pandemic represents a new challenge for mental health researchers and clinical practitioners. The related containment measures may be a risk factor for psychological distress and mood disorders, especially in at-risk populations. This study aims to explore the impact of COVID-19 on postpartum depressive symptoms in mothers with children below 1 year of age. An online questionnaire survey was therefore conducted in Italy between May and June 2020. The survey consisted of several self-administered questionnaires: besides some <i>ad-hoc</i> questionnaires, the Edinburgh Postnatal Depression Scale (EPDS), the Scale of Perceived Social Support (SPSS) and the Maternity Social Support Scale (MSSS) were used. Two hundred forty-three Italian women were included in the study. The prevalence of postpartum depression symptomatology among mothers was 44%, as measured through the EPDS (cut-off &gt;12). Women who spent the isolation in northern Italy adopted maladaptive coping strategies significantly more than women living in areas at lower risk. The analysis highlighted a significant difference between the group that was not directly affected by the virus and women who have had a direct or indirect contact with it. Besides situational factors specific to the pandemic, the results show that there are some risk factors tied to the personal history of the mother (e.g., having had a previous abortion). These data should inform and enlighten future protocols of intervention.","Spinola, Liotti, Speranza, Tambelli",https://doi.org/10.3389/fpsyt.2020.589916,20201216.0,COVID- 19; lockdown; mental health; motherhood; postpartum depression (PPD),PubMed,,,,,,,,,,,,,,False,False,,,,,False,False,False,,2021-01-08
73,Mental Health Status of Psychogeriatric Patients During the 2019 New Coronavirus Disease (COVID-19) Pandemic and Effects on Caregiver Burden,"<b>Introduction:</b> There is a growing awareness about the noxious effects of the 2019 Coronavirus Disease (COVID-19) pandemic on the mental health of the elderly. However, there is limited information from clinically driven research. The objectives of the present study were to examine the magnitude of psychiatric symptoms and to determine their association with caregiver distress, in a cross-section of community-dwelling older adults and a subsample of aging adults with Down syndrome (DS) attending a psychogeriatric service in SÃ£o Paulo, Brazil. <b>Method:</b> Telephone-based interviews and electronically filled self-assessment questionnaires were used to collect information from patients and caregivers, addressing their impressions and concerns about the pandemic and related effects on the patient's emotional state and behavior. Clinical information was obtained from hospital charts, medical records, and psychometric tests administered through telephone interviews [Hospital Anxiety and Depression Scale (HADS) and Neuropsychiatric Inventory Questionnaire (NPI-Q)]. <b>Results:</b> We included 100 consecutive participants, comprising 71 older adults with psychogeriatric/neurocognitive disorders and 29 aging adults with DS. Higher HADS and NPI-Q scores were significantly associated with caregiver distress (<i>p</i> &lt; 0.05) in both groups. Correlation analyses indicated strong, positive associations between caregiver burden and scores in HADS anxiety (HADS-A) and HADS depression (HADS-D) scales in the subsamples of euploid and DS subjects. Higher NPI-Q scores in the former group were also correlated with caregiver distress, with stronger associations for neuropsychiatric symptoms. Similar findings were observed among DS subjects. ANOVA tests indicated significant associations between NPI-Q scores and caregiver distress among dementia patients, as well as with HADS scores. Similar results were found after multiple linear regressions; as such, among the elderly subsample, higher scores in HADS-A (<i>p</i> = 0.002) and HADS-D (<i>p</i> = 0.001) predict a significant impact on caregiver burden (<i>p</i> &lt; 0.00001, <i>R</i><sup>2</sup> 0.46); taking into consideration caregiver burden as a dependent variable and NPI-Q total score as an independent variable, we obtained significant strong prediction values for either DS (<i>p</i> &lt; 0.00001, <i>R</i><sup>2</sup> 0.95) or elderly adults (<i>p</i> &lt; 0.00001, <i>R</i><sup>2</sup> 0.88). <b>Conclusion:</b> During the COVID-19 pandemic, patients with neurocognitive disorders present with clinically relevant neuropsychiatric symptoms, with significant impact on caregiver distress. Apathy, aberrant motor behavior, sleep disorders, and psychoses were the main psychopathological domains, which had determined caregiver burden worsening.","Penteado, Loureiro, Pais, Carvalho, Sant'Ana, Valiengo, Stella, Forlenza",https://doi.org/10.3389/fpsyt.2020.578672,20201216.0,Down syndrome; caregiver burden; caregiver distress; coronavirus disease 2019 (COVID-19); mental health; pandemic; psychogeriatrics,PubMed,,,,,,,,,,,,,,False,False,,,,,False,False,False,,2021-01-08
74,"Physical Inactivity Is Associated With Increased Levels of Anxiety, Depression, and Stress in Brazilians During the COVID-19 Pandemic: A Cross-Sectional Study","<b>Objective:</b> To evaluate the levels of anxiety, depression, and stress associated with the practice of physical exercise (PE) during pandemic by COVID-19. <b>Methods:</b> This study has a cross-sectional characteristic and was carried out between May 12 and 14, 2020. An online questionnaire was applied with questions to assess sociodemographic characteristics and physical exercise during the CoVID-19 pandemic, in addition to depression, anxiety, and stress analysis. The study was approved by the local ethics committee (CAAE: 31521720.8.0000.5082). <b>Results:</b> One thousand one hundred and fifty four answered the questionnaire (69.84% female). During the isolation period, the number of participants who declared not to exercise was 54.16%. Women generaly presented higher levels of anxiety, depression, and stress when compared to men (<i>p</i> &lt; 0.0001 for all domains). The risk of having increased anxiety were 118% higher (OR = 2.183; 95% CI = 1.717-2.775), the risk of depression was 152% higher (OR = 2.525; 95% CI = 1.991-3.205), and the risk of stress symptoms increased 75.1% (OR = 1.751; 95% CI = 1.386-2.213) in the participants who did not perform PE when compared to those who maintain regular PE. <b>Conclusion:</b> People who was not involved with PE during the COVID-19 pandemic had higher anxiety, depression, and stress scores. Based on this, it seems important to advise people to continue PE, following all the recommendations of preventive measures of the pertinent health organizations.","Silva, Seguro, de Oliveira, Santos, de Oliveira, de Souza Filho, de Paula JÃºnior, Gentil, Rebelo",https://doi.org/10.3389/fpsyt.2020.565291,20201216.0,COVID-19; anxiety; depression; mental health; pandemic; physical exercise; physical inactivity; stress,PubMed,,,,,,,,,,,,,,False,False,,,,,False,False,False,,2021-01-08
75,"Corrigendum to &quot;Prevalence of depression, anxiety, and insomnia among healthcare workers during the COVID-19 pandemic: A systematic review and meta-analysis&quot; [Brain Behav Immun 88 (2020) 901-907]",,"Pappa, Ntella, Giannakas, Giannakoulis, Papoutsi, Katsaounou",https://doi.org/10.1016/j.bbi.2020.11.023,20201214.0,,PubMed,,,,,,,,,,,,,,False,False,,,,,False,False,False,,2021-01-08
76,Home Dialysis in the Coronavirus Disease 2019 Era,"The coronavirus disease 2019 pandemic has had a significant impact on patients with end-stage kidney disease and their care, especially given the potential for severe coronavirus disease 2019 in those with a depressed immune status. Patients receiving in-center hemodialysis have been particularly affected by this pandemic because of their need to travel multiple times a week to receive treatment. Although patients on home dialysis are able to avoid such exposure, they face their own unique challenges. In this review, we will discuss the challenges posed by the coronavirus disease 2019 pandemic for patients on home dialysis, the impact of coronavirus disease 2019 on various aspects of their care, and the resultant rapid adaptations in policy/health-care delivery mechanisms with implications for the future care of patients on home dialysis.","Yerram, Misra",https://doi.org/10.1053/j.ackd.2020.07.001,20210104.0,"COVID-19; Home dialysis; Home hemodialysis; Peritoneal dialysis; Remote monitoring; Telehealth; COVID-19; Centers for Medicare and Medicaid Services, U.S.; Delivery of Health Care; Health Policy; Hemodialysis Solutions; Hemodialysis, Home; Humans; Kidney Failure, Chronic; Kidneys, Artificial; Monitoring, Ambulatory; Peritoneal Dialysis; Peritoneal Dialysis, Continuous Ambulatory; SARS-CoV-2; Telemedicine; United States",PubMed,,,,,,,,,,,,,,False,False,,,,,False,False,False,,2021-01-08
77,Healthy Dietary Intake Behavior Potentially Modifies the Negative Effect of COVID-19 Lockdown on Depression: A Hospital and Health Center Survey,"<b>Background:</b> The COVID-19 pandemic causes a huge burden for affected countries. Several public health interventions were applied to contain the infection. However, the pandemic itself and the lockdown measure negatively influence people's lifestyles and psychological health. <b>Purpose:</b> To explore determinants of healthy dietary intake and depression, and examine the interaction between healthy dietary intake and COVID-19 lockdown on depression. <b>Methods:</b> A cross-sectional study was conducted at 18 hospitals and health centers from February 14 to May 31, 2020. Data of 8,291 outpatients were collected including patients' characteristics, clinical parameters, health literacy, healthy dietary intake (using the healthy eating score, HES), other health-related behaviors, and depression (using the patient health questionnaire, PHQ). Depression was defined as PHQ score â‰¥ 10. <b>Results:</b> Protective factors of healthy dietary intake and depression were higher education, better medication payment ability, higher social status, more physical activity, and higher health literacy, whereas older age, ever married, own business or other types of occupation, lockdown, suspected COVID-19 symptoms, and comorbidity were associated with lower HES scores and a higher depression likelihood. Besides, overweight/obesity and alcohol drinking were associated with lower HES scores. As compared with patients not under lockdown and with lowest HES score, those who were under lockdown and with lowest HES score had 10.6 times higher depression likelihood (odds ratio, OR, 10.60; 95% CI 6.88, 16.32; <i>p</i> &lt; 0.001), whereas people with higher HES score had 15% lower depression likelihood (OR 0.85; 95% CI 0.82, 0.89; <i>p</i> &lt; 0.001). <b>Conclusions:</b> Healthy dietary intake and depression were determined by several sociodemographic, clinical, and behavioral factors. Lockdown measure affects people's dietary intake behavior and depression. Importantly, healthy dietary intake potentially modifies the negative effect of lockdown on depression.","Pham, Pham, Phan, Tran, Nguyen, Nguyen, Nguyen, Ha, Dao, Nguyen, Trinh, Do, Nguyen, Nguyen, Nguyen, Tran, Tran, Duong, Nguyen, Do, Vo, Do, Duong, Pham, Le, Do, Nguyen, Mai, Ha, Ngo, Nguyen, Yang, Chao, Duong",https://doi.org/10.3389/fnut.2020.581043,20201212.0,COVID-19; comorbidity; coronavirus; healthy eating; lockdown; obesity; physical activity; psychological,PubMed,,,,,,,,,,,,,,False,False,,,,,False,False,False,,2021-01-08
78,Poor Sleep Quality and Its Consequences on Mental Health During the COVID-19 Lockdown in Italy,"Coronavirus disease 2019 (COVID-19) seriously affected the whole of Italy. The extreme virulence and the speed of propagation resulted in restrictions and home confinement. This change was immediately perceived by people who found themselves exposed to feelings of uncertainty, fear, anger, stress, and a drastic change in the diurnal but above all nocturnal lifestyle. For these reasons, we aimed to study the quality of sleep and its connection to distress levels and to evaluate how lifestyle changed in the Italian population during the lockdown. By means of an Internet survey we recruited 6,519 adults during the whole of the COVID-19 lockdown (from March 10-1st phase to May 4-2nd phase). We investigated the sociodemographic and COVID-19-related information and assessed sleep quality using the Medical Outcomes Study-sleep scale (MOS-SS) and mental health with the short form of Depression, Anxiety, and Stress Scales-21 Items (DASS-21). Multiple logistic regression model was used to evaluate the multivariate association between the dependent variable (good sleeper vs. poor sleeper) and all the variables that were significant in the univariate analysis. A total of 3,562 (55.32%) participants reported poor sleep quality according to the MOS-Sleep Index II score. The multiple binary logistic regression results of poor sleepers revealed several risk factors during the outbreak restrictions: female gender, living in Central Italy, having someone close who died because of COVID-19, markedly changed sleep-wake rhythms characterized by earlier or postponed habitual bedtime, earlier habitual awakening time and reduced number of afternoon naps, and extremely severe levels of stress, anxiety, and depression. This is the first study designed to understand sleep quality and sleep habits during the whole of the lockdown period in the Italian population that provides more than 6,000 participants in a survey developed specifically for the health emergency related to COVID-19. Our study found that more than half of the Italian population had impaired sleep quality and sleep habits due to elevated psychological distress during the COVID-19 lockdown containment measures. A multidisciplinary action should be undertaken in order to plan appropriate responses to the current crisis caused by the lockdown for the COVID-19 outbreak.","Franceschini, Musetti, Zenesini, Palagini, Scarpelli, Quattropani, Lenzo, Freda, Lemmo, Vegni, Borghi, Saita, Cattivelli, De Gennaro, Plazzi, Riemann, Castelnuovo",https://doi.org/10.3389/fpsyg.2020.574475,20201212.0,COVID-19; Italian lockdown; anxiety; clinical psychology; depression; sleep habits; sleep quality; stress,PubMed,,,,,,,,,,,,,,False,False,,,,,False,False,False,,2021-01-08
