,title,abstract,authors,link,date,subject,source,initial_decision,q0,q1,q2,q3,q4,q5,q6,q7,q8,q9,q10,q11,q12,q13,q14,q15,q16,q17,q18,q19,q20,exclusion_reason,extraction_date
86,Psychological outcome of COVID-19 pandemic How can we prepare for a psychodemic crisis?; A COVID-19-pandémia mentálhigiénés következményei Hogyan tudunk felkészülni a pszichodémiás krízisre?,"Összefoglaló. Az elmúlt hónapokban életünket alapvetoen megváltoztatta a COVID-19-pandémia, melynek egészségügyi, gazdasági és társadalmi hatásai egyelore szinte felbecsülhetetlenek. A vírusfertozés akut következményei mellett egyre több adat bizonyítja a teljes népességre kifejtett hatásait: a pszichológiai distressz, a depressziós és szorongásos tünetek, valamint az addiktív viselkedésformák gyakoriságának növekedését. Az is nagyon fontos kérdés, hogy a globális válsághelyzet hogyan befolyásolja az öngyilkossági arányszámokat. Írásomban az elmúlt idoszak legjelentosebb pszichiátriai szakirodalma alapján foglalom össze a vírusfertozés akut és krónikus hatásait, valamint a járványhelyzet általános és specifikus pszichológiai-pszichopatológiai következményeit, kiemelt figyelmet fordítva a suicidiumrizikóra és a leginkább veszélyeztetett csoportokra. A vizsgálatok arra utalnak, hogy a pandémia következtében kialakuló mentális gondok és a suicid viselkedés egyre fontosabb népegészségügyi problémává válnak. Bár napjainkban még a vírusfertozöttek gyógyítása és a fertozés terjedésének lassítása a legfontosabb cél, mindannyiunknak fel kell készülnünk a járvány hosszú távú következményeire. A pandémia várható negatív mentálhigiénés hatásainak megelozésére és enyhítésére általános és specifikus módszerek kidolgozása és alkalmazása szükséges. Ebben az egészségügyi, mentálhigiénés és közösségi ellátórendszerek mellett szerepet kell vállalniuk a politikai és gazdasági döntéshozóknak, a társadalmi szervezeteknek és a média munkatársainak is. Hatékony együttmuködésük kulcsfontosságú az egyéni, közösségi és társadalmi szinten is alkalmazható prevenciós stratégiák megvalósításában, hiszen csak így válik lehetové a súlyosabb mentálhigiénés problémák járványszeru elterjedésének, a ""pszichodémiának"" a megelozése. Orv Hetil. 2021; 162(10): 366-374. Summary. In recent months, our lives have been fundamentally changed by the COVID-19 pandemic, the health, economic, and social impacts of which are almost invaluable for the time being. In addition to the acute consequences of viral infection, more and more data are proving its effects on the entire population: an increase in the incidence of psychological distress, depressive and anxiety symptoms, and addictive behaviours. It is also a very important question, how the global crisis is affecting suicide rates. In my paper, I summarize the acute and chronic effects of viral infection and the general and specific psychological-psychopathological consequences of the epidemic based on the most significant psychiatric literature of the recent period, paying special attention to suicidal risk and the most vulnerable groups. Studies suggest that mental troubles and suicidal behaviour resulting from a pandemic are becoming an increasingly important public health problem. Although the treatment of viral infections and slowing the spread of the infection are still the most important goals today, we all need to be prepared for the long-term consequences of the epidemic. In order to prevent and mitigate the expected negative mental health effects of a pandemic, it is necessary to develop and apply general and specific methods. In addition to health care, mental health and community care systems, political and economic decision-makers, civil society organizations and the media must also play a role. Their effective cooperation is key to the implementation of prevention strategies that can be applied at the individual, community and social levels, as this is the only way to prevent the epidemic spread of more serious mental health problems, the ""psychodemia"". Orv Hetil. 2021; 162(10): 366-374.","Osváth, Péter",https://dx.doi.org/10.1556/650.2021.31141,,"Country: HU; HUNGRIA; HUNGARY; HUNGRIA; Database: MEDLINE; Publication details: Orv Hetil;162(10): 366-374, 2021 03 07.; Publication details: Orv Hetil;162(10): 366-374, 2021 03 07.; Epidemics; Mental Disorders; /psychology; Epidemics/prevention & control; Humans; Mental Disorders/epidemiology; Mental Disorders/prevention & control; Publication type: article",WHO,,,,,,,,,,,,,,False,False,,,,,False,False,False,,2021-03-20
87,Addressing the mental health impact of COVID-19 through population health,"The COVID-19 pandemic has and will continue to result in negative mental health outcomes such as depression, anxiety and traumatic stress in people and populations throughout the world. A population mental health perspective informed by clinical psychology, psychiatry and dissemination and implementation science is ideally suited to address the broad, multi-faceted and long-lasting mental health impact of the pandemic. Informed by a systematic review of the burgeoning empirical research on the COVID-19 pandemic and research on prior coronavirus pandemics, we link pandemic risk factors, negative mental health outcomes and appropriate intervention strategies. We describe how social risk factors and pandemic stressors will contribute to negative mental health outcomes, especially among vulnerable populations. We evaluate the scalability of primary, secondary and tertiary interventions according to mental health target, population, modality, intensity and provider type to provide a unified strategy for meeting population mental health needs. Traditional models, in which evidence-based therapies delivered are delivered in-person, by a trained expert, at a specialty care location have proved difficult to scale. The use of non-traditional models, tailoring preventive interventions to populations based on their needs, and ongoing coordinated evaluation of intervention implementation and effectiveness will be critical to refining our efforts to increase reach.","Boden, Matt; Zimmerman, Lindsey; Azevedo, Kathryn J; Ruzek, Josef I; Gala, Sasha; Abdel Magid, Hoda S; Cohen, Nichole; Walser, Robyn; Mahtani, Naina D; Hoggatt, Katherine J; McLean, Carmen P",https://dx.doi.org/10.1016/j.cpr.2021.102006,,"Country: US; ESTADOS UNIDOS; UNITED STATES; ESTADOS UNIDOS; USA; EUA; US; UNITED STATES OF AMERICA; ESTADOS UNIDOS DA AMERICA; EEUU; Database: MEDLINE; Publication details: Clin Psychol Rev;85: 102006, 2021 Mar 05.; Publication details: Clin Psychol Rev;85: 102006, 2021 Mar 05.; Publication type: article",WHO,,,,,,,,,,,,,,False,False,,,,,False,False,False,,2021-03-20
88,"Does Post-COVID-19 symptoms exist? A longitudinal study of COVID-19 sequelae in Wenzhou, China","OBJECTIVE: We conducted a cohort of tracing discharge patients of COVID-19. MATERIALS AND METHODS: We used the Mann Whitney U test, &#967;² test, or Fisher's exact test to compare differences between age groups and gender groups where appropriate. RESULTS: Our study provides insights into the nature and severity of medical conditions specific to survivors of COVID-19. CONCLUSIONS: It also highlights the potential mental health issues resulting from infectious disease outbreaks within communities.","Zhou, Min; Cai, Jing; Sun, Wenjie; Jing, Wu; Wang, Yidong; Gamber, Michelle; Fan, Lingyan; He, Guiqing",https://dx.doi.org/10.1016/j.amp.2021.03.003,,Country: FR; FRANÇA; FRANCE; FRANCIA; Database: MEDLINE; Publication details: Ann Med Psychol (Paris);2021 Mar 05.; Publication details: Ann Med Psychol (Paris);2021 Mar 05.; Publication type: article,WHO,,,,,,,,,,,,,,False,False,,,,,False,False,False,,2021-03-20
89,LA POLÍTICA ECONÓMICA COMO CATALIZADOR DE LAS CRISIS,"La política económica convencional que se mantenido constante para preservar el capitalismo se mantiene también dominante para afrontar la crisis sanitaria y económica generada por la pandemia del Covid-19 y es un catalizador de más graves crisis, además de la naciente depresión económica  Esta política consiste en promover irrestrictamente el crecimiento económico, el gran incremento de la deuda, en beneficiar a los sectores más opulentos y, actualmente, en consolidar una alianza estratégica entre poseedores de activos intangibles (información y conocimiento) y Estados represivos para el control y administración de la pandemia y para el control social Alternate abstract:Conventional economic policy that remains constant to preserve capitalism also remains dominant to face the health and economic crisis generated by the Covid-19 pandemic and is a catalyst for more serious crises, in addition to the nascent economic depression  This policy consists in promoting unrestricted economic growth, the great increase in debt, in benefiting the most affluent sectors and, currently, in consolidating a strategic alliance between holders of intangible assets (information and knowledge) and repressive States for the control and management of the pandemic and for social control","Cante, Freddy",https://www.google.com/search?q=LA+POLÍTICA+ECONÓMICA+COMO+CATALIZADOR+DE+LAS+CRISIS,,"Database: COVIDWHO; Publication details: Ana´lisis Poli´tico;33(100):55-71, 2020.; Publication details: Ana´lisis Poli´tico;33(100):55-71, 2020.; Publication type: article",WHO,,,,,,,,,,,,,,False,False,,,,,False,False,False,,2021-03-20
90,Effect of COVID-19 Quarantine on the Sleep Quality and the Depressive Symptom Levels of University Students in Jordan During the Spring of 2020,Objectives: This study was designed to assess the effect of COVID-19 home quarantine and its lifestyle challenges on the sleep quality and mental health of a large sample of undergraduate University students in Jordan  It is the first study applied to the Jordanian population  The aim was to investigate how quarantine for several weeks changed the students' habits and affected their mental health,"Saadeh, H.; Saadeh, M.; Almobaideen, W.; Al Refaei, A.; Shewaikani, N.; Al Fayez, R. Q.; Khawaldah, H.; Abu-Shanab, S.; Al-Hussaini, M.",https://doi.org/10.3389/fpsyt.2021.605676,,"Database: COVIDWHO; Publication details: Frontiers in psychiatry Frontiers Research Foundation;12:605676, 2021.; Publication details: Frontiers in psychiatry Frontiers Research Foundation;12:605676, 2021.; Publication type: article",WHO,,,,,,,,,,,,,,False,False,,,,,False,False,False,,2021-03-20
91,Les accès psychotiques aigus liés à la pandémie COVID-19,"Résumé Le monde traverse actuellement une période extrêmement stressante à cause de la pandémie du COVID-19  Cette situation exceptionnelle et alarmante pourrait augmenter l’incidence des problèmes de santé mentale, parmi lesquels les troubles psychotiques aigus  Notre observation rapporte deux cas de patients présentant un accès psychotique aigu, avec une thématique délirante en relation avec la pandémie du coronavirus  Les deux patients, qui ne présentaient pas d’antécédents antérieurs de troubles psychiatriques, ont été hospitalisés dans notre service de psychiatrie, après le début du confinement sanitaire obligatoire dans notre pays  La symptomatologie clinique retrouvée était surtout faite d’un syndrome hallucinatoire et d’un syndrome délirant à thématique religieuse, avec des idées délirantes centrées sur le COVID-19  Ce rapport de cas suggère qu’un stress psychosocial intense, provoqué par la crise mondiale actuelle et les mesures de confinement, pourrait constituer un facteur déclenchant de premiers épisodes psychotiques, et avoir un impact sur l’expression clinique et délirante de la psychose aiguë  The world is currently going through an extremely stressful time due to the COVID-19 pandemic  This exceptional and alarming situation could increase the incidence of mental health problems, including acute psychotic disorders  Our observation reports two cases of patients with an acute psychotic episode, with a delusional theme related to the coronavirus pandemic  The two patients, who did not have a previous history of psychiatric disorders, were hospitalized in our psychiatry department, after the start of mandatory sanitary confinement in our country  The clinical symptoms found were mainly a hallucinatory syndrome and a delusional syndrome with a religious theme, and delusional ideas centered on COVID-19  This case report suggests that intense psychosocial stress, caused by the current global crisis and confinement measures, may be a trigger for new-onset psychotic episodes, and impact the clinical and delusional expression of acute psychosis","Doufik, Jalal, Ouhmou, Mina, Bouraoua, Ilham, Laaraj, Hicham, Mouhadi, Khalid, Rammouz, Ismail",https://doi.org/10.1016/j.amp.2021.03.008,,"Database: COVIDWHO; Publication details: Annales Médico-psychologiques, revue psychiatrique;2021.; Publication details: Annales Médico-psychologiques, revue psychiatrique;2021.; Publication type: article",WHO,,,,,,,,,,,,,,False,False,,,,,False,False,False,,2021-03-20
92,Experiences of nursing students under the unprecedented abrupt online learning format forced by the national curfew due to COVID-19: A qualitative research study,"The unprecedented abrupt shift to remote online learning (OL) within the context of the national lockdown due to the 2019 coronavirus disease (COVID-19) highlights the importance of addressing students' preparedness in managing their first experiences with OL. To investigate the experiences of undergraduate nursing students during their first uses of OL to increase the understanding of their encountered opportunities and challenges. A descriptive qualitative design guided by a phenomenological approach was used. The study used a purposive sampling technique to recruit 18 undergraduate nursing students from two universities. Data were collected using two focus group discussions, and the discussions with participants were audio/video recorded through the online platform Zoom due to the national imposed curfew. Content analysis employed Colaizzi's steps to derive the themes/categories. The study revealed four themes: experience of helplessness, burdens, and burnout; the need for social and technical support to manage OL; the propensity to consider OL as a positive opportunity; and the deficiency of OL in fulfilling the educational outcomes of clinical courses. Abrupt remote OL was a challenge to clinical encounters. This format was very stressful; however, it was also useful. The current study highlighted the need for further research on the effectiveness of remote OL platforms in regard to the achievement of the intended learning outcomes of clinical courses.","Suliman, Abu-Moghli, Khalaf, Zumot, Nabolsi",https://doi.org/10.1016/j.nedt.2021.104829,20210319.0,Abrupt online learning; COVID-19; Experience; Jordan; Nursing students,PubMed,,,,,,,,,,,,,,False,False,,,,,False,False,False,,2021-03-20
93,The COVID-19 pandemic has reinforced the need for community mental health-care models in Uganda,,"Mwesiga, Nakasujja, Muhwezi, Musisi",https://doi.org/10.1016/S2215-0366(21)00070-5,20210319.0,,PubMed,,,,,,,,,,,,,,False,False,,,,,False,False,False,,2021-03-20
94,Patients with Chronic Pain Prefer Maintenance of Pain Treatment Despite COVID-19 Pandemic Restrictions,"Worldwide, the COVID-19 pandemic has a significant impact on daily life. First studies describe a negative impact of pandemic stressors even on individuals without previous mental illnesses. The home lockdown and the shutdown of pain clinics make it difficult for all patients to get the healthcare they need. The aim of this study was to investigate to what extent patients with chronic pain felt affected by the pandemic and its consequences on pain treatments, focussing on the beginning of the outbreak. A prospective noninterventional study. Medical University Center . One-hundred and forty-nine patients, suffering from chronic pain, treated at a large German interdisciplinary pain center, were studied over a period of 2 months at the beginning of the pandemic. Data from patient charts and questionnaires were evaluated. Patients were asked about postponements or cancellations of pain therapy, the possible effect on pain levels, depression, anxiety and stress, and the impact of intensified hygiene measures. Results were compared to those from standardized and validated questionnaires from the same patients (German version of the depression, anxiety, and stress scale = DASS) at the time of the first contact in the pain clinic. Eighty-four (56.4%) patients reported cancelled or postponed treatments during the pandemic. Those chronic pain patients with delayed or cancelled treatments reported significantly more pain and psychological distress. The delay or discontinuation of treatments resulted in a deterioration of symptoms. From the patients' point of view this deterioration was unrelated to the timing of treatment and not secondary to increased hygiene measures. In both groups, patients showed a significant amelioration of the DASS values compared to the values they had at the beginning of treatment, despite the negative effects of the COVID-19 pandemic on care structures. The majority of the patients do not think that the quality of pain treatment was significantly affected by the intensified hygiene requirements. The limitations of the study are the small number of patients because of the limitation to a short period of time at the beginning of the pandemic and the return rate of 40.2% of the study consents. Even in the event of a pandemic-related restriction of the care structures, patients with chronic pain benefit from pain therapy. Limitations such as the increased hygiene measures caused by the pandemic were not considered detrimental to the therapeutic measures.","Kleinmann, Abberger, Kieselbach, Wolter",https://www.google.com/search?q=Patients+with+Chronic+Pain+Prefer+Maintenance+of+Pain+Treatment+Despite+COVID-19+Pandemic+Restrictions.,20210319.0, anxiety;  chronic pain;  depression;  hygiene measures;  stress; COVID-19 pandemic,PubMed,,,,,,,,,,,,,,False,False,,,,,False,False,False,,2021-03-20
95,Hospitalizations for suicide attempt during the first COVID-19 lockdown in France,"When the first lockdown was implemented to limit the spread of coronavirus disease 19 (COVID-19), many experts alerted on the potential risk of suicide. Indeed, prolonged social isolation due to the stay-at-home directives has been associated with increased loneliness (1), known to increase suicide risk.","OliÃ©, Nogue, Christine Picot, Courtet",https://doi.org/10.1111/acps.13296,20210319.0,,PubMed,,,,,,,,,,,,,,False,False,,,,,False,False,False,,2021-03-20
96,Measuring Stress in Health Professionals over the Phone using Automatic Speech Analysis during COVID-19 Pandemic: Observational Study,"During the current COVID-19 pandemic, health professionals are directly confronted with the suffering of patients and their families. By making them main actors in the management of this health crisis, they are exposed to various psychosocial risks (stress, trauma, fatigue, etc.). Paradoxically, stress-related symptoms are often underreported in this vulnerable population but are potentially detectable through passive monitoring of changes in speech behavior. This study aims to investigate the use of rapid and remote measures of stress levels in health professionals working during the COVID-19 outbreak. This was done through the analysis of their speech behavior during a short phone call conversation, and in particular a positive, negative and neutral story telling task. Speech samples of 89 healthcare professionals were collected over the phone during a positive, negative and neutral story telling task and various voice features were extracted and compared with classical stress measures via standard questionnaires. Additionally, a regression analysis was performed. Certain speech characteristics correlated with stress levels in both genders; mainly spectral (formant) features as the Mel-frequency cepstral coefficients (MFCC) and prosodic characteristics such as the fundamental frequency (F0) appear sensitive to stress. Overall, for both male and female participants, using vocal features from the positive tasks for regression yielded the most accurate prediction results of stress scores (MAE = 5.31). Automatic speech analysis could help with early detection of subtle signs of stress in vulnerable populations over the phone. Combining the use of this technology with timely intervention strategies, it could contribute to the prevention of burnout as well as the development of co-morbidities such as depression or anxiety.","KÃ¶nig, Riviere, Linz, Elbaum, Fabre, Robert",https://doi.org/10.2196/24191,20210319.0,,PubMed,,,,,,,,,,,,,,False,False,,,,,False,False,False,,2021-03-20
97,Older adults' experiences of technology use for socialization during the COVID-19 pandemic: A regionally representative cross-sectional survey,"Background: Technology has become the most critical approach to maintain social connectedness during the COVID-19 pandemic. Older adults (over age 65) are perceived as most physiologically vulnerable to COVID-19 and at risk of secondary mental health challenges related to social isolation imposed by virus containment strategies. To mitigate concerns regarding sampling bias we used a random sampling of older adults to understand uptake and acceptance of technologies to support socialization during the pandemic. To conduct a population-based assessment of the barriers and facilitators to engaging in technology use for virtual socialization amongst older adults in the Canadian province of British Columbia during the COVID-19 pandemic. We conducted a cross-sectional population-based regionally representative survey using random-digit dialing to participants over age 65 living in British Columbia. Data were analyzed using SPSS, with open-text responses analyzed using thematic analysis. Respondents included 400 older adults with an average age of 72 years old and 63.7% female. Most respondents (89.5%) were aware of how to use technology to connect with others and slightly more than half (56%) reported using technology differently to connect with others during the pandemic. 55.9% of respondents reported adopting new technology since the beginning of the pandemic. Older adults reported key barriers to using technology including: (1) lack of access (including finance, knowledge, and age); (2) lack of interest (including a preference for telephone, and a general lack of interest in computers); and (3) physical barriers (resultant of cognitive impairments, stroke, and arthritis). Older adults reported numerous facilitators, including: (1) knowledge of technologies (whether self-taught or via external courses); (2) reliance on others (family, friends, and general internet searching); (3) technology accessibility (including environments, user-friendly technology, and receiving clear instructions); and (4) social motivation (because everyone else is doing it). Much data on older adults use of technology is limited by sampling biases, but the current study that used random sampling demonstrated that older adults used technology to mitigate social isolation during the pandemic. Virtual socialization is most promising to mitigate potential mental health effects related to virus containment strategies. Addressing barriers by mobilizing telephone training and task lists, and mobilizing facilitators described by participants such as facilitated socialization activities are important strategies that can be implemented within and beyond the pandemic to bolster the mental health needs of older adults.","Haase, Cosco, Kervin, Riadi, O'Connell",https://doi.org/10.2196/28010,20210319.0,,PubMed,,,,,,,,,,,,,,False,False,,,,,False,False,False,,2021-03-20
98,Factors Associated with Anxiety and Quality of Life of the Wuhan Populace during the COVID-19 Pandemic,"In December 2019, COVID-19 broke out in Wuhan, China, affecting the mental health and quality of life (QoL) of its inhabitants. This study aimed at investigating the factors associated with anxiety and QoL in the Wuhan populace during the COVID-19 pandemic. An online questionnaire survey was carried out during July 6-10, 2020. The questionnaire collected information on demography, anxiety, QoL, and social-environmental support. The main statistical methods included descriptive statistics, independent-samples t-test, one-way analysis of variance, and multivariate regression analysis. In total, 226 participants were recruited. The findings showed that females, elderly, middle-income, poor health status, shortage of medical supplies, and insufficient basic commodities were associated with anxiety significantly. Multiple regression analysis indicated that social-environmental support was significantly related to anxiety. Higher social-environmental support was significantly associated with a higher QoL. Our findings showed that the social-environmental support may reduce anxiety and improve the quality of life for those living in an area heavily affected by the pandemic. This article is protected by copyright. All rights reserved.","Liu, Lee, Lin, Yang",https://doi.org/10.1002/smi.3040,20210319.0,COVID-19; anxiety; quality of life; social-environmental support,PubMed,,,,,,,,,,,,,,False,False,,,,,False,False,False,,2021-03-20
