,title,abstract,authors,link,date,subject,source,initial_decision,q0,q1,q2,q3,q4,q5,q6,q7,q8,q9,q10,q11,q12,q13,q14,q15,q16,q17,q18,q19,q20,exclusion_reason,extraction_date
196,Identification of Functional Limitations and Discharge Destination in Patients With COVID-19,"The objectives of this study were to identify functional limitations in patients with coronavirus 2019 (COVID-19) admitted to acute care hospitals; to evaluate functional limitations by demographic, medical, and encounter characteristics; and to examine functional limitations in relation to discharge destination. and Setting:This is a cross-sectional, retrospective study of adult patients with COVID-19 who were discharged from 2 different types of hospitals (academic medical center and a community hospital) within 1 health care system from January 1 to April 30,Â 2020. Patients were identified from the Cedars-Sinai COVID-19 data registry who had a new-onset positive test for severe acute respiratory syndrome coronavirus 2. A total of 273 patients were identified, which included 230 patients who were discharged alive and 43 patients who died and were excluded from the study sample. Not applicable. Functional limitations in patients with COVID-19 in acute care hospitals and the predictors for discharge disposition. A total of 230 records were analyzed including demographic, encounter, medical, and functional variables. In a propensity score-matched cohort based on age and comorbidity, 88.2% had functional physical health deficits, 72.5% had functional mental health deficits, and 17.6% experienced sensory deficits. In the matched cohort, individuals discharged to an institution experienced greater physical (62.7% vs 25.5%, P&lt;.001) and mental health (49.0% vs 23.5%, P=.006) deficits than patients discharged home. Marital status (odds ratio, 3.17; P=.011) and physical function deficits (odds ratio, 3.63; P=.025) were associated with an increase odds ratio of discharge to an institution. This research highlights that functional status is a strong predictor for discharge destination to an institution for patients with COVID-19. Patients who were older, in the acute care hospital longer, and with comorbidities were more likely to be discharged to an institution. Rehabilitation is a significant aspect of the health care system for these vulnerable patients. The challenges of adjusting the role of rehabilitation providers and systems during the pandemic needs further exploration. Moreover, additional research is needed to look more closely at the many facets and timing of functional status needs, to shed light in use of interdisciplinary rehabilitation services, and to guide providers and health care systems in facilitating optimal recovery and patient outcomes.","Roberts, Wertheimer, Park, NuÃ±o, Riggs",https://doi.org/10.1016/j.apmr.2020.11.005,20210308.0,"COVID-19; Rehabilitation; Academic Medical Centers; Aged; Aged, 80 and over; COVID-19; Cross-Sectional Studies; Female; Hospitals, Community; Humans; Male; Middle Aged; Odds Ratio; Patient Discharge; Physical Functional Performance; Propensity Score; Recovery of Function; Registries; Rehabilitation Centers; Retrospective Studies; SARS-CoV-2",PubMed,,,,,,,,,,,,,,False,False,,,,,False,False,False,,2021-03-20
197,Retraction notice to &quot;Chinese mental health burden during the COVID-19 pandemic&quot; [Asian J Psychiatr 51 (2020) 102052],,"Huang, Zhao",https://doi.org/10.1016/j.ajp.2020.102482,20201214.0,,PubMed,,,,,,,,,,,,,,False,False,,,,,False,False,False,,2021-03-20
198,Burnout and Associated Factors Among Health Care Workers in Singapore During the COVID-19 Pandemic,"The strain on health care systems due to the COVID-19 pandemic has led to increased psychological distress among health care workers (HCWs). As this global crisis continues with little signs of abatement, we examine burnout and associated factors among HCWs. Cross-sectional survey study. Doctors, nurses, allied health professionals, administrative, and support staff in 4 public hospitals and 1 primary care service in Singapore 3Â months after COVID-19 was declared a global pandemic. Study questionnaire captured demographic and workplace environment information and comprised 3 validated instruments, namely the Oldenburg Burnout Inventory (OLBI), Safety Attitudes Questionnaire (SAQ), and Hospital Anxiety and Depression Scale (HADS). Multivariate mixed model regression analyses were used to evaluate independent associations of mean OLBI-Disengagement and -Exhaustion scores. Further subgroup analysis was performed among redeployed HCWs. Among 11,286 invited HCWs, 3075 valid responses were received, giving an overall response rate of 27.2%. Mean OLBI scores were 2.38 and 2.50 for Disengagement and Exhaustion, respectively. Burnout thresholds in Disengagement and Exhaustion were met by 79.7% and 75.3% of respondents, respectively. On multivariate regression analysis, Chinese or Malay ethnicity, HADS anxiety or depression scores â‰¥8, shifts lasting â‰¥8Â hours, and being redeployed were significantly associated with higher OLBI mean scores, whereas high SAQ scores were significantly associated with lower scores. Among redeployed HCWs, those redeployed to high-risk areas in a different facility (offsite) had lower burnout scores than those redeployed within their own work facility (onsite). A higher proportion of HCWs redeployed offsite assessed their training to be good or better compared with those redeployed onsite. Every level of the health care workforce is susceptible to high levels of burnout during this pandemic. Modifiable workplace factors include adequate training, avoiding prolonged shifts â‰¥8Â hours, and promoting safe working environments. Mitigating strategies should target every level of the health care workforce, including frontline and nonfrontline staff. Addressing and ameliorating burnout among HCWs should be a key priority for the sustainment of efforts to care for patients in the face of a prolonged pandemic.","Tan, Kanneganti, Lim, Tan, Chua, Tan, Sia, Denning, Goh, Purkayastha, Kinross, Sim, Chan, Ooi",https://doi.org/10.1016/j.jamda.2020.09.035,20201218.0,"COVID-19; anxiety; burnout; depression; health care workers; pandemic; Adult; Anxiety; Burnout, Professional; COVID-19; Cross-Sectional Studies; Depression; Female; Health Personnel; Humans; Male; Middle Aged; Pandemics; SARS-CoV-2; Singapore; Surveys and Questionnaires",PubMed,,,,,,,,,,,,,,False,False,,,,,False,False,False,,2021-03-20
199,&quot;The psychological impact of COVID-19 on medical education of final year students in Pakistan: A cross-sectional study&quot;,"COVID-19 pandemic has resulted in a strong impact on students' wellbeing, with associated uncertainty about the future. We conducted a cross-sectional survey to assess the psychological effects of COVID-19 on the medical education of final year students in Pakistan. We conducted prospective, cross-sectional survey, as a snapshot, from June 07, 2020 till June 16, 2020, among final year medical and dental students. The 20-questions survey questionnaire was based on rating-scale items to focus on psychological symptoms, institutional preparedness for such crisis and confidence in becoming a future doctor. Descriptive statistics were calculated using Multivariate regression analysis. Majority of participants (nâ€¯=â€¯1753/2661, 65.9%) were female. Despite timely closure of institutes, delay in the start of the online teaching (beta coefficient 0.08, P-value 0.02) was significantly correlated with the depressive symptoms. A significant percentage of students (nâ€¯=â€¯1594, 59.9%) wanted a delay in exit exams due to intimidation. A similar proportion of students also lost confidence to be a competent doctor in future which was positively associated with male gender (beta coefficient 0.21, P-valueâ€¯&lt;â€¯0.001). Our study shows that COVID-19 pandemic has brought significant psychological influence on the medical education of final year students. Despite a stressful crisis, final year medical and dental students are still willing to serve the community. In addition to supporting their emotions and psychological wellbeing, stress counselling, and transforming current medical curricula is crucial to pursue ceaseless medical education and to become a safe future doctor.","Dhahri, Arain, Memon, Rao, Mian, Khan, Hafeez, Dhahri, Mustafa, Malhi, Iqbal, Ahmad, Aziz, Arain, Nankani, Hussain, Kausar, Saqlain, Chawla, Azhar, Haneef, Arain, Arain, Shahid, Iqbal, Mughal, Awan, Mehbub, Qiam, Abro, Khattak, Bhatti, Choudhary, Khan, Baqai, Afzal, Dhahri, Dhahri, Ghufran, Umbrin, Shehdio, Shaikh, Dhahri, Memon, Yousufzai, Kumar, Ilyas, Chaudhary, Nawaz, Bilal, Faraz, Chawla, Shaikh",https://doi.org/10.1016/j.amsu.2020.11.025,20210127.0,,PubMed,,,,,,,,,,,,,,False,False,,,,,False,False,False,,2021-03-20
200,"Young people, mental health and COVID-19 infection: the canaries we put in the coal mine","The number of people testing positive for Severe acute respiratory syndrome coronavirus 2 (SARS-COV-2) in the UK, particularly among young adults, is increasing. We report here on the mental health of young adults and related psychological and behavioural responses to the pandemic and consider the role of these factors in fuelling the increase in coronavirus disease 2019 (COVID-19) in this group. An online survey was completed during the first six weeks of the first UK-wide lockdown by 3097 respondents, including data for 364 respondents aged 18-24 years. The survey included measures of mental health and indices capturing related psychological and behavioural responses to the pandemic. The mental health of 18- to 24-years-olds in the first 6 weeks of lockdown was significantly poorer than that of older respondents and previously published norms: with 84% reporting symptoms of depression and 72% reporting symptoms of anxiety. Young adults also reported significantly greater loneliness and reduced positive mood, both of which were also associated with greater mental health difficulties. We contend that the combination of mental health, social and economic considerations may have contributed to the rise of COVID-19 infections in young adults, and ascribing blame to this group will not aid our efforts to regain control of the disease.","Jia, Ayling, Chalder, Massey, Broadbent, Morling, Coupland, Vedhara",https://doi.org/10.1016/j.puhe.2020.10.018,20210101.0,Behaviour; COVID-19; Mental health; Young people; Adolescent; Adolescent Behavior; Anxiety; Anxiety Disorders; COVID-19; Communicable Disease Control; Depression; Female; Humans; Loneliness; Male; Mental Health; SARS-CoV-2; Surveys and Questionnaires; United Kingdom; Young Adult,PubMed,,,,,,,,,,,,,,False,False,,,,,False,False,False,,2021-03-20
201,Predictors of managers' mental health during the COVID-19 pandemic,"This study reports early evidence of managers' mental health and its predictors during the Coronavirus disease 2019 (COVID-19) pandemic in May 2020. In a sample of 646 managers from 49 countries, 5.3% (32) of managers reached the cut-off levels for disorders in distress (Kessler Psychological Distress Scale-6; K-6), 7.3% (38) experienced anxiety (General Anxiety Disorder-7; GAD-7), and 10.7% (56) had depression (Patient Health Questionnaire-9; PHQ-9). Age, relative income, and work status each predicted at least one of the conditions. Managers' 'illegitimate tasks' caused by COVID-19 predicted all three. Particularly noteworthy is the finding that the degree of downsizing an organization experienced during COVID-19 significantly predicted distress, anxiety, and depression for managers at the highest level (board members) only. This study helps identify managers in need of healthcare services as the COVID-19 pandemic affects organizations and their managers around the world. Este estudio informa sobre evidencia temprana en salud mental de los gerentes y sus predictores durante la pandemia de la enfermedad del coronavirus 2019 (COVID-19) en mayo de 2020. En una muestra de 646 gerentes de 49 paÃ­ses, el 5.3% (32) de los gerentes alcanzaron niveles de punto de corte para trastornos en angustia (escala de angustia PsicolÃ³gica de Kessler-6; K-6), el 7,3% (38) experimentÃ³ ansiedad (Trastorno de ansiedad generalizado-7; GAD-7) y el 10,7% (56) tenÃ­a depresiÃ³n (Cuestionario de salud del paciente- 9; PHQ-9). La edad, los ingresos relativos y la situaciÃ³n laboral predijeron por si solos al menos una de las condiciones. Las â€˜tareas ilegÃ­timasâ€™ de los gerentes causadas por COVID-19 predijeron las tres. Particularmente digno de menciÃ³n es el hallazgo de que el grado de reducciÃ³n que experimentÃ³ una organizaciÃ³n durante el COVID-19 predijo significativamente angustia, ansiedad y depresiÃ³n solo para los gerentes del mÃ¡s alto nivel (miembros del directorio). Este estudio ayuda a identificar a los gerentes que necesitan servicios de atenciÃ³n mÃ©dica, ya que la pandemia de COVID-19 afecta a las organizaciones y sus gerentes en todo el mundo. æœ¬ç ”ç©¶æŠ¥å‘Šäº†2020å¹´5æœˆçš„2019å¹´æ–°åž‹å† çŠ¶ç—…æ¯’è‚ºç‚Ž (COVID-19) ç–«æƒ…æœŸé—´ç®¡ç†è€…å¿ƒç†å¥åº·åŠå…¶é¢„æµ‹å› ç´ çš„æ—©æœŸè¯æ®ã€‚åœ¨æ¥è‡ª49ä¸ªå›½å®¶çš„646åç®¡ç†è€…ä¸­, 5.3ï¼… (32) åç®¡ç†è€…è¾¾åˆ°äº†å¿ƒç†å›°æ‰°å˜ä¸ºéšœç¢çš„ä¸´ç•Œæ°´å¹³ (å‡¯æ–¯å‹’å¿ƒç†å›°æ‰°é‡è¡¨6; K-6), 7.3ï¼… (38) ç»åŽ†è¿‡ç„¦è™‘ (å¹¿æ³›æ€§ç„¦è™‘éšœç¢é‡è¡¨7; GAD-7) å’Œ10.7ï¼… (56) æœ‰è¿‡æŠ‘éƒ (æ‚£è€…å¥åº·é—®å·- 9; PHQ-9) ã€‚å¹´é¾„, ç›¸å¯¹æ”¶å…¥å’Œå·¥ä½œçŠ¶æ€å‡è‡³å°‘é¢„æµ‹å…¶ä¸­ä¸€ç§æƒ…å†µã€‚ç”±COVID-19å¼•èµ·çš„ç®¡ç†è€…çš„â€˜éžæ³•ä»»åŠ¡â€™é¢„æµ‹äº†è¿™ä¸‰ä¸ªæ–¹é¢ã€‚ç‰¹åˆ«å€¼å¾—æ³¨æ„çš„å‘çŽ°æ˜¯, åœ¨COVID-19æœŸé—´ä½“éªŒåˆ°çš„ç»„ç»‡è£å‘˜ç¨‹åº¦ä»…æ˜¾è‘—é¢„æµ‹äº†æœ€é«˜å±‚ç®¡ç†è€… (è‘£äº‹ä¼šæˆå‘˜) çš„å¿ƒç†å›°æ‰°, ç„¦è™‘å’Œæ²®ä¸§ã€‚æœ¬ç ”ç©¶æœ‰åŠ©äºŽè¯†åˆ«å‡ºCOVID-19ç–«æƒ…åœ¨å…¨çƒèŒƒå›´å†…å½±å“åˆ°ç»„ç»‡åŠå…¶ç®¡ç†äººå‘˜æ—¶, éœ€è¦åŒ»ç–—ä¿å¥æœåŠ¡çš„ç®¡ç†è€…ã€‚.","Graf-Vlachy, Sun, Zhang",https://doi.org/10.1080/20008198.2020.1834195,20201128.0,2019-nCoV; Corporate managers; downsizing; epidemic; executives; psychiatric screening; risk factors,PubMed,,,,,,,,,,,,,,False,False,,,,,False,False,False,,2021-03-20
202,Author reply - Letter to the editor &quot;The challenges of quantifying the psychological burden of COVID-19 on heathcare workers&quot;,,"Pappa, Giannakoulis, Papoutsi, Katsaounou",https://doi.org/10.1016/j.bbi.2020.11.025,20210225.0,Anxiety; Covid-19; Depression; Healthcare workers; Insomnia; Anxiety; Benchmarking; COVID-19; Health Personnel; Humans; SARS-CoV-2,PubMed,,,,,,,,,,,,,,False,False,,,,,False,False,False,,2021-03-20
203,A Digital Program (Hope) for People Living With Cancer During the COVID-19 Pandemic: Protocol for a Feasibility Randomized Controlled Trial,"During the COVID-19 lockdown period in the United Kingdom that began on March 23, 2020, more than a quarter of a million people with cancer reported worsening mental health. Help to Overcome Problems Effectively (Hope) is a self-management program for people with cancer, designed to provide support for distress, unmet needs, and poor psychological health. In light of social distancing during the COVID-19 pandemic, digital delivery of the Hope Programme has become ever more vital for people with cancer. Previous pre-post studies of the digital Hope Programme have found reduced anxiety and depression and improved well-being for people with cancer. However, evaluation of this evidence has been limited by the lack of a control group in these previous studies. We now present a protocol for a feasibility randomized controlled trial of the digital Hope Programme for people with cancer during the COVID-19 pandemic. Primary outcomes will be recruitment, dropout, and adherence rates, and estimations of sample and effect size. To detect signals of efficacy, secondary outcomes will be participant mental health and well-being. Participants will be recruited by Macmillan Cancer Support (MCS) through their social media networks. The study will employ a feasibility wait-list randomized controlled trial (RCT) design, with people with cancer being randomized to join the digital Hope Programme immediately (intervention group [IG]) or join a 6-week waiting list (wait-list control group [WLCG]) with a 1:1 allocation ratio. Participants will complete digital measures of depression, anxiety, mental well-being, and confidence in managing their own health. Online questionnaires will be administered preprogram and 6 weeks postprogram. All people who had requested access to the Hope Programme from MCS (N=61) will be invited to participate in the trial. Baseline data collection commenced in April 2020, and the Hope Programme began for the IG in May 2020 and for the WLCG in June 2020. Postprogram data collection was completed by the end of August 2020. This feasibility study will provide data to inform the design of a future definitive trial. Wider-scale provision of the digital Hope Programme has potential to improve the lives of thousands of people with cancer and reduce the burden on health care providers during these unprecedented times. ISRCTN Registry ISRCTN79623250; http://www.isrctn.com/ISRCTN79623250. DERR1-10.2196/24264.","Wright, Martin, Clyne, Clark, McGillion, Matouskova, Turner",https://doi.org/10.2196/24264,20201212.0,COVID-19; cancer; digital health; feasibility; intervention; protocol; randomized controlled trial; self-management; survivorship,PubMed,,,,,,,,,,,,,,False,False,,,,,False,False,False,,2021-03-20
204,Infectious Diseases and Advocacy: This Is our Lane,"The disparate effects of severe acute respiratory syndrome coronavirus 2 virus on communities of color, paired with disjointed federal and local responses to the pandemic and the ongoing examples of structural racism's effects on health, highlight the need for physician advocacy on behalf of patients. The job of infectious disease physicians has always involved caring for the &quot;whole patient,&quot; but the need for advocacy around issues related to racism, housing, food insecurity, substance use disorders, and mental health has increased. Advocacy at all levels-local, regional, and national-can make a difference and be a profoundly rewarding part of the career of an infectious disease/HIV physician.",Person,https://doi.org/10.1093/ofid/ofaa510,20201125.0,COVID-19; HIV; advocacy; health disparities; racism,PubMed,,,,,,,,,,,,,,False,False,,,,,False,False,False,,2021-03-20
205,Mental health before and during the COVID-19 pandemic in two longitudinal UK population cohorts,"The COVID-19 pandemic and mitigation measures are likely to have a marked effect on mental health. It is important to use longitudinal data to improve inferences. To quantify the prevalence of depression, anxiety and mental well-being before and during the COVID-19 pandemic. Also, to identify groups at risk of depression and/or anxiety during the pandemic. Data were from the Avon Longitudinal Study of Parents and Children (ALSPAC) index generation (n = 2850, mean age 28 years) and parent generation (n = 3720, mean age 59 years), and Generation Scotland (n = 4233, mean age 59 years). Depression was measured with the Short Mood and Feelings Questionnaire in ALSPAC and the Patient Health Questionnaire-9 in Generation Scotland. Anxiety and mental well-being were measured with the Generalised Anxiety Disorder Assessment-7 and the Short Warwick Edinburgh Mental Wellbeing Scale. Depression during the pandemic was similar to pre-pandemic levels in the ALSPAC index generation, but those experiencing anxiety had almost doubled, at 24% (95% CI 23-26%) compared with a pre-pandemic level of 13% (95% CI 12-14%). In both studies, anxiety and depression during the pandemic was greater in younger members, women, those with pre-existing mental/physical health conditions and individuals in socioeconomic adversity, even when controlling for pre-pandemic anxiety and depression. These results provide evidence for increased anxiety in young people that is coincident with the pandemic. Specific groups are at elevated risk of depression and anxiety during the COVID-19 pandemic. This is important for planning current mental health provisions and for long-term impact beyond this pandemic.","Kwong, Pearson, Adams, Northstone, Tilling, Smith, Fawns-Ritchie, Bould, Warne, Zammit, Gunnell, Moran, Micali, Reichenberg, Hickman, Rai, Haworth, Campbell, Altschul, Flaig, McIntosh, Lawlor, Porteous, Timpson",https://doi.org/10.1192/bjp.2020.242,20210317.0,ALSPAC; COVID-19; anxiety disorders; depressive disorders; generation Scotland,PubMed,,,,,,,,,,,,,,False,False,,,,,False,False,False,,2021-03-20
206,Suicidal ideation among Bangladeshi university students early during the COVID-19 pandemic: Prevalence estimates and correlates,"Lockdown, social isolation, and interruption of daily life during the COVID-19 period have impacted many lives. University students are particularly vulnerable to such disruptions and may be particularly disposed to suicidal ideation, potentially creating a new public health crisis. This study aimed to assess suicidal ideation and associated factors among university students in Bangladesh during the early stages of the COVID-19 pandemic. A cross-sectional online survey was conducted using the Google form (Google survey tool) from April to May 2020. Initially, 3366 respondents voluntarily completed the survey form. Finally, 3331 surveys were included in the final analyses after removing incomplete surveys. The data ware reviewed, rechecked, and analyzed with SPSS (25.0 version) software. A total of 1979 (59.4%) males and 1352 (40.6%) females participated. Respondents were between the ages of 18 to 28Â years (mean age 21.4Â years [SDÂ =Â 1.9]). The prevalence estimate of suicidal ideation was 12.8%. Potential risk factors included less sleep, excess sleep, cigarette smoking, past suicidal thoughts, suicide attempt history, family history of suicidality, depression, anxiety, and stress. Potential protective factors included being male, having lower SES, living in rural areas, regular physical exercise, and satisfactory study. Suicidal ideation was prevalent among Bangladeshi university students during the onset of the COVID-19 pandemic. Understanding the correlates of suicidal ideation may aid to develop targeted strategies to support students during and after the COVID-19 pandemic.","Tasnim, Islam, Sujan, Sikder, Potenza",https://doi.org/10.1016/j.childyouth.2020.105703,20201215.0,Anxiety; Depression; Stress; Suicidal attempt; Suicidal thoughts,PubMed,,,,,,,,,,,,,,False,False,,,,,False,False,False,,2021-03-20
