,title,abstract,authors,link,date,subject,source,initial_decision,q0,q1,q2,q3,q4,q5,q6,q7,q8,q9,q10,q11,q12,q13,q14,q15,q16,q17,q18,q19,q20,exclusion_reason,extraction_date
54,Mental health care in French correctional facilities during the Covid-19 pandemic,"Objectif En France, les mesures de confinement ont été accompagnées de dispositions spécifiques pour les prisons : suspension des activités, parloirs et interventions extérieures. Plus de dix mille personnes détenues ont en outre été libérées pour diminuer le taux d’occupation des établissements et limiter la propagation du virus. L’objectif de cet article est de décrire la réorganisation des soins psychiatriques en milieu pénitentiaire en contexte de pandémie de Covid-19 et d’interroger les conséquences du confinement et des libérations anticipées sur la santé mentale des personnes détenues. Méthode Ce travail s’appuie sur une enquête menée en avril 2020 auprès des soignants de 42 unités sanitaires en milieu pénitentiaire et des 9 unités hospitalières spécialement aménagées en France. Une synthèse de la littérature internationale sur la question des soins psychiatriques en milieu pénitentiaire durant l’épidémie de Covid-19 a également été réalisée. Résultats L’épidémie de Covid-19 semble avoir été plutôt contenue dans les prisons françaises au cours de la période de confinement mais le poids des mesures mises en place sur la population carcérale est important. Les 3 niveaux de soins psychiatriques en milieu pénitentiaire ont instauré des mesures spécifiques pour assurer la continuité des soins, accompagner les personnes incarcérées et contenir l’épidémie. Parmi les plus importantes, on note la restriction des consultations, la création de « secteurs Covid », la déprogrammation des hospitalisations non urgentes, le renforcement des mesures d’hygiène et le remaniement des effectifs. Actuellement, les soignants sont principalement confrontés à des sevrages forcés, des symptomatologies anxieuses et des décompensations de troubles psychiatriques chroniques. Certaines libérations anticipées sont aussi très préoccupantes, pouvant entraîner des ruptures de soins, par manque de préparation des relais de prise en charge. Discussion Les remaniements en lien avec le confinement donnent une visibilité accrue au fossé qui sépare la psychiatrie en milieu libre de la psychiatrie en milieu pénitentiaire. Il nous apparaît important de rappeler la vulnérabilité des personnes incarcérées qui doivent impérativement être considérées dans les politiques de santé publique. Objective The impact of the Covid-19 pandemic on the 11 million people currently incarcerated worldwide is the subject of many concerns. Prisons and jails are filled with people suffering from many preexisting medical conditions increasing the risk of complications. Detainees’ access to medical services is already limited and overcrowding poses a threat of massive contagion. Beyond the health impact of the crisis, the tightening of prison conditions worries. On March 16, 2020, in France, the lockdown measures have been accompanied by specific provisions for prisons: all facilities have suspended visitations, group activities and external interventions. Over 10,000 prisoners have been released to reduce the prison population and the risk of virus propagation. These adjustments had major consequences on the healthcare system in French prisons. The objectives of this article are to describe the reorganization of the three levels of psychiatric care for inmates in France in the context of Covid-19 pandemic and to have a look at the impact of lockdown measures and early releases on mental health of prisoners. Methods This work is based on a survey conducted in April 2020 in France among psychiatric healthcare providers working in 42 ambulatory units for inmates and in the 9 full-time inpatient psychiatric wards exclusively for inmates called “UHSAs” (which stands for “unités hospitalières spécialement aménagées”, and can be translated as “specially equipped hospital units”). A review of the international literature on mental healthcare system for inmates during the Covid-19 epidemic has also been performed. Results The Covid-19 epidemic has been rather contained during the period of confinement in French prisons but the impact of confinement measures on the prison population is significant. The three levels of psychiatric care for inmates have implemented specific measures to ensure continuity of care, to support detainees during Coronavirus lockdown and to prevent an infection's spread. Among the most important are: limitation of medical consultations to serious and urgent cases, creation of “Covid units”, cancellation of voluntary psychiatric hospitalizations, reinforcement of preventive hygiene measures and reshuffling of medical staff. Prolonged confinement has consequences on mental health of detainees. Currently, mental health workers are facing multiple clinical situations such as forced drug and substance withdrawal (linked to difficulties in supplying psychoactive substances), symptoms of anxiety (due to concerns for their own and their relatives’ well-being) and decompensation among patients with severe psychiatric conditions. Early releases from prison may also raise some issues. People recently released from prison are identified as at high risk of death by suicide and drug overdose. The lack of time to provide the necessary link between health services within prisons and health structures outside could have serious consequences, emphasizing the well-known “revolving prison doors” effect. Discussion The current lockdown measures applied in French jails and prisons point out the disparities between psychiatric care for inmates and psychiatric care for general population. Giving the high vulnerability of prison population, public health authorities should pay more attention to health care in prisons.",,https://doi.org/10.1016/j.encep.2020.05.002,20200601.0,,Scopus,,,,,,,,,,,,,,False,False,,,,,False,False,False,,2020-10-27
55,Ensuring mental health care during the SARS-CoV-2 epidemic in France: A narrative review,"Objectif L’absence de préparation du système de soins psychiatriques à l’épidémie de virus SARS-CoV-2 fait redouter fait redouter un scénario pessimiste pour la santé physique et mentale des patients suivis en psychiatrie. L’objectif de cet article est de proposer des éléments de guidance pour réorganiser les soins psychiatriques dans le contexte de pandémie Covid-19. Méthode Les auteurs ont réalisé une synthèse de la littérature internationale combinée au partage des expériences locales françaises. Résultats Les patients souffrant de troubles psychiques semblent particulièrement vulnérables à ce virus et à la pandémie : vulnérabilités liées aux comorbidités médicales, à l’âge, aux troubles cognitifs qui peuvent entraver le respect des consignes de confinement et aux complications psychosociales. Plusieurs initiatives ont été prises pour assurer la continuité des soins et contenir l’épidémie : création en psychiatrie d’unité Covid+ co-supervisée par des médecins généralistes ou internistes, restriction des consultations aux cas sévères et redéploiement des soins en téléconsultation, accompagnement de type case-management pour les sorties précoces ou l’impossibilité d’hospitaliser, accompagnements spécifiques pour les complications psychiques du confinement. Les populations suivies en pédopsychiatrie, en psychiatrie du sujet âgé, en addictologie ou détenues en prison doivent bénéficier d’une attention particulière. Plusieurs questions restent en suspend : la question de l’interaction négative ou positive des traitements sur l’infection SARS-CoV-2, l’épidémiologie de l’infection chez les personnes souffrant de troubles psychiques, leur adaptation à un confinement long. Discussion Une prise de conscience par les décideurs politiques de la grande vulnérabilité de ces populations et des institutions psychiatriques dans cette situation de catastrophe sanitaire est urgente. Objective The lack of ressources and coordination to face the epidemic of coronavirus raises concerns for the health of patients with mental disorders in a country where we keep in memory the dramatic experience of famine in psychiatric hospitals during the Second World War. This article aims at proposing guidance to ensure mental health care during the SARS-CoV epidemy in France. Methods Authors performed a narrative review identifying relevant results in the scientific and medical literature and local initiatives in France. Results We identified four types of major vulnerabilities in patients suffering from mental disorders during this pandemic: (1) medical comorbidities that are more frequently found in patients suffering from mental disorders (cardiovascular and pulmonary pathologies, diabetes, obesity, etc.) which represent risk factors for severe infections with Covid-19; (2) age (the elderly constituting the population most vulnerable to coronavirus); (3) cognitive and behavioral troubles which can hamper compliance with confinement and hygiene measures and finally and (4) psychosocial vulnerability due to stigmatization and/or socio-economic difficulties. Furthermore, the mental health healthcare system is more vulnerable than other healthcare systems. Current government plans are poorly adapted to psychiatric establishments in a context of major shortage of organizational, material and human resources. In addition, a certain number of structural aspects make the psychiatric institution particularly vulnerable: many beds are closed, wards have a high density of patients, mental health community facilities are closed, medical teams are understaffed and poorly trained to face infectious diseases. We could also face major issues in referring patients with acute mental disorders to intensive care units. To maintain continuity of psychiatric care in this pandemic situation, several directions can be considered, in particular with the creation of Covid+ units. These units are under the dual supervision of a psychiatrist and of an internist/infectious disease specialist; all new entrants should be placed in quarantine for 14 days; the nurse staff should benefit from specific training, from daily medical check-ups and from close psychological support. Family visits would be prohibited and replaced by videoconference. At the end of hospitalization, in particular for the population of patients in compulsory ambulatory care situations, specific case-management should be organized with the possibility of home visits, in order to support them when they get back home and to help them to cope with the experience of confinement, which is at risk to induce recurrences of mental disorders. The total or partial closure of mental health community facilities is particularly disturbing for patients but a regular follow-up is possible with telemedicine and should include the monitoring of the suicide risk and psychoeducation strategies; developing support platforms could also be very helpful in this context. Private psychiatrists have also a crucial role of information with their patients on confinement and barrier measures, but also on measures to prevent the psychological risks inherent to confinement: maintenance of sleep regularity, physical exercise, social interactions, stress management and coping strategies, prevention of addictions, etc. They should also be trained to prevent, detect and treat early warning symptoms of post-traumatic stress disorder, because their prevalence was high in the regions of China most affected by the pandemic. Discussion French mental healthcare is now in a great and urgent need for reorganization and must also prepare in the coming days and weeks to face an epidemic of emotional disorders due to the containment of the general population.",,https://doi.org/10.1016/j.encep.2020.03.001,20200601.0,,Scopus,,,,,,,,,,,,,,False,False,,,,,False,False,False,,2020-10-27
56,‘‘Pandemic fear’’ and COVID-19: Mental health burden and strategies,,,https://doi.org/10.1590/1516-4446-2020-0008,20200501.0,,Scopus,,,,,,,,,,,,,,False,False,,,,,False,False,False,,2020-10-27
57,Suicidality in adults,,,https://doi.org/nan,20200101.0,,Scopus,,,,,,,,,,,,,,False,False,,,,,False,False,False,,2020-10-27
58,The Psychological Impact of Threat & Lockdown During the COVID-19 Pandemic,"Objectives This study aimed to investigate the psychological impact of the COVID-19 pandemic on mental health, particularly the effects of perceived threat and lockdown measures, and to elucidate individual and social factors exacerbating or mitigating its negative effects, particularly sense of control. Design An online survey was designed including questions about psychological wellbeing, lockdown behaviours, and perceived COVID-19 threat, risk, and knowledge. Methods Individuals (N=8,229; 39.4% male, 59.4% female, 1.1% other, Mage=38.3, SD=13.5, range = 18-88) were recruited in 79 countries via the snowballing method and social media, and completed the survey in March-April 2020. Results Participant showed elevated levels of anxiety and depression during early stages of lockdown, predicted by perceived threat. Feelings of social isolation moderated the effect of threat on depression symptoms, and increased with the duration of quarantine, but was mitigated by frequent communication with close others. Sense of control was predicted negatively by maladaptive coping, but positively by adaptive coping and the perception that the government is dealing with the outbreak. Individual actions to avoid contracting the virus were associated with higher anxiety, except when done professionally by essential workers. Conclusions We suggest that the psychological detrimental effects of the pandemic – following perceived threat and lockdown measures – can be alleviated by individual actions such as maintaining frequent social contact and adaptive coping, and by governmental actions which demonstrate support in a public health crisis. Citizens and governments can work together to adapt better to restrictive but necessary measures during the current and future pandemics.",Valerie Van Mulukom et al.,https://share.osf.io/preprint/4617A-B65-F7C,20200722.0,PsyArXiv|Social and Behavioral Sciences; PsyArXiv|Social and Behavioral Sciences|Health Psychology; PsyArXiv|Social and Behavioral Sciences|Health Psychology|Mental Health; PsyArXiv|Social and Behavioral Sciences|Social and Personality Psychology; PsyArXiv|Social and Behavioral Sciences|Social and Personality Psychology|Well-being; government; sense of control; psychological well-being; lockdown; quarantine; anxiety; covid-19; survey; psychology; coronavirus; social isolation; depression; mental health,PsyArXiv,,,,,,,,,,,,,,False,False,,,,,False,False,False,,2020-10-27
59,Parenting and child and adolescent mental health during the COVID-19 pandemic,"Background: Early work indicates the significant impact of the COVID-19 pandemic on the mental health of children and adolescents. Understanding which children may be more at risk for mental health problems, and which risk factors are amenable to change is crucial. The importance of studying children’s mental health within the context of the family system is recognized. Methods: The current study investigated associations between parent factors, and children’s mental health during the early phase of the COVID-19 pandemic across a number of Western countries (primarily Australia and the United Kingdom). Parents (N = 385) reported on their pandemic-related stress, mental health, and parenting behaviors, in addition to mental health changes in their 5-17 year old children (N = 481) during April/May 2020. Results: Analyses revealed significant associations between parent COVID-19 pandemic stress, parent depression, anxiety and stress symptoms, and increases in child internalizing and externalizing problems. Harsh parenting behavior was associated with trauma symptoms and increases in externalizing problems. Further, some associations were more pronounced for children with existing mental health problems, and for disadvantaged and single parent families. Limitations: The data was cross-sectional, the majority of participant parents were female, and all data were parent-report. Conclusions: Findings suggest the importance of parents in influencing children’s mental health during the acute phase of the COVID-19 pandemic. Further work is needed to investigate longer-term impacts.",Sarah Whittle et al.,https://share.osf.io/preprint/460C1-803-230,20200805.0,PsyArXiv|Psychiatry; PsyArXiv|Social and Behavioral Sciences; PsyArXiv|Social and Behavioral Sciences|Clinical Psychology; parenting; child development; covid-19; mental health,PsyArXiv,,,,,,,,,,,,,,False,False,,,,,False,False,False,,2020-10-27
60,Exposure to COVID-19 Pandemic Stress: Associations with Depression and Anxiety in Emerging Adults in the US,"Background: Stressful events due to the COVID-19 pandemic are likely to have profound effects on mental health, and validated methods for assessing these experiences and associations with psychopathology are needed. We developed the Pandemic Stress Questionnaire (PSQ) and tested its psychometric properties, characterized experiences in emerging adults, and examined associations with internalizing symptoms. Methods: Emerging adults (N=450) completed the PSQ and measures of internalizing symptoms and perceived stress through an online platform in May 2020. One month later, 288 participants completed a follow-up questionnaire to assess reliability of the PSQ and longitudinal associations between stress and internalizing symptoms. Results: Results supported the validity/reliability of the PSQ and indicated that stressful events were highly prevalent in May, particularly among younger, female, and Black emerging adults. Symptoms of depression and anxiety were high overall, but decreased at the follow-up assessment. Pandemic-related stress was moderately associated with both depression and anxiety at each assessment, but baseline stress did not predict change in symptoms when controlling for baseline symptoms. Conclusions: Results provide empirical evidence that emerging adults are at high risk for depression and anxiety related to the psychosocial effects of the COVID-19 pandemic, and highlight specific types of experiences associated with greatest risk. Further, this study provides support for a questionnaire measure of experiences related to the COVID-19 pandemic that can be applied in future work to advance understanding of risk and resilience in response to stressful events.",Autumn Kujawa et al.,https://share.osf.io/preprint/4614D-D78-F8E,20200629.0,PsyArXiv|Social and Behavioral Sciences; PsyArXiv|Social and Behavioral Sciences|Clinical Psychology; PsyArXiv|Social and Behavioral Sciences|Clinical Psychology|Anxiety Disorders; PsyArXiv|Social and Behavioral Sciences|Clinical Psychology|Depressive Disorders; PsyArXiv|Social and Behavioral Sciences|Clinical Psychology|Trauma and Stress; anxiety; depression; pandemics; young adult; coronavirus,PsyArXiv,,,,,,,,,,,,,,False,False,,,,,False,False,False,,2020-10-27
61,Mechanisms of COVID-19 Mental Health Burden,"New Zealand's COVID-19 lockdown in March and April 2020 was among the world's most stringent. Similar to other countries, New Zealand's lockdown occurred amidst pervasive health and economic uncertainties. However, New Zealanders experienced comparatively less psychological distress. To test theories of pandemic distress mitigation, we use national longitudinal responses with pre-COVID-19 baselines and systematically quantify psychological distress trajectories within the same individuals during the lockdown (pre-COVID-19 = 2018/2019; stringent-lockdown = March/April 2020; N = 940). Most distress indicators were minimally elevated. However, there was a three-fold increase in feelings of worthlessness. Neither satisfaction with the government, nor business-satisfaction, nor a sense of neighbourhood community were effective distress defences. Perceived social-belonging and health-satisfaction mitigated feelings of worthlessness. A silver lining was a relief from feelings of effort, which social-belonging fostered. That social-belonging and health satisfaction could quell serious distress among those low in government confidence, low in business satisfaction, and low neighbourhood community proves that distress mitigation is possible without shifting a population's general political, economic, and civic attitudes. Protection of income and containment of infectious disease threat reduces mental health burdens. Though feelings of worthlessness surge during lockdown, such feelings attenuate from interpersonal belonging with people one already knows.",Joseph Bulbulia et al.,https://share.osf.io/preprint/46163-B20-33A,20200623.0,PsyArXiv|Social and Behavioral Sciences; PsyArXiv|Social and Behavioral Sciences|Health Psychology; PsyArXiv|Social and Behavioral Sciences|Quantitative Methods; PsyArXiv|Social and Behavioral Sciences|Quantitative Methods|Statistical Methods; PsyArXiv|Social and Behavioral Sciences|Social and Personality Psychology; PsyArXiv|Social and Behavioral Sciences|Social and Personality Psychology|Individual Differences; PsyArXiv|Social and Behavioral Sciences|Social and Personality Psychology|Well-being; employment; brms; kessler-6; glmm; bayesian; ordinal; stan; anxiety; longitudinal; covid-19; mental health,PsyArXiv,,,,,,,,,,,,,,False,False,,,,,False,False,False,,2020-10-27
62,Decision making and mental health across adulthood during social distancing,"Covid-19-related social-distancing measures have dramatically limited physical social contact between individuals of all ages. We wondered how these new societal conditions would impact the choices of individuals of different ages and if social distancing measures would have a differential emotional impact on older individuals. Early media reports suggested that older adults were more likely to ignore social distancing guidelines. We conducted two online studies to examine temporal discounting of monetary, health, and social rewards, COVID-19 beliefs, social distancing behaviors, and mental health symptoms. We used the initial study (N = 233) to form our hypotheses about social distancing behaviors and we ran the second, pre-registered study (N = 243) to determine if these relationships replicated. We found that although older adults were more likely to prefer smaller, sooner (i.e., temporal discount) social and health-related rewards in decision-making tasks, there were no adult age differences in social distancing behavior. The increased motivation for immediate social contact in older age appears to be balanced by a similarly increased motivation for physical health. Although older adults reported being more likely to contract Covid-19 and experience more severe health consequences, they experienced fewer overall Covid-19-related mental health symptoms compared to younger adults. These data contradict media anecdotes and suggest that older adults are not only similarly compliant with distancing guidelines, but also are faring relatively better emotionally during the pandemic while overall mental health issues are higher than normal in the population.",Kendra Leigh Seaman et al.,https://share.osf.io/preprint/46008-064-E80,20200717.0,PsyArXiv|Social and Behavioral Sciences; PsyArXiv|Social and Behavioral Sciences|Clinical Psychology; PsyArXiv|Social and Behavioral Sciences|Cognitive Psychology; PsyArXiv|Social and Behavioral Sciences|Cognitive Psychology|Judgment and Decision Making; PsyArXiv|Social and Behavioral Sciences|Emotion; social distancing; covid-19; temporal discounting; mental health; aging,PsyArXiv,,,,,,,,,,,,,,False,False,,,,,False,False,False,,2020-10-27
