,title,abstract,authors,link,date,subject,source,initial_decision,q0,q1,q2,q3,q4,q5,q6,q7,q8,q9,q10,q11,q12,q13,q14,q15,q16,q17,q18,q19,q20,exclusion_reason,extraction_date
95,,"The current cross-sectional study aimed to explore the relationship between work stressors and mental health in frontline nurses exposed to COVID-19. Participants were recruited from 16 general hospitals in Anhui province from February 2020 to March 2020. The general sociodemographic questionnaire, Nurse Job Stressors Scale, Simplified Coping Style Questionnaire, NEO Five-Factor Inventory, Perceived Social Support Scale, and Kessler Psychological Distress Scale were used in this study. Based on 723 valid questionnaires retrieved (100%), the total mean scores of work stressors and mental health of frontline nurses were (94.38Â±23.42) and (22.81Â±7.16), respectively. The results of the structural equation model showed that work stressors had an indirect positive effect (Î²=0.484, P&lt;0.01), social support had a direct negative effect (Î²=-0.934, P&lt;0.01), personality traits had a direct positive effect (Î²=0.209, P&lt;0.01), and positive coping style had both direct positive (Î²=0.246, P&lt;0.01) and indirect negative effects (Î²=-0.873, P&lt;0.01) on frontline nurses' mental health. In conclusion, nursing staff can reinforce positive influences by accepting social support, adopting positive coping methods, and weakening negative influences factors to reduce or buffer their negative mental states and further reduce work stress.","Shaohua, Dai, Wang, Zhang, Li, He",https://doi.org/10.1016/j.amp.2021.02.015,20210222.0,COVID-19; Caregiver; Job; Mental Health; Psychic suffering; Stress; Work psychology,PubMed,,,,,,,,,,,,,,False,False,,,,,False,False,False,,2021-02-26
96,Suicide in the context of COVID-19 diagnosis in India: Insights and implications from online print media reports,"Suicide reports during the COVID pandemic is an increasing cause for concern. However, there is a limited understanding of suicide among individuals with positive/suspected COVID diagnosis specifically. Hence, this study, using online newspaper reports, aimed to determine factors influencing suicide among individuals withCOVID-19 infection status. Information regarding positive/suspected COVID related suicide was obtained from online newspapers published in 4 languages between 30<sup>th</sup> Jan 2020 to 16<sup>th</sup> August 2020 using google news aggregator. Of 235 online identified, 93 were eligible for analysis after the exclusion and analysed using descriptive statistics. Median Age of COVID related suicide victims was 45 years (range 15 - 80) wherein 61.3% belonged to 30-59 year age group, and 75.3% were males. 50% of suicides occurred within the first week of COVID diagnosis confirmation, and 50% suicides occurred at COVID centres. Hanging (53.8%) was the commonest method of suicide, followed by jumping (12.9%). Higher risk for suicide was observed among male gender and those with positive/suspected COVID infection within the first week, while receiving treatment in COVID care centres. Hanging and jumping were the two commonest methods. The above highlight an urgent need to integrate suicide preventive strategies into standard care protocols of COVID-19 positive and suspected cases.","Sripad, Pantoji, Gowda, Ganjekar, Reddi, Math",https://doi.org/10.1016/j.psychres.2021.113799,20210223.0,COVID; Newspaper; Online; Print media; Suicide,PubMed,,,,,,,,,,,,,,False,False,,,,,False,False,False,,2021-02-26
97,Self-treatment and adverse reactions with herbal products for treating symptoms associated with anxiety and depression in adults from the central-western region of Mexico during the Covid-19 pandemic,"There are plant species used in the Mexican traditional medicine for the empirical treatment of anxiety and depression. This work assessed the prevalence of self-medication with medicinal plants and the prevalence of the concomitant use of prescribed psychiatric drugs and medicinal plants for treating symptoms associated with anxiety and depression during the Covid-19 lockdown in Mexico. The suspected adverse reactions associated with drug-herb interactions were assessed. The factors associated with self-medication, the concomitant use of herb-drug combinations, and the presence of adverse reactions due their combined use is also reported. The study was descriptive and cross-sectional using an online questionnaire conducted among population with symptoms associated with anxiety and depression (n=2100) from seven states of central-western Mexico. The prevalence of the use of herbs (61.9%) and the concomitant use of drug-herb combinations (25.3%) were associated with being diagnosed with mental illness [OR:2.195 (1.655 - 2.912)] and the use of psychiatric medications [OR:307.994 (178.609 - 531.107)], respectively. The presence of adverse reactions (n=104) by the concomitant use of drug-herb combinations was associated with being unemployed [p=0.004, OR: 3.017 (1.404-6.486)]. Health professionals should be aware if their patients concomitantly use medicinal plants and psychiatric drugs. Public health campaigns should promote the possible adverse reactions that might produce the concomitant use of drug-herb combinations for mental illnesses.","Alonso-Castro, Ruiz-Padilla, Ortiz-Cortes, Carranza, RamÃ­rez-Morales, Escutia-GutiÃ©rrez, Ruiz-Noa, Zapata-Morales",https://doi.org/10.1016/j.jep.2021.113952,20210221.0,anxiety; depression; herbal products; self-medication,PubMed,,,,,,,,,,,,,,False,False,,,,,False,False,False,,2021-02-26
98,Food Insufficiency and Mental Health in the US During the COVID-19 Pandemic,"During the COVID-19 pandemic, the rates of food insecurity and mental illness have been projected to increase in the U.S. owing to significant social and economic disruption. This study aims to estimate the prevalence of food insufficiency (often the most extreme form of food insecurity), the correlates of food insufficiency, and the associations between food insufficiency and symptoms of poor mental health in the U.S. during the COVID-19 pandemic. Cross-sectional data from 63,674 participants of the U.S. Census Household Pulse Survey were collected and analyzed in 2020. Multiple Poisson regression models were used to estimate associations with food insufficiency. Food insufficiency rose from 8.1% to 10.0% from March to June 2020. Factors associated with food insufficiency included lower age, Black/African American or Latinx race/ethnicity, being unmarried, larger household size, recent employment loss, income below the federal poverty line, and lower education (all p&lt;0.001). Food insufficiency was independently associated with all symptoms of poor mental health, adjusting for socioeconomic and demographic factors (adjusted RRs ranged from 1.16 to 1.42, all p&lt;0.001). The association between food insufficiency and poor mental health was attenuated among people who received free groceries or meals. Food insufficiency has increased during the COVID-19 pandemic and affects vulnerable populations, placing individuals at higher risk for symptoms of poor mental health. Particularly in the current crisis, clinicians should regularly screen patients for food insufficiency and mental health outcomes as well as provide support in accessing appropriate resources.","Nagata, Ganson, Whittle, Chu, Harris, Tsai, Weiser",https://doi.org/10.1016/j.amepre.2020.12.004,20210219.0,,PubMed,,,,,,,,,,,,,,False,False,,,,,False,False,False,,2021-02-26
99,The effects of home confinement on physical activity level and mental status in professional football players during COVID-19 outbreak,"<b>Objectives</b>: The coronavirus outbreak caused significant changes in football around the world, such as the suspension of leagues and home isolation of players, etc. The main purpose of the present study was to assess the psychological impacts of lockdown and similar restrictions on professional football players during the coronavirus pandemic. <b>Materials and methods</b>: The players from 36 professional football teams (nÂ =Â 977) among Turkish Super League and First League teams were invited to complete a questionnaire including the Center for Epidemiologic Studies Depression Scale (CES-D), Impact of Event Scale-Revised Scores (IES-R) and short form of International Physical Activity Questionnaire (IPAQ). <b>Results</b>: The online survey was completed by 237 players (24.3%). The mean number of self-quarantine day of participants was 26.9Â Â±Â 6.2Â days. The median CES-D Scale and IES-R scores were 6.0 (min:0, max:42) and 23.0 (min:0, max:59), respectively. IPAQ scores of the players showed that four-fifths of the players still maintain high physical activity levels. There were negative, very weak and significant correlations between CES-D score and being married (rÂ =Â -0.146, p =Â 0.024), as well as between CES-D score and IPAQ-Walking (rÂ =Â -0.189, p =Â 0.004). A significant positive very weak correlation was observed between CES-D score and self-quarantine days (rÂ =Â 0.148, p =Â 0.024). IPAQ-Walking was an independent predictor of CES-D. <b>Conclusion</b>: These findings support that maintaining regular physical activity and routinely exercising in a safe home environment is one of the most important strategies to ensure healthy mental state.","DÃ¶nmez, Ã–zkan, Menderes, Torgutalp, KaraÃ§oban, Denerel, KudaÅŸ",https://doi.org/10.1080/00913847.2021.1888630,20210222.0,Coronavirus; depressive symptoms; pandemic; physical activity; soccer,PubMed,,,,,,,,,,,,,,False,False,,,,,False,False,False,,2021-02-26
100,Mental health status among Chinese healthcare-associated infection control professionals during the outbreak of coronavirus disease 2019: A national cross-sectional survey,"Recently, the coronavirus disease 2019 (COVID-19) epidemic has greatly threatened global public health. The responsibility of healthcare-associated infection control professionals (ICPs) is to prevent and control the nosocomial infections. The mental health status of ICPs deserves more attention, however, the correlational research is still lacking. This study aims to investigate the incidence and risk factors of mental health status among ICPs in China during the outbreak of COVID-19.A national cross-sectional survey was performed. The online questionnaire was completed by 9228 ICPs from 3776 hospitals throughout China. Data collection tools were used, including demographics data questionnaire, the Chinese version of the 12-item general health questionnaire (GHQ-12) and the Chinese version of the psychological capital questionnaire (PCQ) for medical staff. Univariate and multivariable analyses were conducted.The total score of mental health of Chinese ICPs was 3.45â€ŠÂ±â€Š2.57. 5608 (60.77%) ICPs might have mental health problems. The psychological capital was in the upper-middle level with an average score of 3.72â€ŠÂ±â€Š0.38. An increased mental health problem risk was associated with the greater self-efficacy and working in the public hospital; a significantly lower risk was obtained by working in the second-class hospital rather than in the third-class hospitals. Besides, mental health problem risk of ICPs working in hospitals of the western economic region or northeast economic region was more significant than that in hospitals of the central economic region. However, a lower risk was caused by the unmarried than married, and working years in department â‰¤1â€Šyear contributed to the lower risk than that &gt;20â€Šyears. Moreover, fewer working hours per week, higher values of hope, and optimism each were contributed to a lower risk.Chinese healthcare-associated ICPs were under different levels of mental health problems in fighting against COVID-19. More importantly, we should actively deal with the mental health problem of ICPs and help them get rid of psychological disorders.","Zhang, Tian, Li, Wen, Wu, Gong, Zeng, Zhou, Liu, Tang, Wu, Huang",https://doi.org/10.1097/MD.0000000000024503,20210222.0,Adult; COVID-19; China; Cross Infection; Cross-Sectional Studies; Female; Humans; Infection Control; Infection Control Practitioners; Male; Mental Health; Occupational Exposure; Occupational Stress; Risk Assessment; SARS-CoV-2; Surveys and Questionnaires,PubMed,,,,,,,,,,,,,,False,False,,,,,False,False,False,,2021-02-26
101,College student mental health risks during the COVID-19 pandemic: Implications of campus relocation,"During the COVID-19 pandemic, many universities evacuated their campuses, requiring students to vacate on campus residences. The psychological outcomes of students who relocated during the pandemic remains unknown. We examined mandated relocation experiences related to self-reported worry, grief, loneliness, and depressive, generalized anxiety, and post-traumatic stress disorder (PTSD) symptoms among college students during the COVID-19 pandemic. We analyzed cross-sectional survey data obtained from April 9 to August 4, 2020 on 791 young adults (ages 18-30 years) who were enrolled at a U.S. university. The CARES 2020 Project (COVID-19 Adult Resilience Experiences Study) is an online survey of young adults' mental health during the COVID-19 pandemic. Recruitment relied on snowball sampling. Participants were asked if they were required to relocate from campus and among those who did, their experiences in moving. COVID-19-related worry and grief, loneliness, and depressive, anxiety, and PTSD symptoms were assessed. Approximately one-third of students reported being mandated to relocate. Students mandated to relocate reported more COVID-19-related grief, loneliness, and generalized anxiety symptoms compared to those who did not even after controlling for the severity level of local COVID-19 outbreaks. Students who had to leave behind valuable personal belongings reported more COVID-19-related worries, grief, and depressive, generalized anxiety, and PTSD symptoms. Students who were mandated to relocate reported worse psychological outcomes compared to students who were not mandated to relocate. Our findings have implications for addressing the psychological impact of evacuating college campuses during public health emergencies and other disasters.","Conrad, Hahm, Koire, Pinder-Amaker, Liu",https://doi.org/10.1016/j.jpsychires.2021.01.054,20210223.0,Anxiety; Loneliness; Relocation; Stress; University; Young adults,PubMed,,,,,,,,,,,,,,False,False,,,,,False,False,False,,2021-02-26
102,"Ethnic Differences in Loneliness, Depression, and Malnutrition Among Older Adults During COVID-19 Quarantine","Depression in older adults may result from a variety of reasons such as loneliness feelings and malnutrition. To examine the direct and indirect effect of loneliness feelings on depressive symptoms, mediated by malnutrition, among older adults from different cultures during the Coronavirus disease 2019 (Covid-19) pandemic quarantine. A convenience sample of 101 Arabs and 100 Jewish older adults aged 65 and over was interviewed. Using bootstrapping, we tested the strength and significance of the conditional indirect effect of malnutrition (mediator) on the relationship between loneliness feelings and depressive symptoms. The relationship between loneliness feelings and depressive symptoms was mediated by malnutrition and Arab older adults reported a higher level than Jewish older adults of loneliness, depression, and malnutrition during the Covid-19 pandemic quarantine. To reduce loneliness feelings, depressive symptoms, and malnutrition in times of crisis like the Covid-19 pandemic, it is essential to develop new communication methods for and with older adults in general, with particular attention paid to ethnic differences, that will be effective in reducing loneliness and in promoting nutrition intervention. Possible solutions include new social network technologies for reducing loneliness, with continued reliance on phone communication for combined intervention that includes psychological support accompanied by instructions for a healthy lifestyle and malnutrition prevention.","Schorr, Yehuda, Tamir",https://doi.org/10.1007/s12603-020-1540-z,20210217.0,Covid-19; Loneliness feelings; depressive symptoms; malnutrition; older adults,PubMed,,,,,,,,,,,,,,False,False,,,,,False,False,False,,2021-02-26
103,Predictors of poor mental health among nurses during COVID-19 pandemic,"To examine the impact of various factors affecting nurses' mental health during the COVID-19 pandemic. An online cross-sectional study. Registered nurses who graduated from a nursing school in Southern California, USA, participated in the study from 20 April-10 May 2020 (NÂ =Â 320). Kendall's tau correlations and multivariate logistic regression procedures were performed with stress, anxiety and depression as outcome variables. Most nurses reported moderate/high stress (80.1%), while 43% and 26% reported moderate/severe anxiety and depression, respectively. COVID-19 patient care was positively associated with moderate/severe high stress (ORÂ =Â 2.25; pÂ =Â .012) and moderate/severe anxiety (ORÂ =Â 3.04; pÂ &lt;Â .001), whereas quarantine was associated with moderate/severe depression (ORÂ =Â 2.68; pÂ &lt;Â .001). High levels of family functioning, resilience and spirituality predicted two- to sixfold lower odds of moderate/severe stress, anxiety or depression. High resilience, spirituality and family functioning appear to be good coping mechanisms for nurses against stress, anxiety and depression during the pandemic.","Kim, Quiban, Sloan, Montejano",https://doi.org/10.1002/nop2.697,20210215.0,COVID-19; anxiety; coping mechanisms; depression; nurses; pandemic; stress,PubMed,,,,,,,,,,,,,,False,False,,,,,False,False,False,,2021-02-26
104,Depression and anxiety in healthcare professionals during the COVID-19 pandemic,"Healthcare staff have been at the centre of the fight against the COVID-19 pandemic, facing diverse work-related stressors. Building upon studies from various countries, we aimed to investigate (1) the prevalence of various work-related stressors among healthcare professionals in Germany specific to the COVID-19 pandemic, (2) the psychological effects of these stressors in terms of clinical symptoms, and (3) the healthcare professionals' help-seeking behaviour. To this end, N = 300 healthcare professionals completed an online survey including the ICD-10 Symptom Rating checklist (ISR), event-sampling questions on pandemic-related stressors and self-formulated questions on help-seeking behaviour. Participants were recruited between 22 May and 22 July 2020. Findings were analysed using t tests, regressions and comparisons to large clinical and non-clinical samples assessed before and during the pandemic. Results show that healthcare professionals were most affected by protective measures at their workplace and changes in work procedures. Psychological symptoms, particularly anxiety and depression, were significantly more severe than in a non-clinical pre-pandemic sample and in the general population during the pandemic. At the same time, most professionals indicated that they would not seek help for psychological concerns. These findings indicate that healthcare employers need to pay greater attention to the mental health of their staff.","Weibelzahl, Reiter, Duden",https://doi.org/10.1017/S0950268821000303,20210225.0,COVID-19; help-seeking behaviour; mental health; nursing staff; occupational stress; pandemics; Anxiety; COVID-19; Depression; Germany; Health Personnel; Incidence; Pandemics; Prevalence,PubMed,,,,,,,,,,,,,,False,False,,,,,False,False,False,,2021-02-26
105,Telemedicine in Pediatrics: Systematic Review of Randomized Controlled Trials,"Telemedicine modalities, such as videoconferencing, are used by health care providers to remotely deliver health care to patients. Telemedicine use in pediatrics has increased in recent years. This has resulted in improved health care access, optimized disease management, progress in the monitoring of health conditions, and fewer exposures to patients with illnesses during pandemics (eg, the COVID-19 pandemic). We aimed to systematically evaluate the most recent evidence on the feasibility and accessibility of telemedicine services, patients' and care providers' satisfaction with these services, and treatment outcomes related to telemedicine service use among pediatric populations with different health conditions. Studies were obtained from the PubMed database on May 10, 2020. We followed the PRISMA (Preferred Reporting Items for Systematic Reviews and Meta-Analyses) guidelines. In this review, we included randomized controlled trials from the last 10 years that used a telemedicine approach as a study intervention or assessed telemedicine as a subspecialty of pediatric care. Titles and abstracts were independently screened based on the eligibility criteria. Afterward, full texts were retrieved and independently screened based on the eligibility criteria. A standardized form was used to extract the following data: publication title, first author's name, publication year, participants' characteristics, study design, the technology-based approach that was used, intervention characteristics, study goals, and study findings. In total, 11 articles met the inclusion criteria and were included in this review. All studies were categorized as randomized controlled trials (8/11, 73%) or cluster randomized trials (3/11, 27%). The number of participants in each study ranged from 22 to 400. The health conditions that were assessed included obesity (3/11, 27%), asthma (2/11, 18%), mental health conditions (1/11, 9%), otitis media (1/11, 9%), skin conditions (1/11, 9%), type 1 diabetes (1/11, 9%), attention deficit hyperactivity disorder (1/11, 9%), and cystic fibrosis-related pancreatic insufficiency (1/11). The telemedicine approaches that were used included patient and doctor videoconferencing visits (5/11, 45%), smartphone-based interventions (3/11, 27%), telephone counseling (2/11, 18%), and telemedicine-based screening visits (1/11, 9%). The telemedicine interventions in all included studies resulted in outcomes that were comparable to or better than the outcomes of control groups. These outcomes were related to symptom management, quality of life, satisfaction, medication adherence, visit completion rates, and disease progression. Although more research is needed, the evidence from this review suggests that telemedicine services for the general public and pediatric care are comparable to or better than in-person services. Patients, health care professionals, and caregivers may benefit from using both telemedicine services and traditional, in-person health care services. To maximize the potential of telemedicine, future research should focus on improving patients' access to care, increasing the cost-effectiveness of telemedicine services, and eliminating barriers to telemedicine use.","Shah, Badawy",https://doi.org/10.2196/22696,20210225.0,COVID-19; coronavirus; digital; eHealth; mHealth; mobile health; pandemic; pediatrics; telehealth; telemedicine,PubMed,,,,,,,,,,,,,,False,False,,,,,False,False,False,,2021-02-26
106,Mental health interventions for healthcare workers during the COVID-19 pandemic in Spain,"In order to reduce distress associated with working with COVID-19 patients, several psychological intervention programmes for healthcare workers have been developed in Spain. We aimed to describe the main characteristics and components of these programmes for healthcare workers treating COVID-19 patients in Spanish hospitals. An online survey was designed to evaluate the main characteristics of psychological intervention programmes for healthcare workers during the peak of COVID-19 pandemic. Valid responses were received from 36 hospitals. Most of these programmes offered both in-person and online therapy. The most common aim of these interventions was emotional regulation, which was treated by psychoeducational and cognitive-behavioural techniques in individual interventions. Group interventions mainly used psychoeducation and mindfulness. Only half of the teams that offered in-person interventions received training in the proper use of personal protective equipment. Several hospitals in Spain have developed mental health interventions for healthcare workers during the COVID-19 pandemic, deploying a wide range of therapeutic modalities and techniques. The rapid implementation of these programmes during the pandemic suggests that safety may not have received sufficient attention. The planning and development of interventions for healthcare workers during pandemics merits greater attention by national and regional authorities and institutions.","Priede, LÃ³pez-Ãlvarez, Carracedo-SanchidriÃ¡n, GonzÃ¡lez-Blanch",https://doi.org/10.1016/j.rpsm.2021.01.005,20210214.0,COVID-19; Distress; Healthcare workers; Malestar psicolÃ³gico; Mental health; Psychological treatment; Salud mental; Trabajadores sanitarios; Tratamiento psicolÃ³gico,PubMed,,,,,,,,,,,,,,False,False,,,,,False,False,False,,2021-02-26
