,title,abstract,authors,link,date,subject,source,initial_decision,q0,q1,q2,q3,q4,q5,q6,q7,q8,q9,q10,q11,q12,q13,q14,q15,q16,q17,q18,q19,q20,exclusion_reason,extraction_date
264,&quot;The COVID-19 Pandemic and its Effect on Mental Health in USA - A Review with Some Coping Strategies&quot;,"The COVID-19 pandemic has resulted in enormous losses in terms of human lives and economy in United States. The outbreak has been continuing to heavily impact the mental health of people. Developing key strategies to prevent mental illnesses is extremely important for the well-being of people. A survey conducted during the last week of March 2020 showed that 72% of Americans felt that their lives were impacted by the outbreak, which was a 32% increase from the survey conducted only 2Â weeks earlier. The results show a positive correlation between COVID-19 infections/casualties and growing public concern. These observations suggest possible increase in mental health illnesses in United States as a consequence of the pandemic. The authors review a recently published model on COVID-19 related fear among the people. The fear of being infected or dying from the disease is one of the most significant causes of mental health disorders. Loss of employment or the fear of losing employment is another major concern leading to mental illnesses. Several unique strategies to prevent or mitigate mental illnesses are discussed.","Bhattacharjee, Acharya",https://doi.org/10.1007/s11126-020-09836-0,20201105.0,"Anxiety disorder; COVID-19; Mental health; Pandemic; Prevention strategies; Adaptation, Psychological; Betacoronavirus; COVID-19; Coronavirus Infections; Employment; Fear; Humans; Mental Disorders; Mental Health; Pandemics; Pneumonia, Viral; SARS-CoV-2; United States",PubMed,,,,,,,,,,,,,,False,False,,,,,False,False,False,,2021-02-26
265,Mental health amongst obstetrics and gynaecology doctors during the COVID-19 pandemic: Results of a UK-wide study,"To explore the impact of the COVID-19 pandemic on the mental health of Obstetricians and Gynaecologists. A cross-section survey-based study amongst doctors working within Obstetrics and Gynaecology in the United Kingdom. A total of 207 doctors completed the survey. Obstetricians and Gynaecologists reported significantly higher rates of both Major Depressive Disorder (versus, p = 0.023) and Generalised Anxiety Disorder (versus, p = 0.044) as compared to the UK-wide estimates. Sub-group analysis showed that anxiety was more common amongst female doctors as compared to males (versus, p = 0.047). Although the prevalence of GAD was higher amongst registrars compared to their Consultant and/or Senior House Officer counterparts, this was not statistically significant. Respondents felt that the most significant factor for work-related changes to mental health was keeping up to date with frequently changing guidelines and protocols related to COVID-19. Only of respondents felt able to talk to colleagues about their mental health. Key findings include the high prevalence of mental health conditions amongst doctors, demonstration of the persistent taboo that mental health carries within the speciality and the key contributory factors to poor mental health. Further work should be done to assess if changes to the way new and updating guidelines, protocols and pathways are disseminated reduces the impact on the mental health of doctors. With the threat of a second COVID-19 peak looming, now more than ever, it is vital that steps are taken to break the stigmatisation of mental health amongst doctors, encouraging doctors to seek help when required.","Shah, Raheem, Sideris, Velauthar, Saeed",https://doi.org/10.1016/j.ejogrb.2020.07.060,20200929.0,"Education and training; Gynaecology; Mental health; Obstetrics; Adult; Anxiety Disorders; Betacoronavirus; COVID-19; Coronavirus Infections; Cross-Sectional Studies; Depressive Disorder, Major; Female; Gynecology; Humans; Male; Mental Disorders; Middle Aged; Obstetrics; Occupational Diseases; Pandemics; Physicians; Pneumonia, Viral; SARS-CoV-2; Surveys and Questionnaires; United Kingdom",PubMed,,,,,,,,,,,,,,False,False,,,,,False,False,False,,2021-02-26
266,"Public Behavior Change, Perceptions, Depression, and Anxiety in Relation to the COVID-19 Outbreak","COVID-19 has spread rapidly and internationally, which has elicited public panic and psychological problems. Public protective behaviors and perception play crucial roles in controlling the spread of illness and psychological status. We conducted a cross-sectional online survey in the hardest-hit Hubei province and other areas in China affected by the COVID-19 outbreak. Questions about their basic information, the perception of the COVID-19 outbreak, recent preventive or avoidance behaviors, and self-reported mental health scales including the Patient Health Questionnaire and Self-Rating Anxiety Scale were included. Binary logistic regressions were used to investigate the association between personal variables/perceptions and psychological distress. A total of 6261 people were included in the analysis, with 3613 (57.7%) in Hubei province (1743 in Wuhan). The majority of people have adopted preventive and avoidance behaviors. People from Hubei, with contact history, and people who were infected or whose family members were infected had a much higher prevalence of depression and anxiety. Providing truthful and sufficient information, informing the public about the severity of the disease, and perceptions that the outbreak can be controlled by protective behaviors were associated with lower prevalence of depression and anxiety. Assessing the public response, perception, and psychological burden during the outbreak may help improve public health recommendations and deliver timely psychological intervention. Further research may focus on the psychological status of a specialized group to identify methods of delivery of better support based on public response and psychological demand.","Huang, Liu, Teng, Chen, Zhao, Wang, Wu, Xiao, Wang, Wu",https://doi.org/10.1093/ofid/ofaa273,20200928.0,COVID-19; anxiety; depression; perceptions; public behavior change,PubMed,,,,,,,,,,,,,,False,False,,,,,False,False,False,,2021-02-26
267,The social underpinnings of mental distress in the time of COVID-19 - time for urgent action,"We argue that predictions of a 'tsunami' of mental health problems as a consequence of the pandemic of coronavirus disease 2019 (COVID-19) and the lockdown are overstated; feelings of anxiety and sadness are entirely normal reactions to difficult circumstances, not symptoms of poor mental health.Â Some people will need specialised mental health support, especially those already leading tough lives; we need immediate reversal of years of underfunding of community mental health services.Â However, the disproportionate effects of COVID-19 on the most disadvantaged, especially BAME people placed at risk by their social and economic conditions, were entirely predictable. Mental health is best ensured by urgently rebuilding the social and economic supports stripped away over the last decade. Governments must pump funds into local authorities to rebuild community services, peer support, mutual aid and local community and voluntary sector organisations.Â Health care organisations must tackle racism and discrimination to ensure genuine equal access to universal health care.Â Government must replace highly conditional benefit systems by something like a universal basic income. All economic and social policies must be subjected to a legally binding mental health audit.Â This may sound unfeasibly expensive, but the social and economic costs, not to mention the costs in personal and community suffering, though often invisible, are far greater.","Rose, Manning, Bentall, Bhui, Burgess, Carr, Cornish, Devakumar, Dowd, Ecks, Faulkner, Ruck Keene, Kirkbride, Knapp, Lovell, Martin, Moncrieff, Parr, Pickersgill, Richardson, Sheard",https://doi.org/10.12688/wellcomeopenres.16123.1,20200928.0,BAME; Mental distress; benefit system reform; social disadvantage; universal basic income,PubMed,,,,,,,,,,,,,,False,False,,,,,False,False,False,,2021-02-26
268,Effect of Common Medications on the Expression of SARS-CoV-2 Entry Receptors in Kidney Tissue,"Besides the respiratory system, severe acute respiratory syndrome-coronavirus 2 (SARS-CoV-2) infection was shown to affect other essential organs such as the kidneys. Early kidney involvement during the course of infection was associated with worse outcomes, which could be attributed to the direct SARS-CoV-2 infection of kidney cells. In this study, the effect of commonly used medications on the expression of SARS-CoV-2 receptor, angiotensin-converting enzyme (ACE)2, and TMPRSS2 protein in kidney tissues was evaluated. This was done by in silico analyses of publicly available transcriptomic databases of kidney tissues of rats treated with multiple doses of commonly used medications. Of 59 tested medications, 56% modified ACE2 expression, whereas 24% modified TMPRSS2 expression. ACE2 was increased with only a few of the tested medication groups, namely the renin-angiotensin inhibitors, such as enalapril, antibacterial agents, such as nitrofurantoin, and the proton pump inhibitor, omeprazole. The majority of the other medications decreased ACE2 expression to variable degrees with allopurinol and cisplatin causing the most noticeable downregulation. The expression level of TMPRSS2 was increased with a number of medications, such as diclofenac, furosemide, and dexamethasone, whereas other medications, such as allopurinol, suppressed the expression of this gene. The prolonged exposure to combinations of these medications could regulate the expression of ACE2 and TMPRSS2 in a way that may affect kidney susceptibility to SARS-CoV-2 infection. Data presented here suggest that we should be vigilant about the potential effects of commonly used medications on kidney tissue expression of ACE2 and TMPRSS2.","Saheb Sharif-Askari, Saheb Sharif-Askari, Alabed, Tayoun, Loney, Uddin, Senok, Al Heialy, Hamoudi, Kashour, Alsheikh-Ali, Hamid, Halwani",https://doi.org/10.1111/cts.12862,20201222.0,"Angiotensin-Converting Enzyme 2; Animals; COVID-19; Gene Expression Regulation; Kidney; Rats; Receptors, Coronavirus; SARS-CoV-2; Serine Endopeptidases",PubMed,,,,,,,,,,,,,,False,False,,,,,False,False,False,,2021-02-26
269,Impact of the COVID-19 pandemic on anaesthesia trainees and their training,"Coronavirus disease 2019 (COVID-19; severe acute respiratory syndrome coronavirus 2 [SARS-CoV-2] has dislocated clinical services and postgraduate training. To better understand and to document these impacts, we contacted anaesthesia trainees and trainers across six continents and collated their experiences during the pandemic. All aspects of training programmes have been affected. Trainees report that reduced caseload, sub-specialty experience, and supervised procedures are impairing learning. Cancelled educational activities, postponed examinations, and altered rotations threaten progression through training. Job prospects and international opportunities are downgraded. Work-related anxieties about provision of personal protective equipment, and risks to self and to colleagues are superimposed on concerns for family and friends and domestic disruption. These seismic changes have had consequences for well-being and mental health. In response, anaesthetists have developed innovations in teaching and trainee support. New technologies support trainer-trainee interactions, with a focus on e-learning. National training bodies and medical regulators that specify training and oversee assessment of trainees and their progression have provided flexibility in their requirements. Within anaesthesia departments, support transcends grades and job titles with lessons for the future. Attention to wellness, awareness of mental health issues and multimodal support can attenuate but not eliminate trainee distress.","Sneyd, Mathoulin, O'Sullivan, So, Roberts, Paul, Cortinez, Ampofo, Miller, Balkisson",https://doi.org/10.1016/j.bja.2020.07.011,20201001.0,"COVID-19; SARS-CoV-2; anaesthesia; medical education; mental health; postgraduate medical education; training; well-being; Anesthesiology; Anesthetists; Attitude of Health Personnel; COVID-19; Coronavirus Infections; Curriculum; Diagnosis-Related Groups; Education, Medical, Graduate; Humans; Mental Health; Pandemics; Personal Protective Equipment; Pneumonia, Viral; Students, Medical; Teaching",PubMed,,,,,,,,,,,,,,False,False,,,,,False,False,False,,2021-02-26
270,Prevalence and associated factors of poor sleep quality among Chinese returning workers during the COVID-19 pandemic,"The 2019 novel coronavirus (COVID-19) pandemic is a severe global crisis which has resulted in many public health problems. This study aimed to investigate the prevalence of poor sleep quality and its related factors among employees who returned to work during the COVID-19 pandemic. Our online cross-sectional study included 2,410 participants aged â‰¥17 years in Deqing and Taizhou, Zhejiang Province, China from 5th to 14th March 2020. The questionnaire covered information on demographic characteristics, health status, workplace, lifestyle, attitude towards COVID-19, assessment of anxiety, depression and sleep quality. The Chinese version of the Pittsburgh Sleep Quality Index (CPSQI) was administered to measure the poor sleep quality. Poor sleep quality was defined as a global PSQI score&gt;5. Factors associated with sleep quality were analyzed by logistic regression models. In sum near half (49.2%) of 2,410 returning workers were females and the average year of subjects was 36.3Â Â±Â 9.1 years. The overall prevalence of poor sleep quality was 14.9% (95%CI: 13.5%-16.3%). The average score of PSQI was 3.0Â Â±Â 2.5 and average sleep duration was 7.6Â Â±Â 1.2Â h. Independent related factors of poor sleep quality included age older than 24 years, higher education level, negative attitude towards COVID-19 control measures, anxiety and depression. Poor sleep quality was common and there was a shorter sleep duration among returning workers during the COVID-19 pandemic. Possible risk factors identified from this study may be of great importance in developing proper intervention for the targeted population to improve the sleep health during the COVID-19 public health emergency.","Yang, Zhu, Yang, Lin, Chen, Zhao, Fu",https://doi.org/10.1016/j.sleep.2020.06.034,20200925.0,"COVID-19; China; Occupational population; Pittsburgh sleep quality index; Poor sleep quality; Adolescent; Adult; Betacoronavirus; COVID-19; China; Coronavirus Infections; Cross-Sectional Studies; Female; Humans; Male; Middle Aged; Pandemics; Pneumonia, Viral; Prevalence; SARS-CoV-2; Sleep Initiation and Maintenance Disorders; Surveys and Questionnaires; Workplace; Young Adult",PubMed,,,,,,,,,,,,,,False,False,,,,,False,False,False,,2021-02-26
271,COVID-19 lockdown in people with severe mental disorders in Spain: Do they have a specific psychological reaction compared with other mental disorders and healthy controls?,"The COVID-19 pandemic and the lockdown restrictions could have adverse consequences for patients with severe mental disorders (SMD). Here, we aim to compare the early psychological impact (depression, anxiety, and stress responses, intrusive and avoidant thoughts, and coping strategies) on people with SMD (nâ€¯=â€¯125) compared with two control groups: common mental disorders (CMD, nâ€¯=â€¯250) and healthy controls (HC, nâ€¯=â€¯250). An anonymous online questionnaire using a snowball sampling method was conducted from March 19-26, 2020 and included sociodemographic and clinical data along with the DASS-21 and IES scales. We performed descriptive and bivariate analyses and multinomial and linear regression models. People with SMD had higher anxiety, stress, and depression responses than HC, but lower scores than CMD in all domains. Most people with SMD (87.2%) were able to enjoy free time, although control groups had higher percentages. After controlling for confounding factors, anxiety was the only significant psychological domain with lower scores in HC than people with SMD (ORâ€¯=â€¯0.721; 95% CI: 0.579-0.898). In the SMD group, higher anxiety was associated with being single (betaâ€¯=â€¯0.144), having COVID-19 symptoms (betaâ€¯=â€¯0.146), and a higher score on the stress subscale of DASS-21 (betaâ€¯=â€¯0.538); whereas being able to enjoy free time was a protective factor (betaâ€¯=â€¯-0.244). Our results showed that patients with SMD reacted to the pandemic and the lockdown restrictions with higher anxiety levels than the general public, and suggesting this domain could be a criterion for early intervention strategies and closer follow-up.","GonzÃ¡lez-Blanco, Dal Santo, GarcÃ­a-Ãlvarez, de la Fuente-TomÃ¡s, Moya Lacasa, Paniagua, SÃ¡iz, GarcÃ­a-Portilla, Bobes",https://doi.org/10.1016/j.schres.2020.07.018,20201211.0,"Anxiety; Bipolar disorder; COVID-19; Pandemics; Psychological distress; Psychosis; Adaptation, Psychological; Adult; Anxiety; Anxiety Disorders; Avoidance Learning; Bipolar Disorder; COVID-19; Case-Control Studies; Communicable Disease Control; Depression; Depressive Disorder; Employment; Family; Female; Humans; Income; Linear Models; Male; Marital Status; Mental Disorders; Middle Aged; Protective Factors; Psychological Distress; Psychotic Disorders; Risk Factors; Spain; Stress, Psychological",PubMed,,,,,,,,,,,,,,False,False,,,,,False,False,False,,2021-02-26
272,Surgical Education in the Time of COVID: Understanding the Early Response of Surgical Training Programs to the Novel Coronavirus Pandemic,"Describe the early impact of the COVID-19 pandemic on general surgery residency training nationwide. A 31-question electronic survey was distributed to general surgery program directors. Qualitative data underwent iterative coding analysis. Quantitative data were evaluated with summary statistics and bivariate analyses. Eighty-four residency programs (33.6% response rate) with representation across US geographic regions, program affiliations, and sizes. Widespread changes were observed in the surgical training environment. One hundred percent of programs reduced the number of residents on rounds and 95.2% reduced the size of their in-hospital resident workforce; on average, daytime staffing decreased by nearly half. With telehealth clinics (90.5%) and remote inpatient consults (26.2%), both clinical care and resident didactics (86.9%) were increasingly virtual, with similar impact across all program demographics. Conversely, availability of some wellness initiatives was significantly higher among university programs than independent programs, including childcare (51.2% vs 6.7%), housing (41.9% vs 13.3%), and virtual mental health services (83.7% vs 53.3%). Changes in clinical care delivery dramatically reduced in face-to-face learning opportunities for surgical trainees during the COVID-19 pandemic. While this effect had equal impact across all program types, sizes, and geographies, the same cannot be said for wellness initiatives. Though all programs initiated some strategies to protect resident health, the disparity between university programs and independent programs may be cause for action.","White, Shaughnessy, Esposito, Slade, Korah, Yoo",https://doi.org/10.1016/j.jsurg.2020.07.036,20210225.0,COVID-19; coronavirus; general surgery; graduate medical education; resident wellness; virtual education,PubMed,,,,,,,,,,,,,,False,False,,,,,False,False,False,,2021-02-26
273,COVID-19 and Parent-Child Psychological Well-being,"The outbreak of coronavirus disease 2019 has changed American society in ways that are difficult to capture in a timely manner. With this study, we take advantage of daily survey data collected before and after the crisis started to investigate the hypothesis that the crisis has worsened parents' and children's psychological well-being. We also examine the extent of crisis-related hardships and evaluate the hypothesis that the accumulation of hardships will be associated with parent and child psychological well-being. Daily survey data were collected between February 20 and April 27, 2020, from hourly service workers with a young child (aged 2-7) in a large US city (<i>N</i> = 8222 person-days from 645 individuals). A subsample completed a one-time survey about the effects of the crisis fielded between March 23 and April 26 (subsample <i>n</i> = 561). Ordered probit models revealed that the frequency of parent-reported daily negative mood increased significantly since the start of the crisis. Many families have experienced hardships during the crisis, including job loss, income loss, caregiving burden, and illness. Both parents' and children's well-being in the postcrisis period was strongly associated with the number of crisis-related hardships that the family experienced. Consistent with our hypotheses, in families that have experienced multiple hardships related to the coronavirus disease 2019 crisis, both parents' and children's mental health is worse. As the crisis continues to unfold, pediatricians should screen for mental health, with particular attention to children whose families are especially vulnerable to economic and disease aspects of the crisis.","Gassman-Pines, Ananat, Fitz-Henley",https://doi.org/10.1542/peds.2020-007294,20201013.0,"Affect; Betacoronavirus; COVID-19; Child; Child Care; Child Health; Child, Preschool; Coronavirus Infections; Cost of Illness; Health Surveys; Humans; Income; Mental Health; Pandemics; Parent-Child Relations; Parents; Pneumonia, Viral; SARS-CoV-2; Unemployment; Vulnerable Populations",PubMed,,,,,,,,,,,,,,False,False,,,,,False,False,False,,2021-02-26
274,Work-Related and Personal Factors Associated With Mental Well-Being During the COVID-19 Response: Survey of Health Care and Other Workers,"The response to the severe acute respiratory syndrome coronavirus 2 (SARS-CoV-2) pandemic has created an unprecedented disruption in work conditions. This study describes the mental health and well-being of workers both with and without clinical exposure to patients with coronavirus disease (COVID-19). The aim of this study is to measure the prevalence of stress, anxiety, depression, work exhaustion, burnout, and decreased well-being among faculty and staff at a university and academic medical center during the SARS-CoV-2 pandemic and describe work-related and personal factors associated with their mental health and well-being. All faculty, staff, and postdoctoral fellows of a university, including its medical school, were invited in April 2020 to complete an online questionnaire measuring stress, anxiety, depression, work exhaustion, burnout, and decreased well-being. We examined associations between these outcomes and factors including work in high-risk clinical settings and family/home stressors. There were 5550 respondents (overall response rate of 34.3%). Overall, 34% of faculty and 14% of staff (n=915) were providing clinical care, while 61% of faculty and 77% of staff were working from home. Among all workers, anxiety (prevalence ratio 1.37, 95% CI 1.09-1.73), depression (prevalence ratio 1.28, 95% CI 1.03-1.59), and high work exhaustion (prevalence ratio 1.24, 95% CI 1.13-1.36) were independently associated with community or clinical exposure to COVID-19. Poor family-supportive behaviors by supervisors were also associated with these outcomes (prevalence ratio 1.40, 95% CI 1.21-1.62; prevalence ratio 1.69, 95% CI 1.48-1.92; and prevalence ratio 1.54, 95% CI 1.44-1.64, respectively). Age &lt;40 years and a greater number of family/home stressors were also associated with these poorer outcomes. Among the subset of clinicians, caring for patients with COVID-19 and working in high-risk clinical settings were additional risk factors. Our findings suggest that the pandemic has had negative effects on the mental health and well-being of both clinical and nonclinical employees. Mitigating exposure to COVID-19 and increasing supervisor support are modifiable risk factors that may protect mental health and well-being for all workers.","Evanoff, Strickland, Dale, Hayibor, Page, Duncan, Kannampallil, Gray",https://doi.org/10.2196/21366,20200904.0,"COVID-19; coronavirus; health care workers; mental health; occupational health; pandemic; remote work; worker well-being; Adult; Anxiety; Betacoronavirus; COVID-19; Coronavirus Infections; Depression; Female; Health Personnel; Humans; Male; Mental Health; Occupational Diseases; Pandemics; Pneumonia, Viral; Prevalence; Risk Factors; SARS-CoV-2; Surveys and Questionnaires",PubMed,,,,,,,,,,,,,,False,False,,,,,False,False,False,,2021-02-26
275,Has loneliness increased during COVID-19? Comment on &quot;Loneliness: A signature mental health concern in the era of COVID-19&quot;,,"Sutin, Luchetti, Terracciano",https://doi.org/10.1016/j.psychres.2020.113295,20200907.0,"Betacoronavirus; COVID-19; Coronavirus Infections; Humans; Loneliness; Mental Health; Pandemics; Pneumonia, Viral; SARS-CoV-2",PubMed,,,,,,,,,,,,,,False,False,,,,,False,False,False,,2021-02-26
