,title,abstract,authors,link,date,subject,source,initial_decision,q0,q1,q2,q3,q4,q5,q6,q7,q8,q9,q10,q11,q12,q13,q14,q15,q16,q17,q18,q19,q20,exclusion_reason,extraction_date
192,Mental health and well-being during the COVID-19 pandemic: longitudinal analyses of adults in the UK COVID-19 Mental Health &amp; Wellbeing study,"The effects of coronavirus disease 2019 (COVID-19) on the population's mental health and well-being are likely to be profound and long lasting. To investigate the trajectory of mental health and well-being during the first 6 weeks of lockdown in adults in the UK. A quota survey design and a sampling frame that permitted recruitment of a national sample was employed. Findings for waves 1 (31 March to 9 April 2020), 2 (10 April to 27 April 2020) and 3 (28 April to 11 May 2020) are reported here. A range of mental health factors was assessed: pre-existing mental health problems, suicide attempts and self-harm, suicidal ideation, depression, anxiety, defeat, entrapment, mental well-being and loneliness. A total of 3077 adults in the UK completed the survey at wave 1. Suicidal ideation increased over time. Symptoms of anxiety, and levels of defeat and entrapment decreased across waves whereas levels of depressive symptoms did not change significantly. Positive well-being also increased. Levels of loneliness did not change significantly over waves. Subgroup analyses showed that women, young people (18-29 years), those from more socially disadvantaged backgrounds and those with pre-existing mental health problems have worse mental health outcomes during the pandemic across most factors. The mental health and well-being of the UK adult population appears to have been affected in the initial phase of the COVID-19 pandemic. The increasing rates of suicidal thoughts across waves, especially among young adults, are concerning.","O'Connor, Wetherall, Cleare, McClelland, Melson, Niedzwiedz, O'Carroll, O'Connor, Platt, Scowcroft, Watson, Zortea, Ferguson, Robb",https://doi.org/10.1192/bjp.2020.212,20201125.0,COVID-19; depression; general population; mental health; suicidal ideation,PubMed,,,,,,,,,,,,,,False,False,,,,,False,False,False,,2021-02-26
193,[Pandemic COVID-19 and mental disorders international experience and therapeutic approaches],"The article considers the COVID-19 pandemic impact on the population mental health, the main psychogenic and somatogenic mental disorders associated with COVID-19 are distinguished. The comorbid PTSD clinical features are described. The mental health risk factors for health workers are presented. The psychotherapeutic and psychopharmaceutical approaches are proposed. Ð’ ÑÑ‚Ð°Ñ‚ÑŒÐµ Ð¾Ð¿Ð¸ÑÐ°Ð½Ð¾ Ð²Ð»Ð¸ÑÐ½Ð¸Ðµ Ð¿Ð°Ð½Ð´ÐµÐ¼Ð¸Ð¸ Ð½Ð¾Ð²Ð¾Ð¹ ÐºÐ¾Ñ€Ð¾Ð½Ð°Ð²Ð¸Ñ€ÑƒÑÐ½Ð¾Ð¹ Ð¸Ð½Ñ„ÐµÐºÑ†Ð¸Ð¸ Ð½Ð° Ð¿ÑÐ¸Ñ…Ð¸Ñ‡ÐµÑÐºÐ¾Ðµ Ð·Ð´Ð¾Ñ€Ð¾Ð²ÑŒÐµ Ð½Ð°ÑÐµÐ»ÐµÐ½Ð¸Ñ, Ð²Ñ‹Ð´ÐµÐ»ÐµÐ½Ñ‹ Ð¾ÑÐ½Ð¾Ð²Ð½Ñ‹Ðµ Ð¿ÑÐ¸Ñ…Ð¸Ñ‡ÐµÑÐºÐ¸Ðµ Ñ€Ð°ÑÑÑ‚Ñ€Ð¾Ð¹ÑÑ‚Ð²Ð°, Ð°ÑÑÐ¾Ñ†Ð¸Ð¸Ñ€Ð¾Ð²Ð°Ð½Ð½Ñ‹Ðµ Ñ COVID-19, ÐºÐ°Ðº Ð¿ÑÐ¸Ñ…Ð¾Ð³ÐµÐ½Ð½Ð¾Ð³Ð¾, Ñ‚Ð°Ðº Ð¸ ÑÐ¾Ð¼Ð°Ñ‚Ð¾Ð³ÐµÐ½Ð½Ð¾Ð³Ð¾ Ð³ÐµÐ½ÐµÐ·Ð°. ÐžÐ¿Ð¸ÑÐ°Ð½Ñ‹ Ñ„Ð°ÐºÑ‚Ð¾Ñ€Ñ‹ Ñ€Ð¸ÑÐºÐ° Ñ€Ð°Ð·Ð²Ð¸Ñ‚Ð¸Ñ Ð¿ÑÐ¸Ñ…Ð¸Ñ‡ÐµÑÐºÐ¸Ñ… Ð½Ð°Ñ€ÑƒÑˆÐµÐ½Ð¸Ð¹ Ñƒ Ð¼ÐµÐ´Ð¸Ñ†Ð¸Ð½ÑÐºÐ¸Ñ… Ñ€Ð°Ð±Ð¾Ñ‚Ð½Ð¸ÐºÐ¾Ð². ÐŸÑ€ÐµÐ´ÑÑ‚Ð°Ð²Ð»ÐµÐ½Ñ‹ ÐºÐ»Ð¸Ð½Ð¸Ñ‡ÐµÑÐºÐ¸Ðµ Ð¾ÑÐ¾Ð±ÐµÐ½Ð½Ð¾ÑÑ‚Ð¸ Ñ€Ð°Ð·Ð²Ð¸Ð²Ð°ÑŽÑ‰ÐµÐ³Ð¾ÑÑ Ð½Ð° Ñ„Ð¾Ð½Ðµ Ð¿Ð°Ð½Ð´ÐµÐ¼Ð¸Ð¸ Ð¿Ð¾ÑÑ‚Ñ‚Ñ€Ð°Ð²Ð¼Ð°Ñ‚Ð¸Ñ‡ÐµÑÐºÐ¾Ð³Ð¾ ÑÑ‚Ñ€ÐµÑÑÐ¾Ð²Ð¾Ð³Ð¾ Ñ€Ð°ÑÑÑ‚Ñ€Ð¾Ð¹ÑÑ‚Ð²Ð°. ÐŸÑ€ÐµÐ´Ð»Ð¾Ð¶ÐµÐ½Ñ‹ Ð¿ÑÐ¸Ñ…Ð¾Ñ‚ÐµÑ€Ð°Ð¿ÐµÐ²Ñ‚Ð¸Ñ‡ÐµÑÐºÐ¸Ðµ Ð¸ Ñ„Ð°Ñ€Ð¼Ð°ÐºÐ¾Ñ‚ÐµÑ€Ð°Ð¿ÐµÐ²Ñ‚Ð¸Ñ‡ÐµÑÐºÐ¸Ðµ Ð¿Ð¾Ð´Ñ…Ð¾Ð´Ñ‹ Ðº Ñ‚ÐµÑ€Ð°Ð¿Ð¸Ð¸.",Vasileva,https://doi.org/10.17116/jnevro2020120091121,20201023.0,"PTSD; antidpepressants; anxiety; coronavirus; depression; pandemic; psychotherapy; tranquillizers; Betacoronavirus; COVID-19; Coronavirus Infections; Humans; Mental Disorders; Mental Health; Pandemics; Pneumonia, Viral; SARS-CoV-2",PubMed,,,,,,,,,,,,,,False,False,,,,,False,False,False,,2021-02-26
194,Mental health presentations to Christchurch Hospital Emergency Department during COVID-19 lockdown,"To describe mental health presentations to a tertiary ED in New Zealand during a national COVID-19 lockdown. A retrospective, comparative cohort study in Christchurch Hospital, New Zealand. There was a 3510 (37%)-patient decrease in all presentations to Christchurch Hospital ED during the 5-week COVID-19 lockdown period from 26 March 2020 to 28 April 2020, compared to a 111 (1.2%)-patient decrease in the same time period in the previous year (P &lt;â€‰0.00001). There is usually a seasonal reduction in mental health attendances at this time of year compared to the weeks before. In 2019, there was a 49 (9.8%)-patient reduction in mental health presentations, whereas in 2020 there was a 193 (34%)-patient reduction (P &lt;â€‰0.001). In 2020, the proportion of mental health attendances compared to all ED attendances during the 5-week lockdown period was similar to the 5-week pre-lockdown period (564/9460 vs 371/5950, P =â€‰0.48). The proportion of mental health patients presenting due to overdose increased by 6.5% (158/564 vs 128/371, P =â€‰0.035); those due to self-harm increased by 3.5% (35/564 vs 36/371, P =â€‰0.049). The proportion of mental health presentations due to anxiety, depression and other non-self-harm/overdose complaints decreased by 10% (371/564 vs 207/371, P =â€‰0.002). The proportion of overdoses of paracetamol and ibuprofen increased by 13.4% during lockdown (22/158 vs 35/128, P =â€‰0.005). During the COVID-19 lockdown, both overall ED presentations as well as mental health-related presentations decreased. There was a relative increase in overdoses and self-harm, particularly involving paracetamol and ibuprofen.","Joyce, Richardson, McCombie, Hamilton, Ardagh",https://doi.org/10.1111/1742-6723.13667,20201109.0,COVID-19; emergency department; mental health; overdose; severe acute respiratory syndrome coronavirus 2,PubMed,,,,,,,,,,,,,,False,False,,,,,False,False,False,,2021-02-26
195,Higher binding affinity of furin for SARS-CoV-2 spike (S) protein D614G mutant could be associated with higher SARS-CoV-2 infectivity,"The coronavirus disease 2019 (COVID-19) pandemic has caused an exponential rise in death rates and hospitalizations. The aim of this study was to characterize the D614G substitution in the severe acute respiratory syndome coronavirus 2 (SARS-CoV-2) spike glycoprotein (S protein), which may affect viral infectivity. The effect of D614G substitution on the structure and thermodynamic stability of the S protein was analyzed with use of DynaMut and SCooP. HDOCK and PRODIGY were used to model furin protease binding to the S protein RRAR cleavage site and calculate binding affinities. Molecular dynamics simulations were used to predict the S protein apo structure, the S protein-furin complex structure, and the free binding energy of the complex. The D614G substitution in the G clade of SARS-CoV-2 strains introduced structural mobility and decreased the thermal stability of the S protein (Î”Î”Gâ€‰=â€‰-0.086â€‰kcal mol<sup>-1</sup>). The substitution resulted in stronger binding affinity (K<sub>d</sub>â€‰=â€‰1.6â€‰Ã—â€‰10<sup>-8</sup>) for furin, which may enhance S protein cleavage. The results were corroborated by molecular dynamics simulations demonstrating higher binding energy of furin and the S protein D614G mutant (-61.9â€‰kcalâ€‰mol<sup>-1</sup> compared with -56.78â€‰kcalâ€‰mol<sup>-1</sup> for wild-type S protein). The D614G substitution in the G clade induced flexibility of the S protein, resulting in increased furin binding, which may enhance S protein cleavage and infiltration of host cells. Therefore, the SARS-CoV-2 D614G substitution may result in a more virulent strain.","Mohammad, Alshawaf, Marafie, Abu-Farha, Abubaker, Al-Mulla",https://doi.org/10.1016/j.ijid.2020.10.033,20210216.0,"COVID-19; Furin; G clade; Interatomic binding; Molecular dynamics simulations; S protein; SARS-CoV-2; Thermodynamic stability; COVID-19; Furin; Humans; Mutant Proteins; Protein Binding; SARS-CoV-2; Spike Glycoprotein, Coronavirus; Thermodynamics",PubMed,,,,,,,,,,,,,,False,False,,,,,False,False,False,,2021-02-26
196,COVID-19 pandemic against mental health services for genocide survivors during commemoration week in Rwanda,Psychology; COVID-19 mental health confinement; Rwanda; Lock down; Commemoration.,"Ngamije, Yadufashije",https://doi.org/10.1016/j.heliyon.2020.e05229,20210212.0,COVID-19 mental health confinement; Commemoration; Lock down; Psychology; Rwanda,PubMed,,,,,,,,,,,,,,False,False,,,,,False,False,False,,2021-02-26
197,Depression in and after COVID-19 lockdown in Austria and the role of stress and loneliness in lockdown: A longitudinal study,,"Probst, Budimir, Pieh",https://doi.org/10.1016/j.jad.2020.09.047,20210110.0,,PubMed,,,,,,,,,,,,,,False,False,,,,,False,False,False,,2021-02-26
198,Rapid-Cycle Community Assessment of Health-Related Social Needs of Children and Families During Coronavirus Disease 2019,"To identify unmet health and social resource needs during a county-wide coronavirus disease 19 (COVID-19) stay-at-home order and phased re-opening in Western Pennsylvania. With public health, social service, and community partners connected through an ongoing academic-community collaborative, we developed and fielded a weekly repeated cross-sectional electronic survey assessing usage of and unmet need for health and social service resources. Using 10 weeks of surveys (April 3-June 11, 2020) by Allegheny County residents, we examined variation in responses by week and by sociodemographic characteristics using chi-square tests. We shared written reports weekly and discussed emerging trends with community partners. Participants ranged from 229 to 1001 per week. Unmet need for at least 1 health or health-related social need resource varied by week, ranging from 55% (95% confidence interval [CI] 50%-59%) of participants in week 2 to 43% (95% CI 37%-49%) of participants in week 9 (P = .006). Increased use of at least 1 resource ranged from 53% (95% CI 47%-58%) of participants in week 3 to 36% (95% CI 31%-42%) in week 9 (P &lt; .001). Unmet need for food and financial assistance peaked early during the stay-at-home order, while unmet need for mental health care rose later. Unmet need for food assistance varied significantly by race and ethnicity and by household prepandemic income. Over half of families with children reported unmet health or social service needs during the first month of a county-wide COVID-19 stay-at-home order. Unmet needs varied with race, ethnicity, and income and with duration of the stay-at-home order.","Ray, Ettinger, Dwarakanath, Mistry, Bey, Chaves-Gnecco, Alston, Ripper, Lavage, Landsittel, Miller",https://doi.org/10.1016/j.acap.2020.10.004,20210124.0,children; coronavirus; coronavirus disease 2019; health-related social needs,PubMed,,,,,,,,,,,,,,False,False,,,,,False,False,False,,2021-02-26
199,Social support and acute stress symptoms (ASSs) during the COVID-19 outbreak: deciphering the roles of psychological needs and sense of control,"<b>Background:</b> A cute stress symptoms (ASSs) are likely to be a common mental health problem in the acute period following the 2019 novel coronavirus pneumonia (COVID-19) outbreak. To address this risk, substantial social support has been provided to relieve ASSs during the COVID-19 outbreak. However, the effectiveness of these support methods for relieving ASSs has not yet been assessed. <b>Objective:</b> The current study sought to examine the underlying mechanisms by which social support relieves ASSs, among primary and secondary school teachers. <b>Method:</b>Â A sample of 751 primary and secondary school teachers was selected to answer self-reported questionnaires regarding ASSs, social support, psychological needs, and the sense of control. <b>Results:</b> Structural equation modelling revealed that social support had a non-significant direct relationship with ASSs, and a significant indirect relationship with reduced ASSs via the needs for autonomy and relatedness, and via the paths from three types of psychological needs to the sense of control. <b>Conclusion:</b> These findings suggest that social support can play a relieving role in ASSs when the support satisfies individuals' psychological needs and improves their sense of control. To alleviate ASSs among primary and secondary school teachers, more attention should be paid to satisfying their specific psychological needs and improving their sense of control. <b>Antecedentes:</b> Es probable que los sÃ­ntomas de estrÃ©s agudo (SEAs) sean un problema de salud mental frecuente en el periodo agudo que sigue al nuevo brote de neumonÃ­a por coronavirus 2019 (COVID-19). Para enfrentar este riesgo, se ha brindado un considerable soporte social para aliviar los SEAs durante el brote del COVID-19. Sin embargo, aÃºn no se han evaluado la efectividad de estos mÃ©todos de soporte para aliviar los SEAs.<b>Objetivo:</b> Para cubrir esta brecha, este estudio buscÃ³ evaluar los mecanismos subyacentes mediante los cuales el soporte social alivia los SEAs en profesores de escuelas primarias y secundarias.<b>MÃ©todo:</b> Se tomÃ³ una muestra de 751 profesores de escuelas primarias y secundarias para que respondieran cuestionarios de auto-reporte relacionadas con SEAs, soporte social, necesidades psicolÃ³gicas y la sensaciÃ³n de control.<b>Resultados:</b> El modelo de ecuaciones estructurales revelÃ³ que el soporte social tenÃ­a una relaciÃ³n directa, no significativa, con los SEAs; y que tenÃ­a una relaciÃ³n significativa indirecta con una reducciÃ³n de los SEAs a travÃ©s de las necesidades de autonomÃ­a y relaciÃ³n, y a travÃ©s de las vÃ­as de tres tipos de necesidades psicolÃ³gicas de la sensaciÃ³n de control.<b>Conclusiones:</b> Estos hallazgos sugieren que el soporte social puede desempeÃ±ar un papel de alivio sobre los SEAs cuando el soporte satisface las necesidades psicolÃ³gicas de los individuos y mejora su sensaciÃ³n de control. Para aliviar los SEAs entre los profesores de escuelas primarias y secundarias, se debe prestar mÃ¡s atenciÃ³n en satisfacer sus necesidades especÃ­ficas y mejorar su sensaciÃ³n de control. <b>èƒŒæ™¯ï¼š</b>åœ¨2019å¹´æ–°åž‹å† çŠ¶ç—…æ¯’æ€§è‚ºç‚Ž (COVID-19) çˆ†å‘åŽçš„æ€¥æ€§æœŸ, æ€¥æ€§åº”æ¿€ç—‡çŠ¶ (ASSs) å¯èƒ½æ˜¯å¸¸è§çš„å¿ƒç†å¥åº·é—®é¢˜ã€‚ä¸ºè§£å†³æ­¤é£Žé™©, åœ¨COVID-19çˆ†å‘æœŸé—´, å·²æä¾›äº†å¤§é‡çš„ç¤¾ä¼šæ”¯æŒä»¥ç¼“è§£ASSã€‚ä½†æ˜¯, å°šæœªè¯„ä¼°è¿™äº›æ”¯æŒæ–¹æ³•ç¼“è§£ASSçš„æœ‰æ•ˆæ€§ã€‚<b>ç›®çš„ï¼š</b>å½“å‰çš„ç ”ç©¶è¯•å›¾è€ƒæŸ¥ä¸­å°å­¦æ•™å¸ˆä¸­ç¤¾ä¼šæ”¯æŒå‡è½»ASSçš„æ½œåœ¨æœºåˆ¶ã€‚<b>æ–¹æ³•ï¼š</b>é€‰æ‹©751åä¸­å°å­¦æ•™å¸ˆä½œä¸ºæ ·æœ¬, ä»¥å›žç­”ASS, ç¤¾ä¼šæ”¯æŒ, å¿ƒç†éœ€æ±‚å’ŒæŽ§åˆ¶æ„Ÿç›¸å…³çš„è‡ªæˆ‘æŠ¥å‘Šé—®å·ã€‚<b>ç»“æžœï¼š</b>ç»“æž„æ–¹ç¨‹æ¨¡åž‹æ˜¾ç¤º, ç¤¾ä¼šæ”¯æŒä¸ŽASSä¹‹é—´æœ‰ä¸æ˜¾è‘—çš„ç›´æŽ¥å…³ç³», ä¸Žå‡è½»çš„ASSä¹‹é—´å­˜åœ¨é€šè¿‡å¯¹è‡ªä¸»æ€§ä¸Žå…³ç³»çš„éœ€æ±‚åŠä»Žä¸‰ç±»å¿ƒç†éœ€æ±‚åˆ°æŽ§åˆ¶æ„Ÿçš„è·¯å¾„çš„æ˜¾è‘—çš„é—´æŽ¥å…³ç³»ã€‚<b>ç»“è®ºï¼š</b>è¿™äº›å‘çŽ°è¡¨æ˜Ž, å½“ç¤¾ä¼šæ”¯æŒå¯ä»¥æ»¡è¶³ä¸ªäººçš„å¿ƒç†éœ€æ±‚å¹¶æé«˜å…¶æŽ§åˆ¶æ„Ÿæ—¶, å®ƒä»¬å¯ä»¥åœ¨ASSä¸­èµ·åˆ°ç¼“è§£ä½œç”¨ã€‚ä¸ºäº†å‡è½»ä¸­å°å­¦æ•™å¸ˆçš„ASS, åº”æ›´åŠ æ³¨æ„æ»¡è¶³å…¶ç‰¹å®šå¿ƒç†éœ€æ±‚å¹¶æé«˜ä»–ä»¬çš„æŽ§åˆ¶æ„Ÿã€‚<b>å…³é”®è¯</b>ï¼šæ€¥æ€§åº”æ¿€ç—‡çŠ¶; ç¤¾ä¼šæ”¯æŒ; å¿ƒç†éœ€æ±‚; æŽ§åˆ¶æ„Ÿ.","Zhou, Yao",https://doi.org/10.1080/20008198.2020.1779494,20201022.0,Social support can play a relieving role in ASSs when the support satisfies individualsâ€™ psychological needs and improves their sense of control during COVID-19 outbreak.; acute stress symptoms; psychological needs; sense of control; social support,PubMed,,,,,,,,,,,,,,False,False,,,,,False,False,False,,2021-02-26
200,Psychosocial Safety Climate of Employees During the COVID-19 Pandemic in Iran: A Policy Analysis,"Iran is among the top 15 countries in the world in terms of coronavirus disease (COVID-19) infection rates. The numbers of infections and deaths are still increasing in September 2020. This study aims to investigate the impact of the policies on terminating the quarantine period on the perception of psychosocial safety by employees and workers in Iran. In this study, policy announcements and regulations, media reports, and the results were collected from 2 previously published population surveys that collected employees' views of the government approach to quarantine. The information thus collected was then analyzed using the &quot;What is the Problem Represented (WPR)&quot; approach for data analysis introduced by Carol Bacchi, and focuses on the question, &quot;What effects are produced by the representation of the problem?&quot; The Iranian Government decided to quarantine people and close most sectors during the New Year holidays in Iran in March 2020. The duration of quarantine was only 2 weeks, and the government then ordered government organizations and industrial companies to reopen. The advantage of a short quarantine period is assumed to be the reinstatement of productivity while the disadvantage is the likely risk of further transmission of the virus. The government approach to and communication about the quarantine period has neglected to consider the psychosocial safety climate of employees, who have to go to their workplaces using buses, subways, or other vehicles, and who are under pressure mentally because of fear of infection, dismissal for non-attendance, and the consequent economic problems. The government approach necessarily impacts on the perceived psychosocial safety climate of employees, and hence influences the causes of work stress. If the psychosocial safety climate is not considered and improved, it may reduce the quality of services and products, and increase accidents.","Seddighi, Dollard, Salmani",https://doi.org/10.1017/dmp.2020.370,20201125.0,COVID-19; Iran; human resources management; mental health; occupational health; policy analysis; psychosocial safety climate,PubMed,,,,,,,,,,,,,,False,False,,,,,False,False,False,,2021-02-26
201,The Impact of COVID-19 Stay-At-Home Orders on Health Behaviors in Adults,"Stay-at-home orders in response to the coronavirus disease 2019 (COVID-19) pandemic have forced abrupt changes to daily routines. This study assessed lifestyle changes across different BMI classifications in response to the global pandemic. The online survey targeting adults was distributed in April 2020 and collected information on dietary behaviors, physical activity, and mental health. All questions were presented as &quot;before&quot; and &quot;since&quot; the COVID-19 pandemic. In total, 7,753 participants were included; 32.2% of the sample were individuals with normal weight, 32.1% had overweight, and 34.0% had obesity. During the pandemic, overall scores for healthy eating increased (Pâ€‰&lt;â€‰0.001), owing to less eating out and increased cooking (Pâ€‰&lt;â€‰0.001). Sedentary leisure behaviors increased, while time spent in physical activity (absolute time and intensity adjusted) declined (Pâ€‰&lt;â€‰0.001). Anxiety scores increased 8.78â€‰Â±â€‰0.21 during the pandemic, and the magnitude of increase was significantly greater in people with obesity (Pâ€‰â‰¤â€‰0.01). Weight gain was reported in 27.5% of the total sample compared with 33.4% in participants with obesity. The COVID-19 pandemic has produced significant health effects, well beyond the virus itself. Government mandates together with fear of contracting the virus have significantly impacted lifestyle behaviors alongside declines in mental health. These deleterious impacts have disproportionally affected individuals with obesity.","Flanagan, Beyl, Fearnbach, Altazan, Martin, Redman",https://doi.org/10.1002/oby.23066,20210204.0,Adult; COVID-19; Exercise; Female; Health Behavior; Humans; Life Style; Male; Mental Health; Obesity; Overweight; Quarantine; SARS-CoV-2; Surveys and Questionnaires; Young Adult,PubMed,,,,,,,,,,,,,,False,False,,,,,False,False,False,,2021-02-26
202,COVID-19 pandemic and mental distress in multiple sclerosis: implications for clinical management,"In multiple sclerosis (MS), disease-related factors and dysfunctional coping might favor the development of mental distress induced by COVID-19 containment measures. Aim of this study was exploring the relationship between disability, coping strategies, daily life reorganization and neuropsychiatric symptoms in an Italian MS population during the COVID-19 lockdown, in order to identify potentially modifiable factors that could inform clinical management of mental distress in people with MS. We explored the relationship between mental distress, disability and coping strategies in the Italian MS population under lockdown. Structural equation modeling was applied to information collected via web survey to identify modifiable factors that could account for mental distress. A total of 845 participants (497 with MS and 348 controls) were included in the study. The MS group had higher scores than the control group for depression (PÂ =Â 0.005), but not for anxiety, emotional dyscontrol or sleep disturbances. The structural equation modeling explained 74% of the variance observed in depression score. Within the model, three latent factors were characterized from measured variables: motor disability and cognitive dysfunction contributed to disability (Î²Â =Â 0.509 and Î²Â =Â 0.836; PÂ &lt;Â 0.001); positive attitude and exercise contributed to active attitude (Î²Â =Â 0.386 and Î²Â =Â 0.297; PÂ &lt;Â 0.001); and avoidance, social support and watching television contributed to passive attitude (Î²Â =Â 0.301, Î²Â =Â 0.243 and Î²Â =Â 0.212; PÂ &lt;Â 0.001). With regard to the relationship between latent factors and their influence on depression, disability contributed to passive attitude (Î²Â =Â 0.855; PÂ &lt;Â 0.001), while both passive and active attitude significantly influenced depression (Î²Â =Â 0.729 and Î²Â =Â -0.456; PÂ &lt;Â 0.001). As a practical implication of our model, favoring exercise would enhance active attitude and its positive impact on mental well-being while, at the same time, reducing the negative impact of disability on depression, representing a valuable tool in facing COVID-19-related mental distress.","Costabile, Carotenuto, Lavorgna, Borriello, Moiola, Inglese, Petruzzo, Trojsi, Ianniello, Nozzolillo, Cellerino, Boffa, Rosa, Servillo, Moccia, Bonavita, Filippi, Lanzillo, Brescia Morra, Petracca",https://doi.org/10.1111/ene.14580,20201120.0,COVID-19; coping; depression; exercise; multiple sclerosis,PubMed,,,,,,,,,,,,,,False,False,,,,,False,False,False,,2021-02-26
