,title,abstract,authors,link,date,subject,source,initial_decision,q0,q1,q2,q3,q4,q5,q6,q7,q8,q9,q10,q11,q12,q13,q14,q15,q16,q17,q18,q19,q20,exclusion_reason,extraction_date
139,The Impact of COVID-19 Stay-At-Home Orders on Health Behaviors in Adults,"Stay-at-home orders in response to the coronavirus disease 2019 (COVID-19) pandemic have forced abrupt changes to daily routines. This study assessed lifestyle changes across different BMI classifications in response to the global pandemic. The online survey targeting adults was distributed in April 2020 and collected information on dietary behaviors, physical activity, and mental health. All questions were presented as &quot;before&quot; and &quot;since&quot; the COVID-19 pandemic. In total, 7,753 participants were included; 32.2% of the sample were individuals with normal weight, 32.1% had overweight, and 34.0% had obesity. During the pandemic, overall scores for healthy eating increased (Pâ€‰&lt;â€‰0.001), owing to less eating out and increased cooking (Pâ€‰&lt;â€‰0.001). Sedentary leisure behaviors increased, while time spent in physical activity (absolute time and intensity adjusted) declined (Pâ€‰&lt;â€‰0.001). Anxiety scores increased 8.78â€‰Â±â€‰0.21 during the pandemic, and the magnitude of increase was significantly greater in people with obesity (Pâ€‰â‰¤â€‰0.01). Weight gain was reported in 27.5% of the total sample compared with 33.4% in participants with obesity. The COVID-19 pandemic has produced significant health effects, well beyond the virus itself. Government mandates together with fear of contracting the virus have significantly impacted lifestyle behaviors alongside declines in mental health. These deleterious impacts have disproportionally affected individuals with obesity.","Flanagan, Beyl, Fearnbach, Altazan, Martin, Redman",https://doi.org/10.1002/oby.23066,20201218.0,,PubMed,,,,,,,,,,,,,,False,False,,,,,False,False,False,,2021-01-08
140,COVID-19 pandemic and mental distress in multiple sclerosis: implications for clinical management,"In multiple sclerosis (MS), disease-related factors and dysfunctional coping might favor the development of mental distress induced by COVID-19 containment measures. Aim of this study was exploring the relationship between disability, coping strategies, daily life reorganization and neuropsychiatric symptoms in an Italian MS population during the COVID-19 lockdown, in order to identify potentially modifiable factors that could inform clinical management of mental distress in people with MS. We explored the relationship between mental distress, disability and coping strategies in the Italian MS population under lockdown. Structural equation modeling was applied to information collected via web survey to identify modifiable factors that could account for mental distress. A total of 845 participants (497 with MS and 348 controls) were included in the study. The MS group had higher scores than the control group for depression (PÂ =Â 0.005), but not for anxiety, emotional dyscontrol or sleep disturbances. The structural equation modeling explained 74% of the variance observed in depression score. Within the model, three latent factors were characterized from measured variables: motor disability and cognitive dysfunction contributed to disability (Î²Â =Â 0.509 and Î²Â =Â 0.836; PÂ &lt;Â 0.001); positive attitude and exercise contributed to active attitude (Î²Â =Â 0.386 and Î²Â =Â 0.297; PÂ &lt;Â 0.001); and avoidance, social support and watching television contributed to passive attitude (Î²Â =Â 0.301, Î²Â =Â 0.243 and Î²Â =Â 0.212; PÂ &lt;Â 0.001). With regard to the relationship between latent factors and their influence on depression, disability contributed to passive attitude (Î²Â =Â 0.855; PÂ &lt;Â 0.001), while both passive and active attitude significantly influenced depression (Î²Â =Â 0.729 and Î²Â =Â -0.456; PÂ &lt;Â 0.001). As a practical implication of our model, favoring exercise would enhance active attitude and its positive impact on mental well-being while, at the same time, reducing the negative impact of disability on depression, representing a valuable tool in facing COVID-19-related mental distress.","Costabile, Carotenuto, Lavorgna, Borriello, Moiola, Inglese, Petruzzo, Trojsi, Ianniello, Nozzolillo, Cellerino, Boffa, Rosa, Servillo, Moccia, Bonavita, Filippi, Lanzillo, Brescia Morra, Petracca",https://doi.org/10.1111/ene.14580,20201120.0,COVID-19; coping; depression; exercise; multiple sclerosis,PubMed,,,,,,,,,,,,,,False,False,,,,,False,False,False,,2021-01-08
141,&quot;Physical Sex Is Over for Now&quot;: Impact of COVID-19 on the Well-Being and Sexual Health of Adolescent Sexual Minority Males in the US,"This study aimed to explore how the COVID-19 pandemic and physical distancing measures have impacted the well-being and sexual health among adolescent sexual minority males (ASMM) during the initial phase of physical distancing mandates in the U.S. From March 27, 2020, to May 8, 2020, U.S. ASMM (NÂ = 151; aged 14-17 years) completed the online baseline survey of a sexual health intervention trial. COVID-19-related closed- and open-ended questions were included. A mixed-methods approach assessed COVID-19-related changes in well-being and sexual health by outness with an accepting guardian. The majority (57%) of participants reported being worried about COVID-19. Almost all (91%) were physically distancing. Participants noted that COVID-19 changed school, home, work, and family life. Participants highlighted that COVID-19 reduced their ability to socialize and had a deleterious effect on their mental health. In the past 3 months, participants reported seeing sexual partners in person less often, masturbating and viewing pornography more often, and sexting and messaging on men-seeking-men websites/phone applications about the same amount. Many described being physically distanced from sexual partners, and some noted an increase in their use of virtual ways to connect with partners (e.g., video chatting). There were no differences by outness with an accepting guardian in quantitative or qualitative responses. These findings provide a snapshot of the initial effects of the COVID-19 pandemic among a convenience sample of U.S. ASMM and underscore the need to provide access to resources sensitive to their social, developmental, and sexual health needs during this crisis.","Nelson, Gordon, John, Stout, Macapagal",https://doi.org/10.1016/j.jadohealth.2020.08.027,20201224.0,ASMM; Adolescents; COVID-19; Mental health; Sexual health; Sexual minority; YMSM; Adolescent; Adolescent Health; COVID-19; Humans; Internet; Male; Sexual Partners; Sexual and Gender Minorities; Surveys and Questionnaires; United States,PubMed,,,,,,,,,,,,,,False,False,,,,,False,False,False,,2021-01-08
142,Impact on mental health of the COVID-19 outbreak among community pharmacists during the sanitary lockdown period,"COVID-19 outbreak can impact mental health including health care workers. The aim of this study was to assess the psychological impact of COVID-19 in French community pharmacists. We carried out a postal-based survey to assess the psychological impact of COVID-19 in French owner community pharmacists based on three validated self-report questionnaires: Perceived Stress scale, Impact of Event Scale-revised and Maslach Burnout Inventory. The sample consists of 135 community pharmacists. Twenty-three pharmacists reported significant post-traumatic stress symptoms (17%). High burnout symptoms were found in 33 (25%), 46 (34.9%) and 4 (3%) participants. Females scored higher than males for all questionnaires (P=0.01). This study is the first study which showed the psychological impact of COVID-19 in community pharmacists. Based on validated self-report questionnaires, up to 35% of pharmacists reported psychological disturbances. Interventions to promote psychological well-being of healthcare workers need to be developing.","Lange, Joo, Couette, de Jaegher, Joly, Humbert",https://doi.org/10.1016/j.pharma.2020.09.002,20201119.0,"Burnout; COVID-19; Mental health; Pharmaciens; Pharmacists; SantÃ© mentale; Adult; Aged; Betacoronavirus; Burnout, Professional; COVID-19; Community Pharmacy Services; Coronavirus Infections; Depersonalization; Emotions; Female; France; Humans; Male; Middle Aged; Occupational Stress; Pandemics; Pharmacists; Pneumonia, Viral; SARS-CoV-2; Self Report; Severity of Illness Index; Sex Distribution; Stress Disorders, Post-Traumatic; Stress, Psychological; Surveys and Questionnaires",PubMed,,,,,,,,,,,,,,False,False,,,,,False,False,False,,2021-01-08
143,Virtual Reality Behavioral Activation as an Intervention for Major Depressive Disorder: Case Report,"Major depressive disorder (MDD) is a global problem with an increasing incidence and prevalence. There has additionally been an increase in depression due to the COVID-19 pandemic. Behavioral activation is considered an evidence-based treatment for MDD. However, there are many barriers that could hinder one's ability to engage in behavioral activation, with COVID-19 &quot;shelter-in-place&quot; and social distancing orders being current and large impediments. Virtual reality (VR) has been successfully used to help treat a variety of mental health conditions, but it has not yet been used as a method of administering behavioral activation to a clinical population. Using VR to engage in behavioral activation could eliminate barriers that pandemic precautions place and help decrease symptoms of depression that are especially exacerbated in these times. The following case report examines the feasibility, acceptability, and tolerability of VR behavioral activation for an adult with MDD during a global pandemic. This participant was part of a larger pilot study, and the case serves as a description of the VR intervention. The participant engaged in a weekly 50-minute psychotherapy Zoom session for 4 weeks, in which a modified behavioral activation protocol was administered using a VR headset to simulate activities. Data on mood ratings, homework compliance, and headset use were obtained from the headset. Acceptability, tolerability, and depression symptoms were obtained using self-report rating scales. The intervention was feasible, acceptable, and tolerable, as reported by this participant. The participant's depressive symptoms decreased by five-points on the Patient Health Questionnaire-9 over a month, with a beginning score of 10 (moderate depression) and a final score of 5 (mild depression). The implications of these findings for future research are discussed. ClinicalTrials.gov NCT04268316; http://clinicaltrials.gov/ct2/show/NCT04268316.","Paul, Bullock, Bailenson",https://doi.org/10.2196/24331,20201117.0,COVID-19; VR; acceptability; behavior; behavioral activation; case report; depression; feasibility; intervention; major depressive disorder; pilot study; telehealth; virtual reality,PubMed,,,,,,,,,,,,,,False,False,,,,,False,False,False,,2021-01-08
144,Trauma-informed responses in addressing public mental health consequences of the COVID-19 pandemic: position paper of the European Society for Traumatic Stress Studies (ESTSS),"The COVID-19 pandemic has changed life in Europe and globally. The pandemic affects both individuals and the broader society across many domains, including physical and psychological health, the economy and general welfare. The measures taken to counteract the pandemic have significantly altered daily life and, along with the threat of contracting the coronavirus and uncertainties surrounding future developments, created a complex system of stressors with a negative impact on public mental health. This paper aims to outline the ESTSS strategy to address mental health issues related to COVID-19 and focuses on (1) trauma-informed policies, (2) capacity building, (3) collaborative research and (4) knowledge-exchange. To facilitate implementation of a trauma-informed approach and appropriate measures, ESTSS has developed a toolkit of recommendations on mental health and psychosocial assistance to be provided during the different phases of crisis and its aftermath. To promote capacity building, ESTSS offers a certification programme based on a curriculum in psychotraumatology and corresponding on-line training to the European community of mental health professionals. To assure evidence-based approaches and methods tailored to current circumstances, ESTSS has initiated a pan-European research project with international cooperation aimed at studying the mental health consequences of the pandemic, with a focus on psychological trauma and other stress-related reactions. To foster knowledge-exchange, the European Journal of Psychotraumatology (EJPT), the official journal of ESTSS, is publishing a special issue on COVID-19. La pandemia de COVID-19 ha cambiado la vida en Europa y en todo el mundo. La pandemia afecta tanto a los individuos como a la sociedad en general en muchos Ã¡mbitos, incluida la salud fÃ­sica y psicolÃ³gica, la economÃ­a y el bienestar general. Las medidas tomadas para contrarrestar la pandemia han alterado significativamente la vida diaria y, junto con la amenaza de contraer el coronavirus y las incertidumbres que rodean los desarrollos futuros, crearon un complejo sistema de estresores con un impacto negativo en la salud mental pÃºblica. En este artÃ­culo se pretende esbozar la estrategia de la ESTSS para abordar los problemas de salud mental relacionados con COVID-19 y se centra en: 1. PolÃ­ticas informadas en trauma, 2. capacitaciÃ³n, 3. investigaciÃ³n colaborativa, 4. e intercambio de conocimientos. Para facilitar la implementaciÃ³n de un enfoque basado en el trauma y las medidas apropiadas, la ESTSS ha desarrollado un conjunto de herramientas de recomendaciones sobre salud mental y asistencia psicosocial que se proporcionarÃ¡ durante las diferentes fases de la crisis y sus consecuencias. Para fomentar la capacitaciÃ³n, la ESTSS ofrece un programa de certificaciÃ³n basado en un plan de estudios en psicotraumatologÃ­a y la formaciÃ³n on-line correspondiente a la comunidad europea de profesionales de la salud mental. Para asegurar enfoques y mÃ©todos basados en la evidencia adaptados a las circunstancias actuales, la ESTSS ha iniciado un proyecto de investigaciÃ³n paneuropeo con cooperaciÃ³n internacional, destinado a estudiar las consecuencias de la pandemia en la salud mental, con enfoque en el trauma psicolÃ³gico y otras reacciones relacionadas con el estrÃ©s. Para fomentar intercambio de conocimiento, la European Journal of Psychotraumatology (EJPT), la revista oficial de ESTSS, publica un nÃºmero especial sobre COVID-19. COVID-19ç–«æƒ…æ”¹å˜äº†æ¬§æ´²ä¹ƒè‡³å…¨çƒçš„ç”Ÿæ´»ã€‚ç–«æƒ…å½±å“ç€ä¸ªäººå’Œæ•´ä¸ªç¤¾ä¼š, æ¶‰åŠä¼—å¤šé¢†åŸŸ, åŒ…æ‹¬èº«å¿ƒå¥åº·, ç»æµŽå’Œä¸€èˆ¬ç¦åˆ©ã€‚ä¸ºåº”å¯¹ç–«æƒ…é‡‡å–çš„æŽªæ–½å·²å¤§å¤§æ”¹å˜äº†äººä»¬çš„æ—¥å¸¸ç”Ÿæ´», å¹¶ä¸”éšç€å† çŠ¶ç—…æ¯’æ„ŸæŸ“çš„å¨èƒåŠæœªæ¥å‘å±•çš„ä¸ç¡®å®šæ€§, é€ æˆäº†ä¸€ä¸ªå¤æ‚çš„åº”æ¿€æºç³»ç»Ÿ, å¯¹å…¬å…±å¿ƒç†å¥åº·äº§ç”Ÿäº†è´Ÿé¢å½±å“ã€‚æœ¬æ–‡æ—¨åœ¨æ¦‚è¿°ESTSSè§£å†³COVID-19ç›¸å…³å¿ƒç†å¥åº·é—®é¢˜çš„ç­–ç•¥, å¹¶é‡ç‚¹å…³æ³¨:1.åˆ›ä¼¤çŸ¥æƒ…æ”¿ç­–, 2.èƒ½åŠ›å»ºè®¾, 3.åˆä½œç ”ç©¶ä»¥åŠ 4.çŸ¥è¯†äº¤æµã€‚ä¸ºäº†ä¿ƒè¿›åˆ›ä¼¤çŸ¥æƒ…æ–¹æ³•å’Œé€‚å½“æŽªæ–½çš„å®žè¡Œ, ESTSSå¼€å‘äº†ä¸€å¥—å·¥å…·åŒ…, åŒ…å«å¯åœ¨å±æœºä¸åŒé˜¶æ®µåŠä¹‹åŽæä¾›çš„å…³å¿ƒç†å¥åº·å’Œç¤¾ä¼šå¿ƒç†æ´åŠ©çš„å»ºè®®ã€‚ä¸ºäº†ä¿ƒè¿›èƒ½åŠ›å»ºè®¾, ESTSSæä¾›äº†åŸºäºŽç²¾ç¥žåˆ›ä¼¤å­¦è¯¾ç¨‹çš„è®¤è¯è®¡åˆ’, å¹¶å‘æ¬§æ´²ç²¾ç¥žå«ç”Ÿä¸“ä¸šäººå‘˜ç¤¾åŒºæä¾›äº†ç›¸åº”çš„åœ¨çº¿åŸ¹è®­ã€‚ä¸ºäº†ç¡®ä¿é‡‡å–é’ˆå¯¹å½“å‰æƒ…å†µå®šåˆ¶çš„å¾ªè¯æ–¹æ³•, ESTSSä¸Žå›½é™…åˆä½œå¯åŠ¨äº†ä¸€é¡¹æ³›æ¬§ç ”ç©¶é¡¹ç›®, æ—¨åœ¨ç ”ç©¶ç–«æƒ…çš„å¿ƒç†å¥åº·åŽæžœ, é‡ç‚¹å…³æ³¨å¿ƒç†åˆ›ä¼¤å’Œå…¶ä»–åº”æ¿€ç›¸å…³ååº”ã€‚ä¸ºäº†ä¿ƒè¿›çŸ¥è¯†äº¤æµ, ESTSSçš„å®˜æ–¹æ‚å¿—ã€Šæ¬§æ´²ç²¾ç¥žåˆ›ä¼¤å­¦æ‚å¿—ã€‹ (EJPT) æ­£åœ¨å‡ºç‰ˆCOVID-19ç›¸å…³ç‰¹åˆŠã€‚.","Javakhishvili, Ardino, BragesjÃ¶, Kazlauskas, Olff, SchÃ¤fer",https://doi.org/10.1080/20008198.2020.1780782,20201009.0,"COVID-19; COVID-19; Europa; ESTSS; salud mental pÃºblica; psicotraumatologÃ­a; especÃ­fico del trauma; trauma-informado; prevenciÃ³n; ESTSS; Europe; prevention; psychotraumatology; public mental health; trauma-informed; trauma-specific; â€¢ ESTSS implements a broad and inclusive response to COVID-19, adopting a multi-layered approach under the umbrella of trauma-informed principles and focuses on (1) trauma-informed policies, (2) capacity building, (3) collaborative research, and knowledge-exchange.",PubMed,,,,,,,,,,,,,,False,False,,,,,False,False,False,,2021-01-08
145,REACH for mental health in the COVID19 pandemic: an urgent call for public health action,"Our submission is responsive to the urgent need for public mental health action prompted by the escalating COVID-19 pandemic. In it, we review the evidence calling for urgent public mental health action, propose a mental health equivalent fo the World Health Organization's 'Do the Five' concept, and describe the 'REACH for Mental Health' public health measure we have launched at the Harvard T.H. Chan School of Public Health. Nuestra presentaciÃ³n responde a la necesidad urgente de acciones en la salud mental pÃºblica debido a la creciente pandemia de COVID-19. En esta presentaciÃ³n revisamos la evidencia que exige acciones urgentes de la salud mental pÃºblica, proponemos un equivalente de salud mental del concepto â€˜Haz los cincoâ€™ de la OrganizaciÃ³n Mundial de la Salud, y describimos la intervenciÃ³n de salud pÃºblica â€˜REACH (por sus siglas en ingles) para Salud Mentalâ€™ que hemos lanzado en la Escuela T.H. Chan de Salud PÃºblica de Harvard. æœ¬æ–‡æ˜¯å¯¹å› COVID-19å¤§æµè¡Œå‡çº§è€Œæ€¥éœ€é‡‡å–å…¬å…±ç²¾ç¥žå«ç”Ÿè¡ŒåŠ¨çš„å›žåº”ã€‚åœ¨æœ¬æ–‡ä¸­, æˆ‘ä»¬ç»¼è¿°äº†å‘¼åé‡‡å–ç´§æ€¥å…¬å…±ç²¾ç¥žå«ç”Ÿè¡ŒåŠ¨çš„è¯æ®, æå‡ºäº†ä¸Žä¸–ç•Œå«ç”Ÿç»„ç»‡çš„â€˜åšåˆ°äº”ç‚¹ (Do the Five)â€™æ¦‚å¿µç›¸å½“çš„å¿ƒç†å¥åº·æŽªæ–½, å¹¶æè¿°äº†æˆ‘ä»¬åœ¨å“ˆä½›å¤§å­¦é™ˆæ°´æ¸…å…¬å…±å«ç”Ÿå­¦é™¢å…±åŒå‘èµ·çš„â€˜ä¸ºç²¾ç¥žå«ç”Ÿæä¾›REACHå¿ƒç†å¥åº·â€™å…¬å…±å«ç”Ÿå¹²é¢„æŽªæ–½ã€‚æˆ‘ä»¬æè¿°äº†è¿™ç§å¹²é¢„æŽªæ–½ä»¥æ”¯æŒå¿…è¦çš„å…¬å…±å«ç”Ÿè¡ŒåŠ¨, ä»¥é˜²æ­¢éšç€COVID-19å¤§æµè¡Œçš„å…¨é¢å±•å¼€è€Œå¼•å‘çš„å¹¿æ³›ç²¾ç¥žå«ç”Ÿå±æœºã€‚.","Denckla, Gelaye, Orlinsky, Koenen",https://doi.org/10.1080/20008198.2020.1762995,20210105.0,COVID-19; Trauma; public mental health; â€¢ COVID-19 pandemic carries all hallmarks of a traumatic event.â€¢ Large-scale public mental health measures are needed to mitigate effects.â€¢ â€œDo the Five for Mental Healthâ€ is summarized by the REACH acronym.,PubMed,,,,,,,,,,,,,,False,False,,,,,False,False,False,,2021-01-08
146,Risk of Mortality in Elderly Coronavirus Disease 2019 Patients With Mental Health Disorders: A Nationwide Retrospective Study in South Korea,"This study aimed to investigate the different clinical characteristics among elderly coronavirus disease 2019 (COVID-19) patients with and without mental disorders in South Korea and determine if these characteristics have an association with underlying mental disorders causing mortality. A population-based comparative cohort study was conducted using the national claims database. Individuals aged â‰¥65 years with confirmed COVID-19 between January 1, 2020 and April 10, 2020 were assessed. The endpoints for evaluating mortality for all participants were death, 21 days after diagnosis, or April 10, 2020. The risk of mortality associated with mental disorders was estimated using Cox hazards regression. We identified 814 elderly COVID-19 patients (255 [31.3%] with mental disorder and 559 [68.7%] with nonmental disorder). Individuals with mental disorders were found more likely to be older, taking antithrombotic agents, and had diabetes, hypertension, chronic obstructive lung disease, and urinary tract infections than those without mental disorders. After propensity score stratification, our study included 781 patients in each group (236 [30.2%] with mental disorder and 545 [69.8%] with nonmental disorder). The mental disorder group showed higher mortality rates than the nonmental disorder group (12.7% [30/236] versus 6.8% [37/545]). However, compared to patients without mental disorders, the hazard ratio (HR) for mortality in elderly COVID-19 patients with mental disorders was not statistically significant (HR: 1.57, 95%CI: 0.95-2.56). Although the association between mental disorders in elderly individuals and mortality in COVID-19 is unclear, this study suggests that elderly patients with comorbid conditions and those taking psychiatric medications might be at a higher risk of COVID-19.","Lee, Cho, You, Park, Kim, Lee, Aizenstein, Andreescu, Karim, Hong, Rho, Park, Son",https://doi.org/10.1016/j.jagp.2020.09.016,20201130.0,"COVID-19; Elderly; mental disorder; mortality; Aged; Betacoronavirus; COVID-19; Cohort Studies; Comorbidity; Coronavirus Infections; Female; Humans; Male; Mental Disorders; Mental Health; Pandemics; Pneumonia, Viral; Proportional Hazards Models; Republic of Korea; Risk Assessment; Risk Factors; SARS-CoV-2",PubMed,,,,,,,,,,,,,,False,False,,,,,False,False,False,,2021-01-08
147,"Communicable Diseases (Including COVID-19)-Induced Global Depression: Caused by Inadequate Healthcare Expenditures, Population Density, and Mass Panic","Coronavirus (COVID-19) is spreading at an enormous rate and has caused deaths beyond expectations due to a variety of reasons. These include: (i) inadequate healthcare spending causing, for instance, a shortage of protective equipment, testing swabs, masks, surgical gloves, gowns, etc.; (ii) a high population density that causes close physical contact among community members who reside in compact places, hence they are more likely to be exposed to communicable diseases, including coronavirus; and (iii) mass panic due to the fear of experiencing the loss of loved ones, lockdown, and shortage of food. In a given scenario, the study focused on the following key variables: communicable diseases, healthcare expenditures, population density, poverty, economic growth, and COVID-19 dummy variable in a panel of 76 selected countries from 2010 through 2019. The results show that the impact of communicable diseases on economic growth is positive because the infected countries get a reap of economic benefits from other countries in the form of healthcare technologies, knowledge transfers, cash transfers, international loans, aid, etc., to get rid of the diseases. However, the case is different with COVID-19 as it has seized the whole world together in a much shorter period of time and no other countries are able to help others in terms of funding loans, healthcare facilities, or technology transfers. Thus, the impact of COVID-19 in the given study is negatively impacting countries' economic growth that converts into a global depression. The high incidence of poverty and social closeness increases more vulnerable conditions that spread coronavirus across countries. The momentous increase in healthcare expenditures put a burden on countries' national healthcare bills that stretch the depression phase-out of the boundary. The forecasting relationship suggested the negative impact of the coronavirus pandemic on the global economy would last the next 10 years. Unified global healthcare policies, physical distancing, smart lockdowns, and meeting food challenges are largely required to combat the coronavirus pandemic and escape from global depression.","Anser, Yousaf, Khan, Sheikh, Nassani, Abro, Zaman",https://doi.org/10.3389/fpubh.2020.00398,20201006.0,(COVID-19); GMM estimator; communicable diseases; global depression; healthcare expenditures; population density; poverty incidence,PubMed,,,,,,,,,,,,,,False,False,,,,,False,False,False,,2021-01-08
