,title,abstract,authors,link,date,subject,source,initial_decision,q0,q1,q2,q3,q4,q5,q6,q7,q8,q9,q10,q11,q12,q13,q14,q15,q16,q17,q18,q19,q20,exclusion_reason,extraction_date
261,Assessment of Mental Health and Various Coping Strategies among general population living Under Imposed COVID-Lockdown Across world: A Cross-Sectional Study,"The 2019 corona virus disease (COVID-19) which outbreak in December 2019, in the Chinese city of Wuhan has became a global threat and is currently the largest known outbreak of atypical pneumonia affecting every continent of the world with about 6,416,828Â cases and 382,867Â deaths. Disease enforced lockdowns are known to cause heightened levels of depression, anxiety, and stress. Our study aimed to investigate the immediate impact of the COVID-19 pandemic enforced lockdown on mental health and quality of life among general population aged 18Â years and to identify various coping strategies used under lockdown. An online survey was conducted between 1st of April-10th of May, 2020; using a validated questionnaire based on DASS-42, employing a snowball sampling technique. A total of 418 responses from 16 different countries were received. The respondents had a high level of depression and anxiety scores, which were significantly different among genders. Also, participants from developing countries-India and Pakistan had severe depression while as participants from India, Pakistan and Kingdom of Saudi Arabia had severe anxiety. We also found that among the various coping strategies, (a) watching television for entertainment, (b) social networking, (c) listening to music, (d) sleeping, (e) doing mundane house chores like cleaning, washing, etc. (f) eating well, and (g) clearing/finishing thepiled-up work were ranked among the most utilized coping strategies by all participants. This study identifies the need to provide the free professional and psychological services to help cope with stress during the disease-enforced lockdown. La maladie Ã corona (COVID-19) qui sâ€™est dÃ©clarÃ©e en dÃ©cembre 2019Â dans la ville chinoise de Wuhan est devenue une menace mondiale et constitue actuellement la plus grande Ã©pidÃ©mie connue de pneumonie atypique affectant tous les continents du monde avec environ 6Â 416Â 828Â cas et 382Â 867Â dÃ©cÃ¨s. On sait que les confinements imposÃ©s par la maladie provoquent des niveaux accrus de dÃ©pression, dâ€™anxiÃ©tÃ© et de stress. Notre Ã©tude visait Ã Ã©tudier lâ€™impact immÃ©diat du confinement imposÃ© par la pandÃ©mie de COVID-19Â sur la santÃ© mentale et la qualitÃ© de vie de la population gÃ©nÃ©rale Ã¢gÃ©e de 18Â ans et Ã identifier les diffÃ©rentes stratÃ©gies dâ€™adaptation utilisÃ©es dans le cadre du confinement. Une enquÃªte en ligne a Ã©tÃ© menÃ©e entre le 1<sup>er</sup>Â avril et le 10Â maiÂ 2020, Ã lâ€™aide dâ€™un questionnaire validÃ© basÃ© sur la DASS-42, en utilisant une technique dâ€™Ã©chantillonnage en boule de neige. Au total, 418Â rÃ©ponses provenant de 16Â pays diffÃ©rents ont Ã©tÃ© reÃ§ues. Les personnes interrogÃ©es prÃ©sentaient un niveau Ã©levÃ© de dÃ©pression et dâ€™anxiÃ©tÃ©, qui diffÃ©raient sensiblement entre les sexes. En outre, les participants des pays en dÃ©veloppement â€”Â Inde et PakistanÂ â€” souffraient de dÃ©pression grave, tandis que les participants de lâ€™Inde, du Pakistan et du Royaume dâ€™Arabie Saoudite souffraient dâ€™anxiÃ©tÃ© grave. Nous avons Ã©galement constatÃ© que parmi les diffÃ©rentes stratÃ©gies dâ€™adaptation, (a) regarder la tÃ©lÃ©vision pour se divertir, (b) les rÃ©seaux sociaux, (c) Ã©couter de la musique, (d) dormir, (e) faire des tÃ¢ches mÃ©nagÃ¨res banales comme le nettoyage, la lessive, etc. (f) bien manger, et (g) nettoyer/finir mon travail accumulÃ© ont Ã©tÃ© classÃ©s parmi les stratÃ©gies dâ€™adaptation les plus utilisÃ©es par tous les participants. Cette Ã©tude identifie le besoin de fournir des services professionnels et psychologiques gratuits pour aider Ã faire face au stress pendant le confinement imposÃ© par la maladie.","Sameer, Khan, Nissar, Banday",https://doi.org/10.1016/j.jemep.2020.100571,20210126.0,Anxiety; COVID; DASS; Depression; Healthcare; Mental Health; Pandemic; Psychological impact; Stress,PubMed,,,,,,,,,,,,,,False,False,,,,,False,False,False,,2021-02-23
262,[Realtime video consultations by psychotherapists in times of the COVID-19 pandemic],"Due to the pandemic caused by the coronavirus disease 2019 (COVID-19) and the resulting constraints on personal (i.e. face to face) treatment, video consultations have recently gained aÂ major role in the delivery of healthcare services; however, until now, most psychotherapists have little experience with conducting video consultations, not least because of poor possibilities for reimbursement from the statutory health insurance. This article provides (1)Â an overview of the effectiveness of psychotherapy interventions delivered via video consultations for depression and anxiety disorders, (2)Â recommendations for setting up and conducting these consultations and (3)Â first experiences of psychotherapists from aÂ German feasibility study and from the provision in routine care in hospital during the COVID-19 pandemic.","Haun, Hoffmann, TÃ¶nnies, Dinger, Hartmann, Friederich",https://doi.org/10.1007/s00278-020-00438-6,20200928.0,Delivery of health care; Health services research; Telemedicine; Treatment efficacy; Treatment setting,PubMed,,,,,,,,,,,,,,False,False,,,,,False,False,False,,2021-02-23
263,REMOTE WORKING DURING THE PANDEMIC: A Q&amp;A WITH GILLIAN ISAACS RUSSELL: Questions from the Editor and Editorial Board of the <i>BJP</i>,"In this interview by email, Gillian Isaacs Russell, author of the influential <i>Screen Relations: The Limits of Computer-Mediated Psychoanalysis and Psychotherapy</i>, responds to a set of questions from the <i>BJP</i>. The interview focuses on the impact of remote working during the coronavirus epidemic, starting with the question of whether an effective therapeutic process can occur without physical co-presence. Isaacs Russell shares her immediate thoughts about the virtually overnight changes to our practice that came with the epidemic, and the work of the American Psychoanalytic Association's Covid-19 Advisory Team, on which she sits. Her responses are informed by recent cross-disciplinary and neuropsychological research on the digital age. She considers what happens to free association, evenly suspended attention and reverie when working by phone or online; the loss of the consulting room as a containing physical space for both clinician and patient; the relationship between place and time; and whether (and how) we can maintain a focus on transference and countertransference in the presence of the threat of death. The interview ends with her thoughts on whether we should assume that the landscape of analytic therapy will be permanently altered by Covid-19, and with her hope that general awareness of the impact of trauma on our mental health has been raised.",Isaacs Russell,https://doi.org/10.1111/bjp.12581,20200928.0,COVIDâ€19; PANDEMIC; PRESENCE; PSYCHOANALYSIS; PSYCHOTHERAPY; REMOTE THERAPY; SCREEN RELATIONS; TECHNOLOGY,PubMed,,,,,,,,,,,,,,False,False,,,,,False,False,False,,2021-02-23
264,"[PSYCOVID-19, psychological support device in the fields of mental health, somatic and medico-social]","In December 2019 the World Health Organization (WHO) recorded the first cases of an infectious disease that appeared in China in November of the same year. Generated by the new coronavirus SARS-CoV2, it is quickly named COVID-19 for COronaVirus Infectious Disease 2019. The spread of this unknown disease will soon have worldwide consequences: the contagiousness of the virus is extremely high and potentially lethal. In France, the population initially reacted with disbelief until the disease reached Europe and the first cases appeared on French territory, at the end of January. A few weeks later, on 16 March 2020, President Macron declared the country &quot;at war&quot; against COVID-19. The next day the population was placed in lockdown. At the present time, the country's activity is at a standstill. Schools, businesses and shops are closed. The French citizens are astounded. They suddenly have to face fear: fear of falling ill or that a close relative may fall ill, fear of being locked up and experiencing restrictions of liberties, fear of economic precariousness. And, above all, fear of uncertainty. In order to prevent the mental consequences of this crisis, psychological support units have been created with urgency at national scale. These units are intended to support the healthcare professionals as well as the patients and more broadly, the general population. The unit responsible for the department of Gironde has been set up quickly, over the weekend of March 21, 2020. The COVIDPSY33 listening unit has thus been created in Bordeaux by the Charles Perrens Hospital with support from the Agence RÃ©gionale de SantÃ© Nouvelle-Aquitaine (ARS). Simultaneously, the PSYCOVID-19 unit was created. This additional unit works in collaboration with the COVIDPSY33 platform and offers psychological assistance to the general population and caregivers in the sectors of Bordeaux Rive Droite, Bordeaux Gare, Rives de Garonne, Rives d'Arcins and Sud Gironde. It thus covers an area equivalent to approximately half of Gironde, the largest department in metropolitan France. In the present interview, Samantha Al Joboory and Florence Monello, psychiatrist and psychologist coordinating PSYCOD-19, present this psychological support unit.","Al Joboory, Monello, Bouchard",https://doi.org/10.1016/j.amp.2020.06.008,20200918.0,Coronavirus; Covid-19; Crisis unit; Epidemic; PSYCOVID-19; Pandemic; Psychological support; SARS-CoV2,PubMed,,,,,,,,,,,,,,False,False,,,,,False,False,False,,2021-02-23
265,"[General sanitary containment during the Coronavirus epidemic: Medico-psychological consequences in general population, caregivers, and subjects suffering previously from mental disorders (Retrospective on the repercussions of lethal mass risks, scientific models of collective confinement, first clinical observations, implementation of countermeasures and innovative therapeutic strategies)]","The situation we are currently experiencing is unprecedented. Declaring a state of health emergency in order to curb a frightening epidemic, the authorities have decreed the home confinement of the majority of the population of our country for several weeks. In a few days, innumerable questions arise for very diverse spaces: epidemiological, immunological, sociological, information scientists, medical, administrative, political, etc. We propose a reflection intended to describe the psychological risks, to clarify the disorders found, and to discuss the means to take care of them in the duration. We base our thinking on a review of the literature confronted with our current clinical experience, including concerning the possibilities of dematerialised medico-psychological monitoring. We recall the collective repercussions of emerging lethal mass risks, and in particular viral infectious agents, before approaching the existing scientific models of collective confinement according to military operations in war zones, polar wintering missions and aerospace conquest. It appears that for the study of a global containment, somewhat studied during previous pandemics, the conceptions of stress reaction and psychodynamic adaptation prove to be relevant. We detail the psychological consequences of confinement on individual mental health and their countermeasures according to three population typologies: general population, population of caregivers on the front line against the epidemic, and population of subjects already suffering from mental illness or seeing their disorders reappear. We also refer to works in social cognitive psychology explaining how, in an anxiety-provoking situation, reasoning can be biased and lead to choices that ultimately prove to be not very rational, in the opinion of those who made them. The current situation in the health sector is favourable in this, as evidenced by the &quot;debate on chloroquine&quot; widely reported in the media and on social networks, opposing conclusions most often decided on the basis of beliefs on contrary to evidence based medicine. The psychological repercussions of confinement appear conditioned by the multiple forms that it can take: voluntary or suffered, more or less prolonged, spent at home or in another place, lived in individual isolation or in a small community, associated other stressors and/or traumatic factors, etc. The home confinement of a population across a country has never been assessed. This experience seems to us to confront our society as a whole with the taboo of death, which is imposed, death more and more evaded as the &quot;Western man&quot; tries to move away from his terrestrial origins. In this sense, psychotraumatic type repercussions are to be prevented. In order to face multiple challenges, the healthcare system has adapted with, in particular, the development of the use of the Internet for the provision of information intended to better experience confinement, or even the generalisation of e-psychotherapy asking as many questions as it provides answers. These intricacies of computer techniques in the area of psychotherapy, techniques with which we had some questioning, became established as quickly as the virus: the task of clinicians and researchers to measure the issues and the consequences. Public health programs could emerge on the model of those already existing in order to manage well-known chronic endemic disorders: protection against the effects of an unbalanced diet associated with a sedentary lifestyle, fight against smoking and alcoholism, prevention of self-aggressive behaviour, etc. We will also need to support the caregivers who have been on the front line and who will emerge tested from this pandemic: depending on the sustainability of the action capacities of our healthcare system to return to its nominal state and also perhaps, so that it can face consequences resulting from other crises, especially social ones.","AuxÃ©mÃ©ry, Tarquinio",https://doi.org/10.1016/j.amp.2020.06.001,20200918.0,Confinement; Coronavirus; Epidemiology; Online psychotherapy; Psychopathology; Reaction to stress; Sociopathology,PubMed,,,,,,,,,,,,,,False,False,,,,,False,False,False,,2021-02-23
266,"[Jail incarceration, social sanitary confinement and ways of escape]","Jail incarceration and social confinement due to a sanitary stay-at-home law against the ongoing COVID-19 pandemic are compared to the introduction of dance workshops for imprisoned women charged with long sentences, then followed by an outside performance <i>Soul Kitchen</i>. The whole experience, organized by a famous contemporary choreographer Angelin Preljocaj, is filmed by ValÃ©rie MÃ¼ller, producing <i>Danser sa peine (To dance her sentence/her sorrow),</i> nominated for an award. The sessions are planned: two hours and a half, 2 times a week, for four months, no technique required. A group of five women start with ordinary easy functional movements, gaining in innovative and expressive qualities, spatial perceptions, feelings and interpersonal interactions, lead by A.Â Preljocaj in a helpful and empathic mood. At the same time, he discovers the cooking authorization in their jail cell. The relevant results shift into a dynamic successful piece <i>Soul Kitchen</i> (2019<i>)</i> performed in town (Dance Festival in Montpellier, south of France) with dancing and cooking occurrences on stage. It makes sense, specially about self-esteem, body image and positive opinion from the audience. The women's physical and psychological states linked with a long lack of space and sensitivityâ€¦ move to a better self-balance and feelings of well-being. In a similar state of mind, the French confined population -Â youth to elderlyÂ - try to find different and imaginative strategies at home as moving in a restrictive area, enjoying family cookingâ€¦ through trainings provided by Internet, looking for reducing anxiety, depressive disorders and other social problems. A panel of situations goes from deleterious conflictual relationships, dramatic isolation, to funny and positive ones using creativeness to escape, facing the disruption of daily life.","Vaysse, Poli",https://doi.org/10.1016/j.amp.2020.05.002,20200917.0,Art-therapy; Dance; Imaginary; Incarceration; Pandemic; Self-esteem; Socialization,PubMed,,,,,,,,,,,,,,False,False,,,,,False,False,False,,2021-02-23
267,Impact of &quot;e-Learning crack-up&quot; perception on psychological distress among college students during COVID-19 pandemic: A mediating role of &quot;fear of academic year loss&quot;,"While literature reveals the positive perception of e-Learning, this study examined and assessed the impact of e-Learning crack-up perceptions on psychological distress among college students during COVID-19 pandemic. Kessler psychological distress scale (<i>K</i>10) was used to evaluate stress symptoms. This study first conducted an online focus group discussion (OFGD) with the target population to develop the scale of &quot;e-Learning crack-up&quot; and &quot;fear of academic year loss&quot;. Afterward, a questionnaire was developed based on OFGD findings. An online survey was conducted amongst college students in Bangladesh using a purposive sampling technique. Results show that &quot;e-Learning crack-up&quot; perception has a significant positive impact on student's psychological distress, and fear of academic year loss is the crucial factor that is responsible for psychological distress during COVID-19 lockdown. This study can provide an understanding of how &quot;e-Learning crack-up&quot; and &quot;Fear of academic year loss&quot; influence college students' mental health. Theoretically, this study extends and validated the scope of Kessler's psychological distress scale with two new contexts. Practically, this study will help the government and policymakers identify the student's mental well-being and take more appropriate action to address these issues.","Hasan, Bao",https://doi.org/10.1016/j.childyouth.2020.105355,20210112.0,COVID-19; Fear of academic year loss; Psychological distress; e-Learning crack-up,PubMed,,,,,,,,,,,,,,False,False,,,,,False,False,False,,2021-02-23
268,Latent profiles of the comorbidity of the symptoms for posttraumatic stress disorder and generalized anxiety disorder among children and adolescents who are susceptible to COVID-19,"The present study aims to examine the comorbidity patterns of the symptoms (intrusion and avoidance) for posttraumatic stress disorder (PTSD) and generalized anxiety disorder (GAD) and the role of perceived threat and courtesy stigma in distinguishing specific patterns of the symptoms for PTSD and GAD among children and adolescents who are susceptible to coronavirus disease 2019 (COVID-19) in Hubei, China. A total of 1172 (683 female and 489 male) children and adolescents aged 8-18Â years were involved in completing the measurements of PTSD, GAD, perceived threat of COVID-19, and COVID-19-related courtesy stigma. The Latent Profile Analysis identified the three profiles of the symptoms for PTSD and GAD which were labeled as Moderate PTSD, Mild Comorbidity, and Severe Comorbidity. The scores of the symptoms for PTSD, GAD, perceived threat, and stigma were different among the three profiles. The risk factors (i.e., perceived threat and stigma) that are related to comorbidity patterns were examined through a three-step method. The possibility of entry into the Severe Comorbidity Profile increased with increasing perceived threat and stigma. The mental health care interventions for children and adolescents who are susceptible to COVID-19 can be developed to reduce perceived threat and stigma.","Li, Duan, Chen",https://doi.org/10.1016/j.childyouth.2020.105235,20200909.0,COVID-19; GAD; Latent profile; PTSD; Perceived threat; Stigma,PubMed,,,,,,,,,,,,,,False,False,,,,,False,False,False,,2021-02-23
269,&quot;The COVID-19 Pandemic and its Effect on Mental Health in USA - A Review with Some Coping Strategies&quot;,"The COVID-19 pandemic has resulted in enormous losses in terms of human lives and economy in United States. The outbreak has been continuing to heavily impact the mental health of people. Developing key strategies to prevent mental illnesses is extremely important for the well-being of people. A survey conducted during the last week of March 2020 showed that 72% of Americans felt that their lives were impacted by the outbreak, which was a 32% increase from the survey conducted only 2Â weeks earlier. The results show a positive correlation between COVID-19 infections/casualties and growing public concern. These observations suggest possible increase in mental health illnesses in United States as a consequence of the pandemic. The authors review a recently published model on COVID-19 related fear among the people. The fear of being infected or dying from the disease is one of the most significant causes of mental health disorders. Loss of employment or the fear of losing employment is another major concern leading to mental illnesses. Several unique strategies to prevent or mitigate mental illnesses are discussed.","Bhattacharjee, Acharya",https://doi.org/10.1007/s11126-020-09836-0,20201105.0,"Anxiety disorder; COVID-19; Mental health; Pandemic; Prevention strategies; Adaptation, Psychological; Betacoronavirus; COVID-19; Coronavirus Infections; Employment; Fear; Humans; Mental Disorders; Mental Health; Pandemics; Pneumonia, Viral; SARS-CoV-2; United States",PubMed,,,,,,,,,,,,,,False,False,,,,,False,False,False,,2021-02-23
270,Mental health amongst obstetrics and gynaecology doctors during the COVID-19 pandemic: Results of a UK-wide study,"To explore the impact of the COVID-19 pandemic on the mental health of Obstetricians and Gynaecologists. A cross-section survey-based study amongst doctors working within Obstetrics and Gynaecology in the United Kingdom. A total of 207 doctors completed the survey. Obstetricians and Gynaecologists reported significantly higher rates of both Major Depressive Disorder (versus, p = 0.023) and Generalised Anxiety Disorder (versus, p = 0.044) as compared to the UK-wide estimates. Sub-group analysis showed that anxiety was more common amongst female doctors as compared to males (versus, p = 0.047). Although the prevalence of GAD was higher amongst registrars compared to their Consultant and/or Senior House Officer counterparts, this was not statistically significant. Respondents felt that the most significant factor for work-related changes to mental health was keeping up to date with frequently changing guidelines and protocols related to COVID-19. Only of respondents felt able to talk to colleagues about their mental health. Key findings include the high prevalence of mental health conditions amongst doctors, demonstration of the persistent taboo that mental health carries within the speciality and the key contributory factors to poor mental health. Further work should be done to assess if changes to the way new and updating guidelines, protocols and pathways are disseminated reduces the impact on the mental health of doctors. With the threat of a second COVID-19 peak looming, now more than ever, it is vital that steps are taken to break the stigmatisation of mental health amongst doctors, encouraging doctors to seek help when required.","Shah, Raheem, Sideris, Velauthar, Saeed",https://doi.org/10.1016/j.ejogrb.2020.07.060,20200929.0,"Education and training; Gynaecology; Mental health; Obstetrics; Adult; Anxiety Disorders; Betacoronavirus; COVID-19; Coronavirus Infections; Cross-Sectional Studies; Depressive Disorder, Major; Female; Gynecology; Humans; Male; Mental Disorders; Middle Aged; Obstetrics; Occupational Diseases; Pandemics; Physicians; Pneumonia, Viral; SARS-CoV-2; Surveys and Questionnaires; United Kingdom",PubMed,,,,,,,,,,,,,,False,False,,,,,False,False,False,,2021-02-23
