,title,abstract,authors,link,date,subject,source,initial_decision,q0,q1,q2,q3,q4,q5,q6,q7,q8,q9,q10,q11,q12,q13,q14,q15,q16,q17,q18,q19,q20,exclusion_reason,extraction_date
189,"Associations of Social Isolation with Anxiety and Depression During the Early COVID-19 Pandemic: A Survey of Older Adults in London, UK","The COVID-19 pandemic is imposing a profound negative impact on the health and wellbeing of societies and individuals, worldwide. One concern is the effect of social isolation as a result of social distancing on the mental health of vulnerable populations, including older people. Within six weeks of lockdown, we initiated the CHARIOT COVID-19 Rapid Response Study, a bespoke survey of cognitively healthy older people living in London, to investigate the impact of COVID-19 and associated social isolation on mental and physical wellbeing. The sample was drawn from CHARIOT, a register of people over 50 who have consented to be contacted for aging related research. A total of 7,127 men and women (mean age=70.7 [SD=7.4]) participated in the baseline survey, May-July 2020. Participants were asked about changes to the 14 components of the Hospital Anxiety Depression scale (HADS) after lockdown was introduced in the UK, on 23<sup>rd</sup> March. A total of 12.8% of participants reported feeling worse on the depression components of HADS (7.8% men and 17.3% women) and 12.3% reported feeling worse on the anxiety components (7.8% men and 16.5% women). Fewer participants reported feeling improved (1.5% for depression and 4.9% for anxiety). Women, younger participants, those single/widowed/divorced, reporting poor sleep, feelings of loneliness and who reported living alone were more likely to indicate feeling worse on both the depression and/or anxiety components of the HADS. There was a significant negative association between subjective loneliness and worsened components of both depression (OR 17.24, 95% CI 13.20, 22.50) and anxiety (OR 10.85, 95% CI 8.39, 14.03). Results may inform targeted interventions and help guide policy recommendations in reducing the effects of social isolation related to the pandemic, and beyond, on the mental health of older people.","Robb, de Jager, Ahmadi-Abhari, Giannakopoulou, Udeh-Momoh, McKeand, Price, Car, Majeed, Ward, Middleton",https://doi.org/10.3389/fpsyt.2020.591120,20201103.0,COVID-19; anxiety; depression; loneliness; mental health; older adults; social isolation,PubMed,,,,,,,,,,,,,,False,False,,,,,False,False,False,,2021-02-23
190,The Effect of COVID-19 on Mental Health and Wellbeing in a Representative Sample of Australian Adults,"There is minimal knowledge about the impact of large-scale epidemics on community mental health, particularly during the acute phase. This gap in knowledge means we are critically ill-equipped to support communities as they face the unprecedented COVID-19 pandemic. This study aimed to provide data urgently needed to inform government policy and resource allocation now and in other future crises. The study was the first to survey a representative sample from the Australian population at the early acute phase of the COVID-19 pandemic. Depression, anxiety, and psychological wellbeing were measured with well-validated scales (PHQ-9, GAD-7, WHO-5). Using linear regression, we tested for associations between mental health and exposure to COVID-19, impacts of COVID-19 on work and social functioning, and socio-demographic factors. Depression and anxiety symptoms were substantively elevated relative to usual population data, including for individuals with no existing mental health diagnosis. Exposure to COVID-19 had minimal association with mental health outcomes. Recent exposure to the Australian bushfires was also unrelated to depression and anxiety, although bushfire smoke exposure correlated with reduced psychological wellbeing. In contrast, pandemic-induced impairments in work and social functioning were strongly associated with elevated depression and anxiety symptoms, as well as decreased psychological wellbeing. Financial distress due to the pandemic, rather than job loss <i>per se</i>, was also a key correlate of poorer mental health. These findings suggest that minimizing disruption to work and social functioning, and increasing access to mental health services in the community, are important policy goals to minimize pandemic-related impacts on mental health and wellbeing. Innovative and creative strategies are needed to meet these community needs while continuing to enact vital public health strategies to control the spread of COVID-19.","Dawel, Shou, Smithson, Cherbuin, Banfield, Calear, Farrer, Gray, Gulliver, Housen, McCallum, Morse, Murray, Newman, Rodney Harris, Batterham",https://doi.org/10.3389/fpsyt.2020.579985,20210208.0,COVID-19; anxiety; bushfire; coronavirus; depression; financial strain; mental health,PubMed,,,,,,,,,,,,,,False,False,,,,,False,False,False,,2021-02-23
191,Mental Health Outcomes in Perinatal Women During the Remission Phase of COVID-19 in China,"Since the middle of March, the COVID-19 outbreak has been well contained in China. The prevention and control measures for the outbreak have been downgraded to a normalized level. However, until now, the change in level of psychological health amongst perinatal women during the remission phase of the COVID-19 outbreak has not been investigated in China. The aim of this current study was to assess the symptoms of anxiety, depression, insomnia and quality of life (QOL) in perinatal women and to identify potential risk factors associated with these symptoms. This was a cross-sectional, hospital-based survey conducted between March 25<sup>th</sup> till June 5<sup>th</sup>, 2020 in southern China. Convenient sampling method was adopted. Women's anxiety, depression, insomnia symptoms and QOL was examined through standardized measurements. Multivariate logistic regression and Analysis of Covariance (ANCOVA) was conducted for the same. A total of 625 perinatal women completed the study; of them, 195 women (31.2%, 95%CI=27.56%-34.84%) reported anxiety, 120 (19.2%, 95%CI=16.10%-22.30%) reported depression, and 87 (13.9%, 95%CI=11.20%-16.64%) experienced symptoms of insomnia. Previous adverse experiences during pregnancy was a significant risk factor for anxiety (OR=1.628, 95%CI=1.069-2.480, P=0.023), depression (OR=1.853, 95%CI=1.153-2.977, P=0.011), and insomnia (OR=2.160, 95%CI=1.290-3.616, P=0.003). Participants having infected friends/families/colleagues were more likely to report anxiety (OR=2.195, 95%CI=1.245-3.871, P=0.007) and depression (OR=2.666, 95%CI=1.482-4.794, P=0.001). Those women whose regular check-ups were severely interrupted by the COVID-19 were also more likely to experience symptoms of anxiety (OR=2.935, 95%CI=1.701-5.062, P&lt;0.001) and insomnia (OR=2.195, 95%CI=1.098-4.390, P=0.026). The COVID-19 pandemic does affect the mental health and well being of perinatal women. Increased attention should be paid to women who have infected friends/families/colleagues and those with previous adverse experiences during pregnancy. Coping strategies that relieve psychological stress during the COVID-19 outbreak should be provided to prevent adverse outcomes for women and their infants.","Zeng, Li, Sun, Luo, Garg, Liu, Zhang, Zhang",https://doi.org/10.3389/fpsyt.2020.571876,20201103.0,COVID-19; China; mental health; perinatal; women,PubMed,,,,,,,,,,,,,,False,False,,,,,False,False,False,,2021-02-23
192,"Depression and Coping Among COVID-19-Infected Individuals After 10 Days of Mandatory in-Hospital Quarantine, Irbid, Jordan","In-hospital mandatory quarantine of asymptomatic and symptomatic COVID-19-infected individuals was part of the national control strategy used to prevent the spread of the COVID-19 outbreak in Jordan. This study aims to evaluate depression, associated stressors, and various coping methods used among adult quarantined COVID-19-infected individuals. This cross-sectional study included all COVID-19-infected individuals who were obligatorily quarantined at King Abdullah University Hospital, Irbid, Jordan from March 15 to April 20, 2020. Symptoms of depression were assessed using the 9-item Patient Health Questionnaire after 10 days of quarantine. In addition, several questions regarding the patients' sights with the health-care system, and coping methods were added. Demographic characteristics, clinical presentation, and comorbidities were collected from the medical records. Out of 91 quarantined COVID-19 patients, a total of 66 completed the survey, with a participation rate of 72.5%. The majority were relatively young; the mean Â± SD age was 35.8 Â± 16.2 years (range 18-79), 59.1% were females and 47% were asymptomatic. A considerable proportion of patients (44%) reported symptoms of depression, with 21% were at high risk of major depressive disorder. Depression symptoms were significantly more common among females than males [PHQ-9 score â‰¥10: 13 (92.9%) vs 1 (7.1%), respectively; <i>p</i>=0.004]. The majority of patients (71.2%) reported having problems with health-care services. Insufficient involvement in making treatment decisions was the most commonly reported concern (59.1%). Patients who reported problems in maintaining privacy, reaching out to their physicians, or receiving conflicting information from the medical staff, had more symptoms of depression compared with the satisfied ones (<i>p</i>&lt;0.05). On the other hand, those who were receiving sufficient support from the family, friends, or medical staff during quarantine, were less likely to have depression symptoms (<i>p</i>&lt;0.05). Furthermore, symptoms of depression were less in patients who stayed in touch with others using phone calls, texting, or social media (<i>p</i>=0.024). Symptoms of depression were common among both symptomatic and asymptomatic quarantined COVID-19 patients. The support of family, friends, and medical staff was an essential alleviating factor. Facilitating adequate communication may promote the mental well-being of COVID-19-infected patients and help in reducing the risk of depression during the in-hospital quarantine.","Samrah, Al-Mistarehi, Aleshawi, Khasawneh, Momany, Momany, Abu Za'nouneh, Keelani, Alshorman, Khassawneh",https://doi.org/10.2147/PRBM.S267459,20201030.0,COVID-19; SARS-CoV-2; coronavirus; depression; psychological disorder; quarantine,PubMed,,,,,,,,,,,,,,False,False,,,,,False,False,False,,2021-02-23
193,Behavior of Callers to a Crisis Helpline Before and During the COVID-19 Pandemic: Quantitative Data Analysis,"The World Health Organization declared the outbreak of COVID-19 to be an international pandemic in March 2020. While numbers of new confirmed cases of the disease and death tolls are rising at an alarming rate on a daily basis, there is concern that the pandemic and the measures taken to counteract it could cause an increase in distress among the public. Hence, there could be an increase in need for emotional support within the population, which is complicated further by the reduction of existing face-to-face mental health services as a result of measures taken to limit the spread of the virus. The objective of this study was to determine whether the COVID-19 pandemic has had any influence on the calls made to Samaritans Ireland, a national crisis helpline within the Republic of Ireland. This study presents an analysis of calls made to Samaritans Ireland in a four-week period before the first confirmed case of COVID-19 (calls=41,648, callers=3752) and calls made to the service within a four-week period after a restrictive lockdown was imposed by the government of the Republic of Ireland (calls=46,043, callers=3147). Statistical analysis was conducted to explore any differences between the duration of calls in the two periods at a global level and at an hourly level. We performed k-means clustering to determine the types of callers who used the helpline based on their helpline call usage behavior and to assess the impact of the pandemic on the caller type usage patterns. The analysis revealed that calls were of a longer duration in the postlockdown period in comparison with the pre-COVID-19 period. There were changes in the behavior of individuals in the cluster types defined by caller behavior, where some caller types tended to make longer calls to the service in the postlockdown period. There were also changes in caller behavior patterns with regard to the time of day of the call; variations were observed in the duration of calls at particular times of day, where average call durations increased in the early hours of the morning. The results of this study highlight the impact of COVID-19 on a national crisis helpline service. Statistical differences were observed in caller behavior between the prelockdown and active lockdown periods. The findings suggest that service users relied on crisis helpline services more during the lockdown period due to an increased sense of isolation, worsening of underlying mental illness due to the pandemic, and reduction or overall removal of access to other support resources. Practical implications and limitations are discussed.","Turkington, Mulvenna, Bond, Ennis, Potts, Moore, Hamra, Morrissey, Isaksen, Scowcroft, O'Neill",https://doi.org/10.2196/22984,20201114.0,COVID-19; caller behavior; clustering; coronavirus; crisis helplines; machine learning; mental health; pandemic,PubMed,,,,,,,,,,,,,,False,False,,,,,False,False,False,,2021-02-23
194,From adversity to resilience in the COVID-19 era: strengthening mental health systems in the Eastern Mediterranean Region,"The global COVID-19 pandemic has demonstrated the impact of a major public health emergency on mental health, and the ways that individuals, communities, professionals and systems can react positively to such a crisis. The Eastern Mediterranean Region (EMR) has substantial experience in mental health and psychosocial support (MHPSS) in crises, and COVID-19 has driven further innovation to support mental health and well-being. Global and regional guidance has been developed quickly, applying lessons learnt from previous disease outbreaks to respond to the pandemic at a systems level, for different population groups, and for countries of different income levels. Preliminary results from a global rapid assessment survey to assess the impact of COVID-19 on MHPSS services, indicate that 20 of the 22 EMR Member States have MHPSS as integral components of national COVID-19 response plans; one-third have allocated additional funding. However, MHPSS services have been severely impacted by the pandemic, including psychotherapy, psychosocial interventions, community services, and services for children/adolescents. Innovative solutions such as crisis hotlines, tele-consultations, digital self-help platforms, novel approaches to ensure supply of psychotropic medicines, and task sharing/shifting for basic psychosocial support, are being used in many countries to overcome service disruptions and maintain care for those with mental conditions.","Eaton, Rahman, Gater, Saxena, Hammerich, Saeed",https://doi.org/10.26719/2020.26.10.1148,20201116.0,"Africa, Northern; Betacoronavirus; COVID-19; Coronavirus Infections; Disasters; Global Health; Health Behavior; Health Promotion; Health Services Accessibility; Humans; Mental Health; Mental Health Services; Middle East; Pandemics; Pneumonia, Viral; Resilience, Psychological; SARS-CoV-2; Social Determinants of Health; Socioeconomic Factors",PubMed,,,,,,,,,,,,,,False,False,,,,,False,False,False,,2021-02-23
195,,"Examine the association between news media use frequency during the COVID-19 pandemic and the scale of psychological distress in pregnant women, considering this distress known harmful effects on the fetus development. Pregnant women living in Quebec province (N = 1014) have been recruited in April 2020 through social media, while a state of health emergency was declared. Participants were divided in 4 groups, according to self-reported frequency of news media consulting (little or none; one time a day; several times a day; constant). They filled measures of depressive symptoms, negative affects, post-traumatic stress symptoms and anxiety specific to COVID-19. Instrument scores were grouped under a unique factor of psychological distress. An ANCOVA controlling for age, gestational age, education level, household annual revenue and a diagnosed mental disorder present at the time of participation in study shows that news media exposure frequency is significantly associated with psychological distress severity in pregnant women, during COVID-19 pandemic, F(3,998) = 27.02, p &lt; 0.001, Î·2 partial = 0.08. Given the mean comparisons <i>a posteriori</i>, higher psychological distress rates are found as soon as news media exposure exceeds once a day (effect sizes between 0.38 and 0.81). The more pregnant women report consulting the news media during the COVID-19 pandemic, the more likely they are to exhibit psychological distress. Results provide one of the first empirical supports to recommendations of World Health Organization, Canada government and psychiatric associations that encourage population to limit their news media consulting during the COVID-19 pandemic. Examiner lâ€™association entre la frÃ©quence dâ€™utilisation des mÃ©dias dâ€™information durant la pandÃ©mie de COVID-19 et lâ€™ampleur de la dÃ©tresse psychologique chez les femmes enceintes, considÃ©rant les impacts dÃ©lÃ©tÃ¨res connus de cette dÃ©tresse sur le dÃ©veloppement du fÅ“tus. Des femmes enceintes habitant la province de QuÃ©bec (<i>N</i> = 1014) ont Ã©tÃ© recrutÃ©es en avril 2020 par le biais des mÃ©dias sociaux, alors quâ€™un Ã©tat dâ€™urgence sanitaire prÃ©valait. Les participantes ont Ã©tÃ© divisÃ©es en quatre groupes, selon la frÃ©quence auto-rapportÃ©e de consultation des mÃ©dias dâ€™information (peu ou pas; une fois par jour; plusieurs fois par jour; constante). Elles ont rempli des mesures des symptÃ´mes dÃ©pressifs, des affects nÃ©gatifs, des symptÃ´mes de stress post-traumatique et dâ€™anxiÃ©tÃ© spÃ©cifique de la COVID-19. Les scores aux instruments se regroupaient sous un facteur unique de dÃ©tresse psychologique. Une ANCOVA contrÃ´lant pour lâ€™Ã¢ge, lâ€™Ã¢ge gestationnel, le niveau dâ€™Ã©ducation, le revenu familial annuel et la prÃ©sence dâ€™un trouble mental diagnostiquÃ© au moment de la participation Ã lâ€™Ã©tude montre que la frÃ©quence dâ€™exposition aux mÃ©dias dâ€™information est significativement associÃ©e Ã la sÃ©vÃ©ritÃ© de la dÃ©tresse psychologique chez les femmes enceintes au moment de la pandÃ©mie de COVID-19, <i>F</i>(3,998) = 27,02, <i>p</i> &lt; 0,001, Î·<sup>2</sup> partiel = 0,08. Selon les comparaisons de moyennes a posteriori, des taux plus Ã©levÃ©s de dÃ©tresse psychologique sâ€™observent dÃ¨s que lâ€™exposition aux mÃ©dias dâ€™information dÃ©passe une fois par jour (tailles de lâ€™effet entre 0,38 et 0,81). Plus les femmes enceintes consultent les mÃ©dias dâ€™information pendant la pandÃ©mie de COVID-19, plus elles sont sujettes Ã prÃ©senter de la dÃ©tresse psychologique. Les rÃ©sultats offrent un des premiers appuis empiriques aux recommandations de lâ€™Organisation mondiale de la santÃ©, du gouvernement du Canada et dâ€™associations de psychiatres encourageant la population Ã limiter sa consultation des mÃ©dias dâ€™information durant la pandÃ©mie de COVID-19.","Lemieux, Garon-Bissonnette, Loiselle, Martel, Drouin-Maziade, Berthelot",https://doi.org/10.1177/0706743720963917,20210217.0,"COVID-19; anxiÃ©tÃ©; dÃ©pression; dÃ©tresse psychologique; grossesse; mÃ©dias; pandÃ©mie; santÃ© mentale; Adult; Anxiety; COVID-19; Communications Media; Depression; Female; Humans; Pregnancy; Pregnancy Complications; Pregnant Women; Psychological Distress; Quebec; SARS-CoV-2; Stress Disorders, Post-Traumatic; Young Adult",PubMed,,,,,,,,,,,,,,False,False,,,,,False,False,False,,2021-02-23
196,Assessment of mental health outcomes and associated factors among workers in community-based HIV care centers in the early stage of the COVID-19 outbreak in Mali,"In Mali, the non-governmental association (NGO) ARCAD SantÃ© PLUS launched the CovidPrev program in response to the COVID-19 outbreak to ensure continuity of HIV care-related activities. This study aimed to identify individual and structural factors associated with mental health disorders (MHD) in the NGO's healthcare workers (HCW) in the early stage of the outbreak. Data were collected between April 6 and 11, 2020 for 135 HCW in ARCAD SantÃ© PLUS's 18 community-based HIV care centers. Outcomes corresponded to the PHQ-9, GAD-7 and ISI instruments for depression, anxiety and insomnia, respectively. A general mixture model with a negative binomial distribution was implemented. Most HCW were men (60.7%) and median age was 40 years IQR[33-46]. Symptoms of depression, anxiety and insomnia were declared by 71.9, 73.3, and 77% participants, respectively. Women were at greater risk of MHD. A lack of personal protection equipment and human resources, especially nurses, was associated with a high risk of MHD. Health policy must place non-front line HCW, including those in NGOs, at the core of the healthcare system response to the COVID-19 outbreak, as they ensure continuity of care for many diseases including HIV. The efficacy of public health strategies depends on the capacity of HCW to fully with and competently perform their duties.","Sagaon-Teyssier, Kamissoko, Yattassaye, Diallo, Rojas Castro, Delabre, Pouradier, Maradan, Bourrelly, CissÃ©, Vidal, KeÃ¯ta, Spire",https://doi.org/10.1016/j.hpopen.2020.100017,20201224.0,COVID-19; HIV; Healthcare workers; Mali; Mental health,PubMed,,,,,,,,,,,,,,False,False,,,,,False,False,False,,2021-02-23
197,Mental health and well-being during the COVID-19 pandemic: longitudinal analyses of adults in the UK COVID-19 Mental Health &amp; Wellbeing study,"The effects of coronavirus disease 2019 (COVID-19) on the population's mental health and well-being are likely to be profound and long lasting. To investigate the trajectory of mental health and well-being during the first 6 weeks of lockdown in adults in the UK. A quota survey design and a sampling frame that permitted recruitment of a national sample was employed. Findings for waves 1 (31 March to 9 April 2020), 2 (10 April to 27 April 2020) and 3 (28 April to 11 May 2020) are reported here. A range of mental health factors was assessed: pre-existing mental health problems, suicide attempts and self-harm, suicidal ideation, depression, anxiety, defeat, entrapment, mental well-being and loneliness. A total of 3077 adults in the UK completed the survey at wave 1. Suicidal ideation increased over time. Symptoms of anxiety, and levels of defeat and entrapment decreased across waves whereas levels of depressive symptoms did not change significantly. Positive well-being also increased. Levels of loneliness did not change significantly over waves. Subgroup analyses showed that women, young people (18-29 years), those from more socially disadvantaged backgrounds and those with pre-existing mental health problems have worse mental health outcomes during the pandemic across most factors. The mental health and well-being of the UK adult population appears to have been affected in the initial phase of the COVID-19 pandemic. The increasing rates of suicidal thoughts across waves, especially among young adults, are concerning.","O'Connor, Wetherall, Cleare, McClelland, Melson, Niedzwiedz, O'Carroll, O'Connor, Platt, Scowcroft, Watson, Zortea, Ferguson, Robb",https://doi.org/10.1192/bjp.2020.212,20201125.0,COVID-19; depression; general population; mental health; suicidal ideation,PubMed,,,,,,,,,,,,,,False,False,,,,,False,False,False,,2021-02-23
