,title,abstract,authors,link,ID,publication_date,update_date,subject,is_medRxiv
117,Connected Despite COVID-19: The Role of Social Interactions and Social Media for Wellbeing,"Physical distancing is crucial for slowing the spread of COVID-19, but the associated reduction of social interaction can be detrimental to psychological wellbeing. Here, we sought to understand whether different ways in which people connect to others might mitigate this negative impact. We examined how amount and type of social interactions and social media use would predict wellbeing during a period of physical distancing in the United Kingdom. In a 30-day diary study conducted in April-June 2020, 108 participants reported their daily social interactions and social media use, as well as their end-of-day wellbeing. Using multilevel regressions, we found that more face-to-face interactions positively predicted wellbeing, while technology-mediated communication had less consistent positive effects on wellbeing. More active and less passive social media use was associated with greater wellbeing. Our results suggest that while technology-mediated communication can improve wellbeing, face-to-face interactions are unique and important for wellbeing during physical distancing.",Rui Sun et al.,https://share.osf.io/preprint/46021-55F-912,https://share.osf.io/preprint/46021-55F-912,2020-12-30,2021-01-03T16:21:48+00:00,PsyArXiv|Social and Behavioral Sciences; PsyArXiv|Social and Behavioral Sciences|Social and Personality Psychology; PsyArXiv|Social and Behavioral Sciences|Social and Personality Psychology|Well-being; covid-19; social media; physical distancing; wellbeing; social interactions,False
118,"Stress, anxiety, depression and burnout in frontline health care workers during COVID-19 pandemic: a brief systematic review and new data from Russia","During the COVID-19 pandemic, healthcare workers (HCWs) have been subject to increased workload while also exposed to many psychosocial stressors. In a systematic review we analyze the impact that the pandemic has had on HCWs mental state and associated risk factors. Most studies reported high levels of depression and anxiety among HCWs worldwide, however, due to a wide range of assessment tools, cut-off scores, and number of frontline participants in the studies, results were difficult to compare. Our study is based on two online surveys of 2195 HCWs from different regions of Russia during spring and autumn epidemic outbreaks revealed the rates of anxiety, stress, depression, emotional exhaustion and depersonalization and perceived stress as 32.3%, 31.1%, 45.5%, 74.2%, 37.7% ,67.8%, respectively. Moreover, 2.4% of HCWs reported suicidal thoughts. The most common risk factors include: female gender, nurse as an occupation, younger age, working for over 6 months, chronic diseases, smoking, high working demands, lack of personal protective equipment, low salary, lack of social support, isolation from families, the fear of relatives getting infected. These results demonstrate the need for urgent supportive programs for HCWs fighting COVID-19 that fall into higher risk factors groups.",Ekaterina Mosolova et al.,https://share.osf.io/preprint/46230-990-0D6,https://share.osf.io/preprint/46230-990-0D6,2021-01-02,2021-01-02T20:22:15+00:00,PsyArXiv|Psychiatry; suicide; health care workers; covid-19; burnout; anxiety; stress; depression,False
119,Impact of a Single School-Based Intervention for COVID-19 on Improving Mental Health,"An underlying concern about the COVID-19 pandemic is that the mental health of children will decline. The present study aimed to investigate whether a single school-based intervention, including self-monitoring and psychoeducation for COVID-19, effectively achieved its aim to promote children’s mental health. The study was conducted in a junior high school. We assigned the third grade as the intervention group, second grade as the announcement group, and first grade, the control group. We hypothesized that the intervention group would experience improved mental health and reduced fear of COVID-19, when compared to the announcement and control groups. Interaction effects were observed only for depression, indicating a significant intervention effect in the intervention group. These findings suggest that a single school-based intervention that includes self-monitoring and psychoeducation for COVID-19 can help to improve children’s mental health. It is suggested that school-based interventions that intend to raise children's awareness of COVID-19 promote healthy development and adaptation within the school.",Takahiro Kubo et al.,https://share.osf.io/preprint/46045-657-288,https://share.osf.io/preprint/46045-657-288,2020-12-31,2021-01-02T20:21:41+00:00,PsyArXiv|Social and Behavioral Sciences; PsyArXiv|Social and Behavioral Sciences|Health Psychology; PsyArXiv|Social and Behavioral Sciences|Health Psychology|Mental Health; PsyArXiv|Social and Behavioral Sciences|Health Psychology|Prevention; PsyArXiv|Social and Behavioral Sciences|School Psychology; PsyArXiv|Social and Behavioral Sciences|School Psychology|Intervention,False
120,Pregnancy during the pandemic: The impact of COVID-19-related stress on risk for prenatal depression,"Pregnant women may be particularly sensitive to negative events (i.e., adversity) related to the COVID-19 pandemic and affective responses to these events (i.e., stress). We examined COVID-19-related stress and adversity in a sample of 725 pregnant women residing in the San Francisco Bay Area in March-May 2020, 343 of whom provided addresses in California that were geocoded and matched by census tract to measures of community-level risk factors. Women who were pregnant during the pandemic had substantially elevated depressive symptoms compared to matched women who were pregnant prior to the pandemic. Several individual- and community-level risk and protective factors were associated with women’s scores on two latent factors of COVID-19-related stress and adversity. Highlighting the role of subjective responses to the pandemic in vulnerability to prenatal depression and factors that influence susceptibility to COVID-19-related stress, these findings inform understanding of the psychosocial sequelae of disease outbreaks among pregnant women.",Lucy S King et al.,https://share.osf.io/preprint/46063-4F2-71A,https://share.osf.io/preprint/46063-4F2-71A,2020-12-31,2021-01-02T20:18:50+00:00,PsyArXiv|Psychiatry; PsyArXiv|Social and Behavioral Sciences; PsyArXiv|Social and Behavioral Sciences|Clinical Psychology; PsyArXiv|Social and Behavioral Sciences|Clinical Psychology|Depressive Disorders; PsyArXiv|Social and Behavioral Sciences|Clinical Psychology|Trauma and Stress; PsyArXiv|Social and Behavioral Sciences|Environmental Psychology; PsyArXiv|Social and Behavioral Sciences|Environmental Psychology|Natural Environments; PsyArXiv|Social and Behavioral Sciences|Health Psychology; PsyArXiv|Social and Behavioral Sciences|Health Psychology|Mental Health; PsyArXiv|Social and Behavioral Sciences|Health Psychology|Stress; pregnancy; depression; stress; covid-19; adversity,False
121,Mechanisms of Parental Stress During and After the COVID-19 Lockdown: A two-wave longitudinal study,"Background: In the unpredictable times of the ongoing global coronavirus disease (COVID-19), parents worldwide are affected by stressors and strains that follow in the wake of the government-initiated distancing protocols. Objective: In a two‐wave longitudinal survey, we examined levels of parental perceived stress and symptoms of anxiety and depression among a sample of parents at two time points; in the midst of the strictest government-initiated physical distancing protocols following the onset of the COVID-19 pandemic (T1, N = 2868) and three months after the protocols discontinued (T2, n = 1489). Further, we investigated the levels of parental stress, anxiety, and depression relative to perceived relationship quality and anger aimed at child(ren) at the two time points, including subgroups based on age, sex, cultural background, civil status, education level, number of children in household, employment status, and pre-existing psychiatric diagnosis. Methods and findings: Parents were asked to fill out a set of validated questionnaires on the two measurement occasions. As expected, the findings indicate that the high levels of parental stress significantly decreased from T1 to T2, indicating that the cumulative stressors that parent’s experiences during distancing protocols declined as a function of the phaseout of the protocols. The decrease of perceived parental stress at the two time points, was accompanied by a significant decrease in symptoms of both depression and anxiety among the participating parents. Symptoms meeting the clinical cut-off for depression (23.0%) and generalized anxiety disorder (23.3%) were reported among participating parents at T1, compared to 16.8% and 13.8% respectively at T2. Reduction in depression and angry at child(ren) from T1 to T2 were further associated with a reduction in perceived parental stress. In addition, relationship quality and angry at child(ren) at T1 predicted change in parental stress. Conclusions: The findings underline some of the negative psychological impact of physical distancing protocols on parent’s health and well-being. Parents who are facing physical distancing and remaining at home with their children may be particularly vulnerable to parental stress, anxiety and depression. Uncovering the nature of how these constructs are associated to parents and families facing social crisis, such as the ongoing pandemic, can contribute to design relevant interventions to reduce parental stress and strengthen parental coping and resilience. Keywords: COVID-19 lockdown, parental stress, anxiety, depression, social distancing.",Miriam S. Johnson et al.,https://share.osf.io/preprint/4608D-F2B-AF9,https://share.osf.io/preprint/4608D-F2B-AF9,2020-12-30,2021-01-02T20:10:19+00:00,PsyArXiv|Psychiatry; PsyArXiv|Social and Behavioral Sciences; PsyArXiv|Social and Behavioral Sciences|Clinical Psychology; PsyArXiv|Social and Behavioral Sciences|Clinical Psychology|Anxiety Disorders; PsyArXiv|Social and Behavioral Sciences|Clinical Psychology|Depressive Disorders; PsyArXiv|Social and Behavioral Sciences|Clinical Psychology|Trauma and Stress; PsyArXiv|Social and Behavioral Sciences|Health Psychology; PsyArXiv|Social and Behavioral Sciences|Health Psychology|Mental Health; PsyArXiv|Social and Behavioral Sciences|Health Psychology|Stress; lockdown; mental health; parental stress; physical distancing; social distancing; covid-19; depression; parents; anxiety,False
122,Development of an intervention to increase adherence to nebuliser treatment in adults with Cystic Fibrosis: CFHealthHub,"Background Cystic Fibrosis (CF) is a life-limiting genetic condition in which daily therapies to maintain lung health are critical yet treatment adherence is low. Previous interventions to increase adherence have been largely unsuccessful and this is likely due to a lack of focus on behavioural evidence and theory alongside input from people with CF. This intervention is based on a digital platform that collects and displays objective nebuliser adherence data. The purpose of this paper is to identify the specific components of an intervention to increase and maintain adherence to nebuliser treatments in adults with CF with a focus on reducing effort and treatment burden. Methods Intervention development was informed by the behaviour change wheel (BCW) and Person-Based Approach (PBA). A multidisciplinary team conducted qualitative research to inform a needs analysis, selected and refined intervention components and methods of delivery, mapped adherence-related barriers and facilitators, associated intervention functions, and behaviour change techniques, and utilised iterative feedback to develop and refine content and processes. Results Results indicated that people with CF need to understand their treatment, be able to monitor adherence, have treatment goals and feedback, confidence in their ability to adhere, to have a treatment plan to develop habits for treatment, and be able to solve problems around treatment adherence. Behaviour change techniques were selected to address each of these needs and were incorporated into the digital intervention developed iteratively, alongside a manual and training for health professionals. Feedback from people with CF and clinicians helped to refine the intervention which could be tailored to individual patient needs. Conclusions The intervention development process is underpinned by a strong theoretical framework and evidence base and was developed by a multidisciplinary team with a range of skills and expertise integrated with substantial input from patients and clinicians. This multifaceted development strategy has ensured that the intervention is usable and acceptable to people with CF and clinicians, providing the best chance of success in supporting people with CF with different needs to increase and maintain their adherence. The intervention is being tested in a randomised controlled trial across 19 UK sites.",Madelynne Arden et al.,https://share.osf.io/preprint/4606C-F62-3F5,https://share.osf.io/preprint/4606C-F62-3F5,2020-12-29,2021-01-02T19:50:54+00:00,PsyArXiv|Social and Behavioral Sciences; PsyArXiv|Social and Behavioral Sciences|Health Psychology; PsyArXiv|Social and Behavioral Sciences|Health Psychology|Health-related Behavior; PsyArXiv|Social and Behavioral Sciences|Health Psychology|Treatment,False
123,A Path from Collective Threat to Eudaimonia: Mediating Role of Awe,"How do people react to collective threats such as natural disasters or the COVID-19 pandemic? Magnificent catastrophic events might have an impact on emotions of not only those who experienced direct harm from it but also those who feel threat without actual harm. The current study demonstrated that such threat enhances self-transcendent values that further leads to general well-being, mediated by the emotion of awe. Two surveys were conducted immediately after a severe typhoon hit Japan (Study 1) and during the early phases of the COVID-19 spread in Japan (Study 2). Predisposition to feel negative awe predicted participants’ attention to both collective threat events, which led to an affirmation of self-transcendent values and general well-being. Furthermore, when participants were asked to recall a collective threat (vs. control event), they felt more awe which led to more engaged meaning making during the event, in turn predicting their affirmation of self-transcendent values.",Masataka Nakayama et al.,https://share.osf.io/preprint/460DE-68A-58A,https://share.osf.io/preprint/460DE-68A-58A,2020-12-26,2021-01-02T19:46:21+00:00,PsyArXiv|Social and Behavioral Sciences; PsyArXiv|Social and Behavioral Sciences|Emotion; eudaimonia; self-transcendence; awe; collective threat; well-being,False
124,Disassociating conformity driven and self-interest driven dishonest behaviors,"Dishonest behavior can be driven by both self-interest and social learning towards the external environment. However, whether and how these two processes (conformity-driven and self-interest-driven dishonesty) relate and interact to influence dishonest acts remains unknown. In the current research, we propose a computational model consisting of these two dishonesty processes. The results of the agent-based simulation modeling and experimental studies revealed that self-interest driven-dishonesty propensity determined the extent of dishonesty when one was in pursuit of self-interests, while the effect of dishonesty conformity on dishonesty was dependent on both the self and environmental dishonesty propensity. In addition, self-interest-driven dishonesty propensity was related to individuals’ preference for value allocation, while dishonesty conformity was related to the belief in environmental predictability. In cross-cultural contexts, these two processes of dishonesty exert distinct effects on participants’ tendency to violate the regulation rules of the local government and impacted the development of the local prevalence of pathogens during the COVID-19 epidemic. The results of the current in-depth research validate the processes of conformity-driven and self-interest-driven dishonesty when dishonest behaviors emerged and to uncover how these two processes influenced the progression of a real-life emergent event.",Nora Huang et al.,https://share.osf.io/preprint/4605C-261-866,https://share.osf.io/preprint/4605C-261-866,2020-12-24,2021-01-02T19:44:30+00:00,PsyArXiv|Social and Behavioral Sciences; PsyArXiv|Social and Behavioral Sciences|Social and Personality Psychology; PsyArXiv|Social and Behavioral Sciences|Social and Personality Psychology|Cultural Differences; PsyArXiv|Social and Behavioral Sciences|Social and Personality Psychology|Individual Differences; PsyArXiv|Social and Behavioral Sciences|Social and Personality Psychology|Moral Behavior; PsyArXiv|Social and Behavioral Sciences|Social and Personality Psychology|Social Influence,False
125,Monthly prevalence of generalized anxiety disorder during the COVID-19 pandemic in Mexico,"Abstract Objective: Estimate the prevalence of generalized anxiety disorder (GAD) from April to June 2020. Methods: Repeated cross-sections design based in the ENCOVID-19 – a series of monthly mobile surveys with representative samples of Mexico (N= 833- 1,674). The questionnaire includes the GAD-2 scale, and, in July, the GAD-7 scale was added; we examined its internal validity with confirmatory factor analysis and its concurrent validity with sociodemographic variables. Using GAD-7 as criterion, we analyzed the predictive validity of the GAD-2. We estimated the monthly prevalence with the GAD-2. Results: The GAD-7 and the GAD-2 are reliable and valid. The GAD-2 has a sensitivity of 0.87 and a specificity of 0.90. The monthly prevalence remains high and stable, between 30.7 and 32.6%. GAD concentrated in women, unemployed and persons with low socioeconomic status. Conclusions: GAD is a public health problem that worsened during the COVID-19 pandemic. Resumen Objetivo: Estimar la prevalencia de ansiedad generalizada (GAD) entre abril y junio de 2020. Material y Métodos: Diseño transversal repetido basado en la ENCOVID-19 –serie de encuestas telefónicas mensuales con muestras representativas de México (N= 833- 1,674). El cuestionario incluye la escala GAD-2 y en julio se añadió la GAD-7; se examinó su validez interna con análisis factorial confirmatorio y su validez concurrente con variables sociodemográficas. Con la GAD-7 como criterio, se calculó la validez predictiva de la GAD-2. Se estimó la prevalencia mensual con la GAD-2. Resultados: La GAD-7 y la GAD-2 son confiables y válidas. La GAD-2 tiene una sensibilidad de 0.87 y una especificidad de 0.90. La prevalencia mensual se mantuvo alta y estable, entre 30.7 y 32.6%. El GAD se concentró en mujeres, personas desocupadas y de bajo nivel socioeconómico. Conclusiones: El GAD es un problema de salud pública que se agravó con la pandemia por COVID-19.",Pablo Gaitán-Rossi et al.,https://share.osf.io/preprint/4612A-558-BD3,https://share.osf.io/preprint/4612A-558-BD3,2020-12-23,2021-01-02T19:43:36+00:00,PsyArXiv|Psychiatry; PsyArXiv|Social and Behavioral Sciences; PsyArXiv|Social and Behavioral Sciences|Emotion; PsyArXiv|Social and Behavioral Sciences|Quantitative Methods; PsyArXiv|Social and Behavioral Sciences|Social and Personality Psychology; monitoring; gad; validez; validity; monitoreo; covid-19; anxiety; ansiedad,False
126,Who does or does not use the “Corona-Warn-App” and why?,"To slow the spread of SARS-CoV-2, the German government released the “Corona-Warn-App”, a smartphone application that warns users if they have come into contact with other users tested posi- tive for SARS-CoV-2. Since using the ""Corona-Warn-App"" is health-relevant behavior, it is essential to understand who is (and who is not) using it and why. In N = 1,972 German adults, we found that non-users were on average older, female, healthier, in training, and had low general trust in others. Most frequently named reasons by non-users were privacy concerns, doubts about the effectiveness of the app, and lack of technical equipment.",Kai Tobias Horstmann et al.,https://share.osf.io/preprint/4604B-892-ED4,https://share.osf.io/preprint/4604B-892-ED4,2020-08-14,2021-01-02T13:04:52+00:00,PsyArXiv|Social and Behavioral Sciences; PsyArXiv|Social and Behavioral Sciences|Health Psychology; PsyArXiv|Social and Behavioral Sciences|Health Psychology|Health-related Behavior; PsyArXiv|Social and Behavioral Sciences|Health Psychology|Prevention; covid-19; health behavior; contact tracing; corona-warn-app,False
127,What drives beliefs in COVID-19 conspiracy theories? The role of psychotic-like experiences and confinement-related factors,"The COVID-19 pandemic is a worldwide threat to public health and the global economy. The climate of fear and uncertainty associated with the pandemic has fostered the emergence of a wide-range of COVID-19 conspiracy theories that has the potential do shape public opinion and hinder the effective dissemination of valid information. Beliefs in conspiracy theories has been associated with maladaptive personality traits such as schizotypy and paranoia, as well as other non-psychotic psychological characteristics (e.g., social isolation, stress). The current study aimed to examine the association between beliefs in COVID-19 conspiracy theories and psychotic-like experiences within the community, while also addressing the role of sociodemographic information, psychological outcomes (e.g., stress, affective states) and other pandemic-related factors (e.g., confinement conditions/behaviors). Our results suggest that psychotic-like experiences are associated with beliefs in COVID-19 conspiracy theories, particularly perceptual abnormalities and persecutory ideation. Moreover, increased health-related concerns and reduced education levels also seem to be liability factors for these conspiracy beliefs. These results add important insights into how the adherence to illogical and erroneous disease-related arguments may be contingent to proneness to psychotic-like experiences. COVID-19 conspiracy theories are yet another major challenge that governments and policy makers must contemplate when defining strategic directions to manage the current and future pandemics.",Simão Pedro Rodrigues Ferreira et al.,https://share.osf.io/preprint/4613E-EA0-397,https://share.osf.io/preprint/4613E-EA0-397,2020-12-31,2021-01-02T11:39:57+00:00,PsyArXiv|Psychiatry; PsyArXiv|Social and Behavioral Sciences; PsyArXiv|Social and Behavioral Sciences|Social and Personality Psychology; conspiracy theories; psychosis; conspiracy belief; covid-19; confinement; pandemic,False
128,Statistical Significance Filtering Overestimates Effects and Impedes Falsification: A Critique of Endsley (2019),"Whether in meta-analysis or single experiments, selecting results based on statistical significance leads to overestimated effect sizes, impeding falsification. We critique a quantitative synthesis that used significance to score and select previously published effects for situation awareness-performance associations (Endsley, 2019). How much does selection using statistical significance quantitatively impact results in a meta-analytic context? We evaluate and compare results using significance-filtered effects versus analyses with all effects as-reported. Endsley reported high predictiveness scores and large positive mean correlations but used atypical methods: the hypothesis was used to select papers and effects. Papers were assigned the maximum predictiveness scores if they contained at-least-one significant effect, yet most papers reported multiple effects, and the number of non-significant effects did not impact the score. Thus, the predictiveness score was rarely less than the maximum. In addition, only significant effects were included in Endsley’s quantitative synthesis. Filtering excluded half of all reported effects, with guaranteed minimum effect sizes based on sample size. Results for filtered compared to as-reported effects clearly diverged. Compared to the mean of as-reported effects, the filtered mean was overestimated by 56%. Furthermore, 92% (or 222 out of 241) of the as-reported effects were below the mean of filtered effects. We conclude that outcome-dependent selection of effects is circular, predetermining results and running contrary to the purpose of meta-analysis. Instead of using significance to score and filter effects, meta-analyses should follow established research practices.",Jonathan Z Bakdash et al.,https://share.osf.io/preprint/461FC-6A0-148,https://share.osf.io/preprint/461FC-6A0-148,2020-09-25,2020-12-31T15:05:10+00:00,PsyArXiv|Engineering Psychology; PsyArXiv|Meta-science; PsyArXiv|Social and Behavioral Sciences; PsyArXiv|Social and Behavioral Sciences|Cognitive Psychology; psychology; validity; human factors; meta-analysis; cognitive psychology; confirmation bias; significance filter; situation awareness; p-hacking; falsification; experimental psychology; selection bias; performance; inference,False
