,title,abstract,authors,link,ID,publication_date,update_date,subject,is_medRxiv
59,Wearing face masks strongly confuses counterparts in reading emotions,"Wearing face masks is one of the essential means to prevent the transmission of certain respiratory diseases such as COVID-19. Although acceptance of such masks increases in the Western hemisphere, many people feel that social interaction is affected by wearing a mask. In the present experiment, we tested the impact of face masks on the readability of emotions. The participants (N=41, calculated by an a priori power test; random sample; healthy persons of different ages, 18-87 years) assessed the emotional expressions displayed by twelve different faces. Each face was randomly presented with six different expressions (angry, disgusted, fearful, happy, neutral, sad) while being fully visible or partly covered by a face mask. Lower accuracy and lower confidence in one’s own assessment of the displayed emotions indicate that emotional reading was strongly irritated by the presence of a mask. We further detected specific confusion patterns, mostly pronounced in the case of misinterpreting disgusted faces as being angry plus assessing many other emotions (e.g. happy, sad and angry) as neutral. We discuss compensatory actions that can keep social interaction effective (e.g. body language, gesture and verbal communication), even when relevant visual information is crucially reduced.",Claus Christian Carbon,https://share.osf.io/preprint/460EF-5C4-2FB,https://share.osf.io/preprint/460EF-5C4-2FB,2020-06-10,2020-10-09T16:29:58+00:00,"PsyArXiv|Life Sciences; PsyArXiv|Social and Behavioral Sciences; PsyArXiv|Social and Behavioral Sciences|Cognitive Psychology; PsyArXiv|Social and Behavioral Sciences|Emotion; PsyArXiv|Social and Behavioral Sciences|Perception; PsyArXiv|Social and Behavioral Sciences|Psychology, other; occlusion; face; confusion; covid-19 pandemic; emotion; social psychology; accuracy; masks",False
60,"Knowledge, attitudes, and perception susceptibility towards the COVID-19 pandemic in Latin American region","BACKGROUND: Latin American countries have been strongly affected by COVID-19. Due to the alarming prevalence of cases, we set out to explore which psychosocial elements may be exerting an influence on the poor compliance with mandatory control measures among the population. OBJECTIVE: We aimed to assess knowledge, attitude, and susceptibility perception of Latin American population during the coronavirus outbreak. METHOD: We collected data from 600 self-selected participants through a web-based cross-sectional survey evaluating demographic information. The respondents were between 16 to 77 years old. The majority of the participants were female (n= 382), graduated professionals (56.8 %), citizens living in any country in South America (72.2%). RESULTS: Logistic regression showed that knowledge is highly related with age (p=0.010*), attitude is related with marital status (p=0.017*), perception susceptibility is related with education (p=0.049*), marital status (p=0.001**) and occupation (p=0.001**). Our study identified that, although people reported adequate knowledge by identifying expected symptoms and coronavirus transmission process. There is a significant perceived susceptibility to contracting the mentioning virus (57.7%), displaying stigmatized behavior (59.1%), fear of contracting the virus from others (70.2%), and concern regarding serious consequences after the COVID-19 disease (72.3%). Additionally, we found that people distrust National Health administration's response (61.57%), preparedness for the disease (73.8%), and suggesting insufficient measures to deal with COVID-19 disease (61.3%). CONCLUSION: Within the framework of government regulations, it is suggested that guidelines be considered to expand strategies and provide reliable knowledge to facilitate positive attitudes towards protection measures against COVID-19. Communication strategies would serve both to contain psychological reactions and the perception of risk of contagion, as well as educational actions to ensure compliance with public control measures among the population.",Jonathan Zegarra-Valdivia et al.,https://share.osf.io/preprint/460D4-F3C-660,https://share.osf.io/preprint/460D4-F3C-660,2020-06-10,2020-10-09T16:28:59+00:00,PsyArXiv|Social and Behavioral Sciences; PsyArXiv|Social and Behavioral Sciences|Health Psychology; PsyArXiv|Social and Behavioral Sciences|Health Psychology|Prevention; public health; health communication; knowledge; attitudes; perception; primary prevention; covid-19,False
61,COVID Feel Good – An Easy Self-Help Virtual Reality Protocol to Overcome the Psychological Burden of Coronavirus,"Background: Living in the time of the COVID-19 means experiencing not only a global health emergency but also extreme psychological stress with potential emotional side effects such as sadness, grief, irritability and mood swings. Crucially, lockdown and confinement measures isolate people who become the first and the only ones in charge of their own mental health: people are left alone facing a novel and potentially lethal situation, and, at the same time, they need to develop adaptive strategies to face it, at home. In this view, easy-to-use, inexpensive, and scientifically validated self-help solutions aiming to reduce the psychological burden of coronavirus are extremely necessary. Aims: This pragmatic trial aims to provide the evidence that a weekly self-help virtual reality (VR) protocol can help overcome the psychological burden of the Coronavirus by relieving anxiety, improving well-being and reinforcing social connectedness. The protocol will be based on the “Secret Garden” 360 VR video online (www.covidfeelgood.com) which simulates a natural environment aiming to promote relaxation and self-reflexion. 360° or spherical videos allow the user to control the viewing direction. In this way, the user can explore the content from any angle like a panorama and experience presence and immersion. The “Secret Garden” video is combined with daily exercises that are designed to be experienced with another person (not necessarily physically together), to facilitate a process of critical examination and eventual revision of core assumptions and beliefs related to personal identity, relationships and goals. Methods: This is a multicentric, pragmatic pilot randomized controlled trial involving individuals who experienced the COVID-19 pandemic and underwent a lockdown and quarantine procedures. The trial is approved by the Ethics Committee of the Istituto Auxologico Italiano. Each research group in all the countries joining the pragmatic trial, aims at enrolling at least 30 individuals in the experimental group experiencing the self-help protocol, and 30 in the control group, over a period of 3 months to verify the feasibility of the intervention. Conclusion: The goal of this protocol is for VR to become the “surgical mask” of mental health treatment. Although surgical masks do not provide the wearer with a reliable level of protection against the coronavirus compared with FFP2 or FFP3 masks, surgical masks are very effective in protecting others from the wearer’s respiratory emissions. The goal of the VR protocol is the same: not necessarily to solve complex mental health problems but rather to improve well-being and preserve social connectedness.",Giuseppe Riva et al.,https://share.osf.io/preprint/460A9-9EA-8BE,https://share.osf.io/preprint/460A9-9EA-8BE,2020-06-10,2020-10-09T16:27:59+00:00,PsyArXiv|Social and Behavioral Sciences; PsyArXiv|Social and Behavioral Sciences|Health Psychology; PsyArXiv|Social and Behavioral Sciences|Health Psychology|Mental Health; PsyArXiv|Social and Behavioral Sciences|Health Psychology|Social health; PsyArXiv|Social and Behavioral Sciences|Health Psychology|Stress; PsyArXiv|Social and Behavioral Sciences|Health Psychology|Treatment; psychological support; virtual reality; post-traumatic stress disorder; psychological distress; self-help; coronavirus; anxiety; positive technology; research protocol; covid-19,False
62,High trait self-control and low boredom proneness help COVID-19 homeschoolers,"In response to the coronavirus disease 2019 (COVID-19) schools around the world have been closed to protect against the spread of coronavirus. In several countries, homeschooling has been introduced to replace classroom schooling. With a focus on individual differences, the present study examined 138 schoolers (age range = 6 to 21 years) regarding their self-control and boredom proneness. The results showed that both traits were important in predicting adherence to homeschooling. Schoolers with higher levels of self-control perceived homeschooling as less difficult, which in turn increased homeschooling adherence. In contrast, schoolers with higher levels of boredom proneness perceived homeschooling as more difficult, which in turn reduced homeschooling adherence. These results partially hold when it comes to studying in the classroom. However, boredom threatened adherence only in the homeschooling context. Our results indicate that boredom proneness is a critical construct to consider when educational systems switch to homeschooling during a pandemic.",Corinna Martarelli et al.,https://share.osf.io/preprint/460A2-A1B-F9D,https://share.osf.io/preprint/460A2-A1B-F9D,2020-08-12,2020-10-09T16:26:24+00:00,PsyArXiv|Social and Behavioral Sciences; PsyArXiv|Social and Behavioral Sciences|Educational Psychology,False
63,Regional Personality Predicts the Early Spread of COVID-19 and Social Distancing Behavior,"Social behaviors play a key role in the spread of COVID-19. Consequently, regional variation in personality traits that capture individual differences in these social behaviors may offer new insight into regional variation in COVID-19 cases. Here we combine self-reported personality data (N ≈ 3.5 million people), official COVID-19 prevalence rates, and behavioral observations (N ≈ 29 million people) to show that regional personality differences in the US and Germany predict the regional onset and growth of COVID-19 cases above and beyond a highly conservative set of socio-demographic, socio-economic, and pandemic-related control variables. Openness and Extraversion were consistently related to earlier COVID-19 onsets and steeper growth rates. The opposite pattern was found for Neuroticism. We also shed light on regional responses to the outbreak, showing that regional personality (i) is associated with objective indicators of regional social distancing, and (ii) predicts self-reported social distancing beyond the effects of individual-level personality.",Heinrich Peters et al.,https://share.osf.io/preprint/46248-F45-EB8,https://share.osf.io/preprint/46248-F45-EB8,2020-08-06,2020-10-09T16:25:32+00:00,PsyArXiv|Social and Behavioral Sciences; regional personality; big five; social distancing; covid-19,False
64,Who does or does not use the “Corona-Warn-App” and why?,"To slow the spread of SARS-CoV-2, the German government released the “Corona-Warn-App”, a smartphone application that warns users if they have come into contact with other users tested posi- tive for SARS-CoV-2. Since using the ""Corona-Warn-App"" is health-relevant behavior, it is essential to understand who is (and who is not) using it and why. In N = 1,972 German adults, we found that non-users were on average older, female, healthier, in training, and had low general trust in others. Most frequently named reasons by non-users were privacy concerns, doubts about the effectiveness of the app, and lack of technical equipment.",Kai Tobias Horstmann et al.,https://share.osf.io/preprint/4604B-892-ED4,https://share.osf.io/preprint/4604B-892-ED4,2020-08-14,2020-10-09T16:24:17+00:00,PsyArXiv|Social and Behavioral Sciences; PsyArXiv|Social and Behavioral Sciences|Health Psychology; PsyArXiv|Social and Behavioral Sciences|Health Psychology|Health-related Behavior; PsyArXiv|Social and Behavioral Sciences|Health Psychology|Prevention; covid-19; health behavior; contact tracing; corona-warn-app,False
65,Pandemic buying: Testing a psychological model of over-purchasing and panic buying using data from the United Kingdom and the Republic of Ireland during the early phase of the COVID-19 pandemic,"Over-purchasing and hoarding of necessities is a common response to crises, especially in developed economies where there is normally an expectation of plentiful supply. This behaviour was observed internationally early on in the COVID-19 pandemic. In the absence of actual scarcity, this behaviour can be described as ‘panic buying’ and can lead to temporary shortages. However, there have been few psychological studies of this phenomenon. We propose a psychological model of over-purchasing informed by animal foraging theory and make predictions about variables that predict over-purchasing by either exacerbating or mitigating the anticipation of future scarcity. These variables include additional scarcity cues (e.g. loss of income), distress (e.g. depression), psychological factors that draw attention to these cues (e.g. neuroticism) or to reassuring messages (eg. analytical reasoning) or which facilitate over-purchasing (e.g. income). We tested our model in parallel nationally representative internet surveys of the adult general population conducted in the United Kingdom (UK: N = 2025) and the Republic of Ireland (RoI: N = 1041) 52 and 31 days after the first confirmed cases of COVID-19 were detected in the UK and RoI, respectively. About three quarters of participants reported no or very little over-purchasing. More over-purchasing in RoI may have reflected different government messaging or historical factors. When over-purchasing occurred, it was observed across a wide range of product categories and was accounted for by a single latent factor. It was positively predicted by household income, the presence of children at home, psychological distress (depression, death anxiety), threat sensitivity (right wing authoritarianism) and mistrust of others (paranoia). Analytic reasoning ability had an inhibitory effect. Predictor variables accounted for 36% and 34% of the variance in over-purchasing in the UK and RoI respectively. With some caveats, the data supported our model and point to strategies to mitigate over-purchasing in future crises.",Richard Bentall et al.,https://share.osf.io/preprint/46216-035-A5C,https://share.osf.io/preprint/46216-035-A5C,2020-08-19,2020-10-09T16:21:09+00:00,PsyArXiv|Social and Behavioral Sciences; PsyArXiv|Social and Behavioral Sciences|Cognitive Psychology; PsyArXiv|Social and Behavioral Sciences|Consumer Psychology; over-purchasing; general population; psychological; panic buying; pandemic; coronavirus; covid-19,False
66,Structuring of Time is Key for Job Performance and Well-being: The Case of Croatians Working from Home During COVID-19 Pandemic,"In this research, we aimed to explore determinants of job performance and well-being while working from home (WFH) in a specific context of mandatory WFH during COVID-19 lockdown in Croatia, a country where WFH is a highly unusual arrangement. In Study 1, on a nationally representative sample of 166 Croatian employees WFH during lockdown, we tested if aspects of work-life balance (WLB) – work-to-family and family-to-work conflict, time structure of the work day and psychological detachment from work – would predict job performance and well-being. We showed that of the four WLB aspects, only time structure was important both for job performance and well-being. In Study 2, we used a convenient sample of 575 Croatian employees who were WFH during lockdown to investigate conscientiousness, emotional stability and autonomy at work as drivers of the WLB during WFH, and to constructively replicate Study 1 findings using different and more advanced measures. Findings showed that autonomy, conscientiousness and, especially, emotional stability contributed to the WLB and were important for job performance and well-being. WLB, especially time structure, predicted both job performance and well-being, and enhanced time structure mediated the effects of personality traits and autonomy on both outcomes.",Mitja Ružojčić et al.,https://share.osf.io/preprint/461CB-AF3-454,https://share.osf.io/preprint/461CB-AF3-454,2020-10-08,2020-10-09T12:42:49+00:00,PsyArXiv|Social and Behavioral Sciences; PsyArXiv|Social and Behavioral Sciences|Industrial and Organizational Psychology; PsyArXiv|Social and Behavioral Sciences|Industrial and Organizational Psychology|Work-life Balance; work from home; personality; coronavirus; work and organizational psychology; autonomy; work-life balance; croatia; occupational health psychology; covid-19,False
67,"PHYSICAL, EMOTIONAL, AND SOCIAL PAIN DURING COVID-19 PANDEMIC-RELATED SOCIAL ISOLATION","The recognition and management of the socio-emotional pain facing the COVID-19 pandemic refer to different, but interdependent, clues regarding cognitive and emotional aspects of the pandemic threat, considering the need of social distancing as a prophylactic procedure to avoid spreading the pathogen. The socio-emotional condition at the time of outbreak subsidizes the (re)modulation of interactive neural circuits underlying the risk assessment behaviour at physical, emotional, and social levels. Experiences of social isolation, exclusion or affective loss are generally considered to be some of the most “painful” things that people face. The threats of social disconnection are processed by some of the same neural structures that process basic threats to survival. The lack of social connection can be ""painful"" due to an overlap in the neural circuitry responsible for both physical and emotional pain related to feelings of social rejection. Indeed, many of us go to great lengths to avoid situations that may engender these experiences. Because of this, this work focusses on times of pandemic, the somatization mentioned above seeks the interconnection and/or interdependence between neural systems related to emotional and cognitive processes, so that the person involved in that aversive social environment becomes aware of himself, the others, and the threatening situation experienced to avoid daily psychological and neuropsychiatric effects. Social distancing during the isolation evokes the formation of social distress, raising the intensity of learned fear that people acquire, consequently enhancing the emotional and social pain.",Priscila De Medeiros et al.,https://share.osf.io/preprint/46248-C53-D16,https://share.osf.io/preprint/46248-C53-D16,2020-09-20,2020-10-09T12:00:57+00:00,PsyArXiv|Neuroscience; PsyArXiv|Neuroscience|Behavioral Neuroscience; PsyArXiv|Neuroscience|Clinical Neuroscience; PsyArXiv|Neuroscience|Cognitive Neuroscience; PsyArXiv|Neuroscience|Systems Neuroscience; PsyArXiv|Psychiatry; PsyArXiv|Social and Behavioral Sciences; PsyArXiv|Social and Behavioral Sciences|Cognitive Psychology; PsyArXiv|Social and Behavioral Sciences|Emotion; physical pain; covid-19; covid-19.; neurosciences; social distancing; emotional pain; social pain,False
68,COVID-19 CONSPIRACY BELIEFS AND CONTAINMENT-RELATED BEHAVIOUR: THE ROLE OF POLITICAL TRUST,"The roles of conspiracy beliefs and political trust for public health behaviour have been seldomly studied prior to the COVID-19 pandemic. In this study, we tested whether conspiracy beliefs affect containment-related behaviour in relation to the COVID-19 epidemic, and whether this relationship is mediated by political trust, preference for saving economy or for saving lives. The data were collected at two time points, at the beginning of the epidemic and after the state of emergency was introduced. The sample consisted of 802 adults from Serbia (356 at time 1 and 446 at time 2), of which around 60% female, with the mean age of around 33. The results indicate that holding more conspiracy beliefs is related to less adherence to containment-related behaviour, both directly and indirectly, via decreased political trust. Preference for saving lives has a direct effect on containment-related behaviour, while preference for saving economy plays no important role in this relationship, although it has a negative zero-order association with containment-related behaviour. The findings are interpreted in the light of the importance of governmental epidemic management for containing, i.e. preventing the spread of infectious diseases.",Tijana Karić et al.,https://share.osf.io/preprint/46128-44E-EE5,https://share.osf.io/preprint/46128-44E-EE5,2020-10-09,2020-10-09T11:24:45+00:00,PsyArXiv|Social and Behavioral Sciences; PsyArXiv|Social and Behavioral Sciences|Social and Personality Psychology; saving the economy; pandemic; covid-19; political trust; conspiracy beliefs; containment-related behaviour,False
69,"Mode and Frequency of Covid-19 Information Updates, Political Values, and Future Covid-19 Vaccine Attitudes","The effect of social media consumption on perceptions of the seriousness of the Covid-19 pandemic, attitudes to public health requirements, and intentions towards a future Covid-19 vaccine are of live public health interest. There are also public health and security concerns that the pandemic has been accompanied and arguably further amplified by an ‘infodemic’ spreading misinformation. Tests of the effect of social media consumption on future Covid-19 vaccine intentions using population samples have been relatively few to date. This study contributes to the evidence base by examining social media consumption and vaccine intentions using British and US population samples. Methods: Data were gathered on 1,663 GB adults and 1,198 US adults from an online panel on attitudes towards a future vaccine alongside self-reported social and legacy broadcast and print media consumption. Ordered and binomial logit models were used to assess reported intentions regarding a future Covid-19 vaccine, testing the effects of media consumption type. Respondents were categorised in terms of their media consumption using a fourfold typology, as less frequent social, less frequent legacy media consumers (low-low); high social, low legacy media consumers (high-low); low social, high legacy (low-high); and high social, high legacy (high-high). Results: In the British sample, regression results indicate that those who receive Covid-19 updates more frequently via legacy media (low-high), and those being updated more than daily via both online and legacy media consumers, tend to provide significantly less Covid-19 vaccine-hesitant responses than low-low consumers. There is no significant difference between high social, low legacy media consumers and low-low consumers. In the US sample, membership of the low-high group is associated with lower Covid-19 vaccine hesitancy compared with low-low consumers. However, respondents consuming both social and legacy media several times daily exhibit similar vaccine intentions on average to those consuming social media daily and legacy media less often, providing a contrast with the UK sample. We also identify differences in Covid-19 vaccine intentions relating to demographics and political values. Conclusions: Differences in vaccine attentions are associated with the extent and balance of consumption of news relating to Covid-19 and its source. Political values and ethnic identity also appear to structure attitudes to a future Covid-19 vaccine.",Siobhan Mcandrew et al.,https://share.osf.io/preprint/46127-240-B51,https://share.osf.io/preprint/46127-240-B51,2020-08-14,2020-10-09T11:20:43+00:00,PsyArXiv|Social and Behavioral Sciences; PsyArXiv|Social and Behavioral Sciences|Quantitative Methods; conspiracism; vaccine attitudes; legacy media; vaccine hesitancy; covid-19; political values; social media,False
70,"The Hazardous Workplace, Work-related Stress, and Unhealthy Behaviors among Healthcare Workers: The Relationships with Depressive and Insomnia symptoms during COVID-19","We aimed to investigate the relationship between mental health problems and unhealthy behaviors among healthcare workers in response to the COVID-19 pandemic. Using an online survey, we collected data on healthcare workers’ consideration of their work unit as hazardous. Furthermore, workers’ depression, insomnia, and anxiety symptoms were assessed using the Patient Health Questionnaire-9, Insomnia Severity Index, and Generalized Anxiety Disorder-7 scale, respectively. Healthcare workers’ work-related stress and anxiety in response to the viral epidemic were measured using the Stress and Anxiety to Viral Epidemic - 9 (SAVE-9) scale. As a result, work-related stress and anxiety in response to the viral epidemic was related to being female, to regarding one's work as a dangerous workplace, and depressive symptoms. Unhealthy behaviors, such as smoking and drinking as coping behaviors during the pandemic, were related to being male, young, experiencing depression, and having insomnia. During the COVID-19 pandemic, it is necessary to closely observe the patterns of work-related stress and anxiety reactions among healthcare workers to reduce their burnout.",Ju Kab Lee et al.,https://share.osf.io/preprint/46057-70E-E8B,https://share.osf.io/preprint/46057-70E-E8B,2020-10-07,2020-10-09T01:28:55+00:00,PsyArXiv|Psychiatry; PsyArXiv|Social and Behavioral Sciences; health personnel; covid-19; save-9; occupational stress,False
