,title,abstract,authors,link,ID,publication_date,update_date,subject,is_medRxiv
58,Report2: Impact of Covid-19 on young people aged 13-24 in the UK- preliminary findings,"A brief follow on report (for Report 1, see https://psyarxiv.com/uq4rn/). This report presents data on parents and their children's well being as a result of the COVID-19 pandemic from our adult survey study. In addition to presenting additional data showing a potentially significant increase in anxiety and depression in young people aged 13-24, as a consequence of COVID-19. Data collection for our Adult Study (Wave 2) took place between 22nd April and was ended on Friday, May 1st, here we report headline figures for the impact of Covid-19 on parents and their children. We have described our methods in a separate report (https://psyarxiv.com/wxe2n) and released two reports on our mental health outcomes from wave 1 (https://psyarxiv.com/hb6nq, https://psyarxiv.com/ydvc7).",Liat Levita et al.,https://share.osf.io/preprint/460EC-F66-7CB,https://share.osf.io/preprint/460EC-F66-7CB,2020-06-30,2021-01-20T11:48:58+00:00,PsyArXiv|Social and Behavioral Sciences; PsyArXiv|Social and Behavioral Sciences|Cognitive Psychology; PsyArXiv|Social and Behavioral Sciences|Developmental Psychology; PsyArXiv|Social and Behavioral Sciences|Health Psychology; PsyArXiv|Social and Behavioral Sciences|Health Psychology|Mental Health; PsyArXiv|Social and Behavioral Sciences|Quantitative Methods; resilience; mental health; covid-19; anxiety; adolescents; depression; parents; children,False
59,Triage Dilemmas: A Window into (Ecologically Valid) Moral Cognition,"At the height of the Covid-19 pandemic, frontline professionals at intensive care units around the world faced gruesome decisions about how to ration life-saving medical resources. These events provided a unique context for moral psychologists to understand how the general public reasons about real-world dilemmas involving trade-offs between human lives—in contrast to most prior research pursuing parallel questions via hypothetical thought experiments with limited relevance to the real world. In three studies (total N = 2298), we examined people’s moral attitudes toward triage of acute coronavirus patients. Our findings indicate that people generally support utilitarian approaches to critical care triage. These utilitarian tendencies do not stem from period change in people’s moral attitudes (relative to pre-pandemic levels); rather, people favor utilitarian resolutions of critical care dilemmas more than structurally analogous, non-medical dilemmas. Support for utilitarian triage decisions was rooted in prosocial dispositions, including empathy and impartial beneficence—which defies the received wisdom in moral psychology. Finally, despite abundant evidence of political polarization surrounding Covid-19, moral attitudes toward critical care triage differed modestly between liberals and conservatives. Taken together, our findings highlight people’s robust support for utilitarian measures in the face of a global public health threat. Our results also illustrate how the dominant research methods in moral psychology may be handicapped by their reliance on hypothetical stimuli (e.g., trolley cases) and could deliver insights that do not generalize to real-world, ethical priorities.",Markus Kneer et al.,https://share.osf.io/preprint/4615D-CBF-45F,https://share.osf.io/preprint/4615D-CBF-45F,2020-09-18,2021-01-19T18:45:19+00:00,PsyArXiv|Social and Behavioral Sciences; PsyArXiv|Social and Behavioral Sciences|Social and Personality Psychology; PsyArXiv|Social and Behavioral Sciences|Social and Personality Psychology|Cultural Differences; PsyArXiv|Social and Behavioral Sciences|Social and Personality Psychology|Moral Behavior; PsyArXiv|Social and Behavioral Sciences|Theory and Philosophy of Science; ecological validity; covid-19; utilitarianism; triage; moral dilemmas,False
60,Perceived COVID-19 risk is attenuated by ingroup trust: Evidence from three empirical studies,"Background: The social identity model of risk taking proposes that people take more risks with ingroup members because they trust them more. While this can be beneficial in some circumstances, in the context of the COVID-19 pandemic it has the potential to undermine an effective public health response if people underestimate the risk of contagion posed by ingroup members, or overestimate the risk of vaccines or treatments developed by outgroup members. Methods: Three studies (two prospective surveys, one experiment) with community-based adults tested the potential for the social identity model of risk taking to explain risk perception and risk taking in the context of COVID-19. Results: Study 1 was a two-wave study with a pre-COVID baseline, and found that people who identified more strongly as a member of their neighborhood pre-COVID tended to trust their neighbors more, and perceive interacting with them during lockdown restrictions as less risky. Study 2 (N=2033) replicated these findings in a two-wave nationally representative Australian sample. Study 3 (N=216) was a pre-registered experiment which found evidence that the tendency to trust ingroup members more could be harnessed to enhance the COVID-19 response. Specifically, people were more willing to take a vaccine and perceived it to be less risky when it was developed by an ingroup compared to an outgroup source. Conclusions: Across all three studies, ingroup members were trusted more and were perceived to pose less health risk. These findings are discussed with a focus on how group processes can be more effectively incorporated into public health policy, both for the current pandemic and for future contagious disease threats.",Tegan Cruwys et al.,https://share.osf.io/preprint/46045-6A7-72F,https://share.osf.io/preprint/46045-6A7-72F,2021-01-19,2021-01-19T14:32:25+00:00,PsyArXiv|Social and Behavioral Sciences; PsyArXiv|Social and Behavioral Sciences|Health Psychology; PsyArXiv|Social and Behavioral Sciences|Health Psychology|Health-related Behavior; PsyArXiv|Social and Behavioral Sciences|Health Psychology|Illness; PsyArXiv|Social and Behavioral Sciences|Social and Personality Psychology; PsyArXiv|Social and Behavioral Sciences|Social and Personality Psychology|Self and Social Identity; group processes; health behavior; social identity; trust; risk perception,False
61,Daily associations between sleep and physical activity: A systematic review and meta-analysis,"The day-to-day variations of sleep and physical activity are associated with various health outcomes in adults, and previous studies suggested a bidirectional association between these behaviors. The daily associations between sleep and physical activity have been examined in observational or interventional contexts. The primary goal of the current systematic review and meta-analysis was to summarize existing evidence about daily associations between sleep and physical activity outcomes at inter- and intra-individual level in adults. A systematic search of records in eight databases from inception to July 2019 identified 33 peer-reviewed empirical publications that examined daily sleep – physical activity association in adults. The qualitative and quantitative analyses of included studies did not support a bidirectional daily association between sleep outcomes and physical activity. Multilevel meta-analyses showed that three sleep parameters were associated with physical activity the following day: sleep quality, sleep efficiency, and wake after sleep onset. However, the associations were small, and varied in terms of direction and level of variability (e.g. inter- or intra-individual). Daytime physical activity was associated with lower total sleep time the following night at an inter-person level with a small effect size. From a clinical perspective, care providers should monitor the effects of better sleep promotion on physical activity behaviours in their patients. Future studies should examine sleep and physical activity during a longer period and perform additional sophisticated statistical analyses.",Sarah Atoui et al.,https://share.osf.io/preprint/4604C-2BA-AA2,https://share.osf.io/preprint/4604C-2BA-AA2,2020-06-17,2021-01-19T11:56:29+00:00,PsyArXiv|Social and Behavioral Sciences; PsyArXiv|Social and Behavioral Sciences|Health Psychology; PsyArXiv|Social and Behavioral Sciences|Health Psychology|Health-related Behavior; intraindividual; insomnia; sleep; ambulatory assessment; daily; physical actvity,False
62,Information about herd immunity through vaccination and empathy promote COVID-19 vaccination intentions,"Objective: An effective vaccine against COVID-19 is a desired solution to curb the spread of the disease. However, vaccine hesitancy might hinder high uptake rates and thus undermine efforts to eliminate COVID-19 once an effective vaccine became available. The present contribution addresses this issue by examining two ways of increasing the intention to get vaccinated against COVID-19. Methods: Two pre-registered online studies were conducted (N = 2,315 participants from the UK) in which knowledge about and beliefs in herd immunity through vaccination, as well as empathy for those most vulnerable to the virus, were either measured (Study 1) or manipulated (Study 2). As a dependent variable, individuals’ self-reported vaccination intention once a vaccine against COVID-19 became available was assessed. Results: In Study 1 (N = 310), the intention to get vaccinated against COVID-19 was correlated with knowledge about and belief in herd immunity (r = .58, p < .001), as well as with empathy for those most vulnerable to the virus (r = .26, p < .001). In Study 2 (N = 2,005), information about herd immunity (Cohen’s d = 0.13, p = .003) and empathy (Cohen’s d = 0.22, p < .001) independently promoted vaccination intention. Conclusions: The motivation to get vaccinated against COVID-19 was related to and could be causally promoted by both mere information about herd immunity and by empathy. As such, the present research provides a better understanding of the intention to get vaccinated against COVID-19.",Stefan Pfattheicher et al.,https://share.osf.io/preprint/46127-E9A-7B0,https://share.osf.io/preprint/46127-E9A-7B0,2020-09-30,2021-01-19T09:46:16+00:00,PsyArXiv|Social and Behavioral Sciences; PsyArXiv|Social and Behavioral Sciences|Social and Personality Psychology; prosociality; covid-19; vaccination; empathy; herd immunity,False
63,Effects of Covid-19 lockdown on parental functioning in vulnerable families,"The Covid-19 pandemic has caused major changes to family life followed by a call for knowledge about how these changes have affected parental functioning, particularly in vulnerable families (Prime, Wade & Brooks, 2020). This study uses a natural experiment design to investigate the effect of the Covid-19 lockdown on parental mental health, parenting stress and three dimensions of destructive interparental conflict in a heterogeneous sample characterized by pre-existing relationship problems. Results from mixed model regression analyses showed that despite significantly higher levels of parenting stress in the lockdown group (n = 744 families) compared with the control group (n = 427 families), lockdown did not adversely affect parental mental health or levels of destructive conflicts behaviors. In fact, levels of verbal aggression and child involvement in conflict decreased during lockdown among parents living apart. Pre-existing destructive conflict levels, financial problems and age of youngest child did not moderate any of the associations. Thus, findings indicated that pre-existing family vulnerability did not predispose for reduced parental functioning during lockdown, beyond increased parenting stress. Resilient processes and an increased sense of purpose may be potential mechanisms. Caution should be taken when generalizing the findings due to the welfare context of the sample and as long-term lockdown effects were not investigated. Importantly, children in vulnerable families may have been negatively impacted by increased family time, despite relatively stable parental functioning during lockdown.",Maren Sand Helland et al.,https://share.osf.io/preprint/4601B-EFC-79A,https://share.osf.io/preprint/4601B-EFC-79A,2020-12-07,2021-01-18T20:03:45+00:00,"PsyArXiv|Social and Behavioral Sciences; PsyArXiv|Social and Behavioral Sciences|Health Psychology; PsyArXiv|Social and Behavioral Sciences|Health Psychology|Mental Health; PsyArXiv|Social and Behavioral Sciences|Psychology, other; PsyArXiv|Social and Behavioral Sciences|Quantitative Methods; PsyArXiv|Social and Behavioral Sciences|Quantitative Methods|Experimental Design and Sample Surveys; vulnerable families; covid-19; natural experiment design; parental functioning",False
64,Unrealistic optimism and HEXACO traits as predictors of risk perception and compliance with COVID-19 preventive measures during the first wave of pandemic,"The aims of this study were to examine possible differences and factors that contribute to risk perception and compliance with preventive measures at the beginning (T1) and the end (T2) of the first wave of COVID-19 pandemic. The sample consisted of 423 participants (M = 30.29, SD = 14.45; 69% female). Compliance, risk perception and trust in information were significantly higher in T1 than T2. For risk perception, significant predictors in both T1 and T2 were age, Emotionality (HEXACO-PI-R) and Unrealistic Optimism (NLE, Negative Life Events). Trust in information was a significant predictor in T1, while Unrealistic Optimism (Positive Life Events) was a signifi-cant predictor in T2. For compliance, significant predictors in T1 were gender and trust in information while in T2 were Emo-tionality, Extraversion, Conscientiousness (HEXACO-PI-R), NLE and trust in information, for both T1 and T2. In general, findings suggest a much more pronounced role of personality traits in adherence to protective measures at the end than at the beginning of the first wave of the COVID-19 pandemic in Serbia. Also, the results indicate the role of unrealistic opti-mism regarding negative life events in lower compliance with protective measures.",Milan Oljača et al.,https://share.osf.io/preprint/4613C-3FE-FDD,https://share.osf.io/preprint/4613C-3FE-FDD,2020-11-02,2021-01-18T19:00:46+00:00,PsyArXiv|Social and Behavioral Sciences; PsyArXiv|Social and Behavioral Sciences|Social and Personality Psychology; PsyArXiv|Social and Behavioral Sciences|Social and Personality Psychology|Affect and Emotion Regulation; PsyArXiv|Social and Behavioral Sciences|Social and Personality Psychology|Individual Differences; PsyArXiv|Social and Behavioral Sciences|Social and Personality Psychology|Social Well-being; risk perception; covid-19; hexaco; compliance to protective measures; unrealistic optimism,False
65,"Depression and Anxiety Symptoms Amongst Kenyan Adolescents: Psychometric Properties, Prevalence, Psychosocial and Sociodemographic Factors","Background: We assessed the psychometric properties of standard Western-derived instruments, the prevalence of depression and anxiety symptoms and their associations with sociodemographic and psychosocial variables in a large sample of Kenyan adolescents. Methods: We administered self-report measures of depression (PHQ-8) and anxiety (GAD-7) symptoms, social support, gratitude, happiness, optimism and perceived control to 2,192 Kenyan youths (57.57% female) aged 12-19. Results: Both the PHQ-8 (α = 0.78) and GAD-7 (α = 0.82) showed adequate internal consistency. EFA with a sub-sample (N = 1096) yielded a 1-factor structure for both the PHQ-8 and GAD-7, a subsequent CFA conducted on the basis of the 1-factor model on another sub-sample (N = 1096) yielded good goodness of fit for the PHQ-8 (2=76.73; p<0.001; RMSEA=0.05; CFI=0.96; TLI=0.95) and GAD-7 (2=88.19; p<0.001; RMSEA=0.07; CFI=0.97; TLI=0.95). Some 28.06% of participants met the clinical cut-off for depressive symptoms and 30.38% for anxiety symptoms. Social support, gratitude, happiness, optimism, and perceived control were negatively associated with symptoms. Older and female adolescents reported higher symptoms, while adolescents with three or more siblings reported lower symptoms. Limitations: Cross-sectional data no not allow us to investigate the onset, maintenance, and course of depressive and anxiety symptoms and our large sample was not randomly sampled. Conclusions: The western-derived PHQ and GAD met conventional psychometric standards with adolescents in sub-Saharan Africa; depression and anxiety symptoms showed relatively high prevalence and significant associations with important psychosocial and sociodemographic factors.",Tom L Osborn et al.,https://share.osf.io/preprint/460E6-302-FB1,https://share.osf.io/preprint/460E6-302-FB1,2021-01-16,2021-01-18T12:29:03+00:00,PsyArXiv|Psychiatry; PsyArXiv|Social and Behavioral Sciences; PsyArXiv|Social and Behavioral Sciences|Clinical Psychology; PsyArXiv|Social and Behavioral Sciences|Clinical Psychology|Anxiety Disorders; PsyArXiv|Social and Behavioral Sciences|Clinical Psychology|Depressive Disorders; PsyArXiv|Social and Behavioral Sciences|Clinical Psychology|Mental Disorders; sociodemographic factors; adolescents; anxiety; kenya; depression; sub-saharan africa; prevalence,False
66,COVID-19: A Boon or a Bane for Creativity?,"In many countries, the COVID-19 pandemic led to a period of lockdown that impacted individual’s lifestyles, in both professional and personal spheres. New problems and challenges arose, as well as opportunities. Numerous studies have examined the negative effects of lockdown measures, but few have attempted to shine light on the potential positive effects that may come out of these measures. We focused on one particular positive outcome that might have emerged from lockdown: creativity. To this end, this paper compared professional creativity (Pro-C) and everyday creativity (little-c) before and during lockdown, using a questionnaire-based study conducted on a French sample (N = 1266). We expected participants to be more creative during than prior to lockdown, in both professional and everyday spheres. Regarding professional creativity, we did not see any significant differences between the two comparison points, before and during lockdown. Regarding everyday creativity, we observed a significant increase during lockdown. Furthermore, our results suggest that participants with a lower baseline creativity (before lockdown) benefited more from the situation than those with a higher initial baseline creativity. Our results provide new insights on the impact of lockdown and its positive outcomes. These measures may have inarguably negative consequences on the physical and mental health of many, but their positive impact exists as well.",Maxence Mercier et al.,https://share.osf.io/preprint/461AC-44D-278,https://share.osf.io/preprint/461AC-44D-278,2020-09-01,2021-01-18T10:57:11+00:00,PsyArXiv|Social and Behavioral Sciences; PsyArXiv|Social and Behavioral Sciences|Cognitive Psychology; PsyArXiv|Social and Behavioral Sciences|Cognitive Psychology|Creativity; PsyArXiv|Social and Behavioral Sciences|Industrial and Organizational Psychology; PsyArXiv|Social and Behavioral Sciences|Industrial and Organizational Psychology|Innovation and Technology; covid-19; creativity development; creativity; pro-c; little-c; positive outcome; lockdown,False
67,Parental Social Isolation and Child Maltreatment Risk During the COVID-19 Pandemic,"Background: On March 11, 2020, COVID-19 was declared a pandemic by the World Health Organization. The social isolation and economic stress resulting from pandemic have the potential to exacerbate child abuse and neglect. Objective: This study examines the association of parents’ perceived social isolation and recent employment loss to risk for child maltreatment (neglect, verbal aggression, and physical punishment) in the early weeks of the COVID-19 pandemic. Participants and Setting: Participants (N = 283) were adults living in the U.S. who were parents of at least one child 0-12 years of age. Methods: Participants completed an online survey approximately 2 weeks after the World Health Organization declared that COVID-19 was a pandemic. The survey asked about recent changes (i.e., in the past 2 weeks) to employment status, parenting behaviors, use of discipline, use of spanking, and depressive symptoms. Results: Parents’ perceived social isolation and recent employment loss were associated with self-report of physical and emotional neglect and verbal aggression against the child, even after statistically controlling for parental depressive symptoms, income, and sociodemographic factors. Parents’ perceived social isolation was associated with parental report of changes in discipline, specifically, using discipline and spanking more often in the past 2 weeks. Associations were robust to analyses that included two variables that assessed days spent social distancing and days spent in “lockdown.” Conclusions: Study results point to the need for mental health supports to parents and children to ameliorate the strain created by COVID-19.",Shawna J. Lee et al.,https://share.osf.io/preprint/460D2-9E7-F97,https://share.osf.io/preprint/460D2-9E7-F97,2020-12-10,2021-01-17T02:46:14+00:00,PsyArXiv|Social and Behavioral Sciences; PsyArXiv|Social and Behavioral Sciences|Developmental Psychology; child abuse; discipline; pandemic; global health crisis; anxiety; parent-child conflict tactics scales; coronavirus; physical abuse; child wellbeing; screaming; psychological aggression; yelling; depression; child neglect; physical punishment; spank,False
68,"Resilience, mood, and mental health outcomes during the first wave of the COVID-19 pandemic in Bulgaria","Background: The fundamental challenges of the COVID-19 pandemic may have lasting negative effects on the quality of mental health worldwide. Resilience is considered an important protective factor in reducing the risk of psychopathology in the face of various adverse events, such as the ongoing health crisis. The aims of the current study were to: (1) evaluate the predictive utility of resilience in accounting for positive and negative moods, substance use, depression and anxiety; and (2) compare negative and positive moods experienced before the pandemic to emotions reported during the first wave of the COVID-19 pandemic in Bulgaria, when the country still had low prevalence of infections and fatalities. Methods: 179 Bulgarian participants completed the international online Minnesota Global Survey on Stress and Resilience in the Face of the Novel Coronavirus (COVID-19), which included measures of resilience, depression and anxiety, substance use, positive and negative moods experienced both before and during the COVID-19 outbreak. Results: Resilience predicted higher levels of positive affect and lower anxiety, depression, and negative mood during the first wave of the COVID-19 outbreak in Bulgaria. A significant increase was found in negative mood and a corresponding decrease in positive mood in the time since COVID-19 began spreading compared to before the pandemic. Conclusions: Results suggest that the initial wave of the COVID-19 crisis impacted individuals’ well-being, even in countries with relatively low prevalence of COVID-19 and associated fatalities. In this challenging global setting, resilience may serve as a buffer against negative emotional states and psychological distress.",Elena Psederska et al.,https://share.osf.io/preprint/46066-B3C-999,https://share.osf.io/preprint/46066-B3C-999,2021-01-16,2021-01-16T21:40:17+00:00,PsyArXiv|Social and Behavioral Sciences; anxiety; substance use; covid-19; depression; resilience; positive and negative mood,False
