,title,abstract,authors,link,ID,publication_date,update_date,subject,is_medRxiv
184,Parenting in a Pandemic: Parental Stress During the Physical Distancing Intervention Following the onset of the COVID-19 Outbreak,"Objective: The main aim of the study was to examine levels of parental stress and symptoms of depression and anxiety in the general parental population (N = 2868) during the strict government-initiated physical distancing protocols following the onset of the COVID-19 pandemic. We further investigated specific predictors of parental distress, including burnout, anger aimed at children, worry, lack of social support, lower perceived self-efficacy, and difficulty to work from home. Method: In this cross-sectional, epidemiological study, we disseminate an online survey that was administered two weeks after the government-initiated physical distancing protocols were established. Data were collected from March 31 to April 7. Results: Female parents compared to male parents and parents living with more than one child per parent or child(ren) with special needs compared to those living with one or fewer children per parent reported higher levels of parental stress. Burnout and social support were further associated with parental stress. Specifically, nearly one-fourth of the parents reported that they have felt burned out or in the proximity of feeling burned out more than half the days during the social distancing interventions. Also, 29% of the parents reported that they were angrier at their child(ren) than usual during the physical distancing period. Parents with a pre-existing psychiatric diagnosis had significantly higher parental stress compared to individuals with no psychiatric diagnosis. The reported prevalence of depression and anxiety symptoms above standardized cutoff levels among the 2868 parents was 25.4% for depression and 24.1% for anxiety, with the highest prevalence score on both symptoms of anxiety (37.6%) and depression (38.5%) for the youngest parents (age group 21–30 years). Furthermore, the parents who were home with their children and predominantly followed distancing protocol by socially distancing from public activity and peers (i.e., at least 10 out of 14 days) had significantly higher symptoms of depression (29%) and anxiety (27%), compared to parents who did not isolate in the same manner (i.e., depression 13% and anxiety 15%). Conclusions: The present study reveals that home confinement during the restricted lockdown period is related to markedly high levels of parental stress, in addition to symptoms of depression and anxiety in parents. Given the detrimental effects of depression, anxiety, and parental stress on the quality of life, morbidity rates, as well as adverse child outcomes and the potential risk of child abuse and neglect, these results suggest that appropriate action should be taken to impede further development of these symptoms, as well as developing interventions aimed at vulnerable subgroups and other relevant factors associated with increased parental stress. Keywords: COVID-19 lockdown, parental stress, depression, anxiety",Miriam S. Johnson et al.,https://share.osf.io/preprint/46242-1A1-402,https://share.osf.io/preprint/46242-1A1-402,2020-12-13,2020-12-15T08:34:08+00:00,PsyArXiv|Life Sciences; PsyArXiv|Social and Behavioral Sciences; PsyArXiv|Social and Behavioral Sciences|Clinical Psychology; PsyArXiv|Social and Behavioral Sciences|Clinical Psychology|Anxiety Disorders; PsyArXiv|Social and Behavioral Sciences|Clinical Psychology|Depressive Disorders; PsyArXiv|Social and Behavioral Sciences|Clinical Psychology|Trauma and Stress; PsyArXiv|Social and Behavioral Sciences|Health Psychology; PsyArXiv|Social and Behavioral Sciences|Health Psychology|Mental Health; PsyArXiv|Social and Behavioral Sciences|Health Psychology|Prevention; social distancing; depression; covid-19; anxiety; physical distancing; parental stress; lockdown,False
185,Musical Engagement and Parent-Child Attachment in Families with Young Children During the Covid-19 Pandemic,"The onset of the Covid-19 pandemic has disrupted the lives of families in the United States and across the world, impacting parent mental health and stress, and in turn, the parent-child relationship. Music is a common parent-child activity and has been found to positively impact relationships, but little is known about music’s role in parent-child interactions during a pandemic. The current study utilized an online questionnaire to assess the use of music in the home of young children and their parents in the USA and Canada during Covid-19 and its relationship with parents’ affective attachment with their child. Musical activity was high for both parents and children. Parents reported using music for both emotion regulation and to socially connect with their children. Parent-child musical engagement was associated with parent-child attachment, controlling for relevant parent variables including parent distress, efficacy, education and parent-child engagement in non-musical activities. These results indicate that music may be an effective tool for building and maintaining parent-child relationships during a period of uncertainty and change.",Selena Steinberg et al.,https://share.osf.io/preprint/46045-69F-509,https://share.osf.io/preprint/46045-69F-509,2020-12-14,2020-12-15T05:57:21+00:00,PsyArXiv|Social and Behavioral Sciences; parent-child attachment; music; covid-19; parent-child interactions; early childhood,False
186,Cultural influence on COVID-19 cognitions and growth speed: the role of cultural collectivism,"Many challenges faced by humans require large-scale cooperation for communal benefits. We examined what motivates such cooperation in the context of social distancing and mask wearing to reduce the transmission intensity of the novel coronavirus (COVID-19). We hypothesized that collectivism, a cultural variable characterizing the extent that individuals see themselves in relation to others, contributes to people’s willingness to engage in these behaviors. Consistent with preregistered predictions, across three studies (n=2864), including a U.S. nationally representative sample, people’s collectivist orientation is positively associated with intentions, positive beliefs, norm perceptions, and policy support for the preventive behaviors. In separate analyses at the country level (n=69 countries), more collectivist countries demonstrated lower growth rate in both COVID-19 confirmed cases and deaths. Together, these studies demonstrate the positive role of collectivism at the individual- and country-level in reducing COVID-19 transmission, and highlight the need to consider culture in public health policies and communications.",Rui Pei et al.,https://share.osf.io/preprint/4613B-4BB-402,https://share.osf.io/preprint/4613B-4BB-402,2020-12-15,2020-12-15T05:54:02+00:00,PsyArXiv|Social and Behavioral Sciences; PsyArXiv|Social and Behavioral Sciences|Health Psychology; PsyArXiv|Social and Behavioral Sciences|Health Psychology|Health-related Behavior; PsyArXiv|Social and Behavioral Sciences|Social and Personality Psychology; PsyArXiv|Social and Behavioral Sciences|Social and Personality Psychology|Cultural Differences,False
187,Factors associated with Adherence to Social Distancing Protocols and Hygienic Behavior during the COVID-19 Pandemic,"Objective: To investigate factors associated with adherence to viral mitigation strategies recommended by the WHO during the COVID-19 pandemic, including adherence to social distancing protocols (SDPs) and adherence to hygienic behavior recommendations (HB). Design: This pre-registered epidemiological study of 4158 adults examines the association between situational, cognitive, affective, behavioral, and personality-based factors with adherence to SDPs and HB during the COVID-19 pandemic. The study further investigates the relationship between central information sources and adherence behavior. Main Outcome Measures: Adherence to social distancing protocols (SDPs) and adherence to hygienic behavior recommendations (HB). Results: Individuals aged between 18-30 reported lowest adherence to SDPs and HB. Greater alcohol consumption was associated with decreased adherence to SDP and HB. Increased risk perception, fear of infection, conscientious personality, and altruistic attitude was associated with greater adherence to SDPs and HB. Males, single individuals, employed individuals, and those without children reported lower adherence to SDPs and HB. Extroverted personality and residents of urban areas were associated with lower adherence to SDPs, but not HB. In contrast to earlier stages of the pandemic, voluntary social distancing was associated with greater adherence to SDPs as opposed to rule-enforced (e.g., mandated) social distancing. Among information sources, increased time spent obtaining information from official (i.e., recognized) newspapers had the strongest favorable association with adherence to both SDPs and HB, followed by information obtainment from recognized television channels. Relying on information from friends and family was associated with decreased adherence to SDPs, but was unrelated to adherence to HB. Sensitivity analyses replicated the findings, supporting the stability and robustness of the proposed models. Conclusion: The present study identifies factors associated with favorable and detrimental adherence behavior along with substantial dissemination routes, presenting strategies which may be utility toward fostering adherence to contemporaneously implemented pandemic mitigation protocols. Key words: COVID-19; Adherence; Compliance; Social Distancing; Physical Distancing; Viral Mitigation; Hygienic Behavior",Omid V. Ebrahimi et al.,https://share.osf.io/preprint/4614E-34D-F5B,https://share.osf.io/preprint/4614E-34D-F5B,2020-12-07,2020-12-14T18:29:50+00:00,"PsyArXiv|Life Sciences; PsyArXiv|Psychiatry; PsyArXiv|Social and Behavioral Sciences; PsyArXiv|Social and Behavioral Sciences|Health Psychology; PsyArXiv|Social and Behavioral Sciences|Health Psychology|Health-related Behavior; PsyArXiv|Social and Behavioral Sciences|Health Psychology|Illness; PsyArXiv|Social and Behavioral Sciences|Health Psychology|Prevention; PsyArXiv|Social and Behavioral Sciences|Health Psychology|Social health; PsyArXiv|Social and Behavioral Sciences|Psychology, other; pandemic mitigation protocols; adherence; coronavirus; severe acute respiratory syndrome coronavirus 2 (sars-cov-2); viral mitigation; non-pharmacological epidemiological interventions; social distancing; physical distancing; covid-19; compliance; behavioral mitigation protocols; hygienic behavior",False
188,The psychological impact of the COVID-19 crisis is higher among young Swiss men with a lower socioeconomic status: evidence from a cohort study,"Aims The COVID-19 pandemic affected daily life worldwide. In addition to its tangible physical impacts, it may also have affected those who had been especially vulnerable already before the crisis and those who experienced substantial changes to their work situation during it. The present study aimed to investigate whether the psychological impact of the COVID-19 crisis varied with regards to young Swiss men’s pre-crisis level of education and socioeconomic status and to changes in their work situation due to it. Methods A cohort of 2345 young Swiss men (mean age = 29) completed survey-based assessments shortly before (April 2019 to February 2020) and early on during the COVID-19 crisis (May to June 2020). Outcomes measured were psychological outcomes before and during the COVID-19 crisis (depression, perceived stress and sleep quality), and the fear, isolation and psychological trauma induced by it. We investigated associations between these outcomes and their predictors: pre-crisis socioeconomic status (relative financial status and difficulty paying bills) and level of education, changes in work situation during the crisis (job loss, partial unemployment, working from home, change in workload) and working in contact with potentially infected people, both inside and outside the healthcare sector. Results COVID-19 changed the employment status of about 21% of participants (job loss, partial unemployment or lost money if self-employed). More than 40% worked predominantly from home during the crisis. Participants with a lower socioeconomic status experienced higher psychological impact (depression, perceived stress, sleep quality, psychological trauma, fear and isolation) due to the COVID-19 crisis. A higher impact was also felt by participants who lost their job due to the COVID-19 crisis, the partially unemployed, those with an increased workload or those who worked mainly from home. Overall, working in contact with potentially infected people was not associated with psychological impact. Conclusions Even in a country like Switzerland, with relatively high social security benefits and universal healthcare, the COVID-19 crisis had a considerable psychological impact, especially among those with a lower socioeconomic status and those who experienced deteriorations in their work situation due to the COVID-19 crisis. Supporting these populations during the crisis may help to prevent an amplification of inequalities in mental health and social status. Such support could help to lower the overall impact of the crisis on the mental well-being of Switzerland’s population.",Simon Marmet et al.,https://share.osf.io/preprint/46031-05A-333,https://share.osf.io/preprint/46031-05A-333,2020-12-11,2020-12-14T17:35:01+00:00,PsyArXiv|Psychiatry; PsyArXiv|Social and Behavioral Sciences; PsyArXiv|Social and Behavioral Sciences|Health Psychology; socioeconomic status; essential workers; switzerland; mental health; education; covid-19,False
189,Predictors and patterns of gambling behaviour across the COVID-19 lockdown: findings from a UK cohort study,"The negative impact of the COVID-19 pandemic on the economy is well documented, with widespread furloughs, job loss, and financial insecurity. Concerns have been raised about increases in maladaptive coping behaviours such as gambling, to offset financial losses. Similarly, as individuals spend increased time at home, new populations may initiate or increase the frequency of gambling behaviours. The current study used a large longitudinal study of UK adults (N = 32,559) to examine a range of sociodemographic, stress, and health predictors of (i) gambling during strict lockdown (March to the first week of June 2020), (ii) gambling more frequently during strict lockdown compared to before lockdown, and (iii) continued increased rates of gambling during the relaxing of lockdown restrictions (end of July/early August 2020) compared to earlier in the lockdown (late May/early June 2020). Results from a logistic regression indicated that males, older ages, the employed, those with progressively lower levels of education, who lived in overcrowded accommodation, were highly bored, frequently drank alcohol, smoked or were ex-smokers, and had high risk-taking tendencies were more likely to gamble during strict lockdown. Individuals who were more likely to have increased their frequency of gambling during strict lockdown compared to before the lockdown were highly bored, employed, frequently drank alcohol, and had depression and anxiety, whilst men and current smokers were less likely. As lockdown restrictions eased, individuals of ethnic minority backgrounds, who were current smokers, and with lower education attainment were more likely to continue gambling at heightened rates. This suggests which risk groups should be targeted and provided with more effective coping strategies.",Meg Fluharty et al.,https://share.osf.io/preprint/460EC-E56-213,https://share.osf.io/preprint/460EC-E56-213,2020-12-10,2020-12-14T17:33:19+00:00,"PsyArXiv|Social and Behavioral Sciences; PsyArXiv|Social and Behavioral Sciences|Psychology, other; risk behaviours; lockdown; covid-19; gambling; coping",False
190,Who Bought All the Toilet Paper? Conspiracy Theorists Are More Likely to Stockpile During the COVID-19 Pandemic,"The current COVID-19 pandemic has changed many people’s lives. Some people have responded to the rising of the pandemic by engaging in panic buying behaviors, a phenomenon that has not been well-understood in the past. People who believe in these conspiracies may experience a heightened sense of powerlessness and vulnerability. As a result, they may be particularly susceptible to palliatively and compensatorily engage in the panic buying behaviors (i.e., stockpiling). Supporting this idea, two studies using data from the U.K. (cross-sectional) and the U.S. (longitudinal) show that people who endorse COVID-19 conspiracy theories are more likely to engage in stockpiling behaviors in the past as well as in the future.",Hui Bai,https://share.osf.io/preprint/46157-536-B22,https://share.osf.io/preprint/46157-536-B22,2020-07-02,2020-12-14T16:10:58+00:00,PsyArXiv|Social and Behavioral Sciences; PsyArXiv|Social and Behavioral Sciences|Social and Personality Psychology,False
191,Subjective Attribution of Infectious Disease Outbreaks to Climate Change is Associated with Mitigation Behavioural Intentions and COVID-19 Recovery Policy Support,"Scholars argue that personal experience with climate change related impacts has the potential to increase public engagement. Yet, previous studies, which have almost exclusively focussed on experience with extreme weather events, provide mixed results. Based on experiential learning and attribution theory, this article argues that unless individuals’ attribute an event as related to or caused by climate change, their responses may be misdirected. Results based on survey data from a nationally representative sample of the New Zealand public indicates that subjective attribution of infectious disease outbreaks to climate change and to the human impact on the environment is positively associated with mitigation behavioural intentions and policy support. In addition, political affiliation moderates the relationship between subjective attribution and mitigation policy support, indicating a higher potential for right-leaning compared to moderates or left-leaning respondents to learn about climate change through health-related climate change impacts. Helping people understand the role of human impact on the environment and climate change in infectious disease outbreaks is likely to increase public engagement.",Jagadish Thaker,https://share.osf.io/preprint/4610F-450-C9D,https://share.osf.io/preprint/4610F-450-C9D,2020-12-14,2020-12-14T13:48:38+00:00,PsyArXiv|Social and Behavioral Sciences; PsyArXiv|Social and Behavioral Sciences|Environmental Psychology; PsyArXiv|Social and Behavioral Sciences|Health Psychology; PsyArXiv|Social and Behavioral Sciences|Health Psychology|Health-related Behavior; covid-19; political affiliation; behavioural intentions; policy support; climate change; subjective attribution; infectious diseases,False
192,Pre-pandemic Autonomic Nervous System Activity Predicts Well-being during COVID-19 in Israel,"Despite the unfolding impact of the COVID-19 pandemic on psychological well-being, there is a lack of prospective studies that target physiological markers of distress. There is a need to examine physiological predictors from the pre-pandemic period to identify and treat individuals at-risk. Our aim was to use pre-pandemic markers of Autonomic Nervous System (ANS) parasympathetic and sympathetic regulation, to predict individuals' psychological well-being during the crisis. We also assessed the role of emotion regulation as a mediator of the association between pre-pandemic physiological measures and COVID-related well-being. In May-June 2020, 185 Israeli adults completed online questionnaires assessing their emotional regulation of negative affect since COVID-19 began, and their current well-being. These individuals had participated in lab studies 1.5-3 years prior to this assessment, where their physiological measures were taken, including Respiratory Sinus Arrhythmia (RSA) and Skin Conductance Level (SCL). RSA was positively related to emotion regulation during COVID-19. Emotion regulation, in its turn, positively predicted well-being during the crisis. The mediation was significant and moderated by SCL (index=-0.09, 95%CI [-0.02, -0.0001]), such that it was strongest for individuals with low SCL. We point to pre-pandemic physiological mechanisms underlying individuals' mental well-being during the COVID-19 pandemic. These findings have theoretical, diagnostic, and clinical implications that may refine our understanding of the physiological basis of resilience to the current pandemic, and thus may be implemented to identify and assist individuals in these times.",Ilanit Gordon et al.,https://share.osf.io/preprint/460E3-5FF-F57,https://share.osf.io/preprint/460E3-5FF-F57,2020-12-14,2020-12-14T13:39:04+00:00,"PsyArXiv|Social and Behavioral Sciences; PsyArXiv|Social and Behavioral Sciences|Physiology; PsyArXiv|Social and Behavioral Sciences|Psychology, other; scl; autonomic nervous system; covid-19; rsa",False
193,Antecedents and consequences of COVID-19 conspiracy beliefs: a rapid review of the evidence,"COVID-19 conspiracy theories emerged almost immediately after the beginning of the pandemic, and the number of believers does not appear to decline. Conspiracy beliefs can have severe consequences, such as reduced guideline adherence and vaccination intentions. Therefore, it is crucial to understand them. In this rapid review we summarize research from more than 43 publications covering research in 25 countries worldwide. We evaluate the contribution of individual difference variables, biases and attitudes, and social factors to the beliefs, and discuss the consequences of the beliefs on safeguarding, self-centred, and misguided behaviours, vaccination intentions, and other, detrimental behaviours. We suggest that belief in COVID-19 conspiracy theories may be boosted by low levels of trust in a context of threat and low levels of comprehensive, accessible information in a context of unknowns. We conclude that interventions are urgently needed to (re-)establish trust and provide accessible information about COVID-19.",Valerie Van Mulukom et al.,https://share.osf.io/preprint/4616B-24D-145,https://share.osf.io/preprint/4616B-24D-145,2020-11-14,2020-12-14T12:39:14+00:00,"PsyArXiv|Social and Behavioral Sciences; PsyArXiv|Social and Behavioral Sciences|Cognitive Psychology; PsyArXiv|Social and Behavioral Sciences|Cognitive Psychology|Biases, Framing, and Heuristics; PsyArXiv|Social and Behavioral Sciences|Cognitive Psychology|Reasoning; PsyArXiv|Social and Behavioral Sciences|Cultural Psychology; PsyArXiv|Social and Behavioral Sciences|Health Psychology; PsyArXiv|Social and Behavioral Sciences|Health Psychology|Health-related Behavior; PsyArXiv|Social and Behavioral Sciences|Health Psychology|Mental Health; PsyArXiv|Social and Behavioral Sciences|Psychology, other; PsyArXiv|Social and Behavioral Sciences|Social and Personality Psychology; PsyArXiv|Social and Behavioral Sciences|Social and Personality Psychology|Attitudes and Persuasion; PsyArXiv|Social and Behavioral Sciences|Social and Personality Psychology|Individual Differences; PsyArXiv|Social and Behavioral Sciences|Social and Personality Psychology|Motivational Behavior; PsyArXiv|Social and Behavioral Sciences|Social and Personality Psychology|Personality and Situations; PsyArXiv|Social and Behavioral Sciences|Social and Personality Psychology|Prejudice and Discrimination; PsyArXiv|Social and Behavioral Sciences|Social and Personality Psychology|Self and Social Identity; PsyArXiv|Social and Behavioral Sciences|Social and Personality Psychology|Social Well-being; PsyArXiv|Social and Behavioral Sciences|Social and Personality Psychology|Violence and Aggression; personality; discrimination; violence; social media; protective behaviours; covid-19; threat; mental health; psychology; group identities; uncertainty; social sciences; trust; information; hoarding; review; trust in science; trust in government; coronavirus; pseudoscientific practices; pandemic; belief; vaccination intention; thinking style; conspiracy belief; infodemic",False
