,title,abstract,authors,link,ID,publication_date,update_date,subject,is_medRxiv
185,The Acute Impact of the COVID-19 Pandemic on Children’s Mental Health in Southwestern Ontario,"Objective: COVID-19 is an unprecedented global crisis. Research is critically needed to identify the acute and long-term impacts of the pandemic to children’s mental health including psychosocial factors that predict resilience, recovery, and persistent long-term distress. The present study collected data in June-July 2020 to enumerate the acute impact of the pandemic on children’s mental health, including the magnitude and nature of psychiatric and psychological distress in children, and to evaluate social support as a putative psychosocial correlate of children’s distress. Method: 190 families of children aged 8 to 13 from the Windsor-Essex region of Southwestern Ontario reported on the impact of the pandemic on children’s well-being (e.g., worry, happiness); irritability; social support; and symptoms of anxiety, depressive, and posttraumatic stress disorder at baseline assessment of an ongoing longitudinal study of the COVID-19 pandemic. Results: Children and parents reported worsened well-being and psychological distress during the pandemic compared to retrospective report of pre-pandemic well-being. Children and parents also reported higher depressive and anxiety symptoms, but fewer PTSD symptoms, compared to epidemiological samples that used the same measures prior to the pandemic. Finally, child-perceived social support from family and friends was associated with lower symptom severity. Conclusions: Study findings indicate broad psychological impact of the COVID-19 pandemic and are consistent with prior research that indicates a protective role of social support to mitigate the negative psychological impact of the pandemic.",Alexandra Mactavish et al.,https://share.osf.io/preprint/4620C-F1D-3F2,https://share.osf.io/preprint/4620C-F1D-3F2,2020-09-19,2020-09-20T14:48:14+00:00,PsyArXiv|Psychiatry; PsyArXiv|Social and Behavioral Sciences; PsyArXiv|Social and Behavioral Sciences|Clinical Psychology; PsyArXiv|Social and Behavioral Sciences|Clinical Psychology|Clinical Child Psychology; child mental health; anxiety; depression; mental health; children; irritability; covid-19,False
186,Lockdown stress amid COVID-19 on Alcoholics and Drug addicts,"Alcohol consumption within the COVID-19 time may be a stress reliever. Loneliness and social distancing results in the increased use of alcohol. Alcohol consumption for endless period during the isolation has created new cases of disorders associated with alcohol use. Especially the increased risk of infection and deteriorating symptoms. Citizens should be properly trained about alcohol-related problems during this emergency period. The Coronavirus Disease pandemic has undoubtedly had a serious impact on the supply of physical healthcare worldwide. The psychological state impact of this pandemic can’t be underestimated, particularly of patients affected by addiction. Heightened public stress and anxiety levels, increasing isolation and therefore the physical consequences of addiction play an outsized role within the proliferation and ongoing relapse of substance misuse and behavioural addiction.",Ankit Patel et al.,https://share.osf.io/preprint/460D6-31C-192,https://share.osf.io/preprint/460D6-31C-192,2020-09-02,2020-09-20T12:10:20+00:00,PsyArXiv|Life Sciences; PsyArXiv|Meta-science; PsyArXiv|Neuroscience; PsyArXiv|Psychiatry,False
187,Gendered Division of Labour during a Nationwide COVID-19 Lockdown: Implications for Relationship Problems and Satisfaction,"COVID-19 lockdowns have required many working parents to balance domestic and paid labour while confined at home. Are women and men equally sharing the workload? Are inequities in the division of labour compromising relationships? Leveraging a pre-pandemic longitudinal study of couples with young children, we examine gender differences in the division and impact of domestic and paid labour during a nationwide COVID-19 lockdown (N = 157 dyads). Women took on more of the parenting and housework, whereas men engaged in more paid work and personal time, during the lockdown. Couple members agreed that women’s share of parenting, housework and personal time was unfair, but this did not protect women burdened with an inequitable share of domestic labour from experiencing detrimental relationship outcomes. A greater, and more unfair, share of parenting, housework and personal time predicted residual increases in relationship problems and decreases in relationship satisfaction for women. Men who were not working full-time or were the primary caregiver also experienced negative relationship outcomes when they did more housework and parenting. These results substantiate concerns that the COVID-19 pandemic may undermine advances toward gender equality by reinforcing inequitable divisions of labour, thereby damaging women’s relationship wellbeing.",Nina Waddell et al.,https://share.osf.io/preprint/461BA-96E-FE0,https://share.osf.io/preprint/461BA-96E-FE0,2020-09-04,2020-09-20T12:01:08+00:00,PsyArXiv|Social and Behavioral Sciences; PsyArXiv|Social and Behavioral Sciences|Social and Personality Psychology; PsyArXiv|Social and Behavioral Sciences|Social and Personality Psychology|Interpersonal Relationships; covid-19 lockdown; division of labour; covid-19; relationship problems; parenting; paid work; housework,False
188,"Basic Psychological Needs, Stress and Coping Strategies - A Comparative Analysis of Pre-Epidemic and Epidemic Experiences","Background: The global epidemic of SARS-CoV-2 caused various deprivations and threats and forced the implementation of drastic restrictions in the whole world, including Poland. Objectives: Recognizing the consequences of the epidemic in the context of basic psychological needs satisfaction and frustration, the level of experienced stress, and the use of coping strategies. Design: The results of the pre-epidemic group (N = 626; aged 18 - 40) were compared with the results of the epidemic group (N = 282; aged 17 - 44). The following tests were used; BPNS&FS (Chen et al., 2015), PSS (Cohen et al., 1983), and COPE (Carver et al., 1989). Results: Women from the epidemic group reported higher levels of stress, lower satisfaction and higher frustration of autonomy and competence than the control group. Men from the epidemic group differed from the control group only by a higher frustration of autonomy. We found significant differences in coping strategy preference. The epidemic group was characterized by the following strategies: acceptance, mental disengagement, restraint, positive reinterpretation and growth, use of emotional social support, and use of humor. Conclusions: The results are consistent with previously documented reactions to uncontrolled and critical stressors and indicate the adaptability of undertaken coping efforts.",Ryszard Poprawa et al.,https://share.osf.io/preprint/461E7-DF1-0AC,https://share.osf.io/preprint/461E7-DF1-0AC,2020-09-05,2020-09-20T11:53:37+00:00,PsyArXiv|Social and Behavioral Sciences; PsyArXiv|Social and Behavioral Sciences|Health Psychology; PsyArXiv|Social and Behavioral Sciences|Health Psychology|Stress; satisfaction and frustration of basic psychological needs; perceived stress; coping; coronavirus; pandemic stress; sars-cov-2,False
189,"Racial Disparities in COVID-19 Impacts in Michigan, USA","Several racial disparities have been observed in the impacts of COVID-19 in the United States. In this paper, we used a representative sample of adults in Michigan to examine differences in COVID-19 impacts on Blacks and Whites in four domains: direct, perceived, political, and behavioral. We found that in the initial wave of the outbreak in May 2020, Blacks were more likely to be diagnosed or know someone who was diagnosed, or more likely to lose their job compared to Whites. Additionally, Blacks differed significantly from Whites in their assessment of COVID-19’s threat to public health and the economy, the adequacy of government responses to COVID-19, and the appropriateness of behavioral changes to mitigate COVID-19’s spread. Although in many cases these views of COVID-19 were also associated with political ideology, this association was significantly stronger for Whites than Blacks. We conclude by discussing the implications of an ongoing and highly politicized public health crisis that has racially disparate impacts in multiple domains.",Kaston D Anderson-Carpenter et al.,https://share.osf.io/preprint/4601B-BA1-ADF,https://share.osf.io/preprint/4601B-BA1-ADF,2020-09-19,2020-09-19T22:13:54+00:00,PsyArXiv|Social and Behavioral Sciences; PsyArXiv|Social and Behavioral Sciences|Health Psychology; ideology; covid; racial disparity; covid-19; race,False
190,"Rates of Adolescent Mental Health Problems, Substance Use, and Violence in the Home during COVID-19: Does Gender Matter?","Objective: There has been concern regarding the mental health impact of coronavirus disease 2019 (COVID-19), and subsequent public health interventions due to isolation, anxiety around the pandemic, and increased conflict in the home. The purpose of this study was to explore current rates of mental health problems, COVID-19 related stress, substance use, and violence at home among adolescents with comparisons across genders. Method: Participants (N = 809) from Canada were recruited via social media to complete an online survey. Participants (Mage = 15.67, SD = 1.37) identified as female (56.2%), male (38.7%), or trans/non-binary individuals (TNBI; 5.1%). Results: A large portion of adolescents met clinical cut-off for depression (51.2%), anxiety (40%) and Post-Traumatic Stress Disorder (45%). High rates of ADHD, ODD, and social phobia symptoms (ranging from 9%-20%) were also reported. Adolescents were mainly concerned with the health of family members and vulnerable populations, as well as the increased family stress at home during COVID-19. Rates of substance use were higher than expected with over 50% of youth engaging in some form of substance use, and almost 20% engaging in regular substance use. Rates of experiencing and perpetrating psychological violence at home were higher than physical violence and were close to rates in high-risk populations. TNBI and females reported higher rates of mental health problems, and violence at home compared to males. Conclusions: Increased rates of mental health problems, substance use, and violence in the home necessitate targeted supports that encourage positive coping amidst the additional stresses of COVID-19.",Stephanie Craig et al.,https://share.osf.io/preprint/4619F-B69-698,https://share.osf.io/preprint/4619F-B69-698,2020-09-09,2020-09-19T18:24:13+00:00,PsyArXiv|Social and Behavioral Sciences; PsyArXiv|Social and Behavioral Sciences|Clinical Psychology; PsyArXiv|Social and Behavioral Sciences|Clinical Psychology|Clinical Child Psychology,False
191,Brief online-delivered cognitive-behavioural therapy for dysfunctional worry related to the covid-19 pandemic: A randomised trial,"Objective: To investigate if a brief self-guided, online psychological intervention can reduce the degree of dysfunctional worry related to the covid-19 pandemic. Design: Randomised waiting list controlled trial. Setting: Swedish general population. Participants: Self-referred adults (N=670) reporting daily uncontrollable worry about covid-19 and its possible consequences (e.g. illness, death, the economy, one’s family). Participants had to experience at least one of the following negative consequences of worrying about covid-19: a) difficulties concentrating b) trouble sleeping c) constantly checking the news and social media d) marked loss of work productivity and/or e) difficulties finding joy in everyday situations. Intervention: A brief (3-week) self-guided, online cognitive behavioural intervention targeting dysfunctional worry related to the covid-19 pandemic. Main outcome measure: A covid-19 adapted version of the self-rated Generalised Anxiety Disorder 7-item scale assessed at baseline, week 1, week 2 and week 3 (primary endpoint). Uncontrolled follow-up assessments were conducted one month after treatment completion. Results: The main pre-specified intention-to-treat analysis indicated significant reductions in covid-19-related worry for the intervention group compared to waiting list (B=1.14, Z=9.27, p<.001), corresponding to a medium effect size (bootstrapped d=0.74 [95% CI; 0.58 to 0.90]). Improvements were also seen on all secondary measures, including mood, daily functioning, insomnia and intolerance of uncertainty. Participant satisfaction was high. No serious adverse events were recorded. Conclusions: A brief digital and easily scalable self-guided psychological intervention can significantly reduce dysfunctional worry and associated behavioural symptoms related to the covid-19 pandemic. Trial registration: ClinicalTrials.gov registration ID: NCT04341922, registered on April 10 2020 before inclusion of the first participant.",Tove Wahlund et al.,https://share.osf.io/preprint/460EC-5DF-54B,https://share.osf.io/preprint/460EC-5DF-54B,2020-09-09,2020-09-19T18:12:58+00:00,PsyArXiv|Social and Behavioral Sciences; PsyArXiv|Social and Behavioral Sciences|Clinical Psychology; PsyArXiv|Social and Behavioral Sciences|Clinical Psychology|Anxiety Disorders; digital therapy; internet; dysfunctional worry; cognitive behaviour therapy; covid-19; self-help,False
192,Creative Lockdown? A Daily Diary Study of Creative Activity During Pandemics,"The current COVID-19 pandemic is influencing our lives in an enormous and unprecedented way. Yet while this impact is being intensively studied with regard to a broad range of health, social, and psychological aspects, the effects of COVID-19 for creativity have been overlooked. Here, we explore COVID-19-lockdown’s consequences for creative activity. To this end, we relied on two extensive diary studies. The first, held in March 2019 (pre-pandemic), involved 78 students who reported their emotions and creativity over two weeks (927 observations). The second, conducted in March 2020 (during the pandemic and lockdown), involved 235 students who reported on their emotions, creativity, and the intensity of thinking and talking about COVID-19 over a month (5,904 observations). Multilevel meditations and dynamic structural equation modeling have shown that compared to 2019, during the lockdown, students engaged slightly, yet statistically significantly more in creative activities. Analysis of diaries collected during the pandemic also showed that students who spent more time discussing or searching for information about COVID-19 were not only more engaged in different creative activities but also declared more positive emotions. We propose potential explanations of these unexpected results along with future studies directions.",Maciej Karwowski et al.,https://share.osf.io/preprint/461B2-A4C-698,https://share.osf.io/preprint/461B2-A4C-698,2020-09-19,2020-09-19T17:51:56+00:00,PsyArXiv|Social and Behavioral Sciences; PsyArXiv|Social and Behavioral Sciences|Social and Personality Psychology; PsyArXiv|Social and Behavioral Sciences|Social and Personality Psychology|Personality and Creativity; multilevel modeling; covid-19; creativity; daily diary,False
193,Change in mental health during highly restrictive lockdown in the COVID-19 pandemic: Evidence from Australia,"We surveyed a sample of people from the Australian public about their concerns and mental health (n = 1599) during COVID-19 lock-down. When estimating their mental health for the previous year 13% of participants reported more negative than positive emotion, whereas this increased to 41% when participants reflected on their prior month during COVID-19 lock-down. A substantial proportion (39-54%) of participants reported deterioration in mental health, physical health, financial situation, and work productivity. Less impact was apparent for social relationships as participants compensated for decreased face-to-face interaction via increased technology-mediated interaction. We found evidence to suggest a general increase in compassion for others, as participants reported that due to the pandemic they were feeling more concerned about the welfare of people close to them (87%), and people in general (84%). However, the extent of increased concern for others was also found to be negatively associated with mental health. Most participants reported a generally favourable attitude regarding the government pandemic response. This study reveals that even when the public are largely supportive of the government response to a pandemic there can still be large public health implications due to the overall level of disruption to people's lives.",Shane L. Rogers et al.,https://share.osf.io/preprint/4619E-286-1CB,https://share.osf.io/preprint/4619E-286-1CB,2020-09-11,2020-09-19T04:11:04+00:00,PsyArXiv|Social and Behavioral Sciences; PsyArXiv|Social and Behavioral Sciences|Emotion; PsyArXiv|Social and Behavioral Sciences|Health Psychology; PsyArXiv|Social and Behavioral Sciences|Health Psychology|Mental Health,False
194,Immediate psychological responses during the initial period of the COVID-19 pandemic among Bangladeshi medical students,"Background: The most recent global pandemic of COVID-19 has been creating multidimensional damages, including a detrimental impact on the mental health status of individuals. Medical students, a vulnerable cross-section of the population, may have perceived a myriad of psychological stressors during this crisis in the background of their prevailing stressful academic pressure and preexisting higher psychological and mental health issue. Objective: To determine the prevalence of anxiety and depressive symptoms and to elucidate the psychological impact of COVID-19 pandemic on Bangladeshi medical students. Method: A cross-sectional study design was utilized to conduct this survey. The online survey including demographic questions, COVID-19 related questions, and the Hospital Anxiety and Depression Scale (HADS; higher scores on the subscales indicate higher levels of depressive and anxiety symptoms), was completed by 425 Bangladeshi medical students. Collected data were statistically analyzed by using SPSS (version 25.0) software. Result: The HADS anxiety subscale revealed that 65.9% of the medical students had different levels of anxiety, ranging from mild (27.3%), moderate (26.8%), and severe (11.8%). As per HADS depression subscale, 49.9% of the medical students had varying degrees of depressive symptoms, with 3.3% of the participants had suffered from severely severe depressive symptoms. Female students had a relatively more anxiety and depressive symptoms, when compared with males. The students, who were severely tensed of getting infected by the virus, were at higher risk of suffering from anxiety (3.5-fold) and depressive (2.7-fold) symptoms, when compared with no/minimally stressed students. Besides, fear of getting assaulted or humiliated on the way to hospital or home, not to be able to give maximum concentration on study after COVID-19 pandemic, students’ present emotional status (agitation), had statistically significant higher risk of anxiety. Conclusion: A substantial proportion of Bangladeshi medical students are experiencing pandemic-related adverse psychological impact. The poor mental health conditions of these vulnerable medical students pose important threat to their potential contribution in future health care. Thus, medical colleges and health authorities should focus on addressing their psychological needs and formulate effective strategies to ameliorate medical students’ mental health status, particularly during any infectious disease outbreak.",M Tasdik Hasan et al.,https://share.osf.io/preprint/46218-308-CC2,https://share.osf.io/preprint/46218-308-CC2,2020-09-11,2020-09-19T03:21:30+00:00,PsyArXiv|Psychiatry; PsyArXiv|Social and Behavioral Sciences; PsyArXiv|Social and Behavioral Sciences|Health Psychology; PsyArXiv|Social and Behavioral Sciences|Health Psychology|Mental Health; covid-19; bangladesh; anxiety; depressive symptoms; medical students,False
195,Prevalence and predictors of the early psychological impact of the COVID-19 pandemic compared with SARS and MERS: A systematic literature review and meta-analysis,"Objective: This meta-analysis examines the psychological impact of COVID-19, SARS and MERS pandemics on health-care workers, patients and the general population, in line with PRISMA, MOOSE, MARS and CASP guidelines. Methods: Searches were conducted on 28-29 March 2020 in Pubmed, Medline, PsycInfo, APA articles, Web-of-Knowledge and scholar.google.com. Hedges’ g was calculated with random-effects models. Results: The final selection included 75 publications from 15,984 papers. Twenty-six studies described the impact of COVID-19 in 104,361 participants, showing that 59% (95%CI: 37%-85%) of health-care workers experienced acute/post-traumatic stress, and 37% (95%CI: 30%-54%) experienced depression, general distress, insomnia and/or anxiety. Of all COVID-19 patients, 32% (95% CI: 22%-42%) experienced acute/post-traumatic stress disorder, anxiety, depression, insomnia and/or distress. In the general population, 25% (95%CI: 15%-35%) experienced any of these psychological symptoms. COVID-19 had a larger impact than SARS/MERS in 28,499 participants in 44 studies. During SARS/MERS pandemics, 33% (95%CI: 25%-41%) of health-care workers, 31% (95%CI: 18%-45%) of SARS/MERS-patients and 15% (95%CI: 7%-23%) of the general population experienced any of these psychological symptoms. The psychological impact was predicted (R<.20-.40>) by the individual’s physical health, restrictions to leisure and social activities, and quarantine. Frontline health-care workers experienced a larger psychological impact than the general population, particularly if they worked with infected patients and reported unfavourable work circumstances. Conclusions: This study can be used to predict the prevalence of mental health problems during and after the COVID-19 pandemic, and to predict which individuals are most at risk of developing mental health problems. Health care workers and vulnerable individuals should be psychologically screened and offered mental health-care. Quarantine should be as short as possible, to prevent mental health problems. Public health significance statement This meta-analysis indicates that between one-third of the general population and half of all health care workers experience a moderate to severe mental health impact of the COVID-19 pandemic. This impact is larger than during SARS and MERS pandemics. The psychological impact on health care workers is mainly predicted by their work circumstances, and the impact on the general population by their pre-existing physical and mental well-being and the psychological effects of quarantine.",Joel Vos,https://share.osf.io/preprint/460E5-5B8-55D,https://share.osf.io/preprint/460E5-5B8-55D,2020-09-11,2020-09-19T03:21:03+00:00,PsyArXiv|Psychiatry; PsyArXiv|Social and Behavioral Sciences; PsyArXiv|Social and Behavioral Sciences|Clinical Psychology; PsyArXiv|Social and Behavioral Sciences|Clinical Psychology|Anxiety Disorders; PsyArXiv|Social and Behavioral Sciences|Clinical Psychology|Depressive Disorders; PsyArXiv|Social and Behavioral Sciences|Clinical Psychology|Mental Disorders; PsyArXiv|Social and Behavioral Sciences|Clinical Psychology|Trauma and Stress; PsyArXiv|Social and Behavioral Sciences|Health Psychology; PsyArXiv|Social and Behavioral Sciences|Health Psychology|Illness; PsyArXiv|Social and Behavioral Sciences|Health Psychology|Mental Health; PsyArXiv|Social and Behavioral Sciences|Health Psychology|Stress; PsyArXiv|Social and Behavioral Sciences|Quantitative Methods; review; covid-19; impact; effects; causes; emotional; frontline; acute stress; quarantine; psychology; meta-analysis; anxiety; sars; insomnia; psychiatry; depression; political; health care worker; mers,False
